number,value,datetime_start,datetime_complete,duration,params_D2_nm,params_D3_nm,params_D4_nm,params_metal,state
2317,0.0,2026-04-26 15:33:39.249684,2026-04-26 15:33:40.013777,0 days 00:00:00.764093,52.39518865990456,18.665719289364173,1.4449085844321945,Au,PRUNED
2318,0.0,2026-04-26 15:33:39.371927,2026-04-26 15:33:40.130332,0 days 00:00:00.758405,32.270924232089556,19.882195010326843,1.3929563274136898,Au,PRUNED
2319,0.0,2026-04-26 15:33:39.438290,2026-04-26 15:33:40.128192,0 days 00:00:00.689902,22.13100394643952,16.688761479665146,1.6651017432403357,Au,PRUNED
2320,0.0,2026-04-26 15:33:39.463979,2026-04-26 15:33:40.080863,0 days 00:00:00.616884,36.4489173631452,19.900188904766864,1.7357643231524345,Au,PRUNED
2321,141.75824175823726,2026-04-26 15:33:39.821394,2026-04-26 15:33:40.581921,0 days 00:00:00.760527,32.22224907261055,17.01980340938861,1.7666447510594634,Au,PRUNED
2322,0.0,2026-04-26 15:33:39.850772,2026-04-26 15:33:40.666528,0 days 00:00:00.815756,21.322571849257834,16.821339739535727,1.6499092175862835,Au,PRUNED
2323,-584.0846047156012,2026-04-26 15:33:39.954309,2026-04-26 15:33:40.694118,0 days 00:00:00.739809,21.427934923754766,19.81245650156894,1.5526965912580284,Au,COMPLETE
2324,0.0,2026-04-26 15:33:40.059335,2026-04-26 15:33:40.829959,0 days 00:00:00.770624,48.40756901376919,17.44537345520332,1.7378488230314266,Au,PRUNED
2325,0.0,2026-04-26 15:33:40.175409,2026-04-26 15:33:41.133565,0 days 00:00:00.958156,20.284710429058485,19.79881022282112,1.4440443469025834,Au,PRUNED
2326,0.0,2026-04-26 15:33:40.223524,2026-04-26 15:33:40.788163,0 days 00:00:00.564639,28.141394381588,19.989717133579532,1.5347942261895475,Au,PRUNED
2327,0.0,2026-04-26 15:33:40.241760,2026-04-26 15:33:41.290710,0 days 00:00:01.048950,20.85568509403622,15.933705219429303,1.4392417586483637,Au,PRUNED
2328,0.0,2026-04-26 15:33:40.282744,2026-04-26 15:33:40.789170,0 days 00:00:00.506426,34.68218963805297,17.46258667621111,1.6499479221932112,Au,PRUNED
2329,-3.7593984962402023,2026-04-26 15:33:40.699473,2026-04-26 15:33:41.400944,0 days 00:00:00.701471,28.117478354382527,16.567439344119247,1.4857186311071062,Au,PRUNED
2330,0.0,2026-04-26 15:33:40.756754,2026-04-26 15:33:41.368374,0 days 00:00:00.611620,38.09597470374058,18.05516873678006,1.47919694534232,Au,PRUNED
2331,0.0,2026-04-26 15:33:40.905562,2026-04-26 15:33:41.603770,0 days 00:00:00.698208,47.28521793522762,19.730011681516668,1.4072063606322927,Au,PRUNED
2332,0.0,2026-04-26 15:33:40.935185,2026-04-26 15:33:41.680774,0 days 00:00:00.745589,20.521013940260318,15.921261883800264,1.4700214494784232,Au,PRUNED
2333,0.0,2026-04-26 15:33:40.990082,2026-04-26 15:33:41.695656,0 days 00:00:00.705574,20.669637524517036,15.184580753573771,1.3179255084330495,Cu,PRUNED
2334,7.518796992480405,2026-04-26 15:33:41.013408,2026-04-26 15:33:41.590189,0 days 00:00:00.576781,32.118331630671776,16.340138142369305,1.4191356222605913,Au,PRUNED
2335,0.0,2026-04-26 15:33:41.268261,2026-04-26 15:33:41.916165,0 days 00:00:00.647904,40.96824614077843,17.137415751526238,1.325314748421344,Au,PRUNED
2336,0.0,2026-04-26 15:33:41.386220,2026-04-26 15:33:42.150134,0 days 00:00:00.763914,21.116689664905213,16.663271837245496,1.3763944856679629,Au,PRUNED
2337,0.0,2026-04-26 15:33:41.494640,2026-04-26 15:33:42.183782,0 days 00:00:00.689142,35.00810433977746,19.84981625649248,1.333632402788635,Au,PRUNED
2338,0.0,2026-04-26 15:33:41.533297,2026-04-26 15:33:42.183782,0 days 00:00:00.650485,39.945543797962,19.697522675017034,1.3643417693354578,Au,PRUNED
2339,0.0,2026-04-26 15:33:41.672663,2026-04-26 15:33:42.429575,0 days 00:00:00.756912,33.025943583088065,17.54688017393971,1.4633695318872313,Au,PRUNED
2340,0.0,2026-04-26 15:33:41.754363,2026-04-26 15:33:42.757757,0 days 00:00:01.003394,21.649509727148722,17.19943914328444,1.4954808370668387,Au,PRUNED
2341,-8.403361344536819,2026-04-26 15:33:41.809172,2026-04-26 15:33:42.456285,0 days 00:00:00.647113,21.117802238269412,19.964332376757923,1.7589945679656056,Au,PRUNED
2342,0.0,2026-04-26 15:33:41.823887,2026-04-26 15:33:42.790775,0 days 00:00:00.966888,20.716865970885614,17.32710214934833,1.5712719584808046,Au,PRUNED
2343,-576.0534429598475,2026-04-26 15:33:42.033008,2026-04-26 15:33:42.883443,0 days 00:00:00.850435,21.165582553372467,19.987906816354368,1.47504135434472,Au,COMPLETE
2344,0.0,2026-04-26 15:33:42.258448,2026-04-26 15:33:42.991774,0 days 00:00:00.733326,20.23111840044512,19.80825143646294,1.6404180447911405,Au,PRUNED
2345,0.0,2026-04-26 15:33:42.275444,2026-04-26 15:33:42.949381,0 days 00:00:00.673937,20.441720426960188,19.775714584086035,1.6325112922351066,Au,PRUNED
2346,0.0,2026-04-26 15:33:42.298176,2026-04-26 15:33:43.091549,0 days 00:00:00.793373,20.13718266773811,18.21248202324178,1.4492763391717312,Au,PRUNED
2347,0.0,2026-04-26 15:33:42.536077,2026-04-26 15:33:43.741569,0 days 00:00:01.205492,36.442891314478665,19.820410009408352,1.4542129210989772,Au,PRUNED
2348,0.0,2026-04-26 15:33:42.522799,2026-04-26 15:33:43.549965,0 days 00:00:01.027166,28.755502633758493,19.82514250604735,1.5881638795939064,Au,PRUNED
2349,0.0,2026-04-26 15:33:42.966656,2026-04-26 15:33:43.499721,0 days 00:00:00.533065,33.583685749326925,17.881605054689516,1.2226308602572415,Au,PRUNED
2350,0.0,2026-04-26 15:33:43.024010,2026-04-26 15:33:43.769296,0 days 00:00:00.745286,32.824256961332644,19.46603265615554,1.2598910989430356,Au,PRUNED
2351,146.1538461538415,2026-04-26 15:33:43.043087,2026-04-26 15:33:43.614783,0 days 00:00:00.571696,26.432250368256152,19.932765750569132,1.4065277447692281,Au,PRUNED
2352,0.0,2026-04-26 15:33:43.057105,2026-04-26 15:33:43.741569,0 days 00:00:00.684464,37.026643163853635,17.34498584176304,1.317223287282799,Au,PRUNED
2353,-15.873015873014094,2026-04-26 15:33:43.103842,2026-04-26 15:33:43.960845,0 days 00:00:00.857003,89.51917199638768,12.042988722838606,0.37937752300893657,Ag,PRUNED
2354,0.0,2026-04-26 15:33:43.259070,2026-04-26 15:33:43.972297,0 days 00:00:00.713227,31.432797966440326,19.580704940770417,1.3930507511744503,Au,PRUNED
2355,0.0,2026-04-26 15:33:43.637313,2026-04-26 15:33:44.485523,0 days 00:00:00.848210,34.75871078857495,19.44688790733512,1.3226363897549132,Au,PRUNED
2356,0.0,2026-04-26 15:33:43.669530,2026-04-26 15:33:44.812687,0 days 00:00:01.143157,43.42211076859529,19.962590016758732,1.2363505828937513,Au,PRUNED
2357,0.0,2026-04-26 15:33:43.788918,2026-04-26 15:33:44.595518,0 days 00:00:00.806600,34.7549398917752,13.979010784859643,1.437897144317701,Au,PRUNED
2358,0.0,2026-04-26 15:33:43.835464,2026-04-26 15:33:44.959932,0 days 00:00:01.124468,49.268583941258015,19.794606391979716,1.5289482887674648,Au,PRUNED
2359,0.0,2026-04-26 15:33:44.022617,2026-04-26 15:33:44.658500,0 days 00:00:00.635883,21.463329252863893,17.400176079019854,1.3940574841105708,Au,PRUNED
2360,0.0,2026-04-26 15:33:44.037012,2026-04-26 15:33:44.547872,0 days 00:00:00.510860,20.241513509346905,19.952427570424454,1.4581658279616518,Au,PRUNED
2361,3.9682539682535234,2026-04-26 15:33:44.057617,2026-04-26 15:33:44.882831,0 days 00:00:00.825214,27.32305178364481,17.65132459504933,1.4630872585948522,Au,PRUNED
2362,2.5510204081630805,2026-04-26 15:33:44.133572,2026-04-26 15:33:44.758269,0 days 00:00:00.624697,40.33951033698335,17.444827971061382,1.4262571093495797,Cu,PRUNED
2363,142.8571428571383,2026-04-26 15:33:44.735928,2026-04-26 15:33:45.480480,0 days 00:00:00.744552,30.373998843146005,18.26894201113064,1.448671483425834,Au,PRUNED
2364,0.0,2026-04-26 15:33:44.791443,2026-04-26 15:33:45.617174,0 days 00:00:00.825731,28.7389148664821,19.832319347597632,1.3693094103652237,Au,PRUNED
2365,143.9560439560394,2026-04-26 15:33:44.837168,2026-04-26 15:33:45.479116,0 days 00:00:00.641948,29.945989792017613,17.598143106464104,1.5174704537014327,Au,PRUNED
2366,0.0,2026-04-26 15:33:44.853331,2026-04-26 15:33:45.399436,0 days 00:00:00.546105,20.277265066132134,16.985787961086043,1.3663963996140738,Au,PRUNED
2367,0.0,2026-04-26 15:33:44.895007,2026-04-26 15:33:45.572720,0 days 00:00:00.677713,20.063355120087266,17.81797598842993,1.5100421703768903,Au,PRUNED
2368,0.0,2026-04-26 15:33:44.897821,2026-04-26 15:33:45.716126,0 days 00:00:00.818305,33.872248506738764,19.98115295663601,1.6372997591093883,Au,PRUNED
2369,0.0,2026-04-26 15:33:44.931399,2026-04-26 15:33:45.572720,0 days 00:00:00.641321,27.8300051758871,19.97455718935795,1.5005354466205545,Au,PRUNED
2370,0.0,2026-04-26 15:33:45.047470,2026-04-26 15:33:45.619200,0 days 00:00:00.571730,20.159289118904198,19.498074838191155,1.4680894698151552,Au,PRUNED
2371,0.0,2026-04-26 15:33:45.544598,2026-04-26 15:33:46.116915,0 days 00:00:00.572317,20.511619509312865,18.005532710620606,1.6376718170303421,Au,PRUNED
2372,-8.928571428570304,2026-04-26 15:33:45.583432,2026-04-26 15:33:46.276432,0 days 00:00:00.693000,22.028769546780104,19.8952631661007,1.5632944032579252,Au,PRUNED
2373,4.2016806722684095,2026-04-26 15:33:45.670403,2026-04-26 15:33:46.606923,0 days 00:00:00.936520,24.490162453732903,19.92908839595,1.5094800684564649,Au,PRUNED
2374,0.0,2026-04-26 15:33:45.731302,2026-04-26 15:33:46.509260,0 days 00:00:00.777958,24.120910552125494,19.992651834717684,1.422986761929701,Au,PRUNED
2375,0.0,2026-04-26 15:33:45.760630,2026-04-26 15:33:46.510689,0 days 00:00:00.750059,25.050930746925992,19.972593616529377,0.6427307052801672,Au,PRUNED
2376,-558.6080586079933,2026-04-26 15:33:45.775100,2026-04-26 15:33:46.384061,0 days 00:00:00.608961,20.989891792891093,19.732005952396214,1.6983507106143003,Au,COMPLETE
2377,0.0,2026-04-26 15:33:45.808989,2026-04-26 15:33:46.509260,0 days 00:00:00.700271,29.240054243625867,19.890553026448618,1.5591442069258776,Au,PRUNED
2378,0.0,2026-04-26 15:33:45.875413,2026-04-26 15:33:46.575177,0 days 00:00:00.699764,20.49505858852249,19.12159515715193,1.6380166060219272,Au,PRUNED
2379,-8.658008658008125,2026-04-26 15:33:46.289826,2026-04-26 15:33:47.021168,0 days 00:00:00.731342,24.22106474333746,16.90586932590796,1.7397975086685018,Cu,PRUNED
2380,0.0,2026-04-26 15:33:46.356162,2026-04-26 15:33:47.560908,0 days 00:00:01.204746,21.204820171980977,17.497592779623925,1.3567937841547835,Au,PRUNED
2381,0.0,2026-04-26 15:33:46.620399,2026-04-26 15:33:47.333571,0 days 00:00:00.713172,50.51362631722673,19.958876319513227,1.5909812809828192,Au,PRUNED
2382,-1.0660980810234213,2026-04-26 15:33:46.635320,2026-04-26 15:33:47.274309,0 days 00:00:00.638989,20.285785829848987,18.104022408191977,1.4343934316122422,Ag,PRUNED
2383,0.0,2026-04-26 15:33:46.608412,2026-04-26 15:33:47.232505,0 days 00:00:00.624093,21.868093298410848,13.392239395621068,1.303585260323095,Au,PRUNED
2384,147.25274725274258,2026-04-26 15:33:46.665365,2026-04-26 15:33:47.335076,0 days 00:00:00.669711,25.935699582863233,19.965915396907164,1.3710581288254255,Au,PRUNED
2385,0.0,2026-04-26 15:33:46.698387,2026-04-26 15:33:47.289753,0 days 00:00:00.591366,30.58298317766159,19.91464123829631,1.4724817469509608,Au,PRUNED
2386,-6.493506493505897,2026-04-26 15:33:46.680419,2026-04-26 15:33:47.192849,0 days 00:00:00.512430,67.63785032637621,19.144442078978717,0.24686274577012368,Ag,PRUNED
2387,0.0,2026-04-26 15:33:47.153276,2026-04-26 15:33:48.020622,0 days 00:00:00.867346,21.013401349871604,17.130081184957326,1.4840700525906265,Au,PRUNED
2388,0.0,2026-04-26 15:33:47.301476,2026-04-26 15:33:48.047540,0 days 00:00:00.746064,36.93457564209078,19.91565898418728,1.5118027150930105,Au,PRUNED
2389,0.0,2026-04-26 15:33:47.303971,2026-04-26 15:33:48.044539,0 days 00:00:00.740568,46.00901121672606,16.482991324483102,1.3791033332088354,Au,PRUNED
2390,0.0,2026-04-26 15:33:47.352340,2026-04-26 15:33:47.965827,0 days 00:00:00.613487,33.07543163407172,17.464830339080905,1.4008426587002234,Au,PRUNED
2391,7.518796992480405,2026-04-26 15:33:47.429328,2026-04-26 15:33:47.989734,0 days 00:00:00.560406,30.22189948296641,17.042950755043943,1.4438082751636436,Au,PRUNED
2392,-1.7421602787456147,2026-04-26 15:33:47.462717,2026-04-26 15:33:48.047540,0 days 00:00:00.584823,108.13652856409107,5.662542736674204,1.0045310397083995,Cu,PRUNED
2393,3.7593984962402023,2026-04-26 15:33:47.476756,2026-04-26 15:33:48.190726,0 days 00:00:00.713970,33.68152220905241,14.54496487410518,1.6499730081068669,Au,PRUNED
2394,0.0,2026-04-26 15:33:47.681669,2026-04-26 15:33:48.454442,0 days 00:00:00.772773,31.275827910914636,19.885086024364263,1.4854428051919681,Au,PRUNED
2395,-4.6082949308752745,2026-04-26 15:33:48.084223,2026-04-26 15:33:48.799517,0 days 00:00:00.715294,25.930338663049312,3.8108170298875352,0.5942924896760378,Cu,PRUNED
2396,0.0,2026-04-26 15:33:48.100783,2026-04-26 15:33:48.800022,0 days 00:00:00.699239,20.10777109280146,17.238693662081648,1.4041849403860163,Au,PRUNED
2397,0.0,2026-04-26 15:33:48.141503,2026-04-26 15:33:48.693226,0 days 00:00:00.551723,36.820421750683686,17.064277169134286,1.457920533790127,Au,PRUNED
2398,0.0,2026-04-26 15:33:48.144142,2026-04-26 15:33:48.879016,0 days 00:00:00.734874,35.029085958803826,17.983784055743772,1.5908197410415208,Au,PRUNED
2399,0.0,2026-04-26 15:33:48.195845,2026-04-26 15:33:48.802600,0 days 00:00:00.606755,34.67887687598508,17.775196297179708,1.711306852197982,Au,PRUNED
2400,0.0,2026-04-26 15:33:48.263842,2026-04-26 15:33:48.928280,0 days 00:00:00.664438,20.372819754928347,17.924883412336087,1.4392942645420916,Au,PRUNED
2401,0.0,2026-04-26 15:33:48.374191,2026-04-26 15:33:49.322113,0 days 00:00:00.947922,20.129705055329183,17.247864805945802,1.3480258335633053,Au,PRUNED
2402,8.403361344536819,2026-04-26 15:33:48.521745,2026-04-26 15:33:49.322113,0 days 00:00:00.800368,25.290159842116687,19.985866157052012,1.2424084739956291,Au,PRUNED
2403,-573.4742584383897,2026-04-26 15:33:48.772278,2026-04-26 15:33:49.833814,0 days 00:00:01.061536,21.160789390179744,19.740227571437643,1.7211657222774144,Au,COMPLETE
2404,-11.278195488720607,2026-04-26 15:33:48.908450,2026-04-26 15:33:49.619372,0 days 00:00:00.710922,30.91210633985314,15.18909215149343,0.6451879245917043,Au,PRUNED
2405,0.0,2026-04-26 15:33:48.946029,2026-04-26 15:33:49.646995,0 days 00:00:00.700966,37.382035923189335,19.866539478788855,1.3488767754692135,Au,PRUNED
2406,-12.605042016805228,2026-04-26 15:33:48.992198,2026-04-26 15:33:49.699756,0 days 00:00:00.707558,21.81085540231873,19.92033738419749,1.2839448970206688,Au,PRUNED
2407,0.0,2026-04-26 15:33:48.961286,2026-04-26 15:33:49.601105,0 days 00:00:00.639819,36.51988408330427,17.063948229552288,0.8099227545154892,Au,PRUNED
2408,-0.5903187721369436,2026-04-26 15:33:49.089938,2026-04-26 15:33:49.699756,0 days 00:00:00.609818,115.33921859915708,17.34997700746878,0.6919917269302877,Au,PRUNED
2409,0.0,2026-04-26 15:33:49.531456,2026-04-26 15:33:50.202895,0 days 00:00:00.671439,21.362200375298293,17.071750562614028,1.7097919144556641,Au,PRUNED
2410,0.0,2026-04-26 15:33:49.567404,2026-04-26 15:33:50.249734,0 days 00:00:00.682330,32.71809266744623,19.671000416169576,1.7105988722045058,Au,PRUNED
2411,0.0,2026-04-26 15:33:49.717165,2026-04-26 15:33:50.518237,0 days 00:00:00.801072,20.344411696332237,19.27687311097572,1.7052099030434589,Au,PRUNED
2412,147.25274725274258,2026-04-26 15:33:49.753351,2026-04-26 15:33:50.180202,0 days 00:00:00.426851,25.068165973660488,19.96275718683598,1.7046567898770453,Au,PRUNED
2413,4.2016806722684095,2026-04-26 15:33:49.771365,2026-04-26 15:33:50.425222,0 days 00:00:00.653857,24.160640394162375,19.777835374136064,1.737232236421981,Au,PRUNED
2414,-526.706700379208,2026-04-26 15:33:49.804470,2026-04-26 15:33:50.341896,0 days 00:00:00.537426,20.59474661756089,19.58923117970848,1.777097144186987,Au,COMPLETE
2415,0.0,2026-04-26 15:33:49.904451,2026-04-26 15:33:50.499632,0 days 00:00:00.595181,33.08194117673686,18.352142210296577,1.7638782628615157,Au,PRUNED
2416,147.25274725274258,2026-04-26 15:33:50.051543,2026-04-26 15:33:50.700078,0 days 00:00:00.648535,25.42536481215548,19.955527027732312,1.6759023780516835,Au,PRUNED
2417,0.0,2026-04-26 15:33:50.285914,2026-04-26 15:33:50.997511,0 days 00:00:00.711597,33.57804184769661,17.114719224086063,1.7913577967711005,Au,PRUNED
2418,0.0,2026-04-26 15:33:50.362728,2026-04-26 15:33:51.180188,0 days 00:00:00.817460,21.11601380760938,17.37769407065508,1.6522104367639112,Au,PRUNED
2419,-20.40816326530027,2026-04-26 15:33:50.343503,2026-04-26 15:33:51.386625,0 days 00:00:01.043122,77.0663637361798,5.205586806098358,1.2423108008565449,Ag,PRUNED
2420,-1.0660980810234213,2026-04-26 15:33:50.548425,2026-04-26 15:33:51.464536,0 days 00:00:00.916111,20.95560878647903,18.879937289968517,1.5248531902278297,Ag,PRUNED
2421,0.0,2026-04-26 15:33:50.601080,2026-04-26 15:33:51.088245,0 days 00:00:00.487165,32.60732398383389,17.784481381999232,1.6766889852021056,Au,PRUNED
2422,-9.523809523808879,2026-04-26 15:33:50.626523,2026-04-26 15:33:51.293109,0 days 00:00:00.666586,23.96200829787656,19.80209218195864,1.5259064513820648,Ag,PRUNED
2423,-23.809523809520613,2026-04-26 15:33:50.672263,2026-04-26 15:33:51.291817,0 days 00:00:00.619554,37.3029362701121,18.540517032686697,1.741542236291672,Ag,PRUNED
2424,140.65934065933618,2026-04-26 15:33:50.751601,2026-04-26 15:33:51.654054,0 days 00:00:00.902453,33.103573224223766,16.937677623905813,1.6929741849342166,Au,PRUNED
2425,0.0,2026-04-26 15:33:51.107514,2026-04-26 15:33:51.774415,0 days 00:00:00.666901,34.21207378247846,18.625755076872284,1.712306582982327,Au,PRUNED
2426,0.0,2026-04-26 15:33:51.220529,2026-04-26 15:33:51.950914,0 days 00:00:00.730385,20.394688489381327,17.065221816180635,1.8715033827150127,Au,PRUNED
2427,0.0,2026-04-26 15:33:51.338272,2026-04-26 15:33:52.142808,0 days 00:00:00.804536,21.067824866759523,17.09847303110141,1.6760704144129084,Au,PRUNED
2428,-8.928571428570304,2026-04-26 15:33:51.362433,2026-04-26 15:33:52.141743,0 days 00:00:00.779310,22.02778763438177,19.87657314100842,1.7053856287764084,Au,PRUNED
2429,143.9560439560394,2026-04-26 15:33:51.388127,2026-04-26 15:33:52.278251,0 days 00:00:00.890124,29.32933460599583,18.059567254015718,1.7323520568756114,Au,PRUNED
2430,-8.928571428570304,2026-04-26 15:33:51.480553,2026-04-26 15:33:52.319450,0 days 00:00:00.838897,22.222923775484336,19.941454751559462,1.2456443865760995,Au,PRUNED
2431,0.0,2026-04-26 15:33:51.618483,2026-04-26 15:33:52.543736,0 days 00:00:00.925253,20.25044937357183,19.050267628550614,1.6886249798323492,Au,PRUNED
2432,0.0,2026-04-26 15:33:51.722478,2026-04-26 15:33:52.607418,0 days 00:00:00.884940,20.302027573425264,16.505159494039336,1.8471880169842099,Au,PRUNED
2433,-575.5297334244013,2026-04-26 15:33:51.979043,2026-04-26 15:33:52.764935,0 days 00:00:00.785892,21.30977262306861,19.616047862606006,1.7857154598922798,Au,COMPLETE
2434,-284.95642288743835,2026-04-26 15:33:52.064802,2026-04-26 15:33:52.924189,0 days 00:00:00.859387,22.327811481200754,19.77666089225114,1.9880859559797712,Ag,COMPLETE
2435,0.0,2026-04-26 15:33:52.220557,2026-04-26 15:33:52.998334,0 days 00:00:00.777777,47.66587778915411,14.987087972161525,1.5613305846160255,Au,PRUNED
2436,140.65934065933618,2026-04-26 15:33:52.298097,2026-04-26 15:33:52.926786,0 days 00:00:00.628689,32.53497778971989,19.902045474856187,1.5772271383703154,Cu,PRUNED
2437,0.0,2026-04-26 15:33:52.376134,2026-04-26 15:33:52.999334,0 days 00:00:00.623200,45.2660099361901,15.796784210209536,1.5929299991209696,Au,PRUNED
2438,0.0,2026-04-26 15:33:52.579172,2026-04-26 15:33:53.209666,0 days 00:00:00.630494,20.376529608859062,18.6250381629308,1.454278794999078,Au,PRUNED
2439,0.0,2026-04-26 15:33:52.649068,2026-04-26 15:33:53.306963,0 days 00:00:00.657895,35.93388959536383,19.854830025776362,1.7847713001169119,Au,PRUNED
2440,0.0,2026-04-26 15:33:52.667201,2026-04-26 15:33:53.378052,0 days 00:00:00.710851,21.263294173283654,17.403341260087085,1.6773277141270937,Au,PRUNED
2441,0.0,2026-04-26 15:33:53.010846,2026-04-26 15:33:53.791641,0 days 00:00:00.780795,40.6832560183129,19.82011815360461,1.7669581435090482,Au,PRUNED
2442,0.0,2026-04-26 15:33:53.046191,2026-04-26 15:33:54.185958,0 days 00:00:01.139767,20.066541457532136,19.871372718955794,1.4356538940623325,Au,PRUNED
2443,0.0,2026-04-26 15:33:53.086051,2026-04-26 15:33:53.900811,0 days 00:00:00.814760,20.02946909730621,17.984158289260648,1.5350094562223844,Au,PRUNED
2444,0.0,2026-04-26 15:33:53.137586,2026-04-26 15:33:53.758187,0 days 00:00:00.620601,39.765559688477,19.91189113651787,1.812808418136228,Au,PRUNED
2445,0.0,2026-04-26 15:33:53.246918,2026-04-26 15:33:54.088901,0 days 00:00:00.841983,20.741282838620318,16.325939056339596,1.669497453690456,Cu,PRUNED
2446,-6.696428571428148,2026-04-26 15:33:53.283191,2026-04-26 15:33:54.062308,0 days 00:00:00.779117,24.207937717531305,16.897441728369127,1.5797427147172864,Cu,PRUNED
2447,-4.761904761904122,2026-04-26 15:33:53.379558,2026-04-26 15:33:54.219692,0 days 00:00:00.840134,22.946444797283387,19.945976065274785,1.4650587824296335,Au,PRUNED
2448,0.0,2026-04-26 15:33:53.454046,2026-04-26 15:33:54.145384,0 days 00:00:00.691338,33.22565429474598,19.856078050863665,1.738625130559698,Au,PRUNED
2449,142.8571428571383,2026-04-26 15:33:53.903666,2026-04-26 15:33:54.636528,0 days 00:00:00.732862,32.2549111043118,16.388146794744454,1.7444756701320459,Au,PRUNED
2450,0.0,2026-04-26 15:33:54.003690,2026-04-26 15:33:54.875448,0 days 00:00:00.871758,20.119484154421514,19.88695546585463,1.7836718510513871,Au,PRUNED
2451,0.0,2026-04-26 15:33:54.029993,2026-04-26 15:33:54.876460,0 days 00:00:00.846467,32.899672187006225,19.999689238953774,1.6032424193609447,Au,PRUNED
2452,0.0,2026-04-26 15:33:54.155528,2026-04-26 15:33:54.875953,0 days 00:00:00.720425,21.099075149047167,17.733868764016478,1.7261242398535965,Au,PRUNED
2453,0.0,2026-04-26 15:33:54.222134,2026-04-26 15:33:54.806508,0 days 00:00:00.584374,44.853669343557044,17.794085497262927,1.544583199109434,Au,PRUNED
2454,0.0,2026-04-26 15:33:54.195201,2026-04-26 15:33:55.010246,0 days 00:00:00.815045,20.13418853314102,17.373412014181316,1.694955372399411,Au,PRUNED
2455,0.0,2026-04-26 15:33:54.277168,2026-04-26 15:33:55.270567,0 days 00:00:00.993399,34.23847174991264,17.423243168757626,1.7465278107796869,Au,PRUNED
