number,value,datetime_start,datetime_complete,duration,params_D2_nm,params_D3_nm,params_D4_nm,params_metal,state
793,0.0,2026-04-26 15:30:59.175228,2026-04-26 15:30:59.683490,0 days 00:00:00.508262,20.7473651062309,19.2808723877394,1.0930069396931112,Au,PRUNED
794,0.0,2026-04-26 15:30:59.313114,2026-04-26 15:31:00.058772,0 days 00:00:00.745658,37.083703884986114,15.844835513030242,1.983320506983788,Au,PRUNED
795,0.0,2026-04-26 15:30:59.390642,2026-04-26 15:30:59.964209,0 days 00:00:00.573567,42.70199210006898,17.569081900795517,1.6610207004940922,Au,PRUNED
796,0.0,2026-04-26 15:30:59.422315,2026-04-26 15:30:59.810852,0 days 00:00:00.388537,46.1608822451097,17.61684352475185,1.6481043135347964,Au,PRUNED
797,0.0,2026-04-26 15:30:59.438065,2026-04-26 15:31:00.122192,0 days 00:00:00.684127,20.763476493653755,18.72331785548058,1.437196870044687,Au,PRUNED
798,0.0,2026-04-26 15:30:59.450826,2026-04-26 15:31:00.248460,0 days 00:00:00.797634,21.09625688262556,19.490632372592607,1.1326511696323762,Au,PRUNED
799,0.0,2026-04-26 15:30:59.472261,2026-04-26 15:30:59.885231,0 days 00:00:00.412970,20.919316500588153,16.60686211927301,1.2431368452712308,Au,PRUNED
800,3.9682539682535234,2026-04-26 15:30:59.483143,2026-04-26 15:31:00.010501,0 days 00:00:00.527358,26.66036093386249,19.867695702626655,1.9906756319106165,Cu,PRUNED
801,0.0,2026-04-26 15:30:59.809852,2026-04-26 15:31:00.621877,0 days 00:00:00.812025,20.90344117031082,19.254250754820568,1.2967086570579318,Au,PRUNED
802,0.0,2026-04-26 15:30:59.985769,2026-04-26 15:31:00.512199,0 days 00:00:00.526430,20.457596965237602,16.451476496093544,1.9154478309632876,Au,PRUNED
803,0.0,2026-04-26 15:31:00.026532,2026-04-26 15:31:00.697548,0 days 00:00:00.671016,35.60039780462707,13.187240233494872,1.9974684579004567,Au,PRUNED
804,-272.025272025255,2026-04-26 15:30:59.916573,2026-04-26 15:31:00.481986,0 days 00:00:00.565413,24.547564053427166,13.880676992564554,1.9922994176374893,Au,COMPLETE
805,145.05494505494045,2026-04-26 15:31:00.091970,2026-04-26 15:31:00.760371,0 days 00:00:00.668401,27.316356990349874,19.732730838655485,1.422669081241807,Au,PRUNED
806,3.571428571428211,2026-04-26 15:31:00.200456,2026-04-26 15:31:00.697548,0 days 00:00:00.497092,31.50520199474602,16.07700438845017,1.7299458087923596,Au,PRUNED
807,-3.7593984962402023,2026-04-26 15:31:00.214105,2026-04-26 15:31:00.635111,0 days 00:00:00.421006,29.654058330610546,14.731559428694611,1.980192419540813,Au,PRUNED
808,-2.1321961620468426,2026-04-26 15:31:00.275980,2026-04-26 15:31:01.366978,0 days 00:00:01.090998,20.86278822035538,19.5642201551319,1.4096444453986952,Ag,PRUNED
809,-6.122448979591482,2026-04-26 15:31:00.586090,2026-04-26 15:31:01.278322,0 days 00:00:00.692232,28.296744167841386,9.648068914158866,1.8403684766553168,Au,PRUNED
810,-1.0660980810234213,2026-04-26 15:31:00.668861,2026-04-26 15:31:01.352471,0 days 00:00:00.683610,21.736531120241985,18.145718958706365,1.986343143631054,Ag,PRUNED
811,0.0,2026-04-26 15:31:00.731600,2026-04-26 15:31:01.278322,0 days 00:00:00.546722,38.30504919071916,19.747840928129804,1.5399312505071396,Au,PRUNED
812,0.0,2026-04-26 15:31:00.778652,2026-04-26 15:31:01.280755,0 days 00:00:00.502103,20.249770618166284,8.845152566995344,1.837076734459434,Au,PRUNED
813,-8.403361344537313,2026-04-26 15:31:00.793717,2026-04-26 15:31:01.321219,0 days 00:00:00.527502,27.679347115280326,11.748726476303586,1.9841424148599824,Au,PRUNED
814,0.0,2026-04-26 15:31:00.809251,2026-04-26 15:31:01.279756,0 days 00:00:00.470505,20.955314345848326,17.754814897866602,1.8685015046764606,Au,PRUNED
815,0.0,2026-04-26 15:31:00.847355,2026-04-26 15:31:01.369498,0 days 00:00:00.522143,21.52528734051933,15.085111214205623,1.6937615631722704,Au,PRUNED
816,-3.571428571428211,2026-04-26 15:31:01.313553,2026-04-26 15:31:01.924446,0 days 00:00:00.610893,31.409181830185773,14.266874750098776,1.9700997478975568,Au,PRUNED
817,-303.1682792638762,2026-04-26 15:31:01.289678,2026-04-26 15:31:02.228157,0 days 00:00:00.938479,23.73299843171979,15.416118516006366,1.9629218150662866,Au,COMPLETE
818,0.0,2026-04-26 15:31:01.526629,2026-04-26 15:31:02.116545,0 days 00:00:00.589916,20.047906942641433,13.480286979255444,1.9960960472159,Au,PRUNED
819,0.0,2026-04-26 15:31:01.547520,2026-04-26 15:31:02.375810,0 days 00:00:00.828290,43.13310865616032,15.888776800204932,1.9464009676726393,Au,PRUNED
820,0.0,2026-04-26 15:31:01.555481,2026-04-26 15:31:02.205488,0 days 00:00:00.650007,111.5334053910469,19.47391739121029,1.5694959840093559,Cu,PRUNED
821,0.0,2026-04-26 15:31:01.604154,2026-04-26 15:31:02.080659,0 days 00:00:00.476505,21.34214353920717,15.486525736923559,1.613323085836329,Au,PRUNED
822,-13.60544217686944,2026-04-26 15:31:01.626919,2026-04-26 15:31:02.224495,0 days 00:00:00.597576,27.387146399758485,13.919312169569444,1.9780352239971644,Au,PRUNED
823,0.0,2026-04-26 15:31:01.652446,2026-04-26 15:31:02.225504,0 days 00:00:00.573058,20.40336336122786,18.035661329570594,1.9368779492730506,Au,PRUNED
824,138.46153846153408,2026-04-26 15:31:02.084178,2026-04-26 15:31:02.748143,0 days 00:00:00.663965,37.05570320343557,15.694266206321231,1.7182259379624187,Au,PRUNED
825,-535.2338244714318,2026-04-26 15:31:02.152501,2026-04-26 15:31:02.824519,0 days 00:00:00.672018,20.85561706635552,19.349920855554547,1.9355473988068612,Au,COMPLETE
826,138.46153846153408,2026-04-26 15:31:02.177922,2026-04-26 15:31:02.796274,0 days 00:00:00.618352,35.646879627446566,16.201103372145923,1.6551102879215558,Au,PRUNED
827,141.75824175823726,2026-04-26 15:31:02.250949,2026-04-26 15:31:03.027975,0 days 00:00:00.777026,31.997048074103436,16.74994386332225,1.718377031589509,Au,PRUNED
828,-10.714285714284633,2026-04-26 15:31:02.330652,2026-04-26 15:31:02.919050,0 days 00:00:00.588398,27.130317936896343,14.66021331666111,1.9929084326589335,Au,PRUNED
829,0.0,2026-04-26 15:31:02.393277,2026-04-26 15:31:02.887408,0 days 00:00:00.494131,20.153629999690587,17.696323974003892,1.6995615313368182,Au,PRUNED
830,0.0,2026-04-26 15:31:02.438072,2026-04-26 15:31:03.215804,0 days 00:00:00.777732,20.287735946626384,19.789449510039795,1.8625791415109634,Au,PRUNED
831,139.56043956043513,2026-04-26 15:31:02.490118,2026-04-26 15:31:02.998048,0 days 00:00:00.507930,37.02517816141064,14.809157496664163,1.964915427365519,Au,PRUNED
832,-545.9882583169631,2026-04-26 15:31:02.813711,2026-04-26 15:31:03.491546,0 days 00:00:00.677835,20.69493272909721,19.68051978372076,1.8441347949745739,Au,COMPLETE
833,146.1538461538415,2026-04-26 15:31:02.874127,2026-04-26 15:31:03.620842,0 days 00:00:00.746715,25.683572981988924,19.30470108597128,1.9951578982400684,Au,PRUNED
834,0.0,2026-04-26 15:31:02.969030,2026-04-26 15:31:03.724472,0 days 00:00:00.755442,37.57704594535157,18.248503318054265,1.9946305213251896,Au,PRUNED
835,0.0,2026-04-26 15:31:03.069641,2026-04-26 15:31:03.589915,0 days 00:00:00.520274,36.19090543021231,19.567738004783255,1.8033150932520072,Au,PRUNED
836,0.0,2026-04-26 15:31:03.105323,2026-04-26 15:31:03.571417,0 days 00:00:00.466094,20.148972904974727,17.547012311552567,1.8724939124913385,Au,PRUNED
837,0.0,2026-04-26 15:31:03.126658,2026-04-26 15:31:03.678674,0 days 00:00:00.552016,42.635058685308536,19.409921713898832,1.8011820217633925,Au,PRUNED
838,-575.5297334244013,2026-04-26 15:31:03.187929,2026-04-26 15:31:03.832413,0 days 00:00:00.644484,20.78891148495575,19.840667665152477,1.9514390456105453,Au,COMPLETE
839,0.0,2026-04-26 15:31:03.341628,2026-04-26 15:31:04.004795,0 days 00:00:00.663167,20.732019549247955,19.986247397021963,1.3692101861602928,Cu,PRUNED
840,142.8571428571383,2026-04-26 15:31:03.645149,2026-04-26 15:31:04.453537,0 days 00:00:00.808388,28.491344008388527,18.582881178385414,1.9664568677462904,Au,PRUNED
841,0.0,2026-04-26 15:31:03.634068,2026-04-26 15:31:04.393297,0 days 00:00:00.759229,20.147361105719682,19.588372291054462,1.7850495263534234,Au,PRUNED
842,0.0,2026-04-26 15:31:03.726643,2026-04-26 15:31:04.377165,0 days 00:00:00.650522,33.33484007512415,19.980035565331097,1.9936801360516831,Au,PRUNED
843,0.0,2026-04-26 15:31:03.785525,2026-04-26 15:31:04.586568,0 days 00:00:00.801043,20.075024657971504,19.59757388757996,1.8404456833889742,Au,PRUNED
844,8.403361344536819,2026-04-26 15:31:03.819200,2026-04-26 15:31:04.281020,0 days 00:00:00.461820,24.90452911717081,19.73923850150196,1.6592596649044826,Au,PRUNED
845,0.0,2026-04-26 15:31:03.833419,2026-04-26 15:31:04.341607,0 days 00:00:00.508188,20.336658543655147,19.267781297067835,1.7677806239616023,Au,PRUNED
846,-19.841269841267618,2026-04-26 15:31:03.998186,2026-04-26 15:31:04.650598,0 days 00:00:00.652412,55.218098373308095,14.488455865763425,1.998015735090318,Ag,PRUNED
847,0.0,2026-04-26 15:31:04.044285,2026-04-26 15:31:04.766327,0 days 00:00:00.722042,21.962203124688674,16.42207302594669,1.7511321001610312,Au,PRUNED
848,0.0,2026-04-26 15:31:04.344665,2026-04-26 15:31:05.156217,0 days 00:00:00.811552,20.531431715952245,18.32219611451746,1.6020154245141143,Au,PRUNED
849,-8.928571428570304,2026-04-26 15:31:04.470264,2026-04-26 15:31:04.998744,0 days 00:00:00.528480,22.669206038572053,19.72556457385648,1.5903690022581989,Au,PRUNED
850,0.0,2026-04-26 15:31:04.533672,2026-04-26 15:31:05.028522,0 days 00:00:00.494850,20.535729104029453,17.833376295951485,1.9591379634846218,Au,PRUNED
851,0.0,2026-04-26 15:31:04.550565,2026-04-26 15:31:05.108184,0 days 00:00:00.557619,20.273133271067774,16.711516919060184,1.929316144507121,Au,PRUNED
852,0.0,2026-04-26 15:31:04.595468,2026-04-26 15:31:05.467187,0 days 00:00:00.871719,20.79965296084396,16.606792617738634,1.9431341155807342,Au,PRUNED
853,-6.493506493505897,2026-04-26 15:31:04.709266,2026-04-26 15:31:05.544986,0 days 00:00:00.835720,42.23692998701964,18.502535016419014,1.7444432696610215,Ag,PRUNED
854,4.2016806722684095,2026-04-26 15:31:04.733721,2026-04-26 15:31:05.267435,0 days 00:00:00.533714,24.24618950225409,19.255321037153905,1.998482934207888,Au,PRUNED
855,-3.9682539682535234,2026-04-26 15:31:04.792014,2026-04-26 15:31:05.732354,0 days 00:00:00.940340,26.228531491166542,16.62948161011232,1.9810327406444808,Au,PRUNED
856,0.0,2026-04-26 15:31:05.112706,2026-04-26 15:31:05.940963,0 days 00:00:00.828257,37.56044120142572,19.94092043200224,1.8046829796150037,Au,PRUNED
857,0.0,2026-04-26 15:31:05.199664,2026-04-26 15:31:05.637877,0 days 00:00:00.438213,38.400630251232144,19.633786748730632,1.7514290716105134,Au,PRUNED
858,0.0,2026-04-26 15:31:05.182006,2026-04-26 15:31:05.997402,0 days 00:00:00.815396,35.15311320316602,16.650156951095372,1.64678427338218,Au,PRUNED
859,0.0,2026-04-26 15:31:05.218684,2026-04-26 15:31:05.669186,0 days 00:00:00.450502,38.83339561741471,19.819594725177897,1.5324342390065242,Au,PRUNED
860,0.0,2026-04-26 15:31:05.374624,2026-04-26 15:31:06.200878,0 days 00:00:00.826254,20.559647191764846,14.083697395573955,1.9626828377097467,Au,PRUNED
861,-11.904761904760573,2026-04-26 15:31:05.593398,2026-04-26 15:31:06.516343,0 days 00:00:00.922945,21.8254960579447,18.95550615501374,1.9939886203192867,Au,PRUNED
862,-1.050420168067195,2026-04-26 15:31:05.659433,2026-04-26 15:31:06.432040,0 days 00:00:00.772607,50.21476962623827,14.64436825401696,0.7181306100890417,Au,PRUNED
863,0.0,2026-04-26 15:31:05.671707,2026-04-26 15:31:06.499648,0 days 00:00:00.827941,21.883257828242787,16.988470231239518,1.5602291583432715,Au,PRUNED
864,0.0,2026-04-26 15:31:05.789095,2026-04-26 15:31:06.432040,0 days 00:00:00.642945,40.73750723035284,16.670672865080316,1.0030321135817342,Au,PRUNED
865,-562.3742454727709,2026-04-26 15:31:05.815078,2026-04-26 15:31:06.516343,0 days 00:00:00.701265,21.280222355918117,19.892841797575226,1.3417739476248072,Au,COMPLETE
866,0.0,2026-04-26 15:31:06.016465,2026-04-26 15:31:06.694911,0 days 00:00:00.678446,20.347424331420388,15.57936481650741,1.517340177393532,Au,PRUNED
867,-4.464285714285152,2026-04-26 15:31:06.077794,2026-04-26 15:31:06.762310,0 days 00:00:00.684516,22.999530439496322,19.809538417151497,1.6296489600049284,Au,PRUNED
868,0.0,2026-04-26 15:31:06.376453,2026-04-26 15:31:07.118679,0 days 00:00:00.742226,21.04670000976291,16.314714773473327,1.936066993257088,Cu,PRUNED
869,-8.928571428570304,2026-04-26 15:31:06.595040,2026-04-26 15:31:07.034158,0 days 00:00:00.439118,23.322803096833514,19.477064873839115,1.3364341380067617,Au,PRUNED
870,0.0,2026-04-26 15:31:06.608428,2026-04-26 15:31:07.260425,0 days 00:00:00.651997,20.00465361173288,16.88419501239908,1.312837920075312,Au,PRUNED
871,0.0,2026-04-26 15:31:06.633906,2026-04-26 15:31:07.119604,0 days 00:00:00.485698,40.542769120151114,19.079451150337132,1.2545518435357121,Au,PRUNED
872,0.0,2026-04-26 15:31:06.673842,2026-04-26 15:31:07.155457,0 days 00:00:00.481615,29.8169575221477,19.829391278516084,1.0815222554998154,Au,PRUNED
873,0.0,2026-04-26 15:31:06.728141,2026-04-26 15:31:07.325161,0 days 00:00:00.597020,23.465966363028393,19.847318251762328,1.9933464381366204,Au,PRUNED
874,0.0,2026-04-26 15:31:06.795339,2026-04-26 15:31:07.293381,0 days 00:00:00.498042,38.623817391104495,19.604784652336196,1.2191997389275824,Au,PRUNED
875,0.0,2026-04-26 15:31:06.835624,2026-04-26 15:31:07.507979,0 days 00:00:00.672355,33.368511952764614,18.58882913685956,1.3421051654590919,Au,PRUNED
876,0.0,2026-04-26 15:31:07.069534,2026-04-26 15:31:07.693771,0 days 00:00:00.624237,20.68689599731713,19.488079115132393,1.2593647834948023,Au,PRUNED
877,0.0,2026-04-26 15:31:07.207862,2026-04-26 15:31:07.719240,0 days 00:00:00.511378,38.197681970609786,16.627154829419766,1.304520280336695,Au,PRUNED
878,-8.928571428570304,2026-04-26 15:31:07.312823,2026-04-26 15:31:07.978634,0 days 00:00:00.665811,21.409394162943332,19.9173756404144,1.7063246689747529,Au,PRUNED
879,0.0,2026-04-26 15:31:07.341639,2026-04-26 15:31:08.155446,0 days 00:00:00.813807,46.85390466047676,17.29960729574975,1.9977909359758323,Au,PRUNED
880,0.0,2026-04-26 15:31:07.371567,2026-04-26 15:31:07.941503,0 days 00:00:00.569936,20.059867440970294,17.179737786841812,1.4643444072612113,Au,PRUNED
881,-2.951593860684718,2026-04-26 15:31:07.419414,2026-04-26 15:31:07.943013,0 days 00:00:00.523599,89.80190944380045,5.544797100466638,1.4817934714502752,Au,PRUNED
882,5.102040816326161,2026-04-26 15:31:07.438184,2026-04-26 15:31:07.977123,0 days 00:00:00.538939,33.41093378139808,16.162062150735252,1.2430221919335929,Au,PRUNED
883,0.0,2026-04-26 15:31:07.591907,2026-04-26 15:31:08.220158,0 days 00:00:00.628251,20.636823808427387,19.776349420987845,1.5796304570426973,Au,PRUNED
884,-11.904761904760573,2026-04-26 15:31:07.776414,2026-04-26 15:31:08.564575,0 days 00:00:00.788161,21.81324887381586,19.499057847569873,1.504839147196741,Au,PRUNED
885,0.0,2026-04-26 15:31:07.888717,2026-04-26 15:31:08.644718,0 days 00:00:00.756001,48.70428174105241,16.369076671465713,1.967316880720595,Au,PRUNED
886,0.0,2026-04-26 15:31:08.072444,2026-04-26 15:31:08.712882,0 days 00:00:00.640438,37.35404077842136,19.509048557305928,1.5541702050307933,Cu,PRUNED
887,-470.1663798048861,2026-04-26 15:31:08.104514,2026-04-26 15:31:08.564575,0 days 00:00:00.460061,21.709073338270713,17.679172558339914,1.9998388953529824,Au,COMPLETE
888,0.0,2026-04-26 15:31:08.124602,2026-04-26 15:31:08.837393,0 days 00:00:00.712791,21.291499021590752,16.35652537774998,1.0319791277958892,Au,PRUNED
889,-0.5714285714285617,2026-04-26 15:31:08.146356,2026-04-26 15:31:08.660208,0 days 00:00:00.513852,76.2367442871917,11.408203414519429,1.7647328492549321,Au,PRUNED
890,0.0,2026-04-26 15:31:08.241688,2026-04-26 15:31:08.702454,0 days 00:00:00.460766,35.71548401595908,17.259628826279222,1.6534184042119457,Au,PRUNED
891,-9.216589861750549,2026-04-26 15:31:08.279966,2026-04-26 15:31:08.987174,0 days 00:00:00.707208,37.63591409915751,12.30826366376427,1.9508719616904424,Cu,PRUNED
892,0.0,2026-04-26 15:31:08.635848,2026-04-26 15:31:09.329600,0 days 00:00:00.693752,20.411953548251937,15.869330314892883,1.7950075062319006,Au,PRUNED
893,0.0,2026-04-26 15:31:08.757171,2026-04-26 15:31:09.524444,0 days 00:00:00.767273,20.6668616278734,19.54196110160961,0.9005983878067394,Au,PRUNED
894,146.1538461538415,2026-04-26 15:31:08.868439,2026-04-26 15:31:09.674436,0 days 00:00:00.805997,25.289101593319263,19.91257300394404,1.9087860524641733,Au,PRUNED
895,-11.278195488720607,2026-04-26 15:31:08.838960,2026-04-26 15:31:09.485257,0 days 00:00:00.646297,23.78171872505527,17.328105207050378,1.9673229416475875,Au,PRUNED
896,0.0,2026-04-26 15:31:08.899471,2026-04-26 15:31:09.662694,0 days 00:00:00.763223,32.376529532168654,19.85177573874625,1.968059475893564,Au,PRUNED
897,0.0,2026-04-26 15:31:08.964294,2026-04-26 15:31:09.426378,0 days 00:00:00.462084,20.164774327636984,19.680827618236563,1.9080124327478118,Au,PRUNED
898,0.0,2026-04-26 15:31:09.038740,2026-04-26 15:31:09.611438,0 days 00:00:00.572698,21.196639400565317,18.0228023571013,1.9629859911559995,Au,PRUNED
899,0.0,2026-04-26 15:31:09.051002,2026-04-26 15:31:09.687852,0 days 00:00:00.636850,37.58257834280707,19.107758664856878,1.7498269024459452,Au,PRUNED
900,-11.904761904760901,2026-04-26 15:31:09.442645,2026-04-26 15:31:10.090817,0 days 00:00:00.648172,36.72337672919369,15.240811361668904,1.639517151796039,Ag,PRUNED
901,0.0,2026-04-26 15:31:09.530864,2026-04-26 15:31:10.090817,0 days 00:00:00.559953,21.130992408070277,16.244821002612813,1.5455801684778048,Au,PRUNED
902,0.0,2026-04-26 15:31:09.571337,2026-04-26 15:31:10.327961,0 days 00:00:00.756624,41.8090648310781,16.509560338348503,1.4204369459778232,Au,PRUNED
903,0.0,2026-04-26 15:31:09.620276,2026-04-26 15:31:10.090243,0 days 00:00:00.469967,34.3640510855508,18.795989791991452,1.7496281205220292,Au,PRUNED
904,0.0,2026-04-26 15:31:09.611438,2026-04-26 15:31:10.033973,0 days 00:00:00.422535,20.726848914028743,18.42457649430799,1.635674226577557,Au,PRUNED
905,141.75824175823726,2026-04-26 15:31:09.712364,2026-04-26 15:31:10.326444,0 days 00:00:00.614080,32.801963921876236,16.52868869553613,1.5803269934933746,Au,PRUNED
906,0.0,2026-04-26 15:31:09.763908,2026-04-26 15:31:10.416874,0 days 00:00:00.652966,35.859269116876014,17.633978829067235,1.6398532335496105,Au,PRUNED
907,7.518796992480405,2026-04-26 15:31:09.950579,2026-04-26 15:31:10.726537,0 days 00:00:00.775958,32.00266531400546,16.154308360247505,1.4894994599468043,Au,PRUNED
908,0.0,2026-04-26 15:31:10.212528,2026-04-26 15:31:10.985160,0 days 00:00:00.772632,20.932985832118725,17.411885379576166,1.8013572518729608,Cu,PRUNED
909,0.0,2026-04-26 15:31:10.234921,2026-04-26 15:31:10.830946,0 days 00:00:00.596025,29.775099078522157,19.997552764456035,1.5686849235352374,Au,PRUNED
910,0.0,2026-04-26 15:31:10.259058,2026-04-26 15:31:11.054341,0 days 00:00:00.795283,20.20089122655891,17.430015230726163,1.846736615399746,Au,PRUNED
911,0.0,2026-04-26 15:31:10.299630,2026-04-26 15:31:10.993366,0 days 00:00:00.693736,20.689263228847416,17.8620243565514,1.262618427809207,Au,PRUNED
912,-541.3022351797238,2026-04-26 15:31:10.361086,2026-04-26 15:31:10.995435,0 days 00:00:00.634349,21.586958978096668,19.422724740349967,1.371547614224088,Au,COMPLETE
913,0.0,2026-04-26 15:31:10.467265,2026-04-26 15:31:11.337576,0 days 00:00:00.870311,20.422106861921446,18.460854691902068,1.6150070922614281,Au,PRUNED
914,-1.7421602787456147,2026-04-26 15:31:10.546650,2026-04-26 15:31:11.293702,0 days 00:00:00.747052,116.59257464978474,4.148226874079281,1.0357133255800879,Ag,PRUNED
915,0.0,2026-04-26 15:31:10.890115,2026-04-26 15:31:11.475452,0 days 00:00:00.585337,40.38361798272601,16.5692678497019,1.6948729261317117,Au,PRUNED
916,0.0,2026-04-26 15:31:10.967375,2026-04-26 15:31:11.428153,0 days 00:00:00.460778,22.296307142219064,11.605961116425103,1.3456951586144916,Au,PRUNED
917,0.0,2026-04-26 15:31:11.044099,2026-04-26 15:31:11.699497,0 days 00:00:00.655398,28.39221489416277,19.826056148791476,1.263234449226521,Au,PRUNED
918,-2.4009603841536187,2026-04-26 15:31:11.081990,2026-04-26 15:31:11.664714,0 days 00:00:00.582724,116.125676787945,0.8608272947408651,1.1734984715422816,Au,PRUNED
919,0.0,2026-04-26 15:31:11.140552,2026-04-26 15:31:11.895562,0 days 00:00:00.755010,34.000657447924155,19.960754411686867,1.1250613107160994,Au,PRUNED
920,0.0,2026-04-26 15:31:11.295742,2026-04-26 15:31:12.088211,0 days 00:00:00.792469,21.17234828752099,19.54857547412551,1.1905941712492298,Au,PRUNED
921,0.0,2026-04-26 15:31:11.377340,2026-04-26 15:31:12.426769,0 days 00:00:01.049429,37.50855048005466,19.88390366035439,1.1762726830687602,Au,PRUNED
922,-11.904761904760573,2026-04-26 15:31:11.414259,2026-04-26 15:31:12.117553,0 days 00:00:00.703294,22.622540769724353,18.787786536929932,1.3944894863652106,Au,PRUNED
923,145.05494505494045,2026-04-26 15:31:11.572677,2026-04-26 15:31:12.041870,0 days 00:00:00.469193,26.872508611688204,19.936352758717682,1.3426769172874182,Au,PRUNED
924,0.0,2026-04-26 15:31:11.618731,2026-04-26 15:31:12.518456,0 days 00:00:00.899725,20.74825961915253,19.725586216174012,1.439869487362266,Au,PRUNED
925,-554.5634920634272,2026-04-26 15:31:11.752373,2026-04-26 15:31:12.520571,0 days 00:00:00.768198,20.507502779100673,19.83741592479002,1.9310685634049736,Au,COMPLETE
926,0.0,2026-04-26 15:31:11.702239,2026-04-26 15:31:12.814697,0 days 00:00:01.112458,20.74730110444192,15.381240746922048,1.9749684598142827,Au,PRUNED
927,0.0,2026-04-26 15:31:11.974044,2026-04-26 15:31:12.692330,0 days 00:00:00.718286,39.60921739171127,16.715267147067337,1.0325091273132856,Au,PRUNED
928,2.645502645502447,2026-04-26 15:31:12.083093,2026-04-26 15:31:13.140187,0 days 00:00:01.057094,32.97186707496409,16.3208101757519,1.1461344135265588,Au,PRUNED
929,0.0,2026-04-26 15:31:12.243950,2026-04-26 15:31:12.751161,0 days 00:00:00.507211,39.54114012955688,16.57917263864443,1.991363768215944,Au,PRUNED
930,0.0,2026-04-26 15:31:12.288911,2026-04-26 15:31:12.722350,0 days 00:00:00.433439,20.11597084797711,19.64046222239349,1.5389073735892056,Au,PRUNED
931,-517.7404295050784,2026-04-26 15:31:12.599316,2026-04-26 15:31:13.141901,0 days 00:00:00.542585,20.78172866303403,19.223017196079066,1.88741416920009,Au,COMPLETE
