number,value,datetime_start,datetime_complete,duration,params_D2_nm,params_D3_nm,params_D4_nm,params_metal,state
2733,0.0,2026-04-26 15:34:24.900636,2026-04-26 15:34:25.778793,0 days 00:00:00.878157,35.50489344602123,17.00947194684412,1.5199299773601864,Au,PRUNED
2734,0.0,2026-04-26 15:34:25.093956,2026-04-26 15:34:25.995954,0 days 00:00:00.901998,20.42881423302351,19.577387779828037,1.439935181851044,Au,PRUNED
2735,142.8571428571383,2026-04-26 15:34:25.168216,2026-04-26 15:34:25.730093,0 days 00:00:00.561877,30.352453072203943,17.480112145007286,1.8379600396383333,Au,PRUNED
2736,8.403361344536819,2026-04-26 15:34:25.225566,2026-04-26 15:34:25.994952,0 days 00:00:00.769386,24.454362710968425,19.987552011412667,1.7018856521557075,Au,PRUNED
2737,-1.0660980810234213,2026-04-26 15:34:25.318605,2026-04-26 15:34:26.070779,0 days 00:00:00.752174,20.254741200908143,15.797245097358607,1.7615305828873478,Ag,PRUNED
2738,0.0,2026-04-26 15:34:25.394560,2026-04-26 15:34:25.982847,0 days 00:00:00.588287,34.044248877311375,17.633849526439203,1.8727696037873067,Au,PRUNED
2739,141.75824175823726,2026-04-26 15:34:25.435016,2026-04-26 15:34:26.243894,0 days 00:00:00.808878,32.383846620625384,16.886678394798356,1.6820753481490445,Au,PRUNED
2740,0.0,2026-04-26 15:34:25.471535,2026-04-26 15:34:26.071814,0 days 00:00:00.600279,38.579245508355974,19.961895218637316,1.5671855898096436,Au,PRUNED
2741,0.0,2026-04-26 15:34:25.851190,2026-04-26 15:34:26.789426,0 days 00:00:00.938236,20.876864456756927,19.703394959183157,1.365829698585538,Au,PRUNED
2742,0.0,2026-04-26 15:34:25.943750,2026-04-26 15:34:26.798105,0 days 00:00:00.854355,20.07684223531787,18.947175111835318,1.7721753804944886,Au,PRUNED
2743,0.0,2026-04-26 15:34:26.109606,2026-04-26 15:34:26.804937,0 days 00:00:00.695331,31.17102460600752,19.944906989181025,1.5007148549074845,Au,PRUNED
2744,-9.852216748767784,2026-04-26 15:34:26.171487,2026-04-26 15:34:27.067444,0 days 00:00:00.895957,23.742085466588478,19.97529589980591,1.7675634485198823,Ag,PRUNED
2745,-1.1614401858304098,2026-04-26 15:34:26.188537,2026-04-26 15:34:26.987559,0 days 00:00:00.799022,119.8268465019192,2.8167884928852764,1.970170777081239,Cu,PRUNED
2746,-12.315270935959731,2026-04-26 15:34:26.311392,2026-04-26 15:34:26.988664,0 days 00:00:00.677272,74.24683993113679,9.514122604879448,0.7350853419099694,Cu,PRUNED
2747,0.0,2026-04-26 15:34:26.349372,2026-04-26 15:34:26.988119,0 days 00:00:00.638747,21.444185017928817,16.79501461551097,1.987100179351028,Au,PRUNED
2748,-9.523809523808245,2026-04-26 15:34:26.427595,2026-04-26 15:34:27.159441,0 days 00:00:00.731846,22.011629174019703,19.988038540805757,1.7896297013271047,Au,PRUNED
2749,0.0,2026-04-26 15:34:26.862968,2026-04-26 15:34:27.639098,0 days 00:00:00.776130,36.3771524223543,19.844184011220456,1.4145319364046711,Au,PRUNED
2750,-584.2579750346035,2026-04-26 15:34:26.945786,2026-04-26 15:34:27.752834,0 days 00:00:00.807048,21.13733021679594,19.914848816041918,1.6753695566314164,Au,COMPLETE
2751,0.0,2026-04-26 15:34:27.055921,2026-04-26 15:34:27.808672,0 days 00:00:00.752751,34.72488211322647,17.623074891349596,1.5484232285419648,Au,PRUNED
2752,0.0,2026-04-26 15:34:27.085257,2026-04-26 15:34:28.129378,0 days 00:00:01.044121,29.290368834978324,19.846511917868103,1.758427043187893,Au,PRUNED
2753,0.0,2026-04-26 15:34:27.100946,2026-04-26 15:34:27.772511,0 days 00:00:00.671565,21.23279752850886,17.336159134505557,1.7995896201845207,Au,PRUNED
2754,0.0,2026-04-26 15:34:27.161443,2026-04-26 15:34:27.841866,0 days 00:00:00.680423,20.25393587939893,19.568517178033897,1.3149069653886754,Au,PRUNED
2755,0.0,2026-04-26 15:34:27.241563,2026-04-26 15:34:28.131893,0 days 00:00:00.890330,20.80431055788416,19.72321151228942,1.391162246433797,Au,PRUNED
2756,0.0,2026-04-26 15:34:27.272329,2026-04-26 15:34:28.159507,0 days 00:00:00.887178,20.29643646842208,17.2012205545446,1.640781201630834,Au,PRUNED
2757,0.0,2026-04-26 15:34:27.785701,2026-04-26 15:34:28.789478,0 days 00:00:01.003777,30.235676770682517,19.942185134026293,1.9921631008613814,Au,PRUNED
2758,0.0,2026-04-26 15:34:27.820619,2026-04-26 15:34:29.030101,0 days 00:00:01.209482,32.49259127497784,15.235946380967608,1.3764711118879378,Au,PRUNED
2759,0.0,2026-04-26 15:34:27.844362,2026-04-26 15:34:28.746446,0 days 00:00:00.902084,20.66328495357754,14.549826348540483,1.3169476119566847,Au,PRUNED
2760,0.0,2026-04-26 15:34:27.950022,2026-04-26 15:34:29.063572,0 days 00:00:01.113550,20.39678049601582,17.00152492657447,1.3133344776352065,Au,PRUNED
2761,0.0,2026-04-26 15:34:27.993204,2026-04-26 15:34:29.091853,0 days 00:00:01.098649,22.527858206775313,14.224910047964373,1.400713387254633,Au,PRUNED
2762,0.0,2026-04-26 15:34:28.219082,2026-04-26 15:34:29.206408,0 days 00:00:00.987326,33.40456129827061,19.957381205261424,1.3638068096770635,Au,PRUNED
2763,0.0,2026-04-26 15:34:28.244691,2026-04-26 15:34:29.512578,0 days 00:00:01.267887,23.41113525486122,19.996321443543632,1.7784214528906472,Au,PRUNED
2764,142.8571428571383,2026-04-26 15:34:28.285920,2026-04-26 15:34:29.203408,0 days 00:00:00.917488,32.23326615579098,17.420745208442384,1.012558595829717,Au,PRUNED
2765,0.0,2026-04-26 15:34:28.849872,2026-04-26 15:34:29.675398,0 days 00:00:00.825526,20.133641107609254,17.202779564437385,1.4557783759466474,Au,PRUNED
2766,0.0,2026-04-26 15:34:28.893562,2026-04-26 15:34:29.838710,0 days 00:00:00.945148,20.222063730615485,17.2705687241668,1.9149870565132716,Au,PRUNED
2767,-4.464285714285152,2026-04-26 15:34:29.135757,2026-04-26 15:34:29.673829,0 days 00:00:00.538072,22.168093714732823,19.92120964296506,1.804611205351375,Au,PRUNED
2768,0.0,2026-04-26 15:34:29.170260,2026-04-26 15:34:29.788156,0 days 00:00:00.617896,36.47072156962199,17.199392699829346,1.2601461731557226,Au,PRUNED
2769,-8.928571428570304,2026-04-26 15:34:29.237987,2026-04-26 15:34:29.917052,0 days 00:00:00.679065,21.7960901774135,19.959896426320057,1.7092134878814627,Au,PRUNED
2770,140.65934065933618,2026-04-26 15:34:29.317336,2026-04-26 15:34:30.153580,0 days 00:00:00.836244,32.73461628600761,17.582691136548252,1.33007679948784,Au,PRUNED
2771,0.0,2026-04-26 15:34:29.398485,2026-04-26 15:34:30.401154,0 days 00:00:01.002669,20.002552886627804,17.686451867902203,1.8076594899420508,Au,PRUNED
2772,3.7593984962402023,2026-04-26 15:34:29.646721,2026-04-26 15:34:30.274791,0 days 00:00:00.628070,30.601475882481832,16.300701711563867,1.5113365634525082,Au,PRUNED
2773,0.0,2026-04-26 15:34:29.814893,2026-04-26 15:34:30.631600,0 days 00:00:00.816707,36.85988955179481,19.957904851116663,1.6523533485528676,Au,PRUNED
2774,0.0,2026-04-26 15:34:29.892595,2026-04-26 15:34:30.757394,0 days 00:00:00.864799,20.677476486235953,17.61135297709024,1.729488740677478,Au,PRUNED
2775,7.936507936507047,2026-04-26 15:34:29.930815,2026-04-26 15:34:30.758399,0 days 00:00:00.827584,29.156520669659724,16.981461590111895,1.6017459967331036,Au,PRUNED
2776,-552.7878587924137,2026-04-26 15:34:29.967630,2026-04-26 15:34:30.907541,0 days 00:00:00.939911,20.67869227033185,19.87821102636269,1.725342639193239,Au,COMPLETE
2777,0.0,2026-04-26 15:34:30.101513,2026-04-26 15:34:30.977100,0 days 00:00:00.875587,46.80444574872351,16.868082361322234,1.5111293683214067,Au,PRUNED
2778,0.0,2026-04-26 15:34:30.224254,2026-04-26 15:34:30.994848,0 days 00:00:00.770594,31.83380065975967,17.87877620615774,1.521419623719286,Au,PRUNED
2779,-562.8772635814228,2026-04-26 15:34:30.304149,2026-04-26 15:34:30.994848,0 days 00:00:00.690699,21.07854512982356,19.869829380551593,1.5376318706305678,Au,COMPLETE
2780,142.8571428571383,2026-04-26 15:34:30.499728,2026-04-26 15:34:31.117058,0 days 00:00:00.617330,30.845157314419097,17.247629315923458,1.6265948950476465,Au,PRUNED
2781,0.0,2026-04-26 15:34:30.775433,2026-04-26 15:34:31.588245,0 days 00:00:00.812812,20.519445294449344,17.088797952633858,1.7913610704924223,Au,PRUNED
2782,0.0,2026-04-26 15:34:30.835896,2026-04-26 15:34:31.644295,0 days 00:00:00.808399,46.442012698800454,17.52488532365983,1.483096501416555,Au,PRUNED
2783,-2.463054187191946,2026-04-26 15:34:30.870217,2026-04-26 15:34:31.802359,0 days 00:00:00.932142,69.00873811208847,10.481968118076846,0.40117525198940374,Au,PRUNED
2784,-546.5838509316143,2026-04-26 15:34:31.013721,2026-04-26 15:34:31.643294,0 days 00:00:00.629573,20.854680152304276,19.956994683959486,1.4254452142023717,Au,COMPLETE
2785,0.0,2026-04-26 15:34:31.083501,2026-04-26 15:34:31.680333,0 days 00:00:00.596832,20.02601252109992,18.142370889165186,1.9585474569741481,Au,PRUNED
2786,0.0,2026-04-26 15:34:31.136021,2026-04-26 15:34:31.761343,0 days 00:00:00.625322,20.77855521104164,17.188785855663678,1.467598306912649,Au,PRUNED
2787,0.0,2026-04-26 15:34:31.225363,2026-04-26 15:34:31.867326,0 days 00:00:00.641963,20.647569208848072,17.469629652032772,1.6755495825310764,Au,PRUNED
2788,0.0,2026-04-26 15:34:31.310765,2026-04-26 15:34:32.097626,0 days 00:00:00.786861,21.402539394561064,17.628997618212573,1.8603608832835605,Cu,PRUNED
2789,7.518796992480405,2026-04-26 15:34:31.719390,2026-04-26 15:34:32.303621,0 days 00:00:00.584231,32.71682403726412,15.212685250876085,1.7690990080019944,Au,PRUNED
2790,4.464285714285152,2026-04-26 15:34:31.758969,2026-04-26 15:34:32.425117,0 days 00:00:00.666148,23.52857845253908,19.976395845196826,1.9725147962456966,Au,PRUNED
2791,0.0,2026-04-26 15:34:31.897995,2026-04-26 15:34:32.739823,0 days 00:00:00.841828,34.0690880740029,19.886973105528064,1.4991852747627972,Au,PRUNED
2792,0.0,2026-04-26 15:34:31.914751,2026-04-26 15:34:32.924766,0 days 00:00:01.010015,33.72811894363882,14.37464497411094,1.727284946842093,Au,PRUNED
2793,141.75824175823726,2026-04-26 15:34:31.970158,2026-04-26 15:34:32.682075,0 days 00:00:00.711917,31.93763572830074,17.615705410405475,1.2529845531097719,Au,PRUNED
2794,143.9560439560394,2026-04-26 15:34:31.992743,2026-04-26 15:34:32.587977,0 days 00:00:00.595234,30.86091732825473,17.14470767425327,1.4972534052068598,Au,PRUNED
2795,0.0,2026-04-26 15:34:32.046070,2026-04-26 15:34:32.649300,0 days 00:00:00.603230,39.46311133463438,19.888904668962457,1.99594105074677,Au,PRUNED
2796,0.0,2026-04-26 15:34:32.165836,2026-04-26 15:34:32.681076,0 days 00:00:00.515240,33.31199418425631,17.08410112680737,1.652858836868905,Au,PRUNED
2797,0.0,2026-04-26 15:34:32.355543,2026-04-26 15:34:33.126404,0 days 00:00:00.770861,20.815261289525914,16.70833236695417,1.6921664690573077,Au,PRUNED
2798,0.0,2026-04-26 15:34:32.619233,2026-04-26 15:34:33.504678,0 days 00:00:00.885445,33.730967529630746,17.573657840417106,1.6221274915775976,Au,PRUNED
2799,0.0,2026-04-26 15:34:32.686588,2026-04-26 15:34:33.790835,0 days 00:00:01.104247,33.237737898194766,19.922738623843827,1.8995975105888554,Au,PRUNED
2800,0.0,2026-04-26 15:34:32.772418,2026-04-26 15:34:33.452586,0 days 00:00:00.680168,20.263124732865048,16.977660043482953,1.6297784322264617,Au,PRUNED
2801,143.9560439560394,2026-04-26 15:34:32.793983,2026-04-26 15:34:33.412789,0 days 00:00:00.618806,29.519095385918526,18.00095803447079,1.5778309222807985,Au,PRUNED
2802,-1.770956316410831,2026-04-26 15:34:32.820326,2026-04-26 15:34:33.483888,0 days 00:00:00.663562,117.88940659330561,3.850247701413524,0.5920517499965221,Au,PRUNED
2803,0.0,2026-04-26 15:34:32.850776,2026-04-26 15:34:33.483299,0 days 00:00:00.632523,35.42883846416855,17.65729705000688,1.9968840160343926,Au,PRUNED
2804,0.0,2026-04-26 15:34:33.036279,2026-04-26 15:34:33.416742,0 days 00:00:00.380463,31.459077487991344,17.898870184846302,1.671275723472974,Au,PRUNED
2805,0.0,2026-04-26 15:34:33.324912,2026-04-26 15:34:34.080738,0 days 00:00:00.755826,48.32118386735782,19.978395177729,1.4455053964680846,Au,PRUNED
2806,0.0,2026-04-26 15:34:33.542673,2026-04-26 15:34:34.453803,0 days 00:00:00.911130,34.40002594596664,17.248669748446936,1.7630746271198172,Au,PRUNED
2807,0.0,2026-04-26 15:34:33.576260,2026-04-26 15:34:34.200806,0 days 00:00:00.624546,20.04109057797464,16.811566357589857,1.7924772707510852,Au,PRUNED
2808,0.0,2026-04-26 15:34:33.620211,2026-04-26 15:34:34.296498,0 days 00:00:00.676287,33.259266924777926,19.87674154704514,1.4760184073468114,Au,PRUNED
2809,0.0,2026-04-26 15:34:33.658417,2026-04-26 15:34:34.309499,0 days 00:00:00.651082,34.86876945278575,19.774813472318396,1.5970995166509065,Au,PRUNED
2810,-8.928571428570304,2026-04-26 15:34:33.690207,2026-04-26 15:34:34.437660,0 days 00:00:00.747453,21.262465786895753,19.922781033017902,1.7859051898113727,Au,PRUNED
2811,-8.928571428570862,2026-04-26 15:34:33.703915,2026-04-26 15:34:34.562411,0 days 00:00:00.858496,35.22845962260645,9.490856127572107,1.259756898374421,Au,PRUNED
2812,0.0,2026-04-26 15:34:33.862298,2026-04-26 15:34:34.608978,0 days 00:00:00.746680,38.088408095918645,19.941729022968385,1.760320986978398,Au,PRUNED
2813,0.0,2026-04-26 15:34:34.176321,2026-04-26 15:34:34.783837,0 days 00:00:00.607516,20.152001644059787,17.024124953206446,1.646792152682617,Au,PRUNED
2814,0.0,2026-04-26 15:34:34.307497,2026-04-26 15:34:35.138573,0 days 00:00:00.831076,20.18884463327846,19.90479650043299,1.8920115746792687,Au,PRUNED
2815,0.0,2026-04-26 15:34:34.420757,2026-04-26 15:34:35.122012,0 days 00:00:00.701255,30.76906296179724,19.98301066167444,1.7527234095833681,Au,PRUNED
2816,-546.5838509316143,2026-04-26 15:34:34.478098,2026-04-26 15:34:34.991547,0 days 00:00:00.513449,21.319494104949147,19.78868456552177,1.251250367942086,Au,COMPLETE
2817,0.0,2026-04-26 15:34:34.515735,2026-04-26 15:34:35.245466,0 days 00:00:00.729731,45.05877072102733,19.234725151200536,0.34817897373728457,Au,PRUNED
2818,2.463054187191946,2026-04-26 15:34:34.582569,2026-04-26 15:34:35.369060,0 days 00:00:00.786491,36.81390307645138,17.031559210806922,1.9565481395550068,Cu,PRUNED
2819,0.0,2026-04-26 15:34:34.700934,2026-04-26 15:34:35.525017,0 days 00:00:00.824083,20.125215386313492,17.426593443441234,1.808547257981379,Au,PRUNED
2820,0.0,2026-04-26 15:34:34.719418,2026-04-26 15:34:35.464973,0 days 00:00:00.745555,20.61935997308433,16.844606375358715,1.4426267094812035,Au,PRUNED
2821,0.0,2026-04-26 15:34:34.872141,2026-04-26 15:34:35.616277,0 days 00:00:00.744136,20.132037091417793,17.282723596204637,1.8459489034511667,Au,PRUNED
2822,0.0,2026-04-26 15:34:35.162091,2026-04-26 15:34:35.789580,0 days 00:00:00.627489,32.06369814474625,19.90197980840084,1.542363365770328,Au,PRUNED
2823,0.0,2026-04-26 15:34:35.280873,2026-04-26 15:34:35.929032,0 days 00:00:00.648159,40.50760405276108,19.988983381783356,1.7475834179260648,Au,PRUNED
2824,2.5510204081630805,2026-04-26 15:34:35.341710,2026-04-26 15:34:36.119367,0 days 00:00:00.777657,41.18451008596446,14.001316715558936,0.9532663216921663,Au,PRUNED
2825,0.0,2026-04-26 15:34:35.410030,2026-04-26 15:34:36.100946,0 days 00:00:00.690916,33.498552819424326,17.80789694690925,1.990715085008168,Au,PRUNED
2826,0.0,2026-04-26 15:34:35.449693,2026-04-26 15:34:36.053359,0 days 00:00:00.603666,40.906259901190836,19.99984359516997,1.6155155170150561,Au,PRUNED
2827,0.0,2026-04-26 15:34:35.535116,2026-04-26 15:34:36.119367,0 days 00:00:00.584251,28.066926619590543,19.90615165981486,1.819944019581504,Au,PRUNED
2828,0.0,2026-04-26 15:34:35.604260,2026-04-26 15:34:36.487467,0 days 00:00:00.883207,20.585038123353723,19.480922361452844,1.4888745381480162,Au,PRUNED
2829,141.75824175823726,2026-04-26 15:34:35.706348,2026-04-26 15:34:36.224497,0 days 00:00:00.518149,32.42304470350453,17.602985421410786,1.267304469707309,Au,PRUNED
2830,0.0,2026-04-26 15:34:35.844323,2026-04-26 15:34:36.725446,0 days 00:00:00.881123,20.103749816276363,19.644071628200166,1.1052230128838532,Au,PRUNED
2831,0.0,2026-04-26 15:34:36.075457,2026-04-26 15:34:36.645426,0 days 00:00:00.569969,34.34326161031797,16.920297733150413,1.7898527203783903,Au,PRUNED
2832,0.0,2026-04-26 15:34:36.142211,2026-04-26 15:34:37.162312,0 days 00:00:01.020101,33.44727051256282,19.94163194331635,1.6664540919407391,Au,PRUNED
2833,-0.6002400960384047,2026-04-26 15:34:36.198173,2026-04-26 15:34:36.783811,0 days 00:00:00.585638,62.93326168711292,14.824477602021236,1.2453462499320949,Au,PRUNED
2834,0.0,2026-04-26 15:34:36.293951,2026-04-26 15:34:36.807447,0 days 00:00:00.513496,31.89669947706178,19.992694473746774,1.3861413702812548,Au,PRUNED
2835,-10.204081632652322,2026-04-26 15:34:36.335369,2026-04-26 15:34:36.909080,0 days 00:00:00.573711,25.962709146473543,19.80392699734923,1.3733618831018737,Ag,PRUNED
2836,-0.5760368663594372,2026-04-26 15:34:36.400989,2026-04-26 15:34:37.270670,0 days 00:00:00.869681,68.39034186903842,12.91345214433225,1.4926315773010161,Au,PRUNED
2837,0.0,2026-04-26 15:34:36.582790,2026-04-26 15:34:37.435506,0 days 00:00:00.852716,20.422457728300696,19.916070509487234,1.6403602203272905,Au,PRUNED
2838,0.0,2026-04-26 15:34:36.836463,2026-04-26 15:34:37.623919,0 days 00:00:00.787456,34.51434694044349,17.34435731847446,1.1266600509784306,Au,PRUNED
2839,0.0,2026-04-26 15:34:36.862709,2026-04-26 15:34:37.861474,0 days 00:00:00.998765,20.278642446639402,18.800248975034304,1.312201401003536,Au,PRUNED
2840,0.0,2026-04-26 15:34:36.810478,2026-04-26 15:34:37.662026,0 days 00:00:00.851548,20.83541055295197,17.102929031003676,1.6120929045513446,Au,PRUNED
2841,-8.928571428570304,2026-04-26 15:34:36.958214,2026-04-26 15:34:37.755230,0 days 00:00:00.797016,21.853320128019593,19.702003141017524,1.6724760750856977,Au,PRUNED
2842,0.0,2026-04-26 15:34:37.006802,2026-04-26 15:34:37.925159,0 days 00:00:00.918357,35.92415037067716,17.34162238388554,1.039362821834135,Au,PRUNED
2843,0.0,2026-04-26 15:34:37.253164,2026-04-26 15:34:37.893272,0 days 00:00:00.640108,31.237607796705152,19.893817934671915,1.612586319889968,Au,PRUNED
2844,-8.403361344536819,2026-04-26 15:34:37.388942,2026-04-26 15:34:38.237162,0 days 00:00:00.848220,21.04013247668306,19.93116305155082,1.8508406667428339,Au,PRUNED
2845,0.0,2026-04-26 15:34:37.480028,2026-04-26 15:34:38.203829,0 days 00:00:00.723801,37.750479788209375,19.948996660819436,0.9774330161109094,Au,PRUNED
2846,0.0,2026-04-26 15:34:37.664588,2026-04-26 15:34:38.596970,0 days 00:00:00.932382,49.26027923757226,17.779848638939054,1.278129012402741,Au,PRUNED
2847,0.0,2026-04-26 15:34:37.752369,2026-04-26 15:34:38.583675,0 days 00:00:00.831306,30.441882026546565,19.841073038767195,1.5020348971805142,Au,PRUNED
2848,0.0,2026-04-26 15:34:37.838064,2026-04-26 15:34:38.566846,0 days 00:00:00.728782,33.576228931839836,18.348099701873686,1.9843262838866176,Au,PRUNED
2849,0.0,2026-04-26 15:34:38.032701,2026-04-26 15:34:38.721323,0 days 00:00:00.688622,34.06387805297021,17.627560091423362,1.8187488348491136,Au,PRUNED
2850,141.75824175823726,2026-04-26 15:34:38.098033,2026-04-26 15:34:38.918409,0 days 00:00:00.820376,32.52696329710743,17.035733313335747,1.3631699398565225,Au,PRUNED
2851,0.0,2026-04-26 15:34:38.177186,2026-04-26 15:34:38.801974,0 days 00:00:00.624788,33.44932554030643,19.92002291036699,1.8736956001415772,Au,PRUNED
2852,0.0,2026-04-26 15:34:38.236653,2026-04-26 15:34:39.217685,0 days 00:00:00.981032,34.5854153602204,17.66208041881884,1.3411717893757726,Au,PRUNED
2853,0.0,2026-04-26 15:34:38.335305,2026-04-26 15:34:38.989093,0 days 00:00:00.653788,31.358316528367602,19.775358714774615,1.5123808339153195,Au,PRUNED
2854,0.0,2026-04-26 15:34:38.695528,2026-04-26 15:34:39.451239,0 days 00:00:00.755711,30.014121869458215,19.937643829276954,1.5903189799746547,Au,PRUNED
2855,0.0,2026-04-26 15:34:38.776485,2026-04-26 15:34:39.612248,0 days 00:00:00.835763,20.022235294420064,19.402089998334556,1.9629863402543326,Au,PRUNED
2856,-15.306122448977392,2026-04-26 15:34:38.818465,2026-04-26 15:34:39.688223,0 days 00:00:00.869758,62.80331482353696,0.8688817985123602,0.8421893569418404,Cu,PRUNED
2857,0.0,2026-04-26 15:34:38.922433,2026-04-26 15:34:39.684188,0 days 00:00:00.761755,20.711473182802635,19.708215967577328,1.3588943484398173,Au,PRUNED
2858,0.0,2026-04-26 15:34:38.976496,2026-04-26 15:34:39.611249,0 days 00:00:00.634753,31.84086386723549,19.967588789929486,1.5187800227108066,Au,PRUNED
2859,-8.928571428570304,2026-04-26 15:34:39.004667,2026-04-26 15:34:39.560749,0 days 00:00:00.556082,21.68950148950996,19.91017511514443,1.7159397754455399,Au,PRUNED
2860,-8.928571428570304,2026-04-26 15:34:39.191582,2026-04-26 15:34:40.200225,0 days 00:00:01.008643,21.699632482658743,19.578089325149907,1.9873116109962483,Au,PRUNED
2861,0.0,2026-04-26 15:34:39.304252,2026-04-26 15:34:39.962298,0 days 00:00:00.658046,46.08664443154811,17.330543413843724,1.690177998929171,Au,PRUNED
2862,0.0,2026-04-26 15:34:39.560749,2026-04-26 15:34:40.482505,0 days 00:00:00.921756,20.22750507170627,19.53211470889213,1.7890419177668364,Au,PRUNED
2863,143.9560439560394,2026-04-26 15:34:39.642260,2026-04-26 15:34:40.297527,0 days 00:00:00.655267,29.912212054375715,17.654451054836034,1.7190352369930613,Au,PRUNED
2864,2.463054187191946,2026-04-26 15:34:39.718647,2026-04-26 15:34:40.372433,0 days 00:00:00.653786,35.80240393290331,14.384151131960623,1.9920972481577794,Au,PRUNED
2865,24.74690663667,2026-04-26 15:34:39.764732,2026-04-26 15:34:40.615800,0 days 00:00:00.851068,104.76584354118654,5.440682560614515,1.9565893005225385,Au,PRUNED
2866,-563.0449362843059,2026-04-26 15:34:39.828133,2026-04-26 15:34:40.448190,0 days 00:00:00.620057,20.38547835790709,19.99475473589822,1.9528596982509459,Au,COMPLETE
2867,0.0,2026-04-26 15:34:39.888623,2026-04-26 15:34:40.605737,0 days 00:00:00.717114,20.21058266562156,16.94889232369329,1.4554191087653512,Au,PRUNED
2868,0.0,2026-04-26 15:34:40.038493,2026-04-26 15:34:40.814418,0 days 00:00:00.775925,20.14048681691397,14.475394543862745,1.8467208021366504,Au,PRUNED
2869,-1.7857142857142545,2026-04-26 15:34:40.352567,2026-04-26 15:34:41.000427,0 days 00:00:00.647860,103.15926865608498,9.288903690554172,1.5774261508659881,Ag,PRUNED
2870,-1.7142857142856853,2026-04-26 15:34:40.459346,2026-04-26 15:34:41.059410,0 days 00:00:00.600064,118.7078252432554,11.10276448684334,1.5221987131728927,Ag,PRUNED
2871,0.0,2026-04-26 15:34:40.513630,2026-04-26 15:34:41.168708,0 days 00:00:00.655078,34.251828436728005,19.916375157458855,1.6920103831664075,Au,PRUNED
