number,value,datetime_start,datetime_complete,duration,params_D2_nm,params_D3_nm,params_D4_nm,params_metal,state
656,0.0,2026-04-26 15:30:46.103690,2026-04-26 15:30:46.562541,0 days 00:00:00.458851,54.83827324825039,16.40131138200208,1.6572926899440776,Au,PRUNED
657,0.5330490405117186,2026-04-26 15:30:46.237843,2026-04-26 15:30:46.781851,0 days 00:00:00.544008,69.94881988037294,18.284123920412156,1.3031384702474145,Ag,PRUNED
658,-341.7243549401886,2026-04-26 15:30:46.406217,2026-04-26 15:30:46.898166,0 days 00:00:00.491949,22.749471028423223,17.7023281666294,1.1601011158516559,Au,COMPLETE
659,0.0,2026-04-26 15:30:46.454972,2026-04-26 15:30:47.057925,0 days 00:00:00.602953,21.786980310985633,18.600395946584317,1.2381063463970525,Au,PRUNED
660,-6.4935064935060955,2026-04-26 15:30:46.476486,2026-04-26 15:30:47.106289,0 days 00:00:00.629803,28.07538478725247,14.8417108622135,1.0523837836418237,Cu,PRUNED
661,-6.4935064935060955,2026-04-26 15:30:46.663464,2026-04-26 15:30:47.229632,0 days 00:00:00.566168,23.149509831613475,17.480249113835953,1.4530487581489928,Cu,PRUNED
662,3.7593984962402023,2026-04-26 15:30:46.712610,2026-04-26 15:30:47.494957,0 days 00:00:00.782347,30.606680523456703,18.77787898295752,1.7967581557905554,Cu,PRUNED
663,-14.285714285712844,2026-04-26 15:30:46.783218,2026-04-26 15:30:47.464209,0 days 00:00:00.680991,23.486605867074417,19.673017863003825,1.147322389139197,Cu,PRUNED
664,-0.9652509652509382,2026-04-26 15:30:46.859155,2026-04-26 15:30:47.529129,0 days 00:00:00.669974,51.61593119291011,16.849825624278065,1.8730718078211352,Cu,PRUNED
665,-10.714285714284633,2026-04-26 15:30:46.881704,2026-04-26 15:30:47.528123,0 days 00:00:00.646419,25.21840966851359,16.010261421523687,0.9363744035306173,Au,PRUNED
666,133.11688311687894,2026-04-26 15:30:47.083151,2026-04-26 15:30:47.588883,0 days 00:00:00.505732,39.269646632072046,17.89201130474814,1.8284781786155326,Cu,PRUNED
667,-13.60544217686944,2026-04-26 15:30:47.108289,2026-04-26 15:30:47.649146,0 days 00:00:00.540857,26.093433738425148,14.96612779830236,1.252283229673014,Au,PRUNED
668,-6.4935064935060955,2026-04-26 15:30:47.204056,2026-04-26 15:30:47.840241,0 days 00:00:00.636185,25.401651879435413,16.011883290852015,1.2521282580804625,Cu,PRUNED
669,-10.714285714284633,2026-04-26 15:30:47.317551,2026-04-26 15:30:47.917026,0 days 00:00:00.599475,26.85179062113177,18.316640716724613,1.5660839554251285,Cu,PRUNED
670,0.0,2026-04-26 15:30:47.618646,2026-04-26 15:30:48.230043,0 days 00:00:00.611397,21.980381381681564,15.86854981255588,1.6702371942443328,Au,PRUNED
671,0.0,2026-04-26 15:30:47.592391,2026-04-26 15:30:48.324720,0 days 00:00:00.732329,21.458050497807843,14.073208872832769,1.4592457588467749,Cu,PRUNED
672,0.0,2026-04-26 15:30:47.665230,2026-04-26 15:30:48.170267,0 days 00:00:00.505037,47.15495311834904,16.9747284205123,1.1961270652802443,Au,PRUNED
673,0.0,2026-04-26 15:30:47.714675,2026-04-26 15:30:48.601640,0 days 00:00:00.886965,36.16785895597401,19.574904038374346,1.461039495139597,Au,PRUNED
674,-13.60544217686944,2026-04-26 15:30:47.746012,2026-04-26 15:30:48.168233,0 days 00:00:00.422221,24.00174876408982,18.04033721121844,1.5328699193719038,Cu,PRUNED
675,0.0,2026-04-26 15:30:47.777302,2026-04-26 15:30:48.455781,0 days 00:00:00.678479,29.42375878918795,19.53028207534171,0.7906366101694982,Au,PRUNED
676,0.0,2026-04-26 15:30:47.881771,2026-04-26 15:30:48.510911,0 days 00:00:00.629140,21.20597315846669,18.95372233968954,1.2186797598361,Au,PRUNED
677,2.5510204081630805,2026-04-26 15:30:47.946064,2026-04-26 15:30:48.527916,0 days 00:00:00.581852,37.41107087306731,17.121965785327234,1.3675135054624539,Cu,PRUNED
678,-4.464285714285152,2026-04-26 15:30:48.233043,2026-04-26 15:30:49.007069,0 days 00:00:00.774026,23.899360894221616,18.510067417542793,1.6747786761952932,Au,PRUNED
679,0.0,2026-04-26 15:30:48.328284,2026-04-26 15:30:49.021246,0 days 00:00:00.692962,20.487815114925272,15.353691118633916,1.154726004810479,Au,PRUNED
680,-575.5297334244013,2026-04-26 15:30:48.458685,2026-04-26 15:30:48.976208,0 days 00:00:00.517523,21.1545071898133,19.620110786614244,1.896543422283562,Au,COMPLETE
681,-7.518796992480405,2026-04-26 15:30:48.531115,2026-04-26 15:30:49.179245,0 days 00:00:00.648130,24.053291436938963,19.846285528667607,1.6635737063680764,Cu,PRUNED
682,0.0,2026-04-26 15:30:48.600074,2026-04-26 15:30:49.352254,0 days 00:00:00.752180,21.485930731304716,15.943561660560835,1.5263719237329023,Au,PRUNED
683,-12.605042016805228,2026-04-26 15:30:48.513940,2026-04-26 15:30:49.130509,0 days 00:00:00.616569,23.06798879592707,19.425363580202152,0.9389874006165861,Au,PRUNED
684,0.0,2026-04-26 15:30:48.649678,2026-04-26 15:30:49.180244,0 days 00:00:00.530566,20.34221516277327,16.940016364526887,0.9252851055001435,Au,PRUNED
685,4.926108374383892,2026-04-26 15:30:48.704576,2026-04-26 15:30:49.350746,0 days 00:00:00.646170,43.0219652201057,13.544727487239458,1.3386699766369587,Au,PRUNED
686,0.0,2026-04-26 15:30:49.102315,2026-04-26 15:30:49.773127,0 days 00:00:00.670812,39.77179376856985,16.527549869717493,1.6452941114904562,Au,PRUNED
687,-543.0194805194183,2026-04-26 15:30:49.210301,2026-04-26 15:30:50.099332,0 days 00:00:00.889031,21.736122221262615,19.34748992914943,1.3763942722932758,Au,COMPLETE
688,3.571428571428211,2026-04-26 15:30:49.226411,2026-04-26 15:30:49.894696,0 days 00:00:00.668285,30.821360620693028,15.73869904335899,1.8864397080009847,Au,PRUNED
689,3.7593984962402023,2026-04-26 15:30:49.257143,2026-04-26 15:30:49.663745,0 days 00:00:00.406602,31.35484614346347,15.756694373646642,1.7603173126707508,Au,PRUNED
690,-13.60544217686944,2026-04-26 15:30:49.287313,2026-04-26 15:30:49.881488,0 days 00:00:00.594175,24.945566251568057,15.987176527794889,1.8403604891693122,Au,PRUNED
691,0.0,2026-04-26 15:30:49.397712,2026-04-26 15:30:49.925410,0 days 00:00:00.527698,44.91494879835646,18.462997214738255,1.8958887867082042,Au,PRUNED
692,-468.93787575145546,2026-04-26 15:30:49.446509,2026-04-26 15:30:49.996268,0 days 00:00:00.549759,23.07146710658829,16.88523163823628,1.8766994154866448,Au,COMPLETE
693,0.0,2026-04-26 15:30:49.511100,2026-04-26 15:30:50.176455,0 days 00:00:00.665355,21.610097036423678,16.962566426026704,1.6974368111399503,Au,PRUNED
694,-11.904761904760573,2026-04-26 15:30:49.746783,2026-04-26 15:30:50.178180,0 days 00:00:00.431397,24.977867606858588,17.67757254957223,1.3961408881095396,Au,PRUNED
695,-473.3044733044249,2026-04-26 15:30:49.821231,2026-04-26 15:30:50.364535,0 days 00:00:00.543304,21.95209057559441,17.759546259865537,1.8063504555169474,Au,COMPLETE
696,0.0,2026-04-26 15:30:49.941874,2026-04-26 15:30:50.592724,0 days 00:00:00.650850,37.507930117695075,19.258492273365718,1.9634393545849171,Au,PRUNED
697,0.0,2026-04-26 15:30:49.978040,2026-04-26 15:30:50.579535,0 days 00:00:00.601495,36.06809359278266,16.47288946567422,1.8702068333126356,Au,PRUNED
698,0.0,2026-04-26 15:30:49.999299,2026-04-26 15:30:50.750918,0 days 00:00:00.751619,41.72004036416117,16.799848930003694,1.331664561314141,Au,PRUNED
699,0.0,2026-04-26 15:30:50.207189,2026-04-26 15:30:50.702410,0 days 00:00:00.495221,36.85178098456994,18.71080236814614,1.8566849154833902,Au,PRUNED
700,0.0,2026-04-26 15:30:50.272590,2026-04-26 15:30:50.982590,0 days 00:00:00.710000,24.63226673214656,18.370632760470315,1.9541448450029575,Au,PRUNED
701,0.0,2026-04-26 15:30:50.284957,2026-04-26 15:30:50.812262,0 days 00:00:00.527305,31.24316062255292,19.159939632303544,1.949412504059897,Au,PRUNED
702,0.0,2026-04-26 15:30:50.372401,2026-04-26 15:30:50.944459,0 days 00:00:00.572058,31.647104893989578,18.54561647850626,1.8485627461468366,Au,PRUNED
703,0.0,2026-04-26 15:30:50.541703,2026-04-26 15:30:51.497589,0 days 00:00:00.955886,23.659397503339804,19.415948123138755,1.727623112486937,Au,PRUNED
704,-11.278195488720607,2026-04-26 15:30:50.675328,2026-04-26 15:30:51.510358,0 days 00:00:00.835030,23.057873690513038,17.658157097487877,1.8973052083040531,Au,PRUNED
705,-542.2740524780723,2026-04-26 15:30:50.754644,2026-04-26 15:30:51.426653,0 days 00:00:00.672009,21.616703231771975,19.039573976973156,1.781143036086779,Au,COMPLETE
706,7.518796992480405,2026-04-26 15:30:50.826826,2026-04-26 15:30:51.364436,0 days 00:00:00.537610,29.257153323214606,16.596822758557714,1.845783116535536,Au,PRUNED
707,0.0,2026-04-26 15:30:50.875317,2026-04-26 15:30:51.291027,0 days 00:00:00.415710,20.629625550546223,19.207583395800352,1.519532082059993,Au,PRUNED
708,0.0,2026-04-26 15:30:50.907056,2026-04-26 15:30:51.426653,0 days 00:00:00.519597,20.929947637118605,18.368615642791763,1.8312860853754935,Au,PRUNED
709,0.0,2026-04-26 15:30:51.028790,2026-04-26 15:30:51.562550,0 days 00:00:00.533760,20.653582846822307,19.802494366092986,1.1827343231090848,Au,PRUNED
710,-7.142857142856661,2026-04-26 15:30:51.078137,2026-04-26 15:30:51.835158,0 days 00:00:00.757021,27.04097344185932,16.685734986034685,1.9443758540634442,Ag,PRUNED
711,4.2016806722684095,2026-04-26 15:30:51.392915,2026-04-26 15:30:52.036007,0 days 00:00:00.643092,24.46689378481305,18.95446929605746,1.9505843615173053,Au,PRUNED
712,-300.90583128890233,2026-04-26 15:30:51.530769,2026-04-26 15:30:51.930111,0 days 00:00:00.399342,23.474664303943705,15.580742400780627,1.8808993461987797,Au,COMPLETE
713,0.0,2026-04-26 15:30:51.465136,2026-04-26 15:30:52.262951,0 days 00:00:00.797815,112.20305718429495,8.758238288093779,1.2781704109194696,Cu,PRUNED
714,0.0,2026-04-26 15:30:51.573083,2026-04-26 15:30:52.225464,0 days 00:00:00.652381,31.643418670679143,19.928830345263066,1.6254639799013988,Au,PRUNED
715,0.0,2026-04-26 15:30:51.588050,2026-04-26 15:30:52.119344,0 days 00:00:00.531294,28.624703325758375,16.0042769097611,1.9793552819137863,Au,PRUNED
716,-559.2740592739929,2026-04-26 15:30:51.619004,2026-04-26 15:30:52.038631,0 days 00:00:00.419627,21.63737767405741,19.302685741735715,1.6974298343460588,Au,COMPLETE
717,4.2016806722684095,2026-04-26 15:30:51.634143,2026-04-26 15:30:52.092258,0 days 00:00:00.458115,24.814761249250402,18.642750117119093,1.983771232648255,Au,PRUNED
718,-262.93622141996013,2026-04-26 15:30:51.936413,2026-04-26 15:30:52.614520,0 days 00:00:00.678107,24.682076981481682,13.48949240819769,1.8827920923819665,Au,COMPLETE
719,0.0,2026-04-26 15:30:52.104364,2026-04-26 15:30:52.770355,0 days 00:00:00.665991,21.68489873336905,16.13696538334295,1.6185875276264832,Au,PRUNED
720,0.0,2026-04-26 15:30:52.138887,2026-04-26 15:30:52.990977,0 days 00:00:00.852090,28.6962772881331,19.195819179919912,1.7239331269029328,Au,PRUNED
721,0.0,2026-04-26 15:30:52.166370,2026-04-26 15:30:52.768836,0 days 00:00:00.602466,21.650877168341637,16.961249541242612,1.9276368625723177,Au,PRUNED
722,145.05494505494045,2026-04-26 15:30:52.197811,2026-04-26 15:30:52.972077,0 days 00:00:00.774266,26.704159562391464,19.817023469612607,1.5751462748584222,Au,PRUNED
723,-3.9682539682535234,2026-04-26 15:30:52.260441,2026-04-26 15:30:52.851586,0 days 00:00:00.591145,25.557712276687624,17.73869891943826,1.6824063082657954,Au,PRUNED
724,-11.278195488720607,2026-04-26 15:30:52.299447,2026-04-26 15:30:52.768331,0 days 00:00:00.468884,23.21065520435058,17.497014666230903,1.6686146819329235,Au,PRUNED
725,0.0,2026-04-26 15:30:52.337545,2026-04-26 15:30:52.933190,0 days 00:00:00.595645,31.070203946257053,19.931120480083436,1.5877464617897008,Au,PRUNED
726,0.0,2026-04-26 15:30:52.862244,2026-04-26 15:30:53.278830,0 days 00:00:00.416586,20.5236410796676,17.967840269786187,1.501411712793374,Au,PRUNED
727,-4.464285714285152,2026-04-26 15:30:52.889711,2026-04-26 15:30:53.277825,0 days 00:00:00.388114,23.213103655437966,19.591814564207695,1.4786843917714518,Au,PRUNED
728,-8.403361344537313,2026-04-26 15:30:52.935199,2026-04-26 15:30:53.595289,0 days 00:00:00.660090,28.27788767865954,11.746518356353734,1.7560188103135959,Au,PRUNED
729,0.0,2026-04-26 15:30:53.021523,2026-04-26 15:30:53.516100,0 days 00:00:00.494577,20.329234678781354,18.752918842752337,1.8443609060237582,Au,PRUNED
730,0.0,2026-04-26 15:30:53.045493,2026-04-26 15:30:53.671085,0 days 00:00:00.625592,20.582677892862776,13.347016289724827,1.862715575032512,Au,PRUNED
731,-2.5510204081630805,2026-04-26 15:30:53.065878,2026-04-26 15:30:53.516716,0 days 00:00:00.450838,45.86622389305785,10.84865510301999,1.8323601907524019,Au,PRUNED
732,-23.80952380951585,2026-04-26 15:30:53.082945,2026-04-26 15:30:53.702694,0 days 00:00:00.619749,79.06676705645721,0.6119085137446483,1.9822155385714604,Ag,PRUNED
733,-289.74876214925666,2026-04-26 15:30:53.097268,2026-04-26 15:30:53.593287,0 days 00:00:00.496019,24.300065526606843,14.706404671990736,1.9593611051904616,Au,COMPLETE
734,-14.285714285712844,2026-04-26 15:30:53.379204,2026-04-26 15:30:54.108313,0 days 00:00:00.729109,32.78730483729497,12.163807822466708,1.8312269931226348,Au,PRUNED
735,-4.464285714285431,2026-04-26 15:30:53.461355,2026-04-26 15:30:54.001821,0 days 00:00:00.540466,23.171617089520858,12.612137810867605,1.9202126828160537,Ag,PRUNED
736,0.0,2026-04-26 15:30:53.647912,2026-04-26 15:30:54.045712,0 days 00:00:00.397800,23.89920537926405,14.4590190401864,1.8755894534710544,Au,PRUNED
737,4.926108374383892,2026-04-26 15:30:53.657789,2026-04-26 15:30:54.419819,0 days 00:00:00.762030,40.50552438909783,13.120191400510873,1.884023382351419,Au,PRUNED
738,0.0,2026-04-26 15:30:53.703704,2026-04-26 15:30:54.481765,0 days 00:00:00.778061,20.078145921670476,11.122515974043557,1.9944553778285912,Au,PRUNED
739,0.0,2026-04-26 15:30:53.766401,2026-04-26 15:30:54.330087,0 days 00:00:00.563686,40.65437272380262,15.00275706523508,1.8777651343865196,Au,PRUNED
740,0.0,2026-04-26 15:30:53.813628,2026-04-26 15:30:54.557551,0 days 00:00:00.743923,20.156131293371228,11.86525336054265,1.641995700248263,Au,PRUNED
741,137.362637362633,2026-04-26 15:30:53.835717,2026-04-26 15:30:54.556550,0 days 00:00:00.720833,39.94568720386489,14.552234110922555,1.824392735690099,Au,PRUNED
742,-1.0660980810234213,2026-04-26 15:30:54.089045,2026-04-26 15:30:54.892615,0 days 00:00:00.803570,21.802062121595633,14.493664947572338,1.390925028668012,Ag,PRUNED
743,0.0,2026-04-26 15:30:54.144631,2026-04-26 15:30:54.790579,0 days 00:00:00.645948,43.51973305189016,15.139485618392417,1.9014224827084536,Au,PRUNED
744,2.463054187191946,2026-04-26 15:30:54.187263,2026-04-26 15:30:54.891575,0 days 00:00:00.704312,46.269436814727,12.590988935495282,1.8682064821717412,Au,PRUNED
745,-8.658008658008125,2026-04-26 15:30:54.497940,2026-04-26 15:30:55.257729,0 days 00:00:00.759789,26.144252153311694,13.206024805908594,1.9376242306394096,Au,PRUNED
746,-7.653061224489242,2026-04-26 15:30:54.526212,2026-04-26 15:30:55.350612,0 days 00:00:00.824400,29.112141658204017,14.589891265272232,1.3834218598385504,Ag,PRUNED
747,-545.0699642042978,2026-04-26 15:30:54.591593,2026-04-26 15:30:55.367234,0 days 00:00:00.775641,20.988144541646257,19.329933095837138,1.9832405898446963,Au,COMPLETE
748,0.0,2026-04-26 15:30:54.749542,2026-04-26 15:30:55.454927,0 days 00:00:00.705385,20.31020604150092,19.920104826963705,1.4229955059999784,Au,PRUNED
749,0.0,2026-04-26 15:30:54.797638,2026-04-26 15:30:55.501027,0 days 00:00:00.703389,22.391501991738156,12.97351959335402,1.9530726584072275,Au,PRUNED
750,-8.928571428570862,2026-04-26 15:30:54.936143,2026-04-26 15:30:55.633354,0 days 00:00:00.697211,25.00468486152084,14.280535086654517,1.9506079720377567,Au,PRUNED
751,-319.5488721804289,2026-04-26 15:30:54.970203,2026-04-26 15:30:55.617048,0 days 00:00:00.646845,23.51505258237183,16.03341072055786,1.883089660161488,Au,COMPLETE
752,-1.0660980810234213,2026-04-26 15:30:54.990172,2026-04-26 15:30:55.664661,0 days 00:00:00.674489,20.308300681085722,17.08682645131382,1.51756790653557,Ag,PRUNED
753,0.0,2026-04-26 15:30:55.421315,2026-04-26 15:30:56.149507,0 days 00:00:00.728192,20.7565591975919,19.093065406616656,1.6834575753561758,Au,PRUNED
754,0.0,2026-04-26 15:30:55.455921,2026-04-26 15:30:56.240703,0 days 00:00:00.784782,20.00140698156238,15.86249536218035,1.8513868500529262,Au,PRUNED
755,3.9682539682535234,2026-04-26 15:30:55.525465,2026-04-26 15:30:56.150513,0 days 00:00:00.625048,26.07732095992773,18.227630444643065,1.941916592809024,Au,PRUNED
756,-13.60544217686944,2026-04-26 15:30:55.662364,2026-04-26 15:30:56.224237,0 days 00:00:00.561873,24.081894400060367,15.578627641556881,1.8689911770763865,Au,PRUNED
757,0.0,2026-04-26 15:30:55.697341,2026-04-26 15:30:56.058564,0 days 00:00:00.361223,32.58172213989587,18.42230816303607,1.981623332145332,Au,PRUNED
758,0.0,2026-04-26 15:30:55.762510,2026-04-26 15:30:56.429604,0 days 00:00:00.667094,21.70880290710654,17.92502567618194,1.7683825489146543,Au,PRUNED
759,-7.936507936507047,2026-04-26 15:30:55.812636,2026-04-26 15:30:56.480029,0 days 00:00:00.667393,24.418990229207704,17.49668665675494,1.9973713821968677,Au,PRUNED
760,3.7593984962402023,2026-04-26 15:30:55.825273,2026-04-26 15:30:56.209671,0 days 00:00:00.384398,28.98685466955243,15.89655525118178,1.9610645946592467,Au,PRUNED
761,0.0,2026-04-26 15:30:56.110778,2026-04-26 15:30:56.926429,0 days 00:00:00.815651,22.665017140451056,16.296704692768984,1.8057269465607557,Au,PRUNED
762,36.25541125541068,2026-04-26 15:30:56.343686,2026-04-26 15:30:56.993051,0 days 00:00:00.649365,83.01780662229079,10.54829817809299,0.14087116175422,Au,PRUNED
763,0.0,2026-04-26 15:30:56.352427,2026-04-26 15:30:56.872774,0 days 00:00:00.520347,42.08342670525598,17.938479034661178,1.6181127781908464,Au,PRUNED
764,0.0,2026-04-26 15:30:56.389299,2026-04-26 15:30:56.899658,0 days 00:00:00.510359,20.211055473731978,16.10132894920336,1.9140698220068084,Au,PRUNED
765,0.0,2026-04-26 15:30:56.450800,2026-04-26 15:30:57.022203,0 days 00:00:00.571403,29.016554721331964,19.84735245493012,1.9445911859594718,Au,PRUNED
766,0.0,2026-04-26 15:30:56.512300,2026-04-26 15:30:56.926429,0 days 00:00:00.414129,29.034591771394552,19.56332867382742,1.8867847326463465,Au,PRUNED
767,2.645502645502447,2026-04-26 15:30:56.522953,2026-04-26 15:30:57.259789,0 days 00:00:00.736836,34.997338179967855,14.326599041437545,1.6664385564678514,Au,PRUNED
768,-8.403361344536819,2026-04-26 15:30:56.550694,2026-04-26 15:30:56.926429,0 days 00:00:00.375735,22.785512720319947,18.82770715678404,1.8045063171223368,Au,PRUNED
769,0.0,2026-04-26 15:30:56.996063,2026-04-26 15:30:57.940685,0 days 00:00:00.944622,20.30096488334012,15.02612746766471,1.907883217692032,Au,PRUNED
770,0.0,2026-04-26 15:30:57.104843,2026-04-26 15:30:57.674650,0 days 00:00:00.569807,20.0391265396034,14.34985520864147,1.7358592917861868,Au,PRUNED
771,-1.1428571428571235,2026-04-26 15:30:57.119323,2026-04-26 15:30:57.923136,0 days 00:00:00.803813,57.185886489669265,18.514200930670835,0.7596207410576423,Cu,PRUNED
772,147.25274725274258,2026-04-26 15:30:57.135108,2026-04-26 15:30:57.911002,0 days 00:00:00.775894,24.82917097842892,19.941392837321416,1.9402675816554744,Au,PRUNED
773,0.0,2026-04-26 15:30:57.154843,2026-04-26 15:30:57.754893,0 days 00:00:00.600050,20.379693517604014,19.38754111676977,1.8894285915234827,Au,PRUNED
774,2.463054187191946,2026-04-26 15:30:57.165970,2026-04-26 15:30:57.678879,0 days 00:00:00.512909,40.89775643556446,13.008092892358295,1.6286408795597662,Au,PRUNED
775,-14.285714285712844,2026-04-26 15:30:57.184914,2026-04-26 15:30:57.677368,0 days 00:00:00.492454,31.249933842097676,13.328144569301365,1.5372295614767801,Au,PRUNED
776,-539.1809093840081,2026-04-26 15:30:57.337965,2026-04-26 15:30:57.605669,0 days 00:00:00.267704,21.438914487118605,19.290601819334018,1.6139050834189652,Au,COMPLETE
777,0.0,2026-04-26 15:30:57.771224,2026-04-26 15:30:58.479599,0 days 00:00:00.708375,53.32757337369228,19.187483681284423,1.4659614599454869,Au,PRUNED
778,0.0,2026-04-26 15:30:57.808589,2026-04-26 15:30:58.451685,0 days 00:00:00.643096,20.830939311430445,14.354268876890526,1.6156435904632933,Au,PRUNED
779,3.571428571428211,2026-04-26 15:30:57.828164,2026-04-26 15:30:58.345480,0 days 00:00:00.517316,32.72044754856107,15.46568697498413,1.5291529608870043,Au,PRUNED
780,0.0,2026-04-26 15:30:57.849848,2026-04-26 15:30:58.425178,0 days 00:00:00.575330,21.58388233979948,14.416254221820985,1.5677286842990381,Au,PRUNED
781,-8.928571428570304,2026-04-26 15:30:57.866330,2026-04-26 15:30:58.644170,0 days 00:00:00.777840,22.098798906261823,19.455828469825246,1.6791506662473241,Au,PRUNED
782,0.0,2026-04-26 15:30:57.983763,2026-04-26 15:30:58.424137,0 days 00:00:00.440374,20.411219574465996,14.22232078163975,1.5907645739508065,Au,PRUNED
783,0.0,2026-04-26 15:30:58.003465,2026-04-26 15:30:58.645560,0 days 00:00:00.642095,21.55866904628712,17.146824598168628,1.417149251614595,Au,PRUNED
784,139.56043956043513,2026-04-26 15:30:58.026669,2026-04-26 15:30:58.612539,0 days 00:00:00.585870,35.072034821335166,16.365799988986844,1.6913082151583372,Au,PRUNED
785,0.0,2026-04-26 15:30:58.481596,2026-04-26 15:30:59.108007,0 days 00:00:00.626411,43.216374567828325,19.809922905790657,1.3862694988695266,Au,PRUNED
786,0.0,2026-04-26 15:30:58.520388,2026-04-26 15:30:59.359875,0 days 00:00:00.839487,20.694745059397963,18.33405812919015,1.523377445231806,Au,PRUNED
787,-7.653061224489242,2026-04-26 15:30:58.662145,2026-04-26 15:30:59.279862,0 days 00:00:00.617717,35.8893419898277,14.934192896892737,1.5906092802116014,Cu,PRUNED
788,-14.28571428571313,2026-04-26 15:30:58.722651,2026-04-26 15:30:59.295204,0 days 00:00:00.572553,34.25458864224815,17.77448943994006,0.8509226338621874,Ag,PRUNED
789,0.0,2026-04-26 15:30:58.737825,2026-04-26 15:30:59.202533,0 days 00:00:00.464708,23.653473507508057,19.89806663830507,1.7941739787256965,Au,PRUNED
790,-5.102040816326161,2026-04-26 15:30:58.774784,2026-04-26 15:30:59.404899,0 days 00:00:00.630115,38.74926387661882,14.920622373892538,1.6361383759081543,Cu,PRUNED
791,-7.518796992480405,2026-04-26 15:30:58.763725,2026-04-26 15:30:59.252532,0 days 00:00:00.488807,33.68365674581863,15.54605045370855,1.728465341950854,Cu,PRUNED
792,-4.464285714285152,2026-04-26 15:30:58.825422,2026-04-26 15:30:59.247946,0 days 00:00:00.422524,23.404716736088194,19.392784594291218,1.6688429562519376,Au,PRUNED
