number,value,datetime_start,datetime_complete,duration,params_D2_nm,params_D3_nm,params_D4_nm,params_metal,state
1071,0.0,2026-04-26 15:31:25.812198,2026-04-26 15:31:26.426818,0 days 00:00:00.614620,40.11894825773847,18.70754323849599,1.9645219672934702,Au,PRUNED
1072,0.0,2026-04-26 15:31:26.094703,2026-04-26 15:31:26.831290,0 days 00:00:00.736587,39.1836539510374,16.679212046002903,1.9634614193424287,Au,PRUNED
1073,-1.050420168067195,2026-04-26 15:31:26.132574,2026-04-26 15:31:26.726542,0 days 00:00:00.593968,21.643882660182136,12.369491984574822,0.17368967833500226,Ag,PRUNED
1074,-14.28571428571313,2026-04-26 15:31:26.318412,2026-04-26 15:31:27.051687,0 days 00:00:00.733275,73.93964043172495,7.409802690134789,0.9495643201482773,Au,PRUNED
1075,0.0,2026-04-26 15:31:26.356761,2026-04-26 15:31:26.941778,0 days 00:00:00.585017,20.57464386313824,16.984486577689932,1.9003274430597479,Au,PRUNED
1076,141.75824175823726,2026-04-26 15:31:26.366368,2026-04-26 15:31:27.096071,0 days 00:00:00.729703,33.73437849777967,16.758001605065083,0.9828091133281245,Au,PRUNED
1077,0.0,2026-04-26 15:31:26.469353,2026-04-26 15:31:27.130254,0 days 00:00:00.660901,21.20341282577327,17.134181807274004,1.421861913939061,Au,PRUNED
1078,0.0,2026-04-26 15:31:26.639841,2026-04-26 15:31:27.373316,0 days 00:00:00.733475,36.44791319865044,19.676011144773298,1.6823477780889267,Au,PRUNED
1079,0.0,2026-04-26 15:31:26.724502,2026-04-26 15:31:27.698772,0 days 00:00:00.974270,30.588173064603367,19.928796414955123,1.751068331882423,Au,PRUNED
1080,-573.8152062733709,2026-04-26 15:31:26.831842,2026-04-26 15:31:27.795090,0 days 00:00:00.963248,21.4175601900805,19.569718495138336,1.7241584122231053,Au,COMPLETE
1081,0.0,2026-04-26 15:31:26.914717,2026-04-26 15:31:27.548216,0 days 00:00:00.633499,20.21922155323289,17.61176506497151,1.9572279511920305,Au,PRUNED
1082,0.0,2026-04-26 15:31:27.014352,2026-04-26 15:31:27.685364,0 days 00:00:00.671012,20.83699243048229,18.68222939724549,1.7516007850635344,Au,PRUNED
1083,0.0,2026-04-26 15:31:27.176893,2026-04-26 15:31:27.994410,0 days 00:00:00.817517,40.01233786738629,17.584783587858915,1.7445470236993665,Au,PRUNED
1084,-550.4105090311347,2026-04-26 15:31:27.190120,2026-04-26 15:31:27.875217,0 days 00:00:00.685097,20.773401376682187,19.675280041826507,1.847739625691719,Au,COMPLETE
1085,0.0,2026-04-26 15:31:27.217909,2026-04-26 15:31:27.912966,0 days 00:00:00.695057,20.723158426646417,18.312208003934824,1.7091704237630732,Au,PRUNED
1086,-294.74762525608025,2026-04-26 15:31:27.431052,2026-04-26 15:31:28.149893,0 days 00:00:00.718841,21.76540537445952,18.35397019567315,1.972692378317196,Cu,COMPLETE
1087,0.0,2026-04-26 15:31:27.749634,2026-04-26 15:31:28.573932,0 days 00:00:00.824298,20.087651028129912,17.53339160297223,1.7834747353669012,Au,PRUNED
1088,0.0,2026-04-26 15:31:27.769465,2026-04-26 15:31:28.482725,0 days 00:00:00.713260,38.7630268767722,19.621061006065208,1.9986048719075613,Au,PRUNED
1089,146.1538461538415,2026-04-26 15:31:27.821202,2026-04-26 15:31:28.400962,0 days 00:00:00.579760,25.571253004746048,19.872395554132623,1.8148484578727044,Au,PRUNED
1090,0.0,2026-04-26 15:31:28.040206,2026-04-26 15:31:28.729336,0 days 00:00:00.689130,28.889757023951773,19.8681466719512,1.672834195457282,Au,PRUNED
1091,-12.755102040815403,2026-04-26 15:31:28.079966,2026-04-26 15:31:28.650025,0 days 00:00:00.570059,43.36024568729579,11.107007537322442,0.25623719400512857,Au,PRUNED
1092,0.0,2026-04-26 15:31:28.101006,2026-04-26 15:31:28.574495,0 days 00:00:00.473489,35.59715148140401,18.033310482297463,1.7517659060296864,Au,PRUNED
1093,0.0,2026-04-26 15:31:28.145818,2026-04-26 15:31:28.667868,0 days 00:00:00.522050,43.81457696556966,19.708008323431624,1.8227995967415471,Au,PRUNED
1094,0.0,2026-04-26 15:31:28.317328,2026-04-26 15:31:29.038889,0 days 00:00:00.721561,30.061268316760916,19.777547779523402,1.962350739738514,Au,PRUNED
1095,-8.403361344536819,2026-04-26 15:31:28.505852,2026-04-26 15:31:29.136175,0 days 00:00:00.630323,21.72291337293429,19.25844675619985,1.9848100792291032,Au,PRUNED
1096,-517.7404295050784,2026-04-26 15:31:28.606041,2026-04-26 15:31:29.181175,0 days 00:00:00.575134,20.921999856934516,19.17380709791627,1.8317007317139136,Au,COMPLETE
1097,0.0,2026-04-26 15:31:28.642636,2026-04-26 15:31:29.271923,0 days 00:00:00.629287,27.830383156347715,19.77113578711207,1.805929648702576,Au,PRUNED
1098,-1.1337868480725433,2026-04-26 15:31:28.847983,2026-04-26 15:31:29.521395,0 days 00:00:00.673412,91.65625948708427,12.563685902731041,1.5827049232366055,Cu,PRUNED
1099,8.403361344536819,2026-04-26 15:31:28.883492,2026-04-26 15:31:29.583259,0 days 00:00:00.699767,24.521445602426144,19.73905099452771,1.8935779398508172,Au,PRUNED
1100,-538.3747178328957,2026-04-26 15:31:28.914185,2026-04-26 15:31:29.567842,0 days 00:00:00.653657,20.61287154586271,19.934126118246336,1.5458105283760584,Au,COMPLETE
1101,0.0,2026-04-26 15:31:28.936421,2026-04-26 15:31:29.449759,0 days 00:00:00.513338,20.323948415205983,17.515083724384365,1.9788255859329817,Au,PRUNED
1102,0.0,2026-04-26 15:31:29.149679,2026-04-26 15:31:29.759216,0 days 00:00:00.609537,34.69088635262332,18.0681767615507,1.7953835876757305,Au,PRUNED
1103,0.0,2026-04-26 15:31:29.184193,2026-04-26 15:31:29.804837,0 days 00:00:00.620644,36.191310707109,17.83565142862309,1.6980878228995218,Au,PRUNED
1104,0.0,2026-04-26 15:31:29.342868,2026-04-26 15:31:29.836471,0 days 00:00:00.493603,31.667846603924737,19.51100510913229,1.788936234192842,Au,PRUNED
1105,0.0,2026-04-26 15:31:29.400030,2026-04-26 15:31:30.210175,0 days 00:00:00.810145,23.811485986960037,19.59355161071248,1.9624027364639727,Au,PRUNED
1106,0.0,2026-04-26 15:31:29.491553,2026-04-26 15:31:30.125416,0 days 00:00:00.633863,20.150785984427987,18.87714329766061,1.8426844559367463,Au,PRUNED
1107,0.0,2026-04-26 15:31:29.676862,2026-04-26 15:31:30.245253,0 days 00:00:00.568391,20.47887467948513,19.514476977155617,1.4421666337868162,Au,PRUNED
1108,-8.403361344536819,2026-04-26 15:31:29.708636,2026-04-26 15:31:30.243253,0 days 00:00:00.534617,21.103791163912696,19.941066355684594,1.8094967982499852,Au,PRUNED
1109,-542.8571428570807,2026-04-26 15:31:29.732900,2026-04-26 15:31:30.194582,0 days 00:00:00.461682,20.83896693387379,19.754984024278436,1.613099774565611,Au,COMPLETE
1110,3.9682539682535234,2026-04-26 15:31:29.816371,2026-04-26 15:31:30.664336,0 days 00:00:00.847965,24.33625363932679,19.858078640372177,1.816566956724405,Au,PRUNED
1111,0.0,2026-04-26 15:31:29.853385,2026-04-26 15:31:30.412334,0 days 00:00:00.558949,21.19908703083391,18.54178702290651,1.7169203769705386,Au,PRUNED
1112,0.0,2026-04-26 15:31:29.907151,2026-04-26 15:31:30.496298,0 days 00:00:00.589147,38.75995970931188,19.84919238077895,1.6581711800572323,Au,PRUNED
1113,-22.321428571425763,2026-04-26 15:31:30.198180,2026-04-26 15:31:31.127900,0 days 00:00:00.929720,74.1758985332473,14.570380047608044,0.9822424277901177,Ag,PRUNED
1114,-4.464285714285152,2026-04-26 15:31:30.319322,2026-04-26 15:31:30.975153,0 days 00:00:00.655831,22.77404069737762,19.888810503562233,1.6666195765286589,Au,PRUNED
1115,-8.928571428570304,2026-04-26 15:31:30.337977,2026-04-26 15:31:31.114637,0 days 00:00:00.776660,22.903682997147197,19.474550060667468,1.7237116628148441,Au,PRUNED
1116,0.0,2026-04-26 15:31:30.369667,2026-04-26 15:31:31.037919,0 days 00:00:00.668252,21.03652474339796,18.84515700996352,1.5946388248785477,Au,PRUNED
1117,-4.464285714285152,2026-04-26 15:31:30.400360,2026-04-26 15:31:31.001066,0 days 00:00:00.600706,22.771498317913096,19.739582088786673,1.77504650047125,Au,PRUNED
1118,-541.3022351797238,2026-04-26 15:31:30.446485,2026-04-26 15:31:31.069513,0 days 00:00:00.623028,20.87140622268155,19.738702568301974,1.582607081275367,Au,COMPLETE
1119,0.0,2026-04-26 15:31:30.594467,2026-04-26 15:31:31.312453,0 days 00:00:00.717986,20.13120738333826,18.70604582427054,1.5704913308296025,Au,PRUNED
1120,-11.428571428570503,2026-04-26 15:31:30.702734,2026-04-26 15:31:31.126384,0 days 00:00:00.423650,68.98130901489444,7.781397718913687,1.0737057279559634,Cu,PRUNED
1121,0.0,2026-04-26 15:31:31.072593,2026-04-26 15:31:31.735757,0 days 00:00:00.663164,35.292593926694664,19.735640487464618,1.5786518718333813,Au,PRUNED
1122,-4.464285714285152,2026-04-26 15:31:31.196421,2026-04-26 15:31:31.860566,0 days 00:00:00.664145,23.539305886792256,19.498737606674922,1.3325249207626602,Au,PRUNED
1123,0.0,2026-04-26 15:31:31.207199,2026-04-26 15:31:31.750341,0 days 00:00:00.543142,38.53602197031435,19.66428187925981,1.44102945957635,Au,PRUNED
1124,0.0,2026-04-26 15:31:31.224135,2026-04-26 15:31:31.750952,0 days 00:00:00.526817,20.082525731771938,17.554828901701747,1.6006652355612663,Au,PRUNED
1125,0.0,2026-04-26 15:31:31.239945,2026-04-26 15:31:32.071563,0 days 00:00:00.831618,42.44761333005402,19.749322192793713,1.6264681653253061,Au,PRUNED
1126,0.0,2026-04-26 15:31:31.277157,2026-04-26 15:31:31.903474,0 days 00:00:00.626317,20.551315104151776,19.087521346232776,1.6212208827131236,Au,PRUNED
1127,0.0,2026-04-26 15:31:31.379969,2026-04-26 15:31:31.940862,0 days 00:00:00.560893,38.669499448982364,19.71686690421195,1.6380033012198607,Ag,PRUNED
1128,0.0,2026-04-26 15:31:31.470251,2026-04-26 15:31:32.126575,0 days 00:00:00.656324,29.9550968634544,19.913903380376265,1.432044985344356,Au,PRUNED
1129,0.0,2026-04-26 15:31:31.849033,2026-04-26 15:31:32.564391,0 days 00:00:00.715358,31.82536868059356,19.900570946455755,1.3961760555394116,Au,PRUNED
1130,-8.928571428570304,2026-04-26 15:31:31.883972,2026-04-26 15:31:32.564391,0 days 00:00:00.680419,22.424938479803522,19.660787179643606,1.699371471024914,Au,PRUNED
1131,-4.464285714285152,2026-04-26 15:31:31.905476,2026-04-26 15:31:32.635255,0 days 00:00:00.729779,23.643306325038402,19.548912772170283,1.4741730474916432,Au,PRUNED
1132,0.0,2026-04-26 15:31:32.006338,2026-04-26 15:31:32.637397,0 days 00:00:00.631059,28.320109026478054,19.607204656491845,1.4069847439476346,Au,PRUNED
1133,0.0,2026-04-26 15:31:32.042766,2026-04-26 15:31:32.699585,0 days 00:00:00.656819,23.73020468080745,19.906971598422228,1.6062461038467017,Au,PRUNED
1134,0.0,2026-04-26 15:31:32.074066,2026-04-26 15:31:32.885703,0 days 00:00:00.811637,30.537060243058576,19.839823343650917,1.6422854587533702,Au,PRUNED
1135,-8.928571428570304,2026-04-26 15:31:32.220798,2026-04-26 15:31:32.902053,0 days 00:00:00.681255,21.70449854956529,19.88519624404929,1.7270225597554762,Au,PRUNED
1136,-7.518796992480405,2026-04-26 15:31:32.270329,2026-04-26 15:31:32.984951,0 days 00:00:00.714622,25.67311122901029,19.273561881327414,1.7674569701619776,Cu,PRUNED
1137,0.0,2026-04-26 15:31:32.717268,2026-04-26 15:31:33.338966,0 days 00:00:00.621698,20.024255627618125,17.747338788878867,1.5990338772900996,Au,PRUNED
1138,0.0,2026-04-26 15:31:32.765220,2026-04-26 15:31:33.805705,0 days 00:00:01.040485,53.47609520881924,19.572974630447305,1.6268888060562074,Au,PRUNED
1139,-12.422360248446113,2026-04-26 15:31:32.794622,2026-04-26 15:31:33.354268,0 days 00:00:00.559646,51.164548758093446,4.385291509806895,1.8219821307645128,Au,PRUNED
1140,0.0,2026-04-26 15:31:32.832864,2026-04-26 15:31:33.339712,0 days 00:00:00.506848,20.887829610899328,19.535699159705377,1.5152436306091768,Au,PRUNED
1141,0.0,2026-04-26 15:31:32.875140,2026-04-26 15:31:33.387481,0 days 00:00:00.512341,20.257942858168303,19.669690050727585,1.7163823758868153,Au,PRUNED
1142,0.0,2026-04-26 15:31:33.010216,2026-04-26 15:31:33.541875,0 days 00:00:00.531659,43.468502353330024,19.49276834105084,1.0536575271880608,Au,PRUNED
1143,0.0,2026-04-26 15:31:33.040129,2026-04-26 15:31:33.805705,0 days 00:00:00.765576,20.8476414324009,19.51526308673546,1.550342979944972,Au,PRUNED
1144,0.0,2026-04-26 15:31:33.074217,2026-04-26 15:31:33.719305,0 days 00:00:00.645088,39.19545071540834,19.425269552598436,1.2591782001934853,Au,PRUNED
1145,0.0,2026-04-26 15:31:33.451365,2026-04-26 15:31:34.070794,0 days 00:00:00.619429,110.92989271375245,15.090583826489496,1.7435590099673264,Ag,PRUNED
1146,0.0,2026-04-26 15:31:33.483922,2026-04-26 15:31:34.069272,0 days 00:00:00.585350,35.34316230543475,19.10339860802565,1.2268661851136002,Au,PRUNED
1147,0.0,2026-04-26 15:31:33.513672,2026-04-26 15:31:33.945372,0 days 00:00:00.431700,20.02053630416098,18.646064795895494,1.993844563297534,Au,PRUNED
1148,146.1538461538415,2026-04-26 15:31:33.528842,2026-04-26 15:31:34.263618,0 days 00:00:00.734776,26.058811416322794,19.946729970157946,1.3332567182176072,Au,PRUNED
1149,-572.4489795917672,2026-04-26 15:31:33.623200,2026-04-26 15:31:34.125412,0 days 00:00:00.502212,21.119555325642494,19.63031344790167,1.8736348850439108,Au,COMPLETE
1150,0.0,2026-04-26 15:31:33.739090,2026-04-26 15:31:34.336479,0 days 00:00:00.597389,20.84186518416102,19.851757200058103,1.0167334482138686,Au,PRUNED
1151,-528.5714285713698,2026-04-26 15:31:33.905354,2026-04-26 15:31:34.486924,0 days 00:00:00.581570,21.0125102514284,19.731971079335214,1.3181259622841826,Au,COMPLETE
1152,0.0,2026-04-26 15:31:33.963476,2026-04-26 15:31:34.622410,0 days 00:00:00.658934,20.400248505185434,19.52935484322335,1.4175126708109334,Au,PRUNED
1153,-14.285714285712844,2026-04-26 15:31:34.021487,2026-04-26 15:31:34.598142,0 days 00:00:00.576655,23.647412025237664,19.65943994447005,0.5901505536739666,Cu,PRUNED
1154,0.0,2026-04-26 15:31:34.147205,2026-04-26 15:31:34.799899,0 days 00:00:00.652694,36.557455060471526,19.87403802996645,1.858428219221739,Au,PRUNED
1155,-595.4144620810549,2026-04-26 15:31:34.185297,2026-04-26 15:31:34.687937,0 days 00:00:00.502640,21.103383977738506,19.99179416485221,1.7335891701709463,Au,COMPLETE
1156,-1.7564402810304147,2026-04-26 15:31:34.243735,2026-04-26 15:31:34.624436,0 days 00:00:00.380701,112.63338243108956,6.775173273079735,0.5507244333720467,Ag,PRUNED
1157,0.0,2026-04-26 15:31:34.382725,2026-04-26 15:31:35.096969,0 days 00:00:00.714244,20.62170366967928,18.452454299352826,1.2876272769384183,Au,PRUNED
1158,0.0,2026-04-26 15:31:34.416233,2026-04-26 15:31:35.235265,0 days 00:00:00.819032,38.912918682172396,19.799041502932926,1.4791773074178605,Au,PRUNED
1159,-2.285714285714247,2026-04-26 15:31:34.648475,2026-04-26 15:31:35.174147,0 days 00:00:00.525672,91.79841126507878,9.022182609055449,0.8790676852958431,Cu,PRUNED
1160,0.0,2026-04-26 15:31:34.690526,2026-04-26 15:31:35.426412,0 days 00:00:00.735886,20.62935269779725,17.20000593160112,1.6001531020114785,Au,PRUNED
1161,146.1538461538415,2026-04-26 15:31:34.722109,2026-04-26 15:31:35.363723,0 days 00:00:00.641614,25.943995036082036,19.873223476711136,1.6006844002755967,Au,PRUNED
1162,-0.5807200929152049,2026-04-26 15:31:34.780764,2026-04-26 15:31:35.382300,0 days 00:00:00.601536,113.64329110931283,8.623856082169212,1.3380236082151549,Au,PRUNED
1163,0.0,2026-04-26 15:31:34.897160,2026-04-26 15:31:35.409822,0 days 00:00:00.512662,20.03202664441739,19.88453623821957,1.6888463038921853,Au,PRUNED
1164,0.0,2026-04-26 15:31:34.941768,2026-04-26 15:31:35.779848,0 days 00:00:00.838080,41.93834677561516,19.988647620175566,1.6054691685623947,Au,PRUNED
1165,0.0,2026-04-26 15:31:35.308290,2026-04-26 15:31:36.207022,0 days 00:00:00.898732,23.7900664375674,19.90089006005989,1.633344418549727,Au,PRUNED
1166,4.2016806722684095,2026-04-26 15:31:35.326395,2026-04-26 15:31:35.974380,0 days 00:00:00.647985,24.244548027066976,19.848560563056406,1.7176142283742135,Au,PRUNED
1167,0.0,2026-04-26 15:31:35.375353,2026-04-26 15:31:35.953482,0 days 00:00:00.578129,32.04157426469731,19.549065314613657,1.4540444001814992,Au,PRUNED
1168,0.0,2026-04-26 15:31:35.457122,2026-04-26 15:31:36.196779,0 days 00:00:00.739657,40.03893150776859,19.90627483835944,1.6057262284128353,Au,PRUNED
1169,-10.405643738975796,2026-04-26 15:31:35.506214,2026-04-26 15:31:36.185107,0 days 00:00:00.678893,21.15911101287114,19.985496822441057,1.6933423405574246,Au,COMPLETE
1170,-547.5645635828065,2026-04-26 15:31:35.518940,2026-04-26 15:31:35.905534,0 days 00:00:00.386594,21.717783728565305,19.25602891761719,1.5433691433865548,Au,COMPLETE
1171,-17.857142857139866,2026-04-26 15:31:35.583804,2026-04-26 15:31:36.030683,0 days 00:00:00.446879,85.21578881135225,9.285303377898153,0.6689303522283934,Ag,PRUNED
1172,0.0,2026-04-26 15:31:35.879025,2026-04-26 15:31:36.559377,0 days 00:00:00.680352,23.618059470436297,19.88538922249755,1.738072483028269,Au,PRUNED
1173,0.0,2026-04-26 15:31:36.049463,2026-04-26 15:31:36.860145,0 days 00:00:00.810682,27.39702614248091,19.798408555364503,1.5906902869768766,Au,PRUNED
1174,0.0,2026-04-26 15:31:36.107985,2026-04-26 15:31:36.624184,0 days 00:00:00.516199,34.0934517288031,19.729499358389713,1.7508674105180513,Au,PRUNED
1175,0.0,2026-04-26 15:31:36.126195,2026-04-26 15:31:36.795470,0 days 00:00:00.669275,20.31055223283055,16.386355996255844,1.5028403881762,Au,PRUNED
1176,0.0,2026-04-26 15:31:36.156046,2026-04-26 15:31:36.824249,0 days 00:00:00.668203,36.74357228670392,19.976069950986748,1.819676111758323,Au,PRUNED
1177,-6.696428571428148,2026-04-26 15:31:36.228011,2026-04-26 15:31:36.909924,0 days 00:00:00.681913,23.39135794438766,18.682883778454265,1.9861055677030264,Ag,PRUNED
1178,0.0,2026-04-26 15:31:36.349296,2026-04-26 15:31:37.181599,0 days 00:00:00.832303,21.59309512514768,17.202414367066403,1.4893927274178964,Au,PRUNED
1179,7.936507936507047,2026-04-26 15:31:36.458070,2026-04-26 15:31:37.110830,0 days 00:00:00.652760,24.508227423034892,19.98342020913407,1.8107356716298801,Au,PRUNED
1180,0.0,2026-04-26 15:31:36.676370,2026-04-26 15:31:37.445645,0 days 00:00:00.769275,38.14212443138213,17.368260475162593,1.4306215081637879,Au,PRUNED
1181,-8.928571428570304,2026-04-26 15:31:36.710063,2026-04-26 15:31:37.449647,0 days 00:00:00.739584,21.65156077323994,19.84079246109979,1.9132359285697609,Au,PRUNED
1182,140.65934065933618,2026-04-26 15:31:36.922447,2026-04-26 15:31:37.548715,0 days 00:00:00.626268,33.73030557297069,16.965398404644308,1.5127720639165774,Au,PRUNED
1183,0.0,2026-04-26 15:31:36.935075,2026-04-26 15:31:37.644992,0 days 00:00:00.709917,20.653178320345816,16.691918671720792,1.5482262184909028,Au,PRUNED
1184,0.0,2026-04-26 15:31:36.954414,2026-04-26 15:31:37.711143,0 days 00:00:00.756729,20.473661599647855,16.88636584256872,1.616846858712915,Au,PRUNED
1185,0.0,2026-04-26 15:31:36.962564,2026-04-26 15:31:37.743344,0 days 00:00:00.780780,35.36493520791001,19.941640750766815,1.9066849568924575,Au,PRUNED
1186,-9.852216748767784,2026-04-26 15:31:37.182608,2026-04-26 15:31:37.976497,0 days 00:00:00.793889,26.18904810570682,19.59044815102706,1.3169224783746403,Ag,PRUNED
1187,0.0,2026-04-26 15:31:37.348619,2026-04-26 15:31:38.165040,0 days 00:00:00.816421,20.132141345956025,16.902844792995804,1.4154129922619765,Au,PRUNED
1188,0.0,2026-04-26 15:31:37.550222,2026-04-26 15:31:38.193468,0 days 00:00:00.643246,20.40399699504199,18.07804025395593,1.6502592884020675,Au,PRUNED
1189,0.0,2026-04-26 15:31:37.607457,2026-04-26 15:31:38.163986,0 days 00:00:00.556529,36.690079011674214,17.524877170027267,1.58878085625366,Au,PRUNED
1190,0.0,2026-04-26 15:31:37.664855,2026-04-26 15:31:38.290881,0 days 00:00:00.626026,20.096002273629907,19.692404270580717,1.9789224547990791,Au,PRUNED
1191,-584.431345353604,2026-04-26 15:31:37.694640,2026-04-26 15:31:38.166552,0 days 00:00:00.471912,20.928674215461008,19.919266222328506,1.8370165778955863,Au,COMPLETE
1192,-12.987012987010614,2026-04-26 15:31:37.818208,2026-04-26 15:31:38.583189,0 days 00:00:00.764981,33.93375578301172,0.5412052323379175,1.307883025660284,Ag,PRUNED
1193,0.0,2026-04-26 15:31:37.922327,2026-04-26 15:31:38.749584,0 days 00:00:00.827257,20.409717442588224,19.60618125125051,1.900595156612921,Au,PRUNED
1194,0.0,2026-04-26 15:31:38.077182,2026-04-26 15:31:38.696245,0 days 00:00:00.619063,20.04381738991651,19.555515140804538,1.797651406942797,Au,PRUNED
1195,0.0,2026-04-26 15:31:38.262391,2026-04-26 15:31:38.804842,0 days 00:00:00.542451,42.137088966126825,19.7208744997183,1.952701388120858,Au,PRUNED
1196,146.1538461538415,2026-04-26 15:31:38.275110,2026-04-26 15:31:39.012643,0 days 00:00:00.737533,25.87367135506784,19.7615955586137,1.6735396312801358,Au,PRUNED
1197,-8.928571428570304,2026-04-26 15:31:38.316532,2026-04-26 15:31:39.391830,0 days 00:00:01.075298,21.2245441419862,19.845831588078898,1.871311052027491,Au,PRUNED
1198,0.0,2026-04-26 15:31:38.352380,2026-04-26 15:31:39.014658,0 days 00:00:00.662278,35.81323344141692,18.095120548674057,1.6578017617963818,Au,PRUNED
1199,-0.5903187721369436,2026-04-26 15:31:38.437563,2026-04-26 15:31:39.068020,0 days 00:00:00.630457,117.57884314567343,12.85145358531032,0.14852265371731477,Au,PRUNED
1200,-582.3244552057394,2026-04-26 15:31:38.675442,2026-04-26 15:31:39.441588,0 days 00:00:00.766146,21.41556389231678,19.85590228014693,1.4860582815099468,Au,COMPLETE
1201,0.0,2026-04-26 15:31:38.770321,2026-04-26 15:31:39.338925,0 days 00:00:00.568604,20.11171461927932,19.92657169898791,1.8458949551627961,Au,PRUNED
1202,0.0,2026-04-26 15:31:38.822440,2026-04-26 15:31:39.340924,0 days 00:00:00.518484,23.635431527271503,19.671806467463263,1.9869620430501003,Au,PRUNED
1203,0.0,2026-04-26 15:31:38.900748,2026-04-26 15:31:39.561051,0 days 00:00:00.660303,34.730784372533414,19.782510575028365,1.943999117841044,Au,PRUNED
1204,-4.761904761904122,2026-04-26 15:31:39.058077,2026-04-26 15:31:39.702517,0 days 00:00:00.644440,22.787221771323132,19.950497057468404,1.4235847941930193,Au,PRUNED
1205,-4.464285714285152,2026-04-26 15:31:39.085893,2026-04-26 15:31:39.923032,0 days 00:00:00.837139,22.694250424644544,19.755513930056356,1.9950315643847365,Au,PRUNED
1206,0.0,2026-04-26 15:31:39.151253,2026-04-26 15:31:40.002609,0 days 00:00:00.851356,36.0532824834951,17.005224111854865,1.6816466268435575,Au,PRUNED
1207,0.0,2026-04-26 15:31:39.437425,2026-04-26 15:31:40.169618,0 days 00:00:00.732193,34.78158860142382,19.60341747360519,1.3949379299040945,Au,PRUNED
1208,0.0,2026-04-26 15:31:39.516590,2026-04-26 15:31:40.085102,0 days 00:00:00.568512,34.07278537211413,17.63894505171702,1.3931834947664468,Au,PRUNED
