number,value,datetime_start,datetime_complete,duration,params_D2_nm,params_D3_nm,params_D4_nm,params_metal,state
2594,0.0,2026-04-26 15:34:09.202623,2026-04-26 15:34:09.929176,0 days 00:00:00.726553,35.679786219288104,19.847299341909917,1.7556578856553045,Au,PRUNED
2595,0.0,2026-04-26 15:34:09.264615,2026-04-26 15:34:09.857445,0 days 00:00:00.592830,20.49005739270173,17.583515571899156,1.5771900948638191,Au,PRUNED
2596,0.0,2026-04-26 15:34:09.240249,2026-04-26 15:34:09.928635,0 days 00:00:00.688386,35.892742335779786,19.80674017552772,1.8376847198004975,Au,PRUNED
2597,-566.8693009117873,2026-04-26 15:34:09.319244,2026-04-26 15:34:10.020230,0 days 00:00:00.700986,21.271759789055487,19.87996452816427,1.4025452628257766,Au,COMPLETE
2598,-2.279635258358612,2026-04-26 15:34:09.426230,2026-04-26 15:34:09.912910,0 days 00:00:00.486680,88.93451458032985,1.5603591432843373,0.759982698900602,Cu,PRUNED
2599,0.0,2026-04-26 15:34:09.543493,2026-04-26 15:34:10.269553,0 days 00:00:00.726060,20.61294502030767,17.897845434537203,1.7406192591775929,Au,PRUNED
2600,0.0,2026-04-26 15:34:09.871508,2026-04-26 15:34:10.595152,0 days 00:00:00.723644,20.153562881896498,17.39896799926239,1.4809058044908803,Au,PRUNED
2601,0.0,2026-04-26 15:34:09.930460,2026-04-26 15:34:10.610687,0 days 00:00:00.680227,20.770267433974116,16.122321799361952,1.720353807533537,Au,PRUNED
2602,0.0,2026-04-26 15:34:09.994744,2026-04-26 15:34:10.672031,0 days 00:00:00.677287,20.06806202624527,19.87934841189812,1.1517185397594503,Au,PRUNED
2603,0.0,2026-04-26 15:34:10.063724,2026-04-26 15:34:10.643852,0 days 00:00:00.580128,20.207936530814887,16.860135142176876,1.5354905091628535,Au,PRUNED
2604,0.0,2026-04-26 15:34:10.086128,2026-04-26 15:34:10.698717,0 days 00:00:00.612589,20.521914370451434,16.393598759451177,1.7920195928438092,Au,PRUNED
2605,-1.050420168067195,2026-04-26 15:34:10.098436,2026-04-26 15:34:10.699715,0 days 00:00:00.601279,20.867612035568733,3.061486790702011,0.9377270433464125,Cu,PRUNED
2606,0.0,2026-04-26 15:34:10.244739,2026-04-26 15:34:10.949613,0 days 00:00:00.704874,31.867649934311416,17.524471904227603,1.848852883131714,Au,PRUNED
2607,0.0,2026-04-26 15:34:10.383797,2026-04-26 15:34:11.200997,0 days 00:00:00.817200,20.431263450088053,17.52013735718808,1.61066331869976,Au,PRUNED
2608,0.0,2026-04-26 15:34:10.658439,2026-04-26 15:34:11.507641,0 days 00:00:00.849202,46.56003116968384,16.85126088256618,1.5101170463501945,Au,PRUNED
2609,0.0,2026-04-26 15:34:10.772620,2026-04-26 15:34:11.622977,0 days 00:00:00.850357,33.244851765633506,17.359778254656625,1.880438186286515,Au,PRUNED
2610,0.0,2026-04-26 15:34:10.783868,2026-04-26 15:34:11.508642,0 days 00:00:00.724774,20.253041917744536,18.0311820202381,1.7122025774784995,Au,PRUNED
2611,0.0,2026-04-26 15:34:10.702816,2026-04-26 15:34:11.434999,0 days 00:00:00.732183,20.699808406872247,17.961894987010613,1.7186650989287182,Au,PRUNED
2612,3.7593984962402023,2026-04-26 15:34:10.860495,2026-04-26 15:34:11.433944,0 days 00:00:00.573449,28.897798103212786,19.740052232657654,1.4460705398014233,Cu,PRUNED
2613,0.0,2026-04-26 15:34:10.897521,2026-04-26 15:34:11.995727,0 days 00:00:01.098206,20.28797257690846,19.926036586135663,1.7258924709754446,Au,PRUNED
2614,0.0,2026-04-26 15:34:11.060710,2026-04-26 15:34:11.998733,0 days 00:00:00.938023,33.77440459225119,19.843839343411158,1.3807262324919216,Au,PRUNED
2615,-9.523809523808245,2026-04-26 15:34:11.393326,2026-04-26 15:34:12.221360,0 days 00:00:00.828034,22.52812514728308,19.95356471133027,1.4258429102083277,Au,PRUNED
2616,-1.7564402810304147,2026-04-26 15:34:11.538447,2026-04-26 15:34:12.305417,0 days 00:00:00.766970,111.57800844113825,3.333542598523869,0.679457973439713,Ag,PRUNED
2617,-14.880952380951127,2026-04-26 15:34:11.636521,2026-04-26 15:34:12.218300,0 days 00:00:00.581779,39.593023326658425,17.191553307030738,1.1281798480379248,Ag,PRUNED
2618,-9.216589861750549,2026-04-26 15:34:11.658027,2026-04-26 15:34:12.223874,0 days 00:00:00.565847,72.52281101868815,11.950841525800975,0.19418990775878686,Cu,PRUNED
2619,0.0,2026-04-26 15:34:11.674798,2026-04-26 15:34:12.257270,0 days 00:00:00.582472,33.60245480193223,17.99647248687257,1.4507214755588322,Au,PRUNED
2620,0.0,2026-04-26 15:34:11.686169,2026-04-26 15:34:12.222369,0 days 00:00:00.536200,20.024978343728478,17.319645416440306,1.3638302939934401,Au,PRUNED
2621,0.0,2026-04-26 15:34:12.113214,2026-04-26 15:34:12.946539,0 days 00:00:00.833325,20.15231905558432,17.147329456178397,1.7492590769809853,Au,PRUNED
2622,0.0,2026-04-26 15:34:12.152695,2026-04-26 15:34:13.182728,0 days 00:00:01.030033,20.3253786688208,18.02024717552623,1.9613598312202483,Au,PRUNED
2623,-8.928571428570304,2026-04-26 15:34:12.359086,2026-04-26 15:34:13.543533,0 days 00:00:01.184447,21.93951852979972,19.8012790347224,1.478710199705419,Au,PRUNED
2624,0.0,2026-04-26 15:34:12.396564,2026-04-26 15:34:13.792805,0 days 00:00:01.396241,20.218783147009084,17.873341912267712,1.8057311912552882,Au,PRUNED
2625,0.0,2026-04-26 15:34:12.433533,2026-04-26 15:34:13.220224,0 days 00:00:00.786691,27.039869368511923,19.97790047097513,1.7507663812908445,Au,PRUNED
2626,0.0,2026-04-26 15:34:12.448209,2026-04-26 15:34:13.542525,0 days 00:00:01.094316,32.86561490511805,19.9212390218869,1.5593289715826244,Au,PRUNED
2627,0.0,2026-04-26 15:34:12.466555,2026-04-26 15:34:13.440156,0 days 00:00:00.973601,20.169204726750277,19.401852228863923,1.5440141743155213,Au,PRUNED
2628,0.0,2026-04-26 15:34:12.498151,2026-04-26 15:34:13.461304,0 days 00:00:00.963153,44.26972336017487,19.983684265396725,1.7604466604024411,Au,PRUNED
2629,-10.714285714284633,2026-04-26 15:34:13.019335,2026-04-26 15:34:14.411292,0 days 00:00:01.391957,22.36719213267763,19.92782530566415,1.882603197348918,Cu,PRUNED
2630,0.0,2026-04-26 15:34:13.274805,2026-04-26 15:34:14.380346,0 days 00:00:01.105541,20.04620613589542,16.702926410058147,1.5979947906779681,Au,PRUNED
2631,0.0,2026-04-26 15:34:13.393622,2026-04-26 15:34:14.828061,0 days 00:00:01.434439,20.192936433109924,14.696368939818438,1.6156142866630578,Au,PRUNED
2632,-10.582010582009788,2026-04-26 15:34:13.836381,2026-04-26 15:34:14.660908,0 days 00:00:00.824527,56.15938555889152,8.016823650793397,1.9451014170249088,Au,PRUNED
2633,0.0,2026-04-26 15:34:13.856296,2026-04-26 15:34:14.659564,0 days 00:00:00.803268,34.23636027315805,19.844184224898232,1.346189512023781,Au,PRUNED
2634,4.926108374383892,2026-04-26 15:34:13.866403,2026-04-26 15:34:14.662521,0 days 00:00:00.796118,36.53034466394189,14.414342749595795,1.9372735781781454,Au,PRUNED
2635,-543.3441558440936,2026-04-26 15:34:13.883679,2026-04-26 15:34:14.658549,0 days 00:00:00.774870,20.438896509507,19.749399458471583,1.9490611558599178,Au,COMPLETE
2636,0.0,2026-04-26 15:34:13.898277,2026-04-26 15:34:14.661969,0 days 00:00:00.763692,20.580520202288042,17.028146151866757,1.9643210494364678,Au,PRUNED
2637,0.0,2026-04-26 15:34:14.601723,2026-04-26 15:34:15.442776,0 days 00:00:00.841053,40.62489205134733,19.91537992648078,1.6622538776700881,Cu,PRUNED
2638,0.0,2026-04-26 15:34:14.743929,2026-04-26 15:34:15.391611,0 days 00:00:00.647682,34.04202323457141,19.845549802583616,1.6192226637998606,Au,PRUNED
2639,-19.04761904761649,2026-04-26 15:34:14.775177,2026-04-26 15:34:15.578512,0 days 00:00:00.803335,33.24081995125598,19.564585632753534,1.7041845347880715,Ag,PRUNED
2640,141.75824175823726,2026-04-26 15:34:14.819232,2026-04-26 15:34:15.530862,0 days 00:00:00.711630,31.525891487205598,17.384475073656567,1.765648109422703,Au,PRUNED
2641,0.0,2026-04-26 15:34:14.868437,2026-04-26 15:34:15.688480,0 days 00:00:00.820043,31.064246482055587,19.898595150587937,1.7793521583557916,Au,PRUNED
2642,0.0,2026-04-26 15:34:14.881663,2026-04-26 15:34:15.440229,0 days 00:00:00.558566,31.008077325593653,19.96321125399583,1.459535680952693,Au,PRUNED
2643,-4.761904761904122,2026-04-26 15:34:14.943416,2026-04-26 15:34:15.625005,0 days 00:00:00.681589,22.422257313623444,19.966339147824016,1.7163820309549147,Au,PRUNED
2644,-17.85714285714061,2026-04-26 15:34:15.034316,2026-04-26 15:34:15.824637,0 days 00:00:00.790321,33.585489696526494,19.65504466426957,1.7488656721881157,Ag,PRUNED
2645,0.0,2026-04-26 15:34:15.505581,2026-04-26 15:34:16.406909,0 days 00:00:00.901328,34.578557262435524,19.729793590035214,1.9805961891284862,Au,PRUNED
2646,0.0,2026-04-26 15:34:15.483577,2026-04-26 15:34:16.220803,0 days 00:00:00.737226,32.38088532730298,19.799410909447783,1.7060672566162822,Au,PRUNED
2647,0.0,2026-04-26 15:34:15.645463,2026-04-26 15:34:16.332739,0 days 00:00:00.687276,31.602742031390154,19.91019938058117,1.815533365269897,Au,PRUNED
2648,0.0,2026-04-26 15:34:15.675305,2026-04-26 15:34:16.423159,0 days 00:00:00.747854,27.85566836379722,19.947270294239157,1.421069574759694,Au,PRUNED
2649,0.0,2026-04-26 15:34:15.736078,2026-04-26 15:34:16.405895,0 days 00:00:00.669817,20.140999894013408,16.87436884957686,1.5376733064910215,Au,PRUNED
2650,0.0,2026-04-26 15:34:15.775431,2026-04-26 15:34:16.503611,0 days 00:00:00.728180,37.036895861167686,17.189308933589622,1.538817261625324,Au,PRUNED
2651,141.75824175823726,2026-04-26 15:34:15.866532,2026-04-26 15:34:16.550534,0 days 00:00:00.684002,30.296474222016883,17.998873812140186,1.7617326239055238,Au,PRUNED
2652,0.0,2026-04-26 15:34:15.898009,2026-04-26 15:34:16.664753,0 days 00:00:00.766744,31.62178136395566,19.91344888345132,1.7739162473300625,Au,PRUNED
2653,0.0,2026-04-26 15:34:16.370294,2026-04-26 15:34:17.093943,0 days 00:00:00.723649,40.60116645968052,19.869243346783584,1.9828655495340102,Au,PRUNED
2654,0.0,2026-04-26 15:34:16.457004,2026-04-26 15:34:17.169248,0 days 00:00:00.712244,20.19490827736117,19.57814865009301,1.5232936395725445,Au,PRUNED
2655,141.75824175823726,2026-04-26 15:34:16.488999,2026-04-26 15:34:17.193802,0 days 00:00:00.704803,32.44438719802297,17.0186858071996,1.6397573294146925,Au,PRUNED
2656,0.0,2026-04-26 15:34:16.519246,2026-04-26 15:34:17.346709,0 days 00:00:00.827463,34.400461172237215,19.941596430861228,1.210578142296253,Au,PRUNED
2657,0.0,2026-04-26 15:34:16.631191,2026-04-26 15:34:17.932338,0 days 00:00:01.301147,45.91711088729657,17.45833714478333,1.728290913470812,Au,PRUNED
2658,0.0,2026-04-26 15:34:16.662499,2026-04-26 15:34:17.398530,0 days 00:00:00.736031,20.587812217633196,18.394907526809632,1.422494372233345,Au,PRUNED
2659,0.0,2026-04-26 15:34:16.780703,2026-04-26 15:34:17.649305,0 days 00:00:00.868602,34.938356503763124,16.63269045857812,1.9774731314263208,Au,PRUNED
2660,141.75824175823726,2026-04-26 15:34:16.815014,2026-04-26 15:34:17.504105,0 days 00:00:00.689091,31.58141595401569,16.964687059464854,1.9923599956709477,Au,PRUNED
2661,0.0,2026-04-26 15:34:17.196803,2026-04-26 15:34:18.144944,0 days 00:00:00.948141,49.37419158876327,19.83093626839359,1.6991500409785458,Au,PRUNED
2662,0.0,2026-04-26 15:34:17.272234,2026-04-26 15:34:18.192730,0 days 00:00:00.920496,34.35890649539785,19.927431394769787,1.5111906663439925,Au,PRUNED
2663,0.0,2026-04-26 15:34:17.351224,2026-04-26 15:34:18.420585,0 days 00:00:01.069361,34.78461570329435,19.83616344582582,1.8574991671521521,Au,PRUNED
2664,0.0,2026-04-26 15:34:17.731706,2026-04-26 15:34:18.374729,0 days 00:00:00.643023,36.481472917362524,19.798800277222075,1.5551105047608635,Au,PRUNED
2665,-23.8095238095185,2026-04-26 15:34:17.795259,2026-04-26 15:34:18.499439,0 days 00:00:00.704180,82.43492933450752,9.427711762485854,0.18099826138277997,Ag,PRUNED
2666,-1.050420168067195,2026-04-26 15:34:17.825426,2026-04-26 15:34:18.375277,0 days 00:00:00.549851,21.12815409005332,7.836684734754773,1.2784158271542012,Cu,PRUNED
2667,-0.5903187721369436,2026-04-26 15:34:17.872407,2026-04-26 15:34:18.485274,0 days 00:00:00.612867,111.67394736118364,19.954615619098213,0.4477680260851553,Au,PRUNED
2668,-537.3230373229763,2026-04-26 15:34:17.990334,2026-04-26 15:34:18.484274,0 days 00:00:00.493940,21.217377132399612,19.53266748498943,1.4922752368284402,Au,COMPLETE
2669,0.0,2026-04-26 15:34:18.195742,2026-04-26 15:34:19.142817,0 days 00:00:00.947075,20.549383441791754,17.78732703514003,1.7638400027683705,Au,PRUNED
2670,0.0,2026-04-26 15:34:18.314303,2026-04-26 15:34:18.842901,0 days 00:00:00.528598,20.39060746146982,17.76254711020813,1.6175741522750569,Au,PRUNED
2671,2.3041474654376373,2026-04-26 15:34:18.449658,2026-04-26 15:34:19.141779,0 days 00:00:00.692121,55.323455551544924,15.280162651921536,0.5880774288005706,Cu,PRUNED
2672,0.0,2026-04-26 15:34:18.547199,2026-04-26 15:34:19.090104,0 days 00:00:00.542905,22.070921354670062,15.566803745925807,1.990495821418715,Cu,PRUNED
2673,0.0,2026-04-26 15:34:18.589706,2026-04-26 15:34:19.326445,0 days 00:00:00.736739,35.09146301253611,17.42081202672647,1.4771900736266863,Au,PRUNED
2674,0.0,2026-04-26 15:34:18.640836,2026-04-26 15:34:19.447819,0 days 00:00:00.806983,39.89625533854041,17.68312764173345,1.0294188123065924,Au,PRUNED
2675,-0.5760368663594372,2026-04-26 15:34:18.672932,2026-04-26 15:34:19.511176,0 days 00:00:00.838244,119.91365234610032,7.336094870273586,0.9607415967583426,Au,PRUNED
2676,0.0,2026-04-26 15:34:18.725393,2026-04-26 15:34:19.372475,0 days 00:00:00.647082,20.04068213501155,19.69038445483642,1.436317034865011,Cu,PRUNED
2677,0.0,2026-04-26 15:34:18.915021,2026-04-26 15:34:19.629160,0 days 00:00:00.714139,33.3721368358765,17.309471126950903,1.7175869520440845,Au,PRUNED
2678,0.0,2026-04-26 15:34:19.189042,2026-04-26 15:34:19.966395,0 days 00:00:00.777353,20.31031760412402,19.984058441843164,1.5485760767156127,Au,PRUNED
2679,-540.2391725920518,2026-04-26 15:34:19.219422,2026-04-26 15:34:19.965843,0 days 00:00:00.746421,20.150491485494314,19.890741799886268,1.9890133744098508,Au,COMPLETE
2680,-8.928571428570304,2026-04-26 15:34:19.250494,2026-04-26 15:34:19.919727,0 days 00:00:00.669233,21.750180850987114,19.931219495497864,1.5292375501417252,Au,PRUNED
2681,0.0,2026-04-26 15:34:19.482840,2026-04-26 15:34:20.121715,0 days 00:00:00.638875,20.479335032370354,15.833950978191925,0.8681364843620611,Au,PRUNED
2682,0.0,2026-04-26 15:34:19.528509,2026-04-26 15:34:20.168920,0 days 00:00:00.640411,20.67729461589912,19.600444098953155,1.6299313031815552,Au,PRUNED
2683,0.0,2026-04-26 15:34:19.562248,2026-04-26 15:34:20.196692,0 days 00:00:00.634444,20.426185387496144,18.115593536370927,1.082996146569338,Au,PRUNED
2684,0.0,2026-04-26 15:34:19.583525,2026-04-26 15:34:20.407251,0 days 00:00:00.823726,20.317156881238063,18.11163342645287,1.507545274326005,Au,PRUNED
2685,0.0,2026-04-26 15:34:19.661076,2026-04-26 15:34:20.558445,0 days 00:00:00.897369,20.212362799588025,16.8051026184057,1.0519601793769793,Au,PRUNED
2686,0.0,2026-04-26 15:34:20.092198,2026-04-26 15:34:20.742744,0 days 00:00:00.650546,35.59029643861783,19.92009189270025,1.9819359516105604,Au,PRUNED
2687,-571.7687074829255,2026-04-26 15:34:20.105965,2026-04-26 15:34:20.610906,0 days 00:00:00.504941,21.595453978984768,19.747848784421873,1.36777160482006,Au,COMPLETE
2688,-9.523809523808879,2026-04-26 15:34:20.166078,2026-04-26 15:34:20.832247,0 days 00:00:00.666169,34.72984995135941,12.195437772532436,0.20508893732823175,Cu,PRUNED
2689,-13.736263736262668,2026-04-26 15:34:20.278222,2026-04-26 15:34:20.816359,0 days 00:00:00.538137,33.536408417114615,17.56289617793566,1.3343034603398445,Ag,PRUNED
2690,0.0,2026-04-26 15:34:20.333587,2026-04-26 15:34:20.913758,0 days 00:00:00.580171,32.61772673318277,19.925064769943738,1.8242213190125465,Au,PRUNED
2691,-15.87301587301233,2026-04-26 15:34:20.385235,2026-04-26 15:34:20.935925,0 days 00:00:00.550690,85.33704451629443,1.841916896569506,1.532488659895992,Ag,PRUNED
2692,0.0,2026-04-26 15:34:20.464220,2026-04-26 15:34:21.037283,0 days 00:00:00.573063,20.142209259167284,17.526728255726432,1.7894876600508547,Au,PRUNED
2693,-547.8374836172369,2026-04-26 15:34:20.670485,2026-04-26 15:34:21.593455,0 days 00:00:00.922970,21.172676660715616,19.873669940020875,1.2823077616951042,Au,COMPLETE
2694,0.0,2026-04-26 15:34:20.764201,2026-04-26 15:34:21.452713,0 days 00:00:00.688512,34.54096175366748,19.973711723341953,1.332020102295892,Au,PRUNED
2695,143.9560439560394,2026-04-26 15:34:20.888976,2026-04-26 15:34:21.656022,0 days 00:00:00.767046,30.97618075481512,17.043435355353434,1.5840358404874348,Au,PRUNED
2696,0.0,2026-04-26 15:34:20.939142,2026-04-26 15:34:21.672189,0 days 00:00:00.733047,27.771884390919784,19.880160573201284,1.7996151963469533,Au,PRUNED
2697,0.0,2026-04-26 15:34:21.016377,2026-04-26 15:34:21.594465,0 days 00:00:00.578088,36.071043648717094,19.850327551397992,1.7303358933379478,Au,PRUNED
2698,0.0,2026-04-26 15:34:21.086348,2026-04-26 15:34:21.808016,0 days 00:00:00.721668,22.8955267732249,1.7986165884078282,0.45800877442398813,Au,PRUNED
2699,0.0,2026-04-26 15:34:21.105107,2026-04-26 15:34:21.918829,0 days 00:00:00.813722,20.000890388466836,19.741681412067,1.7800611379408402,Au,PRUNED
2700,0.0,2026-04-26 15:34:21.184105,2026-04-26 15:34:21.704873,0 days 00:00:00.520768,33.37023686954511,17.693705614297684,1.2692129772677512,Au,PRUNED
2701,0.0,2026-04-26 15:34:21.549689,2026-04-26 15:34:22.263795,0 days 00:00:00.714106,118.75394456417489,13.055202414919034,0.23308648827987155,Cu,PRUNED
2702,-4.464285714285152,2026-04-26 15:34:21.730409,2026-04-26 15:34:22.485216,0 days 00:00:00.754807,22.943156128303993,19.833727835098145,1.6793681380313539,Au,PRUNED
2703,0.0,2026-04-26 15:34:21.788099,2026-04-26 15:34:22.469283,0 days 00:00:00.681184,47.18061685355046,17.151572203356004,1.416635535495548,Au,PRUNED
2704,7.518796992480405,2026-04-26 15:34:21.828226,2026-04-26 15:34:22.521863,0 days 00:00:00.693637,28.96965977495907,17.06109897101068,1.7797444815285495,Au,PRUNED
2705,0.0,2026-04-26 15:34:21.876443,2026-04-26 15:34:22.605236,0 days 00:00:00.728793,20.174304930188722,14.93906105052681,1.9060111299850675,Au,PRUNED
2706,2.463054187191946,2026-04-26 15:34:21.868183,2026-04-26 15:34:22.666396,0 days 00:00:00.798213,38.51502284886084,14.43185866426278,1.5194452622803816,Au,PRUNED
2707,0.0,2026-04-26 15:34:21.980883,2026-04-26 15:34:22.524373,0 days 00:00:00.543490,38.96525599103157,19.921779536543532,0.8825921607201785,Au,PRUNED
2708,0.0,2026-04-26 15:34:22.109603,2026-04-26 15:34:23.092886,0 days 00:00:00.983283,101.23983400358273,13.984443523348467,0.4646952119847355,Cu,PRUNED
2709,0.0,2026-04-26 15:34:22.428162,2026-04-26 15:34:23.206550,0 days 00:00:00.778388,49.17934529442013,16.979475782168045,1.904052603848728,Au,PRUNED
2710,0.0,2026-04-26 15:34:22.566087,2026-04-26 15:34:23.410941,0 days 00:00:00.844854,47.62504089469007,17.302703911613058,1.9639156840911176,Au,PRUNED
2711,0.0,2026-04-26 15:34:22.576779,2026-04-26 15:34:23.447533,0 days 00:00:00.870754,32.459193701785125,19.94681277915359,1.9992891467972247,Au,PRUNED
2712,0.0,2026-04-26 15:34:22.623819,2026-04-26 15:34:23.508397,0 days 00:00:00.884578,50.376194542061775,19.953948562205976,1.6927844736348372,Au,PRUNED
2713,0.0,2026-04-26 15:34:22.659438,2026-04-26 15:34:23.446522,0 days 00:00:00.787084,116.31096235376052,11.095223153895127,1.462480139674923,Cu,PRUNED
2714,-6.912442396312913,2026-04-26 15:34:22.700712,2026-04-26 15:34:23.696794,0 days 00:00:00.996082,23.372385891926335,19.954678940765827,1.1897089815020978,Ag,PRUNED
2715,3.105590062111528,2026-04-26 15:34:22.767769,2026-04-26 15:34:23.494164,0 days 00:00:00.726395,40.05491818854437,19.99238970960433,1.5329526402952935,Ag,PRUNED
2716,0.0,2026-04-26 15:34:23.144620,2026-04-26 15:34:23.697860,0 days 00:00:00.553240,49.99301687133146,19.861790054796902,1.8060465568532194,Au,PRUNED
2717,0.0,2026-04-26 15:34:23.288185,2026-04-26 15:34:23.967321,0 days 00:00:00.679136,33.349117879555465,19.801523475562252,1.7327522533435642,Au,PRUNED
2718,0.0,2026-04-26 15:34:23.543085,2026-04-26 15:34:24.300329,0 days 00:00:00.757244,20.251315427242947,14.189601891644887,1.6509167600150583,Au,PRUNED
2719,0.0,2026-04-26 15:34:23.575345,2026-04-26 15:34:24.362960,0 days 00:00:00.787615,33.11283408045218,19.942125631692782,1.8673367259886648,Au,PRUNED
2720,0.0,2026-04-26 15:34:23.605620,2026-04-26 15:34:24.394448,0 days 00:00:00.788828,33.13713258843498,18.26646946369167,1.756075159265822,Au,PRUNED
2721,0.0,2026-04-26 15:34:23.635216,2026-04-26 15:34:24.163642,0 days 00:00:00.528426,34.798107294526275,19.829991278952445,1.441060085135185,Au,PRUNED
2722,-16.806722689073638,2026-04-26 15:34:23.685151,2026-04-26 15:34:24.362960,0 days 00:00:00.677809,42.56051249965516,12.386670952223595,1.129153996900803,Ag,PRUNED
2723,0.0,2026-04-26 15:34:23.784252,2026-04-26 15:34:24.548218,0 days 00:00:00.763966,20.54881037885964,16.88362726517763,1.2735061926618323,Au,PRUNED
2724,-8.928571428570304,2026-04-26 15:34:23.832384,2026-04-26 15:34:24.471796,0 days 00:00:00.639412,22.82826115805017,19.95566736082721,0.7967129346836983,Au,PRUNED
2725,-9.523809523808245,2026-04-26 15:34:24.030965,2026-04-26 15:34:24.838978,0 days 00:00:00.808013,21.901650382443215,19.98613525600501,1.8854822356959406,Au,PRUNED
2726,0.0,2026-04-26 15:34:24.322816,2026-04-26 15:34:25.031995,0 days 00:00:00.709179,20.640670059424846,16.878044913138087,1.9785487015391818,Au,PRUNED
2727,-8.928571428570304,2026-04-26 15:34:24.414613,2026-04-26 15:34:24.990357,0 days 00:00:00.575744,22.107503892580187,19.90119447617224,1.2181944889704601,Au,PRUNED
2728,0.0,2026-04-26 15:34:24.476374,2026-04-26 15:34:25.386219,0 days 00:00:00.909845,32.798808294760946,18.011135881317493,1.6733813111954283,Au,PRUNED
2729,-23.80952380951585,2026-04-26 15:34:24.585449,2026-04-26 15:34:25.136453,0 days 00:00:00.551004,52.550299371155816,4.376935371724867,0.8498779208218799,Ag,PRUNED
2730,0.0,2026-04-26 15:34:24.602280,2026-04-26 15:34:25.099434,0 days 00:00:00.497154,20.177982424237374,19.763917673666278,1.5950672230864873,Au,PRUNED
2731,0.0,2026-04-26 15:34:24.621515,2026-04-26 15:34:25.267330,0 days 00:00:00.645815,35.179088746499644,17.433655146842355,1.9889289977519795,Au,PRUNED
2732,0.0,2026-04-26 15:34:24.648107,2026-04-26 15:34:25.224542,0 days 00:00:00.576435,20.39066704414497,17.16393522497412,1.6222544730873054,Au,PRUNED
