number,value,datetime_start,datetime_complete,duration,params_D2_nm,params_D3_nm,params_D4_nm,params_metal,state
262,-54.511278195453144,2026-04-26 15:30:09.064306,2026-04-26 15:30:09.575512,0 days 00:00:00.511206,62.92617347636893,1.0405956152780884,0.11490293984024932,Ag,COMPLETE
263,-55.23809523805816,2026-04-26 15:30:09.127931,2026-04-26 15:30:09.628042,0 days 00:00:00.500111,66.95771262903698,1.0186763260640121,0.2107482034339263,Ag,COMPLETE
264,-55.77299412912029,2026-04-26 15:30:09.156851,2026-04-26 15:30:09.789223,0 days 00:00:00.632372,68.09903819084357,0.8812441514631582,0.1450718544819207,Ag,COMPLETE
265,-50.89285714282513,2026-04-26 15:30:09.175434,2026-04-26 15:30:09.714255,0 days 00:00:00.538821,77.16832632242604,0.857955672682163,0.22074610139994194,Ag,COMPLETE
266,-43.31306990879154,2026-04-26 15:30:09.204857,2026-04-26 15:30:09.687273,0 days 00:00:00.482416,51.027311652325636,0.5922749361474724,0.12822228064428415,Ag,COMPLETE
267,-53.57142857139311,2026-04-26 15:30:09.236597,2026-04-26 15:30:09.671731,0 days 00:00:00.435134,74.38256983548534,0.6116097812627054,0.27107313251486603,Ag,COMPLETE
268,-46.03174603172023,2026-04-26 15:30:09.485421,2026-04-26 15:30:10.165478,0 days 00:00:00.680057,55.885870744530735,1.6898128471666938,0.18450544205691075,Ag,COMPLETE
269,-54.28571428567808,2026-04-26 15:30:09.682970,2026-04-26 15:30:10.306323,0 days 00:00:00.623353,62.51365306504626,0.8544806598136983,0.15390106804724935,Ag,COMPLETE
270,-51.393728222965066,2026-04-26 15:30:09.715256,2026-04-26 15:30:10.399641,0 days 00:00:00.684385,64.43077312577601,1.9731438419702432,0.2269289449994225,Ag,COMPLETE
271,-45.2380952380702,2026-04-26 15:30:09.809315,2026-04-26 15:30:10.375332,0 days 00:00:00.566017,54.90515484260766,0.9634044903719213,0.30672490994384266,Ag,COMPLETE
272,-14.285714285712368,2026-04-26 15:30:09.860679,2026-04-26 15:30:10.373987,0 days 00:00:00.513308,73.25268224523417,0.7925877215921626,0.45151611003802594,Cu,PRUNED
273,-52.44122965638617,2026-04-26 15:30:09.871184,2026-04-26 15:30:10.279766,0 days 00:00:00.408582,64.84905017907113,1.5586556237217926,0.17400324452785249,Ag,COMPLETE
274,-20.40816326530027,2026-04-26 15:30:09.923876,2026-04-26 15:30:10.495186,0 days 00:00:00.571310,51.57749382933848,5.685685893453008,0.1360602141867186,Ag,PRUNED
275,-33.368091762240184,2026-04-26 15:30:09.890193,2026-04-26 15:30:10.400163,0 days 00:00:00.509970,52.02004173091305,5.545621586218572,0.23412061777508436,Ag,COMPLETE
276,-16.806722689073638,2026-04-26 15:30:10.343718,2026-04-26 15:30:10.851657,0 days 00:00:00.507939,88.95736064921492,1.4867681430653432,0.26465938654388504,Au,PRUNED
277,-49.053356282242305,2026-04-26 15:30:10.443733,2026-04-26 15:30:11.075140,0 days 00:00:00.631407,55.457395825308325,0.777389080933553,0.10694489183624317,Ag,COMPLETE
278,-49.00332225910753,2026-04-26 15:30:10.512283,2026-04-26 15:30:10.995183,0 days 00:00:00.482900,59.47904919167908,1.946505307431352,0.2090930818582431,Ag,COMPLETE
279,-51.78571428568156,2026-04-26 15:30:10.540185,2026-04-26 15:30:11.070085,0 days 00:00:00.529900,75.90694859946883,1.4441742316167538,0.12641444761136741,Ag,COMPLETE
280,-53.8033395175907,2026-04-26 15:30:10.560198,2026-04-26 15:30:11.209714,0 days 00:00:00.649516,71.21201896967446,1.4737998298123671,0.14729649904251516,Ag,COMPLETE
281,-52.19780219776829,2026-04-26 15:30:10.576269,2026-04-26 15:30:11.147497,0 days 00:00:00.571228,59.7022306222361,0.7332647104162178,0.17985985153557574,Ag,COMPLETE
282,-15.306122448977392,2026-04-26 15:30:10.618181,2026-04-26 15:30:11.069038,0 days 00:00:00.450857,82.62638585754613,1.4797291947828524,0.2389357860600842,Au,PRUNED
283,-17.857142857139866,2026-04-26 15:30:10.646392,2026-04-26 15:30:11.178762,0 days 00:00:00.532370,67.7033255149146,1.380210580537096,0.20072089285159123,Au,PRUNED
284,-55.01930501926762,2026-04-26 15:30:11.010780,2026-04-26 15:30:11.676459,0 days 00:00:00.665679,70.90607500625214,0.8296503103634061,0.21863913959856074,Ag,COMPLETE
285,-2.329192546583798,2026-04-26 15:30:11.175382,2026-04-26 15:30:11.864307,0 days 00:00:00.688925,99.67258227446271,2.531291023625683,0.44109830321815297,Ag,PRUNED
286,-1.4285714285713986,2026-04-26 15:30:11.226144,2026-04-26 15:30:11.833861,0 days 00:00:00.607717,102.55599736487011,0.9758927612570909,0.5997832563431802,Ag,PRUNED
287,-55.01930501926796,2026-04-26 15:30:11.257549,2026-04-26 15:30:12.035086,0 days 00:00:00.777537,74.14514036415987,0.8453522818027346,0.12317009352644562,Ag,COMPLETE
288,-55.77299412912056,2026-04-26 15:30:11.276163,2026-04-26 15:30:11.862184,0 days 00:00:00.586021,66.80209947776687,0.7265289074008032,0.23017813507827733,Ag,COMPLETE
289,-2.463054187192031,2026-04-26 15:30:11.316123,2026-04-26 15:30:11.773847,0 days 00:00:00.457724,96.26758506915593,0.5173614174593597,0.33892890165156025,Ag,PRUNED
290,-2.6954177897573084,2026-04-26 15:30:11.307792,2026-04-26 15:30:11.864307,0 days 00:00:00.556515,95.51133065147849,0.6030818551093099,0.3084510368050165,Ag,PRUNED
291,-52.197802197768844,2026-04-26 15:30:11.390186,2026-04-26 15:30:11.988809,0 days 00:00:00.598623,75.82358269641153,0.6435329128311771,0.3363569825341258,Ag,COMPLETE
292,-52.87569573280392,2026-04-26 15:30:11.808113,2026-04-26 15:30:12.347173,0 days 00:00:00.539060,62.206930874994164,0.8099933953532232,0.24887199901052715,Ag,COMPLETE
293,-54.79452054790749,2026-04-26 15:30:11.911373,2026-04-26 15:30:12.409132,0 days 00:00:00.497759,63.77488869918569,0.6099719892318483,0.1321220424319382,Ag,COMPLETE
294,-46.26623376620729,2026-04-26 15:30:11.961039,2026-04-26 15:30:12.456343,0 days 00:00:00.495304,81.81481579586954,0.9841519988843037,0.10735131224863803,Ag,COMPLETE
295,-54.05405405401748,2026-04-26 15:30:12.005654,2026-04-26 15:30:12.456343,0 days 00:00:00.450689,71.27033708464717,0.5363691597552189,0.26600262612166176,Ag,COMPLETE
296,-54.285714285678004,2026-04-26 15:30:12.053679,2026-04-26 15:30:12.950939,0 days 00:00:00.897260,67.14901323178182,1.255919788778709,0.1521024005707678,Ag,COMPLETE
297,-53.57142857139344,2026-04-26 15:30:12.086634,2026-04-26 15:30:12.531365,0 days 00:00:00.444731,63.3650226004533,1.2013158223628881,0.13307097993239186,Ag,COMPLETE
298,-36.55793025870338,2026-04-26 15:30:12.113655,2026-04-26 15:30:12.583843,0 days 00:00:00.470188,80.90819417288421,5.627819604974589,0.11858953986936221,Ag,COMPLETE
299,-54.28571428567808,2026-04-26 15:30:12.190389,2026-04-26 15:30:12.706424,0 days 00:00:00.516035,72.5214315509655,1.2475359332532299,0.10433583847705802,Ag,COMPLETE
300,-40.90909090907239,2026-04-26 15:30:12.582835,2026-04-26 15:30:13.092740,0 days 00:00:00.509905,57.99672401389957,4.980980761366109,0.11688328257386793,Ag,COMPLETE
301,-47.11246200605375,2026-04-26 15:30:12.627963,2026-04-26 15:30:13.091699,0 days 00:00:00.463736,61.565023600839965,3.621696700504489,0.1315087659139862,Ag,COMPLETE
302,-42.20779220777296,2026-04-26 15:30:12.653931,2026-04-26 15:30:13.530736,0 days 00:00:00.876805,63.086768257428226,5.395222431911954,0.23045966815545232,Ag,COMPLETE
303,-55.01930501926762,2026-04-26 15:30:12.720077,2026-04-26 15:30:13.279556,0 days 00:00:00.559479,62.080615599523576,0.6079883704326328,0.14807371004398365,Ag,COMPLETE
304,-53.8033395175907,2026-04-26 15:30:12.762266,2026-04-26 15:30:13.376175,0 days 00:00:00.613909,62.46935998289513,1.168389779563984,0.13895561450527108,Ag,COMPLETE
305,-51.393728222964974,2026-04-26 15:30:12.804794,2026-04-26 15:30:13.575386,0 days 00:00:00.770592,68.81168532422157,2.514361930989045,0.11171728057336351,Ag,COMPLETE
306,-46.79802955662307,2026-04-26 15:30:12.854015,2026-04-26 15:30:13.450648,0 days 00:00:00.596633,54.53605383065135,0.9349895245225046,0.12775030019528538,Ag,COMPLETE
307,-51.53707052437967,2026-04-26 15:30:13.138022,2026-04-26 15:30:13.733628,0 days 00:00:00.595606,58.58124425956113,0.5921457164193688,0.19810152029401923,Ag,COMPLETE
308,-16.483516483513935,2026-04-26 15:30:13.330999,2026-04-26 15:30:13.833376,0 days 00:00:00.502377,56.30284722255549,1.2448049571668247,0.10285474613483053,Cu,PRUNED
309,-55.77299412912029,2026-04-26 15:30:13.340716,2026-04-26 15:30:13.835420,0 days 00:00:00.494704,73.12271930354493,0.6625441414869099,0.17793878819468772,Ag,COMPLETE
310,-52.44122965638586,2026-04-26 15:30:13.469363,2026-04-26 15:30:14.026413,0 days 00:00:00.557050,61.814413322834945,1.4457763536210149,0.1140798366522612,Ag,COMPLETE
311,-49.05335628224239,2026-04-26 15:30:13.599375,2026-04-26 15:30:13.995019,0 days 00:00:00.395644,57.70844520688931,0.8643499995044305,0.26757556717693043,Ag,COMPLETE
312,-55.01930501926736,2026-04-26 15:30:13.627904,2026-04-26 15:30:14.291777,0 days 00:00:00.663873,64.3573831397293,0.9043280924778785,0.1340103313160684,Ag,COMPLETE
313,-6.493506493505897,2026-04-26 15:30:13.735134,2026-04-26 15:30:14.337595,0 days 00:00:00.602461,81.40753228520987,0.7450059220567372,0.16231278259518642,Cu,PRUNED
314,-45.74638844299168,2026-04-26 15:30:13.813246,2026-04-26 15:30:14.186109,0 days 00:00:00.372863,54.18898636910191,1.1519534945727603,0.1016444414845714,Ag,COMPLETE
315,-52.44122965638617,2026-04-26 15:30:13.866411,2026-04-26 15:30:14.432058,0 days 00:00:00.565647,62.75405838463571,1.4342206732421707,0.14426522715679457,Ag,COMPLETE
316,-16.483516483513935,2026-04-26 15:30:13.939121,2026-04-26 15:30:14.525416,0 days 00:00:00.586295,32.04044924702185,1.5046289854308172,0.17756520793037722,Ag,PRUNED
317,-55.0193050192677,2026-04-26 15:30:13.963077,2026-04-26 15:30:14.571012,0 days 00:00:00.607935,71.23200754577428,0.5164442218720441,0.3150981351077726,Ag,COMPLETE
318,-55.77299412912022,2026-04-26 15:30:14.148427,2026-04-26 15:30:14.714586,0 days 00:00:00.566159,67.88073891755882,0.7951544690648192,0.1501342112394836,Ag,COMPLETE
319,-53.57142857139311,2026-04-26 15:30:14.186109,2026-04-26 15:30:14.698196,0 days 00:00:00.512087,72.28435554963922,1.026836214767966,0.2131115698828552,Ag,COMPLETE
320,-50.52264808359262,2026-04-26 15:30:14.323766,2026-04-26 15:30:15.113452,0 days 00:00:00.789686,76.79503448397926,1.6065129155493516,0.1382742046556673,Ag,COMPLETE
321,-48.19277108430817,2026-04-26 15:30:14.476667,2026-04-26 15:30:15.281892,0 days 00:00:00.805225,79.92296596824279,0.5228281055885677,0.20796235974992294,Ag,COMPLETE
322,-20.40816326530027,2026-04-26 15:30:14.434060,2026-04-26 15:30:15.160725,0 days 00:00:00.726665,84.01376484549044,5.1764201044718225,0.12063775796571782,Ag,PRUNED
323,-50.632911392372854,2026-04-26 15:30:14.620336,2026-04-26 15:30:15.035192,0 days 00:00:00.414856,78.23593068570231,0.5018625029565907,0.19389426694501674,Ag,COMPLETE
324,-43.00291545187319,2026-04-26 15:30:14.660271,2026-04-26 15:30:15.068412,0 days 00:00:00.408141,83.15832152276836,1.6507192798436123,0.11560461704594985,Ag,COMPLETE
325,-42.452830188659156,2026-04-26 15:30:14.773344,2026-04-26 15:30:15.437331,0 days 00:00:00.663987,75.92916196082855,4.399035964355614,0.2939672148708054,Ag,COMPLETE
326,-17.857142857139866,2026-04-26 15:30:14.805860,2026-04-26 15:30:15.397650,0 days 00:00:00.591790,90.26012177836981,4.538709503243902,0.2570232334259706,Ag,PRUNED
327,-55.01930501926796,2026-04-26 15:30:14.830182,2026-04-26 15:30:15.280395,0 days 00:00:00.450213,68.39469854646558,1.2041376682228235,0.1091302460958411,Ag,COMPLETE
328,-52.875695732804246,2026-04-26 15:30:15.261085,2026-04-26 15:30:15.790149,0 days 00:00:00.529064,62.96150823555788,1.1191542236457934,0.16013831360527556,Ag,COMPLETE
329,-52.197802197768766,2026-04-26 15:30:15.331065,2026-04-26 15:30:15.862425,0 days 00:00:00.531360,59.97852714684658,0.8104416573912232,0.20493402395861848,Ag,COMPLETE
330,-52.197802197768844,2026-04-26 15:30:15.364593,2026-04-26 15:30:15.962667,0 days 00:00:00.598074,77.382293425355,0.8786511881268005,0.12855694659541794,Ag,COMPLETE
331,-53.57142857139344,2026-04-26 15:30:15.417428,2026-04-26 15:30:15.676292,0 days 00:00:00.258864,76.65277794798213,0.7116684128942605,0.11432793872230221,Ag,COMPLETE
332,-13.392857142855457,2026-04-26 15:30:15.401151,2026-04-26 15:30:15.956136,0 days 00:00:00.554985,47.020399099005836,0.6214064561486844,0.3806059685742179,Au,PRUNED
333,-47.342192691002474,2026-04-26 15:30:15.516486,2026-04-26 15:30:16.310065,0 days 00:00:00.793579,55.53421152571719,0.5991419008255066,0.36283189424291196,Ag,COMPLETE
334,-53.57142857139311,2026-04-26 15:30:15.544858,2026-04-26 15:30:16.163271,0 days 00:00:00.618413,64.48586200431902,1.3034964461519023,0.11400508948114044,Ag,COMPLETE
335,-55.98455598451783,2026-04-26 15:30:15.556931,2026-04-26 15:30:15.989256,0 days 00:00:00.432325,65.54923933907365,0.8661844382936128,0.16361777668802452,Ag,COMPLETE
336,-47.34219269100218,2026-04-26 15:30:15.819426,2026-04-26 15:30:16.453608,0 days 00:00:00.634182,57.04790278950976,0.681619880544292,0.4419705804448444,Ag,COMPLETE
337,-50.42016806719708,2026-04-26 15:30:16.030360,2026-04-26 15:30:16.609206,0 days 00:00:00.578846,68.14964129896302,2.8627973927108443,0.10748783197455757,Ag,COMPLETE
338,-43.39118825098121,2026-04-26 15:30:16.054354,2026-04-26 15:30:16.624811,0 days 00:00:00.570457,66.89396450136148,5.62668807485243,0.12008023328912185,Ag,COMPLETE
339,-17.85714285714061,2026-04-26 15:30:16.092398,2026-04-26 15:30:16.738049,0 days 00:00:00.645651,68.61167205034447,4.368137594132374,0.10413982791713028,Cu,PRUNED
340,-45.65537555225928,2026-04-26 15:30:16.160754,2026-04-26 15:30:16.687228,0 days 00:00:00.526474,74.30731530595274,4.1099784612705825,0.11131395265523814,Ag,COMPLETE
341,-20.40816326530027,2026-04-26 15:30:16.234951,2026-04-26 15:30:16.737545,0 days 00:00:00.502594,47.41918653592436,3.2778933243291046,0.1347894975493772,Ag,PRUNED
342,-42.85714285712236,2026-04-26 15:30:16.371564,2026-04-26 15:30:16.959937,0 days 00:00:00.588373,63.95169963900305,4.542289090386616,0.35633212794004965,Ag,COMPLETE
343,-40.10025062654879,2026-04-26 15:30:16.331406,2026-04-26 15:30:17.316296,0 days 00:00:00.984890,75.94690429971095,4.531528030695128,0.4745746029531677,Ag,COMPLETE
344,-38.74092009683573,2026-04-26 15:30:16.643866,2026-04-26 15:30:17.145091,0 days 00:00:00.501225,77.66323439373329,4.495565308573731,0.5031878431749592,Ag,COMPLETE
345,-14.285714285712368,2026-04-26 15:30:16.740056,2026-04-26 15:30:17.315789,0 days 00:00:00.575733,55.77461802888072,1.8184292133322943,0.12766585366819883,Au,PRUNED
346,-54.28571428567775,2026-04-26 15:30:16.842152,2026-04-26 15:30:17.373135,0 days 00:00:00.530983,62.70537475311631,0.9394729425082415,0.10044322611497267,Ag,COMPLETE
347,-51.53707052437935,2026-04-26 15:30:16.861199,2026-04-26 15:30:17.271583,0 days 00:00:00.410384,62.63007655208537,0.5204148828507817,0.4845618170338411,Ag,COMPLETE
348,-56.54761904757955,2026-04-26 15:30:16.876203,2026-04-26 15:30:17.423805,0 days 00:00:00.547602,72.76341966613893,0.6174776875761081,0.11258174772035927,Ag,COMPLETE
349,-17.857142857139866,2026-04-26 15:30:16.907182,2026-04-26 15:30:17.422798,0 days 00:00:00.515616,65.97267285806842,0.5735717839377873,0.19430846076241376,Au,PRUNED
350,-51.53707052437967,2026-04-26 15:30:17.069263,2026-04-26 15:30:17.644835,0 days 00:00:00.575572,58.34792390781213,0.601629873596683,0.17927090571990123,Ag,COMPLETE
351,-55.019305019268224,2026-04-26 15:30:17.191796,2026-04-26 15:30:17.710444,0 days 00:00:00.518648,63.26120343642471,0.683921881169799,0.12098157807927452,Ag,COMPLETE
352,-27.93040293039387,2026-04-26 15:30:17.387298,2026-04-26 15:30:17.887399,0 days 00:00:00.500101,44.86382142372709,3.573158784774594,0.3602297981873888,Ag,COMPLETE
353,-55.23809523805823,2026-04-26 15:30:17.460914,2026-04-26 15:30:18.053682,0 days 00:00:00.592768,67.9935477013693,0.6348428446092385,0.3581062763133295,Ag,COMPLETE
354,-55.0193050192677,2026-04-26 15:30:17.485260,2026-04-26 15:30:18.012723,0 days 00:00:00.527463,72.21941090413415,0.775214222291234,0.23167920063409236,Ag,COMPLETE
355,-55.77299412911995,2026-04-26 15:30:17.553058,2026-04-26 15:30:17.975514,0 days 00:00:00.422456,66.3876989839673,0.6631248417963029,0.2140954602594755,Ag,COMPLETE
356,-53.80333951758979,2026-04-26 15:30:17.609049,2026-04-26 15:30:18.012723,0 days 00:00:00.403674,71.39585219449482,1.5967319460320097,0.11595930527223533,Ag,COMPLETE
357,-52.875695732804246,2026-04-26 15:30:17.662963,2026-04-26 15:30:18.146965,0 days 00:00:00.484002,64.22192929287823,1.3118945949552678,0.13657780933839603,Ag,COMPLETE
358,-20.40816326530027,2026-04-26 15:30:17.782069,2026-04-26 15:30:18.505912,0 days 00:00:00.723843,87.01284184453881,2.277715641376385,0.5052413354731227,Ag,PRUNED
359,-52.63157894733374,2026-04-26 15:30:17.839949,2026-04-26 15:30:18.459637,0 days 00:00:00.619688,60.70386767356901,0.6048383647969858,0.20612585361157765,Ag,COMPLETE
360,-55.77299412912029,2026-04-26 15:30:18.107923,2026-04-26 15:30:18.583057,0 days 00:00:00.475134,73.60777181388235,0.502683629436554,0.17467502485734854,Ag,COMPLETE
361,-50.52264808359262,2026-04-26 15:30:18.121275,2026-04-26 15:30:18.629246,0 days 00:00:00.507971,76.162638631082,0.8090371728969157,0.4193393891937823,Ag,COMPLETE
362,-42.56854256852124,2026-04-26 15:30:18.146965,2026-04-26 15:30:18.616077,0 days 00:00:00.469112,80.28065817322546,2.124525000775042,0.3750872757140673,Ag,COMPLETE
363,-41.20879120877136,2026-04-26 15:30:18.182491,2026-04-26 15:30:18.740781,0 days 00:00:00.558290,79.28513510982219,2.683979856885824,0.454589703059464,Ag,COMPLETE
364,-44.554455445522414,2026-04-26 15:30:18.208927,2026-04-26 15:30:18.939762,0 days 00:00:00.730835,73.14254998118611,3.793294904465931,0.4315152014503685,Ag,COMPLETE
365,-43.89880952378675,2026-04-26 15:30:18.310686,2026-04-26 15:30:18.976531,0 days 00:00:00.665845,79.44370054938416,1.761205601599096,0.41651134313447286,Ag,COMPLETE
366,-52.87569573280392,2026-04-26 15:30:18.617096,2026-04-26 15:30:19.172339,0 days 00:00:00.555243,72.4007371658618,0.5678056638122911,0.46788856034365084,Ag,COMPLETE
367,-43.15476190473965,2026-04-26 15:30:18.655362,2026-04-26 15:30:19.229209,0 days 00:00:00.573847,83.51118070924738,0.727705299735249,0.23874274732400633,Ag,COMPLETE
368,-23.80952380951585,2026-04-26 15:30:18.719620,2026-04-26 15:30:19.297358,0 days 00:00:00.577738,87.41057437374212,1.4645334158366827,0.14070280636691354,Ag,PRUNED
369,-47.88961038958328,2026-04-26 15:30:18.769373,2026-04-26 15:30:19.473965,0 days 00:00:00.704592,74.87423276846373,1.6388033472693393,0.5087566561989982,Ag,COMPLETE
370,-46.31083202509202,2026-04-26 15:30:18.820800,2026-04-26 15:30:19.327175,0 days 00:00:00.506375,77.4164785342428,1.3092015740731608,0.5888314277246451,Ag,COMPLETE
371,-16.483516483513935,2026-04-26 15:30:18.866498,2026-04-26 15:30:19.704352,0 days 00:00:00.837854,60.7451242288261,0.8587706233766361,0.4645704983693867,Cu,PRUNED
372,-23.8095238095185,2026-04-26 15:30:19.086071,2026-04-26 15:30:19.626197,0 days 00:00:00.540126,88.97843311125109,2.14415103591025,0.13120749227338277,Ag,PRUNED
373,-45.9183673469156,2026-04-26 15:30:19.175447,2026-04-26 15:30:19.999639,0 days 00:00:00.824192,64.81654983154,4.632459818729085,0.11352009897739139,Ag,COMPLETE
374,-55.77299412912056,2026-04-26 15:30:19.332205,2026-04-26 15:30:20.063582,0 days 00:00:00.731377,71.373184731773,0.8631881877674474,0.12477205701090563,Ag,COMPLETE
375,-49.31972789112706,2026-04-26 15:30:19.379772,2026-04-26 15:30:20.157319,0 days 00:00:00.777547,80.45289043625658,1.0074007018262843,0.10662470404133306,Ag,COMPLETE
376,-47.368421052606564,2026-04-26 15:30:19.392859,2026-04-26 15:30:20.016388,0 days 00:00:00.623529,72.08054372601137,4.198861094658117,0.12147694708527756,Ag,COMPLETE
377,-50.89285714282513,2026-04-26 15:30:19.504416,2026-04-26 15:30:20.201889,0 days 00:00:00.697473,59.51687565753072,0.6750556540411699,0.3661364250179931,Ag,COMPLETE
378,-44.117647058801985,2026-04-26 15:30:19.585178,2026-04-26 15:30:20.158319,0 days 00:00:00.573141,61.448410229955755,4.608203550848209,0.1489293648362841,Ag,COMPLETE
379,-55.23809523805857,2026-04-26 15:30:19.788264,2026-04-26 15:30:20.414487,0 days 00:00:00.626223,68.73688041721465,0.7990859764987057,0.32075039247249854,Ag,COMPLETE
380,-45.45454545451958,2026-04-26 15:30:19.871214,2026-04-26 15:30:20.412480,0 days 00:00:00.541266,82.60700160186853,0.5069840942205763,0.11452831634735516,Ag,COMPLETE
381,-55.01930501926796,2026-04-26 15:30:20.121785,2026-04-26 15:30:20.677020,0 days 00:00:00.555235,72.20948268116031,1.0100454480711885,0.1267294180783008,Ag,COMPLETE
382,-54.5112781954528,2026-04-26 15:30:20.173834,2026-04-26 15:30:20.718709,0 days 00:00:00.544875,74.38288876217217,0.9136930925904287,0.18895352365806686,Ag,COMPLETE
383,-52.87569573280449,2026-04-26 15:30:20.267216,2026-04-26 15:30:20.813259,0 days 00:00:00.546043,76.9543111140113,0.5096545529272933,0.17372094935984678,Ag,COMPLETE
384,-48.192771084308376,2026-04-26 15:30:20.360139,2026-04-26 15:30:20.866375,0 days 00:00:00.506236,80.77561195281908,0.519255933338351,0.1368184559368674,Ag,COMPLETE
385,-44.254658385068936,2026-04-26 15:30:20.416554,2026-04-26 15:30:20.900224,0 days 00:00:00.483670,54.48165142373233,0.5545318474807979,0.5788838154062327,Ag,COMPLETE
386,-49.91394148017653,2026-04-26 15:30:20.543851,2026-04-26 15:30:21.156602,0 days 00:00:00.612751,68.21055414394067,1.3635786363258324,0.5303448297256423,Ag,COMPLETE
387,-54.28571428567808,2026-04-26 15:30:20.565300,2026-04-26 15:30:21.311185,0 days 00:00:00.745885,72.13080060168238,0.7495169482870467,0.25519398659532533,Ag,COMPLETE
388,-48.73949579829101,2026-04-26 15:30:20.626361,2026-04-26 15:30:21.467267,0 days 00:00:00.840906,63.82558686357538,1.470105379538499,0.5415799103237843,Ag,COMPLETE
389,-43.68932038832807,2026-04-26 15:30:20.873070,2026-04-26 15:30:21.569562,0 days 00:00:00.696492,67.32974069504796,4.319123951466809,0.431176556347057,Ag,COMPLETE
390,-47.360248447179046,2026-04-26 15:30:20.931370,2026-04-26 15:30:21.436628,0 days 00:00:00.505258,65.67837609225376,2.7604566266319464,0.5244741092903207,Ag,COMPLETE
391,-41.84704184702049,2026-04-26 15:30:21.001448,2026-04-26 15:30:21.639763,0 days 00:00:00.638315,81.8874305789847,0.9360906085040483,0.5179856125216888,Ag,COMPLETE
