number,value,datetime_start,datetime_complete,duration,params_D2_nm,params_D3_nm,params_D4_nm,params_metal,state
1486,0.0,2026-04-26 15:32:08.379085,2026-04-26 15:32:09.054262,0 days 00:00:00.675177,94.67473127535939,19.12952034203152,0.2271199220722545,Ag,PRUNED
1487,-4.464285714285152,2026-04-26 15:32:08.343083,2026-04-26 15:32:09.408312,0 days 00:00:01.065229,22.76655605204055,19.85912743443721,1.8045999719927293,Au,PRUNED
1488,0.0,2026-04-26 15:32:08.579008,2026-04-26 15:32:09.190150,0 days 00:00:00.611142,56.047949431698754,19.888964339991063,1.6766563112247292,Au,PRUNED
1489,-8.403361344536819,2026-04-26 15:32:08.803509,2026-04-26 15:32:09.449590,0 days 00:00:00.646081,21.13983342957363,19.740687752753903,1.9629617460069,Au,PRUNED
1490,0.0,2026-04-26 15:32:08.878090,2026-04-26 15:32:09.655618,0 days 00:00:00.777528,20.950518833735934,19.004210075797,1.4988781907881537,Au,PRUNED
1491,0.0,2026-04-26 15:32:09.035176,2026-04-26 15:32:09.749337,0 days 00:00:00.714161,20.038264177718034,19.770649785265004,1.809840976651325,Au,PRUNED
1492,0.0,2026-04-26 15:32:09.116709,2026-04-26 15:32:09.954596,0 days 00:00:00.837887,20.14771986378883,19.761343904996924,1.8756726977641207,Au,PRUNED
1493,-1.0660980810234213,2026-04-26 15:32:09.080171,2026-04-26 15:32:09.955596,0 days 00:00:00.875425,20.15697420614753,17.56908645252133,1.1820832641850951,Ag,PRUNED
1494,12.09677419354818,2026-04-26 15:32:09.312160,2026-04-26 15:32:10.140624,0 days 00:00:00.828464,114.20945104650484,7.995117672181316,0.7210195049178897,Cu,PRUNED
1495,5.494505494505066,2026-04-26 15:32:09.478974,2026-04-26 15:32:10.293351,0 days 00:00:00.814377,49.12846326944557,19.77791425766286,1.9258847861745958,Ag,PRUNED
1496,0.0,2026-04-26 15:32:09.547633,2026-04-26 15:32:10.200060,0 days 00:00:00.652427,20.25634401511614,18.025539982537435,1.7130391880547176,Au,PRUNED
1497,-11.904761904760901,2026-04-26 15:32:09.626287,2026-04-26 15:32:10.533587,0 days 00:00:00.907300,47.04508815947261,9.71437787346639,0.2651853424029954,Cu,PRUNED
1498,139.56043956043513,2026-04-26 15:32:09.751618,2026-04-26 15:32:10.612124,0 days 00:00:00.860506,34.17748134547931,16.622118550797985,1.6394645303228381,Au,PRUNED
1499,0.0,2026-04-26 15:32:09.916445,2026-04-26 15:32:10.568453,0 days 00:00:00.652008,20.754691923862488,17.93700496783937,1.6819482313594771,Au,PRUNED
1500,-8.928571428570304,2026-04-26 15:32:10.093224,2026-04-26 15:32:10.760379,0 days 00:00:00.667155,22.186452651092896,19.89645768052342,1.5549724871022168,Au,PRUNED
1501,0.0,2026-04-26 15:32:10.130429,2026-04-26 15:32:11.044793,0 days 00:00:00.914364,33.07846011510938,17.521614407948835,1.637393847745994,Au,PRUNED
1502,0.0,2026-04-26 15:32:10.282224,2026-04-26 15:32:10.977889,0 days 00:00:00.695665,29.601303896283525,19.82445101037961,1.6469104677958994,Au,PRUNED
1503,0.0,2026-04-26 15:32:10.342088,2026-04-26 15:32:11.193776,0 days 00:00:00.851688,34.38495181580909,19.870754430499627,1.6848825416397948,Au,PRUNED
1504,-555.8501823002339,2026-04-26 15:32:10.403053,2026-04-26 15:32:11.043784,0 days 00:00:00.640731,21.208629945821116,19.606430619442666,1.6437323098550969,Au,COMPLETE
1505,141.75824175823726,2026-04-26 15:32:10.638052,2026-04-26 15:32:11.315747,0 days 00:00:00.677695,32.084640950632775,17.073792777927057,1.6332462194971895,Au,PRUNED
1506,0.0,2026-04-26 15:32:10.687479,2026-04-26 15:32:11.571452,0 days 00:00:00.883973,20.186527465269123,18.967287637000005,1.5358060595397764,Au,PRUNED
1507,0.0,2026-04-26 15:32:10.859022,2026-04-26 15:32:11.525186,0 days 00:00:00.666164,20.821631800043196,17.9560187260257,1.5909776389718426,Au,PRUNED
1508,0.0,2026-04-26 15:32:10.849380,2026-04-26 15:32:11.599874,0 days 00:00:00.750494,36.073871351621314,16.87068834775983,1.7026233793140828,Au,PRUNED
1509,-558.441558441493,2026-04-26 15:32:11.097417,2026-04-26 15:32:11.773824,0 days 00:00:00.676407,20.96609498987585,19.905135143268495,1.5406005454932128,Au,COMPLETE
1510,0.0,2026-04-26 15:32:11.125090,2026-04-26 15:32:11.904349,0 days 00:00:00.779259,36.080172910048574,19.238533236904626,1.4301802868193763,Au,PRUNED
1511,0.0,2026-04-26 15:32:11.218948,2026-04-26 15:32:11.918437,0 days 00:00:00.699489,20.073651231412946,19.8154816503604,1.7682581538692548,Au,PRUNED
1512,142.8571428571383,2026-04-26 15:32:11.352686,2026-04-26 15:32:12.346316,0 days 00:00:00.993630,31.28182862707454,17.093710337764623,1.5684431109723336,Au,PRUNED
1513,0.0,2026-04-26 15:32:11.448685,2026-04-26 15:32:12.299332,0 days 00:00:00.850647,34.26678149831261,19.9279765962859,1.543883807596775,Au,PRUNED
1514,0.0,2026-04-26 15:32:11.643475,2026-04-26 15:32:12.253987,0 days 00:00:00.610512,39.28065057860522,16.811256972612654,1.4681132443775895,Au,PRUNED
1515,0.0,2026-04-26 15:32:11.682727,2026-04-26 15:32:12.457343,0 days 00:00:00.774616,35.15607588602693,17.677819917094247,1.4481739004576952,Au,PRUNED
1516,0.0,2026-04-26 15:32:11.821620,2026-04-26 15:32:12.474764,0 days 00:00:00.653144,29.03052248841039,19.988461770450346,1.6130465821920998,Au,PRUNED
1517,0.0,2026-04-26 15:32:11.970385,2026-04-26 15:32:12.664876,0 days 00:00:00.694491,30.65872999195936,19.92215822782543,1.5269746999725111,Au,PRUNED
1518,-4.464285714285152,2026-04-26 15:32:12.026145,2026-04-26 15:32:12.663733,0 days 00:00:00.637588,23.30329599750515,19.80490615725118,1.4883540587720485,Au,PRUNED
1519,0.0,2026-04-26 15:32:11.992676,2026-04-26 15:32:12.619242,0 days 00:00:00.626566,42.05869727556271,19.839311077982696,1.3789948752753833,Au,PRUNED
1520,0.0,2026-04-26 15:32:12.322484,2026-04-26 15:32:13.176528,0 days 00:00:00.854044,29.8634630800862,19.871570024252794,1.2651918347021058,Au,PRUNED
1521,0.0,2026-04-26 15:32:12.381850,2026-04-26 15:32:13.442464,0 days 00:00:01.060614,20.373656273027414,16.516193846254716,1.4204456544171349,Au,PRUNED
1522,3.571428571428211,2026-04-26 15:32:12.522279,2026-04-26 15:32:13.096627,0 days 00:00:00.574348,30.826579614612704,16.78175513224744,1.6039299041676953,Au,PRUNED
1523,4.464285714285152,2026-04-26 15:32:12.571601,2026-04-26 15:32:13.107010,0 days 00:00:00.535409,24.35703158160527,19.891425814201924,1.3904078148159729,Au,PRUNED
1524,0.0,2026-04-26 15:32:12.616212,2026-04-26 15:32:13.229949,0 days 00:00:00.613737,20.545058480300522,15.775323382866056,1.3810258109246623,Au,PRUNED
1525,0.0,2026-04-26 15:32:12.725264,2026-04-26 15:32:13.392233,0 days 00:00:00.666969,24.273822837986106,19.71166786666144,1.4580101520385804,Au,PRUNED
1526,-1.0660980810234213,2026-04-26 15:32:12.771653,2026-04-26 15:32:13.553489,0 days 00:00:00.781836,21.3922883413436,15.16707127048657,1.9023273568106047,Ag,PRUNED
1527,0.0,2026-04-26 15:32:12.806640,2026-04-26 15:32:13.677215,0 days 00:00:00.870575,20.447516166513736,19.861962317572413,1.4285946900503321,Au,PRUNED
1528,0.0,2026-04-26 15:32:13.212261,2026-04-26 15:32:13.912194,0 days 00:00:00.699933,20.136126195665454,16.95623856668758,1.3172893098613014,Au,PRUNED
1529,0.0,2026-04-26 15:32:13.232465,2026-04-26 15:32:13.768235,0 days 00:00:00.535770,21.420448563306824,16.57652811286605,1.4814511134610595,Au,PRUNED
1530,8.403361344536819,2026-04-26 15:32:13.286101,2026-04-26 15:32:14.053377,0 days 00:00:00.767276,24.6757469784123,19.95296659175648,1.591609139513623,Au,PRUNED
1531,0.0,2026-04-26 15:32:13.352614,2026-04-26 15:32:14.112121,0 days 00:00:00.759507,23.29743677015799,19.90123208191056,1.60155671934227,Au,PRUNED
1532,146.1538461538415,2026-04-26 15:32:13.492615,2026-04-26 15:32:14.173167,0 days 00:00:00.680552,26.39688979391292,19.55456334583821,1.3981473910354056,Au,PRUNED
1533,0.0,2026-04-26 15:32:13.587589,2026-04-26 15:32:14.329164,0 days 00:00:00.741575,20.68990219416557,17.43680685038674,1.4272429833138365,Au,PRUNED
1534,0.0,2026-04-26 15:32:13.619303,2026-04-26 15:32:14.342238,0 days 00:00:00.722935,29.529675239707075,19.89224543423593,1.4707483086405957,Au,PRUNED
1535,-19.480519480517692,2026-04-26 15:32:13.744589,2026-04-26 15:32:14.623979,0 days 00:00:00.879390,48.99171817776995,17.10606575445554,1.5582067529338415,Ag,PRUNED
1536,0.0,2026-04-26 15:32:13.956656,2026-04-26 15:32:14.625523,0 days 00:00:00.668867,34.97849394912908,19.44844102811367,1.6335264597432606,Au,PRUNED
1537,0.0,2026-04-26 15:32:14.036260,2026-04-26 15:32:14.730639,0 days 00:00:00.694379,34.64404490796623,19.894558526815953,1.6887071860187226,Au,PRUNED
1538,-12.605042016805228,2026-04-26 15:32:14.113736,2026-04-26 15:32:14.672591,0 days 00:00:00.558855,21.480072629682837,19.908015013007837,1.496819475781984,Au,PRUNED
1539,-13.736263736262668,2026-04-26 15:32:14.175241,2026-04-26 15:32:15.026512,0 days 00:00:00.851271,32.150536470833224,18.678137588698604,1.447647278573546,Ag,PRUNED
1540,-11.428571428570503,2026-04-26 15:32:14.260863,2026-04-26 15:32:15.070618,0 days 00:00:00.809755,50.28016167983747,8.052934533347559,1.5940148933996068,Cu,PRUNED
1541,-9.852216748767784,2026-04-26 15:32:14.382635,2026-04-26 15:32:14.930574,0 days 00:00:00.547939,27.451561048298124,19.320433944603323,1.5025817632293537,Ag,PRUNED
1542,0.0,2026-04-26 15:32:14.406789,2026-04-26 15:32:15.085311,0 days 00:00:00.678522,20.565220678665742,19.786740277874667,1.5493637532995557,Au,PRUNED
1543,0.0,2026-04-26 15:32:14.681392,2026-04-26 15:32:15.375498,0 days 00:00:00.694106,20.04740895435042,17.46899196209465,1.6426802765390491,Au,PRUNED
1544,-0.5903187721369436,2026-04-26 15:32:14.682959,2026-04-26 15:32:15.400296,0 days 00:00:00.717337,82.44114274575789,14.188116897703953,1.3963482971528678,Au,PRUNED
1545,0.0,2026-04-26 15:32:14.713869,2026-04-26 15:32:15.554839,0 days 00:00:00.840970,35.12171634712698,17.182514591043446,1.4339117748398273,Au,PRUNED
1546,-7.936507936507342,2026-04-26 15:32:14.859277,2026-04-26 15:32:15.757617,0 days 00:00:00.898340,58.60983527245591,13.041528762382974,0.8722063033538825,Cu,PRUNED
1547,0.0,2026-04-26 15:32:15.016350,2026-04-26 15:32:15.802516,0 days 00:00:00.786166,20.65828604346943,19.9258203794908,1.8315246320199932,Ag,PRUNED
1548,5.291005291004894,2026-04-26 15:32:15.161012,2026-04-26 15:32:15.803521,0 days 00:00:00.642509,31.067879394790474,16.8357742514549,1.632981311416519,Au,PRUNED
1549,0.0,2026-04-26 15:32:15.258960,2026-04-26 15:32:16.036201,0 days 00:00:00.777241,20.209453403940742,19.989486146772748,1.587086695093735,Au,PRUNED
1550,-577.6098901098202,2026-04-26 15:32:15.320639,2026-04-26 15:32:16.052569,0 days 00:00:00.731930,21.233102167611722,19.919341649782304,1.5069112012992287,Au,COMPLETE
1551,0.0,2026-04-26 15:32:15.407927,2026-04-26 15:32:16.145966,0 days 00:00:00.738039,20.143246092379055,16.337448912910933,1.4851896042803463,Au,PRUNED
1552,0.0,2026-04-26 15:32:15.586113,2026-04-26 15:32:16.304586,0 days 00:00:00.718473,23.4742463650291,19.868286073082693,1.569326088528167,Au,PRUNED
1553,-3.9682539682535234,2026-04-26 15:32:15.621225,2026-04-26 15:32:16.234148,0 days 00:00:00.612923,25.703156937577877,17.531521436613513,1.6800829770512635,Au,PRUNED
1554,0.0,2026-04-26 15:32:15.835510,2026-04-26 15:32:16.720405,0 days 00:00:00.884895,37.61653458318886,17.949665988975234,1.4356549623272317,Au,PRUNED
1555,-582.497405741887,2026-04-26 15:32:15.940671,2026-04-26 15:32:16.762916,0 days 00:00:00.822245,21.200839957766657,19.94133998858801,1.5691611135256256,Au,COMPLETE
1556,-1.3869625520110673,2026-04-26 15:32:15.958553,2026-04-26 15:32:16.718885,0 days 00:00:00.760332,60.38797150377199,18.840202957219724,1.403261942406177,Au,PRUNED
1557,0.0,2026-04-26 15:32:16.181058,2026-04-26 15:32:16.824510,0 days 00:00:00.643452,29.242170068147495,19.957012475810078,1.3133959142515228,Au,PRUNED
1558,0.0,2026-04-26 15:32:16.210875,2026-04-26 15:32:16.919168,0 days 00:00:00.708293,58.241270916964964,19.606172687068618,1.441250225613999,Au,PRUNED
1559,0.0,2026-04-26 15:32:16.278866,2026-04-26 15:32:16.986114,0 days 00:00:00.707248,37.15846251820392,17.64362577255257,1.399259210940383,Au,PRUNED
1560,140.65934065933618,2026-04-26 15:32:16.315188,2026-04-26 15:32:16.799515,0 days 00:00:00.484327,32.867198333813064,17.35495750700563,1.4086615285317514,Au,PRUNED
1561,-13.736263736262668,2026-04-26 15:32:16.369065,2026-04-26 15:32:17.124563,0 days 00:00:00.755498,57.077135897965576,8.174110176403845,1.306400486491517,Au,PRUNED
1562,0.0,2026-04-26 15:32:16.794140,2026-04-26 15:32:17.649443,0 days 00:00:00.855303,20.822122116717452,17.532276031816913,1.4928410628132105,Au,PRUNED
1563,0.0,2026-04-26 15:32:16.842579,2026-04-26 15:32:17.651279,0 days 00:00:00.808700,37.262436940667065,19.927043315909,1.55848650438337,Au,PRUNED
1564,0.0,2026-04-26 15:32:16.986114,2026-04-26 15:32:17.651279,0 days 00:00:00.665165,21.48879180938798,17.13031408386294,1.568404564122149,Au,PRUNED
1565,-12.605042016805228,2026-04-26 15:32:16.999962,2026-04-26 15:32:17.946797,0 days 00:00:00.946835,21.74298204497975,19.684208706673,1.399964732639295,Au,PRUNED
1566,-8.928571428570304,2026-04-26 15:32:17.046302,2026-04-26 15:32:17.884151,0 days 00:00:00.837849,22.11684794737829,19.59140804672901,1.6043293057564523,Au,PRUNED
1567,0.0,2026-04-26 15:32:17.139534,2026-04-26 15:32:17.980401,0 days 00:00:00.840867,37.67294110233769,17.746144280780516,1.4533126848036666,Au,PRUNED
1568,-541.3022351797238,2026-04-26 15:32:17.197472,2026-04-26 15:32:17.729847,0 days 00:00:00.532375,20.50199200849194,19.889855167618197,1.709017310677463,Au,COMPLETE
1569,-545.6621004565586,2026-04-26 15:32:17.188815,2026-04-26 15:32:17.806123,0 days 00:00:00.617308,21.549956558509574,19.47202125864036,1.4045167359319746,Au,COMPLETE
1570,0.0,2026-04-26 15:32:17.745056,2026-04-26 15:32:18.473787,0 days 00:00:00.728731,38.07270669434685,18.54906983379457,1.476952764024571,Au,PRUNED
1571,-8.928571428570304,2026-04-26 15:32:17.776891,2026-04-26 15:32:18.296274,0 days 00:00:00.519383,22.25483056418443,19.937096295745093,1.2306522014333445,Au,PRUNED
1572,-0.5903187721369436,2026-04-26 15:32:17.831534,2026-04-26 15:32:18.739438,0 days 00:00:00.907904,108.8920283307946,12.81999844922692,0.7890114645293718,Au,PRUNED
1573,0.0,2026-04-26 15:32:17.902552,2026-04-26 15:32:18.691404,0 days 00:00:00.788852,35.7342813352347,19.979709087265174,1.3594940442646446,Au,PRUNED
1574,0.0,2026-04-26 15:32:17.981400,2026-04-26 15:32:18.840187,0 days 00:00:00.858787,38.209631037565686,17.917665299881428,1.637566091858464,Au,PRUNED
1575,0.0,2026-04-26 15:32:18.026362,2026-04-26 15:32:18.596523,0 days 00:00:00.570161,38.36379961407371,19.618470143075694,1.3986010483495213,Au,PRUNED
1576,-28.571428571422828,2026-04-26 15:32:18.073889,2026-04-26 15:32:18.657568,0 days 00:00:00.583679,70.04843772768247,12.746595096997318,0.24720990297619294,Ag,PRUNED
1577,-10.714285714284633,2026-04-26 15:32:18.164078,2026-04-26 15:32:18.958953,0 days 00:00:00.794875,22.606503119329123,19.793891896573818,1.302176703768865,Cu,PRUNED
1578,-12.605042016805228,2026-04-26 15:32:18.372201,2026-04-26 15:32:19.441455,0 days 00:00:01.069254,21.766115874576897,19.823648706065168,1.335264232876852,Au,PRUNED
1579,0.0,2026-04-26 15:32:18.554862,2026-04-26 15:32:19.441455,0 days 00:00:00.886593,21.88450490743292,17.153984989753933,1.4925959747724802,Au,PRUNED
1580,0.0,2026-04-26 15:32:18.709645,2026-04-26 15:32:19.299946,0 days 00:00:00.590301,20.544238347212872,18.340524676904145,1.4467701136831201,Cu,PRUNED
1581,3.9682539682535234,2026-04-26 15:32:18.777428,2026-04-26 15:32:19.283840,0 days 00:00:00.506412,28.628195742434748,16.887960721291872,1.6302796818842809,Au,PRUNED
1582,0.0,2026-04-26 15:32:18.805474,2026-04-26 15:32:19.674593,0 days 00:00:00.869119,31.925243602093616,19.9667371669089,1.730929875367256,Au,PRUNED
1583,0.0,2026-04-26 15:32:18.883795,2026-04-26 15:32:19.648571,0 days 00:00:00.764776,20.40897205771096,16.25334299239073,1.7418513178325021,Au,PRUNED
1584,0.0,2026-04-26 15:32:18.914329,2026-04-26 15:32:19.717552,0 days 00:00:00.803223,29.994664398072565,19.923608064436273,1.333525614169308,Au,PRUNED
1585,-4.9603174603173175,2026-04-26 15:32:19.075365,2026-04-26 15:32:19.782509,0 days 00:00:00.707144,83.40043625234793,14.780146067104809,1.9518915155671643,Ag,PRUNED
1586,0.0,2026-04-26 15:32:19.405736,2026-04-26 15:32:20.271864,0 days 00:00:00.866128,20.047603884365728,16.77729042432021,1.6725695548050283,Au,PRUNED
1587,0.0,2026-04-26 15:32:19.551311,2026-04-26 15:32:20.294974,0 days 00:00:00.743663,20.45456326409409,16.834366417861535,1.5224754329870227,Au,PRUNED
1588,-4.464285714285152,2026-04-26 15:32:19.575309,2026-04-26 15:32:20.295983,0 days 00:00:00.720674,23.087421132218857,19.90480162687567,1.5188760026027173,Au,PRUNED
1589,0.0,2026-04-26 15:32:19.645574,2026-04-26 15:32:20.610014,0 days 00:00:00.964440,21.54152427987167,17.729727327084625,1.5595824974316164,Au,PRUNED
1590,-8.928571428570304,2026-04-26 15:32:19.755426,2026-04-26 15:32:20.374020,0 days 00:00:00.618594,21.714720151873408,19.766295222000327,1.5845011614050826,Au,PRUNED
1591,0.0,2026-04-26 15:32:19.785025,2026-04-26 15:32:20.553878,0 days 00:00:00.768853,36.4598442683754,19.774500630711852,1.484890100910051,Au,PRUNED
1592,-8.403361344536819,2026-04-26 15:32:19.846546,2026-04-26 15:32:20.500595,0 days 00:00:00.654049,22.38908416978873,19.569581002040657,1.5687128983151961,Au,PRUNED
1593,0.0,2026-04-26 15:32:19.990153,2026-04-26 15:32:20.717425,0 days 00:00:00.727272,23.691907348484378,19.898479721759617,1.5250488433411782,Au,PRUNED
1594,0.0,2026-04-26 15:32:20.327962,2026-04-26 15:32:21.165890,0 days 00:00:00.837928,52.78474289382798,16.874326322154364,1.6456754852894477,Au,PRUNED
1595,0.0,2026-04-26 15:32:20.415842,2026-04-26 15:32:21.135680,0 days 00:00:00.719838,20.781825419582184,16.066724548358643,1.2585005026846674,Au,PRUNED
1596,0.0,2026-04-26 15:32:20.454046,2026-04-26 15:32:21.152328,0 days 00:00:00.698282,35.69679723895791,19.323140582914288,1.5594985988250767,Au,PRUNED
1597,0.0,2026-04-26 15:32:20.641711,2026-04-26 15:32:21.363807,0 days 00:00:00.722096,38.52699265350251,17.028462211548288,1.6703893513525558,Au,PRUNED
1598,0.0,2026-04-26 15:32:20.672745,2026-04-26 15:32:21.805624,0 days 00:00:01.132879,35.07364663697489,17.328335261139934,1.5971744948997606,Au,PRUNED
1599,0.0,2026-04-26 15:32:20.730840,2026-04-26 15:32:21.434955,0 days 00:00:00.704115,20.5979477822242,19.18833435887989,1.672640329832734,Au,PRUNED
1600,0.0,2026-04-26 15:32:20.763662,2026-04-26 15:32:21.500466,0 days 00:00:00.736804,34.72946535185059,17.149001517515153,1.7243595610551774,Au,PRUNED
1601,0.0,2026-04-26 15:32:20.786447,2026-04-26 15:32:21.254763,0 days 00:00:00.468316,20.242057755719443,17.071714221875993,1.7702112190538424,Au,PRUNED
1602,0.0,2026-04-26 15:32:21.240721,2026-04-26 15:32:21.996401,0 days 00:00:00.755680,20.349793606154492,18.13378512892022,1.490217280484769,Au,PRUNED
1603,-8.928571428570304,2026-04-26 15:32:21.256763,2026-04-26 15:32:21.993740,0 days 00:00:00.736977,22.30550019817693,19.89534185090469,1.6439361217256656,Au,PRUNED
1604,7.518796992480405,2026-04-26 15:32:21.325279,2026-04-26 15:32:21.963864,0 days 00:00:00.638585,32.32392628460377,16.402419172039366,1.1737513979098748,Au,PRUNED
1605,0.0,2026-04-26 15:32:21.366318,2026-04-26 15:32:22.088991,0 days 00:00:00.722673,43.26326652547158,19.89819448396912,1.4816087349337532,Au,PRUNED
1606,0.0,2026-04-26 15:32:21.452532,2026-04-26 15:32:22.088991,0 days 00:00:00.636459,37.24136525883702,19.738046803178552,1.6764221034370084,Au,PRUNED
1607,0.0,2026-04-26 15:32:21.547107,2026-04-26 15:32:22.305350,0 days 00:00:00.758243,36.647161747892724,17.31379753576962,1.1605899200619685,Au,PRUNED
1608,0.0,2026-04-26 15:32:21.578321,2026-04-26 15:32:22.371276,0 days 00:00:00.792955,34.49186764721553,19.75441308747157,1.7719753457608425,Au,PRUNED
1609,-8.928571428570304,2026-04-26 15:32:21.897004,2026-04-26 15:32:22.677161,0 days 00:00:00.780157,22.54174141711959,19.911167538069236,1.4544778693821725,Au,PRUNED
1610,0.0,2026-04-26 15:32:22.067507,2026-04-26 15:32:22.964302,0 days 00:00:00.896795,33.25497683365913,17.406141825803243,1.717023260740317,Au,PRUNED
1611,0.0,2026-04-26 15:32:22.110808,2026-04-26 15:32:22.612026,0 days 00:00:00.501218,35.6206692938892,19.94725573329814,1.8320282807428006,Au,PRUNED
1612,0.0,2026-04-26 15:32:22.166912,2026-04-26 15:32:23.188050,0 days 00:00:01.021138,35.60532920270386,19.642008016063432,1.2562660655325515,Au,PRUNED
1613,0.0,2026-04-26 15:32:22.198160,2026-04-26 15:32:22.676133,0 days 00:00:00.477973,29.822525870426965,19.93326606944469,1.616368143382459,Au,PRUNED
1614,0.0,2026-04-26 15:32:22.276319,2026-04-26 15:32:22.916585,0 days 00:00:00.640266,35.446581256876954,19.902833745191582,1.7083293146779108,Au,PRUNED
1615,-11.904761904760573,2026-04-26 15:32:22.371276,2026-04-26 15:32:23.149796,0 days 00:00:00.778520,21.677009594737978,19.526708623761586,1.6019233031218811,Au,PRUNED
1616,0.0,2026-04-26 15:32:22.438993,2026-04-26 15:32:23.076437,0 days 00:00:00.637444,35.587357226366464,19.887828609215962,1.4635807323928238,Au,PRUNED
1617,0.0,2026-04-26 15:32:22.694191,2026-04-26 15:32:23.849605,0 days 00:00:01.155414,119.1495273243548,16.907760605889834,1.9780423611992703,Cu,PRUNED
1618,-0.5580357142857051,2026-04-26 15:32:22.802272,2026-04-26 15:32:23.414672,0 days 00:00:00.612400,75.33658645286577,15.305903595429395,0.31577389702700176,Cu,PRUNED
1619,5.291005291004894,2026-04-26 15:32:22.869307,2026-04-26 15:32:23.682516,0 days 00:00:00.813209,31.60954934201052,16.825192563291907,1.354339350689868,Au,PRUNED
1620,0.0,2026-04-26 15:32:23.010278,2026-04-26 15:32:23.837797,0 days 00:00:00.827519,34.119821454424816,19.76458858537532,1.5633899980320476,Au,PRUNED
1621,-1.050420168067195,2026-04-26 15:32:23.024829,2026-04-26 15:32:23.729928,0 days 00:00:00.705099,20.117057665248232,8.947185636768442,1.7152440784781193,Cu,PRUNED
1622,0.0,2026-04-26 15:32:23.128623,2026-04-26 15:32:23.663498,0 days 00:00:00.534875,20.000998112474356,17.42071188220125,1.7078645639440428,Au,PRUNED
1623,0.0,2026-04-26 15:32:23.214788,2026-04-26 15:32:23.929813,0 days 00:00:00.715025,32.05685959742446,17.57904640665307,1.719475286383295,Au,PRUNED
