number,value,datetime_start,datetime_complete,duration,params_D2_nm,params_D3_nm,params_D4_nm,params_metal,state
1348,7.142857142856422,2026-04-26 15:31:53.452378,2026-04-26 15:31:54.066407,0 days 00:00:00.614029,29.130236801392027,17.354489245772093,1.9737032512124566,Au,PRUNED
1349,0.0,2026-04-26 15:31:53.510162,2026-04-26 15:31:54.347166,0 days 00:00:00.837004,44.396684206383455,19.96056163972129,1.9187857881678725,Au,PRUNED
1350,-4.464285714285152,2026-04-26 15:31:53.530771,2026-04-26 15:31:54.158212,0 days 00:00:00.627441,22.506992198414498,19.811916791376493,1.8640347018150898,Au,PRUNED
1351,-4.464285714285152,2026-04-26 15:31:53.539708,2026-04-26 15:31:54.392845,0 days 00:00:00.853137,22.27415678139662,19.98482186152937,1.9273482834898472,Au,PRUNED
1352,0.0,2026-04-26 15:31:53.879623,2026-04-26 15:31:54.609880,0 days 00:00:00.730257,21.105647762237183,17.275797746613208,1.993192171123646,Au,PRUNED
1353,37.87878787878727,2026-04-26 15:31:53.948215,2026-04-26 15:31:54.641520,0 days 00:00:00.693305,64.60201366357221,14.271894927480535,1.5026847371106593,Cu,PRUNED
1354,0.0,2026-04-26 15:31:53.976750,2026-04-26 15:31:54.671003,0 days 00:00:00.694253,20.09280004712559,16.78114659323044,1.637950627460802,Au,PRUNED
1355,-555.6844547563153,2026-04-26 15:31:54.128482,2026-04-26 15:31:54.906413,0 days 00:00:00.777931,20.96995885990576,19.80013551126674,1.6180749643307042,Au,COMPLETE
1356,0.0,2026-04-26 15:31:54.179313,2026-04-26 15:31:54.920592,0 days 00:00:00.741279,43.589075730005554,19.258400262207875,1.9634644159524417,Au,PRUNED
1357,0.0,2026-04-26 15:31:54.242946,2026-04-26 15:31:54.905405,0 days 00:00:00.662459,27.580768605678134,19.890948978435453,1.9311127377487387,Au,PRUNED
1358,0.0,2026-04-26 15:31:54.407569,2026-04-26 15:31:55.044312,0 days 00:00:00.636743,37.8344511153838,19.909433548286692,1.956860433941687,Au,PRUNED
1359,0.0,2026-04-26 15:31:54.472009,2026-04-26 15:31:55.449285,0 days 00:00:00.977276,20.094375617879834,16.40493047219705,1.9836174730626102,Au,PRUNED
1360,0.0,2026-04-26 15:31:54.669440,2026-04-26 15:31:55.510831,0 days 00:00:00.841391,20.26338569103007,19.562583173726612,1.7578532826161175,Au,PRUNED
1361,-480.17492711365287,2026-04-26 15:31:54.802222,2026-04-26 15:31:55.792073,0 days 00:00:00.989851,22.16902137956343,17.62000484498148,1.9569318002057705,Au,COMPLETE
1362,0.0,2026-04-26 15:31:54.834054,2026-04-26 15:31:55.418949,0 days 00:00:00.584895,37.03807907067812,19.86626490562016,1.9545392782080209,Au,PRUNED
1363,147.25274725274258,2026-04-26 15:31:55.003353,2026-04-26 15:31:55.668309,0 days 00:00:00.664956,24.945776183702538,19.859593688704738,1.9794101045822605,Au,PRUNED
1364,0.0,2026-04-26 15:31:55.059821,2026-04-26 15:31:55.698744,0 days 00:00:00.638923,36.57963056418948,19.98358923432439,1.816040479832625,Au,PRUNED
1365,0.0,2026-04-26 15:31:55.139206,2026-04-26 15:31:55.697174,0 days 00:00:00.557968,21.55016554984071,16.630048451216275,1.7439859761790482,Au,PRUNED
1366,0.0,2026-04-26 15:31:55.241796,2026-04-26 15:31:56.100847,0 days 00:00:00.859051,20.650478463274677,17.530388443404767,1.6887404855016235,Au,PRUNED
1367,-524.0717432346802,2026-04-26 15:31:55.621542,2026-04-26 15:31:56.241925,0 days 00:00:00.620383,20.85661133715045,19.45178155656708,1.684898605965991,Au,COMPLETE
1368,-589.0674118057258,2026-04-26 15:31:55.620820,2026-04-26 15:31:56.397615,0 days 00:00:00.776795,21.061682641950377,19.906117587588405,1.7913280608407602,Au,COMPLETE
1369,136.26373626373194,2026-04-26 15:31:55.739258,2026-04-26 15:31:56.453304,0 days 00:00:00.714046,37.170619407063505,18.801677822176085,1.952558336716252,Cu,PRUNED
1370,-13.392857142855457,2026-04-26 15:31:55.792073,2026-04-26 15:31:56.543211,0 days 00:00:00.751138,56.12496804205572,0.6773343251904258,1.9985210331802081,Cu,PRUNED
1371,4.2016806722684095,2026-04-26 15:31:55.826616,2026-04-26 15:31:56.411578,0 days 00:00:00.584962,24.053667985526868,19.586338132369693,1.9864243201222345,Au,PRUNED
1372,-8.928571428570304,2026-04-26 15:31:55.891633,2026-04-26 15:31:56.542210,0 days 00:00:00.650577,21.206651013496245,19.914018230759954,1.9633429868233916,Au,PRUNED
1373,0.0,2026-04-26 15:31:55.998515,2026-04-26 15:31:56.569534,0 days 00:00:00.571019,30.894312705294734,19.83390858651437,1.9752899154904733,Au,PRUNED
1374,-543.6688311687689,2026-04-26 15:31:56.167635,2026-04-26 15:31:56.938177,0 days 00:00:00.770542,21.0651424943031,19.28638250261878,1.9540803207824413,Au,COMPLETE
1375,0.0,2026-04-26 15:31:56.477954,2026-04-26 15:31:57.296143,0 days 00:00:00.818189,20.053947150167378,15.91250735971164,1.7266630263813638,Au,PRUNED
1376,-546.1513372471652,2026-04-26 15:31:56.507498,2026-04-26 15:31:57.014681,0 days 00:00:00.507183,20.607567566193694,19.60847021104739,1.9936055807918702,Au,COMPLETE
1377,0.0,2026-04-26 15:31:56.601313,2026-04-26 15:31:57.277327,0 days 00:00:00.676014,20.08953700428916,17.207587889446412,1.7359436049747132,Cu,PRUNED
1378,-23.8095238095185,2026-04-26 15:31:56.625930,2026-04-26 15:31:57.386153,0 days 00:00:00.760223,56.99423652402663,9.555378393744924,0.8954529735839862,Ag,PRUNED
1379,146.1538461538415,2026-04-26 15:31:56.633263,2026-04-26 15:31:57.521617,0 days 00:00:00.888354,25.165531700311973,19.92075585776728,1.9581889741443133,Au,PRUNED
1380,7.518796992480405,2026-04-26 15:31:56.736443,2026-04-26 15:31:57.210173,0 days 00:00:00.473730,29.16460384890562,16.952441305742855,1.9941048625116018,Au,PRUNED
1381,0.0,2026-04-26 15:31:56.843812,2026-04-26 15:31:57.368642,0 days 00:00:00.524830,35.998737725625276,16.402679001325826,1.8224603462570896,Au,PRUNED
1382,0.0,2026-04-26 15:31:57.293950,2026-04-26 15:31:58.024311,0 days 00:00:00.730361,34.379693545502775,19.70507369092187,1.6970540190179757,Au,PRUNED
1383,0.0,2026-04-26 15:31:57.339030,2026-04-26 15:31:58.302384,0 days 00:00:00.963354,20.013219198331072,17.942749590335524,1.9454986866114141,Au,PRUNED
1384,0.0,2026-04-26 15:31:57.389735,2026-04-26 15:31:58.333785,0 days 00:00:00.944050,36.87883049926211,19.93274377454013,1.7577403912365028,Au,PRUNED
1385,0.0,2026-04-26 15:31:57.436188,2026-04-26 15:31:58.037003,0 days 00:00:00.600815,37.90652956004469,19.822752223216725,1.7871943241946378,Au,PRUNED
1386,-8.928571428570304,2026-04-26 15:31:57.466193,2026-04-26 15:31:58.055165,0 days 00:00:00.588972,21.604562165136574,19.97767693372447,1.8852849528814193,Au,PRUNED
1387,0.0,2026-04-26 15:31:57.495113,2026-04-26 15:31:58.274687,0 days 00:00:00.779574,103.89559084639515,14.196530731297731,0.9764322567147277,Cu,PRUNED
1388,-11.9047619047611,2026-04-26 15:31:57.556252,2026-04-26 15:31:58.081782,0 days 00:00:00.525530,69.3613295332315,9.216407652613768,1.951680643328758,Cu,PRUNED
1389,0.0,2026-04-26 15:31:57.591892,2026-04-26 15:31:58.258469,0 days 00:00:00.666577,34.64678328195621,17.196447213079107,1.7921474631293042,Au,PRUNED
1390,-22.321428571425763,2026-04-26 15:31:58.118991,2026-04-26 15:31:58.896041,0 days 00:00:00.777050,31.26985668832851,19.897525497085255,1.6909901287882914,Ag,PRUNED
1391,0.0,2026-04-26 15:31:58.149428,2026-04-26 15:31:58.849637,0 days 00:00:00.700209,38.23805186746853,19.968151058928797,1.687977903845315,Au,PRUNED
1392,-8.928571428570304,2026-04-26 15:31:58.189095,2026-04-26 15:31:58.687943,0 days 00:00:00.498848,22.16168038051372,19.44640762071185,1.9701125831949193,Au,PRUNED
1393,0.0,2026-04-26 15:31:58.230855,2026-04-26 15:31:58.928435,0 days 00:00:00.697580,34.996565877625784,17.739115691753263,1.9774749746031655,Au,PRUNED
1394,0.0,2026-04-26 15:31:58.382292,2026-04-26 15:31:59.135321,0 days 00:00:00.753029,37.53765743078026,17.822727479978045,1.989440105453374,Au,PRUNED
1395,0.0,2026-04-26 15:31:58.397092,2026-04-26 15:31:59.133816,0 days 00:00:00.736724,22.887824719651405,19.812173597428387,1.9500967773664772,Au,PRUNED
1396,0.0,2026-04-26 15:31:58.417529,2026-04-26 15:31:59.132804,0 days 00:00:00.715275,21.361898805090078,17.14678193357305,1.9629856193927468,Au,PRUNED
1397,0.0,2026-04-26 15:31:58.444337,2026-04-26 15:31:59.269934,0 days 00:00:00.825597,34.8309330607708,16.8709840722735,1.8886291143549725,Au,PRUNED
1398,0.0,2026-04-26 15:31:58.758633,2026-04-26 15:31:59.580188,0 days 00:00:00.821555,34.22147580222391,19.803985655306377,1.7004339211432709,Au,PRUNED
1399,0.0,2026-04-26 15:31:59.014841,2026-04-26 15:31:59.878103,0 days 00:00:00.863262,32.22688400155566,19.815568617027548,1.9920581118500826,Au,PRUNED
1400,0.0,2026-04-26 15:31:59.040141,2026-04-26 15:31:59.753245,0 days 00:00:00.713104,39.44159986244006,19.91882206866748,1.6565311288949551,Au,PRUNED
1401,0.0,2026-04-26 15:31:59.070381,2026-04-26 15:31:59.803513,0 days 00:00:00.733132,20.39741817915925,16.231939238197715,1.8194145563195543,Au,PRUNED
1402,0.0,2026-04-26 15:31:59.320283,2026-04-26 15:31:59.973165,0 days 00:00:00.652882,20.287860927720562,16.261052957237425,1.8886703932124307,Au,PRUNED
1403,0.0,2026-04-26 15:31:59.352049,2026-04-26 15:32:00.049368,0 days 00:00:00.697319,38.498986794395194,17.118624188324997,1.7341872617443859,Au,PRUNED
1404,0.0,2026-04-26 15:31:59.383541,2026-04-26 15:32:00.328097,0 days 00:00:00.944556,36.95479288964131,19.905833820618444,1.8412174965932486,Au,PRUNED
1405,0.0,2026-04-26 15:31:59.374775,2026-04-26 15:32:00.081695,0 days 00:00:00.706920,20.58295284451555,16.651815528758252,1.7989045746669046,Au,PRUNED
1406,0.0,2026-04-26 15:31:59.645126,2026-04-26 15:32:00.376420,0 days 00:00:00.731294,23.51628323087968,19.957743160390386,1.6325213494660662,Au,PRUNED
1407,0.0,2026-04-26 15:31:59.834895,2026-04-26 15:32:00.504679,0 days 00:00:00.669784,33.19563300521044,17.06307797509016,1.966290419589548,Au,PRUNED
1408,0.0,2026-04-26 15:31:59.931566,2026-04-26 15:32:00.645108,0 days 00:00:00.713542,36.200996995306156,17.633759143710652,1.9975526814830848,Au,PRUNED
1409,0.0,2026-04-26 15:31:59.942810,2026-04-26 15:32:00.645108,0 days 00:00:00.702298,36.0746188775589,19.283975517974564,1.6080901037347797,Au,PRUNED
1410,0.0,2026-04-26 15:32:00.008277,2026-04-26 15:32:00.754323,0 days 00:00:00.746046,20.438962452618775,16.90772473794503,1.6971835958614327,Au,PRUNED
1411,0.0,2026-04-26 15:32:00.136231,2026-04-26 15:32:00.905918,0 days 00:00:00.769687,30.884108777090727,19.85219198065537,1.5229047893620211,Au,PRUNED
1412,0.0,2026-04-26 15:32:00.192777,2026-04-26 15:32:00.789953,0 days 00:00:00.597176,20.064972594191026,19.09198643715362,1.8985060167814782,Au,PRUNED
1413,0.0,2026-04-26 15:32:00.507684,2026-04-26 15:32:01.202935,0 days 00:00:00.695251,26.945553983715545,19.951636083277087,1.9675026161215379,Au,PRUNED
1414,0.0,2026-04-26 15:32:00.451051,2026-04-26 15:32:01.354755,0 days 00:00:00.903704,20.33209354385918,19.447867980003554,1.8420985128420229,Au,PRUNED
1415,141.75824175823726,2026-04-26 15:32:00.596760,2026-04-26 15:32:01.158941,0 days 00:00:00.562181,31.986444933518897,17.085257048676837,1.6350689648929377,Au,PRUNED
1416,0.0,2026-04-26 15:32:00.794468,2026-04-26 15:32:01.452823,0 days 00:00:00.658355,40.98303895728253,19.874462647276232,0.9705842110751418,Cu,PRUNED
1417,-544.4191343962935,2026-04-26 15:32:00.867416,2026-04-26 15:32:01.626357,0 days 00:00:00.758941,20.37472015016719,19.836341596471414,1.9086889728965433,Au,COMPLETE
1418,0.0,2026-04-26 15:32:00.840615,2026-04-26 15:32:01.660606,0 days 00:00:00.819991,34.15178143178656,17.217399678800454,1.5746010392177676,Au,PRUNED
1419,-566.7115902964287,2026-04-26 15:32:00.940366,2026-04-26 15:32:01.716330,0 days 00:00:00.775964,21.117634028494678,19.516453791617966,1.943167674748937,Au,COMPLETE
1420,141.75824175823726,2026-04-26 15:32:00.969495,2026-04-26 15:32:01.660606,0 days 00:00:00.691111,32.523343606048044,16.650750380715763,1.6817909117149856,Au,PRUNED
1421,-10.714285714284633,2026-04-26 15:32:01.289275,2026-04-26 15:32:02.060990,0 days 00:00:00.771715,24.31093423134861,19.39333649889159,1.6531580823444778,Cu,PRUNED
1422,0.0,2026-04-26 15:32:01.300528,2026-04-26 15:32:01.976484,0 days 00:00:00.675956,20.176529272604576,19.883138902384594,1.7617378256326885,Au,PRUNED
1423,-7.389162561575839,2026-04-26 15:32:01.471612,2026-04-26 15:32:02.060990,0 days 00:00:00.589378,32.436582797376445,7.494339860129267,0.5197510595221497,Cu,PRUNED
1424,-14.285714285712368,2026-04-26 15:32:01.564899,2026-04-26 15:32:02.359960,0 days 00:00:00.795061,84.45783179941213,8.41154281146912,1.9714021555123555,Ag,PRUNED
1425,-14.28571428571313,2026-04-26 15:32:01.798218,2026-04-26 15:32:02.672443,0 days 00:00:00.874225,36.77321483490189,16.090390643033253,1.8525893872181431,Ag,PRUNED
1426,0.0,2026-04-26 15:32:01.836615,2026-04-26 15:32:02.572557,0 days 00:00:00.735942,20.237597957904285,18.60697630133998,1.8552861668092642,Au,PRUNED
1427,2.1482277121374524,2026-04-26 15:32:01.905971,2026-04-26 15:32:02.612392,0 days 00:00:00.706421,67.88397845102554,19.652767670035516,0.6751849084261091,Ag,PRUNED
1428,0.0,2026-04-26 15:32:02.046415,2026-04-26 15:32:02.739964,0 days 00:00:00.693549,32.64887168478149,17.427557908552615,1.9689894151887695,Au,PRUNED
1429,141.75824175823726,2026-04-26 15:32:02.135204,2026-04-26 15:32:03.011241,0 days 00:00:00.876037,31.202054447540693,17.21566246876121,1.9906462374921359,Au,PRUNED
1430,-11.278195488720607,2026-04-26 15:32:02.154793,2026-04-26 15:32:02.886413,0 days 00:00:00.731620,22.958055264772845,17.313724151552435,1.988783015155118,Au,PRUNED
1431,0.0,2026-04-26 15:32:02.226264,2026-04-26 15:32:03.105444,0 days 00:00:00.879180,21.4571984545017,16.864938549934624,1.712367225618533,Au,PRUNED
1432,0.0,2026-04-26 15:32:02.483690,2026-04-26 15:32:03.138213,0 days 00:00:00.654523,20.549192227061788,19.358667984873467,1.8360112861274074,Au,PRUNED
1433,-553.612669086046,2026-04-26 15:32:02.635213,2026-04-26 15:32:03.216670,0 days 00:00:00.581457,21.055720182556808,19.387956646506726,1.978837036567282,Au,COMPLETE
1434,145.05494505494045,2026-04-26 15:32:02.673953,2026-04-26 15:32:03.362684,0 days 00:00:00.688731,26.471399371285823,19.453577469441854,1.9980356221930202,Au,PRUNED
1435,-13.392857142855457,2026-04-26 15:32:02.741467,2026-04-26 15:32:03.895833,0 days 00:00:01.154366,89.21527993276919,8.129573523492766,1.0424733833540973,Ag,PRUNED
1436,-4.464285714285152,2026-04-26 15:32:02.820354,2026-04-26 15:32:03.529768,0 days 00:00:00.709414,22.457598226200044,19.9923901729458,1.8662098663722173,Au,PRUNED
1437,-543.181818181756,2026-04-26 15:32:02.975463,2026-04-26 15:32:03.680906,0 days 00:00:00.705443,20.542666964328205,19.649555409841764,1.9562290264925264,Au,COMPLETE
1438,0.0,2026-04-26 15:32:03.150991,2026-04-26 15:32:03.822518,0 days 00:00:00.671527,35.68925157716658,17.987403884664545,1.99507732389645,Au,PRUNED
1439,-1.050420168067195,2026-04-26 15:32:03.188108,2026-04-26 15:32:03.850963,0 days 00:00:00.662855,21.347960102237487,3.392522506377933,1.2503641206581613,Au,PRUNED
1440,-570.7499151678993,2026-04-26 15:32:03.233758,2026-04-26 15:32:03.821520,0 days 00:00:00.587762,20.924698791363152,19.757184727268168,1.8707147778023376,Au,COMPLETE
1441,0.0,2026-04-26 15:32:03.400593,2026-04-26 15:32:04.047448,0 days 00:00:00.646855,20.57064190778887,16.562899405354266,1.8907392834696672,Au,PRUNED
1442,0.0,2026-04-26 15:32:03.503536,2026-04-26 15:32:04.475289,0 days 00:00:00.971753,34.72380872336993,16.987455259335825,1.6860350648547404,Au,PRUNED
1443,0.0,2026-04-26 15:32:03.698169,2026-04-26 15:32:04.415872,0 days 00:00:00.717703,21.004646505996863,16.994523141614046,1.7148647749011494,Au,PRUNED
1444,140.65934065933618,2026-04-26 15:32:03.872506,2026-04-26 15:32:04.881190,0 days 00:00:01.008684,32.84322900386591,16.814785403451378,1.7240240131405873,Au,PRUNED
1445,0.0,2026-04-26 15:32:03.920679,2026-04-26 15:32:04.644543,0 days 00:00:00.723864,37.44188089498667,19.96841102885551,1.7138856575113195,Au,PRUNED
1446,-499.8493068112793,2026-04-26 15:32:03.947275,2026-04-26 15:32:04.724212,0 days 00:00:00.776937,22.09116032153844,17.968077389156694,1.9935310988497181,Au,COMPLETE
1447,0.0,2026-04-26 15:32:03.976456,2026-04-26 15:32:04.537229,0 days 00:00:00.560773,31.874727955659075,19.91636847184256,1.5930879518559533,Au,PRUNED
1448,0.0,2026-04-26 15:32:04.109045,2026-04-26 15:32:04.754910,0 days 00:00:00.645865,38.099038281847186,19.731621216357357,1.7021663592092697,Au,PRUNED
1449,-573.6447323558804,2026-04-26 15:32:04.162211,2026-04-26 15:32:04.917463,0 days 00:00:00.755252,20.783897427899767,19.89839146081682,1.8590872861841212,Au,COMPLETE
1450,-4.464285714285152,2026-04-26 15:32:04.590905,2026-04-26 15:32:05.580534,0 days 00:00:00.989629,22.171955817543846,19.808806599667946,1.9578365535647775,Au,PRUNED
1451,-311.37026239064903,2026-04-26 15:32:04.658599,2026-04-26 15:32:05.434207,0 days 00:00:00.775608,21.10857656623322,19.516344439432704,1.7440119729993957,Cu,COMPLETE
1452,0.0,2026-04-26 15:32:04.694945,2026-04-26 15:32:05.343760,0 days 00:00:00.648815,21.142534993407338,17.613058241030224,1.776300413855061,Au,PRUNED
1453,-1.0351966873705694,2026-04-26 15:32:04.776630,2026-04-26 15:32:05.654303,0 days 00:00:00.877673,55.67203058848403,16.00802017976814,1.5110481414287282,Au,PRUNED
1454,0.0,2026-04-26 15:32:04.914311,2026-04-26 15:32:05.581534,0 days 00:00:00.667223,34.56802902612884,19.80358290646553,1.607376585492823,Au,PRUNED
1455,0.0,2026-04-26 15:32:04.979811,2026-04-26 15:32:05.595162,0 days 00:00:00.615351,119.59512877259374,16.173385075391614,0.651798558119552,Ag,PRUNED
1456,0.0,2026-04-26 15:32:05.048668,2026-04-26 15:32:05.596164,0 days 00:00:00.547496,20.97595943194258,16.63640609938319,1.9981604054931563,Au,PRUNED
1457,0.0,2026-04-26 15:32:05.095960,2026-04-26 15:32:05.875499,0 days 00:00:00.779539,20.399955511220078,17.02904935446165,1.94861356859289,Au,PRUNED
1458,0.0,2026-04-26 15:32:05.498260,2026-04-26 15:32:06.164119,0 days 00:00:00.665859,20.147518496091763,18.81994953857978,1.9185391448228324,Au,PRUNED
1459,-8.928571428570304,2026-04-26 15:32:05.559694,2026-04-26 15:32:06.343270,0 days 00:00:00.783576,21.97281274556344,19.863659158198352,1.7607849731494882,Au,PRUNED
1460,0.0,2026-04-26 15:32:05.694506,2026-04-26 15:32:06.301158,0 days 00:00:00.606652,20.00047630071124,16.968341775965857,1.8170596308303355,Au,PRUNED
1461,-9.216589861750549,2026-04-26 15:32:05.737272,2026-04-26 15:32:06.551616,0 days 00:00:00.814344,27.040843861022545,15.915244036798216,1.9779047792454774,Cu,PRUNED
1462,0.0,2026-04-26 15:32:05.769470,2026-04-26 15:32:06.359840,0 days 00:00:00.590370,34.602444960155545,16.743716510890113,1.9685026629829905,Au,PRUNED
1463,-551.5141540486518,2026-04-26 15:32:05.816687,2026-04-26 15:32:06.209343,0 days 00:00:00.392656,20.497031777562142,19.815217178988348,1.9196523730785684,Au,COMPLETE
1464,-535.794542536055,2026-04-26 15:32:05.916728,2026-04-26 15:32:06.584283,0 days 00:00:00.667555,20.53171072713203,19.77896473337699,1.733798123524931,Au,COMPLETE
1465,-561.5590498493815,2026-04-26 15:32:05.972660,2026-04-26 15:32:06.634172,0 days 00:00:00.661512,21.308005808181388,19.616701808663464,1.6147304206713162,Au,COMPLETE
1466,0.0,2026-04-26 15:32:06.209343,2026-04-26 15:32:06.952674,0 days 00:00:00.743331,30.761184403470395,19.98565034394116,1.7507341705167556,Au,PRUNED
1467,0.0,2026-04-26 15:32:06.340750,2026-04-26 15:32:06.996818,0 days 00:00:00.656068,38.3303609572993,19.64403808896413,1.9627334174356281,Au,PRUNED
1468,0.0,2026-04-26 15:32:06.503485,2026-04-26 15:32:07.295094,0 days 00:00:00.791609,42.44095201878106,19.680562833855472,1.9165663200373877,Au,PRUNED
1469,0.0,2026-04-26 15:32:06.520822,2026-04-26 15:32:07.341494,0 days 00:00:00.820672,20.54003856169476,19.396247727621986,1.92176224011239,Cu,PRUNED
1470,0.0,2026-04-26 15:32:06.612168,2026-04-26 15:32:07.248250,0 days 00:00:00.636082,34.31022444182231,19.867296511308865,1.706548814106465,Au,PRUNED
1471,0.0,2026-04-26 15:32:06.637195,2026-04-26 15:32:07.528232,0 days 00:00:00.891037,22.92092586711489,19.7327882524451,1.9577730574529961,Au,PRUNED
1472,0.0,2026-04-26 15:32:06.699556,2026-04-26 15:32:07.575115,0 days 00:00:00.875559,32.899297729924925,17.14785504444791,1.8185762387765965,Au,PRUNED
1473,0.0,2026-04-26 15:32:06.947475,2026-04-26 15:32:07.610982,0 days 00:00:00.663507,34.628810633772005,19.811677955365383,1.930070484030053,Au,PRUNED
1474,0.0,2026-04-26 15:32:07.043488,2026-04-26 15:32:08.027865,0 days 00:00:00.984377,31.193027309357944,19.769347993162803,1.9479973369811958,Au,PRUNED
1475,0.0,2026-04-26 15:32:07.093252,2026-04-26 15:32:07.769432,0 days 00:00:00.676180,33.35834325010234,17.00153663745985,1.7787207043004623,Au,PRUNED
1476,0.0,2026-04-26 15:32:07.427884,2026-04-26 15:32:08.204467,0 days 00:00:00.776583,41.09941891822753,19.765475700826016,1.9690542828550888,Au,PRUNED
1477,0.0,2026-04-26 15:32:07.458288,2026-04-26 15:32:08.210895,0 days 00:00:00.752607,20.251033059721998,17.921531599490997,1.7878814633275664,Au,PRUNED
1478,0.0,2026-04-26 15:32:07.516595,2026-04-26 15:32:08.205872,0 days 00:00:00.689277,37.507423302051855,19.87840445101505,1.8630840501605983,Au,PRUNED
1479,-584.0846047156012,2026-04-26 15:32:07.667613,2026-04-26 15:32:08.376011,0 days 00:00:00.708398,21.127822761613913,19.910933924789152,1.6726862181154631,Au,COMPLETE
1480,0.0,2026-04-26 15:32:07.703382,2026-04-26 15:32:08.206886,0 days 00:00:00.503504,20.658108109480278,19.520255399863768,1.643783921440742,Au,PRUNED
1481,0.0,2026-04-26 15:32:07.719482,2026-04-26 15:32:08.703358,0 days 00:00:00.983876,30.6338469370476,19.753711866640224,1.697935122828408,Au,PRUNED
1482,0.0,2026-04-26 15:32:07.883738,2026-04-26 15:32:08.732154,0 days 00:00:00.848416,40.541603374329895,19.339802407422017,1.6385236526973106,Cu,PRUNED
1483,0.0,2026-04-26 15:32:08.141778,2026-04-26 15:32:08.986046,0 days 00:00:00.844268,20.075825973350497,17.260117561565075,1.56450632894847,Au,PRUNED
1484,-8.403361344536819,2026-04-26 15:32:08.304927,2026-04-26 15:32:08.988135,0 days 00:00:00.683208,21.331210216249502,19.696588992075718,1.8379162467046593,Au,PRUNED
1485,-2.2321428571428203,2026-04-26 15:32:08.364623,2026-04-26 15:32:09.280714,0 days 00:00:00.916091,94.9237355813161,7.184315794357213,0.9068351423339661,Au,PRUNED
