number,value,datetime_start,datetime_complete,duration,params_D2_nm,params_D3_nm,params_D4_nm,params_metal,state
2179,-19.04761904761649,2026-04-26 15:33:24.730961,2026-04-26 15:33:25.329991,0 days 00:00:00.599030,69.99490440863335,1.6457973553089236,1.0432018735274895,Au,PRUNED
2180,0.0,2026-04-26 15:33:24.762147,2026-04-26 15:33:25.414739,0 days 00:00:00.652592,33.9462473013011,19.9908590226383,1.593366951913973,Au,PRUNED
2181,146.1538461538415,2026-04-26 15:33:24.776799,2026-04-26 15:33:25.446547,0 days 00:00:00.669748,26.48188733896376,19.994128089300826,1.0886135096537353,Au,PRUNED
2182,4.926108374383892,2026-04-26 15:33:24.912634,2026-04-26 15:33:25.445548,0 days 00:00:00.532914,36.03607198048715,14.302010288166873,1.7737528841431294,Au,PRUNED
2183,-2.3228803716608195,2026-04-26 15:33:24.982217,2026-04-26 15:33:25.576940,0 days 00:00:00.594723,103.4281654718332,14.461857697520113,0.15751981435705698,Ag,PRUNED
2184,0.0,2026-04-26 15:33:25.244859,2026-04-26 15:33:26.019308,0 days 00:00:00.774449,35.18655949970698,19.894970602733967,1.4557544286587822,Au,PRUNED
2185,-4.761904761904122,2026-04-26 15:33:25.332993,2026-04-26 15:33:26.020919,0 days 00:00:00.687926,22.6216953813413,19.953972840369826,1.5288397450537494,Au,PRUNED
2186,0.0,2026-04-26 15:33:25.463514,2026-04-26 15:33:26.049355,0 days 00:00:00.585841,20.226274453916602,18.711118892595735,1.7648655608474617,Au,PRUNED
2187,0.0,2026-04-26 15:33:25.527824,2026-04-26 15:33:26.564191,0 days 00:00:01.036367,20.358277559772393,19.305499819843725,1.7124384985689225,Au,PRUNED
2188,0.0,2026-04-26 15:33:25.553508,2026-04-26 15:33:26.332558,0 days 00:00:00.779050,20.41688124607505,16.512538355350888,1.650948258117625,Au,PRUNED
2189,141.75824175823726,2026-04-26 15:33:25.580951,2026-04-26 15:33:26.541833,0 days 00:00:00.960882,32.11302021836405,17.177101926137475,1.487764689089725,Au,PRUNED
2190,0.0,2026-04-26 15:33:25.677802,2026-04-26 15:33:26.238526,0 days 00:00:00.560724,20.93651440035991,17.949886707955574,1.9788251885594135,Au,PRUNED
2191,0.0,2026-04-26 15:33:25.804223,2026-04-26 15:33:26.473005,0 days 00:00:00.668782,24.02829250247138,9.232034679399417,0.5358392311467477,Au,PRUNED
2192,141.75824175823726,2026-04-26 15:33:26.135080,2026-04-26 15:33:26.829573,0 days 00:00:00.694493,32.346721360383555,16.771153721507932,1.7477174060454992,Au,PRUNED
2193,0.0,2026-04-26 15:33:26.171482,2026-04-26 15:33:26.891622,0 days 00:00:00.720140,47.73595261928999,17.49911208402662,1.5885013374791608,Au,PRUNED
2194,-25.974025974021227,2026-04-26 15:33:26.338637,2026-04-26 15:33:27.119036,0 days 00:00:00.780399,48.82119574570853,12.18122592801761,0.12921939290878226,Ag,PRUNED
2195,0.0,2026-04-26 15:33:26.381161,2026-04-26 15:33:26.993124,0 days 00:00:00.611963,20.34648167964435,17.74728523183445,1.7016035490613237,Au,PRUNED
2196,-8.928571428570304,2026-04-26 15:33:26.436432,2026-04-26 15:33:27.158815,0 days 00:00:00.722383,22.41563470680362,19.993256547611093,0.9936350306881986,Au,PRUNED
2197,0.0,2026-04-26 15:33:26.549322,2026-04-26 15:33:27.120558,0 days 00:00:00.571236,40.84511850348447,19.964385453145848,1.6310334560118322,Au,PRUNED
2198,0.0,2026-04-26 15:33:26.593792,2026-04-26 15:33:27.274532,0 days 00:00:00.680740,20.246966943592742,19.865806981078716,1.763114490378121,Au,PRUNED
2199,-591.9620919620194,2026-04-26 15:33:26.664695,2026-04-26 15:33:27.449449,0 days 00:00:00.784754,21.33412691646017,19.989162000818343,1.5155619778478626,Au,COMPLETE
2200,2.645502645502447,2026-04-26 15:33:27.012169,2026-04-26 15:33:27.932919,0 days 00:00:00.920750,35.463234381990716,14.399584359034288,1.429697678217389,Au,PRUNED
2201,0.0,2026-04-26 15:33:27.039187,2026-04-26 15:33:27.747839,0 days 00:00:00.708652,31.76970361862746,19.98254852504996,1.8892452620951128,Au,PRUNED
2202,0.0,2026-04-26 15:33:27.030046,2026-04-26 15:33:28.044499,0 days 00:00:01.014453,37.08717053467309,19.7447235613412,1.8015528148021203,Au,PRUNED
2203,-7.936507936507047,2026-04-26 15:33:27.220692,2026-04-26 15:33:27.761172,0 days 00:00:00.540480,45.34211723093129,2.328523468285913,0.7446438728299365,Cu,PRUNED
2204,-12.987012987010614,2026-04-26 15:33:27.323810,2026-04-26 15:33:27.918550,0 days 00:00:00.594740,43.44175988689619,7.936099424808843,0.5114404249104901,Ag,PRUNED
2205,147.25274725274258,2026-04-26 15:33:27.280751,2026-04-26 15:33:28.042435,0 days 00:00:00.761684,25.642370143158903,19.945553464527237,1.2240567313929436,Au,PRUNED
2206,0.0,2026-04-26 15:33:27.375486,2026-04-26 15:33:28.137403,0 days 00:00:00.761917,20.66022257142186,19.980297057272157,1.1631236444652764,Cu,PRUNED
2207,0.0,2026-04-26 15:33:27.564345,2026-04-26 15:33:28.439033,0 days 00:00:00.874688,20.248695614193004,19.891403308201234,1.274823456928131,Au,PRUNED
2208,0.0,2026-04-26 15:33:27.893282,2026-04-26 15:33:28.564309,0 days 00:00:00.671027,20.24367752396204,19.69955986711649,1.0725320677615726,Au,PRUNED
2209,-2.3041474654377487,2026-04-26 15:33:27.971312,2026-04-26 15:33:28.564309,0 days 00:00:00.592997,118.31868427769747,7.623673611006234,1.9359180794371542,Ag,PRUNED
2210,-4.761904761904122,2026-04-26 15:33:28.004487,2026-04-26 15:33:28.656932,0 days 00:00:00.652445,22.829928369604996,19.956806435932695,1.3807837711078896,Au,PRUNED
2211,-12.422360248446113,2026-04-26 15:33:28.094860,2026-04-26 15:33:28.703807,0 days 00:00:00.608947,47.49458354464096,7.457858800145582,0.19362853325081764,Au,PRUNED
2212,139.56043956043513,2026-04-26 15:33:28.129025,2026-04-26 15:33:28.565818,0 days 00:00:00.436793,34.43331876627247,16.80288933467455,1.3606169668949737,Au,PRUNED
2213,-3.7593984962402023,2026-04-26 15:33:28.162642,2026-04-26 15:33:28.766211,0 days 00:00:00.603569,26.867154582380067,16.59704036990804,1.9982127184313878,Au,PRUNED
2214,140.65934065933618,2026-04-26 15:33:28.205847,2026-04-26 15:33:28.766727,0 days 00:00:00.560880,33.420372240754176,16.953895804353323,1.5202111793209632,Au,PRUNED
2215,0.0,2026-04-26 15:33:28.614447,2026-04-26 15:33:29.298317,0 days 00:00:00.683870,20.377138955722597,16.391640154209973,1.0489447337155413,Au,PRUNED
2216,0.0,2026-04-26 15:33:28.643948,2026-04-26 15:33:29.344452,0 days 00:00:00.700504,20.469775319951523,17.333460634168013,1.1053676962845285,Au,PRUNED
2217,140.65934065933618,2026-04-26 15:33:28.676512,2026-04-26 15:33:29.533559,0 days 00:00:00.857047,34.67392965416264,16.67503598068747,1.1739848160064021,Au,PRUNED
2218,0.0,2026-04-26 15:33:28.726696,2026-04-26 15:33:29.234076,0 days 00:00:00.507380,20.4730636390063,17.23316074083432,1.9893480862437571,Au,PRUNED
2219,0.0,2026-04-26 15:33:28.783961,2026-04-26 15:33:29.656404,0 days 00:00:00.872443,20.073741846697626,17.960555418038506,1.742290680480086,Au,PRUNED
2220,0.0,2026-04-26 15:33:28.879500,2026-04-26 15:33:29.626204,0 days 00:00:00.746704,20.119569372488627,13.650552593934215,1.6469711953619437,Au,PRUNED
2221,-6.493506493505897,2026-04-26 15:33:28.910674,2026-04-26 15:33:29.559745,0 days 00:00:00.649071,37.69429726948262,0.5540682582215908,0.721529286118175,Au,PRUNED
2222,-575.1879699247422,2026-04-26 15:33:28.955608,2026-04-26 15:33:29.455859,0 days 00:00:00.500251,21.121160750563437,19.749105978205648,1.7725835158571248,Au,COMPLETE
2223,142.8571428571383,2026-04-26 15:33:29.426372,2026-04-26 15:33:30.108303,0 days 00:00:00.681931,31.22014482796525,17.368279185273305,1.6028926691948762,Au,PRUNED
2224,0.0,2026-04-26 15:33:29.469727,2026-04-26 15:33:30.232357,0 days 00:00:00.762630,20.024242059834524,16.376575557871462,1.4224155873634254,Au,PRUNED
2225,0.0,2026-04-26 15:33:29.495144,2026-04-26 15:33:30.366510,0 days 00:00:00.871366,20.051469337490854,17.91945856349458,1.566202436550112,Au,PRUNED
2226,-14.285714285712844,2026-04-26 15:33:29.675413,2026-04-26 15:33:30.544251,0 days 00:00:00.868838,23.729485004661782,17.218511664719863,1.4029283532249766,Au,PRUNED
2227,141.75824175823726,2026-04-26 15:33:29.705875,2026-04-26 15:33:30.312208,0 days 00:00:00.606333,31.980616635311105,17.382616496271496,1.620531575836279,Au,PRUNED
2228,0.0,2026-04-26 15:33:29.721265,2026-04-26 15:33:30.361233,0 days 00:00:00.639968,20.96028050107599,16.83618888301268,1.3738333096686794,Au,PRUNED
2229,-1.0660980810234213,2026-04-26 15:33:29.736207,2026-04-26 15:33:30.362232,0 days 00:00:00.626025,20.57250003967637,17.947239626998822,1.503254038894114,Ag,PRUNED
2230,0.0,2026-04-26 15:33:29.786053,2026-04-26 15:33:30.813939,0 days 00:00:01.027886,33.3323263849327,18.16107800691941,1.5229651020125974,Au,PRUNED
2231,0.0,2026-04-26 15:33:30.203210,2026-04-26 15:33:30.945675,0 days 00:00:00.742465,34.967452682614784,17.672347834482412,1.4286411725596493,Au,PRUNED
2232,0.0,2026-04-26 15:33:30.286356,2026-04-26 15:33:30.932035,0 days 00:00:00.645679,33.36146040623014,17.45688629721573,1.6866400234502295,Au,PRUNED
2233,5.102040816326161,2026-04-26 15:33:30.425302,2026-04-26 15:33:30.887882,0 days 00:00:00.462580,33.07744466755504,16.380946964872454,1.3142314324166189,Au,PRUNED
2234,0.0,2026-04-26 15:33:30.441628,2026-04-26 15:33:30.956792,0 days 00:00:00.515164,33.94173992137286,19.96745687581019,1.6443063692817874,Au,PRUNED
2235,-553.571428571364,2026-04-26 15:33:30.467635,2026-04-26 15:33:31.153366,0 days 00:00:00.685731,21.034294491152764,19.94375290325888,1.3776548666097097,Au,COMPLETE
2236,-0.5903187721369436,2026-04-26 15:33:30.556624,2026-04-26 15:33:31.239927,0 days 00:00:00.683303,100.92329676471581,14.074846914111143,1.2763378495382618,Au,PRUNED
2237,0.0,2026-04-26 15:33:30.671257,2026-04-26 15:33:31.676878,0 days 00:00:01.005621,20.208502780137728,19.563085327608142,1.6207193036529182,Au,PRUNED
2238,0.0,2026-04-26 15:33:30.919653,2026-04-26 15:33:31.787983,0 days 00:00:00.868330,20.237421076886235,19.548998637831215,1.5586436580423684,Au,PRUNED
2239,0.0,2026-04-26 15:33:30.958794,2026-04-26 15:33:31.960022,0 days 00:00:01.001228,20.230145183918733,19.49397585494627,1.4791957748991587,Au,PRUNED
2240,-585.5057351407006,2026-04-26 15:33:31.020469,2026-04-26 15:33:31.708646,0 days 00:00:00.688177,21.453076316554288,19.946699620740684,1.3999237240182416,Au,COMPLETE
2241,0.0,2026-04-26 15:33:31.058353,2026-04-26 15:33:31.694088,0 days 00:00:00.635735,20.98764901037657,16.730217265649415,1.6729536998419827,Au,PRUNED
2242,0.0,2026-04-26 15:33:31.155368,2026-04-26 15:33:32.067011,0 days 00:00:00.911643,20.108537284037286,17.65916712362332,1.9882009445050295,Au,PRUNED
2243,0.0,2026-04-26 15:33:31.314621,2026-04-26 15:33:31.939184,0 days 00:00:00.624563,20.187678073202868,17.68395478893419,1.2382436079712242,Au,PRUNED
2244,0.0,2026-04-26 15:33:31.347697,2026-04-26 15:33:32.310553,0 days 00:00:00.962856,35.9302030829331,19.823804553680947,1.5735487136244437,Au,PRUNED
2245,0.0,2026-04-26 15:33:31.813368,2026-04-26 15:33:33.035744,0 days 00:00:01.222376,33.608231465639065,17.423195487628753,1.706212875284359,Au,PRUNED
2246,0.0,2026-04-26 15:33:31.832988,2026-04-26 15:33:32.503488,0 days 00:00:00.670500,20.68126249372554,19.89103113022949,1.6414035642984603,Cu,PRUNED
2247,-17.857142857139866,2026-04-26 15:33:31.858902,2026-04-26 15:33:32.586070,0 days 00:00:00.727168,69.10272586249411,10.971057025630662,1.7419904667357011,Ag,PRUNED
2248,-1.0660980810234213,2026-04-26 15:33:31.941698,2026-04-26 15:33:32.738679,0 days 00:00:00.796981,20.068543219252867,17.610764857401215,1.935881048708275,Ag,PRUNED
2249,0.0,2026-04-26 15:33:32.087548,2026-04-26 15:33:32.739689,0 days 00:00:00.652141,35.94572889346325,19.839471751329818,1.6044183029228263,Au,PRUNED
2250,-10.714285714284633,2026-04-26 15:33:32.126490,2026-04-26 15:33:32.648130,0 days 00:00:00.521640,36.56160119118938,12.832035828106697,0.6067027028621363,Ag,PRUNED
2251,0.0,2026-04-26 15:33:32.164250,2026-04-26 15:33:32.647132,0 days 00:00:00.482882,20.331884459999426,17.65038851681338,1.3643514739581521,Au,PRUNED
2252,141.75824175823726,2026-04-26 15:33:32.366127,2026-04-26 15:33:33.266322,0 days 00:00:00.900195,31.315928191436992,17.9068103259467,1.509513148262969,Au,PRUNED
2253,-2.341920374707219,2026-04-26 15:33:32.635957,2026-04-26 15:33:33.486228,0 days 00:00:00.850271,106.47086239058925,4.349028087280409,1.0589509621724857,Au,PRUNED
2254,138.46153846153408,2026-04-26 15:33:32.680997,2026-04-26 15:33:33.779075,0 days 00:00:01.098078,34.1582261939817,19.905505587637258,1.588611457587096,Cu,PRUNED
2255,0.0,2026-04-26 15:33:32.755951,2026-04-26 15:33:33.736512,0 days 00:00:00.980561,26.98805653850593,19.901369950365808,1.6020931806541736,Au,PRUNED
2256,0.0,2026-04-26 15:33:32.785983,2026-04-26 15:33:33.426468,0 days 00:00:00.640485,20.85654810189756,16.00734086335287,1.6205048584384256,Au,PRUNED
2257,140.65934065933618,2026-04-26 15:33:32.857473,2026-04-26 15:33:33.542623,0 days 00:00:00.685150,32.11092321561992,17.59140888764973,1.5165713302807378,Au,PRUNED
2258,0.0,2026-04-26 15:33:32.967353,2026-04-26 15:33:33.543622,0 days 00:00:00.576269,35.35979148717224,17.93826992271333,1.302163449862942,Au,PRUNED
2259,0.0,2026-04-26 15:33:33.100514,2026-04-26 15:33:33.841498,0 days 00:00:00.740984,20.18682126512702,19.853409692643393,1.9350671111418862,Au,PRUNED
2260,0.0,2026-04-26 15:33:33.442497,2026-04-26 15:33:34.185978,0 days 00:00:00.743481,33.73367641018621,19.94655231351204,1.7214327672062253,Au,PRUNED
2261,-1.0660980810234213,2026-04-26 15:33:33.519249,2026-04-26 15:33:34.295933,0 days 00:00:00.776684,20.184691809148585,18.75210632791674,1.7243386596929677,Ag,PRUNED
2262,-19.04761904761649,2026-04-26 15:33:33.606616,2026-04-26 15:33:34.328995,0 days 00:00:00.722379,34.45729911839955,19.9540230113635,1.3476984885405552,Ag,PRUNED
2263,0.0,2026-04-26 15:33:33.566038,2026-04-26 15:33:34.330217,0 days 00:00:00.764179,20.072028690820673,17.27011557680841,1.4357551885403903,Au,PRUNED
2264,0.0,2026-04-26 15:33:33.648816,2026-04-26 15:33:34.331216,0 days 00:00:00.682400,34.997178537308194,18.056348948174577,1.6588310272463194,Au,PRUNED
2265,0.0,2026-04-26 15:33:33.803156,2026-04-26 15:33:34.703283,0 days 00:00:00.900127,20.170361039635665,18.75909322670651,1.573853611900749,Au,PRUNED
2266,0.0,2026-04-26 15:33:33.841498,2026-04-26 15:33:34.712323,0 days 00:00:00.870825,49.73878859032759,17.638245539264084,1.7119490426757404,Au,PRUNED
2267,-1.770956316410831,2026-04-26 15:33:33.905841,2026-04-26 15:33:34.401113,0 days 00:00:00.495272,103.37693122177645,5.870072479011155,0.42620139960293313,Cu,PRUNED
2268,0.0,2026-04-26 15:33:34.255634,2026-04-26 15:33:34.961186,0 days 00:00:00.705552,43.60887785881426,19.8740849165318,1.6862622764785298,Au,PRUNED
2269,0.0,2026-04-26 15:33:34.407706,2026-04-26 15:33:34.925415,0 days 00:00:00.517709,20.365619818368238,19.33306032434868,1.6095103414090528,Au,PRUNED
2270,0.0,2026-04-26 15:33:34.455933,2026-04-26 15:33:35.476167,0 days 00:00:01.020234,32.5163888264222,19.774524997753396,1.6706695413637118,Au,PRUNED
2271,-8.928571428570304,2026-04-26 15:33:34.520303,2026-04-26 15:33:35.157845,0 days 00:00:00.637542,21.610421294609495,19.91604231804962,1.9707136627833453,Au,PRUNED
2272,0.0,2026-04-26 15:33:34.564634,2026-04-26 15:33:35.320471,0 days 00:00:00.755837,20.28674051386165,19.9659065942676,1.7453573593102503,Au,PRUNED
2273,0.0,2026-04-26 15:33:34.605862,2026-04-26 15:33:35.230149,0 days 00:00:00.624287,20.601404003551227,19.87805133965281,1.841080036944581,Cu,PRUNED
2274,-588.892769821793,2026-04-26 15:33:34.820589,2026-04-26 15:33:35.420532,0 days 00:00:00.599943,21.153148633776905,19.979718293830544,1.6389743750573587,Au,COMPLETE
2275,-12.605042016805228,2026-04-26 15:33:34.861307,2026-04-26 15:33:35.516407,0 days 00:00:00.655100,21.453352349735905,19.707925895556436,1.657981438919539,Au,PRUNED
2276,0.0,2026-04-26 15:33:35.053390,2026-04-26 15:33:35.686433,0 days 00:00:00.633043,20.293104758465855,14.264806846769922,1.7337851154185213,Au,PRUNED
2277,0.0,2026-04-26 15:33:35.249675,2026-04-26 15:33:36.435548,0 days 00:00:01.185873,32.83385152414499,19.705077600588382,1.6885703638763099,Au,PRUNED
2278,145.05494505494045,2026-04-26 15:33:35.274640,2026-04-26 15:33:35.861599,0 days 00:00:00.586959,26.423652917416025,19.785201132428764,1.6612904328123812,Au,PRUNED
2279,-4.464285714285152,2026-04-26 15:33:35.339475,2026-04-26 15:33:35.944748,0 days 00:00:00.605273,23.192629608105207,19.95437124310513,1.4371694411179237,Au,PRUNED
2280,-8.928571428570304,2026-04-26 15:33:35.400966,2026-04-26 15:33:36.108859,0 days 00:00:00.707893,21.062984658025446,19.96360009533228,1.9917062199549802,Au,PRUNED
2281,0.0,2026-04-26 15:33:35.569699,2026-04-26 15:33:36.110859,0 days 00:00:00.541160,34.813550017524626,17.442485879811688,1.6333184514155035,Au,PRUNED
2282,141.75824175823726,2026-04-26 15:33:35.583629,2026-04-26 15:33:36.280704,0 days 00:00:00.697075,32.17363241559754,16.836338308713223,1.7358143933313506,Au,PRUNED
2283,0.0,2026-04-26 15:33:35.617525,2026-04-26 15:33:36.086187,0 days 00:00:00.468662,20.02763209386238,18.530937418682818,1.679799105877902,Au,PRUNED
2284,-0.5494505494505405,2026-04-26 15:33:35.786191,2026-04-26 15:33:36.354834,0 days 00:00:00.568643,74.83691617226,19.72095285478685,1.0480035847888483,Ag,PRUNED
2285,-563.3802816900748,2026-04-26 15:33:35.994505,2026-04-26 15:33:36.571545,0 days 00:00:00.577040,21.169494592949874,19.65420035061767,1.7120949941716974,Au,COMPLETE
2286,0.0,2026-04-26 15:33:36.002588,2026-04-26 15:33:36.735070,0 days 00:00:00.732482,33.212822693995165,17.8806509831429,1.7446626952382294,Au,PRUNED
2287,3.7593984962402023,2026-04-26 15:33:36.153154,2026-04-26 15:33:37.150686,0 days 00:00:00.997532,33.70424638423173,14.644488841908663,1.719337530075807,Au,PRUNED
2288,0.0,2026-04-26 15:33:36.187741,2026-04-26 15:33:37.482251,0 days 00:00:01.294510,21.53725068422537,16.30931560080512,1.7703448216034554,Au,PRUNED
2289,0.0,2026-04-26 15:33:36.288238,2026-04-26 15:33:36.918855,0 days 00:00:00.630617,34.841758243509204,19.9690040037952,1.6538408202444408,Au,PRUNED
2290,-529.5238095237506,2026-04-26 15:33:36.524165,2026-04-26 15:33:37.122061,0 days 00:00:00.597896,20.809795292891614,19.50581796689639,1.7382947307866967,Au,COMPLETE
2291,0.0,2026-04-26 15:33:36.547263,2026-04-26 15:33:37.058179,0 days 00:00:00.510916,28.59431148403452,19.853003830787145,1.6890004306658115,Au,PRUNED
2292,140.65934065933618,2026-04-26 15:33:36.574057,2026-04-26 15:33:37.255040,0 days 00:00:00.680983,32.90204996917358,17.027334098503083,1.6558259059002016,Au,PRUNED
2293,0.0,2026-04-26 15:33:36.795135,2026-04-26 15:33:37.589400,0 days 00:00:00.794265,20.017800644565014,15.367411658489285,1.7251535158764968,Au,PRUNED
2294,0.0,2026-04-26 15:33:36.825951,2026-04-26 15:33:37.652538,0 days 00:00:00.826587,33.788258872775984,19.88987033477899,1.760069440426984,Au,PRUNED
2295,0.0,2026-04-26 15:33:37.172607,2026-04-26 15:33:37.654826,0 days 00:00:00.482219,20.650146074103414,16.43382337712327,1.6986101534808657,Au,PRUNED
2296,-557.4750830564136,2026-04-26 15:33:37.193966,2026-04-26 15:33:38.294921,0 days 00:00:01.100955,20.87750590087594,19.73008320750021,1.7911246078164025,Au,COMPLETE
2297,0.0,2026-04-26 15:33:37.219340,2026-04-26 15:33:37.739017,0 days 00:00:00.519677,35.10957371877531,19.973754326620337,1.7362959527834403,Au,PRUNED
2298,-567.5447483957444,2026-04-26 15:33:37.343650,2026-04-26 15:33:37.891505,0 days 00:00:00.547855,20.962459266292743,19.772188657849295,1.782867783032298,Au,COMPLETE
2299,0.0,2026-04-26 15:33:37.483253,2026-04-26 15:33:38.294921,0 days 00:00:00.811668,33.55410298452761,19.86893035813788,1.9910414757556922,Au,PRUNED
2300,0.0,2026-04-26 15:33:37.548142,2026-04-26 15:33:38.247818,0 days 00:00:00.699676,33.84412739767163,17.81208217988974,1.973525521736033,Au,PRUNED
2301,141.75824175823726,2026-04-26 15:33:37.683796,2026-04-26 15:33:38.274857,0 days 00:00:00.591061,32.314542243019595,16.819979974793526,1.78169882130506,Au,PRUNED
2302,-551.3495720868349,2026-04-26 15:33:37.811171,2026-04-26 15:33:38.352655,0 days 00:00:00.541484,21.03459747099162,19.71505295434296,1.6024536432262282,Au,COMPLETE
2303,0.0,2026-04-26 15:33:37.830028,2026-04-26 15:33:38.400844,0 days 00:00:00.570816,20.06834652820107,17.193748219704187,1.7088506395086103,Au,PRUNED
2304,0.0,2026-04-26 15:33:37.894018,2026-04-26 15:33:38.622206,0 days 00:00:00.728188,33.231322671148995,17.988322361600222,1.5723882233927402,Au,PRUNED
2305,0.0,2026-04-26 15:33:37.985248,2026-04-26 15:33:38.658248,0 days 00:00:00.673000,20.4832427860907,19.77072109465198,1.4467128855096107,Au,PRUNED
2306,0.0,2026-04-26 15:33:38.293470,2026-04-26 15:33:38.896546,0 days 00:00:00.603076,20.442369867614826,19.317319384995745,1.5680818754454058,Au,PRUNED
2307,-8.403361344536819,2026-04-26 15:33:38.447423,2026-04-26 15:33:39.067364,0 days 00:00:00.619941,21.760608156499195,19.585234684283492,1.645853522711485,Au,PRUNED
2308,0.0,2026-04-26 15:33:38.496024,2026-04-26 15:33:39.190009,0 days 00:00:00.693985,23.04405912286948,19.991552897879806,1.8098603599492726,Au,PRUNED
2309,-19.480519480515923,2026-04-26 15:33:38.509801,2026-04-26 15:33:39.097553,0 days 00:00:00.587752,53.668597670962114,8.958319362577802,1.8960478162710088,Ag,PRUNED
2310,0.0,2026-04-26 15:33:38.555498,2026-04-26 15:33:39.309461,0 days 00:00:00.753963,32.8733662263453,19.95770898828579,1.7593485054699596,Au,PRUNED
2311,0.0,2026-04-26 15:33:38.575195,2026-04-26 15:33:39.274593,0 days 00:00:00.699398,20.21078567599728,18.47739518355777,1.66738548262898,Au,PRUNED
2312,0.0,2026-04-26 15:33:38.728819,2026-04-26 15:33:39.273092,0 days 00:00:00.544273,36.87458910295963,19.80983944868895,1.534017451838948,Au,PRUNED
2313,0.0,2026-04-26 15:33:38.743155,2026-04-26 15:33:39.679540,0 days 00:00:00.936385,36.16386645988905,19.978428730729835,1.6319200285959785,Au,PRUNED
2314,0.0,2026-04-26 15:33:39.008662,2026-04-26 15:33:39.716731,0 days 00:00:00.708069,33.69249392638959,17.82923671174895,1.7104986920530787,Au,PRUNED
2315,0.0,2026-04-26 15:33:39.160801,2026-04-26 15:33:39.989246,0 days 00:00:00.828445,38.758889058743485,19.96693950057507,1.69218592864935,Au,PRUNED
2316,0.0,2026-04-26 15:33:39.213700,2026-04-26 15:33:39.894771,0 days 00:00:00.681071,34.290753587594466,19.927466141874273,1.578086824761515,Au,PRUNED
