number,value,datetime_start,datetime_complete,duration,params_D2_nm,params_D3_nm,params_D4_nm,params_metal,state
131,-9.523809523808879,2026-04-26 15:29:57.303533,2026-04-26 15:29:57.933574,0 days 00:00:00.630041,38.9437985390326,9.059470639825484,0.7060291899447851,Au,PRUNED
132,-21.03290295709812,2026-04-26 15:29:57.388897,2026-04-26 15:29:57.780990,0 days 00:00:00.392093,52.209384660062604,13.222723126875378,1.2000839467824198,Ag,COMPLETE
133,-9.523809523808879,2026-04-26 15:29:57.430429,2026-04-26 15:29:58.001331,0 days 00:00:00.570902,38.39112561682255,13.642726403533457,1.2468666401017356,Cu,PRUNED
134,-16.504854368930463,2026-04-26 15:29:57.405012,2026-04-26 15:29:58.033761,0 days 00:00:00.628749,63.376596223636035,6.957957395551153,0.23716432801641224,Au,COMPLETE
135,105.0420168067195,2026-04-26 15:29:57.526796,2026-04-26 15:29:57.906170,0 days 00:00:00.379374,47.08145324947091,16.91474992085947,1.3606663423653496,Cu,PRUNED
136,-10.20408163265208,2026-04-26 15:29:57.601670,2026-04-26 15:29:58.209876,0 days 00:00:00.608206,35.599304478422184,12.758697124558848,1.4405688860916654,Ag,PRUNED
137,-2.3612750885477745,2026-04-26 15:29:58.017045,2026-04-26 15:29:58.699517,0 days 00:00:00.682472,99.66345325142953,3.320376763209949,1.9010921161826375,Au,PRUNED
138,-15.838509316768507,2026-04-26 15:29:58.037275,2026-04-26 15:29:58.503772,0 days 00:00:00.466497,62.16209298026893,18.08591679828163,0.8220394645713774,Ag,COMPLETE
139,-5.714285714285252,2026-04-26 15:29:58.063967,2026-04-26 15:29:58.436348,0 days 00:00:00.372381,26.984273219396908,8.740487879943261,0.5100076718889225,Ag,PRUNED
140,-0.5854800936768048,2026-04-26 15:29:58.116451,2026-04-26 15:29:58.492683,0 days 00:00:00.376232,84.72244974627264,13.707836198076775,0.5991656924537234,Au,PRUNED
141,0.5580357142857051,2026-04-26 15:29:58.145062,2026-04-26 15:29:58.686332,0 days 00:00:00.541270,105.20990697295453,17.59098015977661,0.6297963637258468,Ag,PRUNED
142,-7.389162561575839,2026-04-26 15:29:58.159401,2026-04-26 15:29:58.687906,0 days 00:00:00.528505,34.38205493021325,4.7571831634080235,1.2560687939156887,Au,PRUNED
143,-23.664785062957712,2026-04-26 15:29:58.250699,2026-04-26 15:29:58.770279,0 days 00:00:00.519580,68.89684898547917,13.240301051984904,1.2780094152401729,Ag,COMPLETE
144,-22.522522522517313,2026-04-26 15:29:58.266700,2026-04-26 15:29:58.850812,0 days 00:00:00.584112,82.12745849699915,5.357060210962472,1.778951686672904,Ag,COMPLETE
145,-0.5952380952380847,2026-04-26 15:29:58.500101,2026-04-26 15:29:59.153744,0 days 00:00:00.653643,95.67866627664637,18.156584650962426,1.5486974921521677,Au,PRUNED
146,-8.241758241757601,2026-04-26 15:29:58.577489,2026-04-26 15:29:59.276645,0 days 00:00:00.699156,51.57340670008681,14.060577535166855,0.3679717923399001,Cu,PRUNED
147,0.0,2026-04-26 15:29:58.743853,2026-04-26 15:29:59.472280,0 days 00:00:00.728427,118.3714043403795,13.725320864660226,1.9768974507137789,Cu,PRUNED
148,-15.286270150081842,2026-04-26 15:29:58.796657,2026-04-26 15:29:59.121672,0 days 00:00:00.325015,39.234505939895556,16.651051941116194,0.5297836688496593,Ag,COMPLETE
149,-0.5760368663594372,2026-04-26 15:29:58.832979,2026-04-26 15:29:59.566612,0 days 00:00:00.733633,75.47333166508034,17.303494261298628,1.244721350015316,Cu,PRUNED
150,0.0,2026-04-26 15:29:58.840125,2026-04-26 15:29:59.339686,0 days 00:00:00.499561,118.94071394102822,18.843532815987064,1.724412467012811,Ag,PRUNED
151,-4.464285714285431,2026-04-26 15:29:58.983176,2026-04-26 15:29:59.545457,0 days 00:00:00.562281,28.324499955407727,5.642531770727311,1.2265375092279638,Cu,PRUNED
152,-13.872491145216921,2026-04-26 15:29:59.031304,2026-04-26 15:29:59.637974,0 days 00:00:00.606670,52.43507216851456,3.928675251718856,1.056024705816918,Au,COMPLETE
153,-2.2321428571428203,2026-04-26 15:29:59.249397,2026-04-26 15:29:59.738176,0 days 00:00:00.488779,102.2072021791091,7.562550636375497,0.4051017376584377,Au,PRUNED
154,-8.241758241757601,2026-04-26 15:29:59.287618,2026-04-26 15:30:00.026705,0 days 00:00:00.739087,39.38402785766014,6.702208831506233,1.5130988474324394,Cu,PRUNED
155,-14.079670329668685,2026-04-26 15:29:59.426301,2026-04-26 15:29:59.854853,0 days 00:00:00.428552,39.07151873001831,11.408152908857755,1.2742869115718665,Ag,COMPLETE
156,-0.5952380952380847,2026-04-26 15:29:59.489937,2026-04-26 15:30:00.168311,0 days 00:00:00.678374,83.75941940115415,15.092579199417868,1.8294218227029044,Au,PRUNED
157,-5.952380952380451,2026-04-26 15:29:59.522246,2026-04-26 15:30:00.216333,0 days 00:00:00.694087,33.8341179759912,3.031881965671531,0.23267952849114293,Cu,PRUNED
158,-16.496598639453893,2026-04-26 15:29:59.585726,2026-04-26 15:30:00.104010,0 days 00:00:00.518284,78.11553200503946,3.6218248008871927,0.640647981009581,Au,COMPLETE
159,-15.706806282720429,2026-04-26 15:29:59.693595,2026-04-26 15:30:00.416433,0 days 00:00:00.722838,84.48994749793833,0.7452000728522029,1.0295268975752243,Au,COMPLETE
160,-21.804511278192468,2026-04-26 15:29:59.750474,2026-04-26 15:30:00.318858,0 days 00:00:00.568384,58.57378089840427,13.870521349964474,1.5704807017538294,Ag,COMPLETE
161,-6.302521008402986,2026-04-26 15:29:59.793077,2026-04-26 15:30:00.317353,0 days 00:00:00.524276,29.2542434214929,8.088156900961046,1.4706742356847806,Au,PRUNED
162,-1.1614401858304098,2026-04-26 15:30:00.028209,2026-04-26 15:30:00.619687,0 days 00:00:00.591478,116.71879443945018,8.80212584218161,0.7725512245138719,Au,PRUNED
163,0.0,2026-04-26 15:30:00.096965,2026-04-26 15:30:00.603646,0 days 00:00:00.506681,109.40898825439332,18.467285576136387,0.2696776951194011,Cu,PRUNED
164,-1.1520737327188744,2026-04-26 15:30:00.294204,2026-04-26 15:30:00.842269,0 days 00:00:00.548065,87.5524861195445,16.711231168248073,0.4844610252532263,Cu,PRUNED
165,-6.122448979591482,2026-04-26 15:30:00.332063,2026-04-26 15:30:01.010659,0 days 00:00:00.678596,30.146672056661,8.226826453627599,1.8898654171827935,Au,PRUNED
166,-15.224562293832703,2026-04-26 15:30:00.339768,2026-04-26 15:30:00.876244,0 days 00:00:00.536476,71.56017746963346,5.564562190472948,1.3473306810927888,Au,COMPLETE
167,-8.241758241757601,2026-04-26 15:30:00.324799,2026-04-26 15:30:00.872649,0 days 00:00:00.547850,58.184056166812475,8.810724003371323,1.5924823574392133,Au,PRUNED
168,-34.1614906832174,2026-04-26 15:30:00.517449,2026-04-26 15:30:00.982829,0 days 00:00:00.465380,58.485018109125704,4.748147788503415,1.2823204578396885,Ag,COMPLETE
169,-0.5903187721369436,2026-04-26 15:30:00.639974,2026-04-26 15:30:01.096744,0 days 00:00:00.456770,112.13554629687265,17.39100397376142,0.9352473377472157,Au,PRUNED
170,-12.605042016805228,2026-04-26 15:30:00.692403,2026-04-26 15:30:01.097744,0 days 00:00:00.405341,34.94112597712809,7.010321672174179,1.7942472917520071,Ag,PRUNED
171,-12.755102040815403,2026-04-26 15:30:00.718177,2026-04-26 15:30:01.258009,0 days 00:00:00.539832,42.541894245952456,10.147797151377397,1.4081780970474593,Au,PRUNED
172,-4.201680672268656,2026-04-26 15:30:00.924790,2026-04-26 15:30:01.520713,0 days 00:00:00.595923,25.75784148458417,10.083993723184614,0.2359163237243901,Cu,PRUNED
173,-7.936507936507342,2026-04-26 15:30:00.900368,2026-04-26 15:30:01.614400,0 days 00:00:00.714032,60.25766484383039,13.543715965933831,0.35811664607046545,Cu,PRUNED
174,0.0,2026-04-26 15:30:01.032148,2026-04-26 15:30:01.694438,0 days 00:00:00.662290,20.9331164275047,8.409468312430764,1.417172066550824,Au,PRUNED
175,-1.1806375442738872,2026-04-26 15:30:01.080071,2026-04-26 15:30:01.614400,0 days 00:00:00.534329,110.1772990003436,0.7038234533467405,0.13028842810943084,Ag,PRUNED
176,0.5370569280343631,2026-04-26 15:30:01.134968,2026-04-26 15:30:01.581184,0 days 00:00:00.446216,73.5526111352415,9.867264608102712,1.2506228714525902,Au,PRUNED
177,-1.7564402810304147,2026-04-26 15:30:01.161330,2026-04-26 15:30:02.061187,0 days 00:00:00.899857,107.71103196696625,10.470972458588848,0.8007939478570337,Ag,PRUNED
178,-7.936507936507342,2026-04-26 15:30:01.206158,2026-04-26 15:30:01.915556,0 days 00:00:00.709398,45.132935758827,13.548356263924683,0.9614197598879175,Cu,PRUNED
179,-10.20408163265208,2026-04-26 15:30:01.340822,2026-04-26 15:30:01.800590,0 days 00:00:00.459768,38.654286015449614,1.8648274214382838,0.9513447380411145,Cu,PRUNED
180,-11.904761904760901,2026-04-26 15:30:01.749313,2026-04-26 15:30:02.289058,0 days 00:00:00.539745,94.56429577948649,1.0807315720211346,0.9134902015587646,Au,PRUNED
181,-1.050420168067195,2026-04-26 15:30:01.801589,2026-04-26 15:30:02.407351,0 days 00:00:00.605762,21.4168161732101,9.762528292991039,1.4450539504113287,Ag,PRUNED
182,-17.13564213563999,2026-04-26 15:30:01.854863,2026-04-26 15:30:02.408350,0 days 00:00:00.553487,43.70497834513621,13.534211639477954,0.913399500684202,Ag,COMPLETE
183,-6.302521008402986,2026-04-26 15:30:01.888125,2026-04-26 15:30:02.628491,0 days 00:00:00.740366,28.532051486847358,9.899147732529647,1.970354310337741,Cu,PRUNED
184,-10.989010989010133,2026-04-26 15:30:01.917607,2026-04-26 15:30:02.674831,0 days 00:00:00.757224,74.93218161350114,8.966039625787092,0.17842050075561647,Cu,PRUNED
185,-0.5903187721369436,2026-04-26 15:30:01.977936,2026-04-26 15:30:02.846285,0 days 00:00:00.868349,117.75793929566413,13.500507116313731,1.4167623168450283,Au,PRUNED
186,-1.1614401858304098,2026-04-26 15:30:02.016382,2026-04-26 15:30:02.457879,0 days 00:00:00.441497,87.60264670788435,17.75794093888907,1.0345101262913596,Cu,PRUNED
187,0.0,2026-04-26 15:30:02.101541,2026-04-26 15:30:02.541707,0 days 00:00:00.440166,46.072482005582266,17.003974091698872,0.9609518437709483,Au,PRUNED
188,-0.5903187721369436,2026-04-26 15:30:02.343232,2026-04-26 15:30:03.032014,0 days 00:00:00.688782,77.8202691117367,14.719655726084026,0.6822009572934343,Au,PRUNED
189,-29.992107340165358,2026-04-26 15:30:02.481568,2026-04-26 15:30:03.093719,0 days 00:00:00.612151,65.97891206255647,7.964499630843569,1.3435135900396895,Ag,COMPLETE
190,-0.5903187721369436,2026-04-26 15:30:02.536001,2026-04-26 15:30:03.244608,0 days 00:00:00.708607,108.46886207833509,13.843177649345385,0.49310748288830697,Au,PRUNED
191,-12.755102040815403,2026-04-26 15:30:02.576681,2026-04-26 15:30:03.140595,0 days 00:00:00.563914,28.12952687745635,19.31027914855214,1.199895984731947,Ag,PRUNED
192,-17.116524028964452,2026-04-26 15:30:02.690558,2026-04-26 15:30:03.308654,0 days 00:00:00.618096,73.39768874598778,5.288021612307227,0.15144125091268817,Au,COMPLETE
193,-10.714285714284633,2026-04-26 15:30:02.714682,2026-04-26 15:30:03.407078,0 days 00:00:00.692396,24.92086571075847,18.26918171531266,1.35607001524065,Cu,PRUNED
194,-0.5903187721369436,2026-04-26 15:30:02.747451,2026-04-26 15:30:03.388506,0 days 00:00:00.641055,108.2523282131771,16.79601630228574,0.4384026664462818,Au,PRUNED
195,-1.7564402810304147,2026-04-26 15:30:02.900927,2026-04-26 15:30:03.796504,0 days 00:00:00.895577,105.0929245127088,10.821776398707646,1.2190447579998227,Ag,PRUNED
196,-0.5807200929152049,2026-04-26 15:30:03.126866,2026-04-26 15:30:03.560858,0 days 00:00:00.433992,86.33986882622928,19.528759976200686,1.7896849034943103,Cu,PRUNED
197,-14.360313315924966,2026-04-26 15:30:03.210246,2026-04-26 15:30:03.591455,0 days 00:00:00.381209,60.45327577094072,4.049298222258434,0.32360010828191904,Cu,COMPLETE
198,-1.0351966873705694,2026-04-26 15:30:03.309657,2026-04-26 15:30:04.027434,0 days 00:00:00.717777,54.924800878656626,16.75452620245126,1.2049644859010846,Au,PRUNED
199,-1.770956316410831,2026-04-26 15:30:03.348725,2026-04-26 15:30:03.796504,0 days 00:00:00.447779,111.36174317993692,2.4913469783623596,0.38564994061439406,Cu,PRUNED
200,-22.907647907644986,2026-04-26 15:30:03.396427,2026-04-26 15:30:03.952299,0 days 00:00:00.555872,78.27325964295005,15.718881165853226,0.3949806124972043,Ag,COMPLETE
201,-24.553571428565867,2026-04-26 15:30:03.498309,2026-04-26 15:30:04.028486,0 days 00:00:00.530177,50.164422927740965,10.0091890468498,0.4888483855609632,Ag,COMPLETE
202,0.0,2026-04-26 15:30:03.530124,2026-04-26 15:30:04.007622,0 days 00:00:00.477498,119.74400717569415,7.85518029877941,0.22838284367873504,Cu,PRUNED
203,-47.88069073780719,2026-04-26 15:30:03.655565,2026-04-26 15:30:04.278129,0 days 00:00:00.622564,64.24284292551448,2.812045074073517,0.39856946716176234,Ag,COMPLETE
204,-48.154093097886324,2026-04-26 15:30:03.705841,2026-04-26 15:30:04.554153,0 days 00:00:00.848312,71.06264950633886,2.0287163607476977,0.5850037647506969,Ag,COMPLETE
205,-42.30235783631765,2026-04-26 15:30:03.944757,2026-04-26 15:30:04.522301,0 days 00:00:00.577544,73.24272200404492,2.149700936227949,1.0530042095716996,Ag,COMPLETE
206,-35.96757852075717,2026-04-26 15:30:03.968366,2026-04-26 15:30:04.462054,0 days 00:00:00.493688,66.20070219516948,7.085911903708634,0.682529925800548,Ag,COMPLETE
207,-40.720961281689824,2026-04-26 15:30:04.066539,2026-04-26 15:30:04.654186,0 days 00:00:00.587647,74.96933038916102,2.6892371805639907,0.9407441527862943,Ag,COMPLETE
208,-47.360248447179046,2026-04-26 15:30:04.108341,2026-04-26 15:30:04.655191,0 days 00:00:00.546850,67.94603458756531,2.8525124140745635,0.4658825753494386,Ag,COMPLETE
209,-40.10025062654879,2026-04-26 15:30:04.135636,2026-04-26 15:30:04.770887,0 days 00:00:00.635251,73.63157294153392,4.022977167982645,0.8105119861110723,Ag,COMPLETE
210,-31.004709576129454,2026-04-26 15:30:04.219334,2026-04-26 15:30:04.769270,0 days 00:00:00.549936,57.795351928006106,10.03330142701672,0.2803896069929771,Ag,COMPLETE
211,-40.25974025972228,2026-04-26 15:30:04.439080,2026-04-26 15:30:05.003955,0 days 00:00:00.564875,73.83886015467445,2.6858501467901332,1.0935458574878147,Ag,COMPLETE
212,-44.832826747696615,2026-04-26 15:30:04.695572,2026-04-26 15:30:05.147811,0 days 00:00:00.452239,77.30434812696888,0.6891651438181774,0.9106944785318947,Ag,COMPLETE
213,-49.00332225910773,2026-04-26 15:30:04.735023,2026-04-26 15:30:05.235083,0 days 00:00:00.500060,66.04556645503973,1.3061161942013615,0.7634685977584927,Ag,COMPLETE
214,-39.3858477970445,2026-04-26 15:30:04.780921,2026-04-26 15:30:05.253038,0 days 00:00:00.472117,80.9870235326712,1.3522152874429674,0.7606784490441176,Ag,COMPLETE
215,-47.6190476190203,2026-04-26 15:30:04.793939,2026-04-26 15:30:05.301715,0 days 00:00:00.507776,64.93414595586714,0.519459274796327,1.034449052753191,Ag,COMPLETE
216,-40.72096128168993,2026-04-26 15:30:04.840901,2026-04-26 15:30:05.237139,0 days 00:00:00.396238,76.3048541386444,2.3030670462420453,0.959612110967504,Ag,COMPLETE
217,-48.701298701270986,2026-04-26 15:30:04.786092,2026-04-26 15:30:05.251533,0 days 00:00:00.465441,65.89026834377,2.1792997606143674,0.5031152599813171,Ag,COMPLETE
218,-44.285714285691846,2026-04-26 15:30:04.940755,2026-04-26 15:30:05.612617,0 days 00:00:00.671862,63.34026832755276,3.398116278251593,0.5580527648406857,Ag,COMPLETE
219,-49.91394148017631,2026-04-26 15:30:05.195192,2026-04-26 15:30:05.850831,0 days 00:00:00.655639,76.07421550297119,0.7169675124649171,0.49038543659864414,Ag,COMPLETE
220,-42.58241758239707,2026-04-26 15:30:05.287197,2026-04-26 15:30:05.755152,0 days 00:00:00.467955,71.70984733406928,2.9328590426662977,0.8645524944615165,Ag,COMPLETE
221,-46.54895666128992,2026-04-26 15:30:05.419594,2026-04-26 15:30:05.753767,0 days 00:00:00.334173,60.41738506710894,1.5794423118095064,0.541118352971191,Ag,COMPLETE
222,-52.44122965638673,2026-04-26 15:30:05.457462,2026-04-26 15:30:05.983883,0 days 00:00:00.526421,66.0780311185,0.7294017286206405,0.510759094519363,Ag,COMPLETE
223,-40.22191400830228,2026-04-26 15:30:05.479633,2026-04-26 15:30:05.928717,0 days 00:00:00.449084,81.0658555030091,0.6215103097368742,0.8305076805082202,Ag,COMPLETE
224,-47.07792207789528,2026-04-26 15:30:05.496632,2026-04-26 15:30:05.999480,0 days 00:00:00.502848,70.44214419138004,0.5315633095624945,1.0904209923295476,Ag,COMPLETE
225,-50.522648083592756,2026-04-26 15:30:05.504936,2026-04-26 15:30:06.164733,0 days 00:00:00.659797,62.628683380530774,0.8584175167531787,0.5886288139096176,Ag,COMPLETE
226,-36.67953667951995,2026-04-26 15:30:05.728154,2026-04-26 15:30:06.318352,0 days 00:00:00.590198,48.72474898436509,1.0993912780445658,0.36888444315900026,Ag,COMPLETE
227,-50.77452667811024,2026-04-26 15:30:05.954881,2026-04-26 15:30:06.492399,0 days 00:00:00.537518,70.14851963712144,2.4558585000263546,0.16820123042260823,Ag,COMPLETE
228,-45.2380952380702,2026-04-26 15:30:06.017573,2026-04-26 15:30:06.593129,0 days 00:00:00.575556,54.774355044235506,0.9679351407008959,0.30807918411179586,Ag,COMPLETE
229,-34.26248548198387,2026-04-26 15:30:06.076450,2026-04-26 15:30:06.431538,0 days 00:00:00.355088,81.79205387253482,0.8376067547178038,1.3110161187251856,Ag,COMPLETE
230,-32.03781512603871,2026-04-26 15:30:06.120389,2026-04-26 15:30:06.710749,0 days 00:00:00.590360,82.53553007359379,1.6884340918918899,1.2617255772730596,Ag,COMPLETE
231,-48.41269841267152,2026-04-26 15:30:06.139897,2026-04-26 15:30:06.666632,0 days 00:00:00.526735,72.37687809150182,3.0665788719812825,0.2603140952872086,Ag,COMPLETE
232,-53.8033395175907,2026-04-26 15:30:06.193093,2026-04-26 15:30:06.590883,0 days 00:00:00.397790,64.94789796969724,1.0454933713942192,0.2556181304771623,Ag,COMPLETE
233,-44.74097331237721,2026-04-26 15:30:06.276719,2026-04-26 15:30:06.833229,0 days 00:00:00.556510,56.473172893076075,0.7560896035264733,0.6606604645971845,Ag,COMPLETE
234,-41.49659863943593,2026-04-26 15:30:06.405716,2026-04-26 15:30:06.940870,0 days 00:00:00.535154,79.83398625752244,3.353664730982697,0.2401498541137107,Ag,COMPLETE
235,-56.54761904757955,2026-04-26 15:30:06.600988,2026-04-26 15:30:07.068947,0 days 00:00:00.467959,68.4026060472736,0.9843532438878345,0.10615495215166704,Ag,COMPLETE
236,-44.999999999977334,2026-04-26 15:30:06.697124,2026-04-26 15:30:07.126218,0 days 00:00:00.429094,75.03265092975059,4.294297779374319,0.14326096379762293,Ag,COMPLETE
237,-53.11355311351901,2026-04-26 15:30:06.745492,2026-04-26 15:30:07.505124,0 days 00:00:00.759632,70.97100565588585,1.3858939590226855,0.2647965467099238,Ag,COMPLETE
238,-51.53707052437935,2026-04-26 15:30:06.774490,2026-04-26 15:30:07.289747,0 days 00:00:00.515257,77.11152420599498,0.8431391517040565,0.18703246891245573,Ag,COMPLETE
239,-52.87569573280449,2026-04-26 15:30:06.834315,2026-04-26 15:30:07.507511,0 days 00:00:00.673196,62.892119263917856,0.5840510655530748,0.36607881017854815,Ag,COMPLETE
240,-55.01930501926762,2026-04-26 15:30:06.944462,2026-04-26 15:30:07.488216,0 days 00:00:00.543754,72.94244183869762,0.5743210155810425,0.29008219050964,Ag,COMPLETE
241,-50.522648083592934,2026-04-26 15:30:06.989630,2026-04-26 15:30:07.550491,0 days 00:00:00.560861,65.25779045511928,1.4408493772091262,0.430046625854797,Ag,COMPLETE
242,-43.73177842563363,2026-04-26 15:30:07.127741,2026-04-26 15:30:07.651479,0 days 00:00:00.523738,58.65513950324409,2.474604358603378,0.5531528079595087,Ag,COMPLETE
243,-53.11355311351901,2026-04-26 15:30:07.203563,2026-04-26 15:30:07.650428,0 days 00:00:00.446865,70.72346920504641,1.0863127680968325,0.3212063583752591,Ag,COMPLETE
244,-50.77452667811024,2026-04-26 15:30:07.318678,2026-04-26 15:30:07.910030,0 days 00:00:00.591352,70.12432118216502,2.4134844882802136,0.19715640902714576,Ag,COMPLETE
245,-48.701298701270986,2026-04-26 15:30:07.482020,2026-04-26 15:30:08.235913,0 days 00:00:00.753893,66.66629199507591,3.1312033930618917,0.2074751764856611,Ag,COMPLETE
246,-55.01930501926796,2026-04-26 15:30:07.659154,2026-04-26 15:30:08.299732,0 days 00:00:00.640578,64.07288094957984,0.8806393552025708,0.12954551519294774,Ag,COMPLETE
247,-52.44122965638617,2026-04-26 15:30:07.698114,2026-04-26 15:30:08.284281,0 days 00:00:00.586167,66.18456304012174,1.9450051309447747,0.11110978562554932,Ag,COMPLETE
248,-53.11355311351901,2026-04-26 15:30:07.726318,2026-04-26 15:30:08.191568,0 days 00:00:00.465250,66.29446862029913,1.6475835979948013,0.11628861373073053,Ag,COMPLETE
249,-52.87569573280392,2026-04-26 15:30:07.744558,2026-04-26 15:30:08.300741,0 days 00:00:00.556183,74.27254278774552,1.0098978027505743,0.22003722270247666,Ag,COMPLETE
250,-53.113553113519586,2026-04-26 15:30:07.804646,2026-04-26 15:30:08.329326,0 days 00:00:00.524680,70.11699126984628,1.3438765974581681,0.27635269466576684,Ag,COMPLETE
251,-52.87569573280449,2026-04-26 15:30:07.891606,2026-04-26 15:30:08.313507,0 days 00:00:00.421901,73.37773114195409,0.5642348122733094,0.3713764375697918,Ag,COMPLETE
252,-53.113553113518456,2026-04-26 15:30:07.993498,2026-04-26 15:30:08.597482,0 days 00:00:00.603984,74.36401397243226,0.9205282976096136,0.2914224115267203,Ag,COMPLETE
253,-56.54761904757989,2026-04-26 15:30:08.356441,2026-04-26 15:30:08.884332,0 days 00:00:00.527891,70.3643785707508,0.5760529783064765,0.23938673466908858,Ag,COMPLETE
254,-51.5370705243799,2026-04-26 15:30:08.426470,2026-04-26 15:30:08.952849,0 days 00:00:00.526379,72.76441537898191,0.8872179478096809,0.39606818944866196,Ag,COMPLETE
255,-52.441229656386405,2026-04-26 15:30:08.473180,2026-04-26 15:30:09.038032,0 days 00:00:00.564852,69.39034037712058,1.2915399374026801,0.3294778991471354,Ag,COMPLETE
256,-53.113553113518456,2026-04-26 15:30:08.488023,2026-04-26 15:30:08.999294,0 days 00:00:00.511271,67.76369810179432,1.6834639715777573,0.17054792894355889,Ag,COMPLETE
257,-54.79452054790749,2026-04-26 15:30:08.510541,2026-04-26 15:30:08.897469,0 days 00:00:00.386928,63.88828181900169,0.6289447991945113,0.1207999279733662,Ag,COMPLETE
258,-42.85714285712047,2026-04-26 15:30:08.532926,2026-04-26 15:30:08.975342,0 days 00:00:00.442416,82.71047511915361,0.8668505316841238,0.26752071286158985,Ag,COMPLETE
259,-55.77299412912056,2026-04-26 15:30:08.568168,2026-04-26 15:30:09.001383,0 days 00:00:00.433215,63.83523309370881,0.7415591091236441,0.10574625479681357,Ag,COMPLETE
260,-49.651567944220396,2026-04-26 15:30:08.708078,2026-04-26 15:30:09.311277,0 days 00:00:00.603199,78.35114506424912,1.2764061294157796,0.10280398525596435,Ag,COMPLETE
261,-57.34406438627744,2026-04-26 15:30:09.015105,2026-04-26 15:30:09.599567,0 days 00:00:00.584462,66.84187108122804,0.6209097593121565,0.10138813448569224,Ag,COMPLETE
