number,value,datetime_start,datetime_complete,duration,params_D2_nm,params_D3_nm,params_D4_nm,params_metal,state
932,-2.2675736961450865,2026-04-26 15:31:12.613587,2026-04-26 15:31:13.439977,0 days 00:00:00.826390,91.38812765355611,8.18072485386105,1.7381791816947687,Cu,PRUNED
933,4.2016806722684095,2026-04-26 15:31:12.770554,2026-04-26 15:31:13.280058,0 days 00:00:00.509504,24.30787829759221,19.393822097737225,1.9293215798024663,Au,PRUNED
934,-4.464285714285152,2026-04-26 15:31:12.783786,2026-04-26 15:31:13.441483,0 days 00:00:00.657697,22.38730009794427,19.955400059209943,1.9096126011454575,Au,PRUNED
935,0.0,2026-04-26 15:31:12.799390,2026-04-26 15:31:13.560800,0 days 00:00:00.761410,34.33599402930354,16.900408180129688,1.6938794102329164,Au,PRUNED
936,0.0,2026-04-26 15:31:12.817638,2026-04-26 15:31:13.404997,0 days 00:00:00.587359,33.47254500966361,19.480557541346055,1.9866839953455826,Au,PRUNED
937,0.0,2026-04-26 15:31:12.907503,2026-04-26 15:31:13.559801,0 days 00:00:00.652298,36.652984493243736,17.200009545353073,1.9830460595372017,Au,PRUNED
938,-8.928571428570304,2026-04-26 15:31:13.301136,2026-04-26 15:31:13.923824,0 days 00:00:00.622688,21.761147592929706,19.895184971318667,1.823712282821803,Au,PRUNED
939,-8.928571428570304,2026-04-26 15:31:13.355579,2026-04-26 15:31:13.932652,0 days 00:00:00.577073,21.525600490740846,19.720102954722794,1.7792346128210321,Au,PRUNED
940,-8.928571428570304,2026-04-26 15:31:13.457402,2026-04-26 15:31:14.202368,0 days 00:00:00.744966,22.263370309074507,19.104900410094896,1.9728542639222308,Au,PRUNED
941,-8.403361344536819,2026-04-26 15:31:13.522548,2026-04-26 15:31:14.137469,0 days 00:00:00.614921,21.140295658456587,19.67117621570816,1.974662461542848,Au,PRUNED
942,-6.696428571428148,2026-04-26 15:31:13.531358,2026-04-26 15:31:14.140985,0 days 00:00:00.609627,24.14643839779283,17.845474696619355,1.675537991315438,Ag,PRUNED
943,0.0,2026-04-26 15:31:13.501408,2026-04-26 15:31:14.124487,0 days 00:00:00.623079,35.93265328126646,19.750800567833146,1.9011262772445758,Au,PRUNED
944,0.0,2026-04-26 15:31:13.640462,2026-04-26 15:31:14.062732,0 days 00:00:00.422270,34.57147634641761,19.163514167261525,1.6563901047843883,Au,PRUNED
945,-4.464285714285152,2026-04-26 15:31:13.682131,2026-04-26 15:31:14.419221,0 days 00:00:00.737090,22.51327911999603,19.592355953834993,1.887672338546913,Au,PRUNED
946,-539.9871009351205,2026-04-26 15:31:13.988972,2026-04-26 15:31:14.742103,0 days 00:00:00.753131,21.434316948358692,18.96402853939852,1.985428152312084,Au,COMPLETE
947,0.0,2026-04-26 15:31:13.979626,2026-04-26 15:31:14.916324,0 days 00:00:00.936698,37.82133516259786,19.853107976635126,1.4819025547150881,Au,PRUNED
948,0.0,2026-04-26 15:31:14.218423,2026-04-26 15:31:14.853972,0 days 00:00:00.635549,23.553518849721833,19.840580954589857,1.6630736271860762,Au,PRUNED
949,0.0,2026-04-26 15:31:14.248429,2026-04-26 15:31:14.864771,0 days 00:00:00.616342,21.1740257689046,18.196572353489984,1.995266380120876,Au,PRUNED
950,-4.464285714285152,2026-04-26 15:31:14.267523,2026-04-26 15:31:15.102322,0 days 00:00:00.834799,22.620528262540887,19.821504312804944,1.5907188736651379,Au,PRUNED
951,0.0,2026-04-26 15:31:14.295942,2026-04-26 15:31:14.793163,0 days 00:00:00.497221,31.421348116847863,19.764347799755495,1.5830333789975914,Au,PRUNED
952,0.0,2026-04-26 15:31:14.341724,2026-04-26 15:31:14.867531,0 days 00:00:00.525807,49.05161613149605,19.732249205198734,1.9699064757796354,Au,PRUNED
953,-531.0213172127945,2026-04-26 15:31:14.487717,2026-04-26 15:31:15.166554,0 days 00:00:00.678837,21.401248334210813,19.15501833114255,1.6753574271698102,Au,COMPLETE
954,0.0,2026-04-26 15:31:14.933180,2026-04-26 15:31:15.685643,0 days 00:00:00.752463,20.053475829035452,19.860653702890104,1.8906044830253659,Au,PRUNED
955,0.0,2026-04-26 15:31:14.985136,2026-04-26 15:31:15.660342,0 days 00:00:00.675206,20.54672144732236,19.716087458096382,1.4777540294032312,Au,PRUNED
956,0.0,2026-04-26 15:31:15.008931,2026-04-26 15:31:15.590329,0 days 00:00:00.581398,34.73117040472031,19.932355130211437,1.5962455658461745,Au,PRUNED
957,-23.809523809520613,2026-04-26 15:31:15.056242,2026-04-26 15:31:15.752930,0 days 00:00:00.696688,36.43637224936143,18.474999505239943,1.9718316875733162,Ag,PRUNED
958,0.0,2026-04-26 15:31:15.072121,2026-04-26 15:31:15.590329,0 days 00:00:00.518208,20.662678397838306,17.921649732983973,1.6985269061413868,Au,PRUNED
959,-0.5854800936768048,2026-04-26 15:31:15.088949,2026-04-26 15:31:15.556688,0 days 00:00:00.467739,102.71460202739829,10.377882648029129,1.824740774450917,Au,PRUNED
960,0.0,2026-04-26 15:31:15.121309,2026-04-26 15:31:15.590329,0 days 00:00:00.469020,37.50717729564424,18.875872933230333,1.9965595519104185,Au,PRUNED
961,0.0,2026-04-26 15:31:15.299322,2026-04-26 15:31:15.945686,0 days 00:00:00.646364,36.03496732962026,19.979266567915626,1.758339395103731,Au,PRUNED
962,-4.464285714285152,2026-04-26 15:31:15.598175,2026-04-26 15:31:16.409366,0 days 00:00:00.811191,22.862066754550206,19.240213594323574,1.988188095195685,Au,PRUNED
963,0.0,2026-04-26 15:31:15.705357,2026-04-26 15:31:16.376664,0 days 00:00:00.671307,20.281504749740755,17.231843653498984,1.764831257035265,Au,PRUNED
964,0.0,2026-04-26 15:31:15.726426,2026-04-26 15:31:16.503857,0 days 00:00:00.777431,20.60324685573712,18.466407749785787,1.6404743802534716,Au,PRUNED
965,0.0,2026-04-26 15:31:15.783755,2026-04-26 15:31:16.252518,0 days 00:00:00.468763,38.34156592986838,19.727814371806517,1.960919084814483,Au,PRUNED
966,0.0,2026-04-26 15:31:15.832917,2026-04-26 15:31:16.338248,0 days 00:00:00.505331,34.8739146002095,19.249059752753926,1.9951782318218336,Au,PRUNED
967,0.0,2026-04-26 15:31:15.862643,2026-04-26 15:31:16.295226,0 days 00:00:00.432583,20.14942319674817,17.904426021047698,0.964217122845852,Au,PRUNED
968,0.0,2026-04-26 15:31:15.881375,2026-04-26 15:31:16.394398,0 days 00:00:00.513023,20.16843731811925,18.095548708626307,1.6355773425961653,Au,PRUNED
969,0.0,2026-04-26 15:31:16.009143,2026-04-26 15:31:16.795930,0 days 00:00:00.786787,22.00094365648465,17.729164491854842,1.6380276923751407,Au,PRUNED
970,0.0,2026-04-26 15:31:16.346369,2026-04-26 15:31:17.045332,0 days 00:00:00.698963,36.03257968149544,17.951492615909267,1.5987933777820742,Au,PRUNED
971,4.464285714285152,2026-04-26 15:31:16.425097,2026-04-26 15:31:16.845739,0 days 00:00:00.420642,24.241540184851694,19.96053603916271,1.519375074847617,Au,PRUNED
972,0.0,2026-04-26 15:31:16.448064,2026-04-26 15:31:16.845739,0 days 00:00:00.397675,34.5231682653743,18.465910281962277,1.6851301322372858,Au,PRUNED
973,0.0,2026-04-26 15:31:16.461307,2026-04-26 15:31:16.919058,0 days 00:00:00.457751,20.732693685839106,17.097930254005764,1.2387965142520179,Au,PRUNED
974,-338.7398627573049,2026-04-26 15:31:16.522528,2026-04-26 15:31:17.186231,0 days 00:00:00.663703,22.80276686566099,17.289295749820386,1.477687679305748,Au,COMPLETE
975,-1.6357688113413043,2026-04-26 15:31:16.546102,2026-04-26 15:31:17.206342,0 days 00:00:00.660240,77.57429578293376,11.860946127596373,0.6177898963217645,Cu,PRUNED
976,0.0,2026-04-26 15:31:16.572590,2026-04-26 15:31:17.183715,0 days 00:00:00.611125,42.463325676724146,18.9384737447867,0.6709168838573536,Au,PRUNED
977,146.1538461538415,2026-04-26 15:31:16.858615,2026-04-26 15:31:17.403741,0 days 00:00:00.545126,26.120638779929955,19.792551166440816,1.6159165165707643,Au,PRUNED
978,-10.714285714284633,2026-04-26 15:31:16.887473,2026-04-26 15:31:17.590459,0 days 00:00:00.702986,23.139948348532045,17.384799213338045,1.7404481924093147,Au,PRUNED
979,-8.928571428570304,2026-04-26 15:31:17.000630,2026-04-26 15:31:17.660558,0 days 00:00:00.659928,21.88465758231486,19.882428621343333,1.8961690188994798,Au,PRUNED
980,-1.0660980810234213,2026-04-26 15:31:17.077943,2026-04-26 15:31:17.620599,0 days 00:00:00.542656,20.702298108921514,18.698874887449573,1.762189526292596,Ag,PRUNED
981,-11.278195488720607,2026-04-26 15:31:17.145784,2026-04-26 15:31:17.556273,0 days 00:00:00.410489,22.55597134726342,18.106383153507245,1.9824421001166452,Au,PRUNED
982,0.0,2026-04-26 15:31:17.286578,2026-04-26 15:31:18.055818,0 days 00:00:00.769240,31.173034334151964,17.808659771266274,1.9902104951376196,Au,PRUNED
983,0.0,2026-04-26 15:31:17.304680,2026-04-26 15:31:17.993528,0 days 00:00:00.688848,28.55928195479989,19.603569420535116,1.9949182566531312,Au,PRUNED
984,0.0,2026-04-26 15:31:17.280038,2026-04-26 15:31:17.901635,0 days 00:00:00.621597,20.22276516898203,19.311408086121062,1.7748481155145104,Au,PRUNED
985,0.0,2026-04-26 15:31:17.524086,2026-04-26 15:31:18.118725,0 days 00:00:00.594639,20.025356476682884,17.152596734471746,1.7183298216629532,Au,PRUNED
986,0.0,2026-04-26 15:31:17.635720,2026-04-26 15:31:18.333748,0 days 00:00:00.698028,20.68757257050841,18.92778285853895,1.9807152748378967,Au,PRUNED
987,0.0,2026-04-26 15:31:17.701335,2026-04-26 15:31:18.536447,0 days 00:00:00.835112,20.010840029755403,18.801594209799216,1.9727982022069208,Au,PRUNED
988,0.0,2026-04-26 15:31:17.728969,2026-04-26 15:31:18.497002,0 days 00:00:00.768033,20.214465888800042,16.93675219905947,1.8179457710486124,Au,PRUNED
989,0.0,2026-04-26 15:31:17.752878,2026-04-26 15:31:18.260274,0 days 00:00:00.507396,20.01843697999122,18.218670929708363,1.1969642903689002,Au,PRUNED
990,8.403361344536819,2026-04-26 15:31:17.972533,2026-04-26 15:31:18.889134,0 days 00:00:00.916601,26.635258964641466,19.7835633053239,0.4372963059396605,Au,PRUNED
991,-0.5952380952380847,2026-04-26 15:31:18.089182,2026-04-26 15:31:18.944022,0 days 00:00:00.854840,95.46496091568551,18.25073376691896,0.16918278084894411,Au,PRUNED
992,0.0,2026-04-26 15:31:18.176217,2026-04-26 15:31:18.803846,0 days 00:00:00.627629,20.52734480164871,19.735348963415863,1.5564661720743713,Au,PRUNED
993,-8.928571428570304,2026-04-26 15:31:18.197470,2026-04-26 15:31:18.663786,0 days 00:00:00.466316,21.91362912353983,19.969172127994238,1.77071330040451,Au,PRUNED
994,0.0,2026-04-26 15:31:18.368716,2026-04-26 15:31:19.060910,0 days 00:00:00.692194,20.0676638618503,16.37365944987003,1.9982415971192178,Au,PRUNED
995,0.0,2026-04-26 15:31:18.415983,2026-04-26 15:31:19.099395,0 days 00:00:00.683412,20.716324717923243,19.056636825062622,1.1110584977655773,Au,PRUNED
996,0.0,2026-04-26 15:31:18.620276,2026-04-26 15:31:19.148470,0 days 00:00:00.528194,20.612785243930777,17.789388674054834,1.233369650793759,Au,PRUNED
997,0.0,2026-04-26 15:31:18.764647,2026-04-26 15:31:19.367537,0 days 00:00:00.602890,20.505298991262077,19.236969790535024,1.154170744684749,Au,PRUNED
998,0.0,2026-04-26 15:31:18.666360,2026-04-26 15:31:19.532474,0 days 00:00:00.866114,35.62152459975402,16.941141980390757,1.6503799557333245,Au,PRUNED
999,0.0,2026-04-26 15:31:18.898244,2026-04-26 15:31:19.688123,0 days 00:00:00.789879,38.48437460259014,17.903941230407796,1.3419191001863355,Au,PRUNED
1000,0.0,2026-04-26 15:31:19.000770,2026-04-26 15:31:19.886570,0 days 00:00:00.885800,36.03563314166138,19.95574610229536,1.5646696034065135,Au,PRUNED
1001,0.0,2026-04-26 15:31:19.150838,2026-04-26 15:31:19.973150,0 days 00:00:00.822312,44.66104505410543,19.96005108332069,1.2994460432102843,Au,PRUNED
1002,0.0,2026-04-26 15:31:19.214868,2026-04-26 15:31:20.045859,0 days 00:00:00.830991,37.79754788108934,17.124443586073575,1.7031912335580641,Au,PRUNED
1003,0.0,2026-04-26 15:31:19.226145,2026-04-26 15:31:19.774636,0 days 00:00:00.548491,38.39169330255827,17.712548503130616,1.339818869042534,Au,PRUNED
1004,0.0,2026-04-26 15:31:19.240900,2026-04-26 15:31:19.772614,0 days 00:00:00.531714,20.809324409411722,16.33831682328674,1.50559289143062,Au,PRUNED
1005,0.0,2026-04-26 15:31:19.427898,2026-04-26 15:31:20.358919,0 days 00:00:00.931021,34.72817401350619,17.862113072012555,1.3991010250620362,Au,PRUNED
1006,0.0,2026-04-26 15:31:19.717580,2026-04-26 15:31:20.572989,0 days 00:00:00.855409,36.89439871275806,18.75134143205688,1.7004920179881011,Au,PRUNED
1007,0.0,2026-04-26 15:31:19.839803,2026-04-26 15:31:20.650275,0 days 00:00:00.810472,20.833356405688544,17.407332439499232,1.5309890330584581,Au,PRUNED
1008,0.0,2026-04-26 15:31:19.879063,2026-04-26 15:31:20.634356,0 days 00:00:00.755293,40.24967286036704,17.220816204719334,1.7162589499457128,Au,PRUNED
1009,0.0,2026-04-26 15:31:19.908002,2026-04-26 15:31:20.419176,0 days 00:00:00.511174,39.03862616273237,19.857884235493053,1.5733353771242182,Au,PRUNED
1010,0.0,2026-04-26 15:31:19.971143,2026-04-26 15:31:20.557116,0 days 00:00:00.585973,40.26378628506595,19.708740376392416,1.7476030551481958,Au,PRUNED
1011,143.9560439560394,2026-04-26 15:31:20.087625,2026-04-26 15:31:20.777040,0 days 00:00:00.689415,30.580421321638436,17.175603251677487,1.6109225708135084,Au,PRUNED
1012,0.0,2026-04-26 15:31:20.132597,2026-04-26 15:31:20.893482,0 days 00:00:00.760885,22.477815317690276,16.380377854359487,1.595284471240225,Au,PRUNED
1013,0.0,2026-04-26 15:31:20.408895,2026-04-26 15:31:21.055823,0 days 00:00:00.646928,24.304223004154483,19.675188871778495,1.4273695054567148,Au,PRUNED
1014,0.0,2026-04-26 15:31:20.522412,2026-04-26 15:31:21.199801,0 days 00:00:00.677389,32.76345650578753,17.195402156234202,1.99962848979999,Au,PRUNED
1015,0.0,2026-04-26 15:31:20.670736,2026-04-26 15:31:21.293533,0 days 00:00:00.622797,20.04505426383018,18.44875597438351,1.3255147152275324,Au,PRUNED
1016,0.0,2026-04-26 15:31:20.698482,2026-04-26 15:31:21.662360,0 days 00:00:00.963878,39.22021711877401,19.496828969982698,1.9916421329641536,Au,PRUNED
1017,0.0,2026-04-26 15:31:20.749167,2026-04-26 15:31:21.360590,0 days 00:00:00.611423,20.64575167602676,16.933711022094446,1.71738461164741,Au,PRUNED
1018,0.0,2026-04-26 15:31:20.815829,2026-04-26 15:31:21.538573,0 days 00:00:00.722744,30.739495251477585,19.628231610281894,1.668521443792369,Au,PRUNED
1019,0.0,2026-04-26 15:31:20.846671,2026-04-26 15:31:21.772248,0 days 00:00:00.925577,27.829788684071637,19.844623365448793,1.604838923468602,Au,PRUNED
1020,-8.928571428570304,2026-04-26 15:31:20.954598,2026-04-26 15:31:21.414648,0 days 00:00:00.460050,22.125329953998833,19.976510813823708,1.5196237836921753,Au,PRUNED
1021,-8.928571428570304,2026-04-26 15:31:21.116440,2026-04-26 15:31:21.814713,0 days 00:00:00.698273,22.34695570586127,19.544420930667172,1.7560315208097694,Au,PRUNED
1022,0.0,2026-04-26 15:31:21.260741,2026-04-26 15:31:21.813713,0 days 00:00:00.552972,20.694766200724295,18.617094991683896,1.961674343935897,Au,PRUNED
1023,0.0,2026-04-26 15:31:21.367193,2026-04-26 15:31:22.013767,0 days 00:00:00.646574,20.4395155727611,19.4391677522257,1.6987747378754805,Au,PRUNED
1024,0.0,2026-04-26 15:31:21.418161,2026-04-26 15:31:22.270581,0 days 00:00:00.852420,21.153090694271704,19.932796750602233,0.9282641563127875,Au,PRUNED
1025,0.0,2026-04-26 15:31:21.492356,2026-04-26 15:31:22.270581,0 days 00:00:00.778225,20.722697889891883,16.887910002495396,1.609973924355415,Au,PRUNED
1026,0.0,2026-04-26 15:31:21.694670,2026-04-26 15:31:22.208294,0 days 00:00:00.513624,29.272473158181498,19.907181109574672,1.8456863215068917,Au,PRUNED
1027,0.0,2026-04-26 15:31:21.745443,2026-04-26 15:31:22.424792,0 days 00:00:00.679349,20.49027113452294,16.81853907919669,1.530012004180461,Au,PRUNED
1028,0.0,2026-04-26 15:31:21.819767,2026-04-26 15:31:22.739719,0 days 00:00:00.919952,27.4404018992658,19.695221929419368,1.9589926799216821,Au,PRUNED
1029,0.0,2026-04-26 15:31:21.880258,2026-04-26 15:31:22.570374,0 days 00:00:00.690116,20.449594273284056,15.164452232956283,1.1090550820763398,Au,PRUNED
1030,0.0,2026-04-26 15:31:21.944768,2026-04-26 15:31:22.472930,0 days 00:00:00.528162,33.46345617385042,19.98346909395863,1.9920473086267254,Au,PRUNED
1031,0.0,2026-04-26 15:31:22.102302,2026-04-26 15:31:22.776584,0 days 00:00:00.674282,30.82108964863409,19.918828510265545,1.0010171782254769,Au,PRUNED
1032,-1.7857142857142545,2026-04-26 15:31:22.320545,2026-04-26 15:31:23.129799,0 days 00:00:00.809254,106.61973204822853,0.6777149490891876,1.097969882168204,Cu,PRUNED
1033,-4.464285714285152,2026-04-26 15:31:22.382911,2026-04-26 15:31:23.012186,0 days 00:00:00.629275,22.066390736107728,19.823883999195342,1.9763659476338988,Au,PRUNED
1034,0.0,2026-04-26 15:31:22.489519,2026-04-26 15:31:23.227884,0 days 00:00:00.738365,41.831493232887766,19.828465193911306,1.8475789443474901,Cu,PRUNED
1035,-8.928571428570304,2026-04-26 15:31:22.553559,2026-04-26 15:31:23.130799,0 days 00:00:00.577240,21.63714390101033,19.74868104550229,1.9908574126762908,Au,PRUNED
1036,0.0,2026-04-26 15:31:22.640206,2026-04-26 15:31:23.224742,0 days 00:00:00.584536,21.744529223238573,17.655508997126763,1.7489682759943996,Au,PRUNED
1037,0.0,2026-04-26 15:31:22.662453,2026-04-26 15:31:23.254309,0 days 00:00:00.591856,20.202738392693092,16.762602562843792,1.9399146828318887,Au,PRUNED
1038,0.0,2026-04-26 15:31:22.782131,2026-04-26 15:31:23.488229,0 days 00:00:00.706098,21.930778865196217,15.938580873921639,1.731708438842799,Au,PRUNED
1039,-8.928571428570304,2026-04-26 15:31:22.852876,2026-04-26 15:31:23.349785,0 days 00:00:00.496909,22.060831151232396,19.73001746311247,1.9871390109162264,Au,PRUNED
1040,0.0,2026-04-26 15:31:23.087248,2026-04-26 15:31:23.764476,0 days 00:00:00.677228,20.59947983913145,19.258704489541543,1.3505020474116516,Au,PRUNED
1041,138.46153846153408,2026-04-26 15:31:23.183919,2026-04-26 15:31:23.800281,0 days 00:00:00.616362,36.91299401617024,16.789787910474153,0.8425597213023923,Au,PRUNED
1042,2.5510204081630805,2026-04-26 15:31:23.314522,2026-04-26 15:31:23.802284,0 days 00:00:00.487762,32.01852186781312,16.47398016932536,1.5716078186197984,Au,PRUNED
1043,145.05494505494045,2026-04-26 15:31:23.365957,2026-04-26 15:31:24.158900,0 days 00:00:00.792943,26.7164420955648,19.93367992080933,1.4613473648791238,Au,PRUNED
1044,0.0,2026-04-26 15:31:23.398071,2026-04-26 15:31:24.143998,0 days 00:00:00.745927,20.69509953844766,19.924214936646162,1.7012524240087386,Ag,PRUNED
1045,4.464285714285152,2026-04-26 15:31:23.429135,2026-04-26 15:31:24.128329,0 days 00:00:00.699194,36.47385835537017,19.968092037629827,1.9758253547708398,Ag,PRUNED
1046,0.0,2026-04-26 15:31:23.452474,2026-04-26 15:31:24.049981,0 days 00:00:00.597507,20.050645008103704,19.54262671996807,1.7271196534720745,Au,PRUNED
1047,0.0,2026-04-26 15:31:23.527252,2026-04-26 15:31:24.065140,0 days 00:00:00.537888,36.696837949951465,17.171934734925465,1.7477392589711784,Au,PRUNED
1048,0.0,2026-04-26 15:31:23.941631,2026-04-26 15:31:24.550025,0 days 00:00:00.608394,37.47832497142096,17.1336716120347,1.5036382579331304,Au,PRUNED
1049,-6.696428571428148,2026-04-26 15:31:23.982695,2026-04-26 15:31:24.505408,0 days 00:00:00.522713,23.652035653191895,15.011983517023316,1.723409043008362,Ag,PRUNED
1050,0.0,2026-04-26 15:31:24.020721,2026-04-26 15:31:24.577912,0 days 00:00:00.557191,37.60601399065878,16.465171969196675,1.3936357505777355,Au,PRUNED
1051,7.936507936507047,2026-04-26 15:31:24.097794,2026-04-26 15:31:24.551027,0 days 00:00:00.453233,25.52333296632636,19.910987182667906,1.2219736897896403,Au,PRUNED
1052,0.0,2026-04-26 15:31:24.193151,2026-04-26 15:31:24.552534,0 days 00:00:00.359383,20.779407446304088,19.835267785814565,1.1813686871488223,Au,PRUNED
1053,0.0,2026-04-26 15:31:24.206903,2026-04-26 15:31:24.960945,0 days 00:00:00.754042,34.63575666386915,16.87898183847645,1.500078609674606,Au,PRUNED
1054,0.0,2026-04-26 15:31:24.222093,2026-04-26 15:31:24.685979,0 days 00:00:00.463886,39.65240775100507,16.938919647871828,1.3908253592789874,Au,PRUNED
1055,-8.928571428570304,2026-04-26 15:31:24.275248,2026-04-26 15:31:24.962449,0 days 00:00:00.687201,22.323809998284837,19.81459880736039,1.4495857633790088,Au,PRUNED
1056,0.0,2026-04-26 15:31:24.619498,2026-04-26 15:31:25.343964,0 days 00:00:00.724466,20.049607898774436,16.88894522005542,1.6453765939763936,Au,PRUNED
1057,0.0,2026-04-26 15:31:24.646849,2026-04-26 15:31:25.463445,0 days 00:00:00.816596,20.216164104651597,19.97040940320157,1.3832485787316349,Au,PRUNED
1058,-1.0660980810234213,2026-04-26 15:31:24.673814,2026-04-26 15:31:25.283829,0 days 00:00:00.610015,20.367940959627724,13.589479287640568,1.0286457949969166,Ag,PRUNED
1059,0.0,2026-04-26 15:31:24.688088,2026-04-26 15:31:25.308429,0 days 00:00:00.620341,20.200821849439457,16.700425611507857,1.9774116799954489,Au,PRUNED
1060,-556.0159098441509,2026-04-26 15:31:24.752528,2026-04-26 15:31:25.541517,0 days 00:00:00.788989,20.663428762741663,19.689467060270296,1.9750900944464709,Au,COMPLETE
1061,-8.928571428570304,2026-04-26 15:31:24.876888,2026-04-26 15:31:25.343964,0 days 00:00:00.467076,21.710207267101065,19.957777414008326,1.4029844727993548,Au,PRUNED
1062,-13.227513227512237,2026-04-26 15:31:25.024007,2026-04-26 15:31:25.748358,0 days 00:00:00.724351,29.02425173205172,19.931977667996968,1.0803784794400701,Ag,PRUNED
1063,0.0,2026-04-26 15:31:25.033502,2026-04-26 15:31:25.617918,0 days 00:00:00.584416,37.92962574056869,17.013093460485727,1.7478244991369734,Au,PRUNED
1064,0.0,2026-04-26 15:31:25.368767,2026-04-26 15:31:26.195242,0 days 00:00:00.826475,26.128826444958065,19.90468829249021,1.9512016987253264,Au,PRUNED
1065,0.0,2026-04-26 15:31:25.495399,2026-04-26 15:31:25.977863,0 days 00:00:00.482464,28.69612240762267,19.894399448532504,1.7411386508531244,Au,PRUNED
1066,0.0,2026-04-26 15:31:25.361238,2026-04-26 15:31:26.268824,0 days 00:00:00.907586,35.67921286820213,19.87935369009331,1.6435327908651252,Au,PRUNED
1067,-8.403361344536819,2026-04-26 15:31:25.558606,2026-04-26 15:31:26.064067,0 days 00:00:00.505461,21.425285584314505,19.883764036662694,1.6143086046701294,Au,PRUNED
1068,-3.9682539682535234,2026-04-26 15:31:25.666359,2026-04-26 15:31:26.196241,0 days 00:00:00.529882,24.987089789503596,17.664482314965657,1.9985885936701155,Au,PRUNED
1069,0.0,2026-04-26 15:31:25.707821,2026-04-26 15:31:26.534265,0 days 00:00:00.826444,35.4173474292276,19.874954022301658,1.936045486556694,Au,PRUNED
1070,0.0,2026-04-26 15:31:25.797874,2026-04-26 15:31:26.502456,0 days 00:00:00.704582,20.063887801340933,17.334600136071188,1.9577336706252852,Au,PRUNED
