number,value,datetime_start,datetime_complete,duration,params_D2_nm,params_D3_nm,params_D4_nm,params_metal,state
2041,0.0,2026-04-26 15:33:09.484924,2026-04-26 15:33:09.996273,0 days 00:00:00.511349,20.501514336172654,16.888559370735216,1.9859412511290484,Au,PRUNED
2042,-13.60544217686944,2026-04-26 15:33:09.497945,2026-04-26 15:33:10.136452,0 days 00:00:00.638507,22.58996979625175,18.211376274300143,1.982875376781081,Cu,PRUNED
2043,0.0,2026-04-26 15:33:09.561375,2026-04-26 15:33:10.022161,0 days 00:00:00.460786,32.21083921549845,19.948883982370884,1.6195002196082926,Au,PRUNED
2044,0.0,2026-04-26 15:33:09.720219,2026-04-26 15:33:10.492922,0 days 00:00:00.772703,49.89614461713222,19.644809882738148,1.692027475386057,Au,PRUNED
2045,-10.582010582009788,2026-04-26 15:33:09.753067,2026-04-26 15:33:10.477827,0 days 00:00:00.724760,43.84970685989055,9.649113775684624,1.2164453210650494,Cu,PRUNED
2046,-1.1614401858304098,2026-04-26 15:33:09.795623,2026-04-26 15:33:10.388975,0 days 00:00:00.593352,83.07911517784562,18.726673819139435,1.4985211611742704,Cu,PRUNED
2047,-19.480519480515923,2026-04-26 15:33:09.998271,2026-04-26 15:33:10.633674,0 days 00:00:00.635403,77.23214168923376,9.626016604270102,1.350077243580964,Ag,PRUNED
2048,-562.541918175654,2026-04-26 15:33:10.108997,2026-04-26 15:33:10.771780,0 days 00:00:00.662783,21.26783923828229,19.91651665500953,1.3308802902145909,Au,COMPLETE
2049,0.0,2026-04-26 15:33:10.134933,2026-04-26 15:33:10.772336,0 days 00:00:00.637403,34.99959024609288,19.811952418499168,1.660798817866193,Au,PRUNED
2050,0.0,2026-04-26 15:33:10.269461,2026-04-26 15:33:10.933384,0 days 00:00:00.663923,33.41722426097317,17.34770578956176,1.4413550525565135,Au,PRUNED
2051,0.0,2026-04-26 15:33:10.318503,2026-04-26 15:33:11.333608,0 days 00:00:01.015105,20.100942174928505,18.6774853634563,1.7505706415541884,Au,PRUNED
2052,0.0,2026-04-26 15:33:10.580805,2026-04-26 15:33:11.102224,0 days 00:00:00.521419,34.0092926817674,18.15066230929255,1.5422847546234295,Au,PRUNED
2053,-12.605042016805228,2026-04-26 15:33:10.600621,2026-04-26 15:33:11.303233,0 days 00:00:00.702612,22.717909134989124,19.66766155545572,0.9147166126752392,Au,PRUNED
2054,0.0,2026-04-26 15:33:10.684983,2026-04-26 15:33:11.506326,0 days 00:00:00.821343,32.93710548303024,19.959881769158976,1.005897939588534,Au,PRUNED
2055,-11.278195488720607,2026-04-26 15:33:10.730533,2026-04-26 15:33:11.556001,0 days 00:00:00.825468,25.516730200662185,17.104524024190905,1.0889007810287763,Au,PRUNED
2056,0.0,2026-04-26 15:33:10.847904,2026-04-26 15:33:11.439715,0 days 00:00:00.591811,31.993330825282143,19.446933516457754,1.0889358571944217,Au,PRUNED
2057,0.0,2026-04-26 15:33:10.947316,2026-04-26 15:33:11.506326,0 days 00:00:00.559010,38.2638043710605,19.91400687026126,1.1851207064640057,Au,PRUNED
2058,-1.7857142857142545,2026-04-26 15:33:11.024031,2026-04-26 15:33:11.926957,0 days 00:00:00.902926,97.38062433491211,3.799231152325448,1.5041202370039737,Cu,PRUNED
2059,0.0,2026-04-26 15:33:11.179491,2026-04-26 15:33:11.892159,0 days 00:00:00.712668,20.36193558589493,16.697998652965246,1.2839332195855595,Au,PRUNED
2060,139.56043956043513,2026-04-26 15:33:11.402667,2026-04-26 15:33:12.457980,0 days 00:00:01.055313,36.54493868826081,16.01486685000349,1.2260129019544057,Au,PRUNED
2061,-11.904761904760573,2026-04-26 15:33:11.413677,2026-04-26 15:33:12.130777,0 days 00:00:00.717100,26.11462833360167,17.16809699142135,1.0653328706381278,Au,PRUNED
2062,0.0,2026-04-26 15:33:11.490652,2026-04-26 15:33:12.341736,0 days 00:00:00.851084,21.0407994265509,18.102655525137767,1.1891770114219764,Au,PRUNED
2063,140.65934065933618,2026-04-26 15:33:11.618376,2026-04-26 15:33:12.280745,0 days 00:00:00.662369,32.832998998587016,17.86661168957009,1.0172927706032246,Au,PRUNED
2064,0.0,2026-04-26 15:33:11.646448,2026-04-26 15:33:12.226659,0 days 00:00:00.580211,20.25236142496433,17.68550656556915,1.061710171671056,Au,PRUNED
2065,0.0,2026-04-26 15:33:11.693957,2026-04-26 15:33:12.614284,0 days 00:00:00.920327,20.237510477248662,15.537367260130697,1.2096213384709815,Au,PRUNED
2066,0.0,2026-04-26 15:33:11.966184,2026-04-26 15:33:12.951424,0 days 00:00:00.985240,28.49426430428294,17.115088727732655,1.3982530148894423,Au,PRUNED
2067,7.518796992480405,2026-04-26 15:33:12.017356,2026-04-26 15:33:12.800245,0 days 00:00:00.782889,29.762116783501334,17.32005587178832,1.1568964624772133,Au,PRUNED
2068,0.0,2026-04-26 15:33:12.318938,2026-04-26 15:33:13.162769,0 days 00:00:00.843831,20.83792818586335,17.77082834525086,1.2966605542761016,Au,PRUNED
2069,0.0,2026-04-26 15:33:12.344442,2026-04-26 15:33:12.992843,0 days 00:00:00.648401,20.540298148566766,17.214892241809785,1.9708511318686923,Au,PRUNED
2070,142.8571428571383,2026-04-26 15:33:12.389038,2026-04-26 15:33:13.226512,0 days 00:00:00.837474,31.68606500436279,17.525651273985652,1.2159447446234473,Au,PRUNED
2071,0.0,2026-04-26 15:33:12.413670,2026-04-26 15:33:13.470500,0 days 00:00:01.056830,20.967907125766136,17.829088268881854,1.2326400793163772,Au,PRUNED
2072,125.7995735607637,2026-04-26 15:33:12.658721,2026-04-26 15:33:13.426349,0 days 00:00:00.767628,47.892483182749295,15.149661281824159,0.10488471556812728,Au,PRUNED
2073,-18.63354037266917,2026-04-26 15:33:12.682218,2026-04-26 15:33:13.162769,0 days 00:00:00.480551,40.774246665265494,17.757270230742364,1.4499726929358003,Ag,PRUNED
2074,-542.5324675324055,2026-04-26 15:33:12.949963,2026-04-26 15:33:13.663481,0 days 00:00:00.713518,20.543324824082216,19.96352354093201,1.6184195426808752,Au,COMPLETE
2075,146.1538461538415,2026-04-26 15:33:13.255653,2026-04-26 15:33:14.317332,0 days 00:00:01.061679,26.68123155745723,19.942732427638195,1.3020139897823049,Au,PRUNED
2076,0.0,2026-04-26 15:33:13.287391,2026-04-26 15:33:14.079913,0 days 00:00:00.792522,42.82683915034889,17.10487470459636,1.2869880433015188,Au,PRUNED
2077,0.0,2026-04-26 15:33:13.319025,2026-04-26 15:33:14.300745,0 days 00:00:00.981720,24.011355306543344,19.7534142226608,1.3913756743016403,Au,PRUNED
2078,0.0,2026-04-26 15:33:13.349544,2026-04-26 15:33:14.193387,0 days 00:00:00.843843,35.42073420937432,19.872463873429613,1.2861888791368408,Au,PRUNED
2079,0.0,2026-04-26 15:33:13.402956,2026-04-26 15:33:14.081910,0 days 00:00:00.678954,30.789923240603358,19.750122978678462,1.3431030680801443,Au,PRUNED
2080,-12.605042016805228,2026-04-26 15:33:13.506025,2026-04-26 15:33:14.034033,0 days 00:00:00.528008,21.891101367971814,19.74579245039519,1.3215580349779779,Au,PRUNED
2081,0.0,2026-04-26 15:33:13.593414,2026-04-26 15:33:14.080909,0 days 00:00:00.487495,28.49570069061049,19.799695114296487,1.2848823566537748,Au,PRUNED
2082,0.0,2026-04-26 15:33:13.804537,2026-04-26 15:33:14.564653,0 days 00:00:00.760116,20.030999333071478,19.622908966009014,1.5985973278437577,Au,PRUNED
2083,0.0,2026-04-26 15:33:14.156170,2026-04-26 15:33:15.026326,0 days 00:00:00.870156,21.14176540420835,18.140462197974493,1.448579995294079,Au,PRUNED
2084,147.25274725274258,2026-04-26 15:33:14.196900,2026-04-26 15:33:14.976979,0 days 00:00:00.780079,24.495410279701208,19.996300443722486,1.9829583426960014,Au,PRUNED
2085,0.0,2026-04-26 15:33:14.221727,2026-04-26 15:33:14.843333,0 days 00:00:00.621606,20.09648987977757,19.959933034663038,1.3755678397770001,Au,PRUNED
2086,0.0,2026-04-26 15:33:14.246826,2026-04-26 15:33:15.235590,0 days 00:00:00.988764,35.78206706481913,19.970501669422198,1.7332438520743794,Au,PRUNED
2087,-544.357469014941,2026-04-26 15:33:14.239020,2026-04-26 15:33:15.097337,0 days 00:00:00.858317,21.126072892088185,19.993266584143452,1.1316538621796521,Au,COMPLETE
2088,0.0,2026-04-26 15:33:14.352287,2026-04-26 15:33:14.939582,0 days 00:00:00.587295,33.79923477839492,19.978143125799857,1.6654751627045818,Au,PRUNED
2089,-0.5952380952380847,2026-04-26 15:33:14.460321,2026-04-26 15:33:15.461432,0 days 00:00:01.001111,91.17396593824483,19.967283508047842,0.9530737840423176,Au,PRUNED
2090,-1.1074197120708567,2026-04-26 15:33:14.699390,2026-04-26 15:33:15.530828,0 days 00:00:00.831438,71.1329893792528,19.633968090238515,1.8168156740183417,Ag,PRUNED
2091,0.0,2026-04-26 15:33:14.937960,2026-04-26 15:33:15.749477,0 days 00:00:00.811517,20.971590942447587,17.376177807947265,1.660957126575929,Au,PRUNED
2092,-582.8433068141802,2026-04-26 15:33:15.114651,2026-04-26 15:33:16.031535,0 days 00:00:00.916884,20.676141153629036,19.94964930629102,1.9862956447120195,Au,COMPLETE
2093,-542.5324675324055,2026-04-26 15:33:15.126345,2026-04-26 15:33:15.859999,0 days 00:00:00.733654,20.98058579423904,19.69557762100211,1.549715064362332,Au,COMPLETE
2094,141.75824175823726,2026-04-26 15:33:15.192902,2026-04-26 15:33:16.123188,0 days 00:00:00.930286,31.83794220487828,16.59565014226136,1.997949338234951,Au,PRUNED
2095,0.0,2026-04-26 15:33:15.264292,2026-04-26 15:33:16.030915,0 days 00:00:00.766623,20.545441050364143,19.598224547195016,1.5092121086836305,Au,PRUNED
2096,0.0,2026-04-26 15:33:15.348049,2026-04-26 15:33:16.156900,0 days 00:00:00.808851,32.80000253670489,17.266932060835202,1.659196289763331,Au,PRUNED
2097,0.0,2026-04-26 15:33:15.548145,2026-04-26 15:33:16.234043,0 days 00:00:00.685898,34.144119668955796,17.991980871049808,1.7055923960541652,Au,PRUNED
2098,3.105590062111528,2026-04-26 15:33:15.626840,2026-04-26 15:33:16.234712,0 days 00:00:00.607872,45.01417087099614,19.76276885696993,1.4870557248192535,Ag,PRUNED
2099,0.0,2026-04-26 15:33:15.857976,2026-04-26 15:33:16.684178,0 days 00:00:00.826202,20.914710253795636,16.88005619448845,1.7954819282837855,Au,PRUNED
2100,0.0,2026-04-26 15:33:16.176421,2026-04-26 15:33:16.889726,0 days 00:00:00.713305,28.49925561214821,19.96550292647262,1.9985066545453873,Au,PRUNED
2101,0.0,2026-04-26 15:33:16.210893,2026-04-26 15:33:16.937214,0 days 00:00:00.726321,34.14970245543569,16.615383555400673,1.9134065369994016,Au,PRUNED
2102,0.0,2026-04-26 15:33:16.226427,2026-04-26 15:33:16.888721,0 days 00:00:00.662294,36.42159462834175,16.776425460491943,1.8209950106454535,Au,PRUNED
2103,0.0,2026-04-26 15:33:16.252421,2026-04-26 15:33:16.858592,0 days 00:00:00.606171,21.04231984713251,15.460478431632055,1.9760806959965722,Au,PRUNED
2104,0.0,2026-04-26 15:33:16.333686,2026-04-26 15:33:17.342890,0 days 00:00:01.009204,37.105002271423956,19.93649521763483,1.9857387088079697,Au,PRUNED
2105,-9.852216748767784,2026-04-26 15:33:16.347240,2026-04-26 15:33:17.175441,0 days 00:00:00.828201,24.293711932923138,19.851613900515034,1.9380266682368197,Ag,PRUNED
2106,0.0,2026-04-26 15:33:16.400230,2026-04-26 15:33:17.356450,0 days 00:00:00.956220,21.53379037771821,16.787911130108373,1.9512286686545695,Au,PRUNED
2107,3.7593984962402023,2026-04-26 15:33:16.798014,2026-04-26 15:33:17.598204,0 days 00:00:00.800190,28.309423422550054,16.855316397169755,1.9937189705602893,Au,PRUNED
2108,0.0,2026-04-26 15:33:16.969013,2026-04-26 15:33:17.684981,0 days 00:00:00.715968,48.74023482301129,17.988644844917392,1.995574685705672,Au,PRUNED
2109,0.0,2026-04-26 15:33:17.064341,2026-04-26 15:33:17.924767,0 days 00:00:00.860426,25.847887029048767,17.67860735287823,1.9831750356968973,Au,PRUNED
2110,0.0,2026-04-26 15:33:17.113734,2026-04-26 15:33:17.824992,0 days 00:00:00.711258,20.560892357023963,17.53303208800171,1.830617182947933,Au,PRUNED
2111,-559.440559440494,2026-04-26 15:33:17.146214,2026-04-26 15:33:17.856826,0 days 00:00:00.710612,21.28577587298601,19.321262480829375,1.9382153768484631,Au,COMPLETE
2112,-9.523809523808879,2026-04-26 15:33:17.253734,2026-04-26 15:33:17.925322,0 days 00:00:00.671588,27.36149273164651,17.036250118473905,1.990126114170372,Ag,PRUNED
2113,0.0,2026-04-26 15:33:17.458558,2026-04-26 15:33:18.062460,0 days 00:00:00.603902,20.00347561064762,19.734075478325906,1.8232444183222558,Au,PRUNED
2114,147.25274725274258,2026-04-26 15:33:17.483613,2026-04-26 15:33:18.276506,0 days 00:00:00.792893,24.950190068702174,19.719938622314878,1.9862123359122115,Au,PRUNED
2115,-1.9132653061224132,2026-04-26 15:33:17.765967,2026-04-26 15:33:18.606196,0 days 00:00:00.840229,104.77680985366977,0.9672918738268663,0.38893940543352323,Au,PRUNED
2116,-11.278195488720607,2026-04-26 15:33:17.797065,2026-04-26 15:33:18.606196,0 days 00:00:00.809131,24.850589427430226,19.78229275103988,0.9127928892027125,Cu,PRUNED
2117,0.0,2026-04-26 15:33:17.968623,2026-04-26 15:33:18.663785,0 days 00:00:00.695162,32.86389472495445,17.884070139394783,1.91470403775261,Au,PRUNED
2118,0.0,2026-04-26 15:33:18.006940,2026-04-26 15:33:18.965993,0 days 00:00:00.959053,45.76353805673631,19.92816507671589,1.9870716555073415,Au,PRUNED
2119,0.0,2026-04-26 15:33:18.031349,2026-04-26 15:33:18.966498,0 days 00:00:00.935149,44.24116810826961,18.189358622655153,1.9970110212659482,Au,PRUNED
2120,0.0,2026-04-26 15:33:18.180782,2026-04-26 15:33:18.918742,0 days 00:00:00.737960,36.16677090623722,17.980730066015308,1.774905190959469,Au,PRUNED
2121,0.0,2026-04-26 15:33:18.239156,2026-04-26 15:33:18.940893,0 days 00:00:00.701737,35.63745478053185,18.23007846334393,1.7296191389292361,Au,PRUNED
2122,0.0,2026-04-26 15:33:18.376307,2026-04-26 15:33:19.386486,0 days 00:00:01.010179,47.7104343242808,19.898045830637663,1.9251387578817176,Au,PRUNED
2123,-552.9528208511401,2026-04-26 15:33:18.733161,2026-04-26 15:33:19.740797,0 days 00:00:01.007636,20.95992223600352,19.71899486338234,1.67869972743939,Au,COMPLETE
2124,0.0,2026-04-26 15:33:18.800371,2026-04-26 15:33:19.620587,0 days 00:00:00.820216,39.032230924125,18.82298166684769,1.9999626416760692,Au,PRUNED
2125,0.0,2026-04-26 15:33:18.872811,2026-04-26 15:33:19.802377,0 days 00:00:00.929566,38.46122171199842,19.77771189642556,1.7699586430391951,Au,PRUNED
2126,0.0,2026-04-26 15:33:18.981212,2026-04-26 15:33:19.931050,0 days 00:00:00.949838,23.54489783411082,19.720471101268036,1.975259355223842,Au,PRUNED
2127,0.0,2026-04-26 15:33:18.997573,2026-04-26 15:33:19.757600,0 days 00:00:00.760027,35.248273569797135,18.79134692802409,1.9856285945783452,Au,PRUNED
2128,0.0,2026-04-26 15:33:19.041629,2026-04-26 15:33:19.879395,0 days 00:00:00.837766,20.088461251355387,19.4065883340145,1.9598420632496731,Au,PRUNED
2129,-8.928571428570304,2026-04-26 15:33:19.157767,2026-04-26 15:33:20.107053,0 days 00:00:00.949286,21.813907156557896,19.997486651043264,1.7621128810169124,Au,PRUNED
2130,0.0,2026-04-26 15:33:19.639255,2026-04-26 15:33:20.697120,0 days 00:00:01.057865,20.434622428804342,17.590741125317656,1.9282437040507365,Au,PRUNED
2131,0.0,2026-04-26 15:33:19.827823,2026-04-26 15:33:20.596671,0 days 00:00:00.768848,37.017700495359875,19.540155643286628,1.9772404202979785,Au,PRUNED
2132,0.0,2026-04-26 15:33:19.851665,2026-04-26 15:33:20.657511,0 days 00:00:00.805846,33.23542671170405,17.86415058371239,1.6881866087447688,Au,PRUNED
2133,0.0,2026-04-26 15:33:19.898494,2026-04-26 15:33:20.657511,0 days 00:00:00.759017,20.27979111937822,17.474413354702836,1.9100431751029687,Au,PRUNED
2134,-474.0259740259262,2026-04-26 15:33:19.943749,2026-04-26 15:33:20.780085,0 days 00:00:00.836336,21.870960600549047,17.68509749671474,1.9725741033324564,Au,COMPLETE
2135,143.9560439560394,2026-04-26 15:33:20.024686,2026-04-26 15:33:20.794820,0 days 00:00:00.770134,29.80146729124737,17.33685060179596,1.9836082899522045,Au,PRUNED
2136,0.0,2026-04-26 15:33:20.091895,2026-04-26 15:33:20.698157,0 days 00:00:00.606262,33.83340879881487,18.139021284561963,1.7279607417867562,Au,PRUNED
2137,0.0,2026-04-26 15:33:20.197220,2026-04-26 15:33:20.766012,0 days 00:00:00.568792,36.60939662266931,16.718386707779295,1.9904019339218686,Au,PRUNED
2138,0.0,2026-04-26 15:33:20.652920,2026-04-26 15:33:21.249636,0 days 00:00:00.596716,20.700721565516528,16.060414300027503,1.577765967835223,Ag,PRUNED
2139,0.0,2026-04-26 15:33:20.741712,2026-04-26 15:33:21.504465,0 days 00:00:00.762753,20.512924537463277,16.354996009837624,1.6555142392682256,Au,PRUNED
2140,-14.28571428571313,2026-04-26 15:33:20.891679,2026-04-26 15:33:21.537985,0 days 00:00:00.646306,50.90192972594471,7.986018971433166,0.6163911674285432,Au,PRUNED
2141,0.0,2026-04-26 15:33:20.923862,2026-04-26 15:33:21.592680,0 days 00:00:00.668818,27.603019941677225,19.902736215986415,1.9930355091477319,Au,PRUNED
2142,0.0,2026-04-26 15:33:20.939699,2026-04-26 15:33:21.842888,0 days 00:00:00.903189,26.610267256233993,19.936493522171016,1.9885646520059743,Au,PRUNED
2143,0.0,2026-04-26 15:33:20.956844,2026-04-26 15:33:21.547467,0 days 00:00:00.590623,35.546346791663325,13.482792296125215,1.6727261253641825,Au,PRUNED
2144,2.5510204081630805,2026-04-26 15:33:20.968057,2026-04-26 15:33:21.634239,0 days 00:00:00.666182,36.95861001465401,17.397163459806322,1.5627020396762012,Cu,PRUNED
2145,0.0,2026-04-26 15:33:21.038321,2026-04-26 15:33:21.536481,0 days 00:00:00.498160,52.33036341301714,19.885204380913983,1.266485515448286,Au,PRUNED
2146,0.0,2026-04-26 15:33:21.464319,2026-04-26 15:33:22.133969,0 days 00:00:00.669650,48.722709232942954,16.900863286424837,1.5765889648766975,Au,PRUNED
2147,0.0,2026-04-26 15:33:21.658186,2026-04-26 15:33:22.321848,0 days 00:00:00.663662,31.082095207735463,19.910132736562577,1.6046005697560595,Au,PRUNED
2148,7.936507936507047,2026-04-26 15:33:21.690707,2026-04-26 15:33:22.262323,0 days 00:00:00.571616,24.602657494887577,19.95102011428624,1.777202873344349,Au,PRUNED
2149,0.0,2026-04-26 15:33:21.721510,2026-04-26 15:33:22.447350,0 days 00:00:00.725840,20.14867745812293,17.68169683236906,1.7753816874741677,Au,PRUNED
2150,-8.928571428570304,2026-04-26 15:33:21.741628,2026-04-26 15:33:22.337350,0 days 00:00:00.595722,21.197979686624453,19.950903522053018,1.949119946301044,Au,PRUNED
2151,0.0,2026-04-26 15:33:21.752438,2026-04-26 15:33:22.537854,0 days 00:00:00.785416,21.069470392584822,16.995273859226472,1.7432851612722953,Au,PRUNED
2152,0.0,2026-04-26 15:33:21.798095,2026-04-26 15:33:22.493113,0 days 00:00:00.695018,26.01776197795972,19.985807895694023,1.9963291513004047,Au,PRUNED
2153,0.0,2026-04-26 15:33:21.956541,2026-04-26 15:33:22.446350,0 days 00:00:00.489809,33.3181903227959,17.19159588395402,1.7580960643437353,Au,PRUNED
2154,0.0,2026-04-26 15:33:22.221217,2026-04-26 15:33:22.872702,0 days 00:00:00.651485,33.4937740285567,19.689496209846308,1.7543622568793882,Au,PRUNED
2155,0.0,2026-04-26 15:33:22.362007,2026-04-26 15:33:23.055892,0 days 00:00:00.693885,34.261793944781644,19.939901218929784,1.8302009953669511,Au,PRUNED
2156,0.0,2026-04-26 15:33:22.406157,2026-04-26 15:33:23.217364,0 days 00:00:00.811207,35.8786041075673,19.993329455434232,1.5515950862159706,Au,PRUNED
2157,2.5510204081630805,2026-04-26 15:33:22.556958,2026-04-26 15:33:23.022422,0 days 00:00:00.465464,30.07976574270334,19.85851834885332,1.9619396070860937,Cu,PRUNED
2158,0.0,2026-04-26 15:33:22.573012,2026-04-26 15:33:23.101574,0 days 00:00:00.528562,20.267166239581808,19.417021845316714,1.681582435369883,Au,PRUNED
2159,-541.6261742791738,2026-04-26 15:33:22.612428,2026-04-26 15:33:23.570751,0 days 00:00:00.958323,20.22474176865703,19.956029770284204,1.880996195956884,Au,COMPLETE
2160,0.0,2026-04-26 15:33:22.646291,2026-04-26 15:33:23.197545,0 days 00:00:00.551254,31.02528735626499,19.952776316755582,1.656998409655354,Au,PRUNED
2161,-0.5668934240362716,2026-04-26 15:33:22.635882,2026-04-26 15:33:23.345029,0 days 00:00:00.709147,82.18506251397984,14.610042574857921,1.2278274785134204,Cu,PRUNED
2162,0.0,2026-04-26 15:33:23.024445,2026-04-26 15:33:24.068754,0 days 00:00:01.044309,23.742614469130203,19.47890723073981,1.9991348951061598,Au,PRUNED
2163,3.571428571428211,2026-04-26 15:33:23.122302,2026-04-26 15:33:23.775135,0 days 00:00:00.652833,29.556274713161706,16.982051357738005,1.708511630692248,Au,PRUNED
2164,-14.28571428571313,2026-04-26 15:33:23.213503,2026-04-26 15:33:23.820404,0 days 00:00:00.606901,39.024760702957096,17.307171141246847,1.688617987807369,Ag,PRUNED
2165,0.0,2026-04-26 15:33:23.255386,2026-04-26 15:33:24.132372,0 days 00:00:00.876986,20.021405740145948,16.564110172942932,1.6955408838101163,Au,PRUNED
2166,0.0,2026-04-26 15:33:23.293778,2026-04-26 15:33:23.929452,0 days 00:00:00.635674,32.99963432540641,19.6768620939518,1.9910997299693929,Au,PRUNED
2167,-9.316770186334585,2026-04-26 15:33:23.369362,2026-04-26 15:33:24.059231,0 days 00:00:00.689869,78.7003437734714,0.9476004524078423,1.6014906326584255,Cu,PRUNED
2168,0.0,2026-04-26 15:33:23.433845,2026-04-26 15:33:24.226292,0 days 00:00:00.792447,38.5242771538575,19.677073210509366,1.9936006713662293,Au,PRUNED
2169,0.0,2026-04-26 15:33:23.716955,2026-04-26 15:33:24.429608,0 days 00:00:00.712653,28.531423156769563,19.94054543015309,1.9975166523154682,Au,PRUNED
2170,137.362637362633,2026-04-26 15:33:23.861396,2026-04-26 15:33:24.516679,0 days 00:00:00.655283,38.10476648304913,15.278555680693483,1.985549294424812,Au,PRUNED
2171,-13.392857142855457,2026-04-26 15:33:23.932458,2026-04-26 15:33:24.614966,0 days 00:00:00.682508,22.084663847413896,19.9241450728312,1.3932157072267557,Au,PRUNED
2172,0.0,2026-04-26 15:33:23.998604,2026-04-26 15:33:24.604713,0 days 00:00:00.606109,32.55037494775338,17.079097704399228,1.9598665680318677,Au,PRUNED
2173,0.0,2026-04-26 15:33:24.129800,2026-04-26 15:33:24.605713,0 days 00:00:00.475913,41.454604967604524,19.973188422068638,1.453280191673985,Au,PRUNED
2174,-6.122448979591482,2026-04-26 15:33:24.171449,2026-04-26 15:33:24.878282,0 days 00:00:00.706833,23.58305484767391,15.799917323905007,1.6884066335126073,Cu,PRUNED
2175,0.0,2026-04-26 15:33:24.238850,2026-04-26 15:33:25.192457,0 days 00:00:00.953607,37.27094177501479,19.899558677007164,1.1019751442548298,Au,PRUNED
2176,146.1538461538415,2026-04-26 15:33:24.338042,2026-04-26 15:33:24.831746,0 days 00:00:00.493704,25.157912902599847,19.911491967550226,1.997202019180357,Au,PRUNED
2177,0.0,2026-04-26 15:33:24.519704,2026-04-26 15:33:25.271939,0 days 00:00:00.752235,31.162131906078372,17.886804115231747,1.6939352624249961,Au,PRUNED
2178,0.0,2026-04-26 15:33:24.597965,2026-04-26 15:33:25.462507,0 days 00:00:00.864542,34.654586899467645,19.969343470219183,1.3670030329511376,Au,PRUNED
