number,value,datetime_start,datetime_complete,duration,params_D2_nm,params_D3_nm,params_D4_nm,params_metal,state
392,-41.38851802401297,2026-04-26 15:30:21.041752,2026-04-26 15:30:21.599877,0 days 00:00:00.558125,58.28035978365584,3.8522985080730363,0.44398084791529924,Ag,COMPLETE
393,-41.82754182752299,2026-04-26 15:30:21.111347,2026-04-26 15:30:21.680713,0 days 00:00:00.569366,66.40385277099347,5.026456796959952,0.50495404361991,Ag,COMPLETE
394,-39.34624697334913,2026-04-26 15:30:21.383566,2026-04-26 15:30:21.900355,0 days 00:00:00.516789,77.4139335887719,5.086157573852441,0.3538079068739951,Ag,COMPLETE
395,-56.338028168974496,2026-04-26 15:30:21.513029,2026-04-26 15:30:22.012574,0 days 00:00:00.499545,67.81927523124733,0.6004523906521951,0.10714824960922036,Ag,COMPLETE
396,-49.319727891127364,2026-04-26 15:30:21.702650,2026-04-26 15:30:22.387988,0 days 00:00:00.685338,75.6150987708494,0.6520954842191835,0.5725755024836126,Ag,COMPLETE
397,-53.57142857139344,2026-04-26 15:30:21.719499,2026-04-26 15:30:22.309231,0 days 00:00:00.589732,68.54978682852446,0.8534496357196042,0.3895686002115879,Ag,COMPLETE
398,-10.20408163265208,2026-04-26 15:30:21.768232,2026-04-26 15:30:22.298068,0 days 00:00:00.529836,52.84181365430116,4.4447199329987646,1.9076220557212757,Cu,PRUNED
399,-44.54685099843999,2026-04-26 15:30:21.831117,2026-04-26 15:30:22.388996,0 days 00:00:00.557879,81.22187963236512,0.9841678803114511,0.327282923864342,Ag,COMPLETE
400,-23.80952380951585,2026-04-26 15:30:21.733859,2026-04-26 15:30:22.433617,0 days 00:00:00.699758,85.3950756951784,0.5310159228597708,0.5281856889910088,Ag,PRUNED
401,-45.8646616541112,2026-04-26 15:30:21.960926,2026-04-26 15:30:22.712749,0 days 00:00:00.751823,76.95053144802675,3.4736872633466747,0.11643141407259343,Ag,COMPLETE
402,-23.80952380951585,2026-04-26 15:30:22.162191,2026-04-26 15:30:22.793991,0 days 00:00:00.631800,74.1413377193673,5.267226007276056,0.11081829913264378,Ag,PRUNED
403,-53.80333951758979,2026-04-26 15:30:22.058796,2026-04-26 15:30:22.840259,0 days 00:00:00.781463,74.16927818294783,1.4546664847142412,0.11247925100006997,Ag,COMPLETE
404,-53.57142857139311,2026-04-26 15:30:22.343890,2026-04-26 15:30:22.753278,0 days 00:00:00.409388,64.66657864163001,0.6901551680153354,0.3613025112919257,Ag,COMPLETE
405,-52.87569573280449,2026-04-26 15:30:22.451451,2026-04-26 15:30:22.931914,0 days 00:00:00.480463,76.27199292376982,0.6412154137824312,0.19994344268231248,Ag,COMPLETE
406,-54.05405405401748,2026-04-26 15:30:22.476454,2026-04-26 15:30:23.080398,0 days 00:00:00.603944,74.67300006898881,0.5048374678695503,0.15262848675027246,Ag,COMPLETE
407,-3.968253968253854,2026-04-26 15:30:22.538179,2026-04-26 15:30:23.213301,0 days 00:00:00.675122,84.117523845777,4.7027514000004125,0.5312204342941929,Cu,PRUNED
408,-47.36024844717932,2026-04-26 15:30:22.530963,2026-04-26 15:30:23.496437,0 days 00:00:00.965474,74.6333829262433,3.4658475226314662,0.11003610783678888,Ag,COMPLETE
409,-49.833887043160146,2026-04-26 15:30:22.853731,2026-04-26 15:30:23.379973,0 days 00:00:00.526242,71.166870073741,3.0185479190442788,0.10322464921883923,Ag,COMPLETE
410,-28.571428571418657,2026-04-26 15:30:22.898016,2026-04-26 15:30:23.448444,0 days 00:00:00.550428,43.564995695909786,2.0802654498689757,0.2052300125998412,Ag,COMPLETE
411,-23.80952380951585,2026-04-26 15:30:22.979288,2026-04-26 15:30:23.470844,0 days 00:00:00.491556,45.082904935038414,0.757154219997626,0.14903144060154122,Ag,PRUNED
412,-23.80952380951585,2026-04-26 15:30:23.082409,2026-04-26 15:30:23.526542,0 days 00:00:00.444133,50.477747646938546,4.057593129561581,0.23002961390358623,Ag,PRUNED
413,-55.01930501926789,2026-04-26 15:30:23.148647,2026-04-26 15:30:23.732328,0 days 00:00:00.583681,66.76674311075011,0.6817186354552148,0.24857523624848135,Ag,COMPLETE
414,-16.483516483513935,2026-04-26 15:30:23.219578,2026-04-26 15:30:23.894494,0 days 00:00:00.674916,66.71374540123139,1.5593219826574516,0.16607996579307782,Cu,PRUNED
415,-55.23809523805816,2026-04-26 15:30:23.425552,2026-04-26 15:30:24.180021,0 days 00:00:00.754469,71.80420881652462,0.6887710048940906,0.3437062797962638,Ag,COMPLETE
416,-55.01930501926736,2026-04-26 15:30:23.494440,2026-04-26 15:30:24.008850,0 days 00:00:00.514410,63.68197797968938,0.5194153292233106,0.19245356577123363,Ag,COMPLETE
417,-52.875695732804246,2026-04-26 15:30:23.553405,2026-04-26 15:30:24.208546,0 days 00:00:00.655141,63.67478051412276,1.3238635343306795,0.12732740676112492,Ag,COMPLETE
418,-45.18950437315491,2026-04-26 15:30:23.608321,2026-04-26 15:30:24.082223,0 days 00:00:00.473902,60.05528074068144,3.697494263882989,0.18101602917870926,Ag,COMPLETE
419,-16.483516483513935,2026-04-26 15:30:23.651403,2026-04-26 15:30:24.316194,0 days 00:00:00.664791,67.06957289089472,0.7459648032727776,0.46390686369927037,Au,PRUNED
420,-54.511278195453144,2026-04-26 15:30:23.684069,2026-04-26 15:30:24.284168,0 days 00:00:00.600099,73.79401417099932,0.9820686376785477,0.171984766836474,Ag,COMPLETE
421,-50.264550264518924,2026-04-26 15:30:24.020628,2026-04-26 15:30:24.676818,0 days 00:00:00.656190,75.4595340089587,0.5873101541735155,0.4566546633295548,Ag,COMPLETE
422,-55.77299412912029,2026-04-26 15:30:24.097116,2026-04-26 15:30:24.691980,0 days 00:00:00.594864,73.1143726775053,0.7206995997894824,0.13880890666916437,Ag,COMPLETE
423,-41.545189504352216,2026-04-26 15:30:24.221689,2026-04-26 15:30:24.770012,0 days 00:00:00.548323,51.95959796371156,0.8218432450429906,0.4065125033553947,Ag,COMPLETE
424,-35.714285714269735,2026-04-26 15:30:24.275032,2026-04-26 15:30:24.844889,0 days 00:00:00.569857,47.88344575971392,0.8281363559673192,0.3605235005163593,Ag,COMPLETE
425,-45.746388442991865,2026-04-26 15:30:24.342668,2026-04-26 15:30:24.891945,0 days 00:00:00.549277,55.39803764171096,0.6144273665386805,0.497734561132614,Ag,COMPLETE
426,-46.825396825370625,2026-04-26 15:30:24.384085,2026-04-26 15:30:24.890436,0 days 00:00:00.506351,58.2645694235493,1.6006995883555997,0.47324563420799826,Ag,COMPLETE
427,-55.01930501926796,2026-04-26 15:30:24.410357,2026-04-26 15:30:24.891439,0 days 00:00:00.481082,61.1061347096646,0.5447785061987709,0.13290716890293322,Ag,COMPLETE
428,-51.28205128201859,2026-04-26 15:30:24.476522,2026-04-26 15:30:25.216540,0 days 00:00:00.740018,58.614124397971494,0.5811660224872368,0.12018485164473056,Ag,COMPLETE
429,-55.77299412912029,2026-04-26 15:30:24.844889,2026-04-26 15:30:25.500746,0 days 00:00:00.655857,69.13100051267084,0.8880226398535688,0.14467152254759288,Ag,COMPLETE
430,-43.84724186702227,2026-04-26 15:30:24.938050,2026-04-26 15:30:25.454248,0 days 00:00:00.516198,60.227477877415616,4.245548052035303,0.12582355397178563,Ag,COMPLETE
431,-55.984555984518444,2026-04-26 15:30:25.021505,2026-04-26 15:30:25.472492,0 days 00:00:00.450987,68.80307353649123,1.1757774740618334,0.14054209922799374,Ag,COMPLETE
432,-42.410714285692286,2026-04-26 15:30:25.057155,2026-04-26 15:30:25.702359,0 days 00:00:00.645204,50.6965755717504,0.6790472090925223,0.11437397475997882,Ag,COMPLETE
433,-53.3333333332976,2026-04-26 15:30:25.068361,2026-04-26 15:30:25.581533,0 days 00:00:00.513172,61.809805853434334,0.7126315763039447,0.14835737562172957,Ag,COMPLETE
434,-54.285714285678004,2026-04-26 15:30:25.108635,2026-04-26 15:30:25.642756,0 days 00:00:00.534121,62.733044229423534,0.9686419432662233,0.12834557816843378,Ag,COMPLETE
435,-54.5112781954528,2026-04-26 15:30:25.148313,2026-04-26 15:30:25.579535,0 days 00:00:00.431222,62.6473719763996,1.0786356626496014,0.1164710304061406,Ag,COMPLETE
436,-56.54761904757989,2026-04-26 15:30:25.324860,2026-04-26 15:30:25.855974,0 days 00:00:00.531114,71.30011157310027,0.7640725724372526,0.10641039661875613,Ag,COMPLETE
437,-42.17687074827927,2026-04-26 15:30:25.639230,2026-04-26 15:30:26.282449,0 days 00:00:00.643219,76.42987868475524,3.6951189948962813,0.43999146688089363,Ag,COMPLETE
438,-23.80952380951585,2026-04-26 15:30:25.677926,2026-04-26 15:30:26.304504,0 days 00:00:00.626578,84.47588302396854,4.124806751977267,0.32303717389677244,Ag,PRUNED
439,-52.87569573280392,2026-04-26 15:30:25.750987,2026-04-26 15:30:26.176539,0 days 00:00:00.425552,71.83641136724498,0.5443687687624776,0.4586248858673817,Ag,COMPLETE
440,-4.926108374383892,2026-04-26 15:30:25.781604,2026-04-26 15:30:26.368884,0 days 00:00:00.587280,93.8831336817569,2.7331258276195007,0.13926383225226893,Ag,PRUNED
441,-1.904761904761852,2026-04-26 15:30:25.804886,2026-04-26 15:30:26.235255,0 days 00:00:00.430369,98.90307362712582,4.159325432499068,0.17820285837004807,Ag,PRUNED
442,-39.47368421050908,2026-04-26 15:30:25.872388,2026-04-26 15:30:26.371405,0 days 00:00:00.499017,81.12987367524022,4.231205877483842,0.1374807426970149,Ag,COMPLETE
443,-1.0660980810234213,2026-04-26 15:30:25.900754,2026-04-26 15:30:26.528364,0 days 00:00:00.627610,20.17464126084952,19.69075495056522,0.597014616240952,Ag,PRUNED
444,-45.65537555225928,2026-04-26 15:30:26.012358,2026-04-26 15:30:26.715029,0 days 00:00:00.702671,75.8388812201823,3.8072646263784202,0.14154538539236616,Ag,COMPLETE
445,-46.85099846387651,2026-04-26 15:30:26.328696,2026-04-26 15:30:27.014275,0 days 00:00:00.685579,67.79730648451626,3.3291473286617292,0.35934768811722545,Ag,COMPLETE
446,-46.85099846387623,2026-04-26 15:30:26.372402,2026-04-26 15:30:27.013105,0 days 00:00:00.640703,67.76737843302627,3.7122723413831817,0.18231476498547125,Ag,COMPLETE
447,-10.204081632651594,2026-04-26 15:30:26.430517,2026-04-26 15:30:26.845195,0 days 00:00:00.414678,91.60935967260556,0.8403832505342207,0.1476554716612651,Ag,PRUNED
448,-4.081632653060987,2026-04-26 15:30:26.547030,2026-04-26 15:30:27.279157,0 days 00:00:00.732127,93.98134316098269,0.8113842426558806,0.20870918606998864,Ag,PRUNED
449,-10.714285714284633,2026-04-26 15:30:26.602293,2026-04-26 15:30:27.339697,0 days 00:00:00.737404,77.99316404138789,0.7081932365037638,1.181481928425026,Cu,PRUNED
450,-15.306122448977392,2026-04-26 15:30:26.650564,2026-04-26 15:30:27.323208,0 days 00:00:00.672644,74.49166798382554,2.935987469505393,0.1054156909575418,Au,PRUNED
451,-48.15409309788613,2026-04-26 15:30:26.635049,2026-04-26 15:30:27.360083,0 days 00:00:00.725034,72.13086643851331,3.169739412892865,0.14173855687435868,Ag,COMPLETE
452,-49.83388704316035,2026-04-26 15:30:26.847192,2026-04-26 15:30:27.400996,0 days 00:00:00.553804,71.26311767345385,3.0212125213571985,0.12001579230822054,Ag,COMPLETE
453,-41.018387553020744,2026-04-26 15:30:26.979879,2026-04-26 15:30:27.653457,0 days 00:00:00.673578,83.61527105616469,1.7025832287356462,0.12906475175371762,Ag,COMPLETE
454,-40.720961281690066,2026-04-26 15:30:27.212679,2026-04-26 15:30:27.963269,0 days 00:00:00.750590,54.99428131944764,3.87400009811203,0.10287146629971128,Ag,COMPLETE
455,-54.5112781954528,2026-04-26 15:30:27.282159,2026-04-26 15:30:27.820804,0 days 00:00:00.538645,72.83222253769871,1.2156088113264498,0.14667631123595176,Ag,COMPLETE
456,-53.80333951759012,2026-04-26 15:30:27.360083,2026-04-26 15:30:28.102694,0 days 00:00:00.742611,68.60655589099156,0.7617017648207965,0.452233950997595,Ag,COMPLETE
457,-51.28205128201859,2026-04-26 15:30:27.453825,2026-04-26 15:30:27.926545,0 days 00:00:00.472720,76.97198545330794,0.5735958857978425,0.23754662864766504,Ag,COMPLETE
458,-1.7421602787456147,2026-04-26 15:30:27.482508,2026-04-26 15:30:28.116841,0 days 00:00:00.634333,117.71183769771955,10.744145458115192,0.22149354265405452,Ag,PRUNED
459,-56.54761904757955,2026-04-26 15:30:27.575225,2026-04-26 15:30:28.228059,0 days 00:00:00.652834,68.55523248287504,0.5249083320617473,0.18421262942429342,Ag,COMPLETE
460,-42.17687074827888,2026-04-26 15:30:27.612304,2026-04-26 15:30:28.273958,0 days 00:00:00.661654,58.43131006502344,4.453495546519419,0.10983063535875161,Ag,COMPLETE
461,-52.441229656386405,2026-04-26 15:30:27.840051,2026-04-26 15:30:28.399468,0 days 00:00:00.559417,71.1706073662469,0.5145568461020871,0.587790054923003,Ag,COMPLETE
462,-40.72096128168969,2026-04-26 15:30:28.014815,2026-04-26 15:30:28.431120,0 days 00:00:00.416305,55.689043940916264,3.3326468013350423,0.3757048356834236,Ag,COMPLETE
463,-44.5544554455225,2026-04-26 15:30:28.046958,2026-04-26 15:30:28.730648,0 days 00:00:00.683690,65.57961278910638,4.225659547262446,0.35655727333792486,Ag,COMPLETE
464,-56.54761904757989,2026-04-26 15:30:28.073000,2026-04-26 15:30:28.752888,0 days 00:00:00.679888,69.18385706692425,0.5923245611184691,0.20845354260256202,Ag,COMPLETE
465,-51.53707052437959,2026-04-26 15:30:28.189166,2026-04-26 15:30:28.862276,0 days 00:00:00.673110,60.69662765356113,0.6564304957784032,0.33306690288262186,Ag,COMPLETE
466,-54.79452054790749,2026-04-26 15:30:28.327246,2026-04-26 15:30:28.798744,0 days 00:00:00.471498,63.44531010701327,0.6127900641439571,0.10222583676733307,Ag,COMPLETE
467,-11.904761904759908,2026-04-26 15:30:28.374904,2026-04-26 15:30:29.016698,0 days 00:00:00.641794,63.51837171742307,0.6810562047406978,0.20999666678386555,Cu,PRUNED
468,-40.259740259721795,2026-04-26 15:30:28.426964,2026-04-26 15:30:29.019279,0 days 00:00:00.592315,57.600048142772344,3.9582188220345405,0.43749751798703984,Ag,COMPLETE
469,-48.701298701270986,2026-04-26 15:30:28.587652,2026-04-26 15:30:28.986464,0 days 00:00:00.398812,68.46589803773858,2.4027923016157122,0.4109559580509449,Ag,COMPLETE
470,-55.0193050192677,2026-04-26 15:30:28.677999,2026-04-26 15:30:29.205533,0 days 00:00:00.527534,68.53402135975641,1.0286347570299843,0.15018513970122405,Ag,COMPLETE
471,-55.77299412912056,2026-04-26 15:30:28.816411,2026-04-26 15:30:29.656515,0 days 00:00:00.840104,71.27066857230689,0.5167487284030676,0.2601442724374827,Ag,COMPLETE
472,-55.77299412911995,2026-04-26 15:30:29.052659,2026-04-26 15:30:29.577216,0 days 00:00:00.524557,69.75382805906268,0.5549707515184361,0.3032702539354189,Ag,COMPLETE
473,-55.01930501926789,2026-04-26 15:30:29.112136,2026-04-26 15:30:29.606506,0 days 00:00:00.494370,74.77708658727295,0.678002942398402,0.10900922770555359,Ag,COMPLETE
474,-40.71428571426544,2026-04-26 15:30:29.145195,2026-04-26 15:30:29.538008,0 days 00:00:00.392813,84.43981487110456,0.8337006815243131,0.15580241887762772,Ag,COMPLETE
475,-46.79802955662355,2026-04-26 15:30:29.203121,2026-04-26 15:30:29.703427,0 days 00:00:00.500306,82.18090480734398,0.5195693923363914,0.16433154302187825,Ag,COMPLETE
476,-50.774526678110455,2026-04-26 15:30:29.279609,2026-04-26 15:30:30.029451,0 days 00:00:00.749842,75.39485035561981,2.176197554834578,0.10765332703422215,Ag,COMPLETE
477,-51.146384479686304,2026-04-26 15:30:29.349999,2026-04-26 15:30:29.896468,0 days 00:00:00.546469,66.62789448373574,1.1556418005513291,0.4660811420184812,Ag,COMPLETE
478,-53.57142857139311,2026-04-26 15:30:29.302306,2026-04-26 15:30:30.030460,0 days 00:00:00.728154,70.95580899130543,0.679740505987121,0.37527732355990906,Ag,COMPLETE
479,-43.60902255636764,2026-04-26 15:30:29.707441,2026-04-26 15:30:30.324889,0 days 00:00:00.617448,80.98778003796717,0.7755959013320183,0.5380951820457314,Ag,COMPLETE
480,-44.91899852722254,2026-04-26 15:30:29.759773,2026-04-26 15:30:30.276404,0 days 00:00:00.516631,74.06713505676102,3.345309198035327,0.39287316789450755,Ag,COMPLETE
481,-55.77299412912056,2026-04-26 15:30:29.796348,2026-04-26 15:30:30.276404,0 days 00:00:00.480056,73.50334879480617,0.8546539141178778,0.10790536509263825,Ag,COMPLETE
482,-53.57142857139344,2026-04-26 15:30:29.926995,2026-04-26 15:30:30.774308,0 days 00:00:00.847313,68.78942711035394,0.6904736310215519,0.3959477880773627,Ag,COMPLETE
483,-49.053356282242305,2026-04-26 15:30:29.980820,2026-04-26 15:30:30.386276,0 days 00:00:00.405456,75.83719914806491,0.8808036571775207,0.4323217939713504,Ag,COMPLETE
484,-51.1463844796864,2026-04-26 15:30:30.091816,2026-04-26 15:30:30.603968,0 days 00:00:00.512152,66.02207550771438,1.2164679700593406,0.4990271373502726,Ag,COMPLETE
485,-44.2857142856921,2026-04-26 15:30:30.148633,2026-04-26 15:30:30.841512,0 days 00:00:00.692879,77.5041445330044,3.8938479530294496,0.11286376394826783,Ag,COMPLETE
486,-54.285714285678004,2026-04-26 15:30:30.195806,2026-04-26 15:30:30.689325,0 days 00:00:00.493519,70.95055074902942,0.5533361642532798,0.3545768803730731,Ag,COMPLETE
487,-54.285714285678004,2026-04-26 15:30:30.412320,2026-04-26 15:30:31.181898,0 days 00:00:00.769578,74.69653813834665,0.554617840540465,0.2124636487421649,Ag,COMPLETE
488,-23.80952380951585,2026-04-26 15:30:30.433377,2026-04-26 15:30:30.959354,0 days 00:00:00.525977,83.25658160418101,3.4120120826763523,0.3205839376750288,Ag,PRUNED
489,-28.571428571417115,2026-04-26 15:30:30.511551,2026-04-26 15:30:31.147404,0 days 00:00:00.635853,79.93615601783412,0.9329036358110473,0.16054656635919104,Ag,PRUNED
490,-28.571428571417115,2026-04-26 15:30:30.569525,2026-04-26 15:30:31.187966,0 days 00:00:00.618441,72.45508555082486,3.586475829991488,0.16391990545597226,Ag,PRUNED
491,-14.285714285712368,2026-04-26 15:30:30.706888,2026-04-26 15:30:31.110902,0 days 00:00:00.404014,74.50967821031037,1.1722759807511285,0.10033193096275783,Cu,PRUNED
492,-54.285714285678004,2026-04-26 15:30:30.796603,2026-04-26 15:30:31.675241,0 days 00:00:00.878638,66.86074360066962,0.5555237686899696,0.3395035550568774,Ag,COMPLETE
493,-43.84724186702193,2026-04-26 15:30:30.945223,2026-04-26 15:30:31.691824,0 days 00:00:00.746601,59.22234480268516,3.565649159928764,0.31831585999336476,Ag,COMPLETE
494,-54.05405405401722,2026-04-26 15:30:31.044857,2026-04-26 15:30:31.535793,0 days 00:00:00.490936,61.85234882308306,0.5399241911067583,0.159119438357195,Ag,COMPLETE
495,-48.136645962706986,2026-04-26 15:30:31.056125,2026-04-26 15:30:31.676251,0 days 00:00:00.620126,68.0970605512102,3.8714317290191977,0.12012861431712951,Ag,COMPLETE
496,-43.2692307692099,2026-04-26 15:30:31.240821,2026-04-26 15:30:31.783529,0 days 00:00:00.542708,65.61562990885743,4.3943305161157005,0.43037898716841544,Ag,COMPLETE
497,-52.87569573280392,2026-04-26 15:30:31.290935,2026-04-26 15:30:31.876559,0 days 00:00:00.585624,62.61926254201768,0.7543255426908994,0.30781321269236006,Ag,COMPLETE
498,-28.571428571417115,2026-04-26 15:30:31.336161,2026-04-26 15:30:31.861377,0 days 00:00:00.525216,69.7840698355225,3.5564003370289594,0.11508635366666263,Ag,PRUNED
499,-20.40816326530027,2026-04-26 15:30:31.376174,2026-04-26 15:30:32.007150,0 days 00:00:00.630976,90.43040492856214,0.7228067151649687,0.12608872060612603,Ag,PRUNED
500,-0.6493506493506369,2026-04-26 15:30:31.695128,2026-04-26 15:30:32.282645,0 days 00:00:00.587517,61.98067069170021,17.860389303944924,0.22212358419063805,Au,PRUNED
501,-28.571428571417115,2026-04-26 15:30:31.893311,2026-04-26 15:30:32.755860,0 days 00:00:00.862549,76.6401442423371,3.6545605665504466,0.11876238030145,Ag,PRUNED
502,-51.5370705243799,2026-04-26 15:30:31.910011,2026-04-26 15:30:32.905852,0 days 00:00:00.995841,77.30623779807085,1.0181778502615957,0.13009859332992219,Ag,COMPLETE
503,-20.40816326530416,2026-04-26 15:30:31.937928,2026-04-26 15:30:32.424127,0 days 00:00:00.486199,47.127280564989974,19.017403008137563,0.19091454011745324,Ag,PRUNED
504,-23.80952380951585,2026-04-26 15:30:31.960143,2026-04-26 15:30:32.564265,0 days 00:00:00.604122,49.81390524459334,0.990253622015695,0.16943210270925038,Ag,PRUNED
505,-28.571428571417115,2026-04-26 15:30:32.008161,2026-04-26 15:30:32.754821,0 days 00:00:00.746660,68.18219130478697,2.7052608832019516,0.10464177860139147,Ag,PRUNED
506,-23.80952380951585,2026-04-26 15:30:32.055310,2026-04-26 15:30:32.486400,0 days 00:00:00.431090,82.62806840860226,0.7275237880318287,0.38400610376393485,Ag,PRUNED
507,-28.571428571417115,2026-04-26 15:30:32.073982,2026-04-26 15:30:32.664696,0 days 00:00:00.590714,79.7417711481885,0.8982004872089774,0.12620640956401608,Ag,PRUNED
508,-55.98455598451837,2026-04-26 15:30:32.488981,2026-04-26 15:30:33.180551,0 days 00:00:00.691570,72.41675633291243,0.988894021804547,0.12963974340648365,Ag,COMPLETE
509,-50.264550264519144,2026-04-26 15:30:32.582416,2026-04-26 15:30:33.280770,0 days 00:00:00.698354,79.86506428664528,0.5496425388733943,0.16409921912735603,Ag,COMPLETE
510,-16.806722689073638,2026-04-26 15:30:32.618237,2026-04-26 15:30:33.181550,0 days 00:00:00.563313,63.61783488179638,4.081263570513718,0.6174372862254084,Au,PRUNED
511,-55.01930501926796,2026-04-26 15:30:32.690926,2026-04-26 15:30:33.575645,0 days 00:00:00.884719,64.7745645193362,0.5286041323326598,0.29286010454709327,Ag,COMPLETE
512,-477.88769275526056,2026-04-26 15:30:32.826158,2026-04-26 15:30:33.502683,0 days 00:00:00.676525,22.426163051483776,17.66489979193996,1.664865206563943,Au,COMPLETE
513,-56.33802816897421,2026-04-26 15:30:32.871694,2026-04-26 15:30:33.308073,0 days 00:00:00.436379,67.33637685134985,0.6768284782574933,0.114465482421178,Ag,COMPLETE
514,-55.0193050192677,2026-04-26 15:30:32.930347,2026-04-26 15:30:33.539984,0 days 00:00:00.609637,75.24978476381979,0.5659478624328583,0.1236141876202956,Ag,COMPLETE
515,-28.571428571417115,2026-04-26 15:30:33.109593,2026-04-26 15:30:33.554372,0 days 00:00:00.444779,60.4905570136397,0.5219747623579103,0.49104053218641264,Ag,PRUNED
516,-56.54761904757955,2026-04-26 15:30:33.289225,2026-04-26 15:30:33.707327,0 days 00:00:00.418102,68.74157543652326,0.8134530950495354,0.1280885665834284,Ag,COMPLETE
517,142.8571428571383,2026-04-26 15:30:33.441576,2026-04-26 15:30:33.782452,0 days 00:00:00.340876,30.40840817436399,18.41595645632477,1.2668933417449155,Au,PRUNED
518,2.5510204081630805,2026-04-26 15:30:33.466853,2026-04-26 15:30:34.043627,0 days 00:00:00.576774,37.90572177825564,13.597303561388081,1.6041783468629254,Au,PRUNED
519,7.518796992480405,2026-04-26 15:30:33.506257,2026-04-26 15:30:34.056956,0 days 00:00:00.550699,29.68293594013131,17.561069116789692,1.3451138431540968,Au,PRUNED
520,0.0,2026-04-26 15:30:33.598654,2026-04-26 15:30:34.119237,0 days 00:00:00.520583,24.76550984016208,18.42067134426453,1.7714520448575994,Au,PRUNED
521,-40.629095674948495,2026-04-26 15:30:33.637532,2026-04-26 15:30:34.237311,0 days 00:00:00.599779,55.353023420238955,4.0764493042021295,0.12224559612840741,Ag,COMPLETE
