number,value,datetime_start,datetime_complete,duration,params_D2_nm,params_D3_nm,params_D4_nm,params_metal,state
1209,-1.0660980810234213,2026-04-26 15:31:39.537921,2026-04-26 15:31:40.195502,0 days 00:00:00.657581,20.220767018300677,19.551095196618775,1.5122482824759969,Ag,PRUNED
1210,-3.1055900621117445,2026-04-26 15:31:39.659273,2026-04-26 15:31:40.295320,0 days 00:00:00.636047,88.96063781171439,15.519313778422681,1.33043122537177,Ag,PRUNED
1211,0.0,2026-04-26 15:31:39.688193,2026-04-26 15:31:40.296320,0 days 00:00:00.608127,36.86658501881979,19.396360026242718,1.4626687102955973,Au,PRUNED
1212,0.0,2026-04-26 15:31:39.747563,2026-04-26 15:31:40.297321,0 days 00:00:00.549758,21.07275947829171,18.97278333246051,1.4406366414159713,Au,PRUNED
1213,0.0,2026-04-26 15:31:40.050753,2026-04-26 15:31:40.900016,0 days 00:00:00.849263,20.48581612927496,19.867238598630124,1.5055162806455495,Au,PRUNED
1214,0.0,2026-04-26 15:31:40.088217,2026-04-26 15:31:40.915178,0 days 00:00:00.826961,32.557461458885655,18.020147715935067,1.3831092444263966,Au,PRUNED
1215,-8.928571428570304,2026-04-26 15:31:40.219835,2026-04-26 15:31:40.763026,0 days 00:00:00.543191,22.53470871254558,19.51346820725744,1.4521863341588264,Au,PRUNED
1216,0.0,2026-04-26 15:31:40.233534,2026-04-26 15:31:41.139096,0 days 00:00:00.905562,20.838906705353352,18.98278997048641,1.3288575663558448,Au,PRUNED
1217,0.0,2026-04-26 15:31:40.267390,2026-04-26 15:31:40.805155,0 days 00:00:00.537765,31.673029317237592,19.838219824467448,1.4307249377679279,Au,PRUNED
1218,0.0,2026-04-26 15:31:40.406366,2026-04-26 15:31:41.197056,0 days 00:00:00.790690,33.26234183828279,19.18207724983808,1.4143887697796445,Au,PRUNED
1219,-538.7847446670359,2026-04-26 15:31:40.436202,2026-04-26 15:31:41.183539,0 days 00:00:00.747337,21.118836455240977,19.96088463054451,1.1067613156583735,Au,COMPLETE
1220,0.0,2026-04-26 15:31:40.450796,2026-04-26 15:31:41.228738,0 days 00:00:00.777942,38.87955521746858,19.537189191714234,1.4262672941586576,Au,PRUNED
1221,0.0,2026-04-26 15:31:40.853327,2026-04-26 15:31:41.768350,0 days 00:00:00.915023,20.110568373342186,19.97654859372753,1.59284867147695,Au,PRUNED
1222,0.0,2026-04-26 15:31:40.980690,2026-04-26 15:31:41.598752,0 days 00:00:00.618062,29.750528575620095,19.931775089038762,1.2031904819699886,Au,PRUNED
1223,0.0,2026-04-26 15:31:41.043492,2026-04-26 15:31:41.766318,0 days 00:00:00.722826,20.12063859669869,19.21340367586029,1.3606656402996986,Au,PRUNED
1224,0.0,2026-04-26 15:31:41.058779,2026-04-26 15:31:41.647991,0 days 00:00:00.589212,20.566514830138473,19.289467540783452,1.297721252545937,Au,PRUNED
1225,-1.7421602787456147,2026-04-26 15:31:41.222292,2026-04-26 15:31:41.715876,0 days 00:00:00.493584,109.9066433779758,5.513355335585155,1.7899790736823513,Cu,PRUNED
1226,0.0,2026-04-26 15:31:41.236389,2026-04-26 15:31:41.982610,0 days 00:00:00.746221,20.423308912772097,19.59685303503599,1.360099065817397,Au,PRUNED
1227,0.0,2026-04-26 15:31:41.350888,2026-04-26 15:31:41.919052,0 days 00:00:00.568164,20.013218727303787,19.659684211900938,0.9541289401174172,Au,PRUNED
1228,0.0,2026-04-26 15:31:41.373851,2026-04-26 15:31:42.185810,0 days 00:00:00.811959,20.446474284754096,19.946928956154306,1.4973759451281374,Au,PRUNED
1229,0.0,2026-04-26 15:31:41.651500,2026-04-26 15:31:42.483705,0 days 00:00:00.832205,34.31684234548516,17.08298144616619,1.6123979887635478,Au,PRUNED
1230,-10.20408163265208,2026-04-26 15:31:41.780929,2026-04-26 15:31:42.420618,0 days 00:00:00.639689,22.675594451867962,19.15391717521314,1.7547844988649979,Cu,PRUNED
1231,-7.518796992480405,2026-04-26 15:31:41.858819,2026-04-26 15:31:42.485209,0 days 00:00:00.626390,25.443865824355903,19.99076385201639,1.4548576950350327,Cu,PRUNED
1232,-17.857142857139866,2026-04-26 15:31:41.822294,2026-04-26 15:31:42.655838,0 days 00:00:00.833544,49.198808855725524,9.939177906539658,1.5356099685492806,Ag,PRUNED
1233,0.0,2026-04-26 15:31:41.944766,2026-04-26 15:31:42.654840,0 days 00:00:00.710074,36.34872972617556,19.88294623598692,1.6741875021077937,Au,PRUNED
1234,0.0,2026-04-26 15:31:42.002487,2026-04-26 15:31:42.613709,0 days 00:00:00.611222,43.42663106188557,19.85146946749073,1.6820843302917454,Au,PRUNED
1235,3.2467532467529483,2026-04-26 15:31:42.032362,2026-04-26 15:31:42.814661,0 days 00:00:00.782299,51.468466048172246,19.202097252986526,1.3047459830969577,Ag,PRUNED
1236,0.0,2026-04-26 15:31:42.314485,2026-04-26 15:31:42.996292,0 days 00:00:00.681807,34.819820263561326,19.53756717178612,0.8491734932586555,Au,PRUNED
1237,0.0,2026-04-26 15:31:42.462332,2026-04-26 15:31:43.106982,0 days 00:00:00.644650,33.51153305173678,19.707125637825957,0.8903267658293859,Au,PRUNED
1238,0.0,2026-04-26 15:31:42.558583,2026-04-26 15:31:43.416424,0 days 00:00:00.857841,21.040461178226096,19.612994892959804,1.1944459842667103,Au,PRUNED
1239,-4.081632653060987,2026-04-26 15:31:42.625285,2026-04-26 15:31:43.431736,0 days 00:00:00.806451,25.333188401313336,8.671704947071103,0.9776875132554594,Cu,PRUNED
1240,0.0,2026-04-26 15:31:42.738087,2026-04-26 15:31:43.446477,0 days 00:00:00.708390,36.29056242950094,17.363970080686883,1.889757232559732,Au,PRUNED
1241,0.0,2026-04-26 15:31:42.826483,2026-04-26 15:31:43.290961,0 days 00:00:00.464478,44.66367575510135,19.614766342263415,1.137151779772851,Au,PRUNED
1242,7.936507936507047,2026-04-26 15:31:42.851128,2026-04-26 15:31:43.709313,0 days 00:00:00.858185,29.463006726592525,17.398036792526522,1.223124624017117,Au,PRUNED
1243,0.0,2026-04-26 15:31:42.888590,2026-04-26 15:31:43.495209,0 days 00:00:00.606619,34.7294652765936,19.935282860598004,1.2500943183727713,Au,PRUNED
1244,0.0,2026-04-26 15:31:43.080720,2026-04-26 15:31:43.760958,0 days 00:00:00.680238,20.09896786061837,19.982307746835033,1.5831093821288182,Au,PRUNED
1245,0.0,2026-04-26 15:31:43.206556,2026-04-26 15:31:43.680379,0 days 00:00:00.473823,20.949650768224057,16.966958754761887,1.3697862048105178,Au,PRUNED
1246,0.0,2026-04-26 15:31:43.347776,2026-04-26 15:31:44.353600,0 days 00:00:01.005824,20.081983665067867,19.776242979811702,1.851339169358986,Au,PRUNED
1247,0.0,2026-04-26 15:31:43.571189,2026-04-26 15:31:44.075085,0 days 00:00:00.503896,34.1825330104584,19.881937452408536,1.2137842389189901,Au,PRUNED
1248,0.0,2026-04-26 15:31:43.571189,2026-04-26 15:31:44.075085,0 days 00:00:00.503896,20.29775510255449,16.90944984073748,1.7143453685692758,Au,PRUNED
1249,0.0,2026-04-26 15:31:43.612478,2026-04-26 15:31:44.231455,0 days 00:00:00.618977,40.050113598418015,17.153074450201355,1.7940082473010686,Au,PRUNED
1250,0.0,2026-04-26 15:31:43.636011,2026-04-26 15:31:44.089691,0 days 00:00:00.453680,36.336195067621894,16.239558806751553,1.6838657392124339,Au,PRUNED
1251,0.0,2026-04-26 15:31:43.822270,2026-04-26 15:31:44.428135,0 days 00:00:00.605865,20.43159600855121,16.430153728058315,1.6127284206127181,Au,PRUNED
1252,0.0,2026-04-26 15:31:43.842242,2026-04-26 15:31:44.492897,0 days 00:00:00.650655,20.46718092147424,16.61432272836887,1.6031500035182389,Au,PRUNED
1253,0.0,2026-04-26 15:31:43.875401,2026-04-26 15:31:44.616480,0 days 00:00:00.741079,20.38914609291945,16.594293017875234,1.7989188579616298,Au,PRUNED
1254,0.0,2026-04-26 15:31:44.202488,2026-04-26 15:31:44.857330,0 days 00:00:00.654842,21.086525160915706,17.26557824479221,1.218717991537702,Au,PRUNED
1255,0.0,2026-04-26 15:31:44.258101,2026-04-26 15:31:44.827883,0 days 00:00:00.569782,37.25464160368411,19.809567341522616,1.6757783765632708,Au,PRUNED
1256,0.0,2026-04-26 15:31:44.259677,2026-04-26 15:31:44.976957,0 days 00:00:00.717280,32.98505663481535,19.947784438730487,1.5596668847404136,Au,PRUNED
1257,0.0,2026-04-26 15:31:44.299364,2026-04-26 15:31:44.755360,0 days 00:00:00.455996,20.108702574995604,19.9062033571516,1.4528292732494141,Au,PRUNED
1258,0.0,2026-04-26 15:31:44.405954,2026-04-26 15:31:44.885734,0 days 00:00:00.479780,32.55449899370301,17.413537201088186,1.9867765080745192,Au,PRUNED
1259,0.0,2026-04-26 15:31:44.493896,2026-04-26 15:31:45.329049,0 days 00:00:00.835153,33.77299435169428,16.922195120085096,1.9761302810917951,Au,PRUNED
1260,0.0,2026-04-26 15:31:44.542934,2026-04-26 15:31:45.219288,0 days 00:00:00.676354,20.641752065327495,19.89125124118702,1.0241371404575048,Au,PRUNED
1261,0.0,2026-04-26 15:31:44.670311,2026-04-26 15:31:45.304423,0 days 00:00:00.634112,36.22625560801154,19.887297556615675,1.7893799736534255,Au,PRUNED
1262,-311.66180758015366,2026-04-26 15:31:44.892385,2026-04-26 15:31:45.362656,0 days 00:00:00.470271,20.88651862037515,19.412341474627834,1.9833467422099447,Cu,COMPLETE
1263,0.0,2026-04-26 15:31:44.892385,2026-04-26 15:31:45.649847,0 days 00:00:00.757462,20.611767925155245,19.383736542068345,1.7195863595425194,Au,PRUNED
1264,-577.9532967032268,2026-04-26 15:31:44.978971,2026-04-26 15:31:45.618743,0 days 00:00:00.639772,21.147300721968705,19.98324225530298,1.5274879883445067,Au,COMPLETE
1265,0.0,2026-04-26 15:31:45.024461,2026-04-26 15:31:45.751173,0 days 00:00:00.726712,20.156921085830398,19.503833334705842,1.726696712325618,Au,PRUNED
1266,0.0,2026-04-26 15:31:45.050817,2026-04-26 15:31:45.771345,0 days 00:00:00.720528,38.931152219052464,16.486407107143283,1.925048247377739,Au,PRUNED
1267,-12.987012987011793,2026-04-26 15:31:45.281453,2026-04-26 15:31:46.051511,0 days 00:00:00.770058,69.58402076039744,4.7767451533197,1.6046715479407683,Cu,PRUNED
1268,141.75824175823726,2026-04-26 15:31:45.362656,2026-04-26 15:31:46.122799,0 days 00:00:00.760143,32.882327719716166,16.603764224422534,1.733151493114114,Au,PRUNED
1269,-11.904761904760573,2026-04-26 15:31:45.477961,2026-04-26 15:31:46.002234,0 days 00:00:00.524273,81.42674135349176,0.9557670713215352,1.6459389051328177,Au,PRUNED
1270,22.85714285714247,2026-04-26 15:31:45.525429,2026-04-26 15:31:46.276052,0 days 00:00:00.750623,114.34384662119093,7.007002214416046,0.25133060133466056,Au,PRUNED
1271,142.8571428571383,2026-04-26 15:31:45.808845,2026-04-26 15:31:46.400035,0 days 00:00:00.591190,31.649085785819974,16.675592399762333,1.7239593508596567,Au,PRUNED
1272,-1.1806375442738872,2026-04-26 15:31:45.832928,2026-04-26 15:31:46.483580,0 days 00:00:00.650652,106.80139239605975,5.0362622329277675,1.8096285376503474,Ag,PRUNED
1273,0.0,2026-04-26 15:31:45.844608,2026-04-26 15:31:46.507983,0 days 00:00:00.663375,20.361620749658712,19.533950796294413,1.6001088576083324,Au,PRUNED
1274,-547.401111474275,2026-04-26 15:31:45.911037,2026-04-26 15:31:46.609745,0 days 00:00:00.698708,20.87025894911044,19.637559614608584,1.7702484676661205,Au,COMPLETE
1275,0.0,2026-04-26 15:31:46.078881,2026-04-26 15:31:46.651616,0 days 00:00:00.572735,36.656664338641335,19.967758492849338,1.910776993126352,Au,PRUNED
1276,0.0,2026-04-26 15:31:46.096491,2026-04-26 15:31:46.661086,0 days 00:00:00.564595,38.66336674208571,16.85954857716886,1.73838723848104,Au,PRUNED
1277,0.0,2026-04-26 15:31:46.235554,2026-04-26 15:31:46.909714,0 days 00:00:00.674160,20.031353233190195,17.352065905993772,1.7408110030088535,Au,PRUNED
1278,0.0,2026-04-26 15:31:46.397949,2026-04-26 15:31:47.133217,0 days 00:00:00.735268,35.86568902534214,17.05307860825043,1.9719452342798482,Au,PRUNED
1279,145.05494505494045,2026-04-26 15:31:46.483580,2026-04-26 15:31:47.008237,0 days 00:00:00.524657,25.802385214098443,19.96480002932156,1.880547895285743,Au,PRUNED
1280,0.0,2026-04-26 15:31:46.572886,2026-04-26 15:31:47.008237,0 days 00:00:00.435351,30.065502653406597,19.81134043106477,1.8287808281031792,Au,PRUNED
1281,-8.928571428570304,2026-04-26 15:31:46.704734,2026-04-26 15:31:47.372672,0 days 00:00:00.667938,21.712195705882074,19.758205205206966,1.7286777877437878,Au,PRUNED
1282,0.0,2026-04-26 15:31:46.724617,2026-04-26 15:31:47.320566,0 days 00:00:00.595949,21.10315991663333,17.09950894101675,1.832817075936635,Au,PRUNED
1283,0.0,2026-04-26 15:31:46.744348,2026-04-26 15:31:47.396234,0 days 00:00:00.651886,36.126763626800916,19.503211455396126,1.8853299867380238,Au,PRUNED
1284,0.0,2026-04-26 15:31:46.792616,2026-04-26 15:31:47.614597,0 days 00:00:00.821981,20.73585558352818,19.208161835447143,1.6943878175296085,Au,PRUNED
1285,-0.5952380952380847,2026-04-26 15:31:46.944547,2026-04-26 15:31:47.661307,0 days 00:00:00.716760,85.21060223180262,14.87430219578441,0.9680408629034851,Au,PRUNED
1286,-563.7156270958426,2026-04-26 15:31:47.096042,2026-04-26 15:31:47.771184,0 days 00:00:00.675142,20.908351488431144,19.629813106095444,1.9531672097229278,Au,COMPLETE
1287,0.0,2026-04-26 15:31:47.136255,2026-04-26 15:31:47.851592,0 days 00:00:00.715337,33.84499108381985,17.005440655777218,1.6552982671782446,Au,PRUNED
1288,0.0,2026-04-26 15:31:47.231195,2026-04-26 15:31:47.850591,0 days 00:00:00.619396,21.072265575120554,16.96196986767528,1.6536728898950697,Au,PRUNED
1289,0.0,2026-04-26 15:31:47.462680,2026-04-26 15:31:48.042632,0 days 00:00:00.579952,20.987933827221855,16.632221023928864,1.9944277544050715,Au,PRUNED
1290,3.7593984962402023,2026-04-26 15:31:47.511063,2026-04-26 15:31:48.205950,0 days 00:00:00.694887,29.9987405637459,16.505304553832687,1.4361490546232205,Au,PRUNED
1291,0.0,2026-04-26 15:31:47.595980,2026-04-26 15:31:48.251459,0 days 00:00:00.655479,36.94055574220043,19.80070245540863,1.7390098426241174,Au,PRUNED
1292,-1.1806375442738872,2026-04-26 15:31:47.816713,2026-04-26 15:31:48.333109,0 days 00:00:00.516396,54.895061638980074,19.74590973753815,1.4032957357848075,Cu,PRUNED
1293,-522.7629513343226,2026-04-26 15:31:47.835110,2026-04-26 15:31:48.334912,0 days 00:00:00.499802,20.78179063951065,19.375035040976584,1.7944927490008644,Au,COMPLETE
1294,-1.050420168067195,2026-04-26 15:31:47.914645,2026-04-26 15:31:48.494682,0 days 00:00:00.580037,25.086275482368443,5.769024532406851,0.29056107843725576,Au,PRUNED
1295,0.0,2026-04-26 15:31:47.945352,2026-04-26 15:31:48.740297,0 days 00:00:00.794945,27.633060696205884,19.92081616547739,1.6179721129117115,Au,PRUNED
1296,-4.3290043290040625,2026-04-26 15:31:48.054836,2026-04-26 15:31:48.666109,0 days 00:00:00.611273,29.020208694351965,7.063837504859305,0.8941418156840726,Au,PRUNED
1297,0.0,2026-04-26 15:31:48.119507,2026-04-26 15:31:48.741804,0 days 00:00:00.622297,31.867998682551143,19.804704983525788,1.610561285941795,Au,PRUNED
1298,0.0,2026-04-26 15:31:48.280120,2026-04-26 15:31:48.849358,0 days 00:00:00.569238,35.68342294431122,17.72115531692451,1.6950158240406998,Au,PRUNED
1299,0.0,2026-04-26 15:31:48.327996,2026-04-26 15:31:48.984421,0 days 00:00:00.656425,20.74313951166376,19.44483284890675,1.6167504454434687,Au,PRUNED
1300,0.0,2026-04-26 15:31:48.545018,2026-04-26 15:31:49.205974,0 days 00:00:00.660956,20.139860988867635,19.206549882065747,1.6935698148846474,Au,PRUNED
1301,0.0,2026-04-26 15:31:48.586852,2026-04-26 15:31:49.067195,0 days 00:00:00.480343,97.8863959093517,18.5838496637394,0.6679430011891615,Cu,PRUNED
1302,-261.6268297201977,2026-04-26 15:31:48.785353,2026-04-26 15:31:49.440061,0 days 00:00:00.654708,22.322595739889355,19.20759803312471,1.8738412450596806,Ag,COMPLETE
1303,0.0,2026-04-26 15:31:48.818253,2026-04-26 15:31:49.439053,0 days 00:00:00.620800,41.4522796733839,19.95017128541775,1.3296311434685892,Au,PRUNED
1304,0.0,2026-04-26 15:31:48.852430,2026-04-26 15:31:49.440061,0 days 00:00:00.587631,20.63331999169735,19.33540789772593,1.7434675266824338,Au,PRUNED
1305,-9.852216748767784,2026-04-26 15:31:48.915765,2026-04-26 15:31:49.501690,0 days 00:00:00.585925,27.90689435003671,18.273029251138457,1.6425054971398125,Ag,PRUNED
1306,0.0,2026-04-26 15:31:49.064122,2026-04-26 15:31:49.595400,0 days 00:00:00.531278,40.821461598544914,19.482470429016356,1.955724445470874,Au,PRUNED
1307,-1.0660980810234213,2026-04-26 15:31:49.050112,2026-04-26 15:31:49.786144,0 days 00:00:00.736032,21.51451327278688,18.30395526232396,1.7291390803147622,Ag,PRUNED
1308,0.0,2026-04-26 15:31:49.127872,2026-04-26 15:31:49.725487,0 days 00:00:00.597615,59.384327078745315,18.801204681452386,1.8557751392232833,Au,PRUNED
1309,-11.904761904760573,2026-04-26 15:31:49.289210,2026-04-26 15:31:50.078776,0 days 00:00:00.789566,21.69024221176138,18.802010858412814,1.9714223405410576,Au,PRUNED
1310,0.0,2026-04-26 15:31:49.580714,2026-04-26 15:31:50.190279,0 days 00:00:00.609565,34.19065282916603,17.324140104875365,1.4221616080612416,Au,PRUNED
1311,0.0,2026-04-26 15:31:49.614374,2026-04-26 15:31:50.529552,0 days 00:00:00.915178,27.462015209920988,19.831103011926967,1.925465445533898,Au,PRUNED
1312,0.0,2026-04-26 15:31:49.665852,2026-04-26 15:31:50.268429,0 days 00:00:00.602577,20.7137357872286,16.920177831644363,1.52641722821293,Au,PRUNED
1313,0.0,2026-04-26 15:31:49.695296,2026-04-26 15:31:50.325399,0 days 00:00:00.630103,32.39702515804551,19.76294976405742,1.7211415081530435,Au,PRUNED
1314,-8.928571428570304,2026-04-26 15:31:49.726671,2026-04-26 15:31:50.427818,0 days 00:00:00.701147,21.58084698415934,19.86536216321336,1.9746122323946975,Au,PRUNED
1315,0.0,2026-04-26 15:31:49.894749,2026-04-26 15:31:50.791686,0 days 00:00:00.896937,20.071672039608647,19.89180887808685,1.987117002823355,Ag,PRUNED
1316,0.0,2026-04-26 15:31:49.925497,2026-04-26 15:31:50.648653,0 days 00:00:00.723156,23.261530584757438,19.831839224095585,1.8128724250109887,Au,PRUNED
1317,0.0,2026-04-26 15:31:50.163747,2026-04-26 15:31:50.904996,0 days 00:00:00.741249,31.250590438272297,19.678958204747957,1.997363979243692,Au,PRUNED
1318,-4.464285714285152,2026-04-26 15:31:50.297913,2026-04-26 15:31:50.848071,0 days 00:00:00.550158,22.31664815762673,19.764221357053312,1.9382894735203713,Au,PRUNED
1319,0.0,2026-04-26 15:31:50.357299,2026-04-26 15:31:51.230816,0 days 00:00:00.873517,45.90324805603925,19.988523776944184,1.6664653373134122,Au,PRUNED
1320,0.0,2026-04-26 15:31:50.360309,2026-04-26 15:31:51.054607,0 days 00:00:00.694298,32.13011755721831,19.928713001975478,1.9936067051934945,Au,PRUNED
1321,0.0,2026-04-26 15:31:50.506415,2026-04-26 15:31:51.304145,0 days 00:00:00.797730,20.333314154767816,19.825230122352277,1.7305517627593474,Au,PRUNED
1322,0.0,2026-04-26 15:31:50.599862,2026-04-26 15:31:51.229816,0 days 00:00:00.629954,37.63666795659941,19.831102313487502,1.3353287682984472,Au,PRUNED
1323,139.56043956043513,2026-04-26 15:31:50.758543,2026-04-26 15:31:51.411227,0 days 00:00:00.652684,34.91940573483,16.626312585578336,1.489753104143224,Au,PRUNED
1324,-9.523809523808245,2026-04-26 15:31:50.869702,2026-04-26 15:31:51.753515,0 days 00:00:00.883813,22.93836241874713,19.859629789214797,1.3377521218518746,Au,PRUNED
1325,0.0,2026-04-26 15:31:50.938123,2026-04-26 15:31:51.525203,0 days 00:00:00.587080,20.035196373313028,19.754923640285003,1.6599887712493873,Au,PRUNED
1326,0.0,2026-04-26 15:31:51.012610,2026-04-26 15:31:51.741543,0 days 00:00:00.728933,38.53227257356666,19.81364863953161,1.680581751198837,Au,PRUNED
1327,0.0,2026-04-26 15:31:51.154027,2026-04-26 15:31:51.805808,0 days 00:00:00.651781,20.464648790819716,19.87858064937208,1.2895231648070993,Au,PRUNED
1328,-13.60544217686944,2026-04-26 15:31:51.346597,2026-04-26 15:31:52.008472,0 days 00:00:00.661875,45.80357923405186,5.489280074496929,1.070497032383356,Cu,PRUNED
1329,-0.6105006105005994,2026-04-26 15:31:51.371269,2026-04-26 15:31:52.399726,0 days 00:00:01.028457,72.4662874929989,18.037325844736444,0.7275058010056653,Au,PRUNED
1330,0.0,2026-04-26 15:31:51.442596,2026-04-26 15:31:52.120928,0 days 00:00:00.678332,20.427781700225736,17.37097125835257,1.3425880492764457,Au,PRUNED
1331,0.0,2026-04-26 15:31:51.527991,2026-04-26 15:31:52.382654,0 days 00:00:00.854663,20.069821083533796,17.33520238524711,1.4011006394188106,Au,PRUNED
1332,0.0,2026-04-26 15:31:51.605323,2026-04-26 15:31:52.557015,0 days 00:00:00.951692,20.540897272600496,16.262752415690482,1.3396319383980377,Au,PRUNED
1333,3.7593984962402023,2026-04-26 15:31:51.856172,2026-04-26 15:31:52.586631,0 days 00:00:00.730459,30.727649684152006,16.54689527011446,1.2497705909234964,Au,PRUNED
1334,0.0,2026-04-26 15:31:51.806816,2026-04-26 15:31:52.616004,0 days 00:00:00.809188,31.340186279952434,19.96851812775831,1.6931550672708187,Au,PRUNED
1335,0.0,2026-04-26 15:31:51.917196,2026-04-26 15:31:52.675160,0 days 00:00:00.757964,31.96308392591739,19.99087466590012,1.9380495739635204,Au,PRUNED
1336,0.0,2026-04-26 15:31:52.124431,2026-04-26 15:31:53.226459,0 days 00:00:01.102028,20.677168399203786,16.275708649687488,1.7220209552030898,Au,PRUNED
1337,0.0,2026-04-26 15:31:52.247346,2026-04-26 15:31:52.990919,0 days 00:00:00.743573,20.302957939829714,19.865572880459602,1.642921611452614,Au,PRUNED
1338,-570.4105870375973,2026-04-26 15:31:52.452244,2026-04-26 15:31:53.260547,0 days 00:00:00.808303,21.33084611683367,19.789783796428054,1.515479819976529,Au,COMPLETE
1339,-550.9031198685731,2026-04-26 15:31:52.463705,2026-04-26 15:31:53.069610,0 days 00:00:00.605905,21.307676200430034,19.183500688190506,1.9691591362896361,Au,COMPLETE
1340,-8.928571428570304,2026-04-26 15:31:52.655995,2026-04-26 15:31:53.444555,0 days 00:00:00.788560,22.130172044406564,19.624495310777622,1.9620337596608672,Au,PRUNED
1341,0.0,2026-04-26 15:31:52.676702,2026-04-26 15:31:53.259547,0 days 00:00:00.582845,20.624015974246227,17.268419846164875,1.887070511945836,Au,PRUNED
1342,-561.7263298761463,2026-04-26 15:31:52.732559,2026-04-26 15:31:53.323832,0 days 00:00:00.591273,20.402611935070155,19.958324450238507,1.9680524474737147,Au,COMPLETE
1343,-4.761904761904122,2026-04-26 15:31:52.772037,2026-04-26 15:31:53.428785,0 days 00:00:00.656748,22.84584524539193,19.984529118301836,1.4403537759844596,Au,PRUNED
1344,-503.33636639363715,2026-04-26 15:31:53.068562,2026-04-26 15:31:53.710560,0 days 00:00:00.641998,21.599918232493753,18.390709874872588,1.9537890715216337,Au,COMPLETE
1345,0.0,2026-04-26 15:31:53.352693,2026-04-26 15:31:53.879623,0 days 00:00:00.526930,34.49495479817642,17.263638337021963,1.7722579729352037,Au,PRUNED
1346,0.0,2026-04-26 15:31:53.369460,2026-04-26 15:31:53.836000,0 days 00:00:00.466540,35.09576779242503,17.116151453112174,1.8792709116823958,Au,PRUNED
1347,0.0,2026-04-26 15:31:53.421496,2026-04-26 15:31:54.023929,0 days 00:00:00.602433,39.99779334835222,16.925991861914532,1.9768465496575633,Au,PRUNED
