number,value,datetime_start,datetime_complete,duration,params_D2_nm,params_D3_nm,params_D4_nm,params_metal,state
2872,0.0,2026-04-26 15:34:40.703340,2026-04-26 15:34:41.481581,0 days 00:00:00.778241,20.277960635977834,17.353076630202192,1.6851728086594946,Au,PRUNED
2873,0.0,2026-04-26 15:34:40.724012,2026-04-26 15:34:41.405579,0 days 00:00:00.681567,32.49029501469676,17.738624210155084,1.6959554611833463,Cu,PRUNED
2874,-547.237659365743,2026-04-26 15:34:40.753150,2026-04-26 15:34:41.654237,0 days 00:00:00.901087,20.202110736867848,19.929496419950905,1.9920880966838819,Au,COMPLETE
2875,0.0,2026-04-26 15:34:40.742368,2026-04-26 15:34:41.496119,0 days 00:00:00.753751,20.58155515116865,18.9151994476265,1.7110689005605109,Cu,PRUNED
2876,0.0,2026-04-26 15:34:40.929928,2026-04-26 15:34:41.449880,0 days 00:00:00.519952,35.25486825871239,19.91489945872239,1.8112572222524916,Au,PRUNED
2877,0.0,2026-04-26 15:34:41.082964,2026-04-26 15:34:41.785335,0 days 00:00:00.702371,20.95929830148919,17.37410085733733,1.2068218975033669,Au,PRUNED
2878,-8.928571428570304,2026-04-26 15:34:41.132936,2026-04-26 15:34:41.825517,0 days 00:00:00.692581,21.898802721081587,19.979380585622074,1.8875970260748165,Au,PRUNED
2879,0.0,2026-04-26 15:34:41.222358,2026-04-26 15:34:42.198124,0 days 00:00:00.975766,20.390475769261528,16.788967036514677,1.8297915440046684,Au,PRUNED
2880,-8.403361344536819,2026-04-26 15:34:41.453967,2026-04-26 15:34:42.281160,0 days 00:00:00.827193,21.49752307412021,19.784030502381274,1.6451097245653785,Au,PRUNED
2881,0.0,2026-04-26 15:34:41.564703,2026-04-26 15:34:42.276353,0 days 00:00:00.711650,20.266757523355434,16.971547547515012,1.5961449125899323,Au,PRUNED
2882,0.0,2026-04-26 15:34:41.593391,2026-04-26 15:34:42.337894,0 days 00:00:00.744503,33.4087808094506,17.91496702519023,1.6938690285626743,Au,PRUNED
2883,0.0,2026-04-26 15:34:41.625234,2026-04-26 15:34:42.305205,0 days 00:00:00.679971,31.34080028587583,19.85742727355142,1.1502431271825377,Au,PRUNED
2884,0.0,2026-04-26 15:34:41.858538,2026-04-26 15:34:42.804229,0 days 00:00:00.945691,46.28249157449622,19.84846559962105,1.1722804275697905,Au,PRUNED
2885,0.0,2026-04-26 15:34:41.906973,2026-04-26 15:34:42.643998,0 days 00:00:00.737025,21.054440971196847,17.261214811665063,1.5901641354173686,Au,PRUNED
2886,-0.5854800936768048,2026-04-26 15:34:41.928498,2026-04-26 15:34:42.787522,0 days 00:00:00.859024,98.22043088210499,12.636089891204136,0.36888599152193646,Au,PRUNED
2887,0.0,2026-04-26 15:34:42.323018,2026-04-26 15:34:42.894161,0 days 00:00:00.571143,35.15363331581747,17.839528073049856,1.9997053150607442,Au,PRUNED
2888,0.0,2026-04-26 15:34:42.366127,2026-04-26 15:34:43.086354,0 days 00:00:00.720227,38.59438525990007,17.39959263768359,1.7940698735135285,Au,PRUNED
2889,-8.928571428570304,2026-04-26 15:34:42.336266,2026-04-26 15:34:43.083760,0 days 00:00:00.747494,22.09678508618799,19.850286356307734,1.723019885274247,Au,PRUNED
2890,-4.464285714285152,2026-04-26 15:34:42.450765,2026-04-26 15:34:43.130843,0 days 00:00:00.680078,23.067121923080567,19.925602956712257,1.6898685715340702,Au,PRUNED
2891,-14.880952380951127,2026-04-26 15:34:42.569409,2026-04-26 15:34:43.285335,0 days 00:00:00.715926,39.29771604560254,15.402355628511298,1.9997043198879634,Ag,PRUNED
2892,-2.2148394241417133,2026-04-26 15:34:42.735697,2026-04-26 15:34:43.365219,0 days 00:00:00.629522,91.7649510480478,15.126670511634993,1.6201627948376038,Ag,PRUNED
2893,-7.518796992480405,2026-04-26 15:34:42.844076,2026-04-26 15:34:43.691979,0 days 00:00:00.847903,30.94693585266708,14.287546824948777,1.7034812088585813,Au,PRUNED
2894,-20.40816326530416,2026-04-26 15:34:42.963334,2026-04-26 15:34:43.800862,0 days 00:00:00.837528,51.681076168032156,15.883429766130323,1.7961324261639011,Ag,PRUNED
2895,-2.5062656641603547,2026-04-26 15:34:42.995056,2026-04-26 15:34:43.617584,0 days 00:00:00.622528,99.27965869385706,1.1421647706025873,1.4961709663075133,Au,PRUNED
2896,0.0,2026-04-26 15:34:43.207426,2026-04-26 15:34:44.012615,0 days 00:00:00.805189,49.30810766462291,19.98016810213823,1.3645047653842615,Au,PRUNED
2897,-585.8533194298898,2026-04-26 15:34:43.289045,2026-04-26 15:34:44.105917,0 days 00:00:00.816872,21.144370762367924,19.97237295898651,1.628659137953922,Au,COMPLETE
2898,-1.0660980810234213,2026-04-26 15:34:43.348686,2026-04-26 15:34:44.093279,0 days 00:00:00.744593,20.213954457813966,15.748904500270879,1.319689386356673,Ag,PRUNED
2899,0.0,2026-04-26 15:34:43.383337,2026-04-26 15:34:44.439983,0 days 00:00:01.056646,20.342635620638035,19.192260720224677,1.427072273980758,Au,PRUNED
2900,0.0,2026-04-26 15:34:43.455468,2026-04-26 15:34:43.976520,0 days 00:00:00.521052,32.60308518832649,14.488450234420586,1.5002872609538882,Au,PRUNED
2901,141.75824175823726,2026-04-26 15:34:43.691979,2026-04-26 15:34:44.502345,0 days 00:00:00.810366,31.603682313519,17.385950676843557,1.7888064021317338,Au,PRUNED
2902,-8.928571428570304,2026-04-26 15:34:43.746671,2026-04-26 15:34:44.457226,0 days 00:00:00.710555,22.17245724877195,19.906527517001667,1.5862314994629048,Au,PRUNED
2903,0.0,2026-04-26 15:34:43.903113,2026-04-26 15:34:44.737639,0 days 00:00:00.834526,20.108864699844133,17.24218764696799,1.4578300801968425,Au,PRUNED
2904,0.0,2026-04-26 15:34:44.032486,2026-04-26 15:34:44.771571,0 days 00:00:00.739085,34.61271190460549,17.379687632608462,1.248933623140282,Au,PRUNED
2905,0.0,2026-04-26 15:34:44.146146,2026-04-26 15:34:44.807784,0 days 00:00:00.661638,20.25528164416323,18.977731367599024,1.3876324803747733,Au,PRUNED
2906,0.0,2026-04-26 15:34:44.209532,2026-04-26 15:34:44.847978,0 days 00:00:00.638446,46.86845415969276,19.988044356741057,1.2933785419600827,Au,PRUNED
2907,141.75824175823726,2026-04-26 15:34:44.265841,2026-04-26 15:34:45.098460,0 days 00:00:00.832619,33.3012410155507,16.671306708776193,1.4645119113426759,Au,PRUNED
2908,2.5510204081630805,2026-04-26 15:34:44.553072,2026-04-26 15:34:45.563938,0 days 00:00:01.010866,38.70222252267381,16.7404123534402,1.174691884855294,Cu,PRUNED
2909,-13.392857142855457,2026-04-26 15:34:44.583749,2026-04-26 15:34:45.345765,0 days 00:00:00.762016,22.274536055890394,19.94938114379538,1.2496202418541045,Au,PRUNED
2910,0.0,2026-04-26 15:34:44.620878,2026-04-26 15:34:45.605902,0 days 00:00:00.985024,29.816026384033844,19.838628351750618,1.4559772039214143,Au,PRUNED
2911,-0.5807200929152049,2026-04-26 15:34:44.806785,2026-04-26 15:34:45.548053,0 days 00:00:00.741268,91.51451755737446,19.94771985786229,0.2823118791655954,Cu,PRUNED
2912,0.0,2026-04-26 15:34:44.898354,2026-04-26 15:34:45.605902,0 days 00:00:00.707548,30.71016031755603,19.920893265553207,1.4227047484302906,Au,PRUNED
2913,141.75824175823726,2026-04-26 15:34:44.925451,2026-04-26 15:34:45.531808,0 days 00:00:00.606357,31.241581436566175,17.76845842741693,1.4940700413408212,Au,PRUNED
2914,0.0,2026-04-26 15:34:45.011358,2026-04-26 15:34:45.580673,0 days 00:00:00.569315,20.96737118097075,17.260363196152113,1.2757914007797466,Au,PRUNED
2915,-1.7421602787456147,2026-04-26 15:34:45.195822,2026-04-26 15:34:46.094128,0 days 00:00:00.898306,117.25273255838094,0.8822806867272526,1.8813772323704383,Ag,PRUNED
2916,0.0,2026-04-26 15:34:45.493911,2026-04-26 15:34:46.373127,0 days 00:00:00.879216,32.59339239394451,19.936037626573842,1.3815675940441048,Au,PRUNED
2917,0.0,2026-04-26 15:34:45.642684,2026-04-26 15:34:46.432650,0 days 00:00:00.789966,20.395152124467497,16.988730470782848,1.992548602448986,Au,PRUNED
2918,0.0,2026-04-26 15:34:45.659044,2026-04-26 15:34:46.263551,0 days 00:00:00.604507,20.86079654985288,17.95693586579046,1.4834608807081329,Au,PRUNED
2919,0.0,2026-04-26 15:34:45.673915,2026-04-26 15:34:46.525297,0 days 00:00:00.851382,32.52291033957912,14.727635369127132,1.5651456945001296,Au,PRUNED
2920,0.0,2026-04-26 15:34:45.691616,2026-04-26 15:34:46.266056,0 days 00:00:00.574440,32.2182896248492,19.983870531645646,1.5656423473660874,Au,PRUNED
2921,0.0,2026-04-26 15:34:45.720290,2026-04-26 15:34:46.389426,0 days 00:00:00.669136,33.22468528396678,19.93615875399083,1.2988275530490732,Au,PRUNED
2922,0.0,2026-04-26 15:34:45.822265,2026-04-26 15:34:46.374131,0 days 00:00:00.551866,33.826002834982695,17.757679688766707,1.5030257876468909,Au,PRUNED
2923,0.0,2026-04-26 15:34:46.289984,2026-04-26 15:34:47.086514,0 days 00:00:00.796530,21.12191109153038,16.843777838022,1.6045382045892318,Au,PRUNED
2924,-564.3697478990921,2026-04-26 15:34:46.342116,2026-04-26 15:34:46.966400,0 days 00:00:00.624284,21.514948498766618,19.678536587092843,1.4268231152579667,Au,COMPLETE
2925,0.0,2026-04-26 15:34:46.462358,2026-04-26 15:34:47.072296,0 days 00:00:00.609938,36.88000261796047,17.205100628563514,1.4613030294295741,Au,PRUNED
2926,0.0,2026-04-26 15:34:46.483628,2026-04-26 15:34:47.148317,0 days 00:00:00.664689,42.26036706004736,16.445576354494747,1.4905537437492764,Au,PRUNED
2927,0.0,2026-04-26 15:34:46.499631,2026-04-26 15:34:47.042637,0 days 00:00:00.543006,34.66108229134534,18.138484472875312,1.5136871545888755,Au,PRUNED
2928,0.0,2026-04-26 15:34:46.597713,2026-04-26 15:34:47.376583,0 days 00:00:00.778870,46.570122037226824,17.078206569820125,1.6169419692672302,Au,PRUNED
2929,0.0,2026-04-26 15:34:46.646383,2026-04-26 15:34:47.305533,0 days 00:00:00.659150,20.19497582241259,19.663227410105026,1.5333290546032345,Au,PRUNED
2930,0.0,2026-04-26 15:34:46.695991,2026-04-26 15:34:47.335567,0 days 00:00:00.639576,35.58829853901697,18.295705962745384,1.3765994485327555,Au,PRUNED
2931,-10.989010989010133,2026-04-26 15:34:47.184911,2026-04-26 15:34:47.919671,0 days 00:00:00.734760,46.36397291970858,9.541192771584992,0.7303684860000508,Cu,PRUNED
2932,-1.2106537530266126,2026-04-26 15:34:47.199360,2026-04-26 15:34:48.286330,0 days 00:00:01.086970,76.45904150615533,19.679552717202732,1.7523073357678673,Au,PRUNED
2933,140.65934065933618,2026-04-26 15:34:47.234295,2026-04-26 15:34:47.969491,0 days 00:00:00.735196,33.76548099234897,17.121837501052067,1.3810424778602284,Au,PRUNED
2934,0.0,2026-04-26 15:34:47.266746,2026-04-26 15:34:47.926257,0 days 00:00:00.659511,20.435623731017287,19.62817419321059,1.734858146729574,Ag,PRUNED
2935,-8.658008658008125,2026-04-26 15:34:47.276500,2026-04-26 15:34:47.924703,0 days 00:00:00.648203,23.97610126761495,16.81184310159947,1.3800406639239957,Cu,PRUNED
2936,0.0,2026-04-26 15:34:47.452501,2026-04-26 15:34:47.955196,0 days 00:00:00.502695,20.76036682008761,14.5476009791885,1.5023704576574943,Au,PRUNED
2937,-3.6166365280288377,2026-04-26 15:34:47.476664,2026-04-26 15:34:48.026177,0 days 00:00:00.549513,90.89099146125302,14.908959176625164,0.5989737956723801,Ag,PRUNED
2938,0.0,2026-04-26 15:34:47.550959,2026-04-26 15:34:48.087471,0 days 00:00:00.536512,33.6011607609856,19.878288504032056,1.4910679005456116,Au,PRUNED
2939,0.0,2026-04-26 15:34:48.052278,2026-04-26 15:34:48.923957,0 days 00:00:00.871679,36.29753345278395,19.952567152578812,1.5518587498016256,Cu,PRUNED
2940,-10.204081632652322,2026-04-26 15:34:48.029256,2026-04-26 15:34:48.888781,0 days 00:00:00.859525,29.46042487568763,17.377074942178215,1.6887445698471246,Ag,PRUNED
2941,0.0,2026-04-26 15:34:48.109167,2026-04-26 15:34:48.842530,0 days 00:00:00.733363,20.527469933494856,17.51147178824324,1.4643719607626198,Au,PRUNED
2942,-10.582010582009788,2026-04-26 15:34:48.113636,2026-04-26 15:34:48.922958,0 days 00:00:00.809322,30.844639925239235,16.882562084931145,1.6687263747373833,Ag,PRUNED
2943,-557.1428571427922,2026-04-26 15:34:48.157972,2026-04-26 15:34:49.126256,0 days 00:00:00.968284,20.51697331439668,19.98638468699739,1.7885349096653747,Au,COMPLETE
2944,141.75824175823726,2026-04-26 15:34:48.179126,2026-04-26 15:34:48.963549,0 days 00:00:00.784423,32.366223590874654,16.668192247233808,1.8093491226287535,Au,PRUNED
2945,0.0,2026-04-26 15:34:48.221191,2026-04-26 15:34:49.277744,0 days 00:00:01.056553,20.00837018880045,19.174233825063368,1.4460727841449186,Au,PRUNED
2946,0.0,2026-04-26 15:34:48.377880,2026-04-26 15:34:49.278248,0 days 00:00:00.900368,20.01405470115158,18.494077584751004,1.0101794528369634,Au,PRUNED
2947,-0.6053268765133063,2026-04-26 15:34:48.999648,2026-04-26 15:34:49.871916,0 days 00:00:00.872268,77.22046431411667,17.795552602309307,1.2228055096794823,Au,PRUNED
2948,3.7593984962402023,2026-04-26 15:34:49.031437,2026-04-26 15:34:49.745179,0 days 00:00:00.713742,29.204952368733565,17.558864585125917,1.507782830817876,Au,PRUNED
2949,0.0,2026-04-26 15:34:49.081337,2026-04-26 15:34:49.797126,0 days 00:00:00.715789,34.1486142615574,17.70864887503421,1.7394839875523194,Au,PRUNED
2950,0.0,2026-04-26 15:34:49.113996,2026-04-26 15:34:49.693366,0 days 00:00:00.579370,45.75739632486475,17.503860672199636,1.6975996000397195,Au,PRUNED
2951,0.0,2026-04-26 15:34:49.219427,2026-04-26 15:34:50.030101,0 days 00:00:00.810674,20.22306962179546,19.730237460904135,1.8162285796167281,Au,PRUNED
2952,0.0,2026-04-26 15:34:49.312573,2026-04-26 15:34:49.840785,0 days 00:00:00.528212,20.293771777431573,17.323738404129816,1.5214927073196647,Au,PRUNED
2953,0.0,2026-04-26 15:34:49.338178,2026-04-26 15:34:50.028162,0 days 00:00:00.689984,44.25037724389698,19.807668933361377,1.7246386821368929,Au,PRUNED
2954,0.0,2026-04-26 15:34:49.389936,2026-04-26 15:34:50.137461,0 days 00:00:00.747525,32.52941799006135,19.969759494076463,1.2736466925395105,Au,PRUNED
2955,0.0,2026-04-26 15:34:49.796124,2026-04-26 15:34:50.737202,0 days 00:00:00.941078,36.30264770625613,19.9737468164799,1.6949955179742642,Au,PRUNED
2956,0.0,2026-04-26 15:34:49.810369,2026-04-26 15:34:50.710782,0 days 00:00:00.900413,20.3893663215684,19.563826761037014,1.7450040384720815,Au,PRUNED
2957,-4.464285714285152,2026-04-26 15:34:49.994600,2026-04-26 15:34:51.105605,0 days 00:00:01.111005,23.18541539646939,19.983807013138687,1.378089535484142,Au,PRUNED
2958,0.0,2026-04-26 15:34:50.094700,2026-04-26 15:34:51.039066,0 days 00:00:00.944366,20.493875109951038,19.79383993334389,1.395351123116562,Au,PRUNED
2959,-8.928571428570304,2026-04-26 15:34:50.170748,2026-04-26 15:34:50.738214,0 days 00:00:00.567466,21.45698189161427,19.815213362633617,1.704392156408771,Au,PRUNED
2960,0.0,2026-04-26 15:34:50.184177,2026-04-26 15:34:50.970502,0 days 00:00:00.786325,34.93486668657328,19.894147751681714,1.5444879167849523,Au,PRUNED
2961,0.0,2026-04-26 15:34:50.265162,2026-04-26 15:34:50.865807,0 days 00:00:00.600645,33.19457666496504,19.852670545944196,1.436157356062401,Au,PRUNED
2962,146.1538461538415,2026-04-26 15:34:50.338696,2026-04-26 15:34:51.149383,0 days 00:00:00.810687,25.892747338822776,19.972078747968457,1.5299573593862872,Au,PRUNED
2963,-547.0742072572108,2026-04-26 15:34:50.787427,2026-04-26 15:34:51.722509,0 days 00:00:00.935082,21.11202086544875,19.680769608246745,1.5349505792000304,Au,COMPLETE
2964,-2.0703933747411387,2026-04-26 15:34:50.869392,2026-04-26 15:34:51.663885,0 days 00:00:00.794493,47.672628515966196,19.91910139875598,1.9860637429817236,Cu,PRUNED
2965,0.0,2026-04-26 15:34:50.985717,2026-04-26 15:34:51.804106,0 days 00:00:00.818389,112.11397971927249,11.683473102919356,0.8961668947231903,Cu,PRUNED
2966,0.0,2026-04-26 15:34:50.991858,2026-04-26 15:34:51.641458,0 days 00:00:00.649600,20.082484384895977,19.681613974886353,1.4006045361924313,Au,PRUNED
2967,0.0,2026-04-26 15:34:51.070278,2026-04-26 15:34:51.757903,0 days 00:00:00.687625,20.33861658466896,18.433734593783413,1.7455108377722293,Au,PRUNED
2968,0.0,2026-04-26 15:34:51.107613,2026-04-26 15:34:51.725077,0 days 00:00:00.617464,20.287910426727365,17.26156106809256,1.7061160902522652,Au,PRUNED
2969,0.0,2026-04-26 15:34:51.210986,2026-04-26 15:34:51.876018,0 days 00:00:00.665032,33.73073261542661,17.47802079540474,1.7529628643907667,Au,PRUNED
2970,0.0,2026-04-26 15:34:51.228142,2026-04-26 15:34:52.270838,0 days 00:00:01.042696,20.292402897487985,19.339305060060852,1.6028140581218098,Au,PRUNED
2971,-530.86223353478,2026-04-26 15:34:51.683643,2026-04-26 15:34:52.332551,0 days 00:00:00.648908,20.256407764828907,19.684050674184842,1.9985547868880689,Au,COMPLETE
2972,0.0,2026-04-26 15:34:51.776322,2026-04-26 15:34:52.488093,0 days 00:00:00.711771,29.486006923335946,19.98841918411792,1.3962553442720562,Au,PRUNED
2973,-10.204081632652322,2026-04-26 15:34:51.822529,2026-04-26 15:34:52.567038,0 days 00:00:00.744509,26.225591683388828,19.92061135405789,1.5888462319370698,Ag,PRUNED
2974,-545.1728636659512,2026-04-26 15:34:51.887530,2026-04-26 15:34:52.411790,0 days 00:00:00.524260,20.75294957549891,19.93145832014111,1.50987271489304,Au,COMPLETE
2975,-1.050420168067195,2026-04-26 15:34:51.916219,2026-04-26 15:34:52.597519,0 days 00:00:00.681300,21.72300727529654,0.5272215389665611,1.034879507449778,Ag,PRUNED
2976,0.0,2026-04-26 15:34:51.931150,2026-04-26 15:34:52.694392,0 days 00:00:00.763242,34.3828718259241,17.805066934572988,1.7719306138605277,Au,PRUNED
2977,-547.8374836172369,2026-04-26 15:34:51.977952,2026-04-26 15:34:52.661208,0 days 00:00:00.683256,21.044152563346014,19.875469204904352,1.3711631256980947,Au,COMPLETE
2978,0.0,2026-04-26 15:34:52.478183,2026-04-26 15:34:53.096036,0 days 00:00:00.617853,32.84495138588123,19.951190322972973,1.807950380462021,Au,PRUNED
2979,0.0,2026-04-26 15:34:52.539046,2026-04-26 15:34:53.237628,0 days 00:00:00.698582,20.756299412303505,15.191236662517964,1.2340489826786614,Au,PRUNED
2980,0.0,2026-04-26 15:34:52.618877,2026-04-26 15:34:53.391231,0 days 00:00:00.772354,31.69960407445837,19.928440878498204,1.730246704876795,Au,PRUNED
2981,0.0,2026-04-26 15:34:52.697386,2026-04-26 15:34:53.299453,0 days 00:00:00.602067,27.95176787294635,19.954134261831175,1.6582169514172556,Au,PRUNED
2982,0.0,2026-04-26 15:34:52.735717,2026-04-26 15:34:53.540835,0 days 00:00:00.805118,31.832708235219382,17.786453673989605,1.6738516038510893,Au,PRUNED
2983,0.0,2026-04-26 15:34:52.757986,2026-04-26 15:34:53.596982,0 days 00:00:00.838996,20.768591206270496,17.367769845743773,1.7272488974190165,Au,PRUNED
2984,-8.928571428570304,2026-04-26 15:34:52.726829,2026-04-26 15:34:53.707556,0 days 00:00:00.980727,21.507332723967295,19.957245735580468,1.5531575916522513,Au,PRUNED
2985,0.0,2026-04-26 15:34:52.891465,2026-04-26 15:34:53.642939,0 days 00:00:00.751474,33.339412833855775,19.974912647812396,1.6217897858660848,Au,PRUNED
2986,0.0,2026-04-26 15:34:53.316234,2026-04-26 15:34:54.016963,0 days 00:00:00.700729,20.171671777521812,17.83687518438981,1.6538715662271324,Au,PRUNED
2987,2.5510204081630805,2026-04-26 15:34:53.362729,2026-04-26 15:34:54.332191,0 days 00:00:00.969462,32.49639747699413,19.88349304614273,1.3010491581347874,Cu,PRUNED
2988,-14.285714285712844,2026-04-26 15:34:53.440429,2026-04-26 15:34:54.063436,0 days 00:00:00.623007,67.73654072684074,5.658695768929348,0.5343019400678529,Cu,PRUNED
2989,3.7593984962402023,2026-04-26 15:34:53.496597,2026-04-26 15:34:54.389913,0 days 00:00:00.893316,30.910171546122996,16.03382041276722,1.4873388134869756,Au,PRUNED
2990,-545.439686171889,2026-04-26 15:34:53.661023,2026-04-26 15:34:54.264913,0 days 00:00:00.603890,21.576638580704156,19.999904633683958,0.8009277935353802,Au,COMPLETE
2991,0.0,2026-04-26 15:34:53.709554,2026-04-26 15:34:54.471449,0 days 00:00:00.761895,32.547301896926236,19.962556295630105,1.650224618357724,Au,PRUNED
2992,0.0,2026-04-26 15:34:53.740270,2026-04-26 15:34:54.328865,0 days 00:00:00.588595,36.679053973833135,19.906728922759942,1.475944775740724,Au,PRUNED
2993,0.0,2026-04-26 15:34:53.799700,2026-04-26 15:34:54.291963,0 days 00:00:00.492263,20.0433116336501,17.403367383014725,0.9982375843000073,Au,PRUNED
2994,7.518796992480405,2026-04-26 15:34:54.157969,2026-04-26 15:34:54.717279,0 days 00:00:00.559310,31.064980416476462,16.897671390142847,1.1800728918503323,Au,PRUNED
2995,-8.928571428570304,2026-04-26 15:34:54.229831,2026-04-26 15:34:54.947774,0 days 00:00:00.717943,22.22115221980798,19.889507733345933,1.4776900298254543,Au,PRUNED
2996,0.0,2026-04-26 15:34:54.362301,2026-04-26 15:34:54.807863,0 days 00:00:00.445562,20.187850912793873,17.622220737099585,1.3987836582531266,Au,PRUNED
2997,0.0,2026-04-26 15:34:54.443174,2026-04-26 15:34:54.899752,0 days 00:00:00.456578,34.73458841666848,19.877897263982167,1.7528499727006284,Au,PRUNED
2998,-0.5760368663594372,2026-04-26 15:34:54.509798,2026-04-26 15:34:54.940163,0 days 00:00:00.430365,54.909758822890474,19.402510518488207,0.4688516594222476,Cu,PRUNED
2999,0.0,2026-04-26 15:34:54.471449,2026-04-26 15:34:54.808406,0 days 00:00:00.336957,34.38698820029515,19.93806656972212,1.4189871787532913,Au,PRUNED
