number,value,datetime_start,datetime_complete,duration,params_D2_nm,params_D3_nm,params_D4_nm,params_metal,state
1624,3.571428571428211,2026-04-26 15:32:23.257503,2026-04-26 15:32:23.774098,0 days 00:00:00.516595,31.605228028510794,15.919854063219082,1.7411257986536492,Au,PRUNED
1625,-8.241758241757601,2026-04-26 15:32:23.745921,2026-04-26 15:32:24.540194,0 days 00:00:00.794273,25.52245343751452,6.2782455527328835,1.0624360953621534,Ag,PRUNED
1626,0.0,2026-04-26 15:32:23.778226,2026-04-26 15:32:24.597589,0 days 00:00:00.819363,31.14290405264606,19.860017591773563,1.5385319062506084,Au,PRUNED
1627,0.0,2026-04-26 15:32:23.859800,2026-04-26 15:32:24.710688,0 days 00:00:00.850888,42.13747768366534,19.99636887559958,1.86314176566882,Cu,PRUNED
1628,-8.928571428570304,2026-04-26 15:32:23.880693,2026-04-26 15:32:24.597589,0 days 00:00:00.716896,22.054655634738143,19.954942518937784,1.7318851670480453,Au,PRUNED
1629,0.0,2026-04-26 15:32:23.899443,2026-04-26 15:32:24.535301,0 days 00:00:00.635858,36.02710735408605,19.89220170343128,1.1863431544004523,Au,PRUNED
1630,-9.523809523808245,2026-04-26 15:32:23.932813,2026-04-26 15:32:24.834972,0 days 00:00:00.902159,22.33930799598419,19.93244326025991,1.627368832735645,Au,PRUNED
1631,0.0,2026-04-26 15:32:23.982006,2026-04-26 15:32:24.807867,0 days 00:00:00.825861,20.32576295100796,19.49337978860521,1.2786284149583405,Au,PRUNED
1632,0.0,2026-04-26 15:32:24.041590,2026-04-26 15:32:24.836383,0 days 00:00:00.794793,36.30974853802724,19.764880688596804,1.6926383269438547,Au,PRUNED
1633,-525.9165613147328,2026-04-26 15:32:24.680558,2026-04-26 15:32:25.225344,0 days 00:00:00.544786,21.244284910800882,19.552955424542365,1.2940809964128157,Au,COMPLETE
1634,0.0,2026-04-26 15:32:24.731139,2026-04-26 15:32:25.180096,0 days 00:00:00.448957,20.104473727895634,19.92686727101344,1.919774356717052,Au,PRUNED
1635,0.5411255411255325,2026-04-26 15:32:24.774883,2026-04-26 15:32:25.334837,0 days 00:00:00.559954,80.42386169268903,8.360269710633684,1.9889058112980202,Au,PRUNED
1636,0.0,2026-04-26 15:32:24.849481,2026-04-26 15:32:25.566659,0 days 00:00:00.717178,20.627701884931533,17.64037129921679,1.7133499737162425,Au,PRUNED
1637,0.0,2026-04-26 15:32:24.888012,2026-04-26 15:32:25.804204,0 days 00:00:00.916192,20.327090598571854,16.679280459745957,1.752542306413009,Au,PRUNED
1638,0.0,2026-04-26 15:32:24.901799,2026-04-26 15:32:25.629014,0 days 00:00:00.727215,20.2227884227447,17.08993167189834,1.744668853091357,Au,PRUNED
1639,0.0,2026-04-26 15:32:24.914876,2026-04-26 15:32:25.676224,0 days 00:00:00.761348,33.099616487042894,19.896358856318933,1.7785220903263654,Au,PRUNED
1640,0.0,2026-04-26 15:32:24.951353,2026-04-26 15:32:25.694432,0 days 00:00:00.743079,37.8962653501773,19.59710435897144,1.6958252874190047,Ag,PRUNED
1641,0.0,2026-04-26 15:32:25.225868,2026-04-26 15:32:25.896651,0 days 00:00:00.670783,20.063694027329806,17.91453773125311,1.4332474335581276,Au,PRUNED
1642,0.0,2026-04-26 15:32:25.449487,2026-04-26 15:32:26.175407,0 days 00:00:00.725920,31.90862093074366,19.9119993373311,1.7892797413946406,Au,PRUNED
1643,0.0,2026-04-26 15:32:25.479682,2026-04-26 15:32:26.129533,0 days 00:00:00.649851,34.69463584622888,19.993119543358304,1.6976665254654144,Au,PRUNED
1644,0.0,2026-04-26 15:32:25.716075,2026-04-26 15:32:26.224183,0 days 00:00:00.508108,20.08534080574843,19.915928365422673,1.3997413825071008,Au,PRUNED
1645,0.0,2026-04-26 15:32:25.781172,2026-04-26 15:32:26.534992,0 days 00:00:00.753820,20.02588602641309,16.628730508944493,1.5263589363642949,Au,PRUNED
1646,7.518796992480405,2026-04-26 15:32:25.759772,2026-04-26 15:32:26.419443,0 days 00:00:00.659671,30.762682335168307,16.369025748024928,1.6395489250047497,Au,PRUNED
1647,0.0,2026-04-26 15:32:25.837227,2026-04-26 15:32:26.860103,0 days 00:00:01.022876,20.633498166433426,15.948271550462756,1.9783858121021765,Au,PRUNED
1648,0.0,2026-04-26 15:32:25.912401,2026-04-26 15:32:26.628840,0 days 00:00:00.716439,33.33619956998122,19.713725430126335,1.7014801157131016,Au,PRUNED
1649,0.0,2026-04-26 15:32:25.950668,2026-04-26 15:32:26.659544,0 days 00:00:00.708876,23.306728712555177,19.89673341958679,1.7410912505018683,Au,PRUNED
1650,0.0,2026-04-26 15:32:26.225233,2026-04-26 15:32:27.138231,0 days 00:00:00.912998,20.40624611310707,19.898635933194228,1.3085856417621133,Au,PRUNED
1651,0.0,2026-04-26 15:32:26.270499,2026-04-26 15:32:27.096311,0 days 00:00:00.825812,20.797971498067156,16.890665186586013,1.994691719932596,Au,PRUNED
1652,142.8571428571383,2026-04-26 15:32:26.326466,2026-04-26 15:32:27.095289,0 days 00:00:00.768823,30.99454305701137,16.89828883323435,1.7200308722778699,Au,PRUNED
1653,-8.928571428570304,2026-04-26 15:32:26.494598,2026-04-26 15:32:27.230921,0 days 00:00:00.736323,22.119847340749853,19.9844478321788,1.277949004844669,Au,PRUNED
1654,0.0,2026-04-26 15:32:26.717196,2026-04-26 15:32:27.670939,0 days 00:00:00.953743,21.320426404255926,17.261551321597373,1.5998555638167709,Au,PRUNED
1655,140.65934065933618,2026-04-26 15:32:26.780001,2026-04-26 15:32:27.467007,0 days 00:00:00.687006,32.161951652863245,17.169125307735058,1.7341873173508047,Au,PRUNED
1656,0.0,2026-04-26 15:32:26.755660,2026-04-26 15:32:27.796866,0 days 00:00:01.041206,21.09663326880522,16.566124363518586,1.6633682780091599,Au,PRUNED
1657,-0.5668934240362716,2026-04-26 15:32:26.950311,2026-04-26 15:32:27.953486,0 days 00:00:01.003175,58.95252318229508,18.606737608756465,0.14461031411202674,Cu,PRUNED
1658,0.0,2026-04-26 15:32:27.193743,2026-04-26 15:32:28.260619,0 days 00:00:01.066876,33.75950627476507,17.10098799767688,1.9977463527059285,Au,PRUNED
1659,0.0,2026-04-26 15:32:27.252258,2026-04-26 15:32:27.920330,0 days 00:00:00.668072,23.07201684382426,19.971119842069047,1.8405092443721094,Au,PRUNED
1660,0.0,2026-04-26 15:32:27.293569,2026-04-26 15:32:28.158326,0 days 00:00:00.864757,20.190512555116634,17.77486557884126,1.6082696159749845,Au,PRUNED
1661,0.0,2026-04-26 15:32:27.416316,2026-04-26 15:32:28.143866,0 days 00:00:00.727550,37.07868320790108,17.140460312201892,1.680029837791586,Au,PRUNED
1662,0.0,2026-04-26 15:32:27.529686,2026-04-26 15:32:28.183830,0 days 00:00:00.654144,51.25731163687565,17.61366405805632,1.8619545528673116,Au,PRUNED
1663,-1.0660980810234213,2026-04-26 15:32:27.754354,2026-04-26 15:32:28.369193,0 days 00:00:00.614839,21.70194882098933,15.533302446739714,1.5696338480240257,Ag,PRUNED
1664,-1.1520737327188744,2026-04-26 15:32:27.845972,2026-04-26 15:32:28.721551,0 days 00:00:00.875579,87.26968575813967,15.90026057650179,1.7424099241164586,Cu,PRUNED
1665,0.0,2026-04-26 15:32:28.040030,2026-04-26 15:32:28.682868,0 days 00:00:00.642838,37.2256889300287,17.052844149505113,1.96730243823212,Au,PRUNED
1666,-1.1614401858304098,2026-04-26 15:32:28.203201,2026-04-26 15:32:28.760493,0 days 00:00:00.557292,72.00160378695422,19.277282112043952,0.9587745171034527,Cu,PRUNED
1667,-543.9310120402888,2026-04-26 15:32:28.160836,2026-04-26 15:32:29.272306,0 days 00:00:01.111470,20.480323247557287,19.943228476839028,1.7000140004032185,Au,COMPLETE
1668,0.0,2026-04-26 15:32:28.279323,2026-04-26 15:32:28.931706,0 days 00:00:00.652383,20.454457057931812,17.629610797411484,1.394309955204267,Au,PRUNED
1669,0.0,2026-04-26 15:32:28.292973,2026-04-26 15:32:28.722551,0 days 00:00:00.429578,36.68808882498986,19.486513911275594,1.9892543503977769,Au,PRUNED
1670,0.0,2026-04-26 15:32:28.357015,2026-04-26 15:32:28.837295,0 days 00:00:00.480280,20.397957974951918,17.828529588774348,1.968076380169001,Au,PRUNED
1671,0.0,2026-04-26 15:32:28.481475,2026-04-26 15:32:29.319246,0 days 00:00:00.837771,35.32830483275585,19.955012351110312,1.667043235044337,Au,PRUNED
1672,0.0,2026-04-26 15:32:28.780943,2026-04-26 15:32:29.586317,0 days 00:00:00.805374,20.081215252132306,15.856016691940896,1.0710890992667499,Au,PRUNED
1673,0.0,2026-04-26 15:32:28.813485,2026-04-26 15:32:29.463721,0 days 00:00:00.650236,48.77617940577076,19.995688080780553,1.5854534491902283,Au,PRUNED
1674,0.0,2026-04-26 15:32:28.854165,2026-04-26 15:32:29.469276,0 days 00:00:00.615111,37.58560820725606,16.62362552223672,1.3996786896798399,Au,PRUNED
1675,0.0,2026-04-26 15:32:28.914766,2026-04-26 15:32:29.584781,0 days 00:00:00.670015,20.32054424750934,18.57709314972596,1.6970208310569965,Au,PRUNED
1676,-8.928571428570304,2026-04-26 15:32:28.981041,2026-04-26 15:32:29.930510,0 days 00:00:00.949469,21.392126964036652,19.96459710332571,1.630244086734788,Au,PRUNED
1677,0.0,2026-04-26 15:32:29.030198,2026-04-26 15:32:29.660146,0 days 00:00:00.629948,34.2288384409719,19.790563836006836,1.7913254916395736,Au,PRUNED
1678,0.0,2026-04-26 15:32:29.525155,2026-04-26 15:32:30.331212,0 days 00:00:00.806057,35.84321051724632,19.9215787968802,1.5615730956628013,Cu,PRUNED
1679,0.0,2026-04-26 15:32:29.556833,2026-04-26 15:32:30.222494,0 days 00:00:00.665661,39.03250811230345,19.998849355179043,1.6974864215960128,Au,PRUNED
1680,0.0,2026-04-26 15:32:29.632475,2026-04-26 15:32:30.378231,0 days 00:00:00.745756,20.305099885677752,18.05669921802793,1.6279122317212664,Au,PRUNED
1681,0.0,2026-04-26 15:32:29.660684,2026-04-26 15:32:30.458024,0 days 00:00:00.797340,35.719899593651164,19.92605132994533,1.2436043676056745,Au,PRUNED
1682,142.8571428571383,2026-04-26 15:32:29.746934,2026-04-26 15:32:30.421516,0 days 00:00:00.674582,30.46884666368807,17.397130607376702,1.7410408610495378,Au,PRUNED
1683,-555.8501823002339,2026-04-26 15:32:29.756448,2026-04-26 15:32:30.457023,0 days 00:00:00.700575,20.478241494352968,19.86461017917183,1.9382646882898436,Au,COMPLETE
1684,0.0,2026-04-26 15:32:29.840860,2026-04-26 15:32:30.545558,0 days 00:00:00.704698,115.84667353836127,16.259018590579423,0.3758576587465159,Cu,PRUNED
1685,147.25274725274258,2026-04-26 15:32:30.086315,2026-04-26 15:32:30.720406,0 days 00:00:00.634091,25.387743612292134,19.874607988481433,1.6164463899159949,Au,PRUNED
1686,-4.464285714285152,2026-04-26 15:32:30.298875,2026-04-26 15:32:31.138182,0 days 00:00:00.839307,22.799367283598226,19.934561170946065,1.7041575997775325,Au,PRUNED
1687,0.0,2026-04-26 15:32:30.487471,2026-04-26 15:32:31.293475,0 days 00:00:00.806004,20.013361663837095,17.66120876367605,1.3234697691002668,Au,PRUNED
1688,-541.1402656299999,2026-04-26 15:32:30.566586,2026-04-26 15:32:31.527213,0 days 00:00:00.960627,20.441148877577014,19.99666925074015,1.645900611183823,Au,COMPLETE
1689,0.0,2026-04-26 15:32:30.594107,2026-04-26 15:32:31.563749,0 days 00:00:00.969642,56.14992615871876,19.90498496756049,1.9158340942749386,Au,PRUNED
1690,-4.464285714285152,2026-04-26 15:32:30.643291,2026-04-26 15:32:31.526681,0 days 00:00:00.883390,22.92992553948427,19.818557309266982,1.5986889988782174,Au,PRUNED
1691,0.0,2026-04-26 15:32:30.672051,2026-04-26 15:32:31.385876,0 days 00:00:00.713825,34.434677805999776,19.813110920004576,1.5039633300148956,Au,PRUNED
1692,-217.5739861161716,2026-04-26 15:32:30.731421,2026-04-26 15:32:31.651014,0 days 00:00:00.919593,22.956465650975645,17.57053367950068,1.5214793785408145,Ag,COMPLETE
1693,0.0,2026-04-26 15:32:30.827221,2026-04-26 15:32:31.649642,0 days 00:00:00.822421,36.69036062665877,13.488813408028863,1.5349812724683387,Au,PRUNED
1694,0.0,2026-04-26 15:32:31.435493,2026-04-26 15:32:32.110095,0 days 00:00:00.674602,34.83395318739921,17.036782754691338,1.8055559252780775,Au,PRUNED
1695,-15.873015873014094,2026-04-26 15:32:31.483749,2026-04-26 15:32:32.238320,0 days 00:00:00.754571,54.00520384416424,2.4663020122109964,1.2273863754284229,Au,PRUNED
1696,0.0,2026-04-26 15:32:31.549625,2026-04-26 15:32:32.135896,0 days 00:00:00.586271,20.48948154887769,19.9983100337971,1.588068260995607,Au,PRUNED
1697,0.0,2026-04-26 15:32:31.530269,2026-04-26 15:32:32.269548,0 days 00:00:00.739279,34.09515743941721,19.733757036185548,1.9730610569493112,Au,PRUNED
1698,0.0,2026-04-26 15:32:31.735432,2026-04-26 15:32:32.598509,0 days 00:00:00.863077,20.75469185476469,16.993959487283554,1.7845462746796268,Au,PRUNED
1699,0.0,2026-04-26 15:32:31.790424,2026-04-26 15:32:32.630958,0 days 00:00:00.840534,36.04849714600009,17.184794042649184,1.9487642437121349,Au,PRUNED
1700,-3.7593984962402023,2026-04-26 15:32:31.826949,2026-04-26 15:32:32.473064,0 days 00:00:00.646115,31.768263794847904,17.21054488764599,1.6022087762571413,Cu,PRUNED
1701,0.0,2026-04-26 15:32:31.933320,2026-04-26 15:32:32.709201,0 days 00:00:00.775881,20.338103961836865,19.654084714581895,1.512176071683648,Au,PRUNED
1702,-8.403361344536819,2026-04-26 15:32:32.169533,2026-04-26 15:32:33.212531,0 days 00:00:01.042998,21.127909998061217,19.79082976902037,1.8567474006722064,Au,PRUNED
1703,0.0,2026-04-26 15:32:32.391703,2026-04-26 15:32:33.028091,0 days 00:00:00.636388,20.083372429265424,16.062251866274273,1.5219504784098896,Au,PRUNED
1704,-10.989010989010133,2026-04-26 15:32:32.414579,2026-04-26 15:32:33.385930,0 days 00:00:00.971351,92.8263337105285,4.345388961891347,0.47451079292558673,Au,PRUNED
1705,0.0,2026-04-26 15:32:32.445734,2026-04-26 15:32:33.026425,0 days 00:00:00.580691,20.061247262696465,18.172047104013124,1.6196450850829078,Au,PRUNED
1706,0.0,2026-04-26 15:32:32.566735,2026-04-26 15:32:33.181565,0 days 00:00:00.614830,20.18726097480324,17.3859245079606,1.7639919234805166,Au,PRUNED
1707,-8.928571428570304,2026-04-26 15:32:32.675380,2026-04-26 15:32:33.422451,0 days 00:00:00.747071,21.626174925639173,19.81806019472494,1.7337246763624228,Au,PRUNED
1708,-1.1806375442738872,2026-04-26 15:32:32.740147,2026-04-26 15:32:33.315977,0 days 00:00:00.575830,106.12188279185833,14.658529710887244,1.8457561635799111,Au,PRUNED
1709,-3.7593984962402023,2026-04-26 15:32:32.796656,2026-04-26 15:32:33.260460,0 days 00:00:00.463804,25.240935072957477,19.970786665869564,1.8094464172199558,Cu,PRUNED
1710,-543.0194805194183,2026-04-26 15:32:33.140646,2026-04-26 15:32:33.899591,0 days 00:00:00.758945,20.40954424874952,19.76913214405836,1.9343995307511739,Au,COMPLETE
1711,23.05961754780614,2026-04-26 15:32:33.213538,2026-04-26 15:32:33.825334,0 days 00:00:00.611796,96.83802919140801,10.846366103790524,0.2642367834080964,Cu,PRUNED
1712,0.0,2026-04-26 15:32:33.280161,2026-04-26 15:32:33.978068,0 days 00:00:00.697907,33.66866834802158,19.98546674655158,1.6004919452309059,Au,PRUNED
1713,-542.694805194743,2026-04-26 15:32:33.322627,2026-04-26 15:32:34.043104,0 days 00:00:00.720477,20.39824227331303,19.88876908147816,1.8077844215378052,Au,COMPLETE
1714,-8.928571428570304,2026-04-26 15:32:33.356994,2026-04-26 15:32:33.891504,0 days 00:00:00.534510,21.61282635929728,19.994419174168893,1.8714650673084294,Au,PRUNED
1715,0.0,2026-04-26 15:32:33.447847,2026-04-26 15:32:34.175443,0 days 00:00:00.727596,34.523091507354124,19.976501092052573,1.7131859288115665,Au,PRUNED
1716,0.0,2026-04-26 15:32:33.498084,2026-04-26 15:32:34.171816,0 days 00:00:00.673732,109.32923622644063,16.17830913664598,1.2684020758986247,Ag,PRUNED
1717,140.65934065933618,2026-04-26 15:32:33.513862,2026-04-26 15:32:34.041807,0 days 00:00:00.527945,33.04705591730374,17.06660221797978,1.4302373307869942,Au,PRUNED
1718,0.0,2026-04-26 15:32:33.900166,2026-04-26 15:32:34.794499,0 days 00:00:00.894333,36.850677873513014,17.195092098742954,1.295932507143466,Au,PRUNED
1719,0.0,2026-04-26 15:32:34.029436,2026-04-26 15:32:34.936028,0 days 00:00:00.906592,42.885751558258505,15.867443047634813,1.1423553000832698,Cu,PRUNED
1720,0.0,2026-04-26 15:32:34.099242,2026-04-26 15:32:34.653899,0 days 00:00:00.554657,35.73015361714892,17.281793247631462,1.9791627220205341,Au,PRUNED
1721,0.0,2026-04-26 15:32:34.108426,2026-04-26 15:32:34.699305,0 days 00:00:00.590879,20.377155237854435,19.940465312680175,1.5234518103185462,Au,PRUNED
1722,0.0,2026-04-26 15:32:34.199414,2026-04-26 15:32:34.794499,0 days 00:00:00.595085,36.38483651053253,19.955625340246566,1.2631181477920557,Au,PRUNED
1723,0.0,2026-04-26 15:32:34.271713,2026-04-26 15:32:34.824205,0 days 00:00:00.552492,20.50704626771066,17.857254562408187,1.991127639602171,Au,PRUNED
1724,0.0,2026-04-26 15:32:34.330170,2026-04-26 15:32:35.357154,0 days 00:00:01.026984,20.160761611073678,14.813976792026143,1.6585949808173799,Au,PRUNED
1725,0.0,2026-04-26 15:32:34.354098,2026-04-26 15:32:35.026721,0 days 00:00:00.672623,20.767509737967874,19.733496505765917,1.4498775169806086,Au,PRUNED
1726,0.0,2026-04-26 15:32:34.771035,2026-04-26 15:32:35.556042,0 days 00:00:00.785007,35.79146968293302,17.15625581539437,1.4505197707179307,Au,PRUNED
1727,0.0,2026-04-26 15:32:34.875419,2026-04-26 15:32:35.556042,0 days 00:00:00.680623,34.292435627430294,16.747228566934925,1.7482209090312666,Au,PRUNED
1728,-22.321428571425763,2026-04-26 15:32:34.906639,2026-04-26 15:32:35.570706,0 days 00:00:00.664067,29.32098342268543,19.623001152267044,1.6749360298706357,Ag,PRUNED
1729,0.0,2026-04-26 15:32:34.939203,2026-04-26 15:32:35.486546,0 days 00:00:00.547343,49.96160233503436,17.39340068599174,1.6021809630289994,Au,PRUNED
1730,0.0,2026-04-26 15:32:35.017497,2026-04-26 15:32:35.554457,0 days 00:00:00.536960,36.56934440277022,16.89052305034452,1.5041342534414635,Au,PRUNED
1731,0.0,2026-04-26 15:32:35.062377,2026-04-26 15:32:35.773134,0 days 00:00:00.710757,33.569049309109495,17.166564594371753,1.6658151896789455,Au,PRUNED
1732,0.0,2026-04-26 15:32:35.155480,2026-04-26 15:32:36.070196,0 days 00:00:00.914716,20.199091771597743,17.804103553676025,1.7401388855028426,Au,PRUNED
1733,7.518796992480405,2026-04-26 15:32:35.515922,2026-04-26 15:32:36.410197,0 days 00:00:00.894275,30.310276437911128,17.41644859024968,1.2187935165902468,Au,PRUNED
1734,0.0,2026-04-26 15:32:35.589080,2026-04-26 15:32:36.338751,0 days 00:00:00.749671,21.24261815891813,16.8913765881203,1.8389506982854547,Au,PRUNED
1735,0.0,2026-04-26 15:32:35.644513,2026-04-26 15:32:36.338751,0 days 00:00:00.694238,39.5274906151063,19.293092433003448,1.992678178066667,Au,PRUNED
1736,0.0,2026-04-26 15:32:35.697131,2026-04-26 15:32:36.379865,0 days 00:00:00.682734,21.048940870342104,16.727549987310784,1.334162913767,Au,PRUNED
1737,0.0,2026-04-26 15:32:35.726553,2026-04-26 15:32:36.488816,0 days 00:00:00.762263,34.87194859037767,19.915979315745712,1.9949896259580355,Au,PRUNED
1738,0.0,2026-04-26 15:32:35.759046,2026-04-26 15:32:36.426347,0 days 00:00:00.667301,20.599920810452584,19.706212652402844,1.557396262668414,Au,PRUNED
1739,139.56043956043513,2026-04-26 15:32:35.848487,2026-04-26 15:32:36.819479,0 days 00:00:00.970992,33.48153645656441,16.790452373926897,1.7773884514481233,Au,PRUNED
1740,-8.403361344536819,2026-04-26 15:32:36.241912,2026-04-26 15:32:36.941656,0 days 00:00:00.699744,21.024904667698795,19.80287137066531,1.929981325307761,Au,PRUNED
1741,4.2016806722684095,2026-04-26 15:32:36.461447,2026-04-26 15:32:37.080263,0 days 00:00:00.618816,24.46329863949708,19.978388755585286,1.5498131031320848,Au,PRUNED
1742,-0.5952380952380847,2026-04-26 15:32:36.495328,2026-04-26 15:32:37.108901,0 days 00:00:00.613573,93.58886712835152,19.938150465706265,1.7317100795017222,Au,PRUNED
1743,0.0,2026-04-26 15:32:36.537847,2026-04-26 15:32:37.136059,0 days 00:00:00.598212,20.34538846103853,16.135244271784142,1.6294468876666173,Au,PRUNED
1744,-28.571428571417115,2026-04-26 15:32:36.562270,2026-04-26 15:32:37.235147,0 days 00:00:00.672877,61.83554287200063,2.530574270485177,1.6117418672881894,Ag,PRUNED
1745,139.56043956043513,2026-04-26 15:32:36.585384,2026-04-26 15:32:37.450592,0 days 00:00:00.865208,35.352490490421644,16.987167252106826,1.0932494999463054,Au,PRUNED
1746,-11.904761904760573,2026-04-26 15:32:36.639217,2026-04-26 15:32:37.162373,0 days 00:00:00.523156,63.06310525676583,3.5678855410875947,1.1260235566413852,Cu,PRUNED
1747,0.0,2026-04-26 15:32:37.191856,2026-04-26 15:32:38.014256,0 days 00:00:00.822400,20.966061348511683,17.106935908256062,1.7472889831522207,Au,PRUNED
1748,0.0,2026-04-26 15:32:37.109901,2026-04-26 15:32:38.057584,0 days 00:00:00.947683,20.961667270154585,16.544132584429136,1.9777005699782046,Au,PRUNED
1749,0.0,2026-04-26 15:32:37.140645,2026-04-26 15:32:38.089596,0 days 00:00:00.948951,20.106186931540208,19.7005360634046,1.9828353114247868,Au,PRUNED
1750,0.0,2026-04-26 15:32:37.252449,2026-04-26 15:32:38.089596,0 days 00:00:00.837147,36.17617183194575,19.96039394523428,1.1363396027032988,Au,PRUNED
1751,0.0,2026-04-26 15:32:37.285534,2026-04-26 15:32:37.968410,0 days 00:00:00.682876,33.65432053732533,17.249462305300085,1.5335261410219434,Au,PRUNED
1752,0.0,2026-04-26 15:32:37.330404,2026-04-26 15:32:37.834890,0 days 00:00:00.504486,34.939018948040165,16.911538146262146,1.7631903912570535,Au,PRUNED
1753,0.0,2026-04-26 15:32:37.395501,2026-04-26 15:32:38.043084,0 days 00:00:00.647583,20.083540141825964,16.54438286207222,1.658781961469082,Au,PRUNED
1754,0.0,2026-04-26 15:32:37.521532,2026-04-26 15:32:37.972636,0 days 00:00:00.451104,35.7145201753698,16.871113062553235,1.7505458882553377,Au,PRUNED
1755,-13.227513227512237,2026-04-26 15:32:37.883943,2026-04-26 15:32:38.785226,0 days 00:00:00.901283,32.523871428534,17.2494843440238,1.8963901739435838,Ag,PRUNED
1756,0.0,2026-04-26 15:32:38.139170,2026-04-26 15:32:38.640312,0 days 00:00:00.501142,20.06514094678585,19.78554745625142,1.6036180834747447,Au,PRUNED
1757,0.0,2026-04-26 15:32:38.154368,2026-04-26 15:32:38.757698,0 days 00:00:00.603330,30.70316920122091,19.87819867830134,1.681772557083558,Au,PRUNED
1758,0.0,2026-04-26 15:32:38.183565,2026-04-26 15:32:38.614764,0 days 00:00:00.431199,33.34673262956242,19.75326317144791,1.7412150339407404,Au,PRUNED
1759,0.0,2026-04-26 15:32:38.205241,2026-04-26 15:32:38.786232,0 days 00:00:00.580991,21.05507831424673,15.594921231923943,1.614048710585457,Cu,PRUNED
1760,0.0,2026-04-26 15:32:38.262608,2026-04-26 15:32:39.059258,0 days 00:00:00.796650,20.12034478753384,18.209605502030378,1.627388245744915,Au,PRUNED
1761,143.9560439560394,2026-04-26 15:32:38.276630,2026-04-26 15:32:39.116688,0 days 00:00:00.840058,31.29276986138538,17.079305385052884,1.4292624155818145,Au,PRUNED
1762,-558.441558441493,2026-04-26 15:32:38.326286,2026-04-26 15:32:39.037944,0 days 00:00:00.711658,20.800910853388398,19.912101482089444,1.658320809737317,Au,COMPLETE
