number,value,datetime_start,datetime_complete,duration,params_D2_nm,params_D3_nm,params_D4_nm,params_metal,state
517,-46.05263157892295,2025-11-13 12:26:39.329032,2025-11-13 12:26:39.800788,0 days 00:00:00.471756,75.89801216794797,1.2121812528630185,0.23253823941971227,Ag,COMPLETE
518,-7.371794871794331,2025-11-13 12:26:39.465378,2025-11-13 12:26:40.430812,0 days 00:00:00.965434,31.568191959398092,1.3509875655553025,0.16498185702160545,Au,COMPLETE
519,-11.44214162348756,2025-11-13 12:26:39.544443,2025-11-13 12:26:40.080709,0 days 00:00:00.536266,41.793751674592414,1.3025022658730783,0.16528427513422694,Au,COMPLETE
520,-19.647696476961613,2025-11-13 12:26:39.679350,2025-11-13 12:26:40.243833,0 days 00:00:00.564483,66.36473122594168,0.5143831942013269,0.10047264009337349,Au,COMPLETE
521,-43.604651162770274,2025-11-13 12:26:39.774872,2025-11-13 12:26:40.369109,0 days 00:00:00.594237,66.03138886692201,3.5413750799986454,0.1628903489799466,Ag,COMPLETE
522,-51.4705882352638,2025-11-13 12:26:39.839377,2025-11-13 12:26:40.753736,0 days 00:00:00.914359,65.81499285368514,0.8147042344190113,0.16484727505257657,Ag,COMPLETE
523,-24.282560706398538,2025-11-13 12:26:40.120412,2025-11-13 12:26:40.604155,0 days 00:00:00.483743,68.56263120892379,13.59958838777946,0.8030332329681835,Ag,COMPLETE
524,-51.76767676764536,2025-11-13 12:26:40.196956,2025-11-13 12:26:40.749600,0 days 00:00:00.552644,69.07813062925734,0.5145649458762886,0.16233049530460106,Ag,COMPLETE
525,-51.47058823526383,2025-11-13 12:26:40.277974,2025-11-13 12:26:41.100913,0 days 00:00:00.822939,68.97290714507238,0.8775725522187354,0.20367316384112288,Ag,COMPLETE
526,-37.414965986379336,2025-11-13 12:26:40.430812,2025-11-13 12:26:40.937729,0 days 00:00:00.506917,68.8542846133973,0.504181185301156,1.8465157941017538,Ag,COMPLETE
527,-48.61111111108426,2025-11-13 12:26:40.564511,2025-11-13 12:26:41.096367,0 days 00:00:00.531856,72.2627569156754,1.1184702837150335,0.21030284049018733,Ag,COMPLETE
528,-49.99999999997132,2025-11-13 12:26:40.678281,2025-11-13 12:26:41.329928,0 days 00:00:00.651647,72.22222334688759,1.0461237093918334,0.20811096940695803,Ag,COMPLETE
529,-48.423423423397416,2025-11-13 12:26:40.839261,2025-11-13 12:26:41.484879,0 days 00:00:00.645618,64.55849553678408,1.9385451248546177,0.13386222095155642,Ag,COMPLETE
530,-48.42342342339707,2025-11-13 12:26:40.947004,2025-11-13 12:26:41.456456,0 days 00:00:00.509452,64.56456256396358,1.817629331744912,0.10182144711141314,Ag,COMPLETE
531,-51.76767676764536,2025-11-13 12:26:41.178233,2025-11-13 12:26:41.884965,0 days 00:00:00.706732,64.27102583531344,0.5009123685586837,0.13806175474636084,Ag,COMPLETE
532,0.0,2025-11-13 12:26:41.276823,2025-11-13 12:26:41.829080,0 days 00:00:00.552257,110.63663047967555,17.922532729945612,0.13521396091487906,Ag,COMPLETE
533,-13.519503546097837,2025-11-13 12:26:41.378079,2025-11-13 12:26:41.937944,0 days 00:00:00.559865,61.72230937208953,17.421272800541143,0.13499688848554842,Ag,COMPLETE
534,-47.453703703677256,2025-11-13 12:26:41.409483,2025-11-13 12:26:41.946445,0 days 00:00:00.536962,60.149722461473225,0.5085919766053443,0.285999980853247,Ag,COMPLETE
535,-47.45370370367742,2025-11-13 12:26:41.585951,2025-11-13 12:26:42.447951,0 days 00:00:00.862000,59.67372950143046,0.8626579932514639,0.1004034627152543,Ag,COMPLETE
536,-21.624472573834243,2025-11-13 12:26:41.690885,2025-11-13 12:26:42.338246,0 days 00:00:00.647361,38.64522813315088,0.9019620195023017,0.2842014805720968,Ag,COMPLETE
537,-7.665094339621905,2025-11-13 12:26:41.748118,2025-11-13 12:26:42.363513,0 days 00:00:00.615395,24.7257040865169,1.2306334876647733,0.18372723891358414,Ag,COMPLETE
538,-39.85507246375066,2025-11-13 12:26:41.849580,2025-11-13 12:26:42.340617,0 days 00:00:00.491037,66.54184320515452,1.3553205546365326,1.342944770954531,Ag,COMPLETE
539,-37.499999999985164,2025-11-13 12:26:42.020912,2025-11-13 12:26:43.346205,0 days 00:00:01.325293,70.47984201294666,1.1211180385001542,1.7758227583173103,Ag,COMPLETE
540,-13.237847222220827,2025-11-13 12:26:42.254774,2025-11-13 12:26:43.087056,0 days 00:00:00.832282,70.1369925543043,4.709502860183244,0.17991835422593827,Cu,COMPLETE
541,-0.8802816901408202,2025-11-13 12:26:42.176642,2025-11-13 12:26:43.133851,0 days 00:00:00.957209,20.43749582399412,0.9349077450775676,0.17345976103527827,Cu,COMPLETE
542,-51.47058823526383,2025-11-13 12:26:42.326454,2025-11-13 12:26:43.180828,0 days 00:00:00.854374,70.5225342410354,0.8835540062482643,0.17780854522823356,Ag,COMPLETE
543,-0.8802816901408202,2025-11-13 12:26:42.484022,2025-11-13 12:26:43.118324,0 days 00:00:00.634302,20.031012334296236,0.9184390967085991,0.16946191258526352,Cu,COMPLETE
544,-0.8802816901408202,2025-11-13 12:26:42.655387,2025-11-13 12:26:43.424312,0 days 00:00:00.768925,20.250793691159412,0.5021158060637645,0.17927648801491963,Cu,COMPLETE
545,-1.1150234741783764,2025-11-13 12:26:43.040190,2025-11-13 12:26:43.509922,0 days 00:00:00.469732,21.661535900146205,0.8767420422957842,1.0066707219099917,Ag,COMPLETE
546,-48.6111111110841,2025-11-13 12:26:43.071438,2025-11-13 12:26:43.813473,0 days 00:00:00.742035,67.547466379936,1.3830589154904371,0.22685594367960016,Ag,COMPLETE
547,21.07652399481161,2025-11-13 12:26:43.377446,2025-11-13 12:26:43.974249,0 days 00:00:00.596803,67.369133590177,19.566539598539183,0.2237187068348765,Ag,COMPLETE
548,-51.76767676764536,2025-11-13 12:26:43.462947,2025-11-13 12:26:43.891650,0 days 00:00:00.428703,67.13843434063868,0.5004270203137962,0.1341385860117316,Ag,COMPLETE
549,-43.60465116277055,2025-11-13 12:26:43.556699,2025-11-13 12:26:44.505705,0 days 00:00:00.949006,67.32611788433776,2.612286500523976,0.4837536694308896,Ag,COMPLETE
550,-47.14912280699262,2025-11-13 12:26:43.581922,2025-11-13 12:26:44.314555,0 days 00:00:00.732633,62.11984236457629,1.836184758154162,0.21896557193243416,Ag,COMPLETE
551,-42.63565891470892,2025-11-13 12:26:43.689892,2025-11-13 12:26:44.379560,0 days 00:00:00.689668,62.547715606979445,2.5093282940032093,0.4681462992922857,Ag,COMPLETE
552,-47.29729729727148,2025-11-13 12:26:43.764275,2025-11-13 12:26:44.442151,0 days 00:00:00.677876,62.587085089028676,1.639684583586585,0.22165127057086292,Ag,COMPLETE
553,-47.29729729727182,2025-11-13 12:26:43.844774,2025-11-13 12:26:44.379560,0 days 00:00:00.534786,62.757180456428536,1.6867707656377617,0.12994357219910188,Ag,COMPLETE
554,-1.423921887713565,2025-11-13 12:26:44.166975,2025-11-13 12:26:44.765288,0 days 00:00:00.598313,116.98921693417765,1.4571787784005568,0.10123867351679494,Ag,COMPLETE
555,-48.245614035062324,2025-11-13 12:26:44.348534,2025-11-13 12:26:44.830656,0 days 00:00:00.482122,65.02834416624842,2.4411145632415394,0.13161261115018796,Ag,COMPLETE
556,-9.74658869395598,2025-11-13 12:26:44.259784,2025-11-13 12:26:44.830656,0 days 00:00:00.570872,27.711298013430877,1.3012807205843853,0.14113464866757672,Ag,COMPLETE
557,-0.6747638326585585,2025-11-13 12:26:44.618636,2025-11-13 12:26:45.228230,0 days 00:00:00.609594,72.61520093298097,11.86928180619986,0.10262179714297043,Au,COMPLETE
558,-19.37984496123722,2025-11-13 12:26:44.719001,2025-11-13 12:26:45.275111,0 days 00:00:00.556110,72.25981618562705,0.8709478964854753,0.15132451744366818,Au,COMPLETE
559,-19.531249999996948,2025-11-13 12:26:44.799343,2025-11-13 12:26:45.212606,0 days 00:00:00.413263,71.67209873167019,0.8145361931017893,0.15524147258211093,Au,COMPLETE
560,-17.639902676396417,2025-11-13 12:26:44.830656,2025-11-13 12:26:45.736625,0 days 00:00:00.905969,56.85715990279503,0.8318012676710681,0.10133473069079003,Au,COMPLETE
561,-19.66666666666346,2025-11-13 12:26:44.893162,2025-11-13 12:26:45.811062,0 days 00:00:00.917900,72.74713337593995,0.5034897316234825,0.16081957321571008,Au,COMPLETE
562,-49.999999999971564,2025-11-13 12:26:44.969478,2025-11-13 12:26:45.696966,0 days 00:00:00.727488,73.31097917921831,1.1183231841022172,0.10277037832894602,Ag,COMPLETE
563,-53.03030303027077,2025-11-13 12:26:45.003640,2025-11-13 12:26:45.645377,0 days 00:00:00.641737,69.18353529172845,0.5123358702319651,0.20008098170378275,Ag,COMPLETE
564,-53.03030303027077,2025-11-13 12:26:45.182818,2025-11-13 12:26:45.732627,0 days 00:00:00.549809,65.3185008693123,0.5037836433548739,0.19964265285265545,Ag,COMPLETE
565,-48.6111111110841,2025-11-13 12:26:45.452589,2025-11-13 12:26:45.984156,0 days 00:00:00.531567,65.89541194932359,1.1604821140802966,0.2531807626447226,Ag,COMPLETE
566,-16.025641025637945,2025-11-13 12:26:45.645377,2025-11-13 12:26:46.438150,0 days 00:00:00.792773,34.537168131236605,1.2174204967039124,0.24025603863474299,Ag,COMPLETE
567,-49.76851851849078,2025-11-13 12:26:45.795480,2025-11-13 12:26:46.265552,0 days 00:00:00.470072,65.90157125502864,1.2764337302035842,0.2771161582939118,Ag,COMPLETE
568,-48.61111111108375,2025-11-13 12:26:45.922184,2025-11-13 12:26:46.438150,0 days 00:00:00.515966,68.34371439362769,1.2200214693714972,0.2942473550039392,Ag,COMPLETE
569,-49.76851851849078,2025-11-13 12:26:45.923185,2025-11-13 12:26:46.579160,0 days 00:00:00.655975,68.67536636058658,1.2296447578077727,0.29841917203943413,Ag,COMPLETE
570,-25.64102564102262,2025-11-13 12:26:46.086952,2025-11-13 12:26:46.900094,0 days 00:00:00.813142,68.4332884123198,16.109569102400663,0.21548438397460795,Ag,COMPLETE
571,-50.245098039186,2025-11-13 12:26:46.344220,2025-11-13 12:26:46.705610,0 days 00:00:00.361390,68.8005353862192,0.8140474928890565,0.2081169431415229,Ag,COMPLETE
572,-40.71969696967839,2025-11-13 12:26:46.359849,2025-11-13 12:26:46.965177,0 days 00:00:00.605328,64.23541341464028,0.5186121235776514,1.406566173660956,Ag,COMPLETE
573,-48.8095238094959,2025-11-13 12:26:46.438150,2025-11-13 12:26:46.929710,0 days 00:00:00.491560,64.42880419648364,0.8064088413269501,0.20893085478735485,Ag,COMPLETE
574,-30.516431924874166,2025-11-13 12:26:46.534594,2025-11-13 12:26:47.262936,0 days 00:00:00.728342,65.074151427173,5.9504475878198155,1.3976850199070043,Ag,COMPLETE
575,-49.99999999997136,2025-11-13 12:26:46.705610,2025-11-13 12:26:47.397774,0 days 00:00:00.692164,66.76806751923506,0.8734496146652526,0.24532773765242835,Ag,COMPLETE
576,-35.71428571427107,2025-11-13 12:26:46.967096,2025-11-13 12:26:47.767007,0 days 00:00:00.799911,48.69792296318141,0.8502121819569652,0.2580416555653969,Ag,COMPLETE
577,-49.999999999971564,2025-11-13 12:26:47.069125,2025-11-13 12:26:47.429597,0 days 00:00:00.360472,65.63688582431922,0.9172276754662738,0.2667210836982897,Ag,COMPLETE
578,-51.47058823526388,2025-11-13 12:26:46.997315,2025-11-13 12:26:47.680187,0 days 00:00:00.682872,66.65930402250419,0.9140680274852071,0.2444667141455515,Ag,COMPLETE
579,-53.03030303027077,2025-11-13 12:26:47.164559,2025-11-13 12:26:47.931725,0 days 00:00:00.767166,70.46958488083112,0.5022956684243254,0.19279868885364687,Ag,COMPLETE
580,-41.66666666664742,2025-11-13 12:26:47.213876,2025-11-13 12:26:47.843834,0 days 00:00:00.629958,80.4008025962153,1.778268816534024,0.1924563337914616,Ag,COMPLETE
581,-50.24509803918605,2025-11-13 12:26:47.296268,2025-11-13 12:26:48.031835,0 days 00:00:00.735567,70.27229588836815,0.5144090818927338,0.2018198493086509,Ag,COMPLETE
582,-27.02702702702214,2025-11-13 12:26:47.542865,2025-11-13 12:26:48.141782,0 days 00:00:00.598917,58.470022838010564,12.576742668290613,0.19366398527302708,Ag,COMPLETE
583,-39.00709219856502,2025-11-13 12:26:47.633860,2025-11-13 12:26:48.180826,0 days 00:00:00.546966,60.438792240776095,1.7535318631404375,1.1762624550713758,Ag,COMPLETE
584,-27.286135693210404,2025-11-13 12:26:47.796912,2025-11-13 12:26:48.248198,0 days 00:00:00.451286,70.6941768672833,12.733148531181422,0.19452462312605515,Ag,COMPLETE
585,-11.054421768705994,2025-11-13 12:26:47.952443,2025-11-13 12:26:48.831243,0 days 00:00:00.878800,29.315357704140617,0.5083574518191023,0.32186850852903076,Ag,COMPLETE
586,-33.459595959585705,2025-11-13 12:26:48.110460,2025-11-13 12:26:48.999189,0 days 00:00:00.888729,75.92896384355006,7.3085466606211895,0.3185836698338913,Ag,COMPLETE
587,-42.65873015871006,2025-11-13 12:26:48.180826,2025-11-13 12:26:48.913594,0 days 00:00:00.732768,70.35771164565685,1.3908383695746322,0.8695435207087592,Ag,COMPLETE
588,-45.94017094014722,2025-11-13 12:26:48.248198,2025-11-13 12:26:48.929242,0 days 00:00:00.681044,76.0534041995478,1.5039581353033853,0.30075402465503187,Ag,COMPLETE
589,-47.297297297271975,2025-11-13 12:26:48.524364,2025-11-13 12:26:49.237191,0 days 00:00:00.712827,74.73574712661647,1.127655776010307,0.2239158257101866,Ag,COMPLETE
590,-48.809523809495936,2025-11-13 12:26:48.780643,2025-11-13 12:26:49.397375,0 days 00:00:00.616732,74.47564411415455,0.5027954271342968,0.20961859964532573,Ag,COMPLETE
591,-48.611111111084135,2025-11-13 12:26:48.831243,2025-11-13 12:26:49.480401,0 days 00:00:00.649158,73.28624723936296,0.9210145211329928,0.2304806417092214,Ag,COMPLETE
592,-48.809523809495936,2025-11-13 12:26:48.913594,2025-11-13 12:26:49.511668,0 days 00:00:00.598074,74.36434400093528,0.5047955451037671,0.2271201560498979,Ag,COMPLETE
593,-50.24509803918605,2025-11-13 12:26:49.003188,2025-11-13 12:26:49.542921,0 days 00:00:00.539733,73.31257885792472,0.5095260022770699,0.21238781969880807,Ag,COMPLETE
594,-3.583333333333196,2025-11-13 12:26:49.344040,2025-11-13 12:26:50.231726,0 days 00:00:00.887686,94.95666516643648,2.172466619260291,0.1640713585046465,Ag,COMPLETE
595,-47.149122806992644,2025-11-13 12:26:49.397375,2025-11-13 12:26:49.955685,0 days 00:00:00.558310,69.12952022955685,2.0631882519180875,0.17300956935525633,Ag,COMPLETE
596,-49.99999999997132,2025-11-13 12:26:49.496134,2025-11-13 12:26:49.893188,0 days 00:00:00.397054,69.09099261075798,1.1190915655486269,0.16975968897111166,Ag,COMPLETE
597,-45.94017094014737,2025-11-13 12:26:49.564139,2025-11-13 12:26:50.130906,0 days 00:00:00.566767,69.89946376057385,1.223429643794748,0.6684781419756864,Ag,COMPLETE
598,-51.4705882352638,2025-11-13 12:26:49.681956,2025-11-13 12:26:50.130906,0 days 00:00:00.448950,68.72338760860747,1.1719887030618548,0.1731306974365519,Ag,COMPLETE
599,-49.76851851849078,2025-11-13 12:26:49.767910,2025-11-13 12:26:50.397656,0 days 00:00:00.629746,70.9596119608768,1.4463035877919375,0.1480267570625279,Ag,COMPLETE
600,-8.203799654575997,2025-11-13 12:26:49.846305,2025-11-13 12:26:50.397656,0 days 00:00:00.551351,26.185930379992836,1.4266231555285167,0.17175621435733446,Ag,COMPLETE
601,-49.99999999997136,2025-11-13 12:26:49.940058,2025-11-13 12:26:50.664737,0 days 00:00:00.724679,71.42221478465689,0.8344279670939334,0.2715696993836717,Ag,COMPLETE
602,-51.4705882352638,2025-11-13 12:26:50.097288,2025-11-13 12:26:50.609357,0 days 00:00:00.512069,70.97556605219542,0.8457064281910897,0.15184091387391482,Ag,COMPLETE
603,-49.99999999997136,2025-11-13 12:26:50.263423,2025-11-13 12:26:50.946992,0 days 00:00:00.683569,66.92998088326455,0.8903639347846256,0.2507301697333811,Ag,COMPLETE
604,-42.68292682924754,2025-11-13 12:26:50.514102,2025-11-13 12:26:50.962712,0 days 00:00:00.448610,67.47142355186236,0.5009501827527316,1.1048338735555054,Ag,COMPLETE
605,-27.027027027023426,2025-11-13 12:26:50.549565,2025-11-13 12:26:51.219778,0 days 00:00:00.670213,67.23658803360044,14.930860192318804,0.132184228777223,Ag,COMPLETE
606,-18.36917562723621,2025-11-13 12:26:50.582842,2025-11-13 12:26:51.546714,0 days 00:00:00.963872,90.57050743972253,0.8747809249206203,0.1351001360021188,Ag,COMPLETE
607,-51.47058823526383,2025-11-13 12:26:50.702474,2025-11-13 12:26:51.296599,0 days 00:00:00.594125,67.21562921421727,0.9614458198536451,0.13287627685876868,Ag,COMPLETE
608,-8.522727272726605,2025-11-13 12:26:50.828328,2025-11-13 12:26:51.264704,0 days 00:00:00.436376,67.59413445638626,15.29334911964325,1.6833134959206724,Ag,COMPLETE
609,-50.245098039186,2025-11-13 12:26:50.897620,2025-11-13 12:26:51.300598,0 days 00:00:00.402978,67.69005579125515,0.910665273317909,0.13604087078396146,Ag,COMPLETE
610,-39.72868217052415,2025-11-13 12:26:51.025121,2025-11-13 12:26:51.686286,0 days 00:00:00.661165,51.51986589294212,0.5053082673129942,0.1983640055085876,Ag,COMPLETE
611,-47.14912280699298,2025-11-13 12:26:51.314042,2025-11-13 12:26:51.946349,0 days 00:00:00.632307,72.25242195494461,1.775803272417317,0.192283089540012,Ag,COMPLETE
612,-1.9080582179623276,2025-11-13 12:26:51.447980,2025-11-13 12:26:51.961976,0 days 00:00:00.513996,101.03105679719704,1.7217773446772755,0.1839215578168433,Ag,COMPLETE
613,-48.42342342339725,2025-11-13 12:26:51.481339,2025-11-13 12:26:52.043675,0 days 00:00:00.562336,71.70559115880395,1.6059967028802467,0.19244969787456795,Ag,COMPLETE
614,-47.29729729727182,2025-11-13 12:26:51.497866,2025-11-13 12:26:52.039674,0 days 00:00:00.541808,63.83871478635345,1.6159904531457128,0.19108952948007224,Ag,COMPLETE
615,-31.432748538000652,2025-11-13 12:26:51.578020,2025-11-13 12:26:52.604828,0 days 00:00:01.026808,86.0900460545314,1.650992381176527,0.1949754150403629,Ag,COMPLETE
616,-19.02887139107306,2025-11-13 12:26:51.634411,2025-11-13 12:26:52.604828,0 days 00:00:00.970417,65.8014090628816,0.5039333014329775,0.26404543433317756,Au,COMPLETE
617,-7.315521628498142,2025-11-13 12:26:51.921018,2025-11-13 12:26:52.298291,0 days 00:00:00.377273,65.53978309404279,8.634331922608553,0.24897444295790383,Au,COMPLETE
618,-35.25641025639949,2025-11-13 12:26:52.060679,2025-11-13 12:26:52.482162,0 days 00:00:00.421483,69.55745654757395,7.9873717859417095,0.2660839058586911,Ag,COMPLETE
619,-51.76767676764536,2025-11-13 12:26:52.147574,2025-11-13 12:26:52.915062,0 days 00:00:00.767488,69.49856009634456,0.5002810559745908,0.1005703651000577,Ag,COMPLETE
620,-49.99999999997149,2025-11-13 12:26:52.283551,2025-11-13 12:26:52.882998,0 days 00:00:00.599447,69.68197122747667,1.196386803175478,0.13640441385672109,Ag,COMPLETE
621,-24.211711711708396,2025-11-13 12:26:52.354466,2025-11-13 12:26:53.059550,0 days 00:00:00.705084,62.70065817165531,13.307821694636075,0.9478044928443043,Ag,COMPLETE
622,-49.99999999997149,2025-11-13 12:26:52.426062,2025-11-13 12:26:53.202661,0 days 00:00:00.776599,62.66177273021184,0.8582195773993455,0.13358809354157342,Ag,COMPLETE
623,-1.1134552273792424,2025-11-13 12:26:52.523880,2025-11-13 12:26:53.201642,0 days 00:00:00.677762,22.978796147425314,0.9131683755386151,0.10011480119055972,Ag,COMPLETE
624,-0.8608815426997103,2025-11-13 12:26:52.615080,2025-11-13 12:26:53.447239,0 days 00:00:00.832159,64.85167576675711,18.677033198835744,1.9590080589213268,Cu,COMPLETE
625,-51.47058823526383,2025-11-13 12:26:52.978213,2025-11-13 12:26:53.448084,0 days 00:00:00.469871,65.51591473062732,0.933419529157881,0.15525799545152846,Ag,COMPLETE
626,-12.544802867382153,2025-11-13 12:26:53.107172,2025-11-13 12:26:53.655451,0 days 00:00:00.548279,65.033593638124,1.3451821413706067,1.9952604077658724,Cu,COMPLETE
627,-28.22580645160364,2025-11-13 12:26:53.296770,2025-11-13 12:26:53.897705,0 days 00:00:00.600935,43.61173415211087,1.2365187456652824,0.2207231801912988,Ag,COMPLETE
628,-49.76851851849059,2025-11-13 12:26:53.328021,2025-11-13 12:26:54.347479,0 days 00:00:01.019458,72.15958941920621,1.2260422985597592,0.22915215527509247,Ag,COMPLETE
629,-48.6111111110841,2025-11-13 12:26:53.406729,2025-11-13 12:26:54.166350,0 days 00:00:00.759621,68.94229498202836,1.1876774186671692,0.22391106363338323,Ag,COMPLETE
630,-7.723577235771578,2025-11-13 12:26:53.484626,2025-11-13 12:26:54.522134,0 days 00:00:01.037508,24.850795121585033,0.5051206489663905,0.23007418130948726,Ag,COMPLETE
631,-7.62910798121992,2025-11-13 12:26:53.536569,2025-11-13 12:26:54.396671,0 days 00:00:00.860102,24.68463884192926,1.1732098075821642,0.23167972387312322,Ag,COMPLETE
632,-47.45370370367742,2025-11-13 12:26:53.830109,2025-11-13 12:26:54.706659,0 days 00:00:00.876550,61.04364277465061,0.8489394410688395,0.16914886488040975,Ag,COMPLETE
633,-51.76767676764536,2025-11-13 12:26:53.881742,2025-11-13 12:26:54.658339,0 days 00:00:00.776597,68.04216194492506,0.5021345974209395,0.15197001540594796,Ag,COMPLETE
634,-51.4705882352638,2025-11-13 12:26:54.275389,2025-11-13 12:26:54.812613,0 days 00:00:00.537224,68.26860369197072,0.8418921279551222,0.16719590967359246,Ag,COMPLETE
635,-49.99999999997149,2025-11-13 12:26:54.367065,2025-11-13 12:26:54.819598,0 days 00:00:00.452533,60.919540864557845,0.8029701060735304,0.16431546526882707,Ag,COMPLETE
636,-51.76767676764536,2025-11-13 12:26:54.427408,2025-11-13 12:26:55.098182,0 days 00:00:00.670774,71.49768279623747,0.5015746699765291,0.17024258971136041,Ag,COMPLETE
637,-44.95614035085377,2025-11-13 12:26:54.717923,2025-11-13 12:26:55.195272,0 days 00:00:00.477349,78.4061482181451,0.893145579072597,0.12920894416193218,Ag,COMPLETE
638,-51.4705882352638,2025-11-13 12:26:54.796986,2025-11-13 12:26:55.622868,0 days 00:00:00.825882,66.08849912024033,0.8850270565342337,0.13284848908399025,Ag,COMPLETE
639,-53.03030303027095,2025-11-13 12:26:54.914519,2025-11-13 12:26:55.697500,0 days 00:00:00.782981,74.18443550716505,0.5004104409242868,0.10024261997709624,Ag,COMPLETE
640,-47.297297297271975,2025-11-13 12:26:55.047594,2025-11-13 12:26:55.670234,0 days 00:00:00.622640,63.67560212558827,1.4076951603257521,0.28493975641389024,Ag,COMPLETE
641,-47.00854700852281,2025-11-13 12:26:55.098182,2025-11-13 12:26:56.036539,0 days 00:00:00.938357,66.70236641649856,2.9602280052697907,0.10168299839185778,Ag,COMPLETE
642,-39.93055555553879,2025-11-13 12:26:55.157392,2025-11-13 12:26:55.762503,0 days 00:00:00.605111,73.69206977765525,4.2034734633197255,0.29079882994514133,Ag,COMPLETE
643,-51.47058823526388,2025-11-13 12:26:55.194272,2025-11-13 12:26:55.669241,0 days 00:00:00.474969,73.37624856121505,0.5066134846948398,0.2732190757447196,Ag,COMPLETE
644,-16.385767790260353,2025-11-13 12:26:55.297197,2025-11-13 12:26:56.284491,0 days 00:00:00.987294,70.52236793730292,1.4352278587659566,1.4841025684657763,Au,COMPLETE
645,-51.76767676764536,2025-11-13 12:26:55.575996,2025-11-13 12:26:56.094663,0 days 00:00:00.518667,66.72010335921368,0.5075920264175113,0.13451159324472312,Ag,COMPLETE
