number,value,datetime_start,datetime_complete,duration,params_D2_nm,params_D3_nm,params_D4_nm,params_metal,state
3364,0.0,2026-04-07 11:34:08.006473,2026-04-07 11:34:08.651513,0 days 00:00:00.645040,41.82190361342142,19.955279434333608,1.0716338825577454,Au,PRUNED
3365,-1.0,2026-04-07 11:34:08.028032,2026-04-07 11:34:08.549859,0 days 00:00:00.521827,22.32014596971382,19.806057845779975,1.0326947880930435,Au,COMPLETE
3366,0.16869095816463964,2026-04-07 11:34:08.042661,2026-04-07 11:34:08.585314,0 days 00:00:00.542653,119.60528787126927,4.326083071450938,1.9903941312792663,Cu,PRUNED
3367,0.0,2026-04-07 11:34:08.066276,2026-04-07 11:34:08.741875,0 days 00:00:00.675599,33.663108959684365,19.860479063542083,1.332211732616485,Au,PRUNED
3368,-1.0,2026-04-07 11:34:08.181132,2026-04-07 11:34:08.825907,0 days 00:00:00.644775,79.28763150767277,15.24471575625537,0.8998194575315668,Au,COMPLETE
3369,-1.0,2026-04-07 11:34:08.196804,2026-04-07 11:34:08.651513,0 days 00:00:00.454709,34.46571901225214,19.97829764632824,1.372694686246757,Au,COMPLETE
3370,-1.0,2026-04-07 11:34:08.237537,2026-04-07 11:34:08.692166,0 days 00:00:00.454629,20.946552988980304,19.36471357522173,1.6759480128287894,Au,COMPLETE
3371,-11.775362318839555,2026-04-07 11:34:08.294736,2026-04-07 11:34:08.880706,0 days 00:00:00.585970,69.16485793725523,4.681268544385889,1.4635411467858104,Cu,PRUNED
3372,-1.4880952380950254,2026-04-07 11:34:08.621900,2026-04-07 11:34:09.538381,0 days 00:00:00.916481,21.73193845230959,19.843717105927873,1.3572361231148318,Au,PRUNED
3373,-1.0,2026-04-07 11:34:08.713355,2026-04-07 11:34:09.353889,0 days 00:00:00.640534,34.46770736508017,17.632640854225624,0.8294453335244826,Au,COMPLETE
3374,-1.0,2026-04-07 11:34:08.760638,2026-04-07 11:34:09.227407,0 days 00:00:00.466769,31.713632175709268,17.651243436382284,1.3178171602693087,Au,COMPLETE
3375,0.0,2026-04-07 11:34:08.836110,2026-04-07 11:34:09.357024,0 days 00:00:00.520914,26.815810159208496,19.860239722367577,1.3924451495871855,Au,PRUNED
3376,-1.0,2026-04-07 11:34:08.882749,2026-04-07 11:34:09.450081,0 days 00:00:00.567332,20.725930829614025,19.87876643875329,0.7199815938666081,Au,COMPLETE
3377,-1.0,2026-04-07 11:34:08.966890,2026-04-07 11:34:09.376522,0 days 00:00:00.409632,39.541308510186724,19.814579147786315,1.7085563952295517,Au,COMPLETE
3378,-1.0,2026-04-07 11:34:09.018992,2026-04-07 11:34:09.513994,0 days 00:00:00.495002,23.068254990018254,19.987558574737708,1.7663203219539472,Ag,COMPLETE
3379,-8.01282051281928,2026-04-07 11:34:09.053920,2026-04-07 11:34:09.599897,0 days 00:00:00.545977,21.41103630328323,19.694053114219862,1.1019677112474247,Au,PRUNED
3380,-1.0,2026-04-07 11:34:09.433101,2026-04-07 11:34:09.995321,0 days 00:00:00.562220,33.550974013267655,18.023552461800403,1.0669436472710414,Au,COMPLETE
3381,-1.0,2026-04-07 11:34:09.358033,2026-04-07 11:34:09.995321,0 days 00:00:00.637288,20.056581529397846,17.188815677128645,0.7305378351668441,Au,COMPLETE
3382,-1.0,2026-04-07 11:34:09.478318,2026-04-07 11:34:10.100716,0 days 00:00:00.622398,20.58499032902084,19.640389605022122,1.0458933885596406,Au,COMPLETE
3383,-1.0,2026-04-07 11:34:09.510977,2026-04-07 11:34:09.994216,0 days 00:00:00.483239,47.31690720477517,19.531685937490018,1.7747119464510783,Au,COMPLETE
3384,-1.0,2026-04-07 11:34:09.633080,2026-04-07 11:34:10.116676,0 days 00:00:00.483596,20.17284382375245,19.82916627282308,1.2740492589536088,Au,COMPLETE
3385,-6.172839506171925,2026-04-07 11:34:09.666866,2026-04-07 11:34:10.304125,0 days 00:00:00.637259,22.026417032739438,19.74023421162684,0.9167394267173896,Au,PRUNED
3386,-1.0,2026-04-07 11:34:09.737151,2026-04-07 11:34:10.176183,0 days 00:00:00.439032,35.35484525892265,16.747719102348505,0.9343641814522261,Au,COMPLETE
3387,-1.0,2026-04-07 11:34:09.768716,2026-04-07 11:34:10.385214,0 days 00:00:00.616498,21.077535937386028,16.467570305174036,0.9687328751411274,Au,COMPLETE
3388,0.0,2026-04-07 11:34:10.178743,2026-04-07 11:34:10.896717,0 days 00:00:00.717974,21.215775057579286,17.152521854329954,1.17672477682623,Au,PRUNED
3389,-1.0,2026-04-07 11:34:10.134424,2026-04-07 11:34:10.851666,0 days 00:00:00.717242,32.122918351884984,17.116714490119712,1.1622133806910835,Au,COMPLETE
3390,-0.8928571428571173,2026-04-07 11:34:10.249312,2026-04-07 11:34:11.036089,0 days 00:00:00.786777,21.446580301820585,15.098803309892231,0.696605084540393,Ag,PRUNED
3391,0.0,2026-04-07 11:34:10.290795,2026-04-07 11:34:11.035538,0 days 00:00:00.744743,20.284414918332917,16.651112134850067,0.8292317017640377,Au,PRUNED
3392,0.0,2026-04-07 11:34:10.371395,2026-04-07 11:34:11.210368,0 days 00:00:00.838973,20.72037600935514,16.18623354064916,1.0126186787357958,Au,PRUNED
3393,0.0,2026-04-07 11:34:10.384087,2026-04-07 11:34:11.115244,0 days 00:00:00.731157,26.14147225004858,19.971094244254587,0.908418779334842,Au,PRUNED
3394,-1.0,2026-04-07 11:34:10.527063,2026-04-07 11:34:11.098404,0 days 00:00:00.571341,35.89906904762564,19.896676985478596,0.9284467382213464,Au,COMPLETE
3395,0.0,2026-04-07 11:34:10.638915,2026-04-07 11:34:11.387545,0 days 00:00:00.748630,20.872803150734967,16.204826185594488,1.075190058011129,Au,PRUNED
3396,0.0,2026-04-07 11:34:10.928357,2026-04-07 11:34:11.757282,0 days 00:00:00.828925,37.50836286710951,17.663402291560402,1.4579953649793729,Au,PRUNED
3397,-1.0,2026-04-07 11:34:11.028942,2026-04-07 11:34:11.600328,0 days 00:00:00.571386,20.502865502855443,17.38113156132205,1.207277748353326,Au,COMPLETE
3398,-430.87121212114675,2026-04-07 11:34:11.148641,2026-04-07 11:34:11.866350,0 days 00:00:00.717709,20.332571521644,19.704189589121622,1.5838500956182957,Au,COMPLETE
3399,0.0,2026-04-07 11:34:11.239853,2026-04-07 11:34:11.992931,0 days 00:00:00.753078,38.29003714220317,17.897989459156936,1.4844003487459632,Au,PRUNED
3400,-1.0,2026-04-07 11:34:11.299402,2026-04-07 11:34:11.956140,0 days 00:00:00.656738,38.578126253640725,4.100698594635227,1.5571699623127475,Ag,COMPLETE
3401,0.0,2026-04-07 11:34:11.324277,2026-04-07 11:34:11.991933,0 days 00:00:00.667656,36.6545496810611,17.40692913357512,0.8218151111956934,Au,PRUNED
3402,0.0,2026-04-07 11:34:11.453840,2026-04-07 11:34:12.091529,0 days 00:00:00.637689,20.223259199285323,16.60100006653266,1.2433884792182326,Au,PRUNED
3403,-437.820512820445,2026-04-07 11:34:11.540434,2026-04-07 11:34:12.457706,0 days 00:00:00.917272,21.26270390644175,19.77261807220534,0.7626162043397027,Au,COMPLETE
3404,11.857707509881235,2026-04-07 11:34:11.749479,2026-04-07 11:34:12.520337,0 days 00:00:00.770858,99.61313693098782,7.171096577042263,1.8749674686075237,Cu,PRUNED
3405,-1.0,2026-04-07 11:34:11.920129,2026-04-07 11:34:12.521349,0 days 00:00:00.601220,22.39386143590109,17.17589297465831,1.5298341313738442,Au,COMPLETE
3406,-1.0,2026-04-07 11:34:12.066926,2026-04-07 11:34:12.612439,0 days 00:00:00.545513,32.57849579177842,19.143987039480088,1.7929477007457282,Au,COMPLETE
3407,-1.0,2026-04-07 11:34:12.114364,2026-04-07 11:34:12.693575,0 days 00:00:00.579211,20.728853640207177,19.706358443295603,1.470240858516968,Au,COMPLETE
3408,0.0,2026-04-07 11:34:12.147629,2026-04-07 11:34:12.723457,0 days 00:00:00.575828,36.26416334325268,19.410151355278206,1.8776727470624635,Au,PRUNED
3409,0.0,2026-04-07 11:34:12.170912,2026-04-07 11:34:12.801760,0 days 00:00:00.630848,39.412792660635944,19.840146718951967,1.5217531653197007,Au,PRUNED
3410,-1.0,2026-04-07 11:34:12.230097,2026-04-07 11:34:12.694573,0 days 00:00:00.464476,34.186442178147715,19.806593084332967,1.7510040366377673,Au,COMPLETE
3411,-0.5787037037036875,2026-04-07 11:34:12.664778,2026-04-07 11:34:13.278800,0 days 00:00:00.614022,53.915191158344086,16.798153361286747,1.1916945795794023,Au,PRUNED
3412,-1.0,2026-04-07 11:34:12.749148,2026-04-07 11:34:13.395026,0 days 00:00:00.645878,20.208697256102173,17.703602043768484,0.8617462246156248,Au,COMPLETE
3413,-1.0,2026-04-07 11:34:12.770807,2026-04-07 11:34:13.427485,0 days 00:00:00.656678,23.06369504520177,19.849689566490827,0.7697419089038863,Au,COMPLETE
3414,-1.0,2026-04-07 11:34:12.843869,2026-04-07 11:34:13.476488,0 days 00:00:00.632619,36.35837247868009,17.733494966073614,0.6401493882477296,Au,COMPLETE
3415,-1.0,2026-04-07 11:34:12.899089,2026-04-07 11:34:13.366704,0 days 00:00:00.467615,33.00545445096987,17.404094051958225,1.4279884061457506,Au,COMPLETE
3416,79.93827160493589,2026-04-07 11:34:12.913579,2026-04-07 11:34:13.784914,0 days 00:00:00.871335,31.803115171164066,17.225560524608067,0.672280564632658,Au,PRUNED
3417,-4.629629629628944,2026-04-07 11:34:12.942338,2026-04-07 11:34:13.831092,0 days 00:00:00.888754,35.77277763317789,19.57443309765574,0.7031871592758985,Ag,PRUNED
3418,82.71604938271359,2026-04-07 11:34:12.974392,2026-04-07 11:34:13.768073,0 days 00:00:00.793681,23.874518525551053,19.994874048659955,1.7740483055165506,Au,PRUNED
3419,-392.3611111110566,2026-04-07 11:34:13.319801,2026-04-07 11:34:13.709515,0 days 00:00:00.389714,20.20002987647432,19.92762747597215,0.8334195069197653,Au,COMPLETE
3420,-1.0,2026-04-07 11:34:13.450373,2026-04-07 11:34:13.775182,0 days 00:00:00.324809,23.489054491545225,19.838946086154305,1.2828536004725228,Au,COMPLETE
3421,-1.0,2026-04-07 11:34:13.568364,2026-04-07 11:34:14.110073,0 days 00:00:00.541709,36.09759420090303,17.836156849336277,0.7761437845055246,Au,COMPLETE
3422,-1.0,2026-04-07 11:34:13.639246,2026-04-07 11:34:14.208344,0 days 00:00:00.569098,36.51429082591821,19.706832097942886,0.8811932342633224,Au,COMPLETE
3423,-1.0,2026-04-07 11:34:13.741304,2026-04-07 11:34:14.493210,0 days 00:00:00.751906,22.760548271833766,19.958374263367126,0.8486549046745014,Au,COMPLETE
3424,-1.0,2026-04-07 11:34:13.881531,2026-04-07 11:34:14.377963,0 days 00:00:00.496432,23.36342728999392,19.162745616715764,1.5328683264443375,Ag,COMPLETE
3425,-2.873563218390408,2026-04-07 11:34:13.904534,2026-04-07 11:34:14.579846,0 days 00:00:00.675312,21.7811814962191,19.35875579915039,1.6271136439250138,Au,PRUNED
3426,0.0,2026-04-07 11:34:13.895467,2026-04-07 11:34:14.551658,0 days 00:00:00.656191,20.359493376337774,18.114622511700944,0.9494903285879288,Au,PRUNED
3427,-1.0,2026-04-07 11:34:13.940605,2026-04-07 11:34:14.489117,0 days 00:00:00.548512,33.18497832953116,17.544146017183824,1.1795360748594588,Au,COMPLETE
3428,-1.0,2026-04-07 11:34:13.979479,2026-04-07 11:34:14.622703,0 days 00:00:00.643224,34.0277614655488,19.941122560629363,1.1185662201988602,Au,COMPLETE
3429,-1.0,2026-04-07 11:34:14.211593,2026-04-07 11:34:14.904332,0 days 00:00:00.692739,91.56476758819716,6.7356339166357735,1.4833661308326507,Ag,COMPLETE
3430,0.0,2026-04-07 11:34:14.413559,2026-04-07 11:34:15.186648,0 days 00:00:00.773089,34.852999858647046,18.209423413666194,1.1263110117309303,Au,PRUNED
3431,-1.0,2026-04-07 11:34:14.537636,2026-04-07 11:34:15.158696,0 days 00:00:00.621060,35.56330092260037,19.93148594319736,0.6665622045164783,Au,COMPLETE
3432,-1.0,2026-04-07 11:34:14.626773,2026-04-07 11:34:15.264318,0 days 00:00:00.637545,20.090338996660904,18.099763977719928,1.292097815055655,Au,COMPLETE
3433,0.0,2026-04-07 11:34:14.680123,2026-04-07 11:34:15.432011,0 days 00:00:00.751888,38.05798291703468,19.886770046085225,1.0145503142892212,Au,PRUNED
3434,-1.0,2026-04-07 11:34:14.778171,2026-04-07 11:34:15.434029,0 days 00:00:00.655858,20.819621007757352,19.91650148552626,1.1462721974440817,Au,COMPLETE
3435,-1.0,2026-04-07 11:34:14.801149,2026-04-07 11:34:15.325705,0 days 00:00:00.524556,20.53508135226905,19.978276749120436,0.5893221350946998,Au,COMPLETE
3436,-1.0,2026-04-07 11:34:14.849846,2026-04-07 11:34:15.561273,0 days 00:00:00.711427,38.59735405209269,19.861579817703202,0.9470512298434657,Au,COMPLETE
3437,-1.0,2026-04-07 11:34:15.187223,2026-04-07 11:34:15.814962,0 days 00:00:00.627739,32.012865291095906,19.901063375724927,0.9939055373132534,Au,COMPLETE
3438,0.0,2026-04-07 11:34:15.299115,2026-04-07 11:34:15.984511,0 days 00:00:00.685396,34.58093774480855,17.126334375632233,1.4643890466839775,Au,PRUNED
3439,0.0,2026-04-07 11:34:15.369808,2026-04-07 11:34:15.983500,0 days 00:00:00.613692,20.59027172847995,15.396852094480277,0.737572120713587,Au,PRUNED
3440,-441.2144702841686,2026-04-07 11:34:15.523434,2026-04-07 11:34:16.205359,0 days 00:00:00.681925,20.817387266642694,19.99505272646831,0.8798421917776373,Au,COMPLETE
3441,0.0,2026-04-07 11:34:15.550280,2026-04-07 11:34:16.376583,0 days 00:00:00.826303,21.16406665199554,16.565986015979295,1.300495672568775,Au,PRUNED
3442,0.0,2026-04-07 11:34:15.626945,2026-04-07 11:34:16.253079,0 days 00:00:00.626134,36.34448941198826,19.989383517662827,0.7048799438029375,Au,PRUNED
3443,83.33333333333088,2026-04-07 11:34:15.641073,2026-04-07 11:34:16.294804,0 days 00:00:00.653731,22.565863902740666,19.966219890378323,1.5214538156131494,Au,PRUNED
3444,-1.0,2026-04-07 11:34:15.713960,2026-04-07 11:34:16.249518,0 days 00:00:00.535558,39.87425389672413,19.837447191539912,0.7300330796706681,Au,COMPLETE
3445,79.93827160493589,2026-04-07 11:34:15.986506,2026-04-07 11:34:16.859975,0 days 00:00:00.873469,31.132592919167642,17.66242328048874,0.603574872392084,Au,PRUNED
3446,-1.0,2026-04-07 11:34:16.080369,2026-04-07 11:34:16.775588,0 days 00:00:00.695219,30.537149775300065,17.474643346436842,0.6255021647131738,Au,COMPLETE
3447,-0.6944444444444328,2026-04-07 11:34:16.092989,2026-04-07 11:34:16.912265,0 days 00:00:00.819276,91.4240959367209,17.951794462435398,1.6535224567159204,Au,PRUNED
3448,-1.0,2026-04-07 11:34:16.334059,2026-04-07 11:34:16.856603,0 days 00:00:00.522544,35.90331584379923,19.812095701612144,0.6314860473141688,Au,COMPLETE
3449,-1.0,2026-04-07 11:34:16.375069,2026-04-07 11:34:16.857901,0 days 00:00:00.482832,21.408718530330063,16.910392793726828,0.6317223547999186,Au,COMPLETE
3450,-1.0,2026-04-07 11:34:16.455679,2026-04-07 11:34:16.947420,0 days 00:00:00.491741,20.154902051338468,19.39683374971969,1.7220764497606371,Au,COMPLETE
3451,-1.0,2026-04-07 11:34:16.466757,2026-04-07 11:34:16.858902,0 days 00:00:00.392145,21.859352075822674,19.669603028809046,0.6454773780543546,Au,COMPLETE
3452,-3.0864197530859623,2026-04-07 11:34:16.486799,2026-04-07 11:34:17.109344,0 days 00:00:00.622545,22.39824528257089,19.852029672892943,0.7951117772051388,Au,PRUNED
3453,79.0441176470565,2026-04-07 11:34:16.992985,2026-04-07 11:34:17.698660,0 days 00:00:00.705675,35.56048893371255,14.545049482264222,0.9489200630412312,Au,PRUNED
3454,-1.0,2026-04-07 11:34:17.031104,2026-04-07 11:34:17.696148,0 days 00:00:00.665044,36.2287469102432,19.94667484563506,0.9897460090277489,Au,COMPLETE
3455,80.88235294117409,2026-04-07 11:34:17.042976,2026-04-07 11:34:17.651596,0 days 00:00:00.608620,30.108072672854853,16.963887904599375,0.7963240044259702,Au,PRUNED
3456,0.0,2026-04-07 11:34:17.076033,2026-04-07 11:34:17.797362,0 days 00:00:00.721329,35.949046500853996,17.033009880163114,0.8011427276250592,Au,PRUNED
3457,0.0,2026-04-07 11:34:17.112008,2026-04-07 11:34:17.827659,0 days 00:00:00.715651,50.07142636731918,16.86354175241658,0.8153131056069182,Au,PRUNED
3458,-444.98697916659717,2026-04-07 11:34:17.221726,2026-04-07 11:34:17.867760,0 days 00:00:00.646034,21.411069109645165,19.829464046500615,0.7049060949688353,Au,COMPLETE
3459,-1.0,2026-04-07 11:34:17.274921,2026-04-07 11:34:17.750111,0 days 00:00:00.475190,31.305786059602354,17.473548689192896,0.7947470101579527,Au,COMPLETE
3460,-1.0,2026-04-07 11:34:17.329369,2026-04-07 11:34:18.014637,0 days 00:00:00.685268,20.502077426592006,19.754603445408872,1.0306342620993747,Au,COMPLETE
3461,-1.0,2026-04-07 11:34:17.699665,2026-04-07 11:34:18.454754,0 days 00:00:00.755089,35.711142416705556,19.943888567093833,0.7618399968307864,Au,COMPLETE
3462,-1.0,2026-04-07 11:34:17.844962,2026-04-07 11:34:18.444630,0 days 00:00:00.599668,20.62770665699292,19.82696901852621,0.5580833111918231,Au,COMPLETE
3463,-1.0,2026-04-07 11:34:17.925526,2026-04-07 11:34:18.532019,0 days 00:00:00.606493,25.222348253708684,16.62712009566747,0.711870141001468,Au,COMPLETE
3464,0.0,2026-04-07 11:34:17.956604,2026-04-07 11:34:18.508599,0 days 00:00:00.551995,34.300610513012785,18.959000114560585,0.6431155787913638,Au,PRUNED
3465,-10.833333333332465,2026-04-07 11:34:17.935965,2026-04-07 11:34:18.632751,0 days 00:00:00.696786,53.123736897878445,10.157636523691407,1.504707254029853,Cu,PRUNED
3466,-1.0,2026-04-07 11:34:18.038052,2026-04-07 11:34:18.531511,0 days 00:00:00.493459,20.02586182923017,19.799625941955327,0.93056663008494,Ag,COMPLETE
3467,0.0,2026-04-07 11:34:18.076740,2026-04-07 11:34:18.727610,0 days 00:00:00.650870,33.456050783911934,18.397660106923652,0.6239683829466214,Au,PRUNED
3468,0.0,2026-04-07 11:34:18.241180,2026-04-07 11:34:18.801006,0 days 00:00:00.559826,32.76412733468389,19.522774980799372,0.7034667750308811,Au,PRUNED
3469,3.571428571428368,2026-04-07 11:34:18.608715,2026-04-07 11:34:19.348239,0 days 00:00:00.739524,56.34806010480981,18.113251901104785,0.9245045409360773,Ag,PRUNED
3470,-1.0,2026-04-07 11:34:18.645012,2026-04-07 11:34:19.348239,0 days 00:00:00.703227,30.906094944861387,17.67406798464571,0.7538777061435773,Au,COMPLETE
3471,-1.0,2026-04-07 11:34:18.698906,2026-04-07 11:34:19.206348,0 days 00:00:00.507442,37.61822296153363,17.03180104335574,0.9481231147576205,Au,COMPLETE
3472,0.0,2026-04-07 11:34:18.729260,2026-04-07 11:34:19.390546,0 days 00:00:00.661286,21.147064288503916,17.257933783715345,0.7556520599084018,Au,PRUNED
3473,-1.0,2026-04-07 11:34:18.802009,2026-04-07 11:34:19.290197,0 days 00:00:00.488188,24.68580793997349,18.032546757071987,0.6250728210377845,Au,COMPLETE
3474,-1.0,2026-04-07 11:34:18.864783,2026-04-07 11:34:19.398921,0 days 00:00:00.534138,27.824757599349493,19.935505396534023,0.500697858852206,Au,COMPLETE
3475,0.0,2026-04-07 11:34:18.905208,2026-04-07 11:34:19.692741,0 days 00:00:00.787533,30.79613884092992,19.063242142330814,0.6528481076116415,Au,PRUNED
3476,0.0,2026-04-07 11:34:19.027415,2026-04-07 11:34:20.045827,0 days 00:00:01.018412,22.35824839428851,19.951231697553343,0.9196293609835249,Au,PRUNED
3477,-370.33991228065304,2026-04-07 11:34:19.343613,2026-04-07 11:34:20.087945,0 days 00:00:00.744332,20.407627164301214,19.48310351494253,0.8448559131106889,Au,COMPLETE
3478,0.0,2026-04-07 11:34:19.420944,2026-04-07 11:34:20.060879,0 days 00:00:00.639935,50.41544037515373,17.18549909113308,0.5914604297091176,Au,PRUNED
3479,-316.4285714285351,2026-04-07 11:34:19.506085,2026-04-07 11:34:20.278118,0 days 00:00:00.772033,21.515942392416527,17.84057576417056,0.758892160538986,Au,COMPLETE
3480,0.0,2026-04-07 11:34:19.545946,2026-04-07 11:34:20.431555,0 days 00:00:00.885609,51.50686943665933,19.786971586298957,0.7638521095686144,Au,PRUNED
3481,-1.0,2026-04-07 11:34:19.662897,2026-04-07 11:34:20.295434,0 days 00:00:00.632537,21.11540196512889,16.338392743311903,0.9099378306611089,Au,COMPLETE
3482,-1.0,2026-04-07 11:34:19.691743,2026-04-07 11:34:20.246423,0 days 00:00:00.554680,26.247391680295742,19.973821264016937,0.8391098672120817,Au,COMPLETE
3483,-13.605442176869637,2026-04-07 11:34:19.879941,2026-04-07 11:34:20.918721,0 days 00:00:01.038780,32.0397402847893,17.073641180239562,0.6882213504333083,Ag,PRUNED
3484,-1.0,2026-04-07 11:34:20.130671,2026-04-07 11:34:20.805379,0 days 00:00:00.674708,48.86912062013916,19.44074646634938,0.713493705303076,Au,COMPLETE
3485,-362.6344086021036,2026-04-07 11:34:20.160417,2026-04-07 11:34:21.097311,0 days 00:00:00.936894,20.485908192452737,19.35115316385953,0.827905653575939,Au,COMPLETE
3486,0.0,2026-04-07 11:34:20.249738,2026-04-07 11:34:21.063485,0 days 00:00:00.813747,37.61005130633819,19.948881355645888,0.9201809639601216,Au,PRUNED
3487,-1.0,2026-04-07 11:34:20.457301,2026-04-07 11:34:21.215359,0 days 00:00:00.758058,20.928138669917367,17.868791821239903,0.9602645607535056,Au,COMPLETE
3488,-1.0,2026-04-07 11:34:20.633349,2026-04-07 11:34:21.152995,0 days 00:00:00.519646,21.60917547613448,15.095340429159727,0.6860181110488842,Au,COMPLETE
3489,-1.0,2026-04-07 11:34:20.677152,2026-04-07 11:34:21.066486,0 days 00:00:00.389334,29.296539344018143,12.331749730389003,0.7002710654605651,Au,COMPLETE
3490,-1.0,2026-04-07 11:34:20.750327,2026-04-07 11:34:21.360860,0 days 00:00:00.610533,27.30801768061515,17.85917249401998,0.7285958782678671,Au,COMPLETE
3491,-1.0,2026-04-07 11:34:20.999236,2026-04-07 11:34:21.422999,0 days 00:00:00.423763,118.48710276390295,0.9825935286963077,1.9634699536611961,Au,COMPLETE
3492,-1.0,2026-04-07 11:34:21.020170,2026-04-07 11:34:21.421997,0 days 00:00:00.401827,28.05042008712529,17.870678393307752,0.674934421519147,Au,COMPLETE
3493,-1.0,2026-04-07 11:34:21.142652,2026-04-07 11:34:21.672404,0 days 00:00:00.529752,21.11494913144587,16.853362428081056,0.738459217241389,Au,COMPLETE
3494,-1.0,2026-04-07 11:34:21.232633,2026-04-07 11:34:21.679202,0 days 00:00:00.446569,20.815270847905275,19.97841257725241,0.7298779558847783,Au,COMPLETE
3495,-1.0,2026-04-07 11:34:21.279173,2026-04-07 11:34:21.671390,0 days 00:00:00.392217,21.497469588969683,16.36899333989151,0.6885950742057492,Au,COMPLETE
3496,0.0,2026-04-07 11:34:21.299079,2026-04-07 11:34:21.828993,0 days 00:00:00.529914,20.23585793451832,16.863843509586406,0.9455370830482519,Au,PRUNED
3497,-347.82608695647866,2026-04-07 11:34:21.319829,2026-04-07 11:34:21.825986,0 days 00:00:00.506157,20.938653486694125,18.94984631250548,0.6624244671100659,Au,COMPLETE
3498,-1.0,2026-04-07 11:34:21.544019,2026-04-07 11:34:22.003758,0 days 00:00:00.459739,20.42247415910562,19.73445905211984,0.9364525193890666,Au,COMPLETE
3499,-0.5230125523012464,2026-04-07 11:34:21.562539,2026-04-07 11:34:22.296740,0 days 00:00:00.734201,88.78333030006067,19.025763194097323,0.24973017699459676,Au,PRUNED
3500,-1.0,2026-04-07 11:34:21.617215,2026-04-07 11:34:22.197034,0 days 00:00:00.579819,27.893453928065135,19.90290560313454,0.6738495255426709,Au,COMPLETE
3501,-1.0,2026-04-07 11:34:21.856508,2026-04-07 11:34:22.296740,0 days 00:00:00.440232,22.45619309834531,19.69861958573721,0.7805562950579188,Au,COMPLETE
3502,0.0,2026-04-07 11:34:21.906515,2026-04-07 11:34:22.538495,0 days 00:00:00.631980,34.5951895500658,17.195817699001072,1.0059586693322022,Au,PRUNED
