number,value,datetime_start,datetime_complete,duration,params_D2_nm,params_D3_nm,params_D4_nm,params_metal,state
1569,-1.0,2026-04-07 11:31:02.458076,2026-04-07 11:31:03.142143,0 days 00:00:00.684067,88.52121573167702,0.6324390911329476,0.14082305017852517,Ag,COMPLETE
1570,-1.0,2026-04-07 11:31:02.504273,2026-04-07 11:31:03.067145,0 days 00:00:00.562872,46.715601504735275,3.9877817339775863,0.27202310270551316,Au,COMPLETE
1571,-1.0,2026-04-07 11:31:02.543539,2026-04-07 11:31:03.628440,0 days 00:00:01.084901,62.11007784331757,0.605387163221069,0.42630645421372226,Ag,COMPLETE
1572,-47.297297297271456,2026-04-07 11:31:02.603227,2026-04-07 11:31:03.547743,0 days 00:00:00.944516,68.46493800656675,0.8399053507937112,0.5117545529937509,Ag,COMPLETE
1573,-1.0,2026-04-07 11:31:02.769382,2026-04-07 11:31:03.499130,0 days 00:00:00.729748,52.99599390331811,0.9172074711477556,0.3798105579152129,Ag,COMPLETE
1574,-39.93055555553904,2026-04-07 11:31:03.254109,2026-04-07 11:31:03.880335,0 days 00:00:00.626226,73.9060626781737,3.5922703493033117,0.4717003731438737,Ag,COMPLETE
1575,2.371273712737089,2026-04-07 11:31:03.317880,2026-04-07 11:31:04.656028,0 days 00:00:01.338148,101.59461533297352,13.617003770101073,1.719251507938112,Cu,PRUNED
1576,-1.0,2026-04-07 11:31:03.348987,2026-04-07 11:31:04.173594,0 days 00:00:00.824607,56.34046129815841,0.5265446666135501,0.42556999769736026,Ag,COMPLETE
1577,-42.572463768097364,2026-04-07 11:31:03.365912,2026-04-07 11:31:04.175111,0 days 00:00:00.809199,68.94443120310932,4.864132438833277,0.11908218569957306,Ag,COMPLETE
1578,-42.61363636361706,2026-04-07 11:31:03.532026,2026-04-07 11:31:04.450091,0 days 00:00:00.918065,67.46457909372717,3.3785427301805426,0.41562945635369053,Ag,COMPLETE
1579,-47.29729729727182,2026-04-07 11:31:03.711036,2026-04-07 11:31:04.423378,0 days 00:00:00.712342,62.246454930044585,0.7432887646553689,0.49287953554574,Ag,COMPLETE
1580,-18.41085271317658,2026-04-07 11:31:03.799253,2026-04-07 11:31:04.742883,0 days 00:00:00.943630,38.3127639775191,17.153884504317737,0.11716195012187441,Ag,PRUNED
1581,-1.0,2026-04-07 11:31:03.883337,2026-04-07 11:31:04.778631,0 days 00:00:00.895294,83.04569495453077,1.0808567726742366,0.4396421785247553,Ag,COMPLETE
1582,-41.66666666664815,2026-04-07 11:31:04.205659,2026-04-07 11:31:05.121376,0 days 00:00:00.915717,57.175846737338034,3.2209477704575953,0.11278165584657578,Ag,COMPLETE
1583,-34.090909090896695,2026-04-07 11:31:04.515673,2026-04-07 11:31:05.561298,0 days 00:00:01.045625,80.56499992573868,3.0327577692027248,0.3015614331581704,Ag,PRUNED
1584,-41.666666666648936,2026-04-07 11:31:04.567143,2026-04-07 11:31:05.556461,0 days 00:00:00.989318,72.09677626959466,3.775020173931289,0.44215417080177294,Ag,COMPLETE
1585,-1.0,2026-04-07 11:31:04.682212,2026-04-07 11:31:05.457073,0 days 00:00:00.774861,51.88655309050624,2.4683669411078313,0.10921594664081344,Ag,COMPLETE
1586,-37.037037037020575,2026-04-07 11:31:04.814721,2026-04-07 11:31:05.649456,0 days 00:00:00.834735,77.72249854992529,0.7377215272886563,0.4532277407328485,Ag,PRUNED
1587,-1.0,2026-04-07 11:31:04.806205,2026-04-07 11:31:05.897971,0 days 00:00:01.091766,49.70625555201521,0.8393632302395645,0.28907895895923863,Cu,COMPLETE
1588,-33.33333333332,2026-04-07 11:31:04.885003,2026-04-07 11:31:06.151288,0 days 00:00:01.266285,83.79724376773525,0.5217376400718571,0.4495794459720782,Ag,PRUNED
1589,-31.249999999989583,2026-04-07 11:31:04.947763,2026-04-07 11:31:05.699360,0 days 00:00:00.751597,84.01006015262453,3.5545457660514703,0.12929002322536445,Ag,PRUNED
1590,-1.0,2026-04-07 11:31:05.387195,2026-04-07 11:31:06.118665,0 days 00:00:00.731470,56.27620798837401,0.573828282491844,0.3799708988493285,Ag,COMPLETE
1591,-37.037037037020575,2026-04-07 11:31:05.725059,2026-04-07 11:31:06.660587,0 days 00:00:00.935528,77.6252414185203,0.5350873280806404,0.4343026042757838,Ag,PRUNED
1592,-39.11564625848749,2026-04-07 11:31:05.763922,2026-04-07 11:31:06.680646,0 days 00:00:00.916724,56.929101675986345,3.445405256619603,0.4009641299785049,Ag,COMPLETE
1593,-0.6887052341597681,2026-04-07 11:31:05.809742,2026-04-07 11:31:06.662810,0 days 00:00:00.853068,115.86220645307536,19.03920836839732,0.6847005696882491,Au,PRUNED
1594,-1.0,2026-04-07 11:31:05.862729,2026-04-07 11:31:06.582667,0 days 00:00:00.719938,82.19208591960104,1.121757249724761,0.11038437874621468,Ag,COMPLETE
1595,0.0,2026-04-07 11:31:05.956932,2026-04-07 11:31:06.829339,0 days 00:00:00.872407,21.906637432744738,12.248933358113165,1.6273467956795022,Au,PRUNED
1596,-47.29729729727148,2026-04-07 11:31:06.096595,2026-04-07 11:31:06.894732,0 days 00:00:00.798137,61.629235915378906,0.6354882094840075,0.4758616372097205,Ag,COMPLETE
1597,-1.0,2026-04-07 11:31:06.219553,2026-04-07 11:31:07.117459,0 days 00:00:00.897906,89.6570566296901,0.5247702594506692,0.12662177713429995,Ag,COMPLETE
1598,-13.888888888887346,2026-04-07 11:31:06.447186,2026-04-07 11:31:07.527314,0 days 00:00:01.080128,60.003121977696345,4.99828006719425,0.1068099459140702,Cu,PRUNED
1599,-42.572463768097364,2026-04-07 11:31:06.778885,2026-04-07 11:31:07.662438,0 days 00:00:00.883553,69.98113771662908,4.464289386446599,0.18497349616908343,Ag,COMPLETE
1600,-1.0,2026-04-07 11:31:06.868973,2026-04-07 11:31:07.600269,0 days 00:00:00.731296,72.54647005589138,1.6120249576389711,0.45304646694448525,Ag,COMPLETE
1601,-33.33333333332,2026-04-07 11:31:06.922322,2026-04-07 11:31:07.901581,0 days 00:00:00.979259,52.6700011716642,0.5156031644393775,0.2363606761322209,Ag,PRUNED
1602,-1.0,2026-04-07 11:31:06.898839,2026-04-07 11:31:07.881320,0 days 00:00:00.982481,84.25257744165225,0.5279751571360777,0.3322488624512807,Ag,COMPLETE
1603,-1.0,2026-04-07 11:31:07.047640,2026-04-07 11:31:07.815355,0 days 00:00:00.767715,81.22648851513088,4.8853545259891105,1.067840665880096,Au,COMPLETE
1604,-1.0,2026-04-07 11:31:07.168014,2026-04-07 11:31:07.983547,0 days 00:00:00.815533,81.23184738991789,0.5599342247625558,0.5405320220360925,Au,COMPLETE
1605,-43.60465116277041,2026-04-07 11:31:07.332808,2026-04-07 11:31:08.139164,0 days 00:00:00.806356,67.26380351797519,2.712154974928782,0.4640004723650043,Ag,COMPLETE
1606,-1.0,2026-04-07 11:31:07.637102,2026-04-07 11:31:08.374495,0 days 00:00:00.737393,63.97416796958365,3.5270678512001323,0.4482694218193801,Ag,COMPLETE
1607,-41.66666666664829,2026-04-07 11:31:07.905072,2026-04-07 11:31:08.673533,0 days 00:00:00.768461,74.23983359482436,3.993261590938095,0.22092909589362109,Ag,COMPLETE
1608,-47.29729729727148,2026-04-07 11:31:08.012115,2026-04-07 11:31:08.928834,0 days 00:00:00.916719,61.55929057404743,0.6491053465230354,0.4673970566633586,Ag,COMPLETE
1609,-39.06249999998366,2026-04-07 11:31:08.039328,2026-04-07 11:31:08.804626,0 days 00:00:00.765298,77.99062941315766,3.775988181218401,0.13012853172864777,Ag,COMPLETE
1610,-39.72868217052415,2026-04-07 11:31:08.083763,2026-04-07 11:31:09.105174,0 days 00:00:01.021411,52.163335495418714,0.5272176932137762,0.32735529712469047,Ag,COMPLETE
1611,-1.0,2026-04-07 11:31:08.121671,2026-04-07 11:31:09.031047,0 days 00:00:00.909376,109.64172124206277,9.470021136600577,0.7376818167873603,Cu,COMPLETE
1612,-33.33333333332,2026-04-07 11:31:08.217429,2026-04-07 11:31:09.105174,0 days 00:00:00.887745,84.24540567011748,1.037505700532273,0.11194510867301014,Ag,PRUNED
1613,-34.090909090896695,2026-04-07 11:31:08.297892,2026-04-07 11:31:09.326415,0 days 00:00:01.028523,80.31765413716731,3.9288021852598334,0.12883827244162016,Ag,PRUNED
1614,-1.0,2026-04-07 11:31:08.598435,2026-04-07 11:31:09.324364,0 days 00:00:00.725929,76.39832334576617,4.360409606289975,0.10129882349383651,Ag,COMPLETE
1615,-1.0,2026-04-07 11:31:08.944306,2026-04-07 11:31:09.541936,0 days 00:00:00.597630,20.89780962510672,16.568518373560472,0.13361254779048623,Cu,COMPLETE
1616,-41.666666666647856,2026-04-07 11:31:09.132340,2026-04-07 11:31:10.204151,0 days 00:00:01.071811,58.237336493238146,3.111156048307169,0.10349350307620149,Ag,COMPLETE
1617,-1.0,2026-04-07 11:31:09.184637,2026-04-07 11:31:09.862630,0 days 00:00:00.677993,50.801967205569795,1.0688885786422158,0.15093587004031717,Ag,COMPLETE
1618,0.0,2026-04-07 11:31:09.236393,2026-04-07 11:31:10.275847,0 days 00:00:01.039454,23.723645782296284,14.854901983384881,0.28082093413720044,Au,PRUNED
1619,-47.29729729727148,2026-04-07 11:31:09.279348,2026-04-07 11:31:10.426898,0 days 00:00:01.147550,61.14843750097959,0.5612774308824109,0.546613884606912,Ag,COMPLETE
1620,4.648074369189833,2026-04-07 11:31:09.369180,2026-04-07 11:31:10.350510,0 days 00:00:00.981330,113.60116188936456,10.486227124795725,1.7663686267989558,Ag,PRUNED
1621,-1.0,2026-04-07 11:31:09.425567,2026-04-07 11:31:10.318218,0 days 00:00:00.892651,113.52081446447237,19.183320462297527,0.13884293042484885,Cu,COMPLETE
1622,-46.171171171146376,2026-04-07 11:31:09.776818,2026-04-07 11:31:10.656440,0 days 00:00:00.879622,58.49148193745333,0.5001749261030395,0.389606502982646,Ag,COMPLETE
1623,-1.0,2026-04-07 11:31:09.650534,2026-04-07 11:31:10.694244,0 days 00:00:01.043710,86.27874435426499,0.6076777348508398,0.10531198887550194,Ag,COMPLETE
1624,-1.0,2026-04-07 11:31:10.048441,2026-04-07 11:31:11.191126,0 days 00:00:01.142685,69.4597665224153,1.0814759800136242,0.45683550360239494,Ag,COMPLETE
1625,-1.0,2026-04-07 11:31:10.414257,2026-04-07 11:31:11.220865,0 days 00:00:00.806608,62.08407260491527,3.101080611224946,0.4461825123913198,Ag,COMPLETE
1626,-1.0,2026-04-07 11:31:10.474497,2026-04-07 11:31:11.177533,0 days 00:00:00.703036,87.90229344992522,0.5045605748727302,0.2064044810932888,Ag,COMPLETE
1627,-37.037037037020575,2026-04-07 11:31:10.492647,2026-04-07 11:31:11.440548,0 days 00:00:00.947901,53.779930036656076,0.6687853379397304,0.3325279360928653,Ag,PRUNED
1628,-1.0,2026-04-07 11:31:10.556681,2026-04-07 11:31:11.269839,0 days 00:00:00.713158,61.14023048509624,3.6580523398112637,0.3779388731235582,Ag,COMPLETE
1629,-1.0,2026-04-07 11:31:10.721791,2026-04-07 11:31:11.268319,0 days 00:00:00.546528,83.8504924230043,2.7582571374173908,0.10325668225787318,Ag,COMPLETE
1630,-9.75177304964456,2026-04-07 11:31:10.845017,2026-04-07 11:31:11.974360,0 days 00:00:01.129343,40.456919102622756,2.964454230036755,1.9581104368486626,Cu,PRUNED
1631,-6.147540983606154,2026-04-07 11:31:10.903127,2026-04-07 11:31:12.410704,0 days 00:00:01.507577,27.61208099145137,5.280930506332169,0.7787303198178338,Cu,PRUNED
1632,-1.0,2026-04-07 11:31:11.444650,2026-04-07 11:31:12.411340,0 days 00:00:00.966690,52.43169355886816,0.6050820949859014,0.18689346897658682,Ag,COMPLETE
1633,-1.0,2026-04-07 11:31:11.507239,2026-04-07 11:31:12.896591,0 days 00:00:01.389352,61.03094677154824,3.4299262637789134,0.11841970193381454,Ag,COMPLETE
1634,-2.747252747252687,2026-04-07 11:31:11.517511,2026-04-07 11:31:12.717064,0 days 00:00:01.199553,97.40264693398336,0.6690044865622957,0.1750993918165062,Au,PRUNED
1635,-1.0,2026-04-07 11:31:11.612128,2026-04-07 11:31:12.377539,0 days 00:00:00.765411,72.38278886287176,4.997029490579513,0.436649732709238,Cu,COMPLETE
1636,-1.0,2026-04-07 11:31:11.691373,2026-04-07 11:31:12.522253,0 days 00:00:00.830880,23.367676779928107,16.590533282290142,0.28176648635416635,Ag,COMPLETE
1637,-34.090909090896695,2026-04-07 11:31:11.747179,2026-04-07 11:31:12.601661,0 days 00:00:00.854482,83.84789512697424,2.032095798751433,0.10091089140885462,Ag,PRUNED
1638,-43.560606060586395,2026-04-07 11:31:12.201200,2026-04-07 11:31:13.517312,0 days 00:00:01.316112,72.89117603685497,3.9893591603841476,0.12412172386718293,Ag,COMPLETE
1639,-42.59259259257386,2026-04-07 11:31:12.542413,2026-04-07 11:31:13.425394,0 days 00:00:00.882981,68.28240090778397,3.2980037823484767,0.4566452629756825,Ag,COMPLETE
1640,-0.8992805755395424,2026-04-07 11:31:12.605792,2026-04-07 11:31:13.814393,0 days 00:00:01.208601,21.898216281545782,16.91585891866503,1.3808368274539986,Ag,PRUNED
1641,-40.78014184395421,2026-04-07 11:31:12.720131,2026-04-07 11:31:13.717065,0 days 00:00:00.996934,59.639112403376785,4.026517723297145,0.15111507192004803,Ag,COMPLETE
1642,-1.0,2026-04-07 11:31:12.760435,2026-04-07 11:31:13.340885,0 days 00:00:00.580450,68.90376404937103,5.096574094341967,0.10742700770842478,Ag,COMPLETE
1643,-49.99999999997149,2026-04-07 11:31:12.790766,2026-04-07 11:31:13.598868,0 days 00:00:00.808102,69.31797258878929,0.5284458214180117,0.4260802527361334,Ag,COMPLETE
1644,-33.33333333332,2026-04-07 11:31:12.820113,2026-04-07 11:31:13.864700,0 days 00:00:01.044587,80.93994779084404,0.5204543790496883,0.4491489451500293,Ag,PRUNED
1645,-1.0,2026-04-07 11:31:13.069429,2026-04-07 11:31:13.579278,0 days 00:00:00.509849,79.2804269405859,3.3988507300191593,0.12478273770280669,Ag,COMPLETE
1646,-43.74999999997812,2026-04-07 11:31:13.598868,2026-04-07 11:31:14.455442,0 days 00:00:00.856574,77.67928458562947,0.9842335570148394,0.4085726748698473,Ag,COMPLETE
1647,-1.0,2026-04-07 11:31:13.767445,2026-04-07 11:31:14.524066,0 days 00:00:00.756621,22.82165113396429,16.9863621031064,0.14411880758771461,Ag,COMPLETE
1648,-1.0,2026-04-07 11:31:13.890062,2026-04-07 11:31:14.610062,0 days 00:00:00.720000,21.19321715578401,16.38815760221903,0.16715958789396212,Ag,COMPLETE
1649,3.858024691357739,2026-04-07 11:31:13.893241,2026-04-07 11:31:14.879257,0 days 00:00:00.986016,34.10245722547664,13.284961084325431,1.6874623625138665,Au,PRUNED
1650,-15.070921985814321,2026-04-07 11:31:13.941093,2026-04-07 11:31:15.063674,0 days 00:00:01.122581,81.2134052386082,5.301917045746287,0.27700489744440054,Au,PRUNED
1651,-47.29729729727182,2026-04-07 11:31:13.956531,2026-04-07 11:31:14.748613,0 days 00:00:00.792082,74.3033576287662,0.6042182188277888,0.4072896021009545,Ag,COMPLETE
1652,-0.5186721991701159,2026-04-07 11:31:13.995545,2026-04-07 11:31:14.771516,0 days 00:00:00.775971,93.2395170243987,12.705157685372106,0.8321697056468826,Au,PRUNED
1653,-1.0,2026-04-07 11:31:13.973903,2026-04-07 11:31:14.719132,0 days 00:00:00.745229,48.65742984793378,0.685746624024999,0.12418371057870736,Ag,COMPLETE
1654,-33.33333333332,2026-04-07 11:31:14.796312,2026-04-07 11:31:15.701784,0 days 00:00:00.905472,84.44408472824169,0.6632324648732854,0.3249341050905184,Ag,PRUNED
1655,-1.0,2026-04-07 11:31:14.830757,2026-04-07 11:31:15.633752,0 days 00:00:00.802995,51.16194914237116,1.749545500946832,0.11556597163148148,Ag,COMPLETE
1656,-37.037037037020575,2026-04-07 11:31:14.879257,2026-04-07 11:31:15.855927,0 days 00:00:00.976670,55.94476716219008,0.6452122732482555,0.4240194377105885,Ag,PRUNED
1657,-1.0,2026-04-07 11:31:14.951701,2026-04-07 11:31:15.669434,0 days 00:00:00.717733,77.39086934988624,0.5115663758760645,0.4373976310419354,Ag,COMPLETE
1658,-41.66666666664881,2026-04-07 11:31:14.983797,2026-04-07 11:31:15.635353,0 days 00:00:00.651556,67.01169482493982,3.919290434120476,0.37917413797093535,Ag,COMPLETE
1659,-1.0,2026-04-07 11:31:15.020959,2026-04-07 11:31:16.115235,0 days 00:00:01.094276,101.88959596210806,14.08200293912525,1.5662048366112926,Au,COMPLETE
1660,-33.33333333332,2026-04-07 11:31:15.163752,2026-04-07 11:31:16.401142,0 days 00:00:01.237390,48.86469898721805,0.5371354078258914,0.1282210906022978,Ag,PRUNED
1661,-1.0,2026-04-07 11:31:15.169924,2026-04-07 11:31:16.316990,0 days 00:00:01.147066,68.3277778388932,0.9373750102244434,0.4777371774183321,Ag,COMPLETE
1662,-41.66666666664881,2026-04-07 11:31:15.770773,2026-04-07 11:31:16.504562,0 days 00:00:00.733789,70.0004286531337,4.702115786080929,0.11307849587975219,Ag,COMPLETE
1663,-42.63565891470892,2026-04-07 11:31:15.829901,2026-04-07 11:31:17.040842,0 days 00:00:01.210941,58.68013156223207,2.9364426944953355,0.10432282914246281,Ag,COMPLETE
1664,-37.037037037020575,2026-04-07 11:31:15.910421,2026-04-07 11:31:16.792478,0 days 00:00:00.882057,54.59180886563328,1.0817798513384296,0.40261664558194243,Ag,PRUNED
1665,-38.88888888887141,2026-04-07 11:31:15.887114,2026-04-07 11:31:17.091989,0 days 00:00:01.204875,83.53154306281397,0.6002645304465507,0.2693020047385231,Ag,COMPLETE
1666,-37.037037037020575,2026-04-07 11:31:15.967684,2026-04-07 11:31:16.704294,0 days 00:00:00.736610,77.5913265941285,0.6661825023681565,0.5317412489085085,Ag,PRUNED
1667,-1.0,2026-04-07 11:31:16.343066,2026-04-07 11:31:17.307139,0 days 00:00:00.964073,90.20089126346966,16.81475842587881,0.9833932922713142,Ag,COMPLETE
1668,-45.94017094014738,2026-04-07 11:31:16.552551,2026-04-07 11:31:17.501152,0 days 00:00:00.948601,75.97731920074904,1.1345946704163383,0.3972881383210035,Ag,COMPLETE
1669,-47.29729729727182,2026-04-07 11:31:16.543237,2026-04-07 11:31:17.649713,0 days 00:00:01.106476,73.41568725865187,0.5922789152676339,0.4496993233132587,Ag,COMPLETE
1670,-1.0,2026-04-07 11:31:16.704294,2026-04-07 11:31:17.683817,0 days 00:00:00.979523,79.6710891839392,3.3260572183966577,0.35628649119335853,Ag,COMPLETE
1671,-1.0113268608414043,2026-04-07 11:31:16.830686,2026-04-07 11:31:17.788435,0 days 00:00:00.957749,61.17846891242082,19.854704160870945,1.0269925194454017,Au,PRUNED
1672,-40.69767441858579,2026-04-07 11:31:16.919220,2026-04-07 11:31:17.682310,0 days 00:00:00.763090,52.21382677604099,0.8316064029947445,0.13563944063337835,Ag,COMPLETE
1673,-1.0,2026-04-07 11:31:17.335643,2026-04-07 11:31:17.969929,0 days 00:00:00.634286,37.66690911137941,0.5641988723077223,1.4181786278704152,Au,COMPLETE
1674,-37.037037037020575,2026-04-07 11:31:17.559915,2026-04-07 11:31:18.354391,0 days 00:00:00.794476,56.00978055542197,0.7504978152522974,0.4507892647528903,Ag,PRUNED
1675,-1.0,2026-04-07 11:31:17.616262,2026-04-07 11:31:18.472340,0 days 00:00:00.856078,111.44829686765333,11.636135393020002,1.1953220807912988,Au,COMPLETE
1676,-1.0,2026-04-07 11:31:17.806703,2026-04-07 11:31:18.619957,0 days 00:00:00.813254,60.84943912184644,0.6722039490542633,0.5148112156509644,Ag,COMPLETE
1677,-1.0,2026-04-07 11:31:17.890892,2026-04-07 11:31:18.685591,0 days 00:00:00.794699,69.8170924070577,4.211429119927961,0.11671302767102171,Ag,COMPLETE
1678,-1.0,2026-04-07 11:31:17.867737,2026-04-07 11:31:18.635312,0 days 00:00:00.767575,75.68619764486606,4.053582225268631,0.5470928042273683,Au,COMPLETE
1679,-1.0,2026-04-07 11:31:17.993137,2026-04-07 11:31:18.586728,0 days 00:00:00.593591,65.16993182763643,3.84684562067999,0.11360592346966071,Ag,COMPLETE
1680,-1.0,2026-04-07 11:31:17.971928,2026-04-07 11:31:18.619957,0 days 00:00:00.648029,53.46274273589252,0.9332561537679065,0.10524883872935183,Ag,COMPLETE
1681,-1.0,2026-04-07 11:31:18.213698,2026-04-07 11:31:18.656369,0 days 00:00:00.442671,61.684823435620814,3.4538372361079297,0.3809884568069455,Ag,COMPLETE
1682,-1.0,2026-04-07 11:31:18.475852,2026-04-07 11:31:19.231282,0 days 00:00:00.755430,72.01525419917117,3.9840594519438124,0.12845379045376365,Ag,COMPLETE
1683,-37.037037037020575,2026-04-07 11:31:18.708499,2026-04-07 11:31:19.397854,0 days 00:00:00.689355,80.51184101151655,0.637320840658455,0.3546648968363798,Ag,PRUNED
1684,-37.037037037020575,2026-04-07 11:31:18.733479,2026-04-07 11:31:19.482157,0 days 00:00:00.748678,80.83814668521413,1.0719746210895218,0.12144351804802417,Ag,PRUNED
1685,-1.0,2026-04-07 11:31:18.922346,2026-04-07 11:31:19.728704,0 days 00:00:00.806358,71.49515286515813,3.8299202491594975,0.34454405771938035,Ag,COMPLETE
1686,-1.0,2026-04-07 11:31:18.935438,2026-04-07 11:31:19.773219,0 days 00:00:00.837781,106.91583033581148,9.121051105857987,0.44893773717142504,Ag,COMPLETE
1687,-1.0,2026-04-07 11:31:18.985427,2026-04-07 11:31:19.773219,0 days 00:00:00.787792,47.548753518067926,2.5793507603675123,0.12258531182537344,Au,COMPLETE
1688,-1.0,2026-04-07 11:31:19.029199,2026-04-07 11:31:19.873642,0 days 00:00:00.844443,57.811062048041975,1.1360547041040077,0.419594605377903,Ag,COMPLETE
1689,-41.666666666648275,2026-04-07 11:31:19.128750,2026-04-07 11:31:20.181533,0 days 00:00:01.052783,58.50902334543071,3.4100484131883015,0.14180104795705475,Ag,COMPLETE
1690,-1.0,2026-04-07 11:31:19.476545,2026-04-07 11:31:20.474823,0 days 00:00:00.998278,68.15050117724664,3.404871169951221,0.34640079404884727,Ag,COMPLETE
1691,-1.1904761904761563,2026-04-07 11:31:19.556738,2026-04-07 11:31:20.384332,0 days 00:00:00.827594,24.031666459784383,13.617258361535685,0.42979836988433284,Ag,PRUNED
1692,-1.0,2026-04-07 11:31:19.633221,2026-04-07 11:31:20.289867,0 days 00:00:00.656646,76.57412377604692,3.87520930967619,0.3078747964620152,Ag,COMPLETE
1693,-0.6775067750677396,2026-04-07 11:31:19.968002,2026-04-07 11:31:20.981572,0 days 00:00:01.013570,83.1280295899818,16.872249632184413,0.35715950029145005,Cu,PRUNED
1694,-1.0,2026-04-07 11:31:20.036814,2026-04-07 11:31:20.790373,0 days 00:00:00.753559,70.13970853668225,4.127665297588016,0.25264885866316994,Ag,COMPLETE
1695,-37.037037037020575,2026-04-07 11:31:20.028793,2026-04-07 11:31:21.131293,0 days 00:00:01.102500,76.94786873455371,0.7754725666292193,0.4244008404433259,Ag,PRUNED
1696,-34.090909090896695,2026-04-07 11:31:20.235967,2026-04-07 11:31:21.446230,0 days 00:00:01.210263,86.0566371908291,1.2703874962176622,0.10312475603941552,Ag,PRUNED
1697,-34.090909090896695,2026-04-07 11:31:20.414775,2026-04-07 11:31:21.447227,0 days 00:00:01.032452,82.02094888799081,3.0366837884585633,0.14104994135516058,Ag,PRUNED
1698,-8.54700854700767,2026-04-07 11:31:20.475637,2026-04-07 11:31:21.349310,0 days 00:00:00.873673,39.90606147706504,19.26324721771211,0.11892906392911605,Ag,PRUNED
1699,-41.666666666648545,2026-04-07 11:31:20.540205,2026-04-07 11:31:21.665821,0 days 00:00:01.125616,64.66767545101527,3.5692526530044812,0.4323974293226345,Ag,COMPLETE
1700,-1.0,2026-04-07 11:31:20.707505,2026-04-07 11:31:21.567762,0 days 00:00:00.860257,56.927758811767546,3.8672413975145217,0.16081742170069827,Ag,COMPLETE
1701,-1.0,2026-04-07 11:31:21.064713,2026-04-07 11:31:21.897030,0 days 00:00:00.832317,68.03172922471765,3.925526854273058,0.3697043624776962,Ag,COMPLETE
1702,-1.0,2026-04-07 11:31:21.178167,2026-04-07 11:31:21.765790,0 days 00:00:00.587623,65.37609061612818,0.5624112655806145,0.47355855340393654,Ag,COMPLETE
1703,-9.114583333332195,2026-04-07 11:31:21.284863,2026-04-07 11:31:22.009593,0 days 00:00:00.724730,24.750460079825615,16.365241301417015,1.341443879641525,Au,PRUNED
