number,value,datetime_start,datetime_complete,duration,params_D2_nm,params_D3_nm,params_D4_nm,params_metal,state
6012,-1.0,2026-04-07 11:39:03.929776,2026-04-07 11:39:04.710314,0 days 00:00:00.780538,35.42558809507279,17.657989491379137,0.3197609804541916,Au,COMPLETE
6013,0.0,2026-04-07 11:39:04.052480,2026-04-07 11:39:04.910099,0 days 00:00:00.857619,32.006150258278325,19.83885590247964,0.41308156219170994,Au,PRUNED
6014,-1.0,2026-04-07 11:39:04.075812,2026-04-07 11:39:04.958781,0 days 00:00:00.882969,20.57874624383932,19.962065693430276,1.134196551459561,Au,COMPLETE
6015,-380.63063063057916,2026-04-07 11:39:04.167870,2026-04-07 11:39:05.535212,0 days 00:00:01.367342,20.6236830222541,19.926369064210206,0.33641969851727677,Au,COMPLETE
6016,-1.0,2026-04-07 11:39:04.263334,2026-04-07 11:39:04.913122,0 days 00:00:00.649788,45.96705154833566,19.97131499680073,0.9403428009043943,Au,COMPLETE
6017,0.0,2026-04-07 11:39:04.597190,2026-04-07 11:39:05.196685,0 days 00:00:00.599495,21.06461749042574,17.69288138514994,0.9571269499625098,Au,PRUNED
6018,0.0,2026-04-07 11:39:04.827594,2026-04-07 11:39:05.787343,0 days 00:00:00.959749,30.750074494609315,19.94703887193836,1.0727207627778936,Au,PRUNED
6019,-1.0,2026-04-07 11:39:04.998243,2026-04-07 11:39:05.784727,0 days 00:00:00.786484,20.422508695644677,17.965205964537557,0.6876640419686678,Au,COMPLETE
6020,0.0,2026-04-07 11:39:05.033984,2026-04-07 11:39:05.941112,0 days 00:00:00.907128,20.011243059606386,18.270589620076443,0.9987247625471711,Au,PRUNED
6021,-1.0,2026-04-07 11:39:05.053394,2026-04-07 11:39:05.783720,0 days 00:00:00.730326,20.283881453674283,17.02073162218109,0.767058708666503,Au,COMPLETE
6022,-1.0,2026-04-07 11:39:05.203735,2026-04-07 11:39:05.992164,0 days 00:00:00.788429,30.048840120928876,11.416664766571746,0.8760213526658736,Au,COMPLETE
6023,25.726010101009713,2026-04-07 11:39:05.243840,2026-04-07 11:39:06.690457,0 days 00:00:01.446617,52.59712916960643,19.34736891206895,1.135061811273106,Ag,PRUNED
6024,-1.0,2026-04-07 11:39:05.328271,2026-04-07 11:39:06.136818,0 days 00:00:00.808547,21.001241244766277,17.979244913909543,0.5674456783079431,Au,COMPLETE
6025,-1.0,2026-04-07 11:39:05.873010,2026-04-07 11:39:06.551207,0 days 00:00:00.678197,46.423448619711124,17.76691640805127,0.8759308120431905,Au,COMPLETE
6026,-1.0,2026-04-07 11:39:05.913099,2026-04-07 11:39:06.791927,0 days 00:00:00.878828,20.0821550930448,17.77189974314349,0.757816969501993,Au,COMPLETE
6027,-1.0,2026-04-07 11:39:05.984674,2026-04-07 11:39:06.877104,0 days 00:00:00.892430,20.14648710262991,17.00060453898332,0.951021877870597,Au,COMPLETE
6028,-8.333333333332,2026-04-07 11:39:06.020627,2026-04-07 11:39:06.930306,0 days 00:00:00.909679,22.035625449101513,19.937298836329525,0.5538627919340702,Au,PRUNED
6029,-1.0,2026-04-07 11:39:06.148130,2026-04-07 11:39:06.815979,0 days 00:00:00.667849,20.333752357937517,17.718634955740587,0.8631461299666817,Au,COMPLETE
6030,80.88235294117409,2026-04-07 11:39:06.287486,2026-04-07 11:39:07.278705,0 days 00:00:00.991219,30.171768785049267,17.335680276853907,0.4652696712680144,Au,PRUNED
6031,0.0,2026-04-07 11:39:06.521324,2026-04-07 11:39:07.593616,0 days 00:00:01.072292,20.623800364076388,17.035559089420776,1.0109462273546082,Au,PRUNED
6032,0.0,2026-04-07 11:39:06.788928,2026-04-07 11:39:08.015491,0 days 00:00:01.226563,21.11668351922308,14.89373039333557,0.3725277494771253,Cu,PRUNED
6033,-8.680555555554832,2026-04-07 11:39:06.825251,2026-04-07 11:39:07.790424,0 days 00:00:00.965173,36.35103380652797,3.020095966877289,1.0641376094449144,Cu,PRUNED
6034,0.0,2026-04-07 11:39:07.031319,2026-04-07 11:39:07.889019,0 days 00:00:00.857700,32.9031344216811,19.879760455266425,0.4817682154437333,Au,PRUNED
6035,-1.0,2026-04-07 11:39:07.111084,2026-04-07 11:39:07.858800,0 days 00:00:00.747716,36.4724868403907,19.93490661991662,1.0160166461103421,Au,COMPLETE
6036,-1.0,2026-04-07 11:39:07.153597,2026-04-07 11:39:07.920226,0 days 00:00:00.766629,31.253752440146396,17.410245589767246,1.174748152755533,Au,COMPLETE
6037,0.0,2026-04-07 11:39:07.366875,2026-04-07 11:39:08.420843,0 days 00:00:01.053968,43.94561339758987,17.50741920828681,0.666268625476832,Au,PRUNED
6038,80.55555555555317,2026-04-07 11:39:07.399784,2026-04-07 11:39:08.722354,0 days 00:00:01.322570,30.300612756250068,17.51492988271451,0.9309637069567259,Au,PRUNED
6039,-1.0,2026-04-07 11:39:07.837300,2026-04-07 11:39:08.718342,0 days 00:00:00.881042,20.065381654178523,17.512858566818654,0.7101088903383586,Au,COMPLETE
6040,-1.0,2026-04-07 11:39:07.863012,2026-04-07 11:39:08.532116,0 days 00:00:00.669104,20.001474680476438,17.30294258056955,0.37212460256227337,Ag,COMPLETE
6041,79.3504901960761,2026-04-07 11:39:07.970283,2026-04-07 11:39:08.978609,0 days 00:00:01.008326,33.84457734791126,15.307215146701168,1.0433041233600515,Au,PRUNED
6042,0.0,2026-04-07 11:39:08.146168,2026-04-07 11:39:09.153452,0 days 00:00:01.007284,20.518589733060008,18.329234387685243,0.42523510812078036,Au,PRUNED
6043,-1.0,2026-04-07 11:39:08.205036,2026-04-07 11:39:09.047005,0 days 00:00:00.841969,36.87724255577762,19.92414763744231,0.2800608852061294,Au,COMPLETE
6044,-1.0,2026-04-07 11:39:08.308684,2026-04-07 11:39:09.134709,0 days 00:00:00.826025,31.626967333690335,17.981015295302537,0.8872303315674518,Au,COMPLETE
6045,-1.0,2026-04-07 11:39:08.535115,2026-04-07 11:39:09.265582,0 days 00:00:00.730467,22.225068125154582,19.924946389656135,0.5617018838454994,Au,COMPLETE
6046,0.0,2026-04-07 11:39:08.797034,2026-04-07 11:39:09.838124,0 days 00:00:01.041090,20.569774823613404,18.263710947395186,0.3272793280514379,Au,PRUNED
6047,79.3795620437933,2026-04-07 11:39:08.834565,2026-04-07 11:39:09.739517,0 days 00:00:00.904952,29.891834446474483,19.816127772473834,0.7517732028180665,Cu,PRUNED
6048,-1.0,2026-04-07 11:39:08.978609,2026-04-07 11:39:09.955127,0 days 00:00:00.976518,45.93943485689668,19.939185984063105,0.7319983532307002,Au,COMPLETE
6049,-1.0,2026-04-07 11:39:09.157458,2026-04-07 11:39:10.188750,0 days 00:00:01.031292,21.02828425580851,19.952786657955773,0.7160901816296575,Au,COMPLETE
6050,0.0,2026-04-07 11:39:09.295159,2026-04-07 11:39:10.312573,0 days 00:00:01.017414,20.119357567322076,19.659900323902548,0.44803992131594184,Au,PRUNED
6051,-1.0,2026-04-07 11:39:09.345920,2026-04-07 11:39:10.107279,0 days 00:00:00.761359,45.545462242777546,17.6815188143296,0.6682883021522328,Au,COMPLETE
6052,-1.0,2026-04-07 11:39:09.389561,2026-04-07 11:39:10.568745,0 days 00:00:01.179184,20.313382052794154,19.629437315571106,1.1462792413087777,Au,COMPLETE
6053,-0.83668005354751,2026-04-07 11:39:09.471335,2026-04-07 11:39:10.522884,0 days 00:00:01.051549,96.16197620450357,11.388421285813841,1.0762644839409203,Cu,PRUNED
6054,-1.0,2026-04-07 11:39:09.843343,2026-04-07 11:39:10.797464,0 days 00:00:00.954121,20.105234965913773,19.210541475337692,0.9868440171379276,Ag,COMPLETE
6055,-0.8928571428571173,2026-04-07 11:39:10.058369,2026-04-07 11:39:11.013262,0 days 00:00:00.954893,20.079386789109257,17.36416531598757,1.0578183022809984,Ag,PRUNED
6056,-1.0,2026-04-07 11:39:10.247440,2026-04-07 11:39:11.094537,0 days 00:00:00.847097,27.096873251390484,19.97832679719259,0.6323787941267993,Au,COMPLETE
6057,-1.0,2026-04-07 11:39:10.370609,2026-04-07 11:39:11.416466,0 days 00:00:01.045857,20.067502552338233,19.590378584004384,0.5404962433996252,Cu,COMPLETE
6058,-1.0,2026-04-07 11:39:10.400929,2026-04-07 11:39:11.432495,0 days 00:00:01.031566,34.72858148068422,17.365064990057093,0.7375973378173817,Au,COMPLETE
6059,-1.0,2026-04-07 11:39:10.464369,2026-04-07 11:39:11.213666,0 days 00:00:00.749297,34.46696966448071,17.60247609694423,0.8298077034086371,Au,COMPLETE
6060,-1.0,2026-04-07 11:39:10.805674,2026-04-07 11:39:11.498378,0 days 00:00:00.692704,20.494430046683803,19.805614278034184,1.1358044216366125,Au,COMPLETE
6061,0.0,2026-04-07 11:39:10.872688,2026-04-07 11:39:11.826370,0 days 00:00:00.953682,41.79070815896805,15.263186759540472,0.5168685066343359,Au,PRUNED
6062,0.0,2026-04-07 11:39:10.982347,2026-04-07 11:39:11.883496,0 days 00:00:00.901149,38.941427421358284,19.920411851345285,0.7223948504888609,Au,PRUNED
6063,0.0,2026-04-07 11:39:11.121857,2026-04-07 11:39:12.202730,0 days 00:00:01.080873,20.07652814773394,17.411546098645125,0.6637680828792452,Au,PRUNED
6064,-1.0,2026-04-07 11:39:11.395910,2026-04-07 11:39:12.183589,0 days 00:00:00.787679,40.190900136730676,19.984514964002003,0.5328764539218024,Au,COMPLETE
6065,-1.0,2026-04-07 11:39:11.468441,2026-04-07 11:39:12.478799,0 days 00:00:01.010358,42.87826950771236,18.253504554677562,0.4506737718656629,Au,COMPLETE
6066,0.0,2026-04-07 11:39:11.673221,2026-04-07 11:39:12.419680,0 days 00:00:00.746459,31.94569646285047,19.950086220662268,0.5463576168063584,Au,PRUNED
6067,-1.0,2026-04-07 11:39:11.704641,2026-04-07 11:39:12.452689,0 days 00:00:00.748048,32.93110061987758,17.973719566053816,0.48039637308063826,Au,COMPLETE
6068,0.0,2026-04-07 11:39:11.886811,2026-04-07 11:39:12.823107,0 days 00:00:00.936296,29.236573243044596,19.912767315911708,0.522852886357423,Au,PRUNED
6069,-1.0,2026-04-07 11:39:11.924000,2026-04-07 11:39:12.693907,0 days 00:00:00.769907,30.746166262043502,19.795171638665135,0.817232071562839,Au,COMPLETE
6070,-1.0,2026-04-07 11:39:11.963703,2026-04-07 11:39:12.793106,0 days 00:00:00.829403,30.92193783880496,17.497825564013397,0.5082470569270893,Au,COMPLETE
6071,-1.0,2026-04-07 11:39:12.366818,2026-04-07 11:39:13.165189,0 days 00:00:00.798371,20.157189143960352,19.952733214670822,0.44157946961676864,Au,COMPLETE
6072,-16.30434782608554,2026-04-07 11:39:12.418171,2026-04-07 11:39:13.679289,0 days 00:00:01.261118,71.39364193959727,5.3572400314897,0.8405583283024369,Au,PRUNED
6073,0.0,2026-04-07 11:39:12.559890,2026-04-07 11:39:13.654865,0 days 00:00:01.094975,30.531257298861803,17.865402266272532,0.9195592511355953,Au,PRUNED
6074,-1.0,2026-04-07 11:39:12.732513,2026-04-07 11:39:13.652462,0 days 00:00:00.919949,32.18531547444707,19.880717517242243,0.7633537933580634,Au,COMPLETE
6075,0.0,2026-04-07 11:39:12.913388,2026-04-07 11:39:13.812448,0 days 00:00:00.899060,41.580720786631744,19.961547476506304,0.45693109410961513,Au,PRUNED
6076,-1.0,2026-04-07 11:39:13.001479,2026-04-07 11:39:13.809449,0 days 00:00:00.807970,30.601436929560403,17.385182351674644,0.11104678934815204,Au,COMPLETE
6077,80.55555555555317,2026-04-07 11:39:13.028414,2026-04-07 11:39:13.867857,0 days 00:00:00.839443,31.475775655236575,16.931800665038296,0.6480071488107128,Au,PRUNED
6078,80.26960784313488,2026-04-07 11:39:13.162678,2026-04-07 11:39:13.975236,0 days 00:00:00.812558,33.247210425077185,15.225105335127738,0.7075886486381684,Au,PRUNED
6079,-1.0,2026-04-07 11:39:13.319781,2026-04-07 11:39:13.911132,0 days 00:00:00.591351,29.41635133537025,19.97812506200681,0.8570449495222062,Au,COMPLETE
6080,0.0,2026-04-07 11:39:13.832772,2026-04-07 11:39:14.912438,0 days 00:00:01.079666,20.285175461338213,16.687967399129732,0.17144880480036628,Au,PRUNED
6081,-423.50746268650437,2026-04-07 11:39:13.995532,2026-04-07 11:39:15.231972,0 days 00:00:01.236440,20.81556227473017,19.89029670861517,0.7196490036158626,Au,COMPLETE
6082,-1.0,2026-04-07 11:39:14.027246,2026-04-07 11:39:14.838983,0 days 00:00:00.811737,29.473894386851317,19.935986956052695,0.32129165942053534,Au,COMPLETE
6083,-1.0,2026-04-07 11:39:14.121872,2026-04-07 11:39:14.945490,0 days 00:00:00.823618,28.759660264970833,17.478916719769604,0.9346512696703789,Au,COMPLETE
6084,-413.9294403892341,2026-04-07 11:39:14.151536,2026-04-07 11:39:15.286078,0 days 00:00:01.134542,20.69050045022486,19.87302658491144,0.7432748880124317,Au,COMPLETE
6085,1.1904761904760544,2026-04-07 11:39:14.227836,2026-04-07 11:39:15.145339,0 days 00:00:00.917503,30.716689193959866,14.791274304688006,0.8624949743933837,Au,PRUNED
6086,0.0,2026-04-07 11:39:14.321185,2026-04-07 11:39:15.141893,0 days 00:00:00.820708,47.4743543134512,19.938606932744086,0.5515544656938555,Au,PRUNED
6087,0.0,2026-04-07 11:39:14.458072,2026-04-07 11:39:15.606471,0 days 00:00:01.148399,20.732459803812326,17.919388188206977,0.5398614443464799,Au,PRUNED
6088,-1.0,2026-04-07 11:39:15.044045,2026-04-07 11:39:16.286800,0 days 00:00:01.242755,32.56118695550495,17.789954311093645,0.839250553574234,Au,COMPLETE
6089,-1.0,2026-04-07 11:39:15.145339,2026-04-07 11:39:16.286800,0 days 00:00:01.141461,20.231777877647065,19.67613804217951,0.6597089083805981,Au,COMPLETE
6090,-1.0,2026-04-07 11:39:15.255126,2026-04-07 11:39:16.169331,0 days 00:00:00.914205,45.15277506510647,19.95127953135804,0.6966619965332871,Ag,COMPLETE
6091,-1.0,2026-04-07 11:39:15.291919,2026-04-07 11:39:16.195503,0 days 00:00:00.903584,20.090185241610882,19.900264837814774,0.6603625046901591,Au,COMPLETE
6092,-375.2777777777274,2026-04-07 11:39:15.435817,2026-04-07 11:39:16.427928,0 days 00:00:00.992111,20.605559221222183,19.877674054791353,0.3441861441845992,Au,COMPLETE
6093,80.55555555555317,2026-04-07 11:39:15.507094,2026-04-07 11:39:16.477039,0 days 00:00:00.969945,30.909262800314206,17.584321632047534,0.4311114085381181,Au,PRUNED
6094,-1.0,2026-04-07 11:39:15.559932,2026-04-07 11:39:16.219351,0 days 00:00:00.659419,32.95010105177238,17.73323406075216,0.5092650020398364,Au,COMPLETE
6095,-1.0,2026-04-07 11:39:15.781966,2026-04-07 11:39:16.348488,0 days 00:00:00.566522,33.089762693538965,17.182377285706174,0.4456863593679466,Au,COMPLETE
6096,4.006410256409948,2026-04-07 11:39:16.380309,2026-04-07 11:39:17.538638,0 days 00:00:01.158329,32.52485579708907,14.458424164513948,1.1464742633813922,Au,PRUNED
6097,-1.0,2026-04-07 11:39:16.448086,2026-04-07 11:39:17.336816,0 days 00:00:00.888730,35.47953784491115,19.939468347329875,1.0368187357360275,Au,COMPLETE
6098,-1.0,2026-04-07 11:39:16.495787,2026-04-07 11:39:17.385309,0 days 00:00:00.889522,43.18345339844933,14.703091531930209,0.2520615834543343,Au,COMPLETE
6099,-1.0,2026-04-07 11:39:16.526369,2026-04-07 11:39:17.349773,0 days 00:00:00.823404,30.29107669164324,19.808500003748126,1.1170894633561554,Au,COMPLETE
6100,0.0,2026-04-07 11:39:16.556613,2026-04-07 11:39:17.614924,0 days 00:00:01.058311,31.359428302335722,19.889514684583197,1.0896980429850336,Au,PRUNED
6101,0.0,2026-04-07 11:39:16.572737,2026-04-07 11:39:17.870558,0 days 00:00:01.297821,20.309460559770248,19.659777023112483,0.3444546186255791,Au,PRUNED
6102,-1.0,2026-04-07 11:39:16.667024,2026-04-07 11:39:17.386322,0 days 00:00:00.719298,31.261830219500936,17.749615847808816,0.4752958868674894,Au,COMPLETE
6103,0.0,2026-04-07 11:39:16.740985,2026-04-07 11:39:17.478219,0 days 00:00:00.737234,32.96781277123148,18.172274917570302,0.8059137467050881,Au,PRUNED
6104,-1.0,2026-04-07 11:39:17.533582,2026-04-07 11:39:18.690910,0 days 00:00:01.157328,20.32988024160445,17.900604611107646,0.5030379318226117,Au,COMPLETE
6105,-1.0,2026-04-07 11:39:17.588511,2026-04-07 11:39:18.442039,0 days 00:00:00.853528,20.03011812087895,15.981461914404584,0.4604874659991055,Au,COMPLETE
6106,-1.0,2026-04-07 11:39:17.652092,2026-04-07 11:39:18.585009,0 days 00:00:00.932917,20.03743403245825,17.91052480122162,0.5680002477592265,Au,COMPLETE
6107,-1.0,2026-04-07 11:39:17.699019,2026-04-07 11:39:18.557224,0 days 00:00:00.858205,34.75004254899265,19.97005954244484,1.1971895750141879,Au,COMPLETE
6108,0.0,2026-04-07 11:39:17.712831,2026-04-07 11:39:18.787816,0 days 00:00:01.074985,48.00860899381557,19.975895095633007,0.7462713925514951,Au,PRUNED
6109,-1.0,2026-04-07 11:39:17.939411,2026-04-07 11:39:18.720752,0 days 00:00:00.781341,29.428549464949956,19.785462088802138,1.0023522038222148,Au,COMPLETE
6110,0.0,2026-04-07 11:39:17.958630,2026-04-07 11:39:18.864659,0 days 00:00:00.906029,31.333581043746495,19.82388811289604,0.9382035409999923,Au,PRUNED
6111,-1.0,2026-04-07 11:39:17.979191,2026-04-07 11:39:18.722143,0 days 00:00:00.742952,22.538545917312288,19.935901563969498,0.516509476610814,Au,COMPLETE
6112,-1.0,2026-04-07 11:39:18.617673,2026-04-07 11:39:19.456492,0 days 00:00:00.838819,30.013483296598856,19.901307687677804,0.7102886537980869,Au,COMPLETE
6113,0.0,2026-04-07 11:39:18.803180,2026-04-07 11:39:20.261428,0 days 00:00:01.458248,20.121827717340395,14.137146955503496,0.9523520437790818,Au,PRUNED
6114,-434.47837150120574,2026-04-07 11:39:18.833466,2026-04-07 11:39:20.155617,0 days 00:00:01.322151,20.93574364518722,19.74447595329598,1.0899623592866279,Au,COMPLETE
6115,-1.0,2026-04-07 11:39:18.869170,2026-04-07 11:39:19.986986,0 days 00:00:01.117816,20.12392029235948,19.494190502953867,0.8006965209701854,Au,COMPLETE
6116,0.0,2026-04-07 11:39:18.913054,2026-04-07 11:39:20.271127,0 days 00:00:01.358073,20.348060142773708,15.995853201900205,0.9875428877569368,Au,PRUNED
6117,-1.0,2026-04-07 11:39:18.973439,2026-04-07 11:39:20.110277,0 days 00:00:01.136838,20.421538484499504,19.819048283920065,1.1074032074096865,Au,COMPLETE
6118,-1.0,2026-04-07 11:39:19.061594,2026-04-07 11:39:20.126575,0 days 00:00:01.064981,21.007681925611934,17.667497300002527,0.9134474042768573,Au,COMPLETE
6119,0.0,2026-04-07 11:39:19.164164,2026-04-07 11:39:20.270118,0 days 00:00:01.105954,35.68274154620222,19.796941232095154,0.38324733157882107,Cu,PRUNED
6120,-1.0,2026-04-07 11:39:19.840398,2026-04-07 11:39:20.814042,0 days 00:00:00.973644,20.73314797706532,19.933829821629995,0.8168011072780759,Au,COMPLETE
6121,0.0,2026-04-07 11:39:20.329807,2026-04-07 11:39:21.453037,0 days 00:00:01.123230,21.61891652126216,17.65304675935578,0.4259509313636434,Cu,PRUNED
6122,0.0,2026-04-07 11:39:20.381127,2026-04-07 11:39:21.514993,0 days 00:00:01.133866,32.593351651867096,17.759655499742088,0.6825998231349533,Au,PRUNED
6123,-1.0,2026-04-07 11:39:20.427289,2026-04-07 11:39:21.455038,0 days 00:00:01.027749,30.691879507601687,19.798207287435858,0.19828927626911014,Au,COMPLETE
6124,-1.0,2026-04-07 11:39:20.443338,2026-04-07 11:39:21.294100,0 days 00:00:00.850762,33.78589624270391,17.4628394485559,0.24739822906167624,Au,COMPLETE
6125,-1.0,2026-04-07 11:39:20.457691,2026-04-07 11:39:21.278784,0 days 00:00:00.821093,23.605315154600536,13.731302693968399,1.0030851272918209,Ag,COMPLETE
6126,0.0,2026-04-07 11:39:20.474122,2026-04-07 11:39:21.411369,0 days 00:00:00.937247,20.641294744808338,17.150537787484502,0.33582883251819173,Au,PRUNED
6127,-1.0,2026-04-07 11:39:20.488533,2026-04-07 11:39:21.361945,0 days 00:00:00.873412,36.28234800595448,19.967700179198367,0.7310190717545261,Au,COMPLETE
6128,0.0,2026-04-07 11:39:20.885224,2026-04-07 11:39:21.662394,0 days 00:00:00.777170,35.98862740684309,19.942915286336792,0.30174561016258966,Au,PRUNED
6129,-375.2777777777274,2026-04-07 11:39:21.545507,2026-04-07 11:39:22.482865,0 days 00:00:00.937358,20.684472653993428,19.68012486472981,0.47314501657323293,Au,COMPLETE
6130,0.0,2026-04-07 11:39:21.551573,2026-04-07 11:39:22.566346,0 days 00:00:01.014773,20.21792238003302,17.334629319121415,0.6591861748894331,Au,PRUNED
6131,-1.0,2026-04-07 11:39:21.599347,2026-04-07 11:39:22.418910,0 days 00:00:00.819563,31.577287630782656,19.895589515122104,0.6206959659201515,Au,COMPLETE
6132,-437.820512820445,2026-04-07 11:39:21.630502,2026-04-07 11:39:22.952819,0 days 00:00:01.322317,21.5331961742589,19.8263974273496,0.4585115528147353,Au,COMPLETE
6133,83.33333333333088,2026-04-07 11:39:21.665444,2026-04-07 11:39:22.953887,0 days 00:00:01.288443,22.97451222938312,19.998461077399,0.9790726511000958,Au,PRUNED
6134,-1.0,2026-04-07 11:39:21.741133,2026-04-07 11:39:22.781814,0 days 00:00:01.040681,31.658400007793546,19.961542491586158,0.7211526440486334,Au,COMPLETE
6135,80.24691358024454,2026-04-07 11:39:21.825265,2026-04-07 11:39:22.732891,0 days 00:00:00.907626,30.829183311313418,17.268000271655136,0.9405276679186041,Au,PRUNED
6136,0.0,2026-04-07 11:39:22.268648,2026-04-07 11:39:23.294930,0 days 00:00:01.026282,33.30076115189808,18.01769887648674,1.0107820509481988,Au,PRUNED
6137,-1.0,2026-04-07 11:39:22.661131,2026-04-07 11:39:23.501364,0 days 00:00:00.840233,20.696972740180108,19.958367434870176,0.38303970651702224,Au,COMPLETE
6138,-434.16030534344486,2026-04-07 11:39:22.713089,2026-04-07 11:39:23.829540,0 days 00:00:01.116451,21.426578872613273,19.878723842234283,0.4004090695990067,Au,COMPLETE
6139,-1.0,2026-04-07 11:39:22.819076,2026-04-07 11:39:23.558585,0 days 00:00:00.739509,46.11550848812326,15.80516895050881,0.6494978196180436,Au,COMPLETE
6140,-1.0,2026-04-07 11:39:22.847249,2026-04-07 11:39:23.981629,0 days 00:00:01.134380,30.448367370905807,17.770138130420875,0.5383198255805313,Au,COMPLETE
6141,0.0,2026-04-07 11:39:23.147045,2026-04-07 11:39:24.264346,0 days 00:00:01.117301,31.01314961567267,19.898567321962965,0.7628716450846398,Au,PRUNED
6142,-1.0,2026-04-07 11:39:23.202723,2026-04-07 11:39:24.074823,0 days 00:00:00.872100,28.247282147635985,19.996159025611103,0.9059535515671462,Au,COMPLETE
6143,0.0,2026-04-07 11:39:23.400333,2026-04-07 11:39:24.392385,0 days 00:00:00.992052,34.525041044117415,19.923335838200856,0.5904356790430705,Au,PRUNED
6144,0.0,2026-04-07 11:39:23.439017,2026-04-07 11:39:24.222372,0 days 00:00:00.783355,20.760828936398205,17.14906352366762,0.5676209595099987,Au,PRUNED
6145,-1.0,2026-04-07 11:39:23.832754,2026-04-07 11:39:25.099505,0 days 00:00:01.266751,43.18860845212866,17.452897705261044,0.8740337817941188,Au,COMPLETE
6146,-395.3962703962157,2026-04-07 11:39:24.113637,2026-04-07 11:39:25.098505,0 days 00:00:00.984868,20.385137720120085,19.709880096085264,0.9543030304714142,Au,COMPLETE
6147,0.0,2026-04-07 11:39:23.933799,2026-04-07 11:39:25.211946,0 days 00:00:01.278147,34.751630851497524,19.975619528061294,0.7550587434251756,Au,PRUNED
6148,0.0,2026-04-07 11:39:24.300336,2026-04-07 11:39:25.366442,0 days 00:00:01.066106,20.16913170989409,19.709485039041123,0.354776224999041,Au,PRUNED
6149,-1.0,2026-04-07 11:39:24.359598,2026-04-07 11:39:25.210934,0 days 00:00:00.851336,20.685375784951898,14.707367102040408,0.9885702129675121,Au,COMPLETE
6150,80.55555555555317,2026-04-07 11:39:24.395888,2026-04-07 11:39:25.302849,0 days 00:00:00.906961,30.232329635549902,17.655669490454724,0.7375599060181077,Au,PRUNED
