number,value,datetime_start,datetime_complete,duration,params_D2_nm,params_D3_nm,params_D4_nm,params_metal,state
6151,-0.6830601092896063,2026-04-07 11:39:24.483394,2026-04-07 11:39:25.349740,0 days 00:00:00.866346,115.77419069203974,8.149043941894874,0.5148262945409223,Au,PRUNED
6152,-1.0,2026-04-07 11:39:24.546261,2026-04-07 11:39:25.234557,0 days 00:00:00.688296,30.891460646968092,15.21481958379116,0.646922108898713,Au,COMPLETE
