number,value,datetime_start,datetime_complete,duration,params_D2_nm,params_D3_nm,params_D4_nm,params_metal,state
646,-0.6973500697349952,2025-11-13 12:26:55.762503,2025-11-13 12:26:56.463233,0 days 00:00:00.700730,77.19823863333129,14.10486583242107,0.10345318977643994,Au,COMPLETE
647,-18.68872549019331,2025-11-13 12:26:55.644717,2025-11-13 12:26:56.494470,0 days 00:00:00.849753,77.18678392720591,1.1423844750564098,0.1037836809859198,Au,COMPLETE
648,-17.73648648648411,2025-11-13 12:26:55.928972,2025-11-13 12:26:56.352097,0 days 00:00:00.423125,74.50981735454926,1.17921583884854,0.6040542568175239,Au,COMPLETE
649,-45.94017094014738,2025-11-13 12:26:56.064187,2025-11-13 12:26:56.615123,0 days 00:00:00.550936,73.23946660659573,0.8930001761068901,0.6030637581621807,Ag,COMPLETE
650,-51.4705882352638,2025-11-13 12:26:56.329836,2025-11-13 12:26:56.781165,0 days 00:00:00.451329,72.3653957198964,0.8425242771985937,0.14026328073287125,Ag,COMPLETE
651,-47.00854700852298,2025-11-13 12:26:56.463233,2025-11-13 12:26:57.003038,0 days 00:00:00.539805,76.1706193195713,2.088962073178557,0.134690755071799,Ag,COMPLETE
652,-51.47058823526383,2025-11-13 12:26:56.572832,2025-11-13 12:26:57.264967,0 days 00:00:00.692135,70.9090213450111,0.8884811134935069,0.1934324242321678,Ag,COMPLETE
653,-43.65079365077271,2025-11-13 12:26:56.654514,2025-11-13 12:26:57.234637,0 days 00:00:00.580123,79.31989012435999,2.088643556741801,0.136215066591471,Ag,COMPLETE
654,-48.8095238094959,2025-11-13 12:26:56.717071,2025-11-13 12:26:57.491951,0 days 00:00:00.774880,71.19437884991738,0.8412750973783885,0.18940224271728529,Ag,COMPLETE
655,-45.94017094014722,2025-11-13 12:26:56.753324,2025-11-13 12:26:57.476343,0 days 00:00:00.723019,75.39666468624578,2.0345995237307415,0.13350178926125397,Ag,COMPLETE
656,-48.6111111110841,2025-11-13 12:26:56.830103,2025-11-13 12:26:57.349822,0 days 00:00:00.519719,75.76078191632135,0.8444068397603757,0.18804725159033583,Ag,COMPLETE
657,-53.03030303027077,2025-11-13 12:26:56.898260,2025-11-13 12:26:57.596098,0 days 00:00:00.697838,70.82646107448211,0.5098706905590219,0.19296984528352812,Ag,COMPLETE
658,-49.99999999997116,2025-11-13 12:26:57.111228,2025-11-13 12:26:57.779715,0 days 00:00:00.668487,70.54286479641729,1.4079269363926121,0.1316535526371323,Ag,COMPLETE
659,-49.99999999997116,2025-11-13 12:26:57.429448,2025-11-13 12:26:58.055145,0 days 00:00:00.625697,69.7139576685952,1.4368383154082638,0.10187128427363605,Ag,COMPLETE
660,-50.24509803918605,2025-11-13 12:26:57.570361,2025-11-13 12:26:58.365024,0 days 00:00:00.794663,68.9008640421077,0.5051660879118495,0.2337563468372681,Ag,COMPLETE
661,-48.6111111110841,2025-11-13 12:26:57.643530,2025-11-13 12:26:58.380612,0 days 00:00:00.737082,68.83733815348208,1.21547665160693,0.20422395440087626,Ag,COMPLETE
662,-4.729474082481921,2025-11-13 12:26:57.694632,2025-11-13 12:26:58.380612,0 days 00:00:00.685980,82.2653088279359,15.765781320823956,0.10163999782080982,Ag,COMPLETE
663,-48.6111111110841,2025-11-13 12:26:57.736928,2025-11-13 12:26:58.546120,0 days 00:00:00.809192,69.31576013702806,1.2073665015841186,0.2111865890210295,Ag,COMPLETE
664,-40.816326530595646,2025-11-13 12:26:57.835918,2025-11-13 12:26:58.499561,0 days 00:00:00.663643,69.62092928735619,5.352579862442672,0.10087291569276008,Ag,COMPLETE
665,-51.190476190446915,2025-11-13 12:26:57.977038,2025-11-13 12:26:58.589416,0 days 00:00:00.612378,68.59835328496905,1.1808537785770177,0.2098616109029695,Ag,COMPLETE
666,-51.47058823526383,2025-11-13 12:26:58.291651,2025-11-13 12:26:59.007624,0 days 00:00:00.715973,73.50595181836952,0.5148511697804484,0.1690591526550287,Ag,COMPLETE
667,-51.76767676764536,2025-11-13 12:26:58.480855,2025-11-13 12:26:59.054518,0 days 00:00:00.573663,73.15754411513352,0.5056321806998568,0.16685694032656348,Ag,COMPLETE
668,-49.99999999997149,2025-11-13 12:26:58.620538,2025-11-13 12:26:59.164761,0 days 00:00:00.544223,73.25062946971943,0.819908990798437,0.16916291255750288,Ag,COMPLETE
669,-27.227722772271793,2025-11-13 12:26:58.666171,2025-11-13 12:26:59.164761,0 days 00:00:00.498590,72.13747883009196,10.550025293612169,0.6990014722471739,Ag,COMPLETE
670,-51.4705882352638,2025-11-13 12:26:58.716100,2025-11-13 12:26:59.281417,0 days 00:00:00.565317,71.86751011425338,0.8402716850958796,0.17078922118024203,Ag,COMPLETE
671,-30.882352941169163,2025-11-13 12:26:58.761257,2025-11-13 12:26:59.384039,0 days 00:00:00.622782,71.69906473818862,10.512185606239395,0.16553975692663725,Ag,COMPLETE
672,-51.4705882352638,2025-11-13 12:26:58.800493,2025-11-13 12:26:59.297636,0 days 00:00:00.497143,72.97906488224733,0.8338484738488144,0.15676915933935445,Ag,COMPLETE
673,-13.888888888887216,2025-11-13 12:26:59.102508,2025-11-13 12:27:00.261652,0 days 00:00:01.159144,66.25730986526722,1.659570534450279,0.7361958513465786,Cu,COMPLETE
674,-15.416666666665096,2025-11-13 12:26:59.365988,2025-11-13 12:26:59.963762,0 days 00:00:00.597774,66.91580518022238,16.92037271323034,0.2511482026143264,Ag,COMPLETE
675,-45.94017094014737,2025-11-13 12:26:59.384039,2025-11-13 12:27:00.414584,0 days 00:00:01.030545,66.37275608375448,1.6834990966523868,0.3840665148203905,Ag,COMPLETE
676,-14.921171171169135,2025-11-13 12:26:59.430979,2025-11-13 12:27:00.387276,0 days 00:00:00.956297,66.96392232833303,1.7790277065854934,0.24205903868980588,Cu,COMPLETE
677,-15.25821596243915,2025-11-13 12:26:59.471985,2025-11-13 12:27:00.614659,0 days 00:00:01.142674,63.283819545066294,1.7819281037657704,0.20617829167061058,Cu,COMPLETE
678,-14.739229024941299,2025-11-13 12:26:59.530899,2025-11-13 12:27:00.372905,0 days 00:00:00.842006,66.92015223388661,1.6726392259865457,0.2563783953060096,Cu,COMPLETE
679,-49.99999999997152,2025-11-13 12:26:59.912867,2025-11-13 12:27:00.414759,0 days 00:00:00.501892,63.81488646748433,0.5027717054869588,0.3379795509741346,Ag,COMPLETE
680,-15.258215962439067,2025-11-13 12:26:59.938561,2025-11-13 12:27:00.383167,0 days 00:00:00.444606,63.108822057018045,1.7184729794389724,0.20734551751563712,Cu,COMPLETE
681,-21.901709401703823,2025-11-13 12:27:00.557620,2025-11-13 12:27:01.407957,0 days 00:00:00.850337,38.76922514370276,1.064158114496832,0.13766600374253318,Ag,COMPLETE
682,-51.47058823526388,2025-11-13 12:27:00.526372,2025-11-13 12:27:01.266669,0 days 00:00:00.740297,68.50625501457938,1.0884169786396667,0.10193922855151412,Ag,COMPLETE
683,-49.99999999997173,2025-11-13 12:27:00.630415,2025-11-13 12:27:01.328969,0 days 00:00:00.698554,68.5129718033065,1.1063759272797524,0.13523715750259976,Ag,COMPLETE
684,-51.47058823526388,2025-11-13 12:27:00.667986,2025-11-13 12:27:01.652387,0 days 00:00:00.984401,68.09692169204313,1.0721702233801644,0.10040003520339477,Ag,COMPLETE
685,-51.47058823526388,2025-11-13 12:27:00.681164,2025-11-13 12:27:01.074305,0 days 00:00:00.393141,68.93286842196478,1.1067685465733437,0.10043663270738688,Ag,COMPLETE
686,-48.61111111108426,2025-11-13 12:27:00.715274,2025-11-13 12:27:01.582585,0 days 00:00:00.867311,58.25613990358352,0.8554741627870064,0.14242633423581655,Ag,COMPLETE
687,23.966165413533478,2025-11-13 12:27:00.996071,2025-11-13 12:27:02.263575,0 days 00:00:01.267504,58.0946055684197,19.154946123422864,0.2972646569454111,Ag,COMPLETE
688,-1.4919011082693743,2025-11-13 12:27:01.089932,2025-11-13 12:27:01.652387,0 days 00:00:00.562455,104.97944929760783,0.798669491623538,0.14427162706046381,Ag,COMPLETE
689,-50.245098039186,2025-11-13 12:27:01.319166,2025-11-13 12:27:01.945971,0 days 00:00:00.626805,64.54581517288317,0.8300774294686708,0.1916766644395796,Ag,COMPLETE
690,-27.369281045746337,2025-11-13 12:27:01.617974,2025-11-13 12:27:02.409373,0 days 00:00:00.791399,74.81022531504695,11.430755233523573,0.28200376105807284,Ag,COMPLETE
691,-47.453703703677256,2025-11-13 12:27:01.724594,2025-11-13 12:27:02.461699,0 days 00:00:00.737105,61.18425947556766,0.5117820869122047,0.2955298460224816,Ag,COMPLETE
692,-50.24509803918625,2025-11-13 12:27:01.773510,2025-11-13 12:27:02.714117,0 days 00:00:00.940607,70.5947862068815,0.5007589458092498,0.3033927938782186,Ag,COMPLETE
693,-28.198653198647392,2025-11-13 12:27:01.897565,2025-11-13 12:27:02.802067,0 days 00:00:00.904502,74.93461315649934,11.439752979312336,0.19122427218445892,Ag,COMPLETE
694,-48.809523809495936,2025-11-13 12:27:01.838871,2025-11-13 12:27:02.960463,0 days 00:00:01.121592,75.1366085020789,0.5350331313909502,0.19568736167349493,Ag,COMPLETE
695,-49.76851851849078,2025-11-13 12:27:01.980574,2025-11-13 12:27:02.881595,0 days 00:00:00.901021,70.95983826972177,1.3822568680166158,0.19360514005493043,Ag,COMPLETE
696,-18.68872549019331,2025-11-13 12:27:02.297959,2025-11-13 12:27:02.971869,0 days 00:00:00.673910,65.28921592669661,1.3660367031657898,0.19336781950658594,Au,COMPLETE
697,-9.789156626504836,2025-11-13 12:27:02.714117,2025-11-13 12:27:03.212794,0 days 00:00:00.498677,27.928157563838834,0.9171785404940989,0.23732205915337629,Ag,COMPLETE
698,-10.284810126580986,2025-11-13 12:27:02.835116,2025-11-13 12:27:03.721180,0 days 00:00:00.886064,28.53857629968895,0.8688211476634368,0.22890450816059288,Ag,COMPLETE
699,-48.6111111110841,2025-11-13 12:27:02.914134,2025-11-13 12:27:03.418299,0 days 00:00:00.504165,62.630148233469804,0.8679061454613075,0.23123645373381851,Ag,COMPLETE
700,-0.5274261603375261,2025-11-13 12:27:03.032300,2025-11-13 12:27:03.721180,0 days 00:00:00.688880,62.97240769761448,17.595626233463594,0.5232471419686628,Ag,COMPLETE
701,-11.43067846607565,2025-11-13 12:27:03.097999,2025-11-13 12:27:04.064762,0 days 00:00:00.966763,33.61333540485115,12.144150704668334,1.8176364928949518,Ag,COMPLETE
702,-0.7109297725024645,2025-11-13 12:27:03.163258,2025-11-13 12:27:03.721180,0 days 00:00:00.557922,64.7367577949069,17.763687191408405,0.1362075632996388,Ag,COMPLETE
703,-50.245098039186,2025-11-13 12:27:03.214498,2025-11-13 12:27:04.015609,0 days 00:00:00.801111,70.68761149773721,0.5196334668586835,0.1364860121816835,Ag,COMPLETE
704,-40.74074074072269,2025-11-13 12:27:03.535848,2025-11-13 12:27:04.131773,0 days 00:00:00.595925,64.79928452443433,1.3349318051048025,1.253284031473892,Ag,COMPLETE
705,-36.05769230767838,2025-11-13 12:27:03.644942,2025-11-13 12:27:04.216016,0 days 00:00:00.571074,70.0553293685178,1.367088500272406,1.7466285324472643,Ag,COMPLETE
706,0.0,2025-11-13 12:27:03.968663,2025-11-13 12:27:04.284868,0 days 00:00:00.316205,46.82846683235955,19.766265701602354,1.6144266686856512,Au,COMPLETE
707,-0.5868544600938801,2025-11-13 12:27:04.081016,2025-11-13 12:27:04.624964,0 days 00:00:00.543948,22.8419116984348,1.23916120815162,0.1499821592404136,Au,COMPLETE
708,-19.531249999996948,2025-11-13 12:27:04.102178,2025-11-13 12:27:04.664464,0 days 00:00:00.562286,67.15174234023866,0.8452540482981792,0.15150079989678486,Au,COMPLETE
709,-19.333333333330202,2025-11-13 12:27:04.118427,2025-11-13 12:27:04.662777,0 days 00:00:00.544350,67.3280936611949,0.5133658771670763,0.16388166887227384,Au,COMPLETE
710,-49.99999999997132,2025-11-13 12:27:04.165149,2025-11-13 12:27:05.198138,0 days 00:00:01.032989,67.09854712725212,0.8971378187151761,0.15842996559503136,Ag,COMPLETE
711,-47.149122806992466,2025-11-13 12:27:04.284868,2025-11-13 12:27:04.943751,0 days 00:00:00.658883,67.50140178501704,0.506153817433548,0.8255404861714484,Ag,COMPLETE
712,-48.8095238094959,2025-11-13 12:27:04.314347,2025-11-13 12:27:05.293909,0 days 00:00:00.979562,60.16024398385609,0.5012950937557865,0.1736929992163641,Ag,COMPLETE
713,-46.05263157892295,2025-11-13 12:27:04.586653,2025-11-13 12:27:05.496967,0 days 00:00:00.910314,77.89614448892868,0.9133810835838791,0.17024095106932272,Ag,COMPLETE
714,-49.99999999997149,2025-11-13 12:27:04.730111,2025-11-13 12:27:05.569791,0 days 00:00:00.839680,60.463373219783044,0.8382510471214853,0.13088069377814665,Ag,COMPLETE
715,-41.66666666664772,2025-11-13 12:27:04.959377,2025-11-13 12:27:06.069695,0 days 00:00:01.110318,70.0986850493043,1.2389040352664642,1.057204613809021,Ag,COMPLETE
716,-49.76851851849095,2025-11-13 12:27:05.124604,2025-11-13 12:27:06.007198,0 days 00:00:00.882594,69.85214182132529,1.3948240061281396,0.25638822088362084,Ag,COMPLETE
717,-48.6111111110841,2025-11-13 12:27:05.450184,2025-11-13 12:27:06.022858,0 days 00:00:00.572674,65.29125789341684,1.1522224397872884,0.25836610526980014,Ag,COMPLETE
718,-48.6111111110841,2025-11-13 12:27:05.496967,2025-11-13 12:27:06.482244,0 days 00:00:00.985277,70.35785442324327,1.3669757586970837,0.22198573334411106,Ag,COMPLETE
719,-49.99999999997152,2025-11-13 12:27:05.528217,2025-11-13 12:27:06.022858,0 days 00:00:00.494641,69.25448222688281,1.2182359877837654,0.21735730486893895,Ag,COMPLETE
720,-41.666666666647146,2025-11-13 12:27:05.616809,2025-11-13 12:27:06.429713,0 days 00:00:00.812904,69.94717794421385,1.3592277484924429,1.054084091087169,Ag,COMPLETE
721,-51.76767676764536,2025-11-13 12:27:05.944695,2025-11-13 12:27:06.429713,0 days 00:00:00.485018,71.61649764159237,0.5099623777562307,0.12763443013188802,Ag,COMPLETE
722,-40.67460317458373,2025-11-13 12:27:06.147260,2025-11-13 12:27:06.885459,0 days 00:00:00.738199,52.758616966803736,0.8299388682746742,0.10195569976824648,Ag,COMPLETE
723,-51.4705882352638,2025-11-13 12:27:06.147260,2025-11-13 12:27:06.795972,0 days 00:00:00.648712,72.24229236708184,0.8624830058557488,0.10334539374781745,Ag,COMPLETE
724,-49.99999999997149,2025-11-13 12:27:06.374378,2025-11-13 12:27:06.994610,0 days 00:00:00.620232,64.25293497531416,0.8527271819313172,0.13082620506253886,Ag,COMPLETE
725,-48.6111111110841,2025-11-13 12:27:06.468002,2025-11-13 12:27:06.978930,0 days 00:00:00.510928,62.17759626386388,0.9701033326254904,0.12799192990985986,Ag,COMPLETE
726,-49.99999999997149,2025-11-13 12:27:06.555294,2025-11-13 12:27:07.010179,0 days 00:00:00.454885,62.21969023999417,0.8724370912562365,0.10592556935008292,Ag,COMPLETE
727,-32.22222222221368,2025-11-13 12:27:06.613449,2025-11-13 12:27:07.312705,0 days 00:00:00.699256,65.47738953421545,9.492524042779198,0.1916024476681959,Ag,COMPLETE
728,-51.76767676764519,2025-11-13 12:27:06.914354,2025-11-13 12:27:07.429962,0 days 00:00:00.515608,66.22960173151561,0.5309846989509608,0.1867191276824075,Ag,COMPLETE
729,-25.394477317551264,2025-11-13 12:27:07.010179,2025-11-13 12:27:07.647009,0 days 00:00:00.636830,67.94797387672648,16.284006076065012,0.174461627638471,Ag,COMPLETE
730,-48.42342342339705,2025-11-13 12:27:07.148273,2025-11-13 12:27:07.631336,0 days 00:00:00.483063,68.04426692216502,1.9395974592336427,0.17835027536128065,Ag,COMPLETE
731,-53.03030303027077,2025-11-13 12:27:07.217887,2025-11-13 12:27:08.185690,0 days 00:00:00.967803,68.21022555517436,0.5119479590960764,0.17663404047453518,Ag,COMPLETE
732,-47.14912280699298,2025-11-13 12:27:07.312705,2025-11-13 12:27:07.999081,0 days 00:00:00.686376,73.8899930830142,1.5635582089198872,0.1616070174254205,Ag,COMPLETE
733,-48.809523809495936,2025-11-13 12:27:07.527174,2025-11-13 12:27:07.999081,0 days 00:00:00.471907,73.91743829375577,0.5097074266725625,0.23674497450987386,Ag,COMPLETE
734,-47.29729729727148,2025-11-13 12:27:07.561672,2025-11-13 12:27:08.219243,0 days 00:00:00.657571,72.63146107615263,1.639073119485209,0.2205769379478036,Ag,COMPLETE
735,-8.333333333332503,2025-11-13 12:27:07.680330,2025-11-13 12:27:08.296131,0 days 00:00:00.615801,26.196800777517446,1.6235281658224978,0.24053865103554403,Ag,COMPLETE
736,-37.41496598637912,2025-11-13 12:27:07.846003,2025-11-13 12:27:08.540453,0 days 00:00:00.694450,64.98637049755251,0.5160861157810512,1.911843962417262,Ag,COMPLETE
737,-49.99999999997149,2025-11-13 12:27:07.947238,2025-11-13 12:27:08.509211,0 days 00:00:00.561973,64.0050770361299,0.8481793185273128,0.13495685752919603,Ag,COMPLETE
738,-48.6111111110841,2025-11-13 12:27:08.068337,2025-11-13 12:27:08.587333,0 days 00:00:00.518996,63.86382839037183,1.113367644285627,0.2701851109631546,Ag,COMPLETE
739,-48.61111111108426,2025-11-13 12:27:08.147841,2025-11-13 12:27:08.763530,0 days 00:00:00.615689,63.67814556740057,1.144930995720058,0.20895884980293378,Ag,COMPLETE
740,-15.13532763532632,2025-11-13 12:27:08.283645,2025-11-13 12:27:08.831762,0 days 00:00:00.548117,30.823720776438876,18.3420708783521,0.28008323188358414,Ag,COMPLETE
741,-50.24509803918605,2025-11-13 12:27:08.478034,2025-11-13 12:27:09.252110,0 days 00:00:00.774076,66.02600346488909,0.510850795365263,0.20631395107886533,Ag,COMPLETE
742,-51.47058823526383,2025-11-13 12:27:08.665745,2025-11-13 12:27:09.250107,0 days 00:00:00.584362,66.82301297044053,0.8851230431143551,0.19784770367448815,Ag,COMPLETE
743,-48.809523809495936,2025-11-13 12:27:08.714090,2025-11-13 12:27:09.311308,0 days 00:00:00.597218,66.56175277646376,0.9249683223005807,0.19528917462110285,Ag,COMPLETE
744,-49.99999999997152,2025-11-13 12:27:08.763530,2025-11-13 12:27:09.311308,0 days 00:00:00.547778,65.97801965397079,0.5143588578053325,0.33454150555580475,Ag,COMPLETE
745,-49.99999999997132,2025-11-13 12:27:08.831762,2025-11-13 12:27:09.685961,0 days 00:00:00.854199,66.50449578715995,0.8532077621047227,0.20597601206009541,Ag,COMPLETE
746,-44.79166666664434,2025-11-13 12:27:08.928131,2025-11-13 12:27:09.662970,0 days 00:00:00.734839,66.31387458096575,2.2966273227266747,0.345465383575592,Ag,COMPLETE
747,-49.99999999997132,2025-11-13 12:27:09.184859,2025-11-13 12:27:09.979409,0 days 00:00:00.794550,68.61045427630391,1.245574710950216,0.1592873277305526,Ag,COMPLETE
748,-44.573643410831764,2025-11-13 12:27:09.373726,2025-11-13 12:27:10.598267,0 days 00:00:01.224541,68.47790501805382,3.858813665233943,0.15609970701322143,Ag,COMPLETE
749,-51.76767676764536,2025-11-13 12:27:09.564819,2025-11-13 12:27:10.138354,0 days 00:00:00.573535,68.74013742392981,0.5040049742809226,0.1601897453743709,Ag,COMPLETE
750,-51.190476190446915,2025-11-13 12:27:09.599152,2025-11-13 12:27:10.090292,0 days 00:00:00.491140,68.72363926206641,1.2400637205556053,0.15759210143604005,Ag,COMPLETE
751,-49.99999999997149,2025-11-13 12:27:09.695961,2025-11-13 12:27:10.350352,0 days 00:00:00.654391,68.95994996584061,1.222408541266618,0.15410426616906234,Ag,COMPLETE
752,-48.611111111084135,2025-11-13 12:27:09.763420,2025-11-13 12:27:10.504028,0 days 00:00:00.740608,61.07283877763209,1.1182399934535439,0.10194126863508202,Ag,COMPLETE
753,-47.453703703677256,2025-11-13 12:27:09.947093,2025-11-13 12:27:10.700185,0 days 00:00:00.753092,61.53410820320573,0.8531150411022974,0.2523629464337153,Ag,COMPLETE
754,-0.7062146892655247,2025-11-13 12:27:10.168275,2025-11-13 12:27:11.294290,0 days 00:00:01.126015,71.89467776337398,14.625346343081645,0.10055286144572331,Au,COMPLETE
755,-18.48370927318017,2025-11-13 12:27:10.285970,2025-11-13 12:27:11.273027,0 days 00:00:00.987057,61.92807749268616,0.8234931158027,0.25974391533353003,Au,COMPLETE
756,-0.7342143906020427,2025-11-13 12:27:10.431202,2025-11-13 12:27:11.297378,0 days 00:00:00.866176,62.7988926729571,14.481952251833512,1.3271122899041823,Au,COMPLETE
757,-0.5296610169491436,2025-11-13 12:27:10.489361,2025-11-13 12:27:11.436188,0 days 00:00:00.946827,71.04017669202551,14.639443885802768,0.13163397314043493,Au,COMPLETE
758,-18.382352941173767,2025-11-13 12:27:10.540778,2025-11-13 12:27:11.405058,0 days 00:00:00.864280,80.84038661574675,0.8043667768886273,0.10053409582977887,Au,COMPLETE
759,-49.76851851849095,2025-11-13 12:27:10.752407,2025-11-13 12:27:11.933602,0 days 00:00:01.181195,70.55952955798664,1.610456311858536,0.13046462965129318,Ag,COMPLETE
760,-41.666666666647856,2025-11-13 12:27:11.139130,2025-11-13 12:27:11.617939,0 days 00:00:00.478809,71.27861529995833,1.5168561942761911,0.9954119420216755,Ag,COMPLETE
761,-42.65873015870962,2025-11-13 12:27:11.313003,2025-11-13 12:27:11.931596,0 days 00:00:00.618593,56.94022340518696,2.0323780455719547,0.22611459554328237,Ag,COMPLETE
762,-47.149122806992644,2025-11-13 12:27:11.413821,2025-11-13 12:27:12.348978,0 days 00:00:00.935157,67.6534035877594,2.006908241662062,0.22745691214732555,Ag,COMPLETE
763,-23.069679849338236,2025-11-13 12:27:11.569806,2025-11-13 12:27:12.622668,0 days 00:00:01.052862,64.16640376602057,13.792285169345714,1.5343708542430097,Ag,COMPLETE
764,-36.29032258063328,2025-11-13 12:27:11.736653,2025-11-13 12:27:12.667479,0 days 00:00:00.930826,64.80899823559662,7.715952233260824,0.18220476063772584,Ag,COMPLETE
765,-29.166666666660173,2025-11-13 12:27:11.867226,2025-11-13 12:27:13.062792,0 days 00:00:01.195566,59.46864585268532,10.906941028877636,0.1835121464898584,Ag,COMPLETE
766,-50.24509803918605,2025-11-13 12:27:11.955322,2025-11-13 12:27:12.794660,0 days 00:00:00.839338,64.56917092735755,0.5388791817283032,0.19325714850110254,Ag,COMPLETE
767,-49.99999999997152,2025-11-13 12:27:12.113240,2025-11-13 12:27:13.325430,0 days 00:00:01.212190,75.67522265703647,0.5157713033406951,0.18468717324561962,Ag,COMPLETE
768,-48.6111111110841,2025-11-13 12:27:12.310890,2025-11-13 12:27:13.109287,0 days 00:00:00.798397,77.2515209260513,0.5060990538513278,0.1807935838451783,Ag,COMPLETE
769,-1.1134552273792424,2025-11-13 12:27:12.430233,2025-11-13 12:27:13.110297,0 days 00:00:00.680064,23.44341762880678,0.8681525622895219,0.18965805893784282,Ag,COMPLETE
770,-49.99999999997149,2025-11-13 12:27:12.667479,2025-11-13 12:27:13.571960,0 days 00:00:00.904481,59.85186259639666,0.5127199281365754,0.10124626918377788,Ag,COMPLETE
771,-49.99999999997132,2025-11-13 12:27:13.046085,2025-11-13 12:27:13.714508,0 days 00:00:00.668423,68.07901997344689,1.1519555372547297,0.1372590925587559,Ag,COMPLETE
772,-51.190476190446915,2025-11-13 12:27:13.144471,2025-11-13 12:27:14.096628,0 days 00:00:00.952157,67.99141086268615,1.175510240166279,0.13754282609176735,Ag,COMPLETE
773,-49.99999999997149,2025-11-13 12:27:13.314317,2025-11-13 12:27:14.104339,0 days 00:00:00.790022,68.60539468514645,1.175264566552112,0.1461962733051669,Ag,COMPLETE
774,-51.47058823526388,2025-11-13 12:27:13.370443,2025-11-13 12:27:14.099282,0 days 00:00:00.728839,69.75605225649448,1.0619053958724658,0.10007616671376705,Ag,COMPLETE
775,-49.99999999997149,2025-11-13 12:27:13.429870,2025-11-13 12:27:14.087578,0 days 00:00:00.657708,67.79106225877293,1.1765212800013085,0.1523049730747253,Ag,COMPLETE
