number,value,datetime_start,datetime_complete,duration,params_D2_nm,params_D3_nm,params_D4_nm,params_metal,state
1298,-45.94017094014737,2026-04-07 11:30:20.546404,2026-04-07 11:30:21.211617,0 days 00:00:00.665213,65.18273974414952,1.0655309519666916,0.6108287798611531,Ag,COMPLETE
1299,-44.715447154449805,2026-04-07 11:30:20.568738,2026-04-07 11:30:21.167761,0 days 00:00:00.599023,68.03981493865997,2.0189256009567593,0.6067596943294317,Ag,COMPLETE
1300,-26.785714285706632,2026-04-07 11:30:20.657989,2026-04-07 11:30:21.364658,0 days 00:00:00.706669,47.62699068791595,4.527587386271811,0.13412823438282756,Ag,PRUNED
1301,-41.66666666664742,2026-04-07 11:30:20.744470,2026-04-07 11:30:21.371131,0 days 00:00:00.626661,79.3055808705053,1.0272014253616075,0.5483377104513543,Ag,COMPLETE
1302,-38.461538461523666,2026-04-07 11:30:20.827085,2026-04-07 11:30:21.411898,0 days 00:00:00.584813,67.1158295729769,5.420956327335991,0.34984984778280936,Ag,COMPLETE
1303,-1.0,2026-04-07 11:30:20.968456,2026-04-07 11:30:21.531817,0 days 00:00:00.563361,53.277169931039055,4.687403873982423,0.20106522397449914,Ag,COMPLETE
1304,-1.0,2026-04-07 11:30:21.226018,2026-04-07 11:30:21.696975,0 days 00:00:00.470957,81.73999307897837,0.8905314805700416,0.5468530498813977,Ag,COMPLETE
1305,-2.28551336146269,2026-04-07 11:30:21.290423,2026-04-07 11:30:21.927722,0 days 00:00:00.637299,87.08042644908755,4.933776177786134,0.27539697712591893,Cu,PRUNED
1306,-1.0,2026-04-07 11:30:21.432304,2026-04-07 11:30:21.804685,0 days 00:00:00.372381,46.62325598151146,4.273399617508312,0.19750266829126417,Ag,COMPLETE
1307,-17.543859649119113,2026-04-07 11:30:21.483010,2026-04-07 11:30:22.211330,0 days 00:00:00.728320,89.77551282405855,1.3013693482733217,0.3311852612009196,Ag,PRUNED
1308,-11.217948717947856,2026-04-07 11:30:21.493263,2026-04-07 11:30:22.226872,0 days 00:00:00.733609,25.54184383442772,19.65835733340617,0.10057541869691716,Ag,PRUNED
1309,0.0,2026-04-07 11:30:21.514047,2026-04-07 11:30:22.130603,0 days 00:00:00.616556,36.38758712432488,17.62000631323029,0.18608371497616805,Au,PRUNED
1310,-40.03267973854628,2026-04-07 11:30:21.557482,2026-04-07 11:30:22.038337,0 days 00:00:00.480855,71.22592411135855,5.686334813123227,0.1083334575919212,Ag,COMPLETE
1311,-1.0,2026-04-07 11:30:21.611389,2026-04-07 11:30:22.177539,0 days 00:00:00.566150,50.59082068299938,0.9264895322116617,0.48237909601559004,Ag,COMPLETE
1312,-40.83333333331706,2026-04-07 11:30:21.826167,2026-04-07 11:30:22.367963,0 days 00:00:00.541796,69.22387257082053,5.0831407911782875,0.33267135787328184,Ag,COMPLETE
1313,-6.944444444443519,2026-04-07 11:30:22.013616,2026-04-07 11:30:22.547081,0 days 00:00:00.533465,33.16385485229728,18.675133120942043,1.8200240571925819,Ag,PRUNED
1314,-1.0,2026-04-07 11:30:22.080976,2026-04-07 11:30:22.634309,0 days 00:00:00.553333,49.82230382194531,2.0385082308303155,0.4220463716307089,Ag,COMPLETE
1315,-1.0,2026-04-07 11:30:22.126030,2026-04-07 11:30:22.635701,0 days 00:00:00.509671,46.163186833974706,13.119213471155751,1.347262101817818,Cu,COMPLETE
1316,-0.8928571428571173,2026-04-07 11:30:22.273503,2026-04-07 11:30:22.777346,0 days 00:00:00.503843,22.97524794662384,16.392877335896628,0.12455024343915216,Ag,PRUNED
1317,-1.0,2026-04-07 11:30:22.321508,2026-04-07 11:30:22.723897,0 days 00:00:00.402389,71.7810003170176,1.8247761435710543,0.5932289753985085,Ag,COMPLETE
1318,-1.0,2026-04-07 11:30:22.415825,2026-04-07 11:30:22.775336,0 days 00:00:00.359511,36.67019000758983,12.102722097227748,1.4489253478030837,Au,COMPLETE
1319,-35.49382716048048,2026-04-07 11:30:22.449728,2026-04-07 11:30:23.007604,0 days 00:00:00.557876,79.05314911413355,4.119121362530027,0.4139768493526013,Ag,COMPLETE
1320,-41.66666666664842,2026-04-07 11:30:22.517788,2026-04-07 11:30:23.184663,0 days 00:00:00.666875,69.32475083212731,3.2044981590215125,0.5915751430361968,Ag,COMPLETE
1321,-1.0,2026-04-07 11:30:22.595210,2026-04-07 11:30:23.265037,0 days 00:00:00.669827,60.22554507515373,4.9966140837583275,0.23766180507159573,Ag,COMPLETE
1322,-1.0,2026-04-07 11:30:22.764020,2026-04-07 11:30:23.185662,0 days 00:00:00.421642,20.131519088577363,19.89867906056698,0.9456199210726695,Ag,COMPLETE
1323,-11.90476190476077,2026-04-07 11:30:22.877790,2026-04-07 11:30:23.436875,0 days 00:00:00.559085,33.530876022328215,12.163150762558246,0.6133501199445313,Ag,PRUNED
1324,-1.0,2026-04-07 11:30:22.898650,2026-04-07 11:30:23.265037,0 days 00:00:00.366387,56.7454081523671,5.161487686811542,0.1541871215105736,Ag,COMPLETE
1325,-1.0,2026-04-07 11:30:22.983410,2026-04-07 11:30:23.437877,0 days 00:00:00.454467,51.50023380305662,1.7837125156080103,0.45612072665361203,Ag,COMPLETE
1326,-36.8589743589601,2026-04-07 11:30:23.077423,2026-04-07 11:30:23.672379,0 days 00:00:00.594956,54.282174759553,4.331582924296407,0.11995958352472529,Ag,COMPLETE
1327,-1.0,2026-04-07 11:30:23.149934,2026-04-07 11:30:23.744778,0 days 00:00:00.594844,86.52676203441132,3.4245486789488258,0.1511728957254742,Ag,COMPLETE
1328,-1.0,2026-04-07 11:30:23.294287,2026-04-07 11:30:23.803491,0 days 00:00:00.509204,68.4641086671739,5.301637433961463,0.11991682570715645,Ag,COMPLETE
1329,-1.0,2026-04-07 11:30:23.356745,2026-04-07 11:30:23.871095,0 days 00:00:00.514350,24.239972183608234,17.08039981840729,1.598811041737755,Au,COMPLETE
1330,0.0,2026-04-07 11:30:23.451530,2026-04-07 11:30:24.153926,0 days 00:00:00.702396,39.03834485920144,17.901558231670318,1.5399072535308587,Au,PRUNED
1331,-1.6801075268816934,2026-04-07 11:30:23.534017,2026-04-07 11:30:23.965024,0 days 00:00:00.431007,118.74766705402095,7.530453625929763,0.8274513633627796,Ag,PRUNED
1332,-33.33333333332,2026-04-07 11:30:23.544143,2026-04-07 11:30:24.332345,0 days 00:00:00.788202,54.532097288543156,0.542247820013352,0.5787442546590738,Ag,PRUNED
1333,-1.0,2026-04-07 11:30:23.722791,2026-04-07 11:30:24.332345,0 days 00:00:00.609554,83.57076549963281,17.01862372038807,1.6663633294265972,Cu,COMPLETE
1334,-1.0,2026-04-07 11:30:23.847894,2026-04-07 11:30:24.415049,0 days 00:00:00.567155,86.72005436803558,0.6127131371156429,0.4302921419566682,Ag,COMPLETE
1335,-1.0,2026-04-07 11:30:23.891691,2026-04-07 11:30:24.414047,0 days 00:00:00.522356,76.75268664127154,3.9421336796486566,0.48349053972100847,Ag,COMPLETE
1336,-39.96598639454163,2026-04-07 11:30:24.096991,2026-04-07 11:30:24.532004,0 days 00:00:00.435013,61.554501880075804,5.1126809474650035,0.10985613615243121,Ag,COMPLETE
1337,-1.0,2026-04-07 11:30:24.112812,2026-04-07 11:30:24.621024,0 days 00:00:00.508212,86.09618784708297,4.193226447699451,0.17253360197840706,Ag,COMPLETE
1338,-23.809523809517003,2026-04-07 11:30:24.192321,2026-04-07 11:30:24.712926,0 days 00:00:00.520605,87.41483796565291,1.1699442853640827,0.41544311904045095,Ag,PRUNED
1339,-1.0,2026-04-07 11:30:24.199110,2026-04-07 11:30:24.793595,0 days 00:00:00.594485,93.48753924383855,3.610398716367385,0.12000759132851546,Ag,COMPLETE
1340,51.94063926940496,2026-04-07 11:30:24.450716,2026-04-07 11:30:24.887270,0 days 00:00:00.436554,49.50723409264601,17.319071931615536,0.11131600551458098,Cu,PRUNED
1341,-1.0,2026-04-07 11:30:24.567946,2026-04-07 11:30:25.070199,0 days 00:00:00.502253,83.59501598325913,0.6544550389421397,0.5195376630383622,Ag,COMPLETE
1342,-40.760869565199854,2026-04-07 11:30:24.535267,2026-04-07 11:30:25.071210,0 days 00:00:00.535943,57.90451711207011,2.5899990271691946,0.5778364318094129,Ag,COMPLETE
1343,-1.0,2026-04-07 11:30:24.592603,2026-04-07 11:30:25.123351,0 days 00:00:00.530748,87.82579468302839,1.0891201716755572,0.4130234060316027,Ag,COMPLETE
1344,-1.0,2026-04-07 11:30:24.748271,2026-04-07 11:30:25.091969,0 days 00:00:00.343698,117.40626654431588,2.984892729920274,1.6769252709512994,Cu,COMPLETE
1345,-40.67460317458373,2026-04-07 11:30:24.765249,2026-04-07 11:30:25.270927,0 days 00:00:00.505678,54.90236894734079,0.7218074490805022,0.5051282611870628,Ag,COMPLETE
1346,-1.0,2026-04-07 11:30:24.796952,2026-04-07 11:30:25.220376,0 days 00:00:00.423424,93.84874003610044,0.7572831298626514,0.37654674853996906,Ag,COMPLETE
1347,-1.0,2026-04-07 11:30:24.919469,2026-04-07 11:30:25.529544,0 days 00:00:00.610075,22.467624757084867,12.412356120724542,1.3177233221640163,Au,COMPLETE
1348,-1.0,2026-04-07 11:30:25.001348,2026-04-07 11:30:25.539566,0 days 00:00:00.538218,98.86481939473391,2.396265879481679,0.3321475380286262,Au,COMPLETE
1349,-1.0,2026-04-07 11:30:25.167992,2026-04-07 11:30:25.699319,0 days 00:00:00.531327,53.74951630564091,3.6849054780100063,0.3823153691082144,Ag,COMPLETE
1350,-1.0,2026-04-07 11:30:25.279474,2026-04-07 11:30:25.792069,0 days 00:00:00.512595,56.001430637790165,5.032238891968584,0.27927968743206305,Cu,COMPLETE
1351,-48.61111111108426,2026-04-07 11:30:25.331858,2026-04-07 11:30:25.700326,0 days 00:00:00.368468,68.91467601269798,0.6991579923565546,0.5352911540702424,Ag,COMPLETE
1352,-19.230769230767258,2026-04-07 11:30:25.341111,2026-04-07 11:30:25.901005,0 days 00:00:00.559894,44.85058219043884,15.625319823941053,0.46172046021347213,Ag,PRUNED
1353,-47.297297297271975,2026-04-07 11:30:25.375579,2026-04-07 11:30:25.855484,0 days 00:00:00.479905,71.17564012457231,0.6910843829686395,0.5684814275814961,Ag,COMPLETE
1354,-0.2955082742316701,2026-04-07 11:30:25.414731,2026-04-07 11:30:25.955437,0 days 00:00:00.540706,46.231027765972456,13.69444706978824,1.5518778587356037,Au,PRUNED
1355,-28.84615384614497,2026-04-07 11:30:25.614644,2026-04-07 11:30:26.391113,0 days 00:00:00.776469,48.50323209540389,3.3655058086771783,0.25134372136890654,Ag,PRUNED
1356,-12.499999999999,2026-04-07 11:30:25.658576,2026-04-07 11:30:26.348982,0 days 00:00:00.690406,51.87727855738892,7.155864097423903,1.749218993321492,Cu,PRUNED
1357,-1.0,2026-04-07 11:30:25.904014,2026-04-07 11:30:26.484472,0 days 00:00:00.580458,71.98103511022815,5.135530607591855,0.1186716616913752,Ag,COMPLETE
1358,-1.0,2026-04-07 11:30:25.988430,2026-04-07 11:30:26.687392,0 days 00:00:00.698962,89.12776669512894,2.535324765220833,0.1286892389843877,Ag,COMPLETE
1359,-1.0,2026-04-07 11:30:25.958029,2026-04-07 11:30:26.431883,0 days 00:00:00.473854,48.48255577389649,3.4448601165056676,0.12214323132559278,Ag,COMPLETE
1360,-26.785714285706632,2026-04-07 11:30:26.048768,2026-04-07 11:30:26.608099,0 days 00:00:00.559331,45.81526760533272,3.3957368892301125,0.1864288806312222,Ag,PRUNED
1361,-36.66666666665189,2026-04-07 11:30:26.053414,2026-04-07 11:30:26.804501,0 days 00:00:00.751087,52.18052100499612,2.301030719879267,0.4428164419700791,Ag,COMPLETE
1362,-37.962962962946214,2026-04-07 11:30:26.071983,2026-04-07 11:30:26.818139,0 days 00:00:00.746156,50.67739847460121,0.5104893107652241,0.38818723553085976,Ag,COMPLETE
1363,-26.785714285706632,2026-04-07 11:30:26.428634,2026-04-07 11:30:27.018627,0 days 00:00:00.589993,87.55024044245204,0.5106640839190939,0.4089811448485279,Ag,PRUNED
1364,-31.249999999989583,2026-04-07 11:30:26.507265,2026-04-07 11:30:27.037297,0 days 00:00:00.530032,84.5443288535133,3.1797150528510665,0.12888585012825923,Ag,PRUNED
1365,-36.949685534577355,2026-04-07 11:30:26.648062,2026-04-07 11:30:27.209093,0 days 00:00:00.561031,54.55983912492811,4.613634533193365,0.12729860812008864,Ag,COMPLETE
1366,-13.2978723404244,2026-04-07 11:30:26.689397,2026-04-07 11:30:27.373987,0 days 00:00:00.684590,56.83290491390213,8.178637485714784,0.6318936761805602,Cu,PRUNED
1367,-44.6428571428358,2026-04-07 11:30:26.752097,2026-04-07 11:30:27.478561,0 days 00:00:00.726464,65.21439511305252,2.326307911472525,0.5222085029733043,Ag,COMPLETE
1368,-1.0,2026-04-07 11:30:26.845322,2026-04-07 11:30:27.291189,0 days 00:00:00.445867,68.8646191006041,3.6723562203758764,0.475587652339138,Ag,COMPLETE
1369,-1.1904761904761563,2026-04-07 11:30:26.947155,2026-04-07 11:30:27.446290,0 days 00:00:00.499135,20.88610400045043,13.381918023719118,1.6358395224841307,Ag,PRUNED
1370,-1.0,2026-04-07 11:30:26.963437,2026-04-07 11:30:27.369118,0 days 00:00:00.405681,81.38277791644293,3.96686318572573,0.11781823509620404,Ag,COMPLETE
1371,-1.0,2026-04-07 11:30:27.118253,2026-04-07 11:30:27.588006,0 days 00:00:00.469753,118.90707245170918,19.445846371237426,1.8625851171963865,Au,COMPLETE
1372,-1.0,2026-04-07 11:30:27.146181,2026-04-07 11:30:27.652723,0 days 00:00:00.506542,46.23433408110192,0.5271687231748532,0.38625270785934807,Ag,COMPLETE
1373,-1.0,2026-04-07 11:30:27.372117,2026-04-07 11:30:27.925934,0 days 00:00:00.553817,20.00895805436731,17.48429457650772,0.3558008446828175,Ag,COMPLETE
1374,-1.0,2026-04-07 11:30:27.464229,2026-04-07 11:30:28.051661,0 days 00:00:00.587432,75.73692102206692,4.941205029567084,0.31617422092330033,Ag,COMPLETE
1375,-39.26282051280568,2026-04-07 11:30:27.481076,2026-04-07 11:30:28.084730,0 days 00:00:00.603654,70.88551039778118,5.222244374272312,0.3842258367622654,Ag,COMPLETE
1376,-2.0461309523809157,2026-04-07 11:30:27.512477,2026-04-07 11:30:28.011342,0 days 00:00:00.498865,89.85690412721623,1.5937717056637468,0.2818571749126977,Cu,PRUNED
1377,-0.31328320802004544,2026-04-07 11:30:27.532279,2026-04-07 11:30:28.187246,0 days 00:00:00.654967,65.24818730652409,12.306995331541142,0.4991192127728935,Cu,PRUNED
1378,-1.0,2026-04-07 11:30:27.666195,2026-04-07 11:30:28.064341,0 days 00:00:00.398146,66.66441072680152,3.704786903619474,0.5619098735148916,Ag,COMPLETE
1379,-2.3277467411545105,2026-04-07 11:30:27.745864,2026-04-07 11:30:28.184118,0 days 00:00:00.438254,87.2804375213773,0.5731905759814551,0.35304352571088576,Cu,PRUNED
1380,-42.68292682924739,2026-04-07 11:30:27.777924,2026-04-07 11:30:28.186247,0 days 00:00:00.408323,76.9682088545273,1.0120353450460422,0.5329689610142774,Ag,COMPLETE
1381,-40.780141843954084,2026-04-07 11:30:28.001692,2026-04-07 11:30:28.784458,0 days 00:00:00.782766,62.94126672610949,3.81744431106989,0.42000228351744684,Ag,COMPLETE
1382,-1.0,2026-04-07 11:30:28.133840,2026-04-07 11:30:28.583130,0 days 00:00:00.449290,70.04337585997756,4.290084202481789,0.4458769994136833,Ag,COMPLETE
1383,-25.641025641017748,2026-04-07 11:30:28.239275,2026-04-07 11:30:29.003332,0 days 00:00:00.764057,87.14382312970227,0.6158883127216187,0.35287557545100345,Ag,PRUNED
1384,-47.297297297271456,2026-04-07 11:30:28.284923,2026-04-07 11:30:28.865906,0 days 00:00:00.580983,64.73474912607941,0.8295796630461021,0.557904017841273,Ag,COMPLETE
1385,-1.0,2026-04-07 11:30:28.332513,2026-04-07 11:30:28.740714,0 days 00:00:00.408201,38.14867125866104,14.976733149505469,0.1145129032752163,Ag,COMPLETE
1386,-15.35087719298084,2026-04-07 11:30:28.346612,2026-04-07 11:30:28.869305,0 days 00:00:00.522693,54.99017654570152,3.668771769659126,0.5331753101828298,Au,PRUNED
1387,-8.62068965517182,2026-04-07 11:30:28.362158,2026-04-07 11:30:28.892911,0 days 00:00:00.530753,24.28539253680163,15.859305177383611,1.3989854857524329,Cu,PRUNED
1388,-33.33333333332,2026-04-07 11:30:28.468601,2026-04-07 11:30:29.762154,0 days 00:00:01.293553,46.86385367969366,0.5609622728410011,0.10219004834146554,Ag,PRUNED
1389,-42.68292682924754,2026-04-07 11:30:28.947562,2026-04-07 11:30:29.790042,0 days 00:00:00.842480,80.30464223648721,0.5241815736953201,0.46368205061979095,Ag,COMPLETE
1390,-23.43749999999414,2026-04-07 11:30:28.973317,2026-04-07 11:30:29.909142,0 days 00:00:00.935825,87.19792183967034,3.4457258152261474,0.17032630682193067,Ag,PRUNED
1391,-1.0,2026-04-07 11:30:28.990780,2026-04-07 11:30:29.530382,0 days 00:00:00.539602,21.421311831243038,18.035094429567366,1.9643749693045578,Cu,COMPLETE
1392,-1.0,2026-04-07 11:30:29.022947,2026-04-07 11:30:29.678183,0 days 00:00:00.655236,78.12926030508291,10.4112342235201,1.8839296771017964,Cu,COMPLETE
1393,0.0,2026-04-07 11:30:29.055111,2026-04-07 11:30:29.880061,0 days 00:00:00.824950,20.953990822095754,14.373929126516451,1.7039381514480605,Au,PRUNED
1394,-1.0,2026-04-07 11:30:29.086670,2026-04-07 11:30:29.721840,0 days 00:00:00.635170,50.39428664470706,0.9551140286377586,0.4293394235771322,Ag,COMPLETE
1395,-0.5230125523012464,2026-04-07 11:30:29.133788,2026-04-07 11:30:29.814418,0 days 00:00:00.680630,87.01836071905059,19.04177588059781,1.1131818415113792,Au,PRUNED
1396,-1.0,2026-04-07 11:30:29.635202,2026-04-07 11:30:30.568310,0 days 00:00:00.933108,91.24685047194947,0.51622868106306,0.1555565800685729,Ag,COMPLETE
1397,-1.0,2026-04-07 11:30:29.832033,2026-04-07 11:30:30.397637,0 days 00:00:00.565604,68.57433049197536,0.9146735163890951,0.5358106782253078,Ag,COMPLETE
1398,-1.0,2026-04-07 11:30:29.880061,2026-04-07 11:30:30.414612,0 days 00:00:00.534551,87.60947264944555,0.8019490478966005,0.35750011957784406,Ag,COMPLETE
1399,-1.0,2026-04-07 11:30:29.926395,2026-04-07 11:30:30.486679,0 days 00:00:00.560284,66.07168434938636,4.577844927930554,0.4424371759262209,Ag,COMPLETE
1400,-1.0,2026-04-07 11:30:29.948320,2026-04-07 11:30:30.416646,0 days 00:00:00.468326,71.69119691312561,4.469430914541592,0.38340037314428227,Ag,COMPLETE
1401,-0.5144032921810615,2026-04-07 11:30:29.972485,2026-04-07 11:30:30.624323,0 days 00:00:00.651838,107.16854708232725,9.871955271423252,0.7503688613827298,Au,PRUNED
1402,-1.0,2026-04-07 11:30:30.003530,2026-04-07 11:30:30.537990,0 days 00:00:00.534460,45.70381164454248,3.515075240700285,0.13336377858780737,Ag,COMPLETE
1403,-1.0,2026-04-07 11:30:30.019864,2026-04-07 11:30:30.414612,0 days 00:00:00.394748,58.89453539472772,0.6539338366324405,0.5059236975274427,Ag,COMPLETE
1404,-41.66666666664815,2026-04-07 11:30:30.504944,2026-04-07 11:30:31.266563,0 days 00:00:00.761619,59.02704283839974,2.819766959319555,0.442404438675721,Ag,COMPLETE
1405,2.371273712737089,2026-04-07 11:30:30.644013,2026-04-07 11:30:31.345004,0 days 00:00:00.700991,100.01626654906377,16.94416491391251,0.717958005507467,Cu,PRUNED
1406,0.0,2026-04-07 11:30:30.661129,2026-04-07 11:30:31.716638,0 days 00:00:01.055509,23.197465690058724,11.299073675789456,1.8863778272783556,Au,PRUNED
1407,-1.0,2026-04-07 11:30:30.691302,2026-04-07 11:30:31.232985,0 days 00:00:00.541683,76.28826311284925,5.227725651697323,0.18638946800157308,Ag,COMPLETE
1408,-34.090909090896695,2026-04-07 11:30:30.727552,2026-04-07 11:30:31.661000,0 days 00:00:00.933448,77.73902430459398,4.586515297422896,0.2604227710670427,Ag,PRUNED
1409,-1.0,2026-04-07 11:30:30.740671,2026-04-07 11:30:31.430020,0 days 00:00:00.689349,48.94250135589431,1.6713617649683072,0.10414687521632085,Ag,COMPLETE
1410,-1.0,2026-04-07 11:30:30.769791,2026-04-07 11:30:31.360688,0 days 00:00:00.590897,46.34842578838237,0.8071349282633673,0.11623659292338222,Ag,COMPLETE
1411,-1.0,2026-04-07 11:30:30.931748,2026-04-07 11:30:31.499096,0 days 00:00:00.567348,36.92862263803634,11.170860657528898,0.1957498186380246,Au,COMPLETE
1412,-38.46153846152355,2026-04-07 11:30:31.342382,2026-04-07 11:30:32.246691,0 days 00:00:00.904309,77.36905538009661,4.913649315594576,0.1718781759486934,Ag,COMPLETE
1413,-33.33333333332,2026-04-07 11:30:31.401626,2026-04-07 11:30:31.878042,0 days 00:00:00.476416,51.96912124617007,0.6512963445935693,0.42293696056984476,Ag,PRUNED
1414,-1.0,2026-04-07 11:30:31.587839,2026-04-07 11:30:32.262672,0 days 00:00:00.674833,56.55722732107078,1.08238482853565,0.5352150003719113,Ag,COMPLETE
1415,-42.59259259257346,2026-04-07 11:30:31.611679,2026-04-07 11:30:32.434887,0 days 00:00:00.823208,63.71517556888675,3.079684355191949,0.5165281684907412,Ag,COMPLETE
1416,0.0,2026-04-07 11:30:31.656603,2026-04-07 11:30:32.464910,0 days 00:00:00.808307,106.17213299486068,19.018730355315256,0.7149497602116373,Ag,PRUNED
1417,-1.0,2026-04-07 11:30:31.776196,2026-04-07 11:30:32.248731,0 days 00:00:00.472535,84.66950572461177,3.7691700351709025,0.11656131475576836,Ag,COMPLETE
1418,-31.249999999989583,2026-04-07 11:30:31.808865,2026-04-07 11:30:32.480831,0 days 00:00:00.671966,52.023187004744734,3.4618301389079367,0.36782904301424785,Ag,PRUNED
1419,-40.780141843954084,2026-04-07 11:30:31.880754,2026-04-07 11:30:32.774319,0 days 00:00:00.893565,61.14529674443583,4.42556570594308,0.11338018051572867,Ag,COMPLETE
1420,-1.0,2026-04-07 11:30:31.972721,2026-04-07 11:30:32.840799,0 days 00:00:00.868078,68.91626846639471,0.8296078195745717,0.5223367660268707,Ag,COMPLETE
1421,-39.96598639454163,2026-04-07 11:30:32.416775,2026-04-07 11:30:33.342989,0 days 00:00:00.926214,62.552166753542984,5.036166333411495,0.1585835104586384,Ag,COMPLETE
1422,-1.0,2026-04-07 11:30:32.590903,2026-04-07 11:30:33.281013,0 days 00:00:00.690110,89.29038037528511,2.6431624399522473,0.15093592273065326,Ag,COMPLETE
1423,-1.0,2026-04-07 11:30:32.641462,2026-04-07 11:30:33.200714,0 days 00:00:00.559252,73.46204520110719,0.9892452309708283,0.5477161174629374,Ag,COMPLETE
1424,-44.87179487177225,2026-04-07 11:30:32.590903,2026-04-07 11:30:33.422364,0 days 00:00:00.831461,64.38993514067367,1.0562260499868785,0.5638187133936156,Ag,COMPLETE
1425,-1.0,2026-04-07 11:30:32.673945,2026-04-07 11:30:33.420324,0 days 00:00:00.746379,60.3070121089054,7.852596132578321,1.2973650913762191,Au,COMPLETE
1426,-45.94017094014738,2026-04-07 11:30:32.738701,2026-04-07 11:30:33.473980,0 days 00:00:00.735279,75.20883223968515,0.9640385820255317,0.5117033127132249,Ag,COMPLETE
1427,-1.0,2026-04-07 11:30:32.939907,2026-04-07 11:30:33.669640,0 days 00:00:00.729733,62.77701419018401,0.5310597561398894,0.6006894790814457,Ag,COMPLETE
1428,-1.0,2026-04-07 11:30:33.009862,2026-04-07 11:30:33.637259,0 days 00:00:00.627397,55.23199247457656,2.6726907196118983,0.44245939878511686,Ag,COMPLETE
1429,-1.0,2026-04-07 11:30:33.393781,2026-04-07 11:30:34.106269,0 days 00:00:00.712488,88.3261585406922,0.6674858120677734,0.1326415319273179,Ag,COMPLETE
1430,-1.0,2026-04-07 11:30:33.496003,2026-04-07 11:30:34.136212,0 days 00:00:00.640209,61.20546084111618,4.799048395423177,0.11982602056508074,Ag,COMPLETE
1431,-1.0,2026-04-07 11:30:33.517351,2026-04-07 11:30:34.207221,0 days 00:00:00.689870,58.83085495888192,0.5583673980148294,0.45598421055795957,Ag,COMPLETE
1432,-1.5306122448979342,2026-04-07 11:30:33.581021,2026-04-07 11:30:34.416211,0 days 00:00:00.835190,118.85656073711772,1.5437888249728093,0.4578994796199535,Cu,PRUNED
