number,value,datetime_start,datetime_complete,duration,params_D2_nm,params_D3_nm,params_D4_nm,params_metal,state
776,-35.91954022987266,2025-11-13 12:27:13.510914,2025-11-13 12:27:14.387802,0 days 00:00:00.876888,73.7926667931523,6.412397987570667,0.27887541740947125,Ag,COMPLETE
777,-48.809523809495936,2025-11-13 12:27:13.714508,2025-11-13 12:27:14.650166,0 days 00:00:00.935658,72.52622223509621,0.8233478637754031,0.2695230167042728,Ag,COMPLETE
778,-13.457556935816067,2025-11-13 12:27:14.017157,2025-11-13 12:27:14.689488,0 days 00:00:00.672331,72.24239330143017,1.536892949722072,0.264029535522856,Cu,COMPLETE
779,-14.076576576574729,2025-11-13 12:27:14.159262,2025-11-13 12:27:15.170814,0 days 00:00:01.011552,72.0105848781202,0.5110459975900005,0.23636549248271707,Cu,COMPLETE
780,-50.24509803918605,2025-11-13 12:27:14.386803,2025-11-13 12:27:15.109852,0 days 00:00:00.723049,64.84656103215453,0.5006957419064073,0.21411545535417126,Ag,COMPLETE
781,-49.99999999997152,2025-11-13 12:27:14.406800,2025-11-13 12:27:15.138261,0 days 00:00:00.731461,66.14311802336309,0.8605300246928911,0.23332098145163238,Ag,COMPLETE
782,-49.99999999997132,2025-11-13 12:27:14.529025,2025-11-13 12:27:15.294887,0 days 00:00:00.765862,64.930999572895,0.838949688326593,0.2087129623059132,Ag,COMPLETE
783,-27.08333333332877,2025-11-13 12:27:14.608095,2025-11-13 12:27:15.477124,0 days 00:00:00.869029,65.06297067896735,13.289835613559278,0.22147793228353302,Ag,COMPLETE
784,-50.24509803918605,2025-11-13 12:27:14.724205,2025-11-13 12:27:15.279250,0 days 00:00:00.555045,65.58518023417713,0.5059795299714633,0.22666505582314747,Ag,COMPLETE
785,-49.76851851849095,2025-11-13 12:27:15.076175,2025-11-13 12:27:15.748755,0 days 00:00:00.672580,62.95275300295927,1.5478362700862887,0.13662849669071214,Ag,COMPLETE
786,-23.648648648642254,2025-11-13 12:27:15.249448,2025-11-13 12:27:15.483974,0 days 00:00:00.234526,41.328534121311975,1.5433154713967658,0.5669292746370127,Ag,COMPLETE
787,-38.94927536230196,2025-11-13 12:27:15.406175,2025-11-13 12:27:16.067555,0 days 00:00:00.661380,62.23158940118599,0.8748785230755276,1.4441484460271292,Ag,COMPLETE
788,-49.76851851849078,2025-11-13 12:27:15.513359,2025-11-13 12:27:16.067555,0 days 00:00:00.554196,69.4305081115009,1.4544287813648502,0.1360740405796882,Ag,COMPLETE
789,-48.8095238094959,2025-11-13 12:27:15.579089,2025-11-13 12:27:15.973791,0 days 00:00:00.394702,62.65690696017699,0.8842745455596499,0.14366029277869716,Ag,COMPLETE
790,-38.94927536230196,2025-11-13 12:27:15.625980,2025-11-13 12:27:16.315802,0 days 00:00:00.689822,70.15980114566601,0.8670936363642415,1.4533429522787755,Ag,COMPLETE
791,-49.99999999997132,2025-11-13 12:27:15.673579,2025-11-13 12:27:16.788613,0 days 00:00:01.115034,70.19344445845742,1.1195170220570057,0.17227892249663782,Ag,COMPLETE
792,-51.76767676764536,2025-11-13 12:27:15.911226,2025-11-13 12:27:16.812395,0 days 00:00:00.901169,70.44051829240546,0.5006757298031409,0.1715061773558481,Ag,COMPLETE
793,-24.999999999992887,2025-11-13 12:27:15.973791,2025-11-13 12:27:16.936121,0 days 00:00:00.962330,88.76989480014501,1.1238737231213998,0.17018306836272207,Ag,COMPLETE
794,-14.573070607551939,2025-11-13 12:27:16.144854,2025-11-13 12:27:17.166678,0 days 00:00:01.021824,66.68435864807475,17.177328633275774,0.10156793159970663,Ag,COMPLETE
795,-48.6111111110841,2025-11-13 12:27:16.645856,2025-11-13 12:27:17.344441,0 days 00:00:00.698585,75.27643375213529,0.5053616389625646,0.32027320309104135,Ag,COMPLETE
796,-50.24509803918621,2025-11-13 12:27:16.685538,2025-11-13 12:27:17.278366,0 days 00:00:00.592828,67.2495021449155,0.8499364535421066,0.10113034094856468,Ag,COMPLETE
797,-49.999999999971564,2025-11-13 12:27:16.784579,2025-11-13 12:27:17.344441,0 days 00:00:00.559862,67.08734040292596,0.8435326203890965,0.30956449687903054,Ag,COMPLETE
798,-53.03030303027095,2025-11-13 12:27:16.849951,2025-11-13 12:27:17.468994,0 days 00:00:00.619043,66.8321773427976,0.8669568722415808,0.10132645682097886,Ag,COMPLETE
799,-1.4391447368420864,2025-11-13 12:27:16.952269,2025-11-13 12:27:17.682466,0 days 00:00:00.730197,111.375584634164,0.8494823621654535,0.12778761377552794,Ag,COMPLETE
800,-49.76851851849098,2025-11-13 12:27:17.297432,2025-11-13 12:27:17.798695,0 days 00:00:00.501263,64.5630151600283,1.7779509993258786,0.10168132574248952,Ag,COMPLETE
801,-35.49382716048066,2025-11-13 12:27:17.444660,2025-11-13 12:27:18.332658,0 days 00:00:00.887998,62.95445459123969,1.817702123437566,1.8604706054622793,Ag,COMPLETE
802,-35.31073446326472,2025-11-13 12:27:17.500590,2025-11-13 12:27:18.237778,0 days 00:00:00.737188,62.69125233926892,5.62546094020523,0.7629109400370397,Ag,COMPLETE
803,-26.9764957264922,2025-11-13 12:27:17.591951,2025-11-13 12:27:18.593487,0 days 00:00:01.001536,63.521503637226374,15.458552621480266,0.13576819665021192,Ag,COMPLETE
804,-45.9401709401477,2025-11-13 12:27:17.648472,2025-11-13 12:27:18.301981,0 days 00:00:00.653509,63.830561367524226,2.2277566069902046,0.13640534810013988,Ag,COMPLETE
805,-48.42342342339707,2025-11-13 12:27:17.699769,2025-11-13 12:27:18.301981,0 days 00:00:00.602212,62.77069965636955,1.438023146256259,0.13671091469045643,Ag,COMPLETE
806,-29.10052910051983,2025-11-13 12:27:17.816103,2025-11-13 12:27:18.558038,0 days 00:00:00.741935,84.20348590136301,1.5393682536857716,0.901749835827431,Ag,COMPLETE
807,-49.99999999997152,2025-11-13 12:27:18.079870,2025-11-13 12:27:18.804210,0 days 00:00:00.724340,66.2246010153938,1.3515483776776893,0.10139116416797657,Ag,COMPLETE
808,-51.190476190446915,2025-11-13 12:27:18.466724,2025-11-13 12:27:19.047138,0 days 00:00:00.580414,66.93638071028215,1.2204028866358256,0.1785273017364226,Ag,COMPLETE
809,-18.11594202898157,2025-11-13 12:27:18.563745,2025-11-13 12:27:19.350357,0 days 00:00:00.786612,36.31179379753219,1.169474449215183,0.18231405120281413,Ag,COMPLETE
810,-47.297297297271975,2025-11-13 12:27:18.655982,2025-11-13 12:27:19.394187,0 days 00:00:00.738205,60.14935506120112,1.170933762444824,0.17630771060056777,Ag,COMPLETE
811,-19.194756554302785,2025-11-13 12:27:18.706129,2025-11-13 12:27:19.350357,0 days 00:00:00.644228,37.166955405577454,1.1426450960230818,0.4165514524923283,Ag,COMPLETE
812,-49.99999999997132,2025-11-13 12:27:18.868187,2025-11-13 12:27:19.571920,0 days 00:00:00.703733,68.64112780123313,1.0968700173471744,0.19302850203556352,Ag,COMPLETE
813,-19.23076923076616,2025-11-13 12:27:18.942941,2025-11-13 12:27:20.111894,0 days 00:00:01.168953,67.6318153501025,0.8411522279983614,0.21309746482724454,Au,COMPLETE
814,-15.771028037381734,2025-11-13 12:27:19.251029,2025-11-13 12:27:20.158868,0 days 00:00:00.907839,66.26677466004924,3.315588957172311,1.5817502370546797,Au,COMPLETE
815,-0.5868544600938801,2025-11-13 12:27:19.482068,2025-11-13 12:27:20.081373,0 days 00:00:00.599305,22.371668958749964,0.514296131772933,0.10109617055301666,Au,COMPLETE
816,-18.910256410253545,2025-11-13 12:27:19.583591,2025-11-13 12:27:20.298485,0 days 00:00:00.714894,65.97893081648698,0.7591157358708625,0.23599803965600993,Au,COMPLETE
817,-48.42342342339705,2025-11-13 12:27:19.655172,2025-11-13 12:27:20.811073,0 days 00:00:01.155901,65.28847457535444,1.9510699316118356,0.15676783680322282,Ag,COMPLETE
818,-0.6720430107526773,2025-11-13 12:27:19.686882,2025-11-13 12:27:20.905457,0 days 00:00:01.218575,98.79837507445771,8.84070868079234,0.2443621383506644,Au,COMPLETE
819,-48.423423423397416,2025-11-13 12:27:19.872639,2025-11-13 12:27:20.842562,0 days 00:00:00.969923,68.94928589712133,1.8801005180940753,0.15918047527448514,Ag,COMPLETE
820,-50.245098039186,2025-11-13 12:27:19.995378,2025-11-13 12:27:20.812901,0 days 00:00:00.817523,60.78410994992051,0.5073049018330483,0.15604816056349946,Ag,COMPLETE
821,-45.94017094014722,2025-11-13 12:27:20.339502,2025-11-13 12:27:21.051866,0 days 00:00:00.712364,60.85311243442278,2.00362395666523,0.15323524843873393,Ag,COMPLETE
822,-14.059304703474794,2025-11-13 12:27:20.397666,2025-11-13 12:27:21.343392,0 days 00:00:00.945726,68.10124710606561,2.706353418703978,0.27707305170670316,Cu,COMPLETE
823,-48.61111111108426,2025-11-13 12:27:20.500829,2025-11-13 12:27:21.374550,0 days 00:00:00.873721,60.945853641322486,0.8437167967099075,0.15668724000552478,Ag,COMPLETE
824,-5.762411347517287,2025-11-13 12:27:20.842562,2025-11-13 12:27:21.515202,0 days 00:00:00.672640,26.417115658061665,0.5005949327524413,0.20097082399905863,Cu,COMPLETE
825,-49.99999999997116,2025-11-13 12:27:21.103029,2025-11-13 12:27:21.892865,0 days 00:00:00.789836,71.0660855585085,1.4378588054432093,0.10268504446846695,Ag,COMPLETE
826,-7.170542635658268,2025-11-13 12:27:21.163654,2025-11-13 12:27:21.940428,0 days 00:00:00.776774,24.15938304715991,0.5074825422280151,0.2032541560613917,Ag,COMPLETE
827,-47.297297297271975,2025-11-13 12:27:21.390512,2025-11-13 12:27:22.293297,0 days 00:00:00.902785,71.30245190230968,1.4694494432432057,0.2094067338412835,Ag,COMPLETE
828,-49.99999999997152,2025-11-13 12:27:21.390512,2025-11-13 12:27:22.221705,0 days 00:00:00.831193,70.4047976971756,1.3690018728401085,0.10023160413592073,Ag,COMPLETE
829,-49.99999999997173,2025-11-13 12:27:21.515202,2025-11-13 12:27:22.759790,0 days 00:00:01.244588,64.91216993815901,1.1151691917671545,0.14002906064813025,Ag,COMPLETE
830,-1.427406199021184,2025-11-13 12:27:21.615688,2025-11-13 12:27:22.666875,0 days 00:00:01.051187,115.19046424328653,1.4543466895787376,0.12616000478245082,Ag,COMPLETE
831,-51.4705882352638,2025-11-13 12:27:21.818654,2025-11-13 12:27:22.712446,0 days 00:00:00.893792,65.13097599711624,0.8927643011413572,0.13170243621807015,Ag,COMPLETE
832,-50.245098039186,2025-11-13 12:27:21.846507,2025-11-13 12:27:23.048327,0 days 00:00:01.201820,65.45427111299921,0.8956136088639368,0.13728203498899835,Ag,COMPLETE
833,-41.666666666648545,2025-11-13 12:27:22.439419,2025-11-13 12:27:23.130940,0 days 00:00:00.691521,64.72903134223108,4.495950585529624,0.1381588752761576,Ag,COMPLETE
834,-49.99999999997136,2025-11-13 12:27:22.487009,2025-11-13 12:27:23.313211,0 days 00:00:00.826202,66.08917728564002,0.8947919852712136,0.2536638145303991,Ag,COMPLETE
835,-49.99999999997132,2025-11-13 12:27:22.496789,2025-11-13 12:27:22.963041,0 days 00:00:00.466252,65.62167438511052,0.9161521006344076,0.13680051722179262,Ag,COMPLETE
836,-49.99999999997136,2025-11-13 12:27:22.586413,2025-11-13 12:27:23.379836,0 days 00:00:00.793423,67.84060576100704,0.8627235454692253,0.2537725225791787,Ag,COMPLETE
837,-51.47058823526383,2025-11-13 12:27:22.963041,2025-11-13 12:27:23.552564,0 days 00:00:00.589523,68.25411316732071,0.8210573102561245,0.24324505972999377,Ag,COMPLETE
838,-44.95614035085329,2025-11-13 12:27:23.066771,2025-11-13 12:27:23.878373,0 days 00:00:00.811602,57.893537476197416,0.8566092940981318,0.2503033228370608,Ag,COMPLETE
839,-38.94927536230196,2025-11-13 12:27:23.179724,2025-11-13 12:27:23.846941,0 days 00:00:00.667217,55.5785883539274,0.5168765122092743,1.177527048122428,Ag,COMPLETE
840,-47.297297297271975,2025-11-13 12:27:23.255974,2025-11-13 12:27:23.878373,0 days 00:00:00.622399,73.8779339809901,1.1542240909728232,0.19083077125983094,Ag,COMPLETE
841,-51.47058823526383,2025-11-13 12:27:23.297726,2025-11-13 12:27:23.848938,0 days 00:00:00.551212,73.08700607329956,0.5063721087508181,0.18782015104084526,Ag,COMPLETE
842,-46.05263157892295,2025-11-13 12:27:23.456846,2025-11-13 12:27:24.061123,0 days 00:00:00.604277,58.45542087242051,1.2593703331650294,0.17862089151153593,Ag,COMPLETE
843,-49.99999999997149,2025-11-13 12:27:23.581181,2025-11-13 12:27:24.165904,0 days 00:00:00.584723,68.79851775027358,1.1462441171728797,0.18479121756546266,Ag,COMPLETE
844,-3.1362007168457757,2025-11-13 12:27:23.802847,2025-11-13 12:27:24.381559,0 days 00:00:00.578712,95.88449286982569,0.508571521130457,0.10063891659929267,Ag,COMPLETE
845,-47.297297297271975,2025-11-13 12:27:24.018760,2025-11-13 12:27:24.708717,0 days 00:00:00.689957,79.77479326962457,0.5223962939071803,0.10141864193741433,Ag,COMPLETE
846,-43.80341880339635,2025-11-13 12:27:24.061123,2025-11-13 12:27:24.892764,0 days 00:00:00.831641,78.91995797983628,0.5004954146032539,0.3088701734801122,Ag,COMPLETE
847,-44.79166666664434,2025-11-13 12:27:24.211292,2025-11-13 12:27:24.594517,0 days 00:00:00.383225,79.26666986638483,1.6299988599557462,0.10111057108254606,Ag,COMPLETE
848,-29.63917525772584,2025-11-13 12:27:24.273846,2025-11-13 12:27:24.998348,0 days 00:00:00.724502,70.0078652207044,11.818490468123102,0.10017604674123926,Ag,COMPLETE
849,-53.03030303027095,2025-11-13 12:27:24.314757,2025-11-13 12:27:24.998348,0 days 00:00:00.683591,69.47708692222673,0.5107288495508696,0.10022946992465086,Ag,COMPLETE
850,-13.059701492535334,2025-11-13 12:27:24.337114,2025-11-13 12:27:25.094155,0 days 00:00:00.757041,91.74493695298587,0.5193190735530429,0.21654142332710505,Ag,COMPLETE
851,-49.999999999971564,2025-11-13 12:27:24.414514,2025-11-13 12:27:25.436742,0 days 00:00:01.022228,69.71877151938905,0.8613412221304486,0.2968996517354491,Ag,COMPLETE
852,-51.47058823526383,2025-11-13 12:27:24.677092,2025-11-13 12:27:25.109797,0 days 00:00:00.432705,70.12025520904426,0.852688683309581,0.21111057366006628,Ag,COMPLETE
853,-51.190476190446915,2025-11-13 12:27:24.946914,2025-11-13 12:27:25.439748,0 days 00:00:00.492834,69.36004313321742,1.1749370278032831,0.21566350652278393,Ag,COMPLETE
854,-36.72316384179542,2025-11-13 12:27:24.899837,2025-11-13 12:27:25.796207,0 days 00:00:00.896370,70.08069504042255,7.169730552656094,0.16860786943610068,Ag,COMPLETE
855,-22.685185185180075,2025-11-13 12:27:25.214740,2025-11-13 12:27:26.028906,0 days 00:00:00.814166,44.96022318495396,7.152014620366254,0.16266123359165763,Ag,COMPLETE
856,-47.297297297271456,2025-11-13 12:27:25.352962,2025-11-13 12:27:25.846308,0 days 00:00:00.493346,75.10635271712707,1.2416454932367613,0.16438751569425905,Ag,COMPLETE
857,-48.423423423397416,2025-11-13 12:27:25.405577,2025-11-13 12:27:26.050525,0 days 00:00:00.644948,72.62522479024993,1.5277919911380027,0.15677860457320925,Ag,COMPLETE
858,-36.16352201256492,2025-11-13 12:27:24.778355,2025-11-13 12:27:26.050525,0 days 00:00:01.272170,72.74842421929254,1.567413553568989,1.674197998928392,Ag,COMPLETE
859,-48.423423423397416,2025-11-13 12:27:25.444742,2025-11-13 12:27:26.314810,0 days 00:00:00.870068,74.74216448613615,1.5166818260857355,0.1557154002459932,Ag,COMPLETE
860,-49.76851851849095,2025-11-13 12:27:25.703823,2025-11-13 12:27:26.446947,0 days 00:00:00.743124,72.39348051195799,1.5096838238577364,0.13805777389476184,Ag,COMPLETE
861,-15.20681265206587,2025-11-13 12:27:25.902821,2025-11-13 12:27:26.948009,0 days 00:00:01.045188,67.60612054303604,0.8777731655591803,0.1324985723295734,Cu,COMPLETE
862,-13.978494623654104,2025-11-13 12:27:26.183424,2025-11-13 12:27:26.896819,0 days 00:00:00.713395,50.396720642196684,2.3583935718193585,0.13711332632345538,Cu,COMPLETE
863,-13.535031847131982,2025-11-13 12:27:26.070830,2025-11-13 12:27:26.897879,0 days 00:00:00.827049,72.20845834139311,0.9159464813377239,0.3679131213716705,Cu,COMPLETE
864,-50.24509803918621,2025-11-13 12:27:26.336374,2025-11-13 12:27:26.912481,0 days 00:00:00.576107,67.78278244603135,0.8577349355719786,0.10104347322555046,Ag,COMPLETE
865,-15.547263681589719,2025-11-13 12:27:26.384203,2025-11-13 12:27:26.897879,0 days 00:00:00.513676,67.74255416894944,0.504911205379558,0.1327930715023651,Cu,COMPLETE
866,-49.99999999997132,2025-11-13 12:27:26.494324,2025-11-13 12:27:27.502685,0 days 00:00:01.008361,71.86542387845068,1.0650701573790315,0.2039297744558122,Ag,COMPLETE
867,-48.809523809495936,2025-11-13 12:27:26.849019,2025-11-13 12:27:27.499688,0 days 00:00:00.650669,76.22783203877647,0.5058949622229391,0.20557616519438882,Ag,COMPLETE
868,-45.94017094014737,2025-11-13 12:27:27.010290,2025-11-13 12:27:27.546029,0 days 00:00:00.535739,77.43090996921623,1.1676974899400574,0.20454780898165853,Ag,COMPLETE
869,-38.39869281044234,2025-11-13 12:27:27.427655,2025-11-13 12:27:28.209306,0 days 00:00:00.781651,63.353974049983215,5.020409191263327,0.28284087620775855,Ag,COMPLETE
870,-51.47058823526388,2025-11-13 12:27:27.450534,2025-11-13 12:27:28.209306,0 days 00:00:00.758772,70.85464458691199,0.5039401091200947,0.2651330795630578,Ag,COMPLETE
871,-48.61111111108426,2025-11-13 12:27:27.906302,2025-11-13 12:27:28.812489,0 days 00:00:00.906187,71.00929621528188,1.1540542862364656,0.17442084825680684,Ag,COMPLETE
872,-48.423423423397416,2025-11-13 12:27:27.937680,2025-11-13 12:27:28.815500,0 days 00:00:00.877820,67.14174460341548,1.899477080936646,0.16985270020839283,Ag,COMPLETE
873,-48.423423423397416,2025-11-13 12:27:27.997506,2025-11-13 12:27:28.659510,0 days 00:00:00.662004,67.17719742958317,1.809587145596991,0.1693284934651702,Ag,COMPLETE
874,-11.60714285714122,2025-11-13 12:27:27.997506,2025-11-13 12:27:28.781510,0 days 00:00:00.784004,30.280765438559147,1.1376562232924747,0.1733733626578046,Ag,COMPLETE
875,-20.488029465927745,2025-11-13 12:27:28.101340,2025-11-13 12:27:28.690271,0 days 00:00:00.588931,67.3007625104869,16.75184260529174,0.17217621340650702,Ag,COMPLETE
876,-49.99999999997149,2025-11-13 12:27:28.162316,2025-11-13 12:27:29.130810,0 days 00:00:00.968494,66.84595044555826,1.1960473607787088,0.17245458771593314,Ag,COMPLETE
877,-9.219858156027593,2025-11-13 12:27:28.572590,2025-11-13 12:27:29.289072,0 days 00:00:00.716482,29.409223796536562,12.824944220677828,0.1276533642692095,Ag,COMPLETE
878,20.50781249999968,2025-11-13 12:27:28.674605,2025-11-13 12:27:28.976234,0 days 00:00:00.301629,67.4771501042183,19.916272150484378,0.1732147559013512,Ag,COMPLETE
879,-49.99999999997149,2025-11-13 12:27:28.737136,2025-11-13 12:27:29.119336,0 days 00:00:00.382200,69.10666184389066,1.1476744391482927,0.17499688731614957,Ag,COMPLETE
880,-18.623737373734535,2025-11-13 12:27:29.086270,2025-11-13 12:27:29.629914,0 days 00:00:00.543644,63.32436343373664,0.8163429067518975,0.22750843724417152,Au,COMPLETE
881,-18.93939393939098,2025-11-13 12:27:29.129033,2025-11-13 12:27:29.915790,0 days 00:00:00.786757,64.0413017342058,0.9095156142685847,0.23127506542058382,Au,COMPLETE
882,-18.623737373734574,2025-11-13 12:27:29.184257,2025-11-13 12:27:29.770632,0 days 00:00:00.586375,63.799051883319855,0.8475267349855642,0.22713554447267256,Au,COMPLETE
883,-51.4705882352638,2025-11-13 12:27:29.211933,2025-11-13 12:27:30.197972,0 days 00:00:00.986039,73.71358263422677,0.8480288692650708,0.136062455479816,Ag,COMPLETE
884,-19.205729166663687,2025-11-13 12:27:29.264572,2025-11-13 12:27:30.132158,0 days 00:00:00.867586,63.43524858362701,0.8380803275488438,0.1027422039593454,Au,COMPLETE
885,-18.76590330788519,2025-11-13 12:27:29.313538,2025-11-13 12:27:30.136166,0 days 00:00:00.822628,63.31241008247315,0.8386697394690366,0.22830626409101037,Au,COMPLETE
886,-47.29729729727182,2025-11-13 12:27:29.580750,2025-11-13 12:27:30.325576,0 days 00:00:00.744826,70.07637841383381,0.5058184726250041,0.6464750350413966,Ag,COMPLETE
887,-49.99999999997149,2025-11-13 12:27:29.645542,2025-11-13 12:27:30.381366,0 days 00:00:00.735824,74.42140769045257,0.8326022326864123,0.13506600156832002,Ag,COMPLETE
888,-50.245098039186,2025-11-13 12:27:30.055257,2025-11-13 12:27:30.639175,0 days 00:00:00.583918,74.21429223349199,0.5092581642213633,0.13014890728084894,Ag,COMPLETE
889,-43.6991869918486,2025-11-13 12:27:30.138165,2025-11-13 12:27:30.767508,0 days 00:00:00.629343,69.08814432865475,0.5089461006952211,1.1295298195427377,Ag,COMPLETE
890,-0.8802816901408202,2025-11-13 12:27:30.247983,2025-11-13 12:27:30.933198,0 days 00:00:00.685215,22.024312957341152,1.4455741624838008,0.12792394296475257,Ag,COMPLETE
891,-49.99999999997116,2025-11-13 12:27:30.415614,2025-11-13 12:27:31.383998,0 days 00:00:00.968384,65.83608108159068,1.4467957714704789,0.1032950524984716,Ag,COMPLETE
892,-12.626262626261555,2025-11-13 12:27:30.540365,2025-11-13 12:27:31.012498,0 days 00:00:00.472133,32.66354259729988,15.943064748940223,0.271783358630615,Ag,COMPLETE
893,-0.8992805755395424,2025-11-13 12:27:30.645687,2025-11-13 12:27:31.352677,0 days 00:00:00.706990,21.50204629579527,18.90876655846884,0.10216836501080087,Ag,COMPLETE
894,-49.76851851849095,2025-11-13 12:27:30.735136,2025-11-13 12:27:31.496467,0 days 00:00:00.761331,70.93024341909478,1.3829618921008395,0.2652377513120936,Ag,COMPLETE
895,-51.19047619044695,2025-11-13 12:27:30.801846,2025-11-13 12:27:31.653040,0 days 00:00:00.851194,65.8372035301816,1.3933304624308591,0.10434688700318014,Ag,COMPLETE
896,-48.6111111110841,2025-11-13 12:27:30.808764,2025-11-13 12:27:31.559978,0 days 00:00:00.751214,65.95136556066133,1.3304563924492934,0.26942717021974605,Ag,COMPLETE
897,-34.72222222221182,2025-11-13 12:27:31.258428,2025-11-13 12:27:31.915873,0 days 00:00:00.657445,68.63014385872835,8.313377978123949,0.20291727501928397,Ag,COMPLETE
898,-1.723847965018462,2025-11-13 12:27:31.606857,2025-11-13 12:27:32.440000,0 days 00:00:00.833143,101.93825846984211,0.5128737433729079,0.19989346248945927,Ag,COMPLETE
899,-46.0526315789233,2025-11-13 12:27:31.559978,2025-11-13 12:27:32.810400,0 days 00:00:01.250422,61.485543478581775,1.8221303882674915,0.15317895965668393,Ag,COMPLETE
900,-7.723577235771607,2025-11-13 12:27:31.714994,2025-11-13 12:27:32.440000,0 days 00:00:00.725006,24.797187634393737,0.5008046890698148,0.13773078259811025,Ag,COMPLETE
901,-51.47058823526383,2025-11-13 12:27:31.784939,2025-11-13 12:27:32.377393,0 days 00:00:00.592454,72.53021893078295,0.5037249970435709,0.20094569444537136,Ag,COMPLETE
902,-49.99999999997132,2025-11-13 12:27:31.811549,2025-11-13 12:27:32.152830,0 days 00:00:00.341281,68.55746565568171,0.8487974497194811,0.19653914159592378,Ag,COMPLETE
903,-1.4831677704194037,2025-11-13 12:27:31.843516,2025-11-13 12:27:32.550369,0 days 00:00:00.706853,108.87108943806336,1.8077985758321728,0.19762278043482848,Ag,COMPLETE
904,-7.79967159277427,2025-11-13 12:27:31.899103,2025-11-13 12:27:32.747102,0 days 00:00:00.847999,24.911741210306477,0.5072423493021976,0.1411331146405094,Ag,COMPLETE
