number,value,datetime_start,datetime_complete,duration,params_D2_nm,params_D3_nm,params_D4_nm,params_metal,state
4337,-1.0,2026-04-07 11:35:50.786259,2026-04-07 11:35:51.497241,0 days 00:00:00.710982,22.58981597259214,19.93614947371458,0.9029312946841842,Au,COMPLETE
4338,-448.49081364822314,2026-04-07 11:35:50.838235,2026-04-07 11:35:51.521064,0 days 00:00:00.682829,21.473493499835424,19.97405375294933,0.4903256065197092,Au,COMPLETE
4339,-1.0,2026-04-07 11:35:51.026496,2026-04-07 11:35:51.787082,0 days 00:00:00.760586,22.700733690168864,19.961719708933146,0.39158535330091726,Au,COMPLETE
4340,0.0,2026-04-07 11:35:51.075500,2026-04-07 11:35:51.679413,0 days 00:00:00.603913,32.87208612828904,17.544822727456417,0.7913904279371697,Au,PRUNED
4341,-10.80246913580087,2026-04-07 11:35:51.241338,2026-04-07 11:35:52.125377,0 days 00:00:00.884039,33.41684146837212,19.914221686946853,0.6622032809461809,Ag,PRUNED
4342,0.0,2026-04-07 11:35:51.228143,2026-04-07 11:35:51.905139,0 days 00:00:00.676996,35.247121819468845,18.080410601978805,0.7993841636578102,Au,PRUNED
4343,-1.0,2026-04-07 11:35:51.331886,2026-04-07 11:35:51.989249,0 days 00:00:00.657363,94.34597395647414,5.380221794275854,1.9952869066145977,Ag,COMPLETE
4344,0.0,2026-04-07 11:35:51.368487,2026-04-07 11:35:52.213280,0 days 00:00:00.844793,21.56258277272098,16.94984440051934,0.34971616676293044,Au,PRUNED
4345,0.0,2026-04-07 11:35:51.682411,2026-04-07 11:35:52.562866,0 days 00:00:00.880455,36.21833101958663,16.95120776776423,0.2879163955562592,Au,PRUNED
4346,-0.83668005354751,2026-04-07 11:35:51.727873,2026-04-07 11:35:52.474013,0 days 00:00:00.746140,74.41518625043551,15.495528641961766,0.11994978594144834,Cu,PRUNED
4347,0.0,2026-04-07 11:35:51.740526,2026-04-07 11:35:52.755866,0 days 00:00:01.015340,37.456640585783695,19.729019272488344,0.4225479951299313,Au,PRUNED
4348,-1.0,2026-04-07 11:35:51.979603,2026-04-07 11:35:52.474520,0 days 00:00:00.494917,29.6091947786258,17.550435927035082,0.1945579186265785,Au,COMPLETE
4349,79.93827160493589,2026-04-07 11:35:51.997164,2026-04-07 11:35:52.758646,0 days 00:00:00.761482,32.453118768265966,17.08526369697258,0.45004765881364445,Au,PRUNED
4350,0.0,2026-04-07 11:35:52.185350,2026-04-07 11:35:52.853349,0 days 00:00:00.667999,34.03777431292721,19.36914311572333,0.13872766565342734,Au,PRUNED
4351,-1.0,2026-04-07 11:35:52.205798,2026-04-07 11:35:53.009990,0 days 00:00:00.804192,36.904176036022626,19.726867601553504,0.252040403585377,Au,COMPLETE
4352,-1.0,2026-04-07 11:35:52.440348,2026-04-07 11:35:53.054238,0 days 00:00:00.613890,31.294125748240994,19.876514702817257,0.3861753147613235,Au,COMPLETE
4353,0.0,2026-04-07 11:35:52.585369,2026-04-07 11:35:53.347207,0 days 00:00:00.761838,51.56558275122169,17.830917805935634,0.38417585165611434,Au,PRUNED
4354,-1.0,2026-04-07 11:35:52.678735,2026-04-07 11:35:53.269913,0 days 00:00:00.591178,21.596975923199988,19.973816166527882,0.4066692999451723,Au,COMPLETE
4355,0.0,2026-04-07 11:35:52.726122,2026-04-07 11:35:53.722221,0 days 00:00:00.996099,20.269407512848932,16.495082386254218,0.5609733587179967,Au,PRUNED
4356,0.0,2026-04-07 11:35:52.854350,2026-04-07 11:35:53.608690,0 days 00:00:00.754340,52.32070173431336,18.066577328535526,0.32216248917681484,Au,PRUNED
4357,-1.0,2026-04-07 11:35:52.932077,2026-04-07 11:35:53.523968,0 days 00:00:00.591891,30.077371262100815,19.978839665284603,0.5304146460818719,Au,COMPLETE
4358,-1.0,2026-04-07 11:35:52.958550,2026-04-07 11:35:53.630509,0 days 00:00:00.671959,33.847608467397976,17.16920061644538,0.4832634691333487,Au,COMPLETE
4359,-1.0,2026-04-07 11:35:53.248300,2026-04-07 11:35:53.752474,0 days 00:00:00.504174,40.23693337938903,17.3528357378355,0.3708774830251518,Au,COMPLETE
4360,-1.0,2026-04-07 11:35:53.181246,2026-04-07 11:35:53.877766,0 days 00:00:00.696520,42.03349776172743,18.148271637856844,0.323879955321114,Au,COMPLETE
4361,-1.0,2026-04-07 11:35:53.429023,2026-04-07 11:35:54.039953,0 days 00:00:00.610930,36.02349377175028,16.858515950287067,0.1464749217573398,Au,COMPLETE
4362,0.0,2026-04-07 11:35:53.443866,2026-04-07 11:35:53.907532,0 days 00:00:00.463666,33.673477477882514,19.992466649592036,0.6625286178849734,Au,PRUNED
4363,-1.0,2026-04-07 11:35:53.668546,2026-04-07 11:35:54.390001,0 days 00:00:00.721455,30.397435494969677,15.35140538923864,0.5408073615718578,Au,COMPLETE
4364,4.166666666666334,2026-04-07 11:35:53.682308,2026-04-07 11:35:54.389409,0 days 00:00:00.707101,32.60877195053555,15.474397095811188,0.1696679361944704,Au,PRUNED
4365,-1.0,2026-04-07 11:35:53.729386,2026-04-07 11:35:54.343641,0 days 00:00:00.614255,38.84806388248202,16.246999381271245,0.17046926638652926,Au,COMPLETE
4366,-1.0,2026-04-07 11:35:53.821668,2026-04-07 11:35:54.303502,0 days 00:00:00.481834,20.07166395583507,19.5516749911808,0.2707550457785444,Au,COMPLETE
4367,-1.0,2026-04-07 11:35:53.887691,2026-04-07 11:35:54.404802,0 days 00:00:00.517111,38.742202137769965,17.246230377565638,0.1235517203417677,Au,COMPLETE
4368,0.0,2026-04-07 11:35:54.051824,2026-04-07 11:35:54.552122,0 days 00:00:00.500298,20.75242149244372,17.538074616502914,0.6784606000401678,Au,PRUNED
4369,0.0,2026-04-07 11:35:54.072707,2026-04-07 11:35:54.638571,0 days 00:00:00.565864,34.461699940562525,19.841907167429053,0.13533113183490256,Au,PRUNED
4370,0.0,2026-04-07 11:35:54.192349,2026-04-07 11:35:55.153787,0 days 00:00:00.961438,21.03788926912048,18.435137359018867,0.23776823887746795,Au,PRUNED
4371,0.0,2026-04-07 11:35:54.471806,2026-04-07 11:35:55.498894,0 days 00:00:01.027088,20.516613487596505,18.03103762205881,0.42471870835939063,Au,PRUNED
4372,0.0,2026-04-07 11:35:54.492019,2026-04-07 11:35:55.369646,0 days 00:00:00.877627,21.23572542138105,17.5512873442031,0.631187984216917,Au,PRUNED
4373,0.0,2026-04-07 11:35:54.573835,2026-04-07 11:35:55.455175,0 days 00:00:00.881340,36.997935785068165,17.28025430699852,0.5584795299625426,Au,PRUNED
4374,-1.0,2026-04-07 11:35:54.595742,2026-04-07 11:35:55.266834,0 days 00:00:00.671092,40.14712337465029,18.217118224227946,0.5132123726793278,Au,COMPLETE
4375,-1.0,2026-04-07 11:35:54.620994,2026-04-07 11:35:55.105072,0 days 00:00:00.484078,102.47463795748331,1.0257952168927673,1.652217916605031,Cu,COMPLETE
4376,-1.0,2026-04-07 11:35:54.744083,2026-04-07 11:35:55.106073,0 days 00:00:00.361990,32.19131017537202,19.454073988810283,0.38316647714874963,Au,COMPLETE
4377,0.0,2026-04-07 11:35:54.770958,2026-04-07 11:35:55.367593,0 days 00:00:00.596635,31.80933495477344,19.821150116698455,0.4039293423517729,Au,PRUNED
4378,-1.0,2026-04-07 11:35:55.293932,2026-04-07 11:35:56.061985,0 days 00:00:00.768053,31.641692759810297,17.847249582434873,0.3958640952762116,Au,COMPLETE
4379,-1.0,2026-04-07 11:35:55.313944,2026-04-07 11:35:55.986160,0 days 00:00:00.672216,34.62406337903065,17.526785286542093,0.3786054210868622,Au,COMPLETE
4380,0.0,2026-04-07 11:35:55.470829,2026-04-07 11:35:56.664859,0 days 00:00:01.194030,20.556112366842935,16.64050832029287,0.2416879572987381,Au,PRUNED
4381,0.0,2026-04-07 11:35:55.624244,2026-04-07 11:35:56.304941,0 days 00:00:00.680697,20.592420565683486,16.105099128975507,0.47218901747004405,Au,PRUNED
4382,-1.0,2026-04-07 11:35:55.696549,2026-04-07 11:35:56.404730,0 days 00:00:00.708181,20.940679697852065,16.32332845884832,0.4182364176194538,Au,COMPLETE
4383,0.0,2026-04-07 11:35:55.726879,2026-04-07 11:35:56.606333,0 days 00:00:00.879454,34.86732699217913,17.468017723999644,0.6993267798297405,Au,PRUNED
4384,0.0,2026-04-07 11:35:55.718045,2026-04-07 11:35:56.523430,0 days 00:00:00.805385,20.58151827388396,17.87472129231469,0.6263072221994157,Au,PRUNED
4385,-1.0,2026-04-07 11:35:55.765295,2026-04-07 11:35:56.460633,0 days 00:00:00.695338,20.208034359653105,18.367813645630424,0.5194232254233607,Au,COMPLETE
4386,0.0,2026-04-07 11:35:56.066575,2026-04-07 11:35:56.987492,0 days 00:00:00.920917,20.869951235836155,15.723377814318145,0.25624566659558184,Au,PRUNED
4387,0.0,2026-04-07 11:35:56.201797,2026-04-07 11:35:57.038803,0 days 00:00:00.837006,34.85436276254005,19.99276077250228,0.8682540220832464,Au,PRUNED
4388,-417.27941176464446,2026-04-07 11:35:56.351978,2026-04-07 11:35:57.228254,0 days 00:00:00.876276,21.139298054344913,19.87465213861088,0.4310519630816694,Au,COMPLETE
4389,-1.0,2026-04-07 11:35:56.621187,2026-04-07 11:35:57.211442,0 days 00:00:00.590255,28.33295862697794,19.800672143693475,0.6352585771578962,Cu,COMPLETE
4390,-1.0,2026-04-07 11:35:56.644227,2026-04-07 11:35:57.270621,0 days 00:00:00.626394,53.87570970572965,19.955124722300003,0.3327417985150679,Au,COMPLETE
4391,-27.298850574708876,2026-04-07 11:35:56.668967,2026-04-07 11:35:57.447076,0 days 00:00:00.778109,29.078091393904113,19.957050587646716,0.38633253230350306,Ag,PRUNED
4392,-404.46428571422797,2026-04-07 11:35:56.758633,2026-04-07 11:35:57.363656,0 days 00:00:00.605023,20.55510874362972,19.84077262105012,0.7738167883920058,Au,COMPLETE
4393,0.0,2026-04-07 11:35:56.840122,2026-04-07 11:35:57.561390,0 days 00:00:00.721268,33.25888708860705,19.91688327695895,0.7314283435607025,Au,PRUNED
4394,-1.0,2026-04-07 11:35:57.062284,2026-04-07 11:35:57.775763,0 days 00:00:00.713479,37.69135854888465,19.658203739092297,0.21748597190081628,Au,COMPLETE
4395,-1.0,2026-04-07 11:35:57.150627,2026-04-07 11:35:57.891932,0 days 00:00:00.741305,20.005387030344778,18.254109950568917,1.0189169117503445,Au,COMPLETE
4396,-1.0,2026-04-07 11:35:57.366712,2026-04-07 11:35:57.995099,0 days 00:00:00.628387,20.873959913025068,19.23604766823119,0.10494229003654992,Au,COMPLETE
4397,-1.0,2026-04-07 11:35:57.424930,2026-04-07 11:35:57.996102,0 days 00:00:00.571172,20.19146657803282,19.269284300322493,0.44169389872070297,Au,COMPLETE
4398,0.0,2026-04-07 11:35:57.491580,2026-04-07 11:35:58.161663,0 days 00:00:00.670083,20.26675474412144,17.391877513654734,0.6311877122313323,Au,PRUNED
4399,-1.0,2026-04-07 11:35:57.530811,2026-04-07 11:35:58.098840,0 days 00:00:00.568029,32.30122191346855,17.659728357964436,1.109780300572146,Au,COMPLETE
4400,-1.0,2026-04-07 11:35:57.602791,2026-04-07 11:35:58.290748,0 days 00:00:00.687957,21.029113932524666,19.578834050417036,0.5279495550901753,Au,COMPLETE
4401,0.0,2026-04-07 11:35:57.827433,2026-04-07 11:35:58.622245,0 days 00:00:00.794812,32.35951917114779,19.845865121163722,1.01821553751293,Au,PRUNED
4402,-1.0,2026-04-07 11:35:57.953428,2026-04-07 11:35:58.661659,0 days 00:00:00.708231,31.746462510882925,17.33088250679039,0.7014119827303295,Au,COMPLETE
4403,-1.0,2026-04-07 11:35:58.102691,2026-04-07 11:35:58.708613,0 days 00:00:00.605922,22.001418739890113,17.345884598589624,0.489031367406553,Au,COMPLETE
4404,-1.0,2026-04-07 11:35:58.225770,2026-04-07 11:35:58.642190,0 days 00:00:00.416420,20.336344973532842,17.626360588571476,0.40954820761902466,Au,COMPLETE
4405,-1.0,2026-04-07 11:35:58.247623,2026-04-07 11:35:58.755340,0 days 00:00:00.507717,33.229870379394754,15.25791845523543,1.1329762334217137,Au,COMPLETE
4406,2.7777777777774073,2026-04-07 11:35:58.263606,2026-04-07 11:35:59.324565,0 days 00:00:01.060959,23.647035186944695,19.96411703173689,0.3172171315883593,Au,PRUNED
4407,0.0,2026-04-07 11:35:58.308853,2026-04-07 11:35:58.987609,0 days 00:00:00.678756,36.669121790404766,17.706079939776835,0.5718154641303983,Au,PRUNED
4408,-1.863143631436284,2026-04-07 11:35:58.512109,2026-04-07 11:35:59.349421,0 days 00:00:00.837312,113.44027185979027,9.482343132147431,0.11761213963869066,Ag,PRUNED
4409,0.0,2026-04-07 11:35:58.784231,2026-04-07 11:35:59.455918,0 days 00:00:00.671687,30.101624734248468,19.985435639460718,0.7562307682874302,Au,PRUNED
4410,-416.9730392156249,2026-04-07 11:35:58.860379,2026-04-07 11:35:59.832284,0 days 00:00:00.971905,20.715778806567126,19.913940332500676,0.7119332341729125,Au,COMPLETE
4411,0.0,2026-04-07 11:35:58.898533,2026-04-07 11:35:59.674355,0 days 00:00:00.775822,32.19585388791192,17.337690955439157,0.6644049437360865,Au,PRUNED
4412,-165.32258064515062,2026-04-07 11:35:58.966812,2026-04-07 11:36:00.066549,0 days 00:00:01.099737,23.43289141091973,16.169272862042607,0.3944959444304824,Cu,PRUNED
4413,0.0,2026-04-07 11:35:59.051617,2026-04-07 11:35:59.728384,0 days 00:00:00.676767,30.96374488826563,19.901280230436583,0.593219662060076,Au,PRUNED
4414,-444.66145833326385,2026-04-07 11:35:59.174667,2026-04-07 11:36:00.022832,0 days 00:00:00.848165,21.207131220268433,19.87380530139844,0.79389421173708,Au,COMPLETE
4415,-1.0,2026-04-07 11:35:59.514460,2026-04-07 11:35:59.959956,0 days 00:00:00.445496,22.718024417386047,19.97874039079063,0.5342904097038911,Au,COMPLETE
4416,0.0,2026-04-07 11:35:59.502062,2026-04-07 11:36:00.334319,0 days 00:00:00.832257,30.85155792794795,19.814284816066703,0.6539583307609301,Au,PRUNED
4417,-392.3611111110566,2026-04-07 11:35:59.460554,2026-04-07 11:36:00.596307,0 days 00:00:01.135753,20.134675418395876,19.792235770335846,1.0209114918017361,Au,COMPLETE
4418,-1.0,2026-04-07 11:35:59.826982,2026-04-07 11:36:00.551371,0 days 00:00:00.724389,53.41345342987471,19.50233396554268,0.6595127890221145,Au,COMPLETE
4419,0.0,2026-04-07 11:35:59.879097,2026-04-07 11:36:00.774409,0 days 00:00:00.895312,20.43956916234798,16.590089245115937,0.6366503397167352,Au,PRUNED
4420,-1.0,2026-04-07 11:36:00.037240,2026-04-07 11:36:00.667605,0 days 00:00:00.630365,33.67828196242827,19.824844849126354,0.7033481172049455,Au,COMPLETE
4421,-1.0,2026-04-07 11:36:00.085761,2026-04-07 11:36:00.769899,0 days 00:00:00.684138,33.14184289868308,17.45525766316668,0.7045127521297956,Au,COMPLETE
4422,0.0,2026-04-07 11:36:00.152210,2026-04-07 11:36:00.772904,0 days 00:00:00.620694,32.83252350822991,17.549008985932364,0.48160521866107947,Au,PRUNED
4423,-1.0,2026-04-07 11:36:00.253721,2026-04-07 11:36:00.880995,0 days 00:00:00.627274,20.382720281592224,19.871643749449422,0.2010898092775745,Au,COMPLETE
4424,0.0,2026-04-07 11:36:00.442135,2026-04-07 11:36:01.267733,0 days 00:00:00.825598,20.075942746156844,17.12530442503221,0.4920118664330056,Au,PRUNED
4425,0.0,2026-04-07 11:36:00.743522,2026-04-07 11:36:01.655441,0 days 00:00:00.911919,20.34259635687782,16.504669561761084,0.8045662564304495,Au,PRUNED
4426,-1.0,2026-04-07 11:36:00.798260,2026-04-07 11:36:01.330487,0 days 00:00:00.532227,35.72247321475434,19.974803718479997,0.4836170585284133,Au,COMPLETE
4427,0.0,2026-04-07 11:36:00.850259,2026-04-07 11:36:01.553098,0 days 00:00:00.702839,44.80161892988477,16.615569903954807,0.6545199467066427,Au,PRUNED
4428,0.0,2026-04-07 11:36:00.880995,2026-04-07 11:36:01.519171,0 days 00:00:00.638176,22.723163198621958,19.83271646774534,0.7252696903811549,Au,PRUNED
4429,-1.0,2026-04-07 11:36:00.894928,2026-04-07 11:36:01.425567,0 days 00:00:00.530639,46.76138853376295,14.497432471730038,0.7221096299794529,Au,COMPLETE
4430,-1.0,2026-04-07 11:36:01.164493,2026-04-07 11:36:01.860208,0 days 00:00:00.695715,30.220502925065084,19.928169673618452,0.5537311342065732,Au,COMPLETE
4431,-1.0,2026-04-07 11:36:01.249723,2026-04-07 11:36:01.655441,0 days 00:00:00.405718,33.09158909471989,19.977324704814684,0.7536229464187676,Au,COMPLETE
4432,-1.0,2026-04-07 11:36:01.535723,2026-04-07 11:36:02.257594,0 days 00:00:00.721871,23.569964966726193,19.898668273517732,0.7945034180967286,Au,COMPLETE
4433,0.0,2026-04-07 11:36:01.571273,2026-04-07 11:36:02.313454,0 days 00:00:00.742181,40.37889827590446,19.911634068238254,0.5235030028089334,Au,PRUNED
4434,-430.87121212114675,2026-04-07 11:36:01.617552,2026-04-07 11:36:02.376076,0 days 00:00:00.758524,20.645674790255224,19.87753547096989,1.0341832710469872,Au,COMPLETE
4435,-1.0,2026-04-07 11:36:01.597396,2026-04-07 11:36:02.189670,0 days 00:00:00.592274,30.85110976358051,19.964384434201353,0.8070352117891939,Au,COMPLETE
4436,-1.0,2026-04-07 11:36:01.691465,2026-04-07 11:36:02.504205,0 days 00:00:00.812740,33.745052082510156,16.747037227086643,0.4534214509364996,Au,COMPLETE
4437,-1.0,2026-04-07 11:36:01.865275,2026-04-07 11:36:02.300011,0 days 00:00:00.434736,83.85884432751438,12.74295609075733,1.5349218524442076,Cu,COMPLETE
4438,-1.0,2026-04-07 11:36:01.909327,2026-04-07 11:36:02.274219,0 days 00:00:00.364892,32.67628028051788,17.88219883572848,0.7535698031514246,Au,COMPLETE
4439,-1.0,2026-04-07 11:36:02.027585,2026-04-07 11:36:02.642116,0 days 00:00:00.614531,20.358769764930948,19.962813310894127,0.358216034141956,Au,COMPLETE
4440,82.40740740740496,2026-04-07 11:36:02.344254,2026-04-07 11:36:03.092053,0 days 00:00:00.747799,25.990827308103736,19.98791485025155,0.499832750305464,Au,PRUNED
4441,-1.0,2026-04-07 11:36:02.439911,2026-04-07 11:36:03.052070,0 days 00:00:00.612159,20.16004444662583,18.24359428887558,0.3414468785988367,Cu,COMPLETE
4442,-1.0,2026-04-07 11:36:02.532690,2026-04-07 11:36:03.204483,0 days 00:00:00.671793,21.08266384213088,17.632305624156036,0.8004053904673898,Au,COMPLETE
4443,0.0,2026-04-07 11:36:02.567110,2026-04-07 11:36:03.204483,0 days 00:00:00.637373,35.28676717612349,19.995043893696884,0.8168258516032315,Au,PRUNED
4444,0.0,2026-04-07 11:36:02.632817,2026-04-07 11:36:03.507467,0 days 00:00:00.874650,45.42709619287636,18.09362924840891,0.7541485174530211,Au,PRUNED
4445,-1.0,2026-04-07 11:36:02.659114,2026-04-07 11:36:03.332055,0 days 00:00:00.672941,30.264885647895596,19.979655538967574,1.0134930808541076,Au,COMPLETE
4446,-1.0,2026-04-07 11:36:02.807247,2026-04-07 11:36:03.729530,0 days 00:00:00.922283,20.72790303572317,19.678113579903574,0.838890733289007,Au,COMPLETE
4447,-1.0,2026-04-07 11:36:02.923089,2026-04-07 11:36:03.728207,0 days 00:00:00.805118,36.4921970086661,14.901576552396936,0.8987013998839049,Au,COMPLETE
4448,-1.0,2026-04-07 11:36:03.223217,2026-04-07 11:36:03.864928,0 days 00:00:00.641711,34.541011038684445,17.76208990892205,0.9307096259500396,Au,COMPLETE
4449,0.0,2026-04-07 11:36:03.279420,2026-04-07 11:36:03.982916,0 days 00:00:00.703496,31.479737570626334,19.837066386320984,0.6393320843800099,Au,PRUNED
4450,-1.0,2026-04-07 11:36:03.335574,2026-04-07 11:36:03.891210,0 days 00:00:00.555636,46.60631460537395,17.029900230229554,0.7758181524567238,Au,COMPLETE
4451,-12.626262626261097,2026-04-07 11:36:03.447170,2026-04-07 11:36:04.403277,0 days 00:00:00.956107,52.12516925779479,1.1875572842306799,1.2313067108877491,Cu,PRUNED
4452,-382.93650793645565,2026-04-07 11:36:03.614787,2026-04-07 11:36:04.261511,0 days 00:00:00.646724,20.823178181278983,19.98502867055114,0.12021584157742873,Au,COMPLETE
4453,-1.0,2026-04-07 11:36:03.574201,2026-04-07 11:36:04.155250,0 days 00:00:00.581049,21.183730285133883,17.35203850979546,0.535679044848444,Au,COMPLETE
4454,0.0,2026-04-07 11:36:03.989796,2026-04-07 11:36:04.795679,0 days 00:00:00.805883,30.545933460770005,19.996818644272203,0.983200552837996,Au,PRUNED
4455,-1.0,2026-04-07 11:36:03.980316,2026-04-07 11:36:04.611760,0 days 00:00:00.631444,20.105836677178704,17.665331908764202,0.6432415178310777,Au,COMPLETE
4456,-1.0,2026-04-07 11:36:04.043375,2026-04-07 11:36:04.685286,0 days 00:00:00.641911,32.043502315655026,16.517583889668764,0.8980579659189661,Au,COMPLETE
4457,-1.0,2026-04-07 11:36:04.095662,2026-04-07 11:36:04.544149,0 days 00:00:00.448487,34.09815295438108,15.009796213290763,0.7261632385398363,Au,COMPLETE
4458,-1.0,2026-04-07 11:36:04.313777,2026-04-07 11:36:04.779465,0 days 00:00:00.465688,20.24630579998088,19.68409373468857,0.7133620763421092,Au,COMPLETE
4459,-1.0,2026-04-07 11:36:04.385673,2026-04-07 11:36:05.060848,0 days 00:00:00.675175,20.31596268153298,19.347112049501135,0.7872629972254894,Au,COMPLETE
4460,-1.0,2026-04-07 11:36:04.470651,2026-04-07 11:36:05.060848,0 days 00:00:00.590197,31.728507626473515,13.795160651948478,0.6480202889138607,Au,COMPLETE
4461,-1.0,2026-04-07 11:36:04.491469,2026-04-07 11:36:05.194290,0 days 00:00:00.702821,33.5711586392518,18.09017159703593,0.9083748644229532,Au,COMPLETE
4462,-1.0,2026-04-07 11:36:04.815460,2026-04-07 11:36:05.314802,0 days 00:00:00.499342,20.241479460183736,14.134871094482225,0.41272281999769495,Au,COMPLETE
4463,-401.30023640656185,2026-04-07 11:36:04.835063,2026-04-07 11:36:05.452128,0 days 00:00:00.617065,20.060722573602725,19.98680610483056,0.9898733042424706,Au,COMPLETE
4464,0.0,2026-04-07 11:36:04.860797,2026-04-07 11:36:05.639830,0 days 00:00:00.779033,37.9198031669863,19.847319928425335,0.6182392037598337,Au,PRUNED
4465,0.0,2026-04-07 11:36:04.885639,2026-04-07 11:36:05.687130,0 days 00:00:00.801491,32.685369740722734,17.774506531286626,0.9842424118550319,Au,PRUNED
4466,-1.0,2026-04-07 11:36:05.009758,2026-04-07 11:36:05.563811,0 days 00:00:00.554053,45.51659154199508,13.820723531918714,0.11866396542812674,Cu,COMPLETE
4467,-1.0,2026-04-07 11:36:05.225172,2026-04-07 11:36:05.879699,0 days 00:00:00.654527,26.317736373430023,19.523380681404536,0.7824475265457727,Ag,COMPLETE
4468,-1.0,2026-04-07 11:36:05.303731,2026-04-07 11:36:05.774112,0 days 00:00:00.470381,20.367669302421735,18.360085140058075,0.6410230095049708,Au,COMPLETE
4469,-1.0,2026-04-07 11:36:05.367774,2026-04-07 11:36:06.074175,0 days 00:00:00.706401,20.78318085040228,17.54496405080123,0.8465509895142335,Au,COMPLETE
4470,1.1904761904760544,2026-04-07 11:36:05.554572,2026-04-07 11:36:06.420014,0 days 00:00:00.865442,30.25326039103437,15.056172636199701,0.7945215139873015,Au,PRUNED
4471,0.0,2026-04-07 11:36:05.644069,2026-04-07 11:36:06.555942,0 days 00:00:00.911873,39.473690840918586,19.941702253952748,0.9354614690791252,Au,PRUNED
4472,-1.0,2026-04-07 11:36:05.701304,2026-04-07 11:36:06.279803,0 days 00:00:00.578499,58.20308373473015,19.695774714053563,0.29373068093987875,Cu,COMPLETE
4473,-1.0,2026-04-07 11:36:05.751285,2026-04-07 11:36:06.275201,0 days 00:00:00.523916,21.15800783202709,19.920446354782623,1.0567683564329267,Au,COMPLETE
4474,80.55555555555317,2026-04-07 11:36:05.777120,2026-04-07 11:36:06.545305,0 days 00:00:00.768185,30.47985486042299,17.50107404801156,0.727876030165326,Au,PRUNED
4475,-16.84397163120424,2026-04-07 11:36:06.085471,2026-04-07 11:36:07.187657,0 days 00:00:01.102186,33.67021582196148,17.105881173730776,1.0746109913215953,Ag,PRUNED
4476,0.0,2026-04-07 11:36:06.215786,2026-04-07 11:36:06.936435,0 days 00:00:00.720649,20.049049160841175,15.443624575967306,0.9870375909737974,Au,PRUNED
