number,value,datetime_start,datetime_complete,duration,params_D2_nm,params_D3_nm,params_D4_nm,params_metal,state
5034,82.72058823529169,2026-04-07 11:37:08.265953,2026-04-07 11:37:09.257732,0 days 00:00:00.991779,24.877274415250422,19.984916000117337,0.5278824452629828,Au,PRUNED
5035,-27.77777777777037,2026-04-07 11:37:08.327661,2026-04-07 11:37:09.258733,0 days 00:00:00.931072,55.18133806650857,5.467576525823825,1.3311072564575146,Ag,PRUNED
5036,-1.0,2026-04-07 11:37:08.364896,2026-04-07 11:37:09.175593,0 days 00:00:00.810697,30.49387799313243,17.340487099147246,0.6870563514168682,Au,COMPLETE
5037,0.0,2026-04-07 11:37:08.376803,2026-04-07 11:37:09.516917,0 days 00:00:01.140114,35.129644566776776,19.936532466891727,0.7199005351659206,Au,PRUNED
5038,-1.0,2026-04-07 11:37:08.584743,2026-04-07 11:37:09.126824,0 days 00:00:00.542081,21.773462526156752,16.74764198989068,0.6142758324835736,Au,COMPLETE
5039,-1.0,2026-04-07 11:37:08.932838,2026-04-07 11:37:09.665470,0 days 00:00:00.732632,33.292062205372815,17.68447623684299,0.6144017590323715,Au,COMPLETE
5040,-1.0,2026-04-07 11:37:08.957788,2026-04-07 11:37:09.747985,0 days 00:00:00.790197,20.1101497626608,17.30262863694316,0.5949279512523937,Au,COMPLETE
5041,-1.0,2026-04-07 11:37:09.100002,2026-04-07 11:37:09.870044,0 days 00:00:00.770042,21.81467714363167,17.530516385665912,0.46790280756106417,Au,COMPLETE
5042,-1.0,2026-04-07 11:37:09.270967,2026-04-07 11:37:10.039274,0 days 00:00:00.768307,29.90230005762193,19.78751229616372,0.6145817316460899,Au,COMPLETE
5043,-1.0,2026-04-07 11:37:09.319967,2026-04-07 11:37:09.930981,0 days 00:00:00.611014,94.50804726867585,11.258339034069246,1.3816225791106962,Ag,COMPLETE
5044,-366.83006535942866,2026-04-07 11:37:09.358187,2026-04-07 11:37:10.149768,0 days 00:00:00.791581,20.44585380780736,19.84235428320897,0.3775634720964317,Au,COMPLETE
5045,0.0,2026-04-07 11:37:09.390500,2026-04-07 11:37:10.075272,0 days 00:00:00.684772,20.733172817412225,17.09080583064267,0.4984309362576436,Au,PRUNED
5046,-1.0,2026-04-07 11:37:09.684075,2026-04-07 11:37:10.263598,0 days 00:00:00.579523,24.4112807129359,19.93660856067559,0.7050714453566765,Au,COMPLETE
5047,-1.0,2026-04-07 11:37:09.779893,2026-04-07 11:37:10.477108,0 days 00:00:00.697215,21.011299762597965,17.558336963562795,0.8336696077858999,Au,COMPLETE
5048,-1.0,2026-04-07 11:37:09.900208,2026-04-07 11:37:10.523384,0 days 00:00:00.623176,21.601614758273527,19.86296919929354,0.34676619885885795,Au,COMPLETE
5049,-1.0,2026-04-07 11:37:10.076267,2026-04-07 11:37:10.626781,0 days 00:00:00.550514,30.884288074841873,19.920660283616026,0.43817936687021897,Au,COMPLETE
5050,0.0,2026-04-07 11:37:10.175267,2026-04-07 11:37:10.950181,0 days 00:00:00.774914,28.657525046610896,19.949797127853138,0.4949162087761777,Au,PRUNED
5051,0.0,2026-04-07 11:37:10.202699,2026-04-07 11:37:11.005517,0 days 00:00:00.802818,31.654000504678223,19.74281465832921,0.6657713432629409,Au,PRUNED
5052,0.0,2026-04-07 11:37:10.163256,2026-04-07 11:37:11.158132,0 days 00:00:00.994876,35.7689826389358,19.828338545178866,0.7654988421976328,Au,PRUNED
5053,-1.0,2026-04-07 11:37:10.414274,2026-04-07 11:37:11.047830,0 days 00:00:00.633556,20.642796426531007,19.916652288544732,0.3067624433393872,Au,COMPLETE
5054,-1.0,2026-04-07 11:37:10.476572,2026-04-07 11:37:11.235557,0 days 00:00:00.758985,22.61505923710265,19.833597612068292,0.7153283987203307,Au,COMPLETE
5055,-1.0,2026-04-07 11:37:10.705329,2026-04-07 11:37:11.442654,0 days 00:00:00.737325,21.598168231462747,19.925611204632084,0.7977700284103336,Au,COMPLETE
5056,-1.0,2026-04-07 11:37:10.758482,2026-04-07 11:37:11.459501,0 days 00:00:00.701019,35.203910130409966,17.795574519792527,0.4563940879953539,Au,COMPLETE
5057,-1.0,2026-04-07 11:37:10.782524,2026-04-07 11:37:11.459501,0 days 00:00:00.676977,45.6232170232021,17.57460514599154,0.5279190502040396,Au,COMPLETE
5058,-1.0,2026-04-07 11:37:11.070847,2026-04-07 11:37:11.597544,0 days 00:00:00.526697,36.99396464336676,17.524477461121705,0.7664698951328265,Au,COMPLETE
5059,0.0,2026-04-07 11:37:11.086115,2026-04-07 11:37:11.763605,0 days 00:00:00.677490,22.79082721599141,19.920602731164536,0.623885855363637,Au,PRUNED
5060,0.0,2026-04-07 11:37:11.161840,2026-04-07 11:37:11.959332,0 days 00:00:00.797492,20.221134180587526,15.449947658057372,0.7043917787050944,Au,PRUNED
5061,0.0,2026-04-07 11:37:11.307847,2026-04-07 11:37:11.957827,0 days 00:00:00.649980,20.54308230274532,17.783456919776373,0.6922217916006163,Au,PRUNED
5062,0.0,2026-04-07 11:37:11.490394,2026-04-07 11:37:12.522118,0 days 00:00:01.031724,31.494282137151828,19.839009402667994,0.7648760613893718,Au,PRUNED
5063,-1.0,2026-04-07 11:37:11.579121,2026-04-07 11:37:12.307946,0 days 00:00:00.728825,22.031902834434263,19.892710943951556,0.5526031940132162,Au,COMPLETE
5064,0.0,2026-04-07 11:37:11.642427,2026-04-07 11:37:12.447267,0 days 00:00:00.804840,20.02528256136194,18.08383623761637,0.3991121125463084,Au,PRUNED
5065,0.0,2026-04-07 11:37:11.687475,2026-04-07 11:37:12.521120,0 days 00:00:00.833645,27.45330084250144,19.99732228856678,0.6503628655765952,Au,PRUNED
5066,-386.13013698624883,2026-04-07 11:37:11.863588,2026-04-07 11:37:12.611736,0 days 00:00:00.748148,20.280475205446223,19.910545652753594,0.6785623217811084,Au,COMPLETE
5067,1.633986928104447,2026-04-07 11:37:11.897685,2026-04-07 11:37:12.906646,0 days 00:00:01.008961,35.22555372047139,13.927184543477559,0.31755865837417363,Au,PRUNED
5068,-1.0,2026-04-07 11:37:12.129033,2026-04-07 11:37:12.522118,0 days 00:00:00.393085,32.93170702762609,15.244278168380534,0.8484835678751065,Au,COMPLETE
5069,-1.0,2026-04-07 11:37:12.156347,2026-04-07 11:37:13.001987,0 days 00:00:00.845640,20.367403576899374,17.687475178026197,0.6645167521482228,Au,COMPLETE
5070,-1.0,2026-04-07 11:37:12.443744,2026-04-07 11:37:13.282180,0 days 00:00:00.838436,22.07652878243409,17.54717556141077,0.6601698955516921,Cu,COMPLETE
5071,0.0,2026-04-07 11:37:12.656756,2026-04-07 11:37:13.531643,0 days 00:00:00.874887,36.333198333528046,17.71693313556005,0.6073004953563964,Au,PRUNED
5072,0.0,2026-04-07 11:37:12.656756,2026-04-07 11:37:13.453678,0 days 00:00:00.796922,48.85945621116686,17.942490055270422,0.8775366331640416,Au,PRUNED
5073,0.0,2026-04-07 11:37:12.783119,2026-04-07 11:37:13.678804,0 days 00:00:00.895685,31.232033830570614,19.986221447635707,0.5805947480968037,Au,PRUNED
5074,0.0,2026-04-07 11:37:12.833223,2026-04-07 11:37:13.759575,0 days 00:00:00.926352,39.826208941200555,19.97169140867461,0.6055190660850637,Au,PRUNED
5075,0.0,2026-04-07 11:37:12.936206,2026-04-07 11:37:13.774530,0 days 00:00:00.838324,45.91658879587408,18.128216623505192,0.755879333042404,Au,PRUNED
5076,-441.2144702841686,2026-04-07 11:37:13.005834,2026-04-07 11:37:13.873090,0 days 00:00:00.867256,20.93437616734004,19.886691923944976,0.942648174800223,Au,COMPLETE
5077,-1.0,2026-04-07 11:37:13.276073,2026-04-07 11:37:14.199515,0 days 00:00:00.923442,117.31354198916011,6.177495141391175,0.7418866247480822,Cu,COMPLETE
5078,0.0,2026-04-07 11:37:13.536154,2026-04-07 11:37:14.458117,0 days 00:00:00.921963,34.566342318849976,17.930776417688957,0.7172220165804422,Au,PRUNED
5079,80.55555555555317,2026-04-07 11:37:13.559794,2026-04-07 11:37:14.687327,0 days 00:00:01.127533,30.60511990898419,17.719080393567562,0.5916607732808339,Au,PRUNED
5080,-1.0,2026-04-07 11:37:13.647350,2026-04-07 11:37:14.355194,0 days 00:00:00.707844,20.23301680900803,18.94211166322266,0.6605141171073284,Au,COMPLETE
5081,0.0,2026-04-07 11:37:13.806795,2026-04-07 11:37:14.635847,0 days 00:00:00.829052,35.83478775112825,17.18094620160798,0.7050424069748193,Au,PRUNED
5082,-6.410256410255424,2026-04-07 11:37:13.916274,2026-04-07 11:37:14.731197,0 days 00:00:00.814923,22.1692835605854,19.903102068783824,0.5673602173397724,Au,PRUNED
5083,-416.9730392156249,2026-04-07 11:37:13.951752,2026-04-07 11:37:14.537971,0 days 00:00:00.586219,21.113949246567117,19.859325026554615,0.44021797391877987,Au,COMPLETE
5084,-1.0,2026-04-07 11:37:14.117991,2026-04-07 11:37:14.811668,0 days 00:00:00.693677,21.80884522776845,17.17120108134,0.6229856613267472,Au,COMPLETE
5085,0.0,2026-04-07 11:37:14.413916,2026-04-07 11:37:15.125591,0 days 00:00:00.711675,20.182642293386113,19.537221274305132,0.5022186941159447,Au,PRUNED
5086,-1.0,2026-04-07 11:37:14.506945,2026-04-07 11:37:15.126639,0 days 00:00:00.619694,20.965360846208252,15.278960086143352,0.5730903691136281,Au,COMPLETE
5087,-1.0,2026-04-07 11:37:14.600394,2026-04-07 11:37:15.404483,0 days 00:00:00.804089,42.81825752892901,19.318075974269895,0.3028134693012584,Ag,COMPLETE
5088,0.0,2026-04-07 11:37:14.752212,2026-04-07 11:37:15.502567,0 days 00:00:00.750355,20.576932510286266,16.970528658050895,0.42029754196957403,Au,PRUNED
5089,0.0,2026-04-07 11:37:14.764227,2026-04-07 11:37:15.621947,0 days 00:00:00.857720,30.609387072940947,19.92051486612604,0.2748921002270323,Au,PRUNED
5090,-14.756944444443215,2026-04-07 11:37:14.784414,2026-04-07 11:37:15.447996,0 days 00:00:00.663582,31.865128968722182,17.236556779791844,0.7354837074608078,Ag,PRUNED
5091,-1.0,2026-04-07 11:37:14.814975,2026-04-07 11:37:15.500145,0 days 00:00:00.685170,33.90494991108195,19.945223531183675,0.7989453959317967,Au,COMPLETE
5092,0.0,2026-04-07 11:37:15.083489,2026-04-07 11:37:15.760535,0 days 00:00:00.677046,30.82990066898355,17.89045361532519,0.7492239063591526,Au,PRUNED
5093,-1.0,2026-04-07 11:37:15.203335,2026-04-07 11:37:15.846939,0 days 00:00:00.643604,20.49967378937975,16.37902743511148,0.7419938916259831,Au,COMPLETE
5094,-1.0,2026-04-07 11:37:15.292674,2026-04-07 11:37:15.922757,0 days 00:00:00.630083,30.779039579607463,18.116880112588305,0.7742808585612477,Au,COMPLETE
5095,-0.664010624169976,2026-04-07 11:37:15.557054,2026-04-07 11:37:16.400376,0 days 00:00:00.843322,77.24120436533336,9.564984388770782,1.3280912095892454,Au,PRUNED
5096,-1.0,2026-04-07 11:37:15.585557,2026-04-07 11:37:16.151036,0 days 00:00:00.565479,66.97720730774633,5.37971047162125,1.0888735097542923,Ag,COMPLETE
5097,-1.0,2026-04-07 11:37:15.685537,2026-04-07 11:37:16.435321,0 days 00:00:00.749784,20.641493422006285,17.375122989171274,0.692601403565512,Au,COMPLETE
5098,0.0,2026-04-07 11:37:15.807446,2026-04-07 11:37:16.513358,0 days 00:00:00.705912,20.49234710953488,17.077534643297934,0.8953028169557893,Au,PRUNED
5099,0.0,2026-04-07 11:37:15.765972,2026-04-07 11:37:16.568816,0 days 00:00:00.802844,32.51884641436976,17.64055241806411,0.6421185215058618,Au,PRUNED
5100,-1.0,2026-04-07 11:37:15.844939,2026-04-07 11:37:16.822548,0 days 00:00:00.977609,34.59442618126165,17.67695312607709,0.8853177732700745,Au,COMPLETE
5101,0.0,2026-04-07 11:37:16.108752,2026-04-07 11:37:16.836021,0 days 00:00:00.727269,20.732527753066964,17.91977519130586,0.7677332966389295,Au,PRUNED
5102,-0.850340136054408,2026-04-07 11:37:16.155623,2026-04-07 11:37:17.180663,0 days 00:00:01.025040,92.67325956852177,19.13429380295745,0.3258815615106757,Cu,PRUNED
5103,-1.0,2026-04-07 11:37:16.317590,2026-04-07 11:37:17.006056,0 days 00:00:00.688466,32.520418034378835,19.923048292504998,0.3695177875376844,Au,COMPLETE
5104,-1.0,2026-04-07 11:37:16.464951,2026-04-07 11:37:17.035951,0 days 00:00:00.571000,20.914216285929204,17.52112218900728,0.6246471976642027,Au,COMPLETE
5105,-1.0,2026-04-07 11:37:16.615586,2026-04-07 11:37:17.176485,0 days 00:00:00.560899,35.60084434692131,17.711548158852697,0.6420095003474878,Au,COMPLETE
5106,-427.00501253126436,2026-04-07 11:37:16.701263,2026-04-07 11:37:17.425322,0 days 00:00:00.724059,20.787741881133243,19.966734179624634,0.7308721610919522,Au,COMPLETE
5107,-1.0,2026-04-07 11:37:16.746897,2026-04-07 11:37:17.574277,0 days 00:00:00.827380,31.538801244492912,19.93555333912152,0.8493151550904771,Au,COMPLETE
5108,0.0,2026-04-07 11:37:16.947657,2026-04-07 11:37:17.773276,0 days 00:00:00.825619,33.80879740577185,17.663176446200797,0.11021317133079661,Au,PRUNED
5109,-1.0,2026-04-07 11:37:17.068657,2026-04-07 11:37:17.728305,0 days 00:00:00.659648,46.88871746457362,17.722109237527924,0.7154564556478681,Au,COMPLETE
5110,-401.30023640656185,2026-04-07 11:37:17.243636,2026-04-07 11:37:17.938621,0 days 00:00:00.694985,20.786069000230107,19.824683598081737,0.5522553000157027,Au,COMPLETE
5111,-1.0,2026-04-07 11:37:17.331524,2026-04-07 11:37:17.993289,0 days 00:00:00.661765,20.12681025875992,14.348730332634172,0.4244854083158866,Au,COMPLETE
5112,-16.666666666664764,2026-04-07 11:37:17.397659,2026-04-07 11:37:18.234864,0 days 00:00:00.837205,29.825378850650804,13.966524604694547,0.368246301931691,Au,PRUNED
5113,-1.0,2026-04-07 11:37:17.491649,2026-04-07 11:37:18.166805,0 days 00:00:00.675156,20.06927141198377,16.608646601333575,0.31741115338114845,Au,COMPLETE
5114,0.0,2026-04-07 11:37:17.586350,2026-04-07 11:37:18.316793,0 days 00:00:00.730443,35.393934515794946,19.847798607521824,0.7763191601484187,Au,PRUNED
5115,-1.0,2026-04-07 11:37:17.847264,2026-04-07 11:37:18.337433,0 days 00:00:00.490169,118.46683744168169,1.4560916061639322,1.4327174400829996,Cu,COMPLETE
5116,0.0,2026-04-07 11:37:17.896507,2026-04-07 11:37:18.606908,0 days 00:00:00.710401,35.66026263747874,19.921209926342645,0.3753926699551269,Au,PRUNED
5117,-2.976190476190051,2026-04-07 11:37:17.917635,2026-04-07 11:37:18.541431,0 days 00:00:00.623796,34.5622603747414,19.89338148723692,0.7039223917877391,Ag,PRUNED
5118,0.0,2026-04-07 11:37:18.111313,2026-04-07 11:37:19.013331,0 days 00:00:00.902018,35.324361684367815,19.809820419268284,0.8247342777912837,Au,PRUNED
5119,-1.0,2026-04-07 11:37:18.208534,2026-04-07 11:37:19.014639,0 days 00:00:00.806105,32.54543918521441,17.994840424805687,0.5363518881354045,Au,COMPLETE
5120,0.0,2026-04-07 11:37:18.316793,2026-04-07 11:37:19.107456,0 days 00:00:00.790663,20.41697249038554,17.727701254412807,0.6506389202570957,Au,PRUNED
5121,-1.0,2026-04-07 11:37:18.397647,2026-04-07 11:37:19.105379,0 days 00:00:00.707732,20.035825585061882,17.113298024734547,0.19411170842936398,Au,COMPLETE
5122,0.0,2026-04-07 11:37:18.439549,2026-04-07 11:37:19.342458,0 days 00:00:00.902909,32.95224637881116,17.253482644932625,0.9149022564560491,Au,PRUNED
5123,0.0,2026-04-07 11:37:18.543994,2026-04-07 11:37:19.196963,0 days 00:00:00.652969,41.760804122816225,19.74926856574049,0.8372467362564104,Au,PRUNED
5124,-1.0,2026-04-07 11:37:18.633618,2026-04-07 11:37:19.254267,0 days 00:00:00.620649,44.32091846624692,17.728080322925543,0.5713962407866271,Au,COMPLETE
5125,0.0,2026-04-07 11:37:18.800842,2026-04-07 11:37:19.627967,0 days 00:00:00.827125,31.796341615734605,19.93542762768899,0.17061838619031927,Au,PRUNED
5126,-1.0,2026-04-07 11:37:19.138997,2026-04-07 11:37:20.061895,0 days 00:00:00.922898,20.267508128835967,18.488546359918345,0.43108629606084886,Au,COMPLETE
5127,-1.0,2026-04-07 11:37:19.202788,2026-04-07 11:37:19.735153,0 days 00:00:00.532365,20.040219096517088,19.867318284894914,0.8042622801077102,Au,COMPLETE
5128,-1.0,2026-04-07 11:37:19.254774,2026-04-07 11:37:20.077167,0 days 00:00:00.822393,20.787352468981492,17.734630156937136,0.8989767787731783,Au,COMPLETE
5129,-1.0,2026-04-07 11:37:19.268899,2026-04-07 11:37:19.956855,0 days 00:00:00.687956,33.26823171643308,16.89097432143786,0.5212304657616439,Au,COMPLETE
5130,-1.0,2026-04-07 11:37:19.219604,2026-04-07 11:37:20.061304,0 days 00:00:00.841700,30.32538781304438,17.52943910366079,0.8334191072822524,Au,COMPLETE
5131,0.0,2026-04-07 11:37:19.432474,2026-04-07 11:37:20.187598,0 days 00:00:00.755124,20.102017334204483,18.018205456619064,0.8187357034278625,Au,PRUNED
5132,-1.0,2026-04-07 11:37:19.633598,2026-04-07 11:37:20.512472,0 days 00:00:00.878874,29.57776609133343,19.979566865087314,0.3774433089777574,Au,COMPLETE
5133,0.0,2026-04-07 11:37:19.712028,2026-04-07 11:37:20.580362,0 days 00:00:00.868334,45.561409403316986,17.35263943421841,0.30789494231630776,Au,PRUNED
5134,0.0,2026-04-07 11:37:19.815717,2026-04-07 11:37:20.436939,0 days 00:00:00.621222,34.66862532985529,19.808484603185292,0.7932611793780652,Au,PRUNED
5135,0.0,2026-04-07 11:37:20.023727,2026-04-07 11:37:20.817204,0 days 00:00:00.793477,30.923719288066174,19.948300754857755,0.9809580274363742,Au,PRUNED
5136,-1.0,2026-04-07 11:37:20.179143,2026-04-07 11:37:21.002500,0 days 00:00:00.823357,20.57149263931517,13.729822964490612,0.7050308093481134,Ag,COMPLETE
5137,-1.0,2026-04-07 11:37:20.254961,2026-04-07 11:37:21.167962,0 days 00:00:00.913001,22.043287329665606,19.93268875739431,0.4813537957853007,Au,COMPLETE
5138,-0.8538251366120079,2026-04-07 11:37:20.295189,2026-04-07 11:37:21.274407,0 days 00:00:00.979218,58.35353793969597,17.868286289553286,0.5849114790556718,Cu,PRUNED
5139,79.98783454987601,2026-04-07 11:37:20.347063,2026-04-07 11:37:21.226715,0 days 00:00:00.879652,29.51132601277267,19.904097872741694,0.5489340870732741,Cu,PRUNED
5140,-1.0,2026-04-07 11:37:20.682228,2026-04-07 11:37:21.371526,0 days 00:00:00.689298,24.735155813520866,19.872328446083955,0.7983118557441609,Cu,COMPLETE
5141,-1.0,2026-04-07 11:37:20.736106,2026-04-07 11:37:21.289154,0 days 00:00:00.553048,35.57615296215049,19.983541814690046,0.6557185197565458,Au,COMPLETE
5142,4.084967320261118,2026-04-07 11:37:20.766509,2026-04-07 11:37:21.462767,0 days 00:00:00.696258,32.43978862785343,15.062372684954845,0.6501216443043162,Au,PRUNED
5143,-1.0,2026-04-07 11:37:21.043734,2026-04-07 11:37:21.750697,0 days 00:00:00.706963,20.443103109660257,16.3139839907661,0.8621543543920319,Au,COMPLETE
5144,-1.0,2026-04-07 11:37:21.115385,2026-04-07 11:37:21.833217,0 days 00:00:00.717832,30.68660161714709,19.91560942724961,0.35151513084821806,Au,COMPLETE
5145,0.0,2026-04-07 11:37:21.373778,2026-04-07 11:37:22.021850,0 days 00:00:00.648072,21.871662373498797,13.948273940812966,0.8489147616734203,Au,PRUNED
5146,0.0,2026-04-07 11:37:21.422354,2026-04-07 11:37:21.969652,0 days 00:00:00.547298,20.318957779032235,17.047527980873607,0.8503926170360808,Au,PRUNED
5147,-1.0,2026-04-07 11:37:21.462767,2026-04-07 11:37:22.419628,0 days 00:00:00.956861,23.26324223722643,19.8031957699485,0.6928985064220621,Au,COMPLETE
5148,-1.0,2026-04-07 11:37:21.604513,2026-04-07 11:37:22.386085,0 days 00:00:00.781572,30.75166317827604,16.894900215649027,0.3613460452988725,Au,COMPLETE
5149,-1.0,2026-04-07 11:37:21.629734,2026-04-07 11:37:22.420630,0 days 00:00:00.790896,32.61112125881981,17.6551446442761,0.8544199960791883,Au,COMPLETE
5150,-6.3559322033894,2026-04-07 11:37:21.653820,2026-04-07 11:37:22.559724,0 days 00:00:00.905904,29.762865351521995,1.077483880908412,1.9014362550077364,Au,PRUNED
5151,0.0,2026-04-07 11:37:22.024949,2026-04-07 11:37:22.805299,0 days 00:00:00.780350,31.965907224298665,19.70231343853757,0.8731432770104934,Au,PRUNED
5152,0.0,2026-04-07 11:37:22.077602,2026-04-07 11:37:22.746732,0 days 00:00:00.669130,33.973349214568806,17.741504478681005,0.8674291492384569,Au,PRUNED
5153,-395.3962703962157,2026-04-07 11:37:22.096777,2026-04-07 11:37:22.790192,0 days 00:00:00.693415,20.584454520316104,19.636697545933092,0.8630506859268066,Au,COMPLETE
5154,-417.27941176464446,2026-04-07 11:37:22.113261,2026-04-07 11:37:22.747732,0 days 00:00:00.634471,21.236129504144845,19.562257131296285,0.70327098807977,Au,COMPLETE
5155,-1.0,2026-04-07 11:37:22.573461,2026-04-07 11:37:23.354083,0 days 00:00:00.780622,31.326746405407253,19.978553359423973,0.5858606577690515,Au,COMPLETE
5156,-1.0,2026-04-07 11:37:22.623142,2026-04-07 11:37:23.481368,0 days 00:00:00.858226,51.17839154149891,19.914025867867736,0.8262842619591403,Au,COMPLETE
5157,-1.0,2026-04-07 11:37:22.663043,2026-04-07 11:37:23.501048,0 days 00:00:00.838005,20.820807374593333,16.978538291592983,0.5320581933177033,Au,COMPLETE
5158,-1.0,2026-04-07 11:37:22.702380,2026-04-07 11:37:23.510767,0 days 00:00:00.808387,20.7252973503643,19.515744263379542,0.5454162750696266,Au,COMPLETE
5159,-1.0,2026-04-07 11:37:22.843895,2026-04-07 11:37:23.379685,0 days 00:00:00.535790,30.51349735564793,17.2427846084352,0.34269359851568765,Au,COMPLETE
5160,0.0,2026-04-07 11:37:23.013320,2026-04-07 11:37:23.591919,0 days 00:00:00.578599,20.785064261034307,17.21566527907546,0.35547840525158453,Au,PRUNED
5161,-315.4761904761544,2026-04-07 11:37:23.066309,2026-04-07 11:37:23.650240,0 days 00:00:00.583931,21.516968993433842,19.981568595581546,0.709879047576277,Cu,PRUNED
5162,0.0,2026-04-07 11:37:23.094517,2026-04-07 11:37:23.564375,0 days 00:00:00.469858,39.07274691564561,19.773434551622834,0.5729327375101293,Au,PRUNED
5163,-1.0,2026-04-07 11:37:23.486892,2026-04-07 11:37:24.099855,0 days 00:00:00.612963,86.16989893639669,12.210809533283602,1.952687120669208,Cu,COMPLETE
5164,81.7901234567877,2026-04-07 11:37:23.688187,2026-04-07 11:37:24.648859,0 days 00:00:00.960672,27.212623929700882,19.868635148132707,0.1275343541173191,Au,PRUNED
5165,-1.0,2026-04-07 11:37:23.699270,2026-04-07 11:37:24.468657,0 days 00:00:00.769387,20.87975907061588,18.053853893017024,0.38248856490483374,Au,COMPLETE
5166,0.0,2026-04-07 11:37:23.719873,2026-04-07 11:37:24.511455,0 days 00:00:00.791582,29.804117834591786,19.94458234590597,0.8600994289664323,Au,PRUNED
5167,0.0,2026-04-07 11:37:23.728063,2026-04-07 11:37:24.425722,0 days 00:00:00.697659,34.6323180111553,19.97469639521361,0.6807456128777262,Au,PRUNED
5168,-1.0,2026-04-07 11:37:23.732085,2026-04-07 11:37:24.337256,0 days 00:00:00.605171,20.538344625352597,16.675374390230193,0.11829139765949542,Au,COMPLETE
5169,0.0,2026-04-07 11:37:23.776298,2026-04-07 11:37:24.619818,0 days 00:00:00.843520,20.99405836338717,17.389373160401632,0.7832128835353084,Au,PRUNED
5170,-404.7619047618469,2026-04-07 11:37:23.798115,2026-04-07 11:37:24.851907,0 days 00:00:01.053792,20.88260488413089,19.614875192940087,0.7869475809146076,Au,COMPLETE
5171,-1.0,2026-04-07 11:37:24.215373,2026-04-07 11:37:25.105343,0 days 00:00:00.889970,81.14704870402129,1.683370786744062,0.9730525214185557,Au,COMPLETE
5172,0.0,2026-04-07 11:37:24.534895,2026-04-07 11:37:25.321360,0 days 00:00:00.786465,20.994420324633925,17.3697784229631,0.9900422118905989,Au,PRUNED
5173,-1.0,2026-04-07 11:37:24.588706,2026-04-07 11:37:25.270885,0 days 00:00:00.682179,39.532792174822134,19.99889495237768,0.9429913653489757,Au,COMPLETE
