number,value,datetime_start,datetime_complete,duration,params_D2_nm,params_D3_nm,params_D4_nm,params_metal,state
4617,-1.0,2026-04-07 11:36:21.681998,2026-04-07 11:36:22.397641,0 days 00:00:00.715643,36.29373195494806,19.781424438110715,0.6604487518929569,Au,COMPLETE
4618,0.0,2026-04-07 11:36:21.741534,2026-04-07 11:36:22.466807,0 days 00:00:00.725273,20.392464275354843,18.953009479919043,0.7205159321755574,Au,PRUNED
4619,-1.0,2026-04-07 11:36:22.074980,2026-04-07 11:36:22.779587,0 days 00:00:00.704607,21.065996585927248,17.102177429699257,0.31264877067799035,Au,COMPLETE
4620,-1.0,2026-04-07 11:36:22.101989,2026-04-07 11:36:22.732569,0 days 00:00:00.630580,21.377756052467127,19.8140178328061,0.662564231798878,Au,COMPLETE
4621,-0.9842519685039215,2026-04-07 11:36:22.191153,2026-04-07 11:36:22.832968,0 days 00:00:00.641815,75.88449155307259,18.555240874402404,1.2601004406274259,Ag,PRUNED
4622,79.62962962962726,2026-04-07 11:36:22.125128,2026-04-07 11:36:23.028797,0 days 00:00:00.903669,33.04647725607773,16.633934651364928,0.740121391062186,Au,PRUNED
4623,-6.818181818181322,2026-04-07 11:36:22.408783,2026-04-07 11:36:23.046962,0 days 00:00:00.638179,30.182659019821095,1.6745639701753188,1.6844444310071345,Cu,PRUNED
4624,-1.0,2026-04-07 11:36:22.510973,2026-04-07 11:36:23.164733,0 days 00:00:00.653760,20.728126561141938,17.286576936488878,0.4423210381156255,Au,COMPLETE
4625,0.0,2026-04-07 11:36:22.641491,2026-04-07 11:36:23.232826,0 days 00:00:00.591335,32.11210162677679,17.530639327728423,0.8340244414145219,Au,PRUNED
4626,0.0,2026-04-07 11:36:22.660666,2026-04-07 11:36:23.593586,0 days 00:00:00.932920,33.76907675492876,19.89272190294553,0.8144702230269514,Au,PRUNED
4627,-400.70921985809935,2026-04-07 11:36:22.915799,2026-04-07 11:36:23.552772,0 days 00:00:00.636973,20.91918382426808,19.99725678647219,0.24024302107739098,Au,COMPLETE
4628,-1.0,2026-04-07 11:36:22.952823,2026-04-07 11:36:23.578389,0 days 00:00:00.625566,22.478118169940792,19.918053938859156,0.6135888173156784,Au,COMPLETE
4629,0.0,2026-04-07 11:36:22.969005,2026-04-07 11:36:23.796508,0 days 00:00:00.827503,21.60365304023244,13.748135570225681,0.644590712473341,Au,PRUNED
4630,-1.0,2026-04-07 11:36:23.228192,2026-04-07 11:36:23.674040,0 days 00:00:00.445848,20.80496059847189,18.37879299503615,0.7685346453930973,Au,COMPLETE
4631,-1.0,2026-04-07 11:36:23.274054,2026-04-07 11:36:23.873326,0 days 00:00:00.599272,47.309562938845126,17.847871384303378,0.7808324967724996,Au,COMPLETE
4632,0.0,2026-04-07 11:36:23.299010,2026-04-07 11:36:24.361728,0 days 00:00:01.062718,20.2446449063611,15.211737197431393,0.6814818030459919,Au,PRUNED
4633,80.24691358024454,2026-04-07 11:36:23.361435,2026-04-07 11:36:24.031369,0 days 00:00:00.669934,32.29627783428512,17.256699343459882,0.20228610566207733,Au,PRUNED
4634,-1.0,2026-04-07 11:36:23.728560,2026-04-07 11:36:24.356425,0 days 00:00:00.627865,20.34885719869327,19.748902213303246,0.6931107694368747,Au,COMPLETE
4635,-9.9999999999984,2026-04-07 11:36:23.808431,2026-04-07 11:36:24.534840,0 days 00:00:00.726409,22.02120590036721,19.986710188571102,0.41959773492128216,Au,PRUNED
4636,-1.0,2026-04-07 11:36:23.835875,2026-04-07 11:36:24.480059,0 days 00:00:00.644184,35.802941638683535,16.37532971539946,0.6093235308636394,Cu,COMPLETE
4637,-0.8741258741258496,2026-04-07 11:36:23.957545,2026-04-07 11:36:24.590534,0 days 00:00:00.632989,53.51997784337918,13.716509005200404,0.2002036767626834,Au,PRUNED
4638,-392.07175925920484,2026-04-07 11:36:23.986204,2026-04-07 11:36:24.590534,0 days 00:00:00.604330,20.095287725553177,19.946754805755198,0.8749756456806799,Au,COMPLETE
4639,-1.0,2026-04-07 11:36:24.200496,2026-04-07 11:36:25.046448,0 days 00:00:00.845952,20.314475103238447,17.018307240473032,0.6075990013775927,Au,COMPLETE
4640,0.0,2026-04-07 11:36:24.238582,2026-04-07 11:36:25.233960,0 days 00:00:00.995378,20.051610077914965,17.690846704153785,0.49215963194219764,Au,PRUNED
4641,-437.4999999999331,2026-04-07 11:36:24.503444,2026-04-07 11:36:25.298340,0 days 00:00:00.794896,20.801919158259068,19.981458707110292,0.85883627689182,Au,COMPLETE
4642,0.0,2026-04-07 11:36:24.610338,2026-04-07 11:36:25.193048,0 days 00:00:00.582710,38.23749272488413,19.874546174578725,0.8161344479563168,Au,PRUNED
4643,-434.16030534344486,2026-04-07 11:36:24.687626,2026-04-07 11:36:25.422326,0 days 00:00:00.734700,21.36755901883754,19.828861384058122,0.5307789556669417,Au,COMPLETE
4644,-1.0,2026-04-07 11:36:24.743320,2026-04-07 11:36:25.373166,0 days 00:00:00.629846,21.07827134786989,19.778758263569838,0.4987051180597052,Au,COMPLETE
4645,0.0,2026-04-07 11:36:24.805270,2026-04-07 11:36:25.488841,0 days 00:00:00.683571,28.93463932116274,19.981305159671216,0.8048700549839692,Au,PRUNED
4646,-1.0,2026-04-07 11:36:24.828697,2026-04-07 11:36:25.436789,0 days 00:00:00.608092,33.74037008733164,19.88038538450418,0.498224408764243,Au,COMPLETE
4647,-1.0,2026-04-07 11:36:25.284223,2026-04-07 11:36:26.094869,0 days 00:00:00.810646,20.680206777915757,15.074731836744231,0.9148722503143688,Au,COMPLETE
4648,-1.0,2026-04-07 11:36:25.301351,2026-04-07 11:36:25.970366,0 days 00:00:00.669015,33.505686960313255,16.78548882159004,0.357597481885291,Au,COMPLETE
4649,-1.0,2026-04-07 11:36:25.391745,2026-04-07 11:36:26.082049,0 days 00:00:00.690304,114.4801462031215,19.183616101895403,1.5204197533994157,Ag,COMPLETE
4650,-1.0,2026-04-07 11:36:25.554606,2026-04-07 11:36:26.010371,0 days 00:00:00.455765,31.942539624374042,18.187929473799024,0.35995000761618184,Au,COMPLETE
4651,0.0,2026-04-07 11:36:25.614820,2026-04-07 11:36:26.562415,0 days 00:00:00.947595,40.443654097422474,19.84667992026031,0.23827989409144146,Au,PRUNED
4652,81.17283950617043,2026-04-07 11:36:25.632299,2026-04-07 11:36:26.187203,0 days 00:00:00.554904,30.887176991044008,17.381886860499915,0.35294251182046416,Au,PRUNED
4653,-153.0303030302919,2026-04-07 11:36:25.639997,2026-04-07 11:36:26.214935,0 days 00:00:00.574938,23.768895812054172,19.16010601148687,0.3494367357397883,Ag,PRUNED
4654,-1.0,2026-04-07 11:36:25.657644,2026-04-07 11:36:26.312178,0 days 00:00:00.654534,79.5289654933593,19.729024136491454,0.6998545166110619,Ag,COMPLETE
4655,0.0,2026-04-07 11:36:26.042821,2026-04-07 11:36:26.560823,0 days 00:00:00.518002,20.905011101067128,16.86288718479941,0.3696363978111278,Au,PRUNED
4656,3.9308176100625967,2026-04-07 11:36:26.111255,2026-04-07 11:36:27.091248,0 days 00:00:00.979993,37.81665557234028,13.894896352456893,0.410786679616091,Au,PRUNED
4657,0.0,2026-04-07 11:36:26.244580,2026-04-07 11:36:26.902072,0 days 00:00:00.657492,29.2061872103649,19.76189667513879,0.1319412999038435,Au,PRUNED
4658,0.0,2026-04-07 11:36:26.216442,2026-04-07 11:36:27.146361,0 days 00:00:00.929919,36.892363039871114,17.30513699319846,0.1675391121365991,Au,PRUNED
4659,-430.5555555554903,2026-04-07 11:36:26.462613,2026-04-07 11:36:27.353048,0 days 00:00:00.890435,21.163530984899214,19.908829865376447,0.5338280821361512,Au,COMPLETE
4660,0.0,2026-04-07 11:36:26.494002,2026-04-07 11:36:27.211955,0 days 00:00:00.717953,21.271063989659037,17.76208766061954,0.39983367088502786,Au,PRUNED
4661,0.0,2026-04-07 11:36:26.669921,2026-04-07 11:36:27.490335,0 days 00:00:00.820414,20.034684016212253,17.37789941978322,0.6715051648280436,Au,PRUNED
4662,-1.0,2026-04-07 11:36:26.705083,2026-04-07 11:36:27.322575,0 days 00:00:00.617492,32.14619806366779,17.178861486845513,0.3930064104739899,Au,COMPLETE
4663,-1.0,2026-04-07 11:36:26.768887,2026-04-07 11:36:27.408914,0 days 00:00:00.640027,78.34094719333166,9.747335194497456,1.3363906909694219,Cu,COMPLETE
4664,0.0,2026-04-07 11:36:27.011579,2026-04-07 11:36:27.625106,0 days 00:00:00.613527,37.53416152707089,19.755029570204872,0.4812258506480724,Au,PRUNED
4665,80.55555555555317,2026-04-07 11:36:27.226125,2026-04-07 11:36:28.370567,0 days 00:00:01.144442,30.888142335161383,17.682206995259303,0.36556982053781295,Au,PRUNED
4666,-12.681159420288752,2026-04-07 11:36:27.288414,2026-04-07 11:36:28.193547,0 days 00:00:00.905133,52.028044791162735,5.18814058762803,1.902122389888595,Cu,PRUNED
4667,0.0,2026-04-07 11:36:27.340244,2026-04-07 11:36:28.084259,0 days 00:00:00.744015,38.16275809008976,19.893030824230884,0.49412570220255503,Au,PRUNED
4668,0.0,2026-04-07 11:36:27.543144,2026-04-07 11:36:28.414430,0 days 00:00:00.871286,20.377279832658996,16.759849666315677,0.6714188769044586,Au,PRUNED
4669,-1.0,2026-04-07 11:36:27.557409,2026-04-07 11:36:28.241707,0 days 00:00:00.684298,66.64385100595403,11.337128510582435,1.048831529578252,Au,COMPLETE
4670,-1.0,2026-04-07 11:36:27.626106,2026-04-07 11:36:28.256054,0 days 00:00:00.629948,31.29202198778087,18.233584969038425,0.40249094177058303,Au,COMPLETE
4671,-1.0,2026-04-07 11:36:27.665913,2026-04-07 11:36:28.281211,0 days 00:00:00.615298,32.82903971939808,17.423550578532286,0.38172491894608607,Au,COMPLETE
4672,-0.5910165484633402,2026-04-07 11:36:27.711428,2026-04-07 11:36:28.126354,0 days 00:00:00.414926,21.625429322432325,8.002304035392727,1.2135422930670856,Cu,PRUNED
4673,-1.0,2026-04-07 11:36:28.183813,2026-04-07 11:36:28.753005,0 days 00:00:00.569192,20.71032749827067,19.791181071080242,0.49430963056435717,Au,COMPLETE
4674,-23.611111111107963,2026-04-07 11:36:28.300118,2026-04-07 11:36:29.056186,0 days 00:00:00.756068,27.600902757358966,19.799798969323366,0.48747408213194027,Ag,PRUNED
4675,-1.0,2026-04-07 11:36:28.386183,2026-04-07 11:36:29.089608,0 days 00:00:00.703425,30.86433074226364,19.932810556884696,0.5273919220764846,Au,COMPLETE
4676,0.0,2026-04-07 11:36:28.400360,2026-04-07 11:36:29.022662,0 days 00:00:00.622302,32.15704123198834,19.967067357430388,0.7563502808929512,Au,PRUNED
4677,0.0,2026-04-07 11:36:28.428672,2026-04-07 11:36:29.134925,0 days 00:00:00.706253,20.14788721707247,19.59884181706656,0.37063373837360364,Au,PRUNED
4678,0.0,2026-04-07 11:36:28.434567,2026-04-07 11:36:29.191117,0 days 00:00:00.756550,26.684699481051233,19.779901273943306,0.6641690335723492,Au,PRUNED
4679,-295.0450450450131,2026-04-07 11:36:28.452881,2026-04-07 11:36:29.544219,0 days 00:00:01.091338,21.19647612815707,19.83304702300268,0.5408037064223157,Cu,PRUNED
4680,-1.0,2026-04-07 11:36:28.568331,2026-04-07 11:36:29.316119,0 days 00:00:00.747788,23.257786266501412,19.910823669622378,0.5997765494070433,Au,COMPLETE
4681,-1.0,2026-04-07 11:36:29.023847,2026-04-07 11:36:29.741331,0 days 00:00:00.717484,34.15269603936375,19.885081007988713,0.7387696652708107,Au,COMPLETE
4682,-1.0,2026-04-07 11:36:29.138440,2026-04-07 11:36:29.771996,0 days 00:00:00.633556,35.739384763439126,19.685920808544694,0.34147880354085114,Au,COMPLETE
4683,0.0,2026-04-07 11:36:29.094286,2026-04-07 11:36:29.964222,0 days 00:00:00.869936,20.308885382974445,16.31695600902246,0.3559606453236769,Au,PRUNED
4684,-1.0,2026-04-07 11:36:29.267657,2026-04-07 11:36:29.844327,0 days 00:00:00.576670,33.0990040593691,19.753028912653562,0.3161347855870691,Au,COMPLETE
4685,-1.0,2026-04-07 11:36:29.296263,2026-04-07 11:36:29.845832,0 days 00:00:00.549569,39.41955239615069,19.957018419144934,0.17584216308624379,Au,COMPLETE
4686,0.0,2026-04-07 11:36:29.272181,2026-04-07 11:36:30.026033,0 days 00:00:00.753852,33.91494185958062,19.814109348198414,0.17226153316005366,Au,PRUNED
4687,0.0,2026-04-07 11:36:29.594108,2026-04-07 11:36:30.522730,0 days 00:00:00.928622,36.340050410561844,19.86939446304907,0.3614063136063899,Au,PRUNED
4688,0.0,2026-04-07 11:36:29.647976,2026-04-07 11:36:30.569209,0 days 00:00:00.921233,33.52833955725903,17.447105634332797,0.47843935467633325,Au,PRUNED
4689,-1.0,2026-04-07 11:36:29.967946,2026-04-07 11:36:30.837167,0 days 00:00:00.869221,39.52077438029522,14.791253542459787,0.5299012436943086,Ag,COMPLETE
4690,-1.0,2026-04-07 11:36:30.011072,2026-04-07 11:36:30.757161,0 days 00:00:00.746089,40.24398332714982,17.193118164175438,0.4471601770324587,Ag,COMPLETE
4691,-1.0,2026-04-07 11:36:30.023032,2026-04-07 11:36:30.865454,0 days 00:00:00.842422,32.80984112644506,15.992880741635563,0.5160829272168058,Au,COMPLETE
4692,-1.0,2026-04-07 11:36:30.054424,2026-04-07 11:36:30.684553,0 days 00:00:00.630129,32.101011873972425,17.840897111040015,0.5785358015974905,Au,COMPLETE
4693,0.0,2026-04-07 11:36:30.091775,2026-04-07 11:36:30.838169,0 days 00:00:00.746394,20.24766472021686,14.68066474876592,0.610805390992418,Au,PRUNED
4694,-1.0,2026-04-07 11:36:30.118980,2026-04-07 11:36:30.758169,0 days 00:00:00.639189,32.6428226153019,19.922563069353874,0.5891523692196601,Au,COMPLETE
4695,-1.0,2026-04-07 11:36:30.604758,2026-04-07 11:36:31.368576,0 days 00:00:00.763818,20.678174787378868,19.682819850461062,0.6250405144184792,Au,COMPLETE
4696,0.0,2026-04-07 11:36:30.679988,2026-04-07 11:36:31.123153,0 days 00:00:00.443165,35.08015744498512,17.868319756789234,0.6463319751459078,Au,PRUNED
4697,0.0,2026-04-07 11:36:30.786730,2026-04-07 11:36:31.607773,0 days 00:00:00.821043,118.7401340130537,15.87106655471079,0.5054291990265535,Cu,PRUNED
4698,0.0,2026-04-07 11:36:30.833294,2026-04-07 11:36:31.558022,0 days 00:00:00.724728,21.075892026576618,17.95300252813482,0.5662130046982541,Au,PRUNED
4699,80.55555555555317,2026-04-07 11:36:31.089087,2026-04-07 11:36:31.872620,0 days 00:00:00.783533,31.356940856379364,17.012806590977288,0.6369121406614504,Au,PRUNED
4700,-1.0,2026-04-07 11:36:31.108625,2026-04-07 11:36:31.903846,0 days 00:00:00.795221,20.84121402114319,16.765360418169895,0.3568049738507111,Au,COMPLETE
4701,0.0,2026-04-07 11:36:31.172640,2026-04-07 11:36:32.144314,0 days 00:00:00.971674,31.53674799667801,19.760605366051568,0.6327976700164619,Au,PRUNED
4702,0.0,2026-04-07 11:36:31.214093,2026-04-07 11:36:31.749961,0 days 00:00:00.535868,21.64041035053879,17.086736825675754,0.5760394495031818,Au,PRUNED
4703,-1.0,2026-04-07 11:36:31.229014,2026-04-07 11:36:31.933702,0 days 00:00:00.704688,30.14416846989247,17.328207694045734,0.7446619211376988,Au,COMPLETE
4704,-1.0,2026-04-07 11:36:31.559541,2026-04-07 11:36:32.324408,0 days 00:00:00.764867,20.87921249466855,19.164383967707384,0.45949037118724584,Au,COMPLETE
4705,0.0,2026-04-07 11:36:31.645657,2026-04-07 11:36:32.324993,0 days 00:00:00.679336,43.42504215771616,19.9439809447717,0.6657778424474019,Au,PRUNED
4706,0.0,2026-04-07 11:36:31.659783,2026-04-07 11:36:32.266748,0 days 00:00:00.606965,37.03202507280665,19.904723137498394,0.8327170039964032,Au,PRUNED
4707,-1.0,2026-04-07 11:36:31.857928,2026-04-07 11:36:32.365671,0 days 00:00:00.507743,34.03554957544975,14.376694098192747,0.586104392383799,Au,COMPLETE
4708,-1.0,2026-04-07 11:36:31.938235,2026-04-07 11:36:32.809975,0 days 00:00:00.871740,31.504954448174168,18.10174889911712,0.6677879839051795,Cu,COMPLETE
4709,0.0,2026-04-07 11:36:32.133255,2026-04-07 11:36:32.939195,0 days 00:00:00.805940,20.240750005798628,16.538669591675234,0.5942026709820768,Au,PRUNED
4710,-1.0,2026-04-07 11:36:32.263079,2026-04-07 11:36:32.952292,0 days 00:00:00.689213,38.41200035880139,19.639807231928337,0.6561460047574765,Au,COMPLETE
4711,-1.0,2026-04-07 11:36:32.424026,2026-04-07 11:36:33.051752,0 days 00:00:00.627726,111.97749457630508,19.619637157044508,1.4849353281059603,Au,COMPLETE
4712,-1.0,2026-04-07 11:36:32.436947,2026-04-07 11:36:33.121981,0 days 00:00:00.685034,20.765877395238014,19.716733445307547,0.7735195829437784,Au,COMPLETE
4713,-1.0,2026-04-07 11:36:32.325999,2026-04-07 11:36:33.091626,0 days 00:00:00.765627,36.00121209933259,19.9808223026778,0.5559787436951851,Au,COMPLETE
4714,-1.0,2026-04-07 11:36:32.537609,2026-04-07 11:36:33.052877,0 days 00:00:00.515268,20.0892648176965,18.39749525099865,0.527419990928715,Au,COMPLETE
4715,0.0,2026-04-07 11:36:32.669335,2026-04-07 11:36:33.331324,0 days 00:00:00.661989,34.31074510788766,19.687284528046845,0.6578984611678336,Au,PRUNED
4716,0.0,2026-04-07 11:36:32.969287,2026-04-07 11:36:33.780665,0 days 00:00:00.811378,20.06336540377249,17.03955648669672,0.5142762535425063,Au,PRUNED
4717,0.0,2026-04-07 11:36:32.989126,2026-04-07 11:36:33.783223,0 days 00:00:00.794097,35.738029151162486,17.81284425380601,0.568613100242881,Au,PRUNED
4718,-1.0,2026-04-07 11:36:33.047496,2026-04-07 11:36:33.783223,0 days 00:00:00.735727,50.639789191980356,19.19442262770814,0.833253994357443,Ag,COMPLETE
4719,-1.0,2026-04-07 11:36:33.332323,2026-04-07 11:36:33.923542,0 days 00:00:00.591219,20.281150855247876,18.363822177736942,0.7041662870195762,Au,COMPLETE
4720,80.24691358024454,2026-04-07 11:36:33.364033,2026-04-07 11:36:34.026260,0 days 00:00:00.662227,31.336143957922552,17.18550402606823,0.7531788173833925,Au,PRUNED
4721,72.2422062350099,2026-04-07 11:36:33.389461,2026-04-07 11:36:34.154824,0 days 00:00:00.765363,37.4059237421375,18.285171453885976,0.7111687817783254,Cu,PRUNED
4722,-1.0,2026-04-07 11:36:33.427150,2026-04-07 11:36:33.923542,0 days 00:00:00.496392,20.292762586606578,17.9889866054342,0.45690527807510173,Au,COMPLETE
4723,-1.0,2026-04-07 11:36:33.493399,2026-04-07 11:36:34.350483,0 days 00:00:00.857084,29.68953633374199,19.990581022408406,0.2770400815386179,Au,COMPLETE
4724,-1.0,2026-04-07 11:36:33.867342,2026-04-07 11:36:34.443431,0 days 00:00:00.576089,23.28857802122568,19.90059310358433,0.5059673003579359,Au,COMPLETE
4725,-0.5868544600938801,2026-04-07 11:36:33.884931,2026-04-07 11:36:34.673763,0 days 00:00:00.788832,49.50317859869858,15.712961886415744,0.4679538835374511,Au,PRUNED
4726,0.0,2026-04-07 11:36:33.956476,2026-04-07 11:36:34.957100,0 days 00:00:01.000624,33.45600430257956,19.903329645368853,0.7228476420944968,Au,PRUNED
4727,-1.0,2026-04-07 11:36:34.124243,2026-04-07 11:36:34.663761,0 days 00:00:00.539518,36.791034821950035,19.959552388719928,0.807646049468129,Au,COMPLETE
4728,-1.0,2026-04-07 11:36:34.189501,2026-04-07 11:36:34.634643,0 days 00:00:00.445142,20.727239572299887,18.344902845346777,0.7461673490301916,Au,COMPLETE
4729,-1.0,2026-04-07 11:36:34.209508,2026-04-07 11:36:34.741630,0 days 00:00:00.532122,27.020890590989318,19.920703172081446,0.5227820756153508,Au,COMPLETE
4730,-1.0,2026-04-07 11:36:34.243791,2026-04-07 11:36:34.828532,0 days 00:00:00.584741,34.12534915870879,19.872652669306575,0.5064352461159758,Au,COMPLETE
4731,0.0,2026-04-07 11:36:34.502131,2026-04-07 11:36:35.312453,0 days 00:00:00.810322,29.60288639865773,19.958795264699962,0.70327204196397,Au,PRUNED
4732,-374.99999999994964,2026-04-07 11:36:34.583002,2026-04-07 11:36:35.547732,0 days 00:00:00.964730,20.786045404585916,19.716255758047225,0.33685873572647496,Au,COMPLETE
4733,0.0,2026-04-07 11:36:34.745621,2026-04-07 11:36:35.564364,0 days 00:00:00.818743,20.276962004446084,17.36420593031152,0.5872225506689446,Au,PRUNED
4734,-1.0,2026-04-07 11:36:34.882923,2026-04-07 11:36:35.550754,0 days 00:00:00.667831,29.719181147079027,19.975571457459626,0.5836689470254631,Au,COMPLETE
4735,0.0,2026-04-07 11:36:34.913986,2026-04-07 11:36:35.838884,0 days 00:00:00.924898,30.985857596841303,19.869637687470675,0.4440033051878011,Au,PRUNED
4736,0.0,2026-04-07 11:36:35.016960,2026-04-07 11:36:35.542555,0 days 00:00:00.525595,20.18679264608815,15.466207832052142,0.6483187747752723,Au,PRUNED
4737,-1.0,2026-04-07 11:36:35.051976,2026-04-07 11:36:35.672520,0 days 00:00:00.620544,34.40871244319048,19.934300873868356,0.7073293901944951,Au,COMPLETE
4738,81.17283950617043,2026-04-07 11:36:35.081485,2026-04-07 11:36:35.647440,0 days 00:00:00.565955,28.619091112232454,18.30557761975731,0.8042012436261211,Au,PRUNED
4739,80.86419753086179,2026-04-07 11:36:35.391861,2026-04-07 11:36:36.502223,0 days 00:00:01.110362,30.058550283571535,17.787834300213294,0.6498874379250611,Au,PRUNED
4740,-1.0,2026-04-07 11:36:35.647440,2026-04-07 11:36:36.514991,0 days 00:00:00.867551,110.86729907910802,12.002365338688797,0.655242232859152,Ag,COMPLETE
4741,-1.0,2026-04-07 11:36:35.722721,2026-04-07 11:36:36.374838,0 days 00:00:00.652117,20.416169339660517,18.984818185534742,0.5569630895398102,Au,COMPLETE
4742,0.0,2026-04-07 11:36:35.776538,2026-04-07 11:36:36.365022,0 days 00:00:00.588484,20.338261402738766,19.584570957104802,0.3007196819766048,Au,PRUNED
4743,0.0,2026-04-07 11:36:35.810115,2026-04-07 11:36:36.632951,0 days 00:00:00.822836,20.213209983514954,19.023650513359836,0.6577619499814343,Au,PRUNED
4744,0.0,2026-04-07 11:36:35.841087,2026-04-07 11:36:36.777744,0 days 00:00:00.936657,56.929701089488745,19.971580807881512,0.880405135425331,Au,PRUNED
4745,0.0,2026-04-07 11:36:35.954013,2026-04-07 11:36:36.433930,0 days 00:00:00.479917,32.64427451551479,19.74388006237814,0.40295572717629585,Au,PRUNED
4746,-1.0,2026-04-07 11:36:36.007326,2026-04-07 11:36:36.561510,0 days 00:00:00.554184,20.18306781636247,19.038716195739042,0.7893826527655075,Au,COMPLETE
4747,-6.172839506171925,2026-04-07 11:36:36.438006,2026-04-07 11:36:37.292650,0 days 00:00:00.854644,21.964670453069633,19.948964482425083,0.7949325397113435,Au,PRUNED
4748,-0.6802721088435263,2026-04-07 11:36:36.580970,2026-04-07 11:36:37.245963,0 days 00:00:00.664993,100.61386726383793,8.857956201816478,0.9025086467734809,Au,PRUNED
4749,0.0,2026-04-07 11:36:36.655414,2026-04-07 11:36:37.747332,0 days 00:00:01.091918,44.32527262855227,17.695618430977543,0.8827308121147843,Au,PRUNED
4750,-1.0,2026-04-07 11:36:36.676090,2026-04-07 11:36:37.526276,0 days 00:00:00.850186,20.869111136745303,19.917484850072224,0.6732955325383798,Au,COMPLETE
4751,-375.2777777777274,2026-04-07 11:36:36.725072,2026-04-07 11:36:37.521176,0 days 00:00:00.796104,20.157098041271052,19.740270933382483,0.8449901869140751,Au,COMPLETE
4752,0.0,2026-04-07 11:36:36.778746,2026-04-07 11:36:37.438721,0 days 00:00:00.659975,33.38683769032754,17.17241351615858,0.8873777986087075,Au,PRUNED
4753,-166.6666666666559,2026-04-07 11:36:36.829187,2026-04-07 11:36:37.895392,0 days 00:00:01.066205,23.104643792597084,16.506230246575445,0.5689001374171843,Cu,PRUNED
4754,-444.98697916659717,2026-04-07 11:36:36.872862,2026-04-07 11:36:37.558335,0 days 00:00:00.685473,21.32124390958463,19.917053398872824,0.693241127177108,Au,COMPLETE
4755,-1.0,2026-04-07 11:36:37.349196,2026-04-07 11:36:37.956557,0 days 00:00:00.607361,32.83463561888182,17.201704389012523,0.607515012670408,Au,COMPLETE
