number,value,datetime_start,datetime_complete,duration,params_D2_nm,params_D3_nm,params_D4_nm,params_metal,state
2530,-8.01282051281928,2026-04-07 11:32:45.315820,2026-04-07 11:32:45.857755,0 days 00:00:00.541935,20.499098909430497,19.956569645487132,1.6059825031782904,Au,PRUNED
2531,-1.0,2026-04-07 11:32:45.488738,2026-04-07 11:32:45.932895,0 days 00:00:00.444157,21.03710801529133,17.723743976579808,0.9307101485870994,Au,COMPLETE
2532,0.0,2026-04-07 11:32:45.525059,2026-04-07 11:32:46.369618,0 days 00:00:00.844559,32.691475434936535,18.279814498533096,1.299025181466294,Au,PRUNED
2533,1.436781609195204,2026-04-07 11:32:45.619421,2026-04-07 11:32:46.165323,0 days 00:00:00.545902,22.76907361256424,19.223519164613457,1.31972457978599,Au,PRUNED
2534,-405.0595238094659,2026-04-07 11:32:45.890474,2026-04-07 11:32:46.465925,0 days 00:00:00.575451,20.853956809790876,19.15712115321251,1.3652992747956108,Au,COMPLETE
2535,-1.0,2026-04-07 11:32:45.952194,2026-04-07 11:32:46.565753,0 days 00:00:00.613559,100.44199754409257,5.488676270418262,1.3716572603218464,Cu,COMPLETE
2536,-327.94117647054986,2026-04-07 11:32:46.017726,2026-04-07 11:32:46.714012,0 days 00:00:00.696286,22.377384668111507,17.13643199424165,1.1157656763050592,Au,COMPLETE
2537,-382.03828828823663,2026-04-07 11:32:45.995742,2026-04-07 11:32:46.564413,0 days 00:00:00.568671,20.550769758038484,18.976616872758033,1.476057296432334,Au,COMPLETE
2538,0.0,2026-04-07 11:32:46.076171,2026-04-07 11:32:46.667138,0 days 00:00:00.590967,37.23676502380725,16.91948972744167,1.1449915100569172,Au,PRUNED
2539,-1.0,2026-04-07 11:32:46.145087,2026-04-07 11:32:46.729816,0 days 00:00:00.584729,21.590053139377133,18.78155181737738,1.2670923836703842,Au,COMPLETE
2540,-1.0,2026-04-07 11:32:46.267494,2026-04-07 11:32:46.792670,0 days 00:00:00.525176,33.30199058796134,16.196181781123407,1.361407636538999,Au,COMPLETE
2541,-314.3939393939037,2026-04-07 11:32:46.468446,2026-04-07 11:32:47.092212,0 days 00:00:00.623766,21.915993221459363,17.505960152418155,0.7649520193384639,Au,COMPLETE
2542,-373.6203090507236,2026-04-07 11:32:46.644115,2026-04-07 11:32:47.308637,0 days 00:00:00.664522,20.813941765956443,18.799458991852774,1.323268658259717,Au,COMPLETE
2543,-300.54644808739874,2026-04-07 11:32:46.687326,2026-04-07 11:32:47.556074,0 days 00:00:00.868748,21.878377907276093,16.95927118938855,1.0033922935699713,Au,COMPLETE
2544,-1.0,2026-04-07 11:32:46.783513,2026-04-07 11:32:47.307619,0 days 00:00:00.524106,20.11209381955507,17.9336373430561,1.2758989993186547,Au,COMPLETE
2545,-1.0,2026-04-07 11:32:46.849266,2026-04-07 11:32:47.309646,0 days 00:00:00.460380,21.29317688727783,19.086869284259837,1.3391545683463832,Au,COMPLETE
2546,-1.0,2026-04-07 11:32:46.833244,2026-04-07 11:32:47.419934,0 days 00:00:00.586690,20.100598405842266,18.614354731340278,1.5437674181256764,Au,COMPLETE
2547,0.0,2026-04-07 11:32:46.888136,2026-04-07 11:32:47.477984,0 days 00:00:00.589848,20.737036954499626,18.32570863706236,0.7305829636885546,Au,PRUNED
2548,-4.310344827585612,2026-04-07 11:32:46.939569,2026-04-07 11:32:47.493926,0 days 00:00:00.554357,24.366622559680778,18.39089756371854,0.5564590437880491,Au,PRUNED
2549,-1.0,2026-04-07 11:32:47.232218,2026-04-07 11:32:47.666973,0 days 00:00:00.434755,34.33054391130986,19.954681259045145,1.3769724018963556,Au,COMPLETE
2550,-1.0,2026-04-07 11:32:47.519762,2026-04-07 11:32:48.195424,0 days 00:00:00.675662,57.832776567196674,16.27333416902208,0.8577501252557653,Au,COMPLETE
2551,-1.0,2026-04-07 11:32:47.479554,2026-04-07 11:32:48.164951,0 days 00:00:00.685397,42.93217979206215,17.06470596502303,0.7300827119684783,Au,COMPLETE
2552,-1.0,2026-04-07 11:32:47.597718,2026-04-07 11:32:48.166993,0 days 00:00:00.569275,21.627522685739567,19.852009274068642,1.0268067896367292,Au,COMPLETE
2553,0.0,2026-04-07 11:32:47.623813,2026-04-07 11:32:48.339269,0 days 00:00:00.715456,37.50307983045596,17.29337803893587,0.7129424137597596,Au,PRUNED
2554,0.0,2026-04-07 11:32:47.636511,2026-04-07 11:32:48.150964,0 days 00:00:00.514453,45.063455942202296,17.12870441123371,0.6263240917883883,Au,PRUNED
2555,0.0,2026-04-07 11:32:47.683258,2026-04-07 11:32:48.392764,0 days 00:00:00.709506,35.85733863562888,17.23980979256953,0.4484860286454534,Au,PRUNED
2556,-1.0,2026-04-07 11:32:47.805994,2026-04-07 11:32:48.166993,0 days 00:00:00.360999,40.13420588726085,16.683882493077768,0.7218212153873399,Au,COMPLETE
2557,-11.11111111110963,2026-04-07 11:32:47.886302,2026-04-07 11:32:48.111706,0 days 00:00:00.225404,23.595306101580935,17.838074596591746,0.8191570405031573,Au,PRUNED
2558,-4.629629629628944,2026-04-07 11:32:48.260625,2026-04-07 11:32:48.789057,0 days 00:00:00.528432,21.024626639519585,19.981683915948228,1.5113789063908485,Au,PRUNED
2559,-1.0,2026-04-07 11:32:48.199525,2026-04-07 11:32:48.789057,0 days 00:00:00.589532,20.17184137441556,13.776428616352971,0.5046266489304829,Au,COMPLETE
2560,-338.8888888888474,2026-04-07 11:32:48.437133,2026-04-07 11:32:49.100330,0 days 00:00:00.663197,22.956932995970703,17.40802094215132,0.6374280124667295,Au,COMPLETE
2561,-1.0,2026-04-07 11:32:48.446929,2026-04-07 11:32:48.841772,0 days 00:00:00.394843,46.509125413615436,13.80735497830138,0.8763742720036602,Au,COMPLETE
2562,0.0,2026-04-07 11:32:48.463688,2026-04-07 11:32:49.234880,0 days 00:00:00.771192,36.03627922783746,18.907539637857933,1.014206521771406,Au,PRUNED
2563,-362.90322580640463,2026-04-07 11:32:48.478638,2026-04-07 11:32:49.144346,0 days 00:00:00.665708,20.36560949628711,18.963633523061212,1.333554355489443,Au,COMPLETE
2564,-1.0,2026-04-07 11:32:48.503092,2026-04-07 11:32:49.052122,0 days 00:00:00.549030,30.21362286624033,19.78427072318026,1.49977086751628,Au,COMPLETE
2565,-1.0,2026-04-07 11:32:48.600888,2026-04-07 11:32:49.083822,0 days 00:00:00.482934,39.964348849406164,19.67169340477702,1.0623143280081147,Au,COMPLETE
2566,0.0,2026-04-07 11:32:48.975849,2026-04-07 11:32:49.696259,0 days 00:00:00.720410,21.074554351924135,17.19619472256399,0.3634041970952083,Au,PRUNED
2567,-200.74349442377672,2026-04-07 11:32:49.007442,2026-04-07 11:32:49.697280,0 days 00:00:00.689838,23.857476251696152,15.337609041240377,0.6490300512334798,Au,COMPLETE
2568,-1.0,2026-04-07 11:32:49.173081,2026-04-07 11:32:49.609028,0 days 00:00:00.435947,45.604325903973375,11.837555874253214,0.5345793775291761,Au,COMPLETE
2569,-1.0,2026-04-07 11:32:49.202294,2026-04-07 11:32:49.900920,0 days 00:00:00.698626,32.70417781937748,14.74381595368731,0.9225312075610909,Au,COMPLETE
2570,0.0,2026-04-07 11:32:49.240055,2026-04-07 11:32:49.880185,0 days 00:00:00.640130,39.202683207983256,18.52859016011617,0.31865812700928803,Au,PRUNED
2571,-1.0,2026-04-07 11:32:49.316679,2026-04-07 11:32:49.816052,0 days 00:00:00.499373,22.771363214799653,14.466578137860393,0.6088824300003556,Au,COMPLETE
2572,-1.0,2026-04-07 11:32:49.351456,2026-04-07 11:32:49.703168,0 days 00:00:00.351712,31.022250903403766,17.983299505050788,0.5169161975593864,Au,COMPLETE
2573,-1.0,2026-04-07 11:32:49.413114,2026-04-07 11:32:49.912955,0 days 00:00:00.499841,30.738193785052616,13.999263506406988,0.8791083788482493,Au,COMPLETE
2574,-9.615384615383135,2026-04-07 11:32:49.755896,2026-04-07 11:32:50.417971,0 days 00:00:00.662075,21.52712039161528,19.630380058180155,1.009985812307229,Au,PRUNED
2575,0.0,2026-04-07 11:32:49.837578,2026-04-07 11:32:50.441498,0 days 00:00:00.603920,45.54351164285656,19.820290299278764,1.464106155665049,Au,PRUNED
2576,-1.0,2026-04-07 11:32:49.852138,2026-04-07 11:32:50.502549,0 days 00:00:00.650411,20.333916164192303,18.611104427572442,0.7338988229063256,Au,COMPLETE
2577,-1.0,2026-04-07 11:32:49.900920,2026-04-07 11:32:50.440979,0 days 00:00:00.540059,26.69067056865416,17.732546332496284,0.6588808731642756,Au,COMPLETE
2578,-1.0,2026-04-07 11:32:49.993728,2026-04-07 11:32:50.573936,0 days 00:00:00.580208,42.14201808951691,19.978418230214096,1.257359560502217,Au,COMPLETE
2579,-9.722222222220926,2026-04-07 11:32:50.038288,2026-04-07 11:32:50.801474,0 days 00:00:00.763186,24.739568694109792,17.469288373990278,0.6174149239866491,Au,PRUNED
2580,-1.0,2026-04-07 11:32:50.074592,2026-04-07 11:32:50.572424,0 days 00:00:00.497832,25.267431697812725,18.00878207455414,0.5749957819697654,Au,COMPLETE
2581,-1.0,2026-04-07 11:32:50.133685,2026-04-07 11:32:50.435056,0 days 00:00:00.301371,29.47167078323273,17.04511262869949,0.38188033210714545,Au,COMPLETE
2582,2.6881720430104057,2026-04-07 11:32:50.464052,2026-04-07 11:32:51.127829,0 days 00:00:00.663777,22.69888382680964,19.77071657124768,1.202697594045776,Au,PRUNED
2583,-1.0,2026-04-07 11:32:50.614997,2026-04-07 11:32:51.193440,0 days 00:00:00.578443,21.396375428499578,15.619043226600311,0.600315787176306,Au,COMPLETE
2584,78.1249999999977,2026-04-07 11:32:50.658213,2026-04-07 11:32:51.394642,0 days 00:00:00.736429,38.023382532021444,14.79523124368998,0.6160809368402902,Au,PRUNED
2585,0.0,2026-04-07 11:32:50.694304,2026-04-07 11:32:51.306863,0 days 00:00:00.612559,33.980481406097056,17.779433240248373,1.184345132882746,Au,PRUNED
2586,82.40740740740496,2026-04-07 11:32:50.731387,2026-04-07 11:32:51.568222,0 days 00:00:00.836835,25.608226432659194,19.37328831986437,1.2001236978591059,Au,PRUNED
2587,-8.57843137254801,2026-04-07 11:32:50.765129,2026-04-07 11:32:51.713747,0 days 00:00:00.948618,27.790671002877833,15.505008390498244,0.7135802186207851,Au,PRUNED
2588,-1.0,2026-04-07 11:32:50.924344,2026-04-07 11:32:51.710776,0 days 00:00:00.786432,21.866986620565857,17.843736964750658,1.057317456235435,Au,COMPLETE
2589,-1.0,2026-04-07 11:32:50.987124,2026-04-07 11:32:51.570715,0 days 00:00:00.583591,30.16497963805906,19.886206015345838,1.2585399540285354,Au,COMPLETE
2590,-1.0,2026-04-07 11:32:51.197069,2026-04-07 11:32:51.712233,0 days 00:00:00.515164,20.20664423171394,19.394570517840922,1.1233568071727411,Au,COMPLETE
2591,0.0,2026-04-07 11:32:51.343437,2026-04-07 11:32:51.992174,0 days 00:00:00.648737,31.851272146899056,19.875875282236407,1.1629545647543797,Au,PRUNED
2592,0.0,2026-04-07 11:32:51.445869,2026-04-07 11:32:51.991172,0 days 00:00:00.545303,36.199896055866795,19.821070603358027,1.1262591245385827,Au,PRUNED
2593,-1.0,2026-04-07 11:32:51.484411,2026-04-07 11:32:52.036942,0 days 00:00:00.552531,29.443244424818097,16.424262448705,0.9090919839028566,Au,COMPLETE
2594,-395.68764568759013,2026-04-07 11:32:51.623824,2026-04-07 11:32:52.229190,0 days 00:00:00.605366,20.444185616437196,19.557615616668585,1.0928736133209938,Au,COMPLETE
2595,-1.0,2026-04-07 11:32:51.821185,2026-04-07 11:32:52.390348,0 days 00:00:00.569163,37.38228778178805,19.96367291803308,1.2802576086861424,Au,COMPLETE
2596,5.952380952380272,2026-04-07 11:32:51.837381,2026-04-07 11:32:52.379813,0 days 00:00:00.542432,28.076243955220736,16.86557033043746,0.9229215686041351,Au,PRUNED
2597,-1.0,2026-04-07 11:32:51.953884,2026-04-07 11:32:52.391355,0 days 00:00:00.437471,20.929658664186135,19.996817758388985,1.1510938193514244,Au,COMPLETE
2598,0.0,2026-04-07 11:32:51.978505,2026-04-07 11:32:52.849948,0 days 00:00:00.871443,22.281102676481016,15.91320018946478,1.0203075839796685,Au,PRUNED
2599,-1.0,2026-04-07 11:32:52.116523,2026-04-07 11:32:52.584734,0 days 00:00:00.468211,20.1295503001691,15.143986042028011,0.7469004184840873,Au,COMPLETE
2600,0.0,2026-04-07 11:32:52.145674,2026-04-07 11:32:52.629455,0 days 00:00:00.483781,20.393125837105817,18.835204843404195,0.5524071721343617,Au,PRUNED
2601,-1.0,2026-04-07 11:32:52.201222,2026-04-07 11:32:52.743102,0 days 00:00:00.541880,21.143921128452952,18.699280386694515,1.1643467549371722,Au,COMPLETE
2602,-1.0,2026-04-07 11:32:52.372795,2026-04-07 11:32:52.926207,0 days 00:00:00.553412,21.328992185309275,17.656874863207136,1.1047927969852958,Au,COMPLETE
2603,-1.0,2026-04-07 11:32:52.529152,2026-04-07 11:32:53.114180,0 days 00:00:00.585028,20.27838773802094,18.785882021997875,1.0802529314300129,Au,COMPLETE
2604,-441.2144702841686,2026-04-07 11:32:52.550186,2026-04-07 11:32:53.362886,0 days 00:00:00.812700,20.906750119226203,19.987096092541062,0.8200510990595321,Au,COMPLETE
2605,-9.615384615383135,2026-04-07 11:32:52.633465,2026-04-07 11:32:53.362886,0 days 00:00:00.729421,20.72680796226293,19.743386522973488,1.472105439009586,Au,PRUNED
2606,-1.0,2026-04-07 11:32:52.703854,2026-04-07 11:32:53.101250,0 days 00:00:00.397396,20.736131973079804,19.306065008504866,1.2484056036101983,Au,COMPLETE
2607,-1.0,2026-04-07 11:32:52.776177,2026-04-07 11:32:53.300776,0 days 00:00:00.524599,22.14626222266467,19.885719811395845,1.4190051701810722,Au,COMPLETE
2608,-1.0,2026-04-07 11:32:52.929793,2026-04-07 11:32:53.784074,0 days 00:00:00.854281,20.01030210509935,18.810250536508796,1.4766123480120423,Au,COMPLETE
2609,-1.0,2026-04-07 11:32:53.046903,2026-04-07 11:32:53.784721,0 days 00:00:00.737818,20.919672849094837,18.709589870371016,1.5503888719648293,Au,COMPLETE
2610,-401.59574468079353,2026-04-07 11:32:53.029728,2026-04-07 11:32:53.754203,0 days 00:00:00.724475,20.17324648950929,19.73532455035016,1.1954104588345993,Au,COMPLETE
2611,-1.0,2026-04-07 11:32:53.230785,2026-04-07 11:32:53.672555,0 days 00:00:00.441770,21.126972886055853,19.863990344989503,1.298486078680996,Au,COMPLETE
2612,-1.0,2026-04-07 11:32:53.366337,2026-04-07 11:32:53.834195,0 days 00:00:00.467858,20.183879600467503,16.41727636745441,1.2167659089824436,Au,COMPLETE
2613,-1.0,2026-04-07 11:32:53.434273,2026-04-07 11:32:53.970743,0 days 00:00:00.536470,40.53193930632713,17.081922209365853,1.029368503299532,Au,COMPLETE
2614,-405.0595238094659,2026-04-07 11:32:53.446167,2026-04-07 11:32:54.020783,0 days 00:00:00.574616,21.825660178425487,18.84717989782884,0.9388286567008601,Au,COMPLETE
2615,-1.0,2026-04-07 11:32:53.630135,2026-04-07 11:32:54.009626,0 days 00:00:00.379491,33.712563813258924,17.79279318118565,0.7909948510807266,Au,COMPLETE
2616,-355.7489451476346,2026-04-07 11:32:53.903655,2026-04-07 11:32:54.461435,0 days 00:00:00.557780,22.38398741948553,17.794362151813583,0.9240540053467972,Au,COMPLETE
2617,0.0,2026-04-07 11:32:53.928893,2026-04-07 11:32:54.802960,0 days 00:00:00.874067,21.07993341918265,17.913266984214072,0.995217824402711,Au,PRUNED
2618,-1.0,2026-04-07 11:32:53.950017,2026-04-07 11:32:54.273714,0 days 00:00:00.323697,57.530958883471385,19.150073748821978,0.49062505523044303,Au,COMPLETE
2619,0.0,2026-04-07 11:32:54.022310,2026-04-07 11:32:54.411066,0 days 00:00:00.388756,30.77891598759646,19.609137975284565,0.7682562785018825,Au,PRUNED
2620,0.0,2026-04-07 11:32:54.048482,2026-04-07 11:32:54.502693,0 days 00:00:00.454211,46.64924031171122,18.135062736915742,0.8977837555587993,Au,PRUNED
2621,-1.0,2026-04-07 11:32:54.179103,2026-04-07 11:32:54.817496,0 days 00:00:00.638393,30.810123621201626,19.087036733643068,0.8145461453752953,Au,COMPLETE
2622,-1.0,2026-04-07 11:32:54.200137,2026-04-07 11:32:54.893309,0 days 00:00:00.693172,40.09618538219519,19.784581996651543,0.8074828143789813,Au,COMPLETE
2623,-1.0,2026-04-07 11:32:54.167098,2026-04-07 11:32:54.801961,0 days 00:00:00.634863,24.41187020875834,19.874730654815746,0.9234625686651821,Au,COMPLETE
2624,-1.0,2026-04-07 11:32:54.468811,2026-04-07 11:32:55.034484,0 days 00:00:00.565673,34.76614838322001,18.22784537647356,0.8728041618520264,Au,COMPLETE
2625,-1.3020833333331705,2026-04-07 11:32:54.553356,2026-04-07 11:32:55.164769,0 days 00:00:00.611413,24.9666998172722,17.930653807524543,0.8080933597545754,Au,PRUNED
2626,-13.888888888887205,2026-04-07 11:32:54.709347,2026-04-07 11:32:55.206600,0 days 00:00:00.497253,23.74691327495265,16.97359822700173,0.86271718989984,Au,PRUNED
2627,0.0,2026-04-07 11:32:54.777386,2026-04-07 11:32:55.502257,0 days 00:00:00.724871,20.491475729884755,17.727637968962277,0.9438219417989444,Au,PRUNED
2628,-1.0,2026-04-07 11:32:54.912846,2026-04-07 11:32:55.364041,0 days 00:00:00.451195,25.468475279994344,19.30005019973407,0.8864928927221954,Au,COMPLETE
2629,0.0,2026-04-07 11:32:54.962374,2026-04-07 11:32:55.675777,0 days 00:00:00.713403,31.518978848791676,19.582296008469502,0.9491256256317112,Au,PRUNED
2630,-1.0,2026-04-07 11:32:54.976790,2026-04-07 11:32:55.501250,0 days 00:00:00.524460,20.18462400270876,18.579257469517263,0.6910943474075493,Au,COMPLETE
2631,-1.0,2026-04-07 11:32:55.009189,2026-04-07 11:32:55.499124,0 days 00:00:00.489935,37.07776971505578,18.08842806555076,0.8734322239440734,Au,COMPLETE
2632,-1.0,2026-04-07 11:32:55.249480,2026-04-07 11:32:55.704176,0 days 00:00:00.454696,20.241092555420884,19.9422223806876,0.8604226143298391,Au,COMPLETE
2633,-1.0,2026-04-07 11:32:55.275802,2026-04-07 11:32:55.592270,0 days 00:00:00.316468,32.661012922170684,18.474182838807714,0.8280968766355977,Au,COMPLETE
2634,-10.80246913580087,2026-04-07 11:32:55.209148,2026-04-07 11:32:56.114733,0 days 00:00:00.905585,22.65241992720984,19.282927910959426,0.4307233541623767,Au,PRUNED
2635,82.41421568627209,2026-04-07 11:32:55.498124,2026-04-07 11:32:56.128617,0 days 00:00:00.630493,25.97598698635721,19.506863610478895,0.5479242958747503,Au,PRUNED
2636,0.0,2026-04-07 11:32:55.596410,2026-04-07 11:32:56.203748,0 days 00:00:00.607338,31.85691518746526,19.440099143389734,0.6133555848482075,Au,PRUNED
2637,0.0,2026-04-07 11:32:55.691476,2026-04-07 11:32:56.249637,0 days 00:00:00.558161,30.72445369650995,19.743678692292388,0.6194070911545461,Au,PRUNED
2638,-1.0,2026-04-07 11:32:55.723790,2026-04-07 11:32:56.113731,0 days 00:00:00.389941,25.680388580558887,19.9970907833799,0.8438816875288845,Au,COMPLETE
2639,-1.0,2026-04-07 11:32:55.741005,2026-04-07 11:32:56.043073,0 days 00:00:00.302068,21.524026269084683,19.734138718380933,1.1708564892209077,Au,COMPLETE
2640,-420.3703703703087,2026-04-07 11:32:55.827355,2026-04-07 11:32:56.687805,0 days 00:00:00.860450,21.394187680342153,19.486918080546943,0.6843286793836725,Au,COMPLETE
2641,-1.0,2026-04-07 11:32:55.853865,2026-04-07 11:32:56.464404,0 days 00:00:00.610539,37.786836764393605,19.72951307311978,0.9724310069523348,Au,COMPLETE
2642,-1.0,2026-04-07 11:32:56.220431,2026-04-07 11:32:56.568012,0 days 00:00:00.347581,33.08288313112366,19.651383158021293,0.9320556836056515,Au,COMPLETE
2643,0.0,2026-04-07 11:32:56.237410,2026-04-07 11:32:56.905233,0 days 00:00:00.667823,37.09163012294459,17.782430170721334,1.0203609001979395,Au,PRUNED
2644,2.7777777777774073,2026-04-07 11:32:56.295224,2026-04-07 11:32:57.115349,0 days 00:00:00.820125,23.244216491607318,19.955406596364053,0.6505886632747884,Au,PRUNED
2645,-417.58578431366413,2026-04-07 11:32:56.315070,2026-04-07 11:32:57.167357,0 days 00:00:00.852287,20.382689849266157,19.730749560370057,1.2710834865234921,Au,COMPLETE
2646,0.0,2026-04-07 11:32:56.338702,2026-04-07 11:32:57.153860,0 days 00:00:00.815158,20.629009304385402,17.46423562011257,1.129049646392424,Au,PRUNED
2647,-1.0,2026-04-07 11:32:56.250204,2026-04-07 11:32:56.905233,0 days 00:00:00.655029,21.367936423196358,16.789634501214742,0.9883352767396979,Au,COMPLETE
2648,-1.0,2026-04-07 11:32:56.638518,2026-04-07 11:32:57.288577,0 days 00:00:00.650059,21.921805304431174,19.8799153897672,0.49075469431166113,Au,COMPLETE
2649,-364.9891774891304,2026-04-07 11:32:56.712119,2026-04-07 11:32:57.378989,0 days 00:00:00.666870,20.953303172205445,18.983360262133512,0.8370831892794359,Au,COMPLETE
2650,0.0,2026-04-07 11:32:56.908317,2026-04-07 11:32:57.502555,0 days 00:00:00.594238,20.370454676686098,18.220808122093413,0.5950274132610106,Au,PRUNED
2651,83.02696078431127,2026-04-07 11:32:57.027502,2026-04-07 11:32:57.803645,0 days 00:00:00.776143,25.097131165122494,19.77918376479977,0.21790678487635506,Au,PRUNED
2652,-6.172839506171925,2026-04-07 11:32:57.072303,2026-04-07 11:32:57.770827,0 days 00:00:00.698524,22.65118593024217,19.66225649081026,0.567391791218965,Au,PRUNED
2653,-370.33991228065304,2026-04-07 11:32:57.250871,2026-04-07 11:32:57.991299,0 days 00:00:00.740428,20.88375345544046,19.16548769269463,0.7915210860047336,Au,COMPLETE
2654,0.0,2026-04-07 11:32:57.292162,2026-04-07 11:32:57.951996,0 days 00:00:00.659834,35.673024323361254,16.868153870001983,1.1063627680864936,Au,PRUNED
2655,-1.0,2026-04-07 11:32:57.347988,2026-04-07 11:32:57.949993,0 days 00:00:00.602005,35.4926767231456,16.355220069306792,0.8772738378334977,Au,COMPLETE
2656,-8.01282051281928,2026-04-07 11:32:57.476930,2026-04-07 11:32:58.192526,0 days 00:00:00.715596,21.68635937733975,19.89985352073852,0.8536949511381643,Au,PRUNED
2657,-1.0,2026-04-07 11:32:57.499358,2026-04-07 11:32:57.941913,0 days 00:00:00.442555,21.246845146870083,19.828781562061337,0.8305229634942138,Au,COMPLETE
2658,-1.0,2026-04-07 11:32:57.609664,2026-04-07 11:32:58.302101,0 days 00:00:00.692437,27.779254542801347,19.926700940420236,0.6561059546435455,Au,COMPLETE
2659,-1.0,2026-04-07 11:32:57.872301,2026-04-07 11:32:58.376903,0 days 00:00:00.504602,21.17061056014962,19.193690919288176,0.976094452301279,Au,COMPLETE
2660,76.64233576642111,2026-04-07 11:32:57.864071,2026-04-07 11:32:58.490209,0 days 00:00:00.626138,39.33099375376207,15.35788216155235,0.41941691990364344,Au,PRUNED
2661,82.72058823529169,2026-04-07 11:32:58.118370,2026-04-07 11:32:58.696207,0 days 00:00:00.577837,24.7177025073447,19.620478813000847,0.9741635676198588,Au,PRUNED
2662,-1.0,2026-04-07 11:32:58.156208,2026-04-07 11:32:58.695202,0 days 00:00:00.538994,79.85911574381592,7.489891075637437,1.6921923814309978,Au,COMPLETE
2663,-1.0,2026-04-07 11:32:58.180361,2026-04-07 11:32:58.768723,0 days 00:00:00.588362,39.92914795792868,14.235482307341046,0.4053412621989788,Au,COMPLETE
2664,-1.0,2026-04-07 11:32:58.236833,2026-04-07 11:32:58.807560,0 days 00:00:00.570727,20.04779695701882,19.98194620678029,0.9468951099063667,Au,COMPLETE
2665,-0.8992805755395424,2026-04-07 11:32:58.257602,2026-04-07 11:32:58.697207,0 days 00:00:00.439605,21.458079438350506,19.543975862207972,0.6529704909049425,Ag,PRUNED
2666,-1.0,2026-04-07 11:32:58.534698,2026-04-07 11:32:59.146754,0 days 00:00:00.612056,33.187258623982025,16.834209737390808,0.8176380208757174,Au,COMPLETE
2667,-201.8034825870496,2026-04-07 11:32:58.632042,2026-04-07 11:32:59.291790,0 days 00:00:00.659748,23.65817201065231,15.558772464800478,0.6173546851860721,Au,COMPLETE
