number,value,datetime_start,datetime_complete,duration,params_D2_nm,params_D3_nm,params_D4_nm,params_metal,state
2668,2.873563218390408,2026-04-07 11:32:58.648541,2026-04-07 11:32:59.163121,0 days 00:00:00.514580,22.921144928061185,19.93819287496733,0.7950837659431069,Au,PRUNED
2669,-1.0,2026-04-07 11:32:58.820134,2026-04-07 11:32:59.400593,0 days 00:00:00.580459,23.65959512937845,16.268453910449775,0.8385560390200206,Au,COMPLETE
2670,0.0,2026-04-07 11:32:58.836396,2026-04-07 11:32:59.391771,0 days 00:00:00.555375,21.12074344914403,18.061056607926606,0.8088660369905548,Au,PRUNED
2671,-1.0,2026-04-07 11:32:58.886870,2026-04-07 11:32:59.368228,0 days 00:00:00.481358,44.042075234491335,19.325868234827986,0.5829281560795649,Au,COMPLETE
2672,-1.0,2026-04-07 11:32:58.924690,2026-04-07 11:32:59.458139,0 days 00:00:00.533449,46.35749129130444,18.793830705710995,0.6740546195856201,Au,COMPLETE
2673,79.9632352941153,2026-04-07 11:32:59.121080,2026-04-07 11:32:59.563755,0 days 00:00:00.442675,33.46058476206109,15.190857709145847,0.9372768763968509,Au,PRUNED
2674,-360.5769230768762,2026-04-07 11:32:59.305367,2026-04-07 11:32:59.778331,0 days 00:00:00.472964,22.237634479611327,18.069785084667974,0.7985715971223911,Au,COMPLETE
2675,-1.0,2026-04-07 11:32:59.367213,2026-04-07 11:33:00.105860,0 days 00:00:00.738647,20.380895623708057,18.48108199068429,0.7049906013296828,Au,COMPLETE
2676,0.0,2026-04-07 11:32:59.420124,2026-04-07 11:32:59.913277,0 days 00:00:00.493153,22.613787731576192,14.949654774089765,0.9486504479136478,Au,PRUNED
2677,0.0,2026-04-07 11:32:59.518649,2026-04-07 11:33:00.210243,0 days 00:00:00.691594,34.091399283381584,17.986074122591187,1.0815665309121063,Au,PRUNED
2678,-1.0,2026-04-07 11:32:59.639634,2026-04-07 11:33:00.257769,0 days 00:00:00.618135,20.52879999857555,19.84813804897151,0.7003708370523445,Au,COMPLETE
2679,-1.0,2026-04-07 11:32:59.657309,2026-04-07 11:33:00.386625,0 days 00:00:00.729316,25.104379297997237,16.749696521711304,0.6570485279362631,Au,COMPLETE
2680,-304.5580110496902,2026-04-07 11:32:59.706586,2026-04-07 11:33:00.418922,0 days 00:00:00.712336,23.02155348569384,16.55509158290637,0.7556266817640186,Au,COMPLETE
2681,-308.4264432029449,2026-04-07 11:32:59.816946,2026-04-07 11:33:00.415776,0 days 00:00:00.598830,23.50238225645167,16.514992183936165,0.5757611411866218,Au,COMPLETE
2682,-15.476190476188707,2026-04-07 11:32:59.915281,2026-04-07 11:33:00.503183,0 days 00:00:00.587902,24.863692524186494,16.101365420194593,0.6310563377928169,Au,PRUNED
2683,-1.0,2026-04-07 11:33:00.038838,2026-04-07 11:33:00.414769,0 days 00:00:00.375931,27.068282494936874,17.39518003424718,0.7606255315943733,Au,COMPLETE
2684,-1.0,2026-04-07 11:33:00.242162,2026-04-07 11:33:00.850072,0 days 00:00:00.607910,32.58535324943658,19.81734332069666,1.1436689097887425,Au,COMPLETE
2685,0.0,2026-04-07 11:33:00.450824,2026-04-07 11:33:01.065732,0 days 00:00:00.614908,31.717960837518042,19.571055083733167,0.9463740599223808,Au,PRUNED
2686,-1.0,2026-04-07 11:33:00.528321,2026-04-07 11:33:01.142382,0 days 00:00:00.614061,21.352867289454053,17.254317056801344,0.8945746288816039,Au,COMPLETE
2687,-1.0,2026-04-07 11:33:00.575557,2026-04-07 11:33:00.977678,0 days 00:00:00.402121,22.281347427202448,15.808254374914998,0.8926965176559876,Au,COMPLETE
2688,0.0,2026-04-07 11:33:00.630985,2026-04-07 11:33:01.180963,0 days 00:00:00.549978,47.642681698725156,19.82309711409812,0.7566038113019974,Au,PRUNED
2689,-1.0,2026-04-07 11:33:00.651848,2026-04-07 11:33:01.258908,0 days 00:00:00.607060,20.17510590737869,18.245501167979064,0.9081729646360467,Au,COMPLETE
2690,0.0,2026-04-07 11:33:00.668220,2026-04-07 11:33:01.341211,0 days 00:00:00.672991,20.056875114333927,16.75746981853029,0.696780659538678,Au,PRUNED
2691,-1.0,2026-04-07 11:33:00.744660,2026-04-07 11:33:01.257903,0 days 00:00:00.513243,39.6097206775263,19.393802024256726,0.8648932653080945,Au,COMPLETE
2692,-1.0,2026-04-07 11:33:01.035852,2026-04-07 11:33:01.816046,0 days 00:00:00.780194,36.162339042075686,19.51310488680465,0.5727465516204242,Au,COMPLETE
2693,-1.0,2026-04-07 11:33:01.201742,2026-04-07 11:33:01.888167,0 days 00:00:00.686425,30.81793252644883,19.858806490989046,1.242978984536154,Au,COMPLETE
2694,-1.0,2026-04-07 11:33:01.224643,2026-04-07 11:33:01.840232,0 days 00:00:00.615589,33.45456887110645,19.69669453524376,0.8825889495570272,Au,COMPLETE
2695,-1.0,2026-04-07 11:33:01.307647,2026-04-07 11:33:01.840232,0 days 00:00:00.532585,33.25025665599233,19.868992027949385,1.1850527213567852,Au,COMPLETE
2696,0.0,2026-04-07 11:33:01.377182,2026-04-07 11:33:02.045272,0 days 00:00:00.668090,20.41860269171237,17.743089475538085,0.8510274834084792,Au,PRUNED
2697,-1.0,2026-04-07 11:33:01.429450,2026-04-07 11:33:01.803315,0 days 00:00:00.373865,37.16388378507766,17.728880236111138,0.5859176658365347,Au,COMPLETE
2698,0.0,2026-04-07 11:33:01.494576,2026-04-07 11:33:02.044240,0 days 00:00:00.549664,36.12831874334948,19.854385377593434,1.2772041418329476,Au,PRUNED
2699,-1.0,2026-04-07 11:33:01.599843,2026-04-07 11:33:02.046618,0 days 00:00:00.446775,35.436680789567816,17.306938440211695,0.608644346014813,Au,COMPLETE
2700,-1.0,2026-04-07 11:33:01.889697,2026-04-07 11:33:02.513794,0 days 00:00:00.624097,22.08514251279624,19.95334576747419,1.0905020773797804,Au,COMPLETE
2701,-1.0,2026-04-07 11:33:01.985324,2026-04-07 11:33:02.515942,0 days 00:00:00.530618,20.071667607838574,18.099815587027596,1.14252734393304,Au,COMPLETE
2702,-1.0,2026-04-07 11:33:02.055656,2026-04-07 11:33:02.516941,0 days 00:00:00.461285,34.837616476755585,17.123074014592614,0.9319248334326242,Au,COMPLETE
2703,-427.63157894730426,2026-04-07 11:33:02.060299,2026-04-07 11:33:02.709367,0 days 00:00:00.649068,20.65266196704265,19.786811390040683,1.149171905669927,Au,COMPLETE
2704,-1.0,2026-04-07 11:33:02.186513,2026-04-07 11:33:02.667399,0 days 00:00:00.480886,20.127357359157525,19.791938171102753,1.3175232773288672,Au,COMPLETE
2705,-1.0,2026-04-07 11:33:02.198800,2026-04-07 11:33:02.614448,0 days 00:00:00.415648,21.362832095588512,19.972364250659474,0.897741477161595,Au,COMPLETE
2706,-1.0,2026-04-07 11:33:02.253139,2026-04-07 11:33:02.651144,0 days 00:00:00.398005,20.028083938324908,18.6478364060855,1.165010020266296,Au,COMPLETE
2707,-1.0,2026-04-07 11:33:02.437826,2026-04-07 11:33:02.895128,0 days 00:00:00.457302,20.90688908327023,17.61863382602064,0.8395579733466536,Au,COMPLETE
2708,-1.0,2026-04-07 11:33:02.737926,2026-04-07 11:33:03.294647,0 days 00:00:00.556721,33.42625449607416,19.48178008749447,0.9542600142629301,Au,COMPLETE
2709,0.0,2026-04-07 11:33:02.710364,2026-04-07 11:33:03.369965,0 days 00:00:00.659601,39.13035149307711,19.433159580631155,0.6185170148213344,Au,PRUNED
2710,0.0,2026-04-07 11:33:02.787630,2026-04-07 11:33:03.472310,0 days 00:00:00.684680,20.197098173411312,18.966711154953714,0.986349954076866,Au,PRUNED
2711,-1.0,2026-04-07 11:33:02.777774,2026-04-07 11:33:03.292227,0 days 00:00:00.514453,21.052442320505477,18.16867110639159,0.6541318913522104,Au,COMPLETE
2712,-1.0,2026-04-07 11:33:02.830958,2026-04-07 11:33:03.292227,0 days 00:00:00.461269,20.925844632812296,19.974983091474158,1.3166558030516136,Au,COMPLETE
2713,0.0,2026-04-07 11:33:02.855559,2026-04-07 11:33:03.367890,0 days 00:00:00.512331,20.896593862595083,16.56129104605508,0.9841316924627036,Au,PRUNED
2714,-1.0,2026-04-07 11:33:02.918774,2026-04-07 11:33:03.369965,0 days 00:00:00.451191,35.10834435262598,18.67280049630008,0.9604511111633722,Au,COMPLETE
2715,-1.0,2026-04-07 11:33:03.025594,2026-04-07 11:33:03.591929,0 days 00:00:00.566335,20.811952078871403,17.041493024186067,0.43591248033499125,Au,COMPLETE
2716,0.0,2026-04-07 11:33:03.446930,2026-04-07 11:33:04.351697,0 days 00:00:00.904767,20.012962687337648,16.815872833915,0.8411175020073521,Au,PRUNED
2717,-1.0,2026-04-07 11:33:03.498917,2026-04-07 11:33:04.166401,0 days 00:00:00.667484,21.28608978177312,19.654399127293278,1.2276294751127068,Au,COMPLETE
2718,-380.63063063057916,2026-04-07 11:33:03.509345,2026-04-07 11:33:04.086438,0 days 00:00:00.577093,20.730027117744005,19.81630619435931,0.3645452570478286,Au,COMPLETE
2719,0.0,2026-04-07 11:33:03.526330,2026-04-07 11:33:04.320631,0 days 00:00:00.794301,38.727402433165,19.699065152041413,1.1017628709306677,Au,PRUNED
2720,-1.0,2026-04-07 11:33:03.543805,2026-04-07 11:33:04.030599,0 days 00:00:00.486794,33.84893698568537,19.80713077621778,1.183367771008386,Au,COMPLETE
2721,-1.0,2026-04-07 11:33:03.594435,2026-04-07 11:33:04.029596,0 days 00:00:00.435161,35.03360491613424,17.080981701048405,0.9196809622621652,Ag,COMPLETE
2722,0.0,2026-04-07 11:33:03.622724,2026-04-07 11:33:04.087444,0 days 00:00:00.464720,21.76088126523962,13.769337803016818,0.886984059068902,Au,PRUNED
2723,-1.0,2026-04-07 11:33:03.760686,2026-04-07 11:33:04.190132,0 days 00:00:00.429446,21.159975812587554,19.264110770750644,0.7302234541372619,Au,COMPLETE
2724,-1.0,2026-04-07 11:33:04.231347,2026-04-07 11:33:04.821710,0 days 00:00:00.590363,27.53690793949844,17.613062218844572,0.4244802744780698,Au,COMPLETE
2725,2.873563218390408,2026-04-07 11:33:04.270602,2026-04-07 11:33:04.991729,0 days 00:00:00.721127,22.395190075050778,19.921272419381637,1.1585759756991756,Au,PRUNED
2726,0.0,2026-04-07 11:33:04.308436,2026-04-07 11:33:04.901812,0 days 00:00:00.593376,36.82772408032638,17.484680645088368,0.2579054590690921,Au,PRUNED
2727,81.49509803921329,2026-04-07 11:33:04.352706,2026-04-07 11:33:04.990718,0 days 00:00:00.638012,28.928202081529705,18.200168928082594,0.2180118386909633,Au,PRUNED
2728,-441.53746770019023,2026-04-07 11:33:04.431111,2026-04-07 11:33:05.169211,0 days 00:00:00.738100,21.12369919391189,19.8567043771602,0.9499885773985769,Au,COMPLETE
2729,-1.0,2026-04-07 11:33:04.486287,2026-04-07 11:33:04.901812,0 days 00:00:00.415525,26.33416970987896,17.864429657431415,0.24304051787620942,Au,COMPLETE
2730,-1.0,2026-04-07 11:33:04.554621,2026-04-07 11:33:05.044474,0 days 00:00:00.489853,24.69650975587944,19.08758742214834,0.3042595685811043,Au,COMPLETE
2731,-1.0,2026-04-07 11:33:04.629302,2026-04-07 11:33:05.238231,0 days 00:00:00.608929,39.478470751075676,18.463416074851306,0.41371328486340775,Au,COMPLETE
2732,0.0,2026-04-07 11:33:05.035356,2026-04-07 11:33:05.696745,0 days 00:00:00.661389,30.770846120200286,17.935471944711118,1.0999517381530972,Au,PRUNED
2733,-1.0,2026-04-07 11:33:05.043473,2026-04-07 11:33:05.791270,0 days 00:00:00.747797,20.034492847477843,16.708230267861065,0.3793186461871636,Au,COMPLETE
2734,-1.0,2026-04-07 11:33:05.110186,2026-04-07 11:33:05.668430,0 days 00:00:00.558244,20.066837644585373,19.092094775968857,0.9135306801928635,Au,COMPLETE
2735,-1.0,2026-04-07 11:33:05.151366,2026-04-07 11:33:05.681569,0 days 00:00:00.530203,36.129444842487416,19.71967000440416,0.8461503991356716,Au,COMPLETE
2736,-1.0,2026-04-07 11:33:05.204126,2026-04-07 11:33:05.661408,0 days 00:00:00.457282,23.06756982019232,18.993307446324565,0.5327409236470301,Au,COMPLETE
2737,-1.0,2026-04-07 11:33:05.292310,2026-04-07 11:33:05.730051,0 days 00:00:00.437741,30.647979761193326,19.776889010102472,0.27933133035980784,Au,COMPLETE
2738,0.0,2026-04-07 11:33:05.335854,2026-04-07 11:33:05.934863,0 days 00:00:00.599009,42.55812045403244,19.574979303197775,0.5326775828424892,Au,PRUNED
2739,-1.0,2026-04-07 11:33:05.449957,2026-04-07 11:33:05.876290,0 days 00:00:00.426333,25.90955005450415,19.853312642493975,1.042978915703189,Au,COMPLETE
2740,-1.0,2026-04-07 11:33:05.772131,2026-04-07 11:33:06.276156,0 days 00:00:00.504025,35.41034610244206,19.3666269378577,0.9558758321646412,Au,COMPLETE
2741,0.0,2026-04-07 11:33:05.817728,2026-04-07 11:33:06.491945,0 days 00:00:00.674217,33.34651477868536,19.66880091220668,0.5363596055506756,Au,PRUNED
2742,0.0,2026-04-07 11:33:05.859869,2026-04-07 11:33:06.477586,0 days 00:00:00.617717,28.32851439239789,19.42810720809211,0.6229451263015026,Au,PRUNED
2743,-441.2144702841686,2026-04-07 11:33:05.874289,2026-04-07 11:33:06.823416,0 days 00:00:00.949127,21.029852771736003,19.997969031172975,0.6943202897801231,Au,COMPLETE
2744,-0.8573388203017691,2026-04-07 11:33:05.967913,2026-04-07 11:33:06.650556,0 days 00:00:00.682643,72.17178777748781,19.745384556239117,0.7433192762367233,Cu,PRUNED
2745,-381.19369369364284,2026-04-07 11:33:06.046165,2026-04-07 11:33:06.691520,0 days 00:00:00.645355,20.997085699298278,19.31853789343051,0.6906207324454516,Au,COMPLETE
2746,0.0,2026-04-07 11:33:06.063860,2026-04-07 11:33:06.583923,0 days 00:00:00.520063,32.65494382029077,19.868155027364562,0.7420469573091661,Au,PRUNED
2747,0.0,2026-04-07 11:33:06.071913,2026-04-07 11:33:06.851201,0 days 00:00:00.779288,29.839005788496344,19.5314975050743,0.7629090279626157,Au,PRUNED
2748,0.0,2026-04-07 11:33:06.392194,2026-04-07 11:33:06.992586,0 days 00:00:00.600392,31.83709600091569,19.367070201784163,0.4867202843197152,Au,PRUNED
2749,0.0,2026-04-07 11:33:06.585496,2026-04-07 11:33:07.662061,0 days 00:00:01.076565,20.167803647587295,19.0211004004898,0.4805342477818089,Au,PRUNED
2750,4.166666666666111,2026-04-07 11:33:06.666430,2026-04-07 11:33:07.428864,0 days 00:00:00.762434,23.760206304118185,19.552863821390837,0.6461448774949845,Au,PRUNED
2751,-1.0,2026-04-07 11:33:06.736065,2026-04-07 11:33:07.367888,0 days 00:00:00.631823,20.010729489221447,19.51401009768757,0.6987540392045652,Au,COMPLETE
2752,-1.0,2026-04-07 11:33:06.694703,2026-04-07 11:33:07.309616,0 days 00:00:00.614913,24.05148462559884,19.70728951727757,0.5219502961175262,Au,COMPLETE
2753,-1.0,2026-04-07 11:33:06.898203,2026-04-07 11:33:07.367295,0 days 00:00:00.469092,20.432028447462255,17.073272624561966,0.47184331790509315,Au,COMPLETE
2754,-1.0,2026-04-07 11:33:06.967783,2026-04-07 11:33:07.490920,0 days 00:00:00.523137,25.90277173037481,19.182949796616967,0.47585650125072493,Au,COMPLETE
2755,0.0,2026-04-07 11:33:07.033672,2026-04-07 11:33:07.661051,0 days 00:00:00.627379,27.500750961125725,19.707597036233643,0.6802911421667032,Au,PRUNED
2756,-1.0,2026-04-07 11:33:07.081334,2026-04-07 11:33:07.378260,0 days 00:00:00.296926,24.06508547747422,17.784709206573186,0.21179470736907471,Au,COMPLETE
2757,-1.0,2026-04-07 11:33:07.392025,2026-04-07 11:33:08.089914,0 days 00:00:00.697889,30.837270657528048,19.645454502851337,0.4061686211910489,Au,COMPLETE
2758,-1.4880952380950254,2026-04-07 11:33:07.597047,2026-04-07 11:33:08.289079,0 days 00:00:00.692032,22.758986618873994,19.610648538235935,0.8150388429773753,Au,PRUNED
2759,0.0,2026-04-07 11:33:07.725785,2026-04-07 11:33:08.341702,0 days 00:00:00.615917,20.220874559240574,19.126435741170916,0.8341887448234813,Au,PRUNED
2760,-1.0,2026-04-07 11:33:07.745797,2026-04-07 11:33:08.179041,0 days 00:00:00.433244,27.55436673932507,19.710829013393845,0.7124987947647459,Au,COMPLETE
2761,-1.0,2026-04-07 11:33:07.774975,2026-04-07 11:33:08.289079,0 days 00:00:00.514104,37.84573270556092,16.385019597552013,0.7737318435731095,Au,COMPLETE
2762,-1.0,2026-04-07 11:33:07.792823,2026-04-07 11:33:08.227632,0 days 00:00:00.434809,24.424691482450577,19.634763186194593,0.2805786866245066,Au,COMPLETE
2763,-1.0,2026-04-07 11:33:07.837825,2026-04-07 11:33:08.413777,0 days 00:00:00.575952,22.68120910759588,19.09757075956753,0.2602121945516582,Au,COMPLETE
2764,-1.0,2026-04-07 11:33:07.876307,2026-04-07 11:33:08.412214,0 days 00:00:00.535907,44.53881698915336,19.870367507279024,0.2686596276682508,Au,COMPLETE
2765,-407.9736211030594,2026-04-07 11:33:08.280366,2026-04-07 11:33:08.899928,0 days 00:00:00.619562,20.96356247903186,19.526885801739123,0.8535626727358716,Au,COMPLETE
2766,-2.976190476190051,2026-04-07 11:33:08.368707,2026-04-07 11:33:09.113753,0 days 00:00:00.745046,22.42280917727422,19.89934891980876,0.7905083570401981,Au,PRUNED
2767,0.0,2026-04-07 11:33:08.415787,2026-04-07 11:33:09.045143,0 days 00:00:00.629356,40.53881621285926,19.696678115754985,0.7714705518635094,Au,PRUNED
2768,-1.0,2026-04-07 11:33:08.507362,2026-04-07 11:33:08.983827,0 days 00:00:00.476465,39.02947343664144,19.618681431826896,0.9319799416919696,Au,COMPLETE
2769,-1.0,2026-04-07 11:33:08.541118,2026-04-07 11:33:09.138880,0 days 00:00:00.597762,21.925468860445104,19.922183622848994,0.9062690389845879,Au,COMPLETE
2770,0.0,2026-04-07 11:33:08.591963,2026-04-07 11:33:09.197551,0 days 00:00:00.605588,35.0114814632557,16.954825732036277,0.7330558154400783,Au,PRUNED
2771,-1.0,2026-04-07 11:33:08.602348,2026-04-07 11:33:09.045143,0 days 00:00:00.442795,34.77774290114304,19.94068484474318,0.8209136324801608,Au,COMPLETE
2772,-1.0,2026-04-07 11:33:08.644807,2026-04-07 11:33:09.076000,0 days 00:00:00.431193,35.65474891029952,19.98037765414338,0.8153872316702537,Au,COMPLETE
2773,-420.3703703703087,2026-04-07 11:33:09.112753,2026-04-07 11:33:09.869025,0 days 00:00:00.756272,20.227725288253,19.97213465529044,1.1194780469409922,Au,COMPLETE
2774,-1.0,2026-04-07 11:33:09.228688,2026-04-07 11:33:09.835666,0 days 00:00:00.606978,41.02366411397168,16.66957625771939,0.6663837108213896,Au,COMPLETE
2775,-1.0,2026-04-07 11:33:09.259111,2026-04-07 11:33:09.931624,0 days 00:00:00.672513,21.659346883983698,18.93522504560248,0.6764922028362459,Au,COMPLETE
2776,-1.0,2026-04-07 11:33:09.342158,2026-04-07 11:33:09.738515,0 days 00:00:00.396357,20.38321206120463,19.794228952825467,0.633441599321907,Au,COMPLETE
2777,-8.333333333332,2026-04-07 11:33:09.356595,2026-04-07 11:33:10.040379,0 days 00:00:00.683784,22.247075704893422,19.97964574030045,0.4278142296651048,Au,PRUNED
2778,-1.0,2026-04-07 11:33:09.389765,2026-04-07 11:33:09.836662,0 days 00:00:00.446897,20.045913412115596,18.186905440984887,0.8008369616498303,Au,COMPLETE
2779,-1.0,2026-04-07 11:33:09.409428,2026-04-07 11:33:10.087631,0 days 00:00:00.678203,21.39635090003781,19.098394086458534,0.48366986072851587,Au,COMPLETE
2780,-1.0,2026-04-07 11:33:09.453725,2026-04-07 11:33:09.963025,0 days 00:00:00.509300,20.33150002731821,18.01918398854132,0.4578104165194074,Au,COMPLETE
2781,-1.0,2026-04-07 11:33:09.866177,2026-04-07 11:33:10.445425,0 days 00:00:00.579248,20.669286687564057,18.618933862240702,1.0658136533427043,Au,COMPLETE
2782,-1.0,2026-04-07 11:33:09.989615,2026-04-07 11:33:10.428710,0 days 00:00:00.439095,20.996762743158634,19.658770291285872,0.23785455049239076,Au,COMPLETE
2783,-388.79310344822244,2026-04-07 11:33:10.025075,2026-04-07 11:33:10.543595,0 days 00:00:00.518520,21.319909674266498,19.65580329091511,0.12662030088513954,Au,COMPLETE
2784,-1.0,2026-04-07 11:33:10.106272,2026-04-07 11:33:10.676810,0 days 00:00:00.570538,41.785065521910454,19.700622881686208,1.0470775669317338,Au,COMPLETE
2785,0.0,2026-04-07 11:33:10.121275,2026-04-07 11:33:10.819420,0 days 00:00:00.698145,27.55374179714562,19.975367062709577,0.9132347544935967,Au,PRUNED
2786,0.0,2026-04-07 11:33:10.161969,2026-04-07 11:33:10.663446,0 days 00:00:00.501477,35.838040182133525,16.573134363896013,0.8618138282097959,Au,PRUNED
2787,0.0,2026-04-07 11:33:10.203805,2026-04-07 11:33:10.941332,0 days 00:00:00.737527,33.57724003521074,19.847668333651328,0.9644462761386047,Au,PRUNED
2788,-1.0,2026-04-07 11:33:10.255284,2026-04-07 11:33:10.940332,0 days 00:00:00.685048,20.260826123713333,18.166435864939032,0.7474776951154313,Au,COMPLETE
2789,81.49509803921329,2026-04-07 11:33:10.604520,2026-04-07 11:33:11.414185,0 days 00:00:00.809665,30.68134935531061,16.771306053367955,0.21886907224276111,Au,PRUNED
2790,-1.0,2026-04-07 11:33:10.726809,2026-04-07 11:33:11.221416,0 days 00:00:00.494607,30.201563905930023,19.97297993365776,1.00678654217565,Au,COMPLETE
2791,0.0,2026-04-07 11:33:10.692576,2026-04-07 11:33:11.383150,0 days 00:00:00.690574,30.969378562986204,19.831519244263596,1.3201358436655113,Au,PRUNED
2792,-1.0,2026-04-07 11:33:10.783900,2026-04-07 11:33:11.350677,0 days 00:00:00.566777,25.606500132761,19.12302362525795,0.10774315933001921,Au,COMPLETE
2793,0.0,2026-04-07 11:33:10.894007,2026-04-07 11:33:11.710481,0 days 00:00:00.816474,40.28665452891328,19.828510108496584,1.2858175207456832,Au,PRUNED
2794,2.7777777777774073,2026-04-07 11:33:11.002638,2026-04-07 11:33:11.443820,0 days 00:00:00.441182,22.916211773520228,19.815759130288793,0.9636725660934834,Au,PRUNED
2795,-1.0,2026-04-07 11:33:11.042504,2026-04-07 11:33:11.819011,0 days 00:00:00.776507,27.748340745962945,14.371069986106873,0.2509529488725556,Au,COMPLETE
2796,-1.0,2026-04-07 11:33:11.106926,2026-04-07 11:33:11.581294,0 days 00:00:00.474368,36.69198717771134,14.761439202565636,0.19205341139719712,Au,COMPLETE
2797,-1.0,2026-04-07 11:33:11.412182,2026-04-07 11:33:11.900239,0 days 00:00:00.488057,36.28716732555779,19.95875483497759,1.131332975067124,Au,COMPLETE
2798,-367.64705882348085,2026-04-07 11:33:11.461413,2026-04-07 11:33:12.006699,0 days 00:00:00.545286,22.30443524558837,18.73360024533155,0.13608822961391137,Au,COMPLETE
2799,-1.0,2026-04-07 11:33:11.492189,2026-04-07 11:33:11.963743,0 days 00:00:00.471554,26.422628347295248,15.233478263498965,0.3723741352869972,Au,COMPLETE
2800,0.0,2026-04-07 11:33:11.506576,2026-04-07 11:33:12.195367,0 days 00:00:00.688791,36.44547326422953,18.862709770528284,0.3400596980782229,Au,PRUNED
2801,-1.0,2026-04-07 11:33:11.583966,2026-04-07 11:33:12.051050,0 days 00:00:00.467084,35.22414469512708,17.93594823749268,0.13127229252811948,Au,COMPLETE
2802,-1.0,2026-04-07 11:33:11.713085,2026-04-07 11:33:12.240527,0 days 00:00:00.527442,26.334688764106687,16.293569163462017,0.19185933183961018,Au,COMPLETE
2803,-1.0,2026-04-07 11:33:11.766862,2026-04-07 11:33:12.347868,0 days 00:00:00.581006,21.988635752574993,16.272403530699535,0.4645445964042353,Au,COMPLETE
2804,-1.0,2026-04-07 11:33:12.006699,2026-04-07 11:33:12.629487,0 days 00:00:00.622788,20.498040119574096,16.15470665971538,0.422851071428916,Au,COMPLETE
2805,-1.0,2026-04-07 11:33:12.141238,2026-04-07 11:33:12.579629,0 days 00:00:00.438391,36.18136033656144,19.525679604996274,0.24314846909836813,Au,COMPLETE
2806,-1.0,2026-04-07 11:33:12.099373,2026-04-07 11:33:12.645471,0 days 00:00:00.546098,34.47388334327084,19.322677796860223,0.1689583142495814,Au,COMPLETE
