number,value,datetime_start,datetime_complete,duration,params_D2_nm,params_D3_nm,params_D4_nm,params_metal,state
1981,0.0,2026-04-07 11:31:53.341923,2026-04-07 11:31:53.941019,0 days 00:00:00.599096,34.805247522006034,18.555432117814988,0.8309757014975071,Au,PRUNED
1982,-1.0,2026-04-07 11:31:53.775755,2026-04-07 11:31:54.392460,0 days 00:00:00.616705,28.12937312440894,15.503298954270868,1.096197695897585,Ag,COMPLETE
1983,-8.838383838382768,2026-04-07 11:31:53.891401,2026-04-07 11:31:54.511108,0 days 00:00:00.619707,22.952428230338114,19.22674443947185,1.6896181554040863,Cu,PRUNED
1984,-186.84210526314484,2026-04-07 11:31:53.957114,2026-04-07 11:31:54.436181,0 days 00:00:00.479067,21.38677940763104,17.890248551153295,1.1457844511772732,Cu,COMPLETE
1985,0.0,2026-04-07 11:31:53.987563,2026-04-07 11:31:54.672581,0 days 00:00:00.685018,117.17712304204662,9.937146257805779,0.2463313825282507,Cu,PRUNED
1986,0.0,2026-04-07 11:31:54.023251,2026-04-07 11:31:54.638536,0 days 00:00:00.615285,37.26892940697019,16.443997761091683,1.5758757547856421,Au,PRUNED
1987,-1.0,2026-04-07 11:31:54.033199,2026-04-07 11:31:54.569187,0 days 00:00:00.535988,32.75587421626933,18.00476946480086,1.97626174739838,Au,COMPLETE
1988,-0.8928571428571173,2026-04-07 11:31:54.099300,2026-04-07 11:31:54.722545,0 days 00:00:00.623245,21.265055675583344,14.242446670249498,1.9890418399473722,Ag,PRUNED
1989,-12.387387387386047,2026-04-07 11:31:54.159570,2026-04-07 11:31:54.675163,0 days 00:00:00.515593,22.379935738834572,18.76196866543904,1.0060307232416095,Cu,PRUNED
1990,-13.888888888887346,2026-04-07 11:31:54.600830,2026-04-07 11:31:55.091734,0 days 00:00:00.490904,25.247083222135473,17.63392827888179,0.8463392614933327,Cu,PRUNED
1991,-1.0,2026-04-07 11:31:54.613296,2026-04-07 11:31:55.080478,0 days 00:00:00.467182,32.55621214466392,14.999490019445075,1.215251489852623,Cu,COMPLETE
1992,-1.0,2026-04-07 11:31:54.641048,2026-04-07 11:31:55.297781,0 days 00:00:00.656733,22.863218251456004,17.55893878922986,1.1004669142408985,Cu,COMPLETE
1993,-1.0,2026-04-07 11:31:54.824968,2026-04-07 11:31:55.296775,0 days 00:00:00.471807,22.612707064421954,16.675252927274087,0.8917203221225595,Cu,COMPLETE
1994,-1.0,2026-04-07 11:31:54.683878,2026-04-07 11:31:55.233454,0 days 00:00:00.549576,27.827991068432407,15.916033155342687,0.9124114466145592,Cu,COMPLETE
1995,0.0,2026-04-07 11:31:54.810601,2026-04-07 11:31:55.693800,0 days 00:00:00.883199,21.163348453815285,16.963779639000276,1.2550567804201762,Au,PRUNED
1996,0.0,2026-04-07 11:31:54.679395,2026-04-07 11:31:55.475581,0 days 00:00:00.796186,39.19003145956538,15.05690498404668,1.1595070689163076,Au,PRUNED
1997,-1.0,2026-04-07 11:31:55.002499,2026-04-07 11:31:55.516332,0 days 00:00:00.513833,41.41645218512133,18.91721652334748,1.420369840091214,Cu,COMPLETE
1998,-1.0,2026-04-07 11:31:55.211861,2026-04-07 11:31:55.879225,0 days 00:00:00.667364,86.98112206173447,12.436530745009748,1.656106030568781,Ag,COMPLETE
1999,2.403846153845969,2026-04-07 11:31:55.275942,2026-04-07 11:31:55.836464,0 days 00:00:00.560522,40.606482367743,15.627559642438774,0.7955733269984868,Cu,PRUNED
2000,-1.456876456876416,2026-04-07 11:31:55.447024,2026-04-07 11:31:56.048441,0 days 00:00:00.601417,41.929081431147026,19.30969036183942,0.9819029153839541,Cu,PRUNED
2001,-1.0,2026-04-07 11:31:55.487792,2026-04-07 11:31:56.074912,0 days 00:00:00.587120,45.92459226857041,17.10083082069329,0.9507668565454066,Cu,COMPLETE
2002,-13.15789473684072,2026-04-07 11:31:55.518326,2026-04-07 11:31:55.995513,0 days 00:00:00.477187,24.41283902060468,17.109400131191983,1.2770449453583952,Cu,PRUNED
2003,-1.0,2026-04-07 11:31:55.603918,2026-04-07 11:31:56.195144,0 days 00:00:00.591226,28.428035114682842,18.891432377982234,1.0323966494119052,Cu,COMPLETE
2004,-11.574074074072788,2026-04-07 11:31:55.759255,2026-04-07 11:31:56.263459,0 days 00:00:00.504204,26.745097839120827,16.750826593229988,1.413876199917428,Cu,PRUNED
2005,4.084967320261118,2026-04-07 11:31:55.783800,2026-04-07 11:31:56.656932,0 days 00:00:00.873132,29.685514220582593,19.32710892083221,0.7997339640526975,Cu,PRUNED
2006,-300.3187613843022,2026-04-07 11:31:55.924953,2026-04-07 11:31:56.484593,0 days 00:00:00.559640,21.22429850166047,19.31957713172861,1.1948180130170964,Cu,COMPLETE
2007,44.54926624737833,2026-04-07 11:31:56.022170,2026-04-07 11:31:56.558156,0 days 00:00:00.535986,52.4803393928738,14.37111735735191,1.0648622669069616,Cu,PRUNED
2008,-1.0,2026-04-07 11:31:56.050913,2026-04-07 11:31:56.555676,0 days 00:00:00.504763,46.14991388794472,17.366820588360124,1.0729705422686664,Cu,COMPLETE
2009,-1.0,2026-04-07 11:31:56.105473,2026-04-07 11:31:56.772827,0 days 00:00:00.667354,26.540224080968358,17.83444747600244,1.069561051732271,Cu,COMPLETE
2010,-1.0,2026-04-07 11:31:56.230886,2026-04-07 11:31:56.780649,0 days 00:00:00.549763,20.440817048658317,12.201159214047514,1.7155759729573026,Au,COMPLETE
2011,-12.731481481480067,2026-04-07 11:31:56.318019,2026-04-07 11:31:56.945405,0 days 00:00:00.627386,25.207045717306617,17.558769890463577,1.2550314447645452,Cu,PRUNED
2012,-196.1678832116646,2026-04-07 11:31:56.362129,2026-04-07 11:31:56.945405,0 days 00:00:00.583276,20.815358447562765,18.832653135217495,0.9888741155528936,Cu,COMPLETE
2013,2.4509803921566706,2026-04-07 11:31:56.633469,2026-04-07 11:31:57.339770,0 days 00:00:00.706301,30.37322555530357,17.370081752537654,1.4171559782536967,Cu,PRUNED
2014,-1.0,2026-04-07 11:31:56.647016,2026-04-07 11:31:57.182499,0 days 00:00:00.535483,20.61727182956069,15.457125788022147,0.7548161032376972,Cu,COMPLETE
2015,0.0,2026-04-07 11:31:56.687788,2026-04-07 11:31:57.342285,0 days 00:00:00.654497,38.604681628041654,19.84588495208054,1.0585512718010046,Cu,PRUNED
2016,-1.0,2026-04-07 11:31:56.703783,2026-04-07 11:31:57.229856,0 days 00:00:00.526073,33.99374046429282,19.707429998116,1.158595485215777,Cu,COMPLETE
2017,-6.313131313130548,2026-04-07 11:31:56.948521,2026-04-07 11:31:57.776900,0 days 00:00:00.828379,23.473584829711875,19.826175939957682,1.3827351734253426,Cu,PRUNED
2018,-1.0,2026-04-07 11:31:57.013367,2026-04-07 11:31:57.529108,0 days 00:00:00.515741,21.7869876678973,16.266027377032877,1.0519961944541683,Cu,COMPLETE
2019,-1.0,2026-04-07 11:31:57.041195,2026-04-07 11:31:57.529615,0 days 00:00:00.488420,33.69971932791646,17.828069493006385,1.1513297901102229,Cu,COMPLETE
2020,-1.0,2026-04-07 11:31:57.100542,2026-04-07 11:31:57.614536,0 days 00:00:00.513994,23.502918475735722,19.446271459119956,1.1325129959814773,Cu,COMPLETE
2021,-1.0,2026-04-07 11:31:57.338756,2026-04-07 11:31:58.151365,0 days 00:00:00.812609,31.039837484280312,19.65249763933,1.1697791262225739,Cu,COMPLETE
2022,-12.731481481480067,2026-04-07 11:31:57.416925,2026-04-07 11:31:58.067635,0 days 00:00:00.650710,22.77155793537106,18.829469898882927,1.1982641188122167,Cu,PRUNED
2023,80.55555555555317,2026-04-07 11:31:57.467151,2026-04-07 11:31:58.106545,0 days 00:00:00.639394,29.808279690230076,17.344467881141146,1.1444529216920782,Au,PRUNED
2024,-26.78571428571046,2026-04-07 11:31:57.498726,2026-04-07 11:31:58.057075,0 days 00:00:00.558349,35.501326594887296,17.68980714382389,1.1247113102376063,Ag,PRUNED
2025,0.0,2026-04-07 11:31:57.654542,2026-04-07 11:31:58.357629,0 days 00:00:00.703087,21.386690990006258,17.02388150483068,1.1150086867168296,Cu,PRUNED
2026,-1.0,2026-04-07 11:31:57.668307,2026-04-07 11:31:58.150349,0 days 00:00:00.482042,28.438542697944875,18.176454231344017,1.1046071951574097,Cu,COMPLETE
2027,-1.0,2026-04-07 11:31:57.755516,2026-04-07 11:31:58.295247,0 days 00:00:00.539731,26.28213732538128,18.335988098390192,1.3214181889871446,Cu,COMPLETE
2028,-293.4587813619754,2026-04-07 11:31:57.901196,2026-04-07 11:31:58.491353,0 days 00:00:00.590157,21.136801645039714,19.18204703024193,1.0987626075525565,Cu,COMPLETE
2029,-13.095238095236597,2026-04-07 11:31:58.183962,2026-04-07 11:31:58.965573,0 days 00:00:00.781611,25.33688776209643,18.335593562310923,0.6767032460637469,Cu,PRUNED
2030,-1.0,2026-04-07 11:31:58.265704,2026-04-07 11:31:58.712970,0 days 00:00:00.447266,32.90988666478097,16.833472907449185,1.1778519764082966,Cu,COMPLETE
2031,-1.0,2026-04-07 11:31:58.328662,2026-04-07 11:31:58.943809,0 days 00:00:00.615147,48.29269656807958,17.7454544190935,1.4358102149841152,Cu,COMPLETE
2032,-205.3345959595804,2026-04-07 11:31:58.405599,2026-04-07 11:31:59.091130,0 days 00:00:00.685531,20.855111157499262,19.314092453428746,0.8729654857967273,Cu,COMPLETE
2033,-1.0,2026-04-07 11:31:58.435760,2026-04-07 11:31:58.997151,0 days 00:00:00.561391,31.098251369196717,19.358450888514316,1.3421871202041833,Cu,COMPLETE
2034,-1.0,2026-04-07 11:31:58.451273,2026-04-07 11:31:58.905565,0 days 00:00:00.454292,40.356509946695326,19.851312156740033,0.7606194903305448,Cu,COMPLETE
2035,-1.0,2026-04-07 11:31:58.531204,2026-04-07 11:31:58.881590,0 days 00:00:00.350386,20.336175081527497,16.537483166292713,0.952537680643264,Cu,COMPLETE
2036,-1.0,2026-04-07 11:31:58.661857,2026-04-07 11:31:59.046873,0 days 00:00:00.385016,23.02581042096649,19.714665977572345,0.9142053948428579,Cu,COMPLETE
2037,-1.0,2026-04-07 11:31:58.859789,2026-04-07 11:31:59.327464,0 days 00:00:00.467675,25.57914468581311,19.50390176425818,1.333534909163167,Cu,COMPLETE
2038,-1.0,2026-04-07 11:31:59.033198,2026-04-07 11:31:59.496563,0 days 00:00:00.463365,20.596331403293647,19.935676731613498,1.0209488503663087,Cu,COMPLETE
2039,-13.888888888887346,2026-04-07 11:31:59.049874,2026-04-07 11:31:59.734897,0 days 00:00:00.685023,24.30419894872572,18.5605587926535,0.5608882853140167,Cu,PRUNED
2040,0.0,2026-04-07 11:31:59.092147,2026-04-07 11:31:59.653760,0 days 00:00:00.561613,21.69904788425894,14.775369156711246,1.4273361014374544,Cu,PRUNED
2041,-1.0,2026-04-07 11:31:59.148223,2026-04-07 11:31:59.501623,0 days 00:00:00.353400,20.623652405246652,19.656888578465438,1.2218400949804582,Cu,COMPLETE
2042,-3.571428571428163,2026-04-07 11:31:59.172596,2026-04-07 11:31:59.795407,0 days 00:00:00.622811,28.47384745033298,17.404465579831562,1.227979856211112,Cu,PRUNED
2043,0.0,2026-04-07 11:31:59.191703,2026-04-07 11:31:59.830693,0 days 00:00:00.638990,20.667909124886954,17.736352336911565,0.5144435097740101,Cu,PRUNED
2044,-1.0,2026-04-07 11:31:59.276507,2026-04-07 11:31:59.707887,0 days 00:00:00.431380,33.88597635416191,17.694756695772597,0.9709317242236469,Cu,COMPLETE
2045,-15.35087719298084,2026-04-07 11:31:59.429078,2026-04-07 11:32:00.488288,0 days 00:00:01.059210,27.83212775531118,15.361261620972089,1.05387235430801,Cu,PRUNED
2046,-1.0,2026-04-07 11:31:59.583111,2026-04-07 11:31:59.973414,0 days 00:00:00.390303,29.14866409538822,19.456845283224165,0.9849821189719425,Cu,COMPLETE
2047,-1.0,2026-04-07 11:31:59.600293,2026-04-07 11:32:00.394754,0 days 00:00:00.794461,20.887056666178786,18.25386845288936,1.1456442990666524,Cu,COMPLETE
2048,-1.1904761904760544,2026-04-07 11:31:59.787968,2026-04-07 11:32:00.384826,0 days 00:00:00.596858,29.626512174707806,16.95576284328812,1.3632478778160346,Cu,PRUNED
2049,-1.0,2026-04-07 11:31:59.766921,2026-04-07 11:32:00.342737,0 days 00:00:00.575816,22.652415886743686,16.615064213454545,1.1362508077961893,Cu,COMPLETE
2050,-1.0,2026-04-07 11:31:59.798908,2026-04-07 11:32:00.392829,0 days 00:00:00.593921,21.566771911236334,19.77213682285065,1.2189160567408395,Cu,COMPLETE
2051,-1.0,2026-04-07 11:32:00.019556,2026-04-07 11:32:00.510454,0 days 00:00:00.490898,24.007524707221858,18.48149817569079,0.6789671408052221,Cu,COMPLETE
2052,0.0,2026-04-07 11:32:00.031226,2026-04-07 11:32:00.470326,0 days 00:00:00.439100,35.46485416730117,19.63729703895947,1.2796015863095562,Cu,PRUNED
2053,-1.0,2026-04-07 11:32:00.104606,2026-04-07 11:32:00.630853,0 days 00:00:00.526247,27.338407586061408,16.501046965792106,0.9354271582970438,Cu,COMPLETE
2054,79.0441176470565,2026-04-07 11:32:00.462774,2026-04-07 11:32:01.092451,0 days 00:00:00.629677,31.46824756002276,19.822556127169673,0.6701852506338918,Cu,PRUNED
2055,3.2051282051279584,2026-04-07 11:32:00.532952,2026-04-07 11:32:01.157140,0 days 00:00:00.624188,39.076540111195364,16.244355200835678,0.8753664081492807,Cu,PRUNED
2056,-1.0,2026-04-07 11:32:00.409262,2026-04-07 11:32:01.124145,0 days 00:00:00.714883,33.96305406364966,17.34599923098014,0.941907663014574,Cu,COMPLETE
2057,65.17857142856957,2026-04-07 11:32:00.583525,2026-04-07 11:32:01.314421,0 days 00:00:00.730896,40.13843786941712,16.625870109888496,1.0509977904727261,Cu,PRUNED
2058,-1.0,2026-04-07 11:32:00.598115,2026-04-07 11:32:01.221749,0 days 00:00:00.623634,33.279437923434195,13.034712007786545,0.9721186229964913,Cu,COMPLETE
2059,-0.5952380952380781,2026-04-07 11:32:00.710118,2026-04-07 11:32:01.578363,0 days 00:00:00.868245,22.246404044410276,11.515911085315032,1.9764713981646616,Cu,PRUNED
2060,-1.0,2026-04-07 11:32:00.744800,2026-04-07 11:32:01.026364,0 days 00:00:00.281564,23.30796819266541,19.890089659465932,1.0860327056020869,Cu,COMPLETE
2061,-14.25438596491078,2026-04-07 11:32:00.785007,2026-04-07 11:32:01.253719,0 days 00:00:00.468712,23.985222059197906,17.977149981840768,0.7800584664919328,Cu,PRUNED
2062,-314.63068181814606,2026-04-07 11:32:01.128776,2026-04-07 11:32:01.912246,0 days 00:00:00.783470,20.837945119002136,19.96967335870652,1.2097664171011429,Cu,COMPLETE
2063,-1.0,2026-04-07 11:32:01.279535,2026-04-07 11:32:01.821487,0 days 00:00:00.541952,22.289025912607467,16.666080977435602,1.1690670169796704,Cu,COMPLETE
2064,-1.1185682326621622,2026-04-07 11:32:01.222750,2026-04-07 11:32:01.846393,0 days 00:00:00.623643,48.85114445231842,18.703052877675436,0.5690905623057742,Cu,PRUNED
2065,-14.639639639638055,2026-04-07 11:32:01.379210,2026-04-07 11:32:02.004236,0 days 00:00:00.625026,25.428605523008073,16.862103476147606,1.0137187884847574,Cu,PRUNED
2066,-1.0,2026-04-07 11:32:01.390962,2026-04-07 11:32:01.847398,0 days 00:00:00.456436,48.03202643961231,18.9860958630499,1.220205466478035,Cu,COMPLETE
2067,5.43478260869518,2026-04-07 11:32:01.408474,2026-04-07 11:32:01.942323,0 days 00:00:00.533849,40.17851274474044,19.797290280735517,1.0408226568330103,Ag,PRUNED
2068,-13.513513513512052,2026-04-07 11:32:01.442256,2026-04-07 11:32:01.912246,0 days 00:00:00.469990,24.787089959116592,17.117129454039194,1.0158697794010618,Cu,PRUNED
2069,-1.0,2026-04-07 11:32:01.622546,2026-04-07 11:32:02.251927,0 days 00:00:00.629381,37.47538150942611,19.271696253893765,0.9563647628407309,Cu,COMPLETE
2070,-1.0,2026-04-07 11:32:02.016677,2026-04-07 11:32:02.459889,0 days 00:00:00.443212,20.94456818078083,17.02402882656681,1.193707658973585,Cu,COMPLETE
2071,-1.0,2026-04-07 11:32:01.915685,2026-04-07 11:32:02.501993,0 days 00:00:00.586308,27.4224624778813,19.6013413207316,1.3081856185900882,Cu,COMPLETE
2072,-1.0,2026-04-07 11:32:02.047962,2026-04-07 11:32:02.543494,0 days 00:00:00.495532,20.860354263746533,18.422314174613593,1.3851501573787397,Cu,COMPLETE
2073,-13.513513513512052,2026-04-07 11:32:02.081084,2026-04-07 11:32:02.704199,0 days 00:00:00.623115,24.683692853468482,17.498752636149483,1.4337554094354845,Cu,PRUNED
2074,0.0,2026-04-07 11:32:02.097804,2026-04-07 11:32:02.612869,0 days 00:00:00.515065,20.43353035375232,18.420969113580142,0.9810165449952569,Cu,PRUNED
2075,0.0,2026-04-07 11:32:02.203036,2026-04-07 11:32:02.723086,0 days 00:00:00.520050,34.79558014843785,19.403831060083736,1.4538306268455718,Cu,PRUNED
2076,-1.0,2026-04-07 11:32:02.280454,2026-04-07 11:32:02.642733,0 days 00:00:00.362279,37.38288597891108,19.322883087310036,1.4596456179641724,Cu,COMPLETE
2077,-12.254901960782872,2026-04-07 11:32:02.391917,2026-04-07 11:32:02.944502,0 days 00:00:00.552585,22.557420025261802,19.975371523339014,0.7781081010286122,Cu,PRUNED
2078,-1.0,2026-04-07 11:32:02.671266,2026-04-07 11:32:03.418525,0 days 00:00:00.747259,20.371277973076847,18.826041881549237,1.0808573838181699,Cu,COMPLETE
2079,-1.0,2026-04-07 11:32:02.737379,2026-04-07 11:32:03.163044,0 days 00:00:00.425665,27.44097267474104,19.419538387015894,0.9355690562914092,Cu,COMPLETE
2080,-11.029411764704586,2026-04-07 11:32:02.762464,2026-04-07 11:32:03.388583,0 days 00:00:00.626119,24.064347285764267,18.740092490731058,1.1485231942798702,Cu,PRUNED
2081,2.4509803921565743,2026-04-07 11:32:02.782963,2026-04-07 11:32:03.355551,0 days 00:00:00.572588,26.355453478039173,19.84827570922718,0.8694319710014482,Cu,PRUNED
2082,-1.0,2026-04-07 11:32:02.806712,2026-04-07 11:32:03.388583,0 days 00:00:00.581871,20.563316394420355,19.19371086566811,1.2679892229556609,Cu,COMPLETE
2083,-6.218905472636446,2026-04-07 11:32:02.898254,2026-04-07 11:32:03.430906,0 days 00:00:00.532652,23.907564138944828,13.05860913172135,1.1078311695689926,Cu,PRUNED
2084,0.0,2026-04-07 11:32:02.976500,2026-04-07 11:32:03.694414,0 days 00:00:00.717914,36.4445177510454,19.502775632729744,1.1964183051982742,Cu,PRUNED
2085,-1.0,2026-04-07 11:32:02.985853,2026-04-07 11:32:03.609223,0 days 00:00:00.623370,21.141799583216695,17.02257970317025,1.5653810121551894,Cu,COMPLETE
2086,-1.0,2026-04-07 11:32:03.333503,2026-04-07 11:32:03.926194,0 days 00:00:00.592691,22.346519565996875,19.64388039245273,0.7195046874804134,Cu,COMPLETE
2087,-1.0,2026-04-07 11:32:03.536590,2026-04-07 11:32:04.037928,0 days 00:00:00.501338,38.39971641451102,17.571804747420963,1.2309950228638051,Cu,COMPLETE
2088,-12.387387387386047,2026-04-07 11:32:03.562544,2026-04-07 11:32:04.038931,0 days 00:00:00.476387,23.21134895612652,17.92258208549195,1.4656674899499413,Cu,PRUNED
2089,-1.0,2026-04-07 11:32:03.622720,2026-04-07 11:32:04.171011,0 days 00:00:00.548291,21.322504453334894,18.348999764660565,0.8277417481096503,Cu,COMPLETE
2090,-8.928571428570791,2026-04-07 11:32:03.639248,2026-04-07 11:32:04.204521,0 days 00:00:00.565273,24.223390012709793,17.075070592121268,0.7726793064463084,Cu,PRUNED
2091,-1.0,2026-04-07 11:32:03.654890,2026-04-07 11:32:04.147288,0 days 00:00:00.492398,23.651162657695156,18.87935112661835,1.0111647283049316,Cu,COMPLETE
2092,-1.0,2026-04-07 11:32:03.728745,2026-04-07 11:32:04.282063,0 days 00:00:00.553318,20.68667217014751,17.829456084886683,1.371637965337984,Cu,COMPLETE
2093,-1.0,2026-04-07 11:32:03.833105,2026-04-07 11:32:04.236234,0 days 00:00:00.403129,33.610222084870486,19.85846682427647,1.2049862816308816,Cu,COMPLETE
2094,-9.615384615383876,2026-04-07 11:32:04.092449,2026-04-07 11:32:04.823573,0 days 00:00:00.731124,38.51495951319032,13.681399705184694,0.6331506321480581,Cu,PRUNED
2095,-1.633986928104447,2026-04-07 11:32:04.208843,2026-04-07 11:32:04.904622,0 days 00:00:00.695779,32.089261858785676,16.181906261806546,1.2222150607169378,Cu,PRUNED
2096,-1.0,2026-04-07 11:32:04.299372,2026-04-07 11:32:04.923565,0 days 00:00:00.624193,34.081858111066374,17.597165204814324,1.3092272905027216,Cu,COMPLETE
2097,80.26960784313488,2026-04-07 11:32:04.316592,2026-04-07 11:32:04.824663,0 days 00:00:00.508071,28.960651725221123,19.655701123341597,1.2518149030635553,Cu,PRUNED
2098,-1.0,2026-04-07 11:32:04.370320,2026-04-07 11:32:04.785453,0 days 00:00:00.415133,20.050841214999206,15.27305767520217,1.3107555389548675,Cu,COMPLETE
2099,-1.0,2026-04-07 11:32:04.390810,2026-04-07 11:32:05.092044,0 days 00:00:00.701234,20.90007728373201,18.249676135634754,1.5613946455406733,Au,COMPLETE
2100,-171.60087719297115,2026-04-07 11:32:04.423883,2026-04-07 11:32:05.046036,0 days 00:00:00.622153,21.64014050466664,16.673105314103417,1.311403396398401,Cu,COMPLETE
2101,-1.0,2026-04-07 11:32:04.466199,2026-04-07 11:32:04.861057,0 days 00:00:00.394858,22.630639062657597,19.942361975303093,1.3129148965429094,Cu,COMPLETE
2102,-1.0,2026-04-07 11:32:04.955880,2026-04-07 11:32:05.473461,0 days 00:00:00.517581,27.18236453023811,16.05919341094996,1.2956337299263891,Cu,COMPLETE
2103,-9.433962264150232,2026-04-07 11:32:04.987184,2026-04-07 11:32:05.670005,0 days 00:00:00.682821,33.52416669433697,13.88966424863379,1.3607896838874962,Cu,PRUNED
2104,-0.83668005354751,2026-04-07 11:32:05.001415,2026-04-07 11:32:05.623342,0 days 00:00:00.621927,65.24269431223773,14.656492582125077,1.9615503809483177,Cu,PRUNED
2105,-1.0,2026-04-07 11:32:05.048041,2026-04-07 11:32:05.551175,0 days 00:00:00.503134,24.909696391153304,15.168044971105374,0.9532978121470251,Cu,COMPLETE
2106,-8.474576271185866,2026-04-07 11:32:05.148815,2026-04-07 11:32:05.591124,0 days 00:00:00.442309,24.391588276924693,16.00413355272751,1.0972030420355976,Cu,PRUNED
2107,0.0,2026-04-07 11:32:05.206750,2026-04-07 11:32:05.783351,0 days 00:00:00.576601,31.03328235116531,19.23611692333666,1.0462989826848217,Au,PRUNED
2108,-10.606060606059835,2026-04-07 11:32:05.307877,2026-04-07 11:32:05.843964,0 days 00:00:00.536087,30.2246370033336,14.20983560284789,1.3696314513280072,Cu,PRUNED
2109,-1.0,2026-04-07 11:32:05.343240,2026-04-07 11:32:05.859396,0 days 00:00:00.516156,21.488810831307877,16.117466835051548,0.9532571386321118,Cu,COMPLETE
2110,-1.0,2026-04-07 11:32:05.633230,2026-04-07 11:32:06.084631,0 days 00:00:00.451401,36.38427513279798,14.152511493936714,1.2800614761821576,Cu,COMPLETE
2111,-1.0,2026-04-07 11:32:05.694636,2026-04-07 11:32:06.167195,0 days 00:00:00.472559,31.192798824861697,19.525764902140693,1.4710326648375638,Cu,COMPLETE
2112,-12.387387387386047,2026-04-07 11:32:05.720821,2026-04-07 11:32:06.462306,0 days 00:00:00.741485,23.79119784583452,17.804020982297533,1.5744988179590131,Cu,PRUNED
2113,-1.0,2026-04-07 11:32:05.824691,2026-04-07 11:32:06.347223,0 days 00:00:00.522532,43.6603189504587,16.205483155007233,1.2840544628303192,Cu,COMPLETE
2114,58.978873239434954,2026-04-07 11:32:05.873932,2026-04-07 11:32:06.464741,0 days 00:00:00.590809,44.06161919499291,15.947087969258273,1.1842869622897898,Cu,PRUNED
2115,-1.1737089201877602,2026-04-07 11:32:05.942503,2026-04-07 11:32:06.218313,0 days 00:00:00.275810,41.60779428884216,18.339716910933493,1.6886179030103867,Cu,PRUNED
2116,74.94004796162854,2026-04-07 11:32:05.952293,2026-04-07 11:32:06.464741,0 days 00:00:00.512448,36.460988142333036,18.062300633015784,1.521545263982987,Cu,PRUNED
2117,67.26190476190283,2026-04-07 11:32:06.155509,2026-04-07 11:32:06.956700,0 days 00:00:00.801191,39.50874136876601,17.456886392987002,0.9543355434369013,Cu,PRUNED
