number,value,datetime_start,datetime_complete,duration,params_D2_nm,params_D3_nm,params_D4_nm,params_metal,state
4895,0.0,2026-04-07 11:36:52.856293,2026-04-07 11:36:53.572034,0 days 00:00:00.715741,33.52830115172672,19.794937023782964,0.6026847108429342,Au,PRUNED
4896,-1.0,2026-04-07 11:36:53.050766,2026-04-07 11:36:53.846169,0 days 00:00:00.795403,45.55687443050438,17.6808966255668,0.33162053189749396,Au,COMPLETE
4897,-297.2972972972652,2026-04-07 11:36:53.073695,2026-04-07 11:36:53.963255,0 days 00:00:00.889560,21.81350868323668,17.064875494924767,0.9791636321525161,Au,PRUNED
4898,-19.23076923076627,2026-04-07 11:36:53.105830,2026-04-07 11:36:54.041360,0 days 00:00:00.935530,43.7462110948198,10.229243859351856,0.3404143303081226,Ag,PRUNED
4899,-1.0,2026-04-07 11:36:53.133853,2026-04-07 11:36:53.681037,0 days 00:00:00.547184,20.34116056999298,18.02607876268078,0.6672663131570075,Au,COMPLETE
4900,-1.0,2026-04-07 11:36:53.132846,2026-04-07 11:36:53.788452,0 days 00:00:00.655606,46.98082021875554,19.895211937759576,0.8454357344413279,Au,COMPLETE
4901,0.0,2026-04-07 11:36:53.634828,2026-04-07 11:36:54.596448,0 days 00:00:00.961620,37.81673805380029,19.962297852002067,0.5645545306480656,Cu,PRUNED
4902,79.0441176470565,2026-04-07 11:36:53.659466,2026-04-07 11:36:54.550680,0 days 00:00:00.891214,36.134505346301154,15.077396921761705,0.47472294457553993,Au,PRUNED
4903,0.0,2026-04-07 11:36:53.698949,2026-04-07 11:36:54.506849,0 days 00:00:00.807900,20.150627046646267,17.300836275899442,0.5777964723170728,Au,PRUNED
4904,80.55555555555317,2026-04-07 11:36:53.883454,2026-04-07 11:36:54.506849,0 days 00:00:00.623395,30.09996117885688,17.593451861425706,0.8076881861825984,Au,PRUNED
4905,0.0,2026-04-07 11:36:54.042361,2026-04-07 11:36:54.579314,0 days 00:00:00.536953,31.819690219710612,19.990998999237593,0.26295172975474096,Au,PRUNED
4906,-1.0,2026-04-07 11:36:54.088956,2026-04-07 11:36:54.693041,0 days 00:00:00.604085,32.407946903762586,16.858393242982807,0.6191841206816814,Au,COMPLETE
4907,-1.0,2026-04-07 11:36:54.117577,2026-04-07 11:36:54.531938,0 days 00:00:00.414361,20.339849438164258,17.35822233402603,0.9350074841497791,Au,COMPLETE
4908,0.0,2026-04-07 11:36:54.139626,2026-04-07 11:36:54.865774,0 days 00:00:00.726148,20.14509475642514,17.355914987592413,0.9699391579867416,Au,PRUNED
4909,-1.0,2026-04-07 11:36:54.589179,2026-04-07 11:36:55.304528,0 days 00:00:00.715349,36.08509869231007,17.071729246875957,0.33574503568403224,Au,COMPLETE
4910,-1.0,2026-04-07 11:36:54.549096,2026-04-07 11:36:55.304528,0 days 00:00:00.755432,37.73144631938989,19.981121251473105,0.8422086632372653,Au,COMPLETE
4911,-1.0,2026-04-07 11:36:54.773755,2026-04-07 11:36:55.409707,0 days 00:00:00.635952,34.362166352996056,17.620251479774968,0.9278209695177054,Au,COMPLETE
4912,-12.499999999999,2026-04-07 11:36:54.805644,2026-04-07 11:36:55.393609,0 days 00:00:00.587965,24.702617251033853,19.9525357999508,0.788204050558428,Ag,PRUNED
4913,-1.0,2026-04-07 11:36:54.824610,2026-04-07 11:36:55.346946,0 days 00:00:00.522336,35.4464615040336,19.96838825077399,0.43460324909931947,Au,COMPLETE
4914,0.0,2026-04-07 11:36:54.884344,2026-04-07 11:36:55.492098,0 days 00:00:00.607754,20.38317251006642,18.143579363481244,0.6066282462418635,Cu,PRUNED
4915,0.0,2026-04-07 11:36:55.009767,2026-04-07 11:36:56.093858,0 days 00:00:01.084091,31.389516523128798,17.720708332005994,0.9001299902312467,Au,PRUNED
4916,0.0,2026-04-07 11:36:55.026452,2026-04-07 11:36:55.587502,0 days 00:00:00.561050,35.07137444932349,17.83570664145039,0.8427784067571031,Au,PRUNED
4917,0.0,2026-04-07 11:36:55.462726,2026-04-07 11:36:56.262845,0 days 00:00:00.800119,33.14439685545827,17.440269185550306,0.5964097683466445,Au,PRUNED
4918,-1.0,2026-04-07 11:36:55.507060,2026-04-07 11:36:56.054645,0 days 00:00:00.547585,44.019591242137025,16.991035780917475,0.9906809533695558,Au,COMPLETE
4919,-1.0,2026-04-07 11:36:55.539256,2026-04-07 11:36:56.149891,0 days 00:00:00.610635,33.640809047031915,18.18112881552874,0.5811696087314957,Au,COMPLETE
4920,-413.6253041361929,2026-04-07 11:36:55.569030,2026-04-07 11:36:56.408114,0 days 00:00:00.839084,21.416792552856606,19.717001830691917,0.30198912084398993,Au,COMPLETE
4921,-1.0,2026-04-07 11:36:55.586041,2026-04-07 11:36:56.261296,0 days 00:00:00.675255,32.15451727381017,17.835434172028783,0.5423766593967122,Au,COMPLETE
4922,-1.0,2026-04-07 11:36:55.598376,2026-04-07 11:36:56.208896,0 days 00:00:00.610520,32.80354818581168,17.467405524107473,0.7008298475179029,Au,COMPLETE
4923,0.0,2026-04-07 11:36:55.729244,2026-04-07 11:36:56.406752,0 days 00:00:00.677508,30.365709349770334,19.943697086703263,0.7300451895005833,Au,PRUNED
4924,-1.0,2026-04-07 11:36:56.234385,2026-04-07 11:36:56.833900,0 days 00:00:00.599515,20.30188715480511,19.8537329548209,0.7114045356348601,Au,COMPLETE
4925,0.0,2026-04-07 11:36:56.339338,2026-04-07 11:36:56.977683,0 days 00:00:00.638345,31.252488423191018,17.666180987011394,0.6807658590724232,Au,PRUNED
4926,0.0,2026-04-07 11:36:56.348087,2026-04-07 11:36:57.102341,0 days 00:00:00.754254,40.363460198021485,19.910290467009908,0.6566436722825785,Au,PRUNED
4927,-1.0,2026-04-07 11:36:56.411118,2026-04-07 11:36:57.102341,0 days 00:00:00.691223,117.9712184275138,19.335280598892346,1.9207912014011592,Ag,COMPLETE
4928,-1.0,2026-04-07 11:36:56.475797,2026-04-07 11:36:57.043010,0 days 00:00:00.567213,29.503421883269926,17.53529483291335,0.8989288380915466,Au,COMPLETE
4929,-1.0,2026-04-07 11:36:56.529368,2026-04-07 11:36:57.041507,0 days 00:00:00.512139,20.660374856773572,17.855811936153675,0.9746476611392546,Au,COMPLETE
4930,-417.27941176464446,2026-04-07 11:36:56.586702,2026-04-07 11:36:57.388709,0 days 00:00:00.802007,20.56611799275897,19.88798437043506,0.8775490368703674,Au,COMPLETE
4931,-1.0,2026-04-07 11:36:56.652197,2026-04-07 11:36:57.210498,0 days 00:00:00.558301,29.6979705445629,16.941028103863573,0.7315958512486106,Au,COMPLETE
4932,-1.0,2026-04-07 11:36:57.004914,2026-04-07 11:36:57.674378,0 days 00:00:00.669464,45.43740090338562,19.99016221657308,0.44443410748830187,Au,COMPLETE
4933,-1.0,2026-04-07 11:36:57.046521,2026-04-07 11:36:57.737677,0 days 00:00:00.691156,23.49978831728719,19.953668322728127,0.4975185304253823,Au,COMPLETE
4934,0.0,2026-04-07 11:36:57.105347,2026-04-07 11:36:57.852249,0 days 00:00:00.746902,20.47097874119248,17.088665331017804,0.8131223593312762,Au,PRUNED
4935,-1.0,2026-04-07 11:36:57.237162,2026-04-07 11:36:57.878964,0 days 00:00:00.641802,20.39737723898453,16.49320366771873,0.840501239967631,Au,COMPLETE
4936,-1.0,2026-04-07 11:36:57.259540,2026-04-07 11:36:58.002588,0 days 00:00:00.743048,21.124098661754566,17.13455702244599,0.5921162340918302,Au,COMPLETE
4937,-1.0,2026-04-07 11:36:57.418152,2026-04-07 11:36:57.963905,0 days 00:00:00.545753,21.937615456388944,19.94696999657724,0.4267753361282543,Au,COMPLETE
4938,-1.0,2026-04-07 11:36:57.392079,2026-04-07 11:36:57.987663,0 days 00:00:00.595584,31.968558655392705,19.839404144865117,0.7240651437435838,Au,COMPLETE
4939,-1.0,2026-04-07 11:36:57.613886,2026-04-07 11:36:58.188037,0 days 00:00:00.574151,35.81034011134551,17.401274267892074,0.13157031708899264,Au,COMPLETE
4940,7.352941176469723,2026-04-07 11:36:57.919384,2026-04-07 11:36:58.643153,0 days 00:00:00.723769,28.653644438645482,17.49176714874945,0.10549125283762434,Au,PRUNED
4941,-1.0,2026-04-07 11:36:57.938587,2026-04-07 11:36:58.468152,0 days 00:00:00.529565,20.620688645717948,19.97856366282973,0.4566786670872746,Cu,COMPLETE
4942,7.697456492637091,2026-04-07 11:36:58.035084,2026-04-07 11:36:58.917881,0 days 00:00:00.882797,110.67380012104505,7.186117033336493,0.16980742902709411,Cu,PRUNED
4943,-1.0,2026-04-07 11:36:58.078471,2026-04-07 11:36:58.966122,0 days 00:00:00.887651,32.610484565076206,19.868301844331583,0.8537222943069146,Au,COMPLETE
4944,-1.0,2026-04-07 11:36:58.147813,2026-04-07 11:36:58.641134,0 days 00:00:00.493321,31.52265994257639,19.793177378439974,0.9171801693159535,Au,COMPLETE
4945,-1.0,2026-04-07 11:36:58.181520,2026-04-07 11:36:58.845248,0 days 00:00:00.663728,21.693707722343568,17.88631952140593,0.5454465679624504,Au,COMPLETE
4946,-1.0,2026-04-07 11:36:58.256599,2026-04-07 11:36:58.857984,0 days 00:00:00.601385,34.55998744437284,19.936150763046946,0.8849779693237458,Au,COMPLETE
4947,0.0,2026-04-07 11:36:58.471495,2026-04-07 11:36:59.266977,0 days 00:00:00.795482,20.264833742048722,18.070819320258217,0.43596211174190286,Au,PRUNED
4948,-8.333333333332,2026-04-07 11:36:58.670593,2026-04-07 11:36:59.409330,0 days 00:00:00.738737,22.315443564153416,19.99323576437784,0.3292851010931851,Au,PRUNED
4949,-1.0,2026-04-07 11:36:58.808165,2026-04-07 11:36:59.584803,0 days 00:00:00.776638,95.84008858461422,11.385799865721719,0.14259337532823269,Cu,COMPLETE
4950,-1.0,2026-04-07 11:36:58.928693,2026-04-07 11:36:59.688627,0 days 00:00:00.759934,30.31990872197347,17.180001363917654,0.3674357144061485,Au,COMPLETE
4951,80.86419753086179,2026-04-07 11:36:59.002098,2026-04-07 11:36:59.753070,0 days 00:00:00.750972,30.26988921008676,17.418888249186494,0.7979767335895929,Au,PRUNED
4952,-1.1737089201877602,2026-04-07 11:36:59.032008,2026-04-07 11:36:59.699974,0 days 00:00:00.667966,40.2056607111054,19.90895717447722,0.3607746548267818,Cu,PRUNED
4953,78.7377450980369,2026-04-07 11:36:59.110925,2026-04-07 11:36:59.806579,0 days 00:00:00.695654,36.21469322359819,14.8149025350091,0.8409191009066102,Au,PRUNED
4954,-364.718614718567,2026-04-07 11:36:59.336872,2026-04-07 11:37:00.064668,0 days 00:00:00.727796,20.08272978533861,19.700022771562264,0.8079057302074412,Au,COMPLETE
4955,0.0,2026-04-07 11:36:59.348595,2026-04-07 11:37:00.202228,0 days 00:00:00.853633,35.99844579725759,17.514017545235635,1.0504403774997808,Au,PRUNED
4956,-1.0,2026-04-07 11:36:59.611663,2026-04-07 11:37:00.256933,0 days 00:00:00.645270,33.36201093085379,19.924246655279738,0.6777548511077744,Au,COMPLETE
4957,-1.0,2026-04-07 11:36:59.785765,2026-04-07 11:37:00.488912,0 days 00:00:00.703147,22.924713279579723,19.30167967937048,0.46302301443475646,Ag,COMPLETE
4958,-1.0,2026-04-07 11:36:59.810646,2026-04-07 11:37:00.353960,0 days 00:00:00.543314,38.68229105625322,19.979049168505508,1.130403504753592,Au,COMPLETE
4959,-1.0,2026-04-07 11:36:59.848093,2026-04-07 11:37:00.487905,0 days 00:00:00.639812,32.121979674998514,19.993246196536948,0.8650756297417643,Au,COMPLETE
4960,0.0,2026-04-07 11:36:59.884767,2026-04-07 11:37:00.848321,0 days 00:00:00.963554,31.743612307103675,17.778384984391767,0.5688622186292263,Au,PRUNED
4961,0.0,2026-04-07 11:37:00.098684,2026-04-07 11:37:00.750012,0 days 00:00:00.651328,38.429109794831774,19.991365685577264,0.7502810539587772,Au,PRUNED
4962,4.006410256409948,2026-04-07 11:37:00.204800,2026-04-07 11:37:00.889486,0 days 00:00:00.684686,32.235128884116236,14.531482300794476,1.0609853009870904,Au,PRUNED
4963,-1.0,2026-04-07 11:37:00.252333,2026-04-07 11:37:01.046570,0 days 00:00:00.794237,37.14720187961295,18.416954662418785,0.3563696026939201,Ag,COMPLETE
4964,-1.0,2026-04-07 11:37:00.492375,2026-04-07 11:37:01.095453,0 days 00:00:00.603078,29.02618774955133,17.197380669819882,0.39320417778071254,Au,COMPLETE
4965,-1.0,2026-04-07 11:37:00.575886,2026-04-07 11:37:01.267800,0 days 00:00:00.691914,33.11999610588484,17.956628196406673,1.0131997242965027,Au,COMPLETE
4966,-1.0,2026-04-07 11:37:00.633499,2026-04-07 11:37:01.148371,0 days 00:00:00.514872,32.69968071284839,17.088447082051147,0.9367817200876768,Au,COMPLETE
4967,-1.0,2026-04-07 11:37:00.697569,2026-04-07 11:37:01.149373,0 days 00:00:00.451804,20.55507688558891,17.68799147474756,0.851811540669516,Au,COMPLETE
4968,-410.3260869564619,2026-04-07 11:37:00.872380,2026-04-07 11:37:01.719341,0 days 00:00:00.846961,21.238263184362175,19.82636288895825,0.28124983598400977,Au,COMPLETE
4969,-1.0,2026-04-07 11:37:00.948286,2026-04-07 11:37:01.497262,0 days 00:00:00.548976,20.864227660899925,19.975536263702658,0.7805882963128516,Au,COMPLETE
4970,4.901960784313341,2026-04-07 11:37:00.985031,2026-04-07 11:37:01.657564,0 days 00:00:00.672533,31.22486863244197,15.272254746353333,1.0045122408024998,Au,PRUNED
4971,0.0,2026-04-07 11:37:01.222465,2026-04-07 11:37:02.126249,0 days 00:00:00.903784,47.091775771208034,18.036315203358434,0.46701625517008394,Au,PRUNED
4972,0.0,2026-04-07 11:37:01.288895,2026-04-07 11:37:02.099951,0 days 00:00:00.811056,21.151229273229717,14.79196625503317,0.620603825499249,Au,PRUNED
4973,-1.0,2026-04-07 11:37:01.265792,2026-04-07 11:37:02.095951,0 days 00:00:00.830159,22.170455981704777,19.924419930222474,0.4508303916518519,Au,COMPLETE
4974,0.0,2026-04-07 11:37:01.346514,2026-04-07 11:37:02.019672,0 days 00:00:00.673158,20.160507174141088,17.787345492879005,1.0338186689874918,Au,PRUNED
4975,-1.0,2026-04-07 11:37:01.636583,2026-04-07 11:37:02.422811,0 days 00:00:00.786228,46.278653880061555,17.836024928780322,0.8722518870319154,Au,COMPLETE
4976,-1.0,2026-04-07 11:37:01.720449,2026-04-07 11:37:02.474957,0 days 00:00:00.754508,20.956952906619087,19.985381729999748,0.5241246574058784,Au,COMPLETE
4977,0.0,2026-04-07 11:37:01.815954,2026-04-07 11:37:02.592581,0 days 00:00:00.776627,20.45604088430353,16.84904703944332,0.5686192325655504,Au,PRUNED
4978,0.0,2026-04-07 11:37:01.929786,2026-04-07 11:37:02.707759,0 days 00:00:00.777973,20.270433368214658,19.700905668457025,0.5217929254707038,Au,PRUNED
4979,0.0,2026-04-07 11:37:02.145207,2026-04-07 11:37:03.032402,0 days 00:00:00.887195,38.969674637420155,19.938518936926812,0.5512930460388283,Au,PRUNED
4980,-1.0,2026-04-07 11:37:02.233860,2026-04-07 11:37:02.847801,0 days 00:00:00.613941,30.382332156597187,18.01593248478215,0.9863817815513589,Au,COMPLETE
4981,-1.0,2026-04-07 11:37:02.253648,2026-04-07 11:37:03.027309,0 days 00:00:00.773661,33.39889283442754,18.310163143257768,0.9467267774143366,Au,COMPLETE
4982,-1.0,2026-04-07 11:37:02.287250,2026-04-07 11:37:03.031829,0 days 00:00:00.744579,20.85142146846939,16.825235661977864,0.29866207823463836,Au,COMPLETE
4983,0.0,2026-04-07 11:37:02.610584,2026-04-07 11:37:03.397277,0 days 00:00:00.786693,33.61517263143009,17.365607511565695,0.6054274063555369,Au,PRUNED
4984,-1.0,2026-04-07 11:37:02.675108,2026-04-07 11:37:03.158545,0 days 00:00:00.483437,28.20999791961206,19.946273803413174,0.9129169271949992,Au,COMPLETE
4985,0.0,2026-04-07 11:37:02.708767,2026-04-07 11:37:03.305913,0 days 00:00:00.597146,20.27144620521358,17.421199355037565,0.720122366331345,Au,PRUNED
4986,0.0,2026-04-07 11:37:02.904593,2026-04-07 11:37:03.547709,0 days 00:00:00.643116,43.427602605550554,19.97372284827744,0.34926389505171596,Au,PRUNED
4987,0.0,2026-04-07 11:37:03.103698,2026-04-07 11:37:03.963721,0 days 00:00:00.860023,33.34475177320894,18.427701793289533,0.3298409915218589,Au,PRUNED
4988,-1.0,2026-04-07 11:37:03.045482,2026-04-07 11:37:03.822323,0 days 00:00:00.776841,34.02679358721225,19.8928155064638,0.7186636547076201,Au,COMPLETE
4989,-1.0,2026-04-07 11:37:03.190235,2026-04-07 11:37:03.747029,0 days 00:00:00.556794,31.100107536749196,17.405696207877522,0.6131006182170038,Au,COMPLETE
4990,-1.0,2026-04-07 11:37:03.431849,2026-04-07 11:37:03.822323,0 days 00:00:00.390474,20.70108801148964,19.906221626078462,1.0190621860599665,Au,COMPLETE
4991,0.0,2026-04-07 11:37:03.440301,2026-04-07 11:37:04.358627,0 days 00:00:00.918326,20.010507408523498,19.823047495016294,0.22156189041971422,Au,PRUNED
4992,0.0,2026-04-07 11:37:03.463280,2026-04-07 11:37:03.920200,0 days 00:00:00.456920,37.37646767457491,19.80305799631202,0.5226253146046937,Au,PRUNED
4993,-373.06843267103204,2026-04-07 11:37:03.479838,2026-04-07 11:37:04.313831,0 days 00:00:00.833993,20.303525534263947,19.590485580449165,0.8781380210859364,Au,COMPLETE
4994,-1.0,2026-04-07 11:37:03.750538,2026-04-07 11:37:04.425865,0 days 00:00:00.675327,32.668058073451384,19.937535247273185,1.0321984161447784,Au,COMPLETE
4995,-1.0,2026-04-07 11:37:03.854384,2026-04-07 11:37:04.567148,0 days 00:00:00.712764,32.00506156799818,17.707874396920797,0.4578090676321355,Au,COMPLETE
4996,0.0,2026-04-07 11:37:04.030965,2026-04-07 11:37:04.812100,0 days 00:00:00.781135,20.359748386384336,18.73548372959752,0.11526059255360296,Au,PRUNED
4997,0.0,2026-04-07 11:37:04.087667,2026-04-07 11:37:04.910191,0 days 00:00:00.822524,20.92596927833257,19.717885463886834,0.13331797002281287,Cu,PRUNED
4998,-1.0,2026-04-07 11:37:04.118447,2026-04-07 11:37:04.720119,0 days 00:00:00.601672,35.75306286502803,19.95529329869703,0.46993865097186016,Au,COMPLETE
4999,79.62962962962726,2026-04-07 11:37:04.226975,2026-04-07 11:37:04.868144,0 days 00:00:00.641169,32.493817629820185,17.268522515725493,0.41902541431414414,Au,PRUNED
5000,-1.0,2026-04-07 11:37:04.467165,2026-04-07 11:37:05.218152,0 days 00:00:00.750987,47.304463832663785,19.994903179646148,0.999108601807742,Au,COMPLETE
5001,-1.0,2026-04-07 11:37:04.594899,2026-04-07 11:37:05.628070,0 days 00:00:01.033171,30.62354033205797,17.861815088077098,0.4681142087587101,Au,COMPLETE
5002,79.93827160493589,2026-04-07 11:37:04.675489,2026-04-07 11:37:05.424966,0 days 00:00:00.749477,32.65532804222501,17.150875528773245,0.35684402860152653,Au,PRUNED
5003,0.0,2026-04-07 11:37:04.775836,2026-04-07 11:37:05.501694,0 days 00:00:00.725858,33.70722077368454,19.92485605400828,0.535403951437512,Au,PRUNED
5004,-1.0,2026-04-07 11:37:04.871143,2026-04-07 11:37:05.500663,0 days 00:00:00.629520,20.18583284946452,19.85897012335271,0.894084301740394,Au,COMPLETE
5005,-1.0,2026-04-07 11:37:04.980418,2026-04-07 11:37:05.472478,0 days 00:00:00.492060,33.85297302236456,19.950756026392494,0.5188884077775675,Au,COMPLETE
5006,83.33333333333088,2026-04-07 11:37:05.004405,2026-04-07 11:37:05.765266,0 days 00:00:00.760861,23.756084314028254,19.945192143234575,0.9481996737997539,Au,PRUNED
5007,79.93827160493589,2026-04-07 11:37:05.039701,2026-04-07 11:37:05.636683,0 days 00:00:00.596982,31.366334578423,17.33455261689103,0.8694212553303186,Au,PRUNED
5008,-1.0,2026-04-07 11:37:05.329512,2026-04-07 11:37:06.258275,0 days 00:00:00.928763,20.401328393299178,19.929164814066752,1.0350620326683875,Au,COMPLETE
5009,-1.0,2026-04-07 11:37:05.506127,2026-04-07 11:37:06.132392,0 days 00:00:00.626265,21.071034232188115,19.483761949618696,0.3833264655523615,Ag,COMPLETE
5010,-1.0,2026-04-07 11:37:05.569341,2026-04-07 11:37:06.227565,0 days 00:00:00.658224,20.78044173308871,17.897742158611372,0.9243439816831657,Au,COMPLETE
5011,-6.410256410255424,2026-04-07 11:37:05.667264,2026-04-07 11:37:06.430905,0 days 00:00:00.763641,21.925685607953433,19.947998896316818,0.7631231898317328,Au,PRUNED
5012,-1.0,2026-04-07 11:37:05.723143,2026-04-07 11:37:06.407924,0 days 00:00:00.684781,45.91646333809446,10.599838238539975,0.4272415749567777,Cu,COMPLETE
5013,-1.0,2026-04-07 11:37:05.733004,2026-04-07 11:37:06.223380,0 days 00:00:00.490376,36.981460819530895,18.037811380289696,0.9956976262079413,Au,COMPLETE
5014,-1.0,2026-04-07 11:37:05.880622,2026-04-07 11:37:06.324723,0 days 00:00:00.444101,20.848424648759938,17.32201783932796,0.5625190575235506,Au,COMPLETE
5015,-1.0,2026-04-07 11:37:05.978105,2026-04-07 11:37:06.510096,0 days 00:00:00.531991,29.789647203397234,14.170511999910076,0.8005132933509457,Au,COMPLETE
5016,-1.0,2026-04-07 11:37:06.251181,2026-04-07 11:37:07.027644,0 days 00:00:00.776463,20.469242837872955,18.398370572602584,0.7362292410374192,Au,COMPLETE
5017,0.0,2026-04-07 11:37:06.451391,2026-04-07 11:37:07.164327,0 days 00:00:00.712936,20.4335145920426,16.2941778533274,0.9214935800634874,Au,PRUNED
5018,0.0,2026-04-07 11:37:06.488149,2026-04-07 11:37:07.164327,0 days 00:00:00.676178,21.79028477017218,17.026507649153547,0.8431938961463159,Au,PRUNED
5019,0.0,2026-04-07 11:37:06.540222,2026-04-07 11:37:07.163327,0 days 00:00:00.623105,33.78817483574896,17.83480457409219,0.7393309176887763,Au,PRUNED
5020,-441.2144702841686,2026-04-07 11:37:06.581700,2026-04-07 11:37:07.214079,0 days 00:00:00.632379,21.181810657103306,19.919531173989178,0.6730798100052415,Au,COMPLETE
5021,0.0,2026-04-07 11:37:06.662505,2026-04-07 11:37:07.558510,0 days 00:00:00.896005,35.67211190333908,19.69833735968683,0.9860679281622869,Au,PRUNED
5022,-1.1990407673860566,2026-04-07 11:37:06.753340,2026-04-07 11:37:07.724333,0 days 00:00:00.970993,20.44908167793896,19.757109918237855,0.6374260647698152,Ag,PRUNED
5023,-1.0,2026-04-07 11:37:06.804623,2026-04-07 11:37:07.541855,0 days 00:00:00.737232,21.149512561689523,15.338310681955189,0.5438752728711809,Cu,COMPLETE
5024,-1.0,2026-04-07 11:37:07.248464,2026-04-07 11:37:07.770553,0 days 00:00:00.522089,20.259719575146274,14.582322686327853,0.7807525340724211,Au,COMPLETE
5025,-1.0,2026-04-07 11:37:07.259669,2026-04-07 11:37:07.897559,0 days 00:00:00.637890,32.80904232224387,14.549921004974667,0.5494173440732754,Au,COMPLETE
5026,-1.0,2026-04-07 11:37:07.308911,2026-04-07 11:37:08.000615,0 days 00:00:00.691704,38.638219825534954,19.955189714795036,0.4929072795043545,Au,COMPLETE
5027,0.0,2026-04-07 11:37:07.330479,2026-04-07 11:37:08.000109,0 days 00:00:00.669630,31.68533703653399,19.91632029036436,0.3714287759865718,Au,PRUNED
5028,-1.0,2026-04-07 11:37:07.414396,2026-04-07 11:37:08.141757,0 days 00:00:00.727361,20.196760907769768,18.975813359881357,0.5467030554482735,Au,COMPLETE
5029,80.86419753086179,2026-04-07 11:37:07.622172,2026-04-07 11:37:08.202821,0 days 00:00:00.580649,30.268913390930308,17.528735456557307,0.5914518312216758,Au,PRUNED
5030,0.0,2026-04-07 11:37:07.655407,2026-04-07 11:37:08.460079,0 days 00:00:00.804672,116.60972016041255,12.648424981410017,1.648792855873971,Cu,PRUNED
5031,0.0,2026-04-07 11:37:07.877776,2026-04-07 11:37:08.863790,0 days 00:00:00.986014,44.12685307215093,15.767800428318335,0.6072803936717961,Au,PRUNED
5032,80.26960784313488,2026-04-07 11:37:07.978169,2026-04-07 11:37:08.820537,0 days 00:00:00.842368,33.420288544911465,15.570832936929367,0.5686224015552053,Au,PRUNED
5033,-1.0,2026-04-07 11:37:08.030664,2026-04-07 11:37:08.939974,0 days 00:00:00.909310,21.01260445111942,17.85428218463075,0.6998810244481714,Au,COMPLETE
