number,value,datetime_start,datetime_complete,duration,params_D2_nm,params_D3_nm,params_D4_nm,params_metal,state
5174,79.93827160493589,2026-04-07 11:37:24.630141,2026-04-07 11:37:25.322369,0 days 00:00:00.692228,32.524412228907565,16.44534833185632,0.8658833915189977,Au,PRUNED
5175,-1.1990407673860566,2026-04-07 11:37:24.649867,2026-04-07 11:37:25.515416,0 days 00:00:00.865549,21.86630589633877,19.64397658711919,0.8383234804044264,Ag,PRUNED
5176,-1.0,2026-04-07 11:37:24.729021,2026-04-07 11:37:25.322369,0 days 00:00:00.593348,20.162219929393533,17.168630559197418,0.4211784871173908,Au,COMPLETE
5177,79.6568627450957,2026-04-07 11:37:24.760490,2026-04-07 11:37:25.603724,0 days 00:00:00.843234,33.81662160660917,15.46452417100492,0.7768447336942471,Au,PRUNED
5178,0.0,2026-04-07 11:37:25.063410,2026-04-07 11:37:25.975459,0 days 00:00:00.912049,20.02285237803777,15.274038828597858,0.4799294694073089,Au,PRUNED
5179,-1.0,2026-04-07 11:37:25.341979,2026-04-07 11:37:26.044381,0 days 00:00:00.702402,63.54903044331061,16.700185668575557,1.5234608381196508,Cu,COMPLETE
5180,0.0,2026-04-07 11:37:25.385371,2026-04-07 11:37:26.226222,0 days 00:00:00.840851,37.886953400521634,19.87980461542274,0.6654032523516669,Au,PRUNED
5181,0.0,2026-04-07 11:37:25.414896,2026-04-07 11:37:26.641460,0 days 00:00:01.226564,29.1758753221577,19.88737991047249,0.5724787049447292,Au,PRUNED
5182,-1.0,2026-04-07 11:37:25.488780,2026-04-07 11:37:26.043378,0 days 00:00:00.554598,21.072626777841673,19.860687741244774,0.4172784620087766,Au,COMPLETE
5183,80.55555555555317,2026-04-07 11:37:25.605287,2026-04-07 11:37:26.351630,0 days 00:00:00.746343,31.423664123011946,17.113187074654064,0.5997564278019546,Au,PRUNED
5184,-1.0,2026-04-07 11:37:25.694066,2026-04-07 11:37:26.582869,0 days 00:00:00.888803,25.400301621466884,19.971081081999916,0.7885031337028634,Au,COMPLETE
5185,-1.0,2026-04-07 11:37:25.886799,2026-04-07 11:37:26.436278,0 days 00:00:00.549479,32.42720070079046,17.258018425063604,0.6977651283170615,Au,COMPLETE
5186,-427.31829573928434,2026-04-07 11:37:26.144680,2026-04-07 11:37:26.769042,0 days 00:00:00.624362,20.73447345401513,19.7963952924253,1.006079214303759,Au,COMPLETE
5187,-1.0,2026-04-07 11:37:26.246169,2026-04-07 11:37:26.882435,0 days 00:00:00.636266,31.105212462394384,17.341167835233918,0.3520850115204738,Au,COMPLETE
5188,-1.0,2026-04-07 11:37:26.230247,2026-04-07 11:37:26.804916,0 days 00:00:00.574669,20.254283795866673,16.963312132020707,0.8987815627973864,Au,COMPLETE
5189,-1.0,2026-04-07 11:37:26.305609,2026-04-07 11:37:27.151608,0 days 00:00:00.845999,20.491094433816844,17.891579418230883,0.5085330390757749,Au,COMPLETE
5190,0.0,2026-04-07 11:37:26.493489,2026-04-07 11:37:27.256392,0 days 00:00:00.762903,32.22057226625893,19.928903114097245,1.0239343686844586,Au,PRUNED
5191,-1.0,2026-04-07 11:37:26.580860,2026-04-07 11:37:27.256392,0 days 00:00:00.675532,47.34299704894836,19.985722480377888,0.8688224810606492,Au,COMPLETE
5192,-1.0,2026-04-07 11:37:26.728302,2026-04-07 11:37:27.342007,0 days 00:00:00.613705,20.082617573672657,17.942188007980995,0.9571721826021153,Au,COMPLETE
5193,-1.0,2026-04-07 11:37:26.772277,2026-04-07 11:37:27.404339,0 days 00:00:00.632062,20.074661411988384,19.800868740352843,0.5195618979947849,Au,COMPLETE
5194,1.7006802721087046,2026-04-07 11:37:26.952037,2026-04-07 11:37:27.524441,0 days 00:00:00.572404,34.401697753681674,14.366059418571389,0.10431685147599079,Au,PRUNED
5195,80.55555555555317,2026-04-07 11:37:27.063464,2026-04-07 11:37:27.898989,0 days 00:00:00.835525,31.2749005391892,17.47230963710462,0.44027484730700495,Au,PRUNED
5196,0.0,2026-04-07 11:37:27.150611,2026-04-07 11:37:27.778050,0 days 00:00:00.627439,34.97924353247264,19.88715527981795,0.5310009102920953,Au,PRUNED
5197,-1.0,2026-04-07 11:37:27.391607,2026-04-07 11:37:27.994793,0 days 00:00:00.603186,20.123395424793493,15.075200539915938,0.5510882307294159,Au,COMPLETE
5198,-1.0,2026-04-07 11:37:27.343009,2026-04-07 11:37:28.348144,0 days 00:00:01.005135,27.004245631763812,19.953968243675014,0.9217451668948287,Au,COMPLETE
5199,-1.0,2026-04-07 11:37:27.424194,2026-04-07 11:37:28.177328,0 days 00:00:00.753134,20.923206780064866,19.9592979658456,0.6170455519468486,Au,COMPLETE
5200,-1.0,2026-04-07 11:37:27.619101,2026-04-07 11:37:28.364268,0 days 00:00:00.745167,65.50428292024864,8.951840127336723,0.4648637056755568,Cu,COMPLETE
5201,0.0,2026-04-07 11:37:27.718381,2026-04-07 11:37:28.436676,0 days 00:00:00.718295,45.48958978997562,19.953512058135743,0.7627014372306378,Au,PRUNED
5202,-1.0,2026-04-07 11:37:27.820690,2026-04-07 11:37:28.443851,0 days 00:00:00.623161,45.39149424159625,17.780782461838267,0.7103086496236022,Au,COMPLETE
5203,-1.0,2026-04-07 11:37:27.806697,2026-04-07 11:37:28.444851,0 days 00:00:00.638154,20.745557148058154,16.938226478631496,0.8375541311699515,Au,COMPLETE
5204,0.0,2026-04-07 11:37:27.996192,2026-04-07 11:37:28.715903,0 days 00:00:00.719711,20.518496963913776,19.89992542685953,0.15973732609679234,Au,PRUNED
5205,-1.0,2026-04-07 11:37:28.158410,2026-04-07 11:37:28.632482,0 days 00:00:00.474072,20.637167360657664,17.03598648182938,0.8542158800788544,Au,COMPLETE
5206,0.0,2026-04-07 11:37:28.470116,2026-04-07 11:37:29.361872,0 days 00:00:00.891756,32.745370357362795,17.32473743150656,1.0515623791721305,Au,PRUNED
5207,-1.0,2026-04-07 11:37:28.509079,2026-04-07 11:37:29.221767,0 days 00:00:00.712688,31.174457965308157,17.720277886771285,1.008105682864612,Au,COMPLETE
5208,0.0,2026-04-07 11:37:28.562543,2026-04-07 11:37:29.423598,0 days 00:00:00.861055,33.03825661874084,17.690849752501734,0.6427635336825908,Au,PRUNED
5209,-1.0,2026-04-07 11:37:28.551261,2026-04-07 11:37:29.456351,0 days 00:00:00.905090,44.84830816142425,19.77263982082227,0.4730935411464256,Au,COMPLETE
5210,0.0,2026-04-07 11:37:28.781236,2026-04-07 11:37:29.526746,0 days 00:00:00.745510,31.595816366857953,18.10423116135651,0.7927530246749048,Au,PRUNED
5211,2.3148148148145573,2026-04-07 11:37:28.804468,2026-04-07 11:37:29.600840,0 days 00:00:00.796372,31.898738857060533,14.76525855583926,0.6218734917234738,Au,PRUNED
5212,-1.0,2026-04-07 11:37:28.857443,2026-04-07 11:37:29.354345,0 days 00:00:00.496902,20.13585593789145,19.08018823711364,0.6110788149567595,Au,COMPLETE
5213,0.0,2026-04-07 11:37:28.892349,2026-04-07 11:37:29.599841,0 days 00:00:00.707492,20.08340051364651,19.320120976522276,0.5265401997295828,Au,PRUNED
5214,-1.0,2026-04-07 11:37:29.469129,2026-04-07 11:37:30.128224,0 days 00:00:00.659095,31.304625013542292,19.89308086834561,0.37260269490682196,Au,COMPLETE
5215,-1.0,2026-04-07 11:37:29.506351,2026-04-07 11:37:30.270039,0 days 00:00:00.763688,20.1944092735944,19.510613123914197,0.5464364708406675,Au,COMPLETE
5216,-1.0,2026-04-07 11:37:29.529264,2026-04-07 11:37:30.363019,0 days 00:00:00.833755,20.184767124229626,19.961780281742733,0.7504194139999664,Au,COMPLETE
5217,0.0,2026-04-07 11:37:29.658339,2026-04-07 11:37:30.440748,0 days 00:00:00.782409,20.178521118677924,17.707672580126065,0.6961867452457575,Au,PRUNED
5218,-404.7619047618469,2026-04-07 11:37:29.694163,2026-04-07 11:37:30.272047,0 days 00:00:00.577884,20.79170033240295,19.570662300762635,0.9077605297564347,Au,COMPLETE
5219,0.0,2026-04-07 11:37:29.710654,2026-04-07 11:37:30.509917,0 days 00:00:00.799263,31.849691953648453,19.956069669846798,0.7952328447194286,Au,PRUNED
5220,0.0,2026-04-07 11:37:29.724277,2026-04-07 11:37:30.551278,0 days 00:00:00.827001,20.305901102035875,17.366585424139373,0.878218173228702,Au,PRUNED
5221,0.0,2026-04-07 11:37:29.994732,2026-04-07 11:37:30.264179,0 days 00:00:00.269447,36.35101181226591,17.660660145471233,0.6901578989733401,Au,PRUNED
5222,-1.0,2026-04-07 11:37:30.409650,2026-04-07 11:37:31.127769,0 days 00:00:00.718119,30.389098470863253,17.579381482807392,0.7484800839324232,Au,COMPLETE
5223,80.55555555555317,2026-04-07 11:37:30.524569,2026-04-07 11:37:31.352423,0 days 00:00:00.827854,31.05501446711714,17.52891709481623,0.48365423476372665,Au,PRUNED
5224,-1.0,2026-04-07 11:37:30.568835,2026-04-07 11:37:31.393943,0 days 00:00:00.825108,37.08652460488473,19.86120087355366,0.5110611352316689,Au,COMPLETE
5225,0.0,2026-04-07 11:37:30.599925,2026-04-07 11:37:31.505570,0 days 00:00:00.905645,32.311255138130534,19.903367000690785,0.8381337978891792,Au,PRUNED
5226,0.0,2026-04-07 11:37:30.617204,2026-04-07 11:37:31.378423,0 days 00:00:00.761219,29.65079142461137,19.930656682686358,0.6956517759079459,Au,PRUNED
5227,-1.0,2026-04-07 11:37:30.629929,2026-04-07 11:37:31.613823,0 days 00:00:00.983894,50.039719352915114,19.684401209789385,0.3579535933420338,Au,COMPLETE
5228,-1.0,2026-04-07 11:37:30.684384,2026-04-07 11:37:31.353933,0 days 00:00:00.669549,34.35480215133498,17.52817885064707,0.5788104201961334,Cu,COMPLETE
5229,-1.0,2026-04-07 11:37:30.964470,2026-04-07 11:37:31.443185,0 days 00:00:00.478715,22.78473151621874,19.35475313196018,0.18915053637530158,Ag,COMPLETE
5230,3.267973856208894,2026-04-07 11:37:31.311879,2026-04-07 11:37:32.130405,0 days 00:00:00.818526,31.697326620032,15.090520990486414,0.8851591628350451,Au,PRUNED
5231,-1.0,2026-04-07 11:37:31.447687,2026-04-07 11:37:32.191579,0 days 00:00:00.743892,26.90787846853812,19.91845544520764,0.7352962586303059,Au,COMPLETE
5232,-1.0,2026-04-07 11:37:31.522726,2026-04-07 11:37:32.074359,0 days 00:00:00.551633,21.242521805413485,19.72754857312426,0.5089343289949839,Au,COMPLETE
5233,-1.0,2026-04-07 11:37:31.580914,2026-04-07 11:37:32.070857,0 days 00:00:00.489943,20.37036305928614,19.652094697521786,0.8663843877988616,Au,COMPLETE
5234,-1.0,2026-04-07 11:37:31.599952,2026-04-07 11:37:32.254259,0 days 00:00:00.654307,20.335109817032627,19.904937251616104,0.5957969950866883,Au,COMPLETE
5235,0.0,2026-04-07 11:37:31.636052,2026-04-07 11:37:32.255267,0 days 00:00:00.619215,20.324850992729836,18.451219607441146,0.6764917633324854,Au,PRUNED
5236,-1.0,2026-04-07 11:37:31.719924,2026-04-07 11:37:32.225088,0 days 00:00:00.505164,21.177120502009707,17.557176879589225,0.6059515519170996,Au,COMPLETE
5237,-1.0,2026-04-07 11:37:32.012327,2026-04-07 11:37:32.557179,0 days 00:00:00.544852,32.445046807514885,17.64618358081002,0.9740820542010136,Au,COMPLETE
5238,0.0,2026-04-07 11:37:32.247135,2026-04-07 11:37:32.828935,0 days 00:00:00.581800,32.86143012138179,19.853907256755413,0.5894558876637681,Au,PRUNED
5239,-1.0,2026-04-07 11:37:32.292661,2026-04-07 11:37:32.863142,0 days 00:00:00.570481,20.46133098604601,14.511516277353298,0.9752669000642715,Au,COMPLETE
5240,-1.0,2026-04-07 11:37:32.363927,2026-04-07 11:37:33.144719,0 days 00:00:00.780792,30.899270488158876,17.33242355671389,0.26208624461471847,Au,COMPLETE
5241,-1.0,2026-04-07 11:37:32.386217,2026-04-07 11:37:33.171551,0 days 00:00:00.785334,65.65626621680666,15.489280227446546,0.4692304140734681,Au,COMPLETE
5242,-1.0,2026-04-07 11:37:32.395697,2026-04-07 11:37:32.995055,0 days 00:00:00.599358,31.15515170427252,17.37235760660796,0.470277015701015,Au,COMPLETE
5243,-1.0,2026-04-07 11:37:32.467814,2026-04-07 11:37:32.993849,0 days 00:00:00.526035,20.166194378597833,19.300859512711845,0.721263107661366,Au,COMPLETE
5244,-2.049180327868819,2026-04-07 11:37:32.488885,2026-04-07 11:37:33.211361,0 days 00:00:00.722476,99.10172909816205,4.709282010332293,0.40366185454811265,Cu,PRUNED
5245,-1.0,2026-04-07 11:37:32.811774,2026-04-07 11:37:33.376161,0 days 00:00:00.564387,31.842297009638195,18.235054117222735,0.9444973983018315,Au,COMPLETE
5246,-1.0,2026-04-07 11:37:32.901460,2026-04-07 11:37:33.737188,0 days 00:00:00.835728,34.88670135312276,19.997796236391117,0.9203608626033557,Au,COMPLETE
5247,-1.0,2026-04-07 11:37:33.079326,2026-04-07 11:37:33.753111,0 days 00:00:00.673785,20.139324979940255,17.16833371715253,0.43092209788636626,Au,COMPLETE
5248,-413.9294403892341,2026-04-07 11:37:33.250231,2026-04-07 11:37:34.265402,0 days 00:00:01.015171,20.877196094986928,19.867346274117573,0.6049714699041476,Au,COMPLETE
5249,83.33333333333088,2026-04-07 11:37:33.254812,2026-04-07 11:37:33.881072,0 days 00:00:00.626260,23.71217971320794,19.89660449105881,0.7532185431625286,Au,PRUNED
5250,0.0,2026-04-07 11:37:33.340201,2026-04-07 11:37:34.264026,0 days 00:00:00.923825,20.027709715200647,15.205388365002566,1.0360479187746892,Au,PRUNED
5251,-1.0,2026-04-07 11:37:33.364111,2026-04-07 11:37:33.900519,0 days 00:00:00.536408,95.78724249057204,19.753681233718517,1.7845601910051738,Cu,COMPLETE
5252,0.0,2026-04-07 11:37:33.407921,2026-04-07 11:37:34.274988,0 days 00:00:00.867067,43.33296954084015,16.479041718824092,0.34835877408244625,Au,PRUNED
5253,0.0,2026-04-07 11:37:33.669790,2026-04-07 11:37:34.270476,0 days 00:00:00.600686,27.258588697075396,19.9793034521017,0.5541127824518446,Au,PRUNED
5254,-1.0,2026-04-07 11:37:33.878279,2026-04-07 11:37:34.409246,0 days 00:00:00.530967,35.40777234371558,17.737446533445475,1.000998969964954,Au,COMPLETE
5255,-1.0,2026-04-07 11:37:33.927877,2026-04-07 11:37:34.913982,0 days 00:00:00.986105,21.063857019266315,19.949945578597106,0.517154459670657,Au,COMPLETE
5256,0.0,2026-04-07 11:37:34.046137,2026-04-07 11:37:35.181877,0 days 00:00:01.135740,20.040693554321745,16.17509046566623,0.7573290857141483,Au,PRUNED
5257,-1.0,2026-04-07 11:37:34.184680,2026-04-07 11:37:35.027714,0 days 00:00:00.843034,30.863155201221346,19.96249475584364,0.7574311128622288,Au,COMPLETE
5258,0.0,2026-04-07 11:37:34.396916,2026-04-07 11:37:35.387070,0 days 00:00:00.990154,30.861724911385664,19.894219572457963,0.9254162143825487,Au,PRUNED
5259,0.0,2026-04-07 11:37:34.506726,2026-04-07 11:37:35.355876,0 days 00:00:00.849150,29.815893598877445,19.861581868779833,0.8490935000357656,Au,PRUNED
5260,-1.0,2026-04-07 11:37:34.471043,2026-04-07 11:37:35.121856,0 days 00:00:00.650813,21.247517784863238,17.786730388140583,0.1137384757855906,Au,COMPLETE
5261,-1.0,2026-04-07 11:37:34.492230,2026-04-07 11:37:35.180815,0 days 00:00:00.688585,34.83250673389814,19.063114189299135,1.0168825387846787,Ag,COMPLETE
5262,-1.0,2026-04-07 11:37:34.547049,2026-04-07 11:37:35.371488,0 days 00:00:00.824439,20.84513945300836,16.73609735276266,0.6549892671277099,Au,COMPLETE
5263,-1.0,2026-04-07 11:37:35.003468,2026-04-07 11:37:35.455184,0 days 00:00:00.451716,20.70117203149594,17.606547988155093,0.5597395982136837,Ag,COMPLETE
5264,-14.322916666664876,2026-04-07 11:37:35.220515,2026-04-07 11:37:35.942837,0 days 00:00:00.722322,63.20563677841983,0.5379511814274718,1.4551733220266914,Cu,PRUNED
5265,-410.92995169076204,2026-04-07 11:37:35.302381,2026-04-07 11:37:36.499960,0 days 00:00:01.197579,20.39963851333509,19.868853874659248,0.984476474098887,Au,COMPLETE
5266,0.0,2026-04-07 11:37:35.366945,2026-04-07 11:37:36.187330,0 days 00:00:00.820385,32.08803586921989,19.913514621335644,0.3339492494025892,Au,PRUNED
5267,0.0,2026-04-07 11:37:35.470247,2026-04-07 11:37:36.261520,0 days 00:00:00.791273,20.01154795514305,17.38379570886939,0.47704969363385624,Au,PRUNED
5268,-1.0,2026-04-07 11:37:35.514122,2026-04-07 11:37:36.186311,0 days 00:00:00.672189,20.00156952470779,17.660772897085586,0.8005614709768509,Au,COMPLETE
5269,-434.16030534344486,2026-04-07 11:37:35.581705,2026-04-07 11:37:36.430977,0 days 00:00:00.849272,21.080223631964937,19.712857883693577,0.9308583279605518,Au,COMPLETE
5270,-1.0,2026-04-07 11:37:35.689749,2026-04-07 11:37:36.267232,0 days 00:00:00.577483,31.088636925498175,17.36314299865489,0.9135070456319108,Au,COMPLETE
5271,0.0,2026-04-07 11:37:35.752374,2026-04-07 11:37:36.439580,0 days 00:00:00.687206,21.781418870432017,10.164300094269755,0.47267584764991705,Au,PRUNED
5272,0.0,2026-04-07 11:37:36.042865,2026-04-07 11:37:36.829526,0 days 00:00:00.786661,46.141063696941885,19.837941090907275,0.8915720772313364,Au,PRUNED
5273,-1.0,2026-04-07 11:37:36.373595,2026-04-07 11:37:36.958050,0 days 00:00:00.584455,47.489129132822384,17.37909528585816,0.9898075229868947,Au,COMPLETE
5274,0.0,2026-04-07 11:37:36.377012,2026-04-07 11:37:37.174624,0 days 00:00:00.797612,43.651739908643435,18.20102907370905,1.0087097107463414,Au,PRUNED
5275,0.0,2026-04-07 11:37:36.431984,2026-04-07 11:37:37.176650,0 days 00:00:00.744666,20.666299644279665,14.546705183222322,0.6711282948285723,Au,PRUNED
5276,-1.0,2026-04-07 11:37:36.469326,2026-04-07 11:37:37.331316,0 days 00:00:00.861990,44.29878371882372,17.64679402669908,0.46963091577156046,Au,COMPLETE
5277,-1.0,2026-04-07 11:37:36.653572,2026-04-07 11:37:37.524284,0 days 00:00:00.870712,29.454218025898687,17.90404611953241,0.3365978994054125,Cu,COMPLETE
5278,-1.0,2026-04-07 11:37:36.674863,2026-04-07 11:37:37.240232,0 days 00:00:00.565369,20.24206379549102,17.63738054927191,0.9893812770404863,Au,COMPLETE
5279,0.0,2026-04-07 11:37:36.746643,2026-04-07 11:37:37.848418,0 days 00:00:01.101775,46.45417661805533,17.938578075960386,1.036789039420144,Au,PRUNED
5280,-1.0,2026-04-07 11:37:36.947824,2026-04-07 11:37:37.685298,0 days 00:00:00.737474,32.40347381235481,16.95075158429315,0.5265594594915158,Au,COMPLETE
5281,-1.0,2026-04-07 11:37:37.267202,2026-04-07 11:37:37.835360,0 days 00:00:00.568158,20.251197333544404,19.809461500705623,1.039467115198483,Au,COMPLETE
5282,0.0,2026-04-07 11:37:37.313732,2026-04-07 11:37:38.162714,0 days 00:00:00.848982,45.318791757769134,17.349830889116397,0.49136806505729175,Au,PRUNED
5283,-1.0,2026-04-07 11:37:37.289330,2026-04-07 11:37:37.837454,0 days 00:00:00.548124,33.63437900429497,17.12628537422464,0.8370113604338636,Au,COMPLETE
5284,-1.0,2026-04-07 11:37:37.385931,2026-04-07 11:37:38.006473,0 days 00:00:00.620542,44.87341222319792,17.839320720852992,0.7158777568103195,Au,COMPLETE
5285,0.0,2026-04-07 11:37:37.482179,2026-04-07 11:37:38.126302,0 days 00:00:00.644123,30.54820402485526,19.909531433416095,0.6637700051850659,Au,PRUNED
5286,-1.0,2026-04-07 11:37:37.754365,2026-04-07 11:37:38.474653,0 days 00:00:00.720288,45.91218223478471,19.8906741930002,0.2589492297691399,Au,COMPLETE
5287,-375.2777777777274,2026-04-07 11:37:37.833343,2026-04-07 11:37:38.649477,0 days 00:00:00.816134,20.50737586212648,19.67815736456485,0.6062227452473847,Au,COMPLETE
5288,-1.0,2026-04-07 11:37:38.073385,2026-04-07 11:37:38.787843,0 days 00:00:00.714458,20.0825233966346,19.995037975970533,0.4761166542958013,Au,COMPLETE
5289,0.0,2026-04-07 11:37:38.110821,2026-04-07 11:37:39.229325,0 days 00:00:01.118504,20.557512274171344,17.279842687572007,0.7525279236886182,Au,PRUNED
5290,-8.040935672514054,2026-04-07 11:37:38.148532,2026-04-07 11:37:38.820982,0 days 00:00:00.672450,24.40594452226699,16.894721506299536,0.9292489434110949,Ag,PRUNED
5291,-1.0,2026-04-07 11:37:38.190270,2026-04-07 11:37:38.718011,0 days 00:00:00.527741,33.974403542759916,17.65315762155565,0.7264200609918614,Au,COMPLETE
5292,0.0,2026-04-07 11:37:38.250984,2026-04-07 11:37:38.885893,0 days 00:00:00.634909,20.203002591463257,16.12693508560658,0.7245886331731234,Au,PRUNED
5293,-1.0,2026-04-07 11:37:38.275990,2026-04-07 11:37:39.094501,0 days 00:00:00.818511,20.079697339383547,17.830744381023816,0.610598136529888,Au,COMPLETE
5294,0.0,2026-04-07 11:37:38.694056,2026-04-07 11:37:39.588484,0 days 00:00:00.894428,36.80000559220922,19.96048631385907,0.9674672092829283,Au,PRUNED
5295,-1.0,2026-04-07 11:37:38.856433,2026-04-07 11:37:39.648250,0 days 00:00:00.791817,38.310158417433065,17.95956065946184,0.615723115110363,Au,COMPLETE
5296,-1.0,2026-04-07 11:37:38.890002,2026-04-07 11:37:39.712079,0 days 00:00:00.822077,20.922857852550234,17.646189045638526,0.5687547707884759,Au,COMPLETE
5297,-1.0,2026-04-07 11:37:38.945836,2026-04-07 11:37:39.552717,0 days 00:00:00.606881,23.21771949635843,19.997521409938923,0.2146151029404543,Au,COMPLETE
5298,0.0,2026-04-07 11:37:39.001198,2026-04-07 11:37:39.753354,0 days 00:00:00.752156,20.14919130309178,16.722104981242673,0.9459688611778645,Au,PRUNED
5299,-1.0,2026-04-07 11:37:39.026985,2026-04-07 11:37:39.588484,0 days 00:00:00.561499,20.798310022167865,18.15243278753619,0.8242175483745884,Au,COMPLETE
5300,0.0,2026-04-07 11:37:39.221796,2026-04-07 11:37:39.900038,0 days 00:00:00.678242,20.616382262821087,16.927027779265245,0.9968483664965266,Au,PRUNED
5301,0.0,2026-04-07 11:37:39.288463,2026-04-07 11:37:39.988599,0 days 00:00:00.700136,32.23578601451342,19.95275120141301,0.5019379914175066,Au,PRUNED
5302,0.0,2026-04-07 11:37:39.670335,2026-04-07 11:37:40.402187,0 days 00:00:00.731852,33.994009108597766,19.933638445545704,0.6453169526909767,Au,PRUNED
5303,-1.0,2026-04-07 11:37:39.825490,2026-04-07 11:37:40.666759,0 days 00:00:00.841269,22.319097385850576,19.80302178226171,0.10660952297295351,Au,COMPLETE
5304,0.0,2026-04-07 11:37:39.841860,2026-04-07 11:37:40.634887,0 days 00:00:00.793027,34.841625798796414,19.82942695617298,0.9211647743133897,Au,PRUNED
5305,0.0,2026-04-07 11:37:39.871278,2026-04-07 11:37:40.886276,0 days 00:00:01.014998,20.48835681397489,17.300531390431264,0.3943785226132221,Au,PRUNED
5306,0.0,2026-04-07 11:37:39.919935,2026-04-07 11:37:40.778255,0 days 00:00:00.858320,32.9372672952802,17.641722396161857,0.34941962857825104,Au,PRUNED
5307,-1.0,2026-04-07 11:37:39.959667,2026-04-07 11:37:40.668760,0 days 00:00:00.709093,21.182204057669363,19.860053107725843,0.7501378163115208,Au,COMPLETE
5308,-1.0,2026-04-07 11:37:40.176553,2026-04-07 11:37:40.787246,0 days 00:00:00.610693,30.277172856005812,19.83509510544883,0.6952649252906224,Au,COMPLETE
5309,0.0,2026-04-07 11:37:40.199061,2026-04-07 11:37:41.197650,0 days 00:00:00.998589,33.77234130833581,19.93548868261841,0.7988654707259617,Au,PRUNED
5310,0.0,2026-04-07 11:37:40.454996,2026-04-07 11:37:41.228023,0 days 00:00:00.773027,20.159446451023452,19.431572746340795,0.7307758533284519,Au,PRUNED
5311,-1.0,2026-04-07 11:37:40.720969,2026-04-07 11:37:41.509429,0 days 00:00:00.788460,33.95981631175119,19.952736672921166,0.4308779917103924,Au,COMPLETE
5312,-1.0,2026-04-07 11:37:40.777243,2026-04-07 11:37:41.353114,0 days 00:00:00.575871,41.114107162268255,15.258139590160447,0.49738652358545543,Au,COMPLETE
5313,-1.0,2026-04-07 11:37:40.832994,2026-04-07 11:37:41.493467,0 days 00:00:00.660473,31.978385139108198,19.94544505356167,0.743256034595439,Au,COMPLETE
