number,value,datetime_start,datetime_complete,duration,params_D2_nm,params_D3_nm,params_D4_nm,params_metal,state
2392,-1.0,2026-04-07 11:32:32.069611,2026-04-07 11:32:32.680607,0 days 00:00:00.610996,25.048659172607085,15.066046524488808,1.729519371662625,Cu,COMPLETE
2393,1.6666666666665333,2026-04-07 11:32:32.094027,2026-04-07 11:32:32.838659,0 days 00:00:00.744632,29.802335453910636,17.088012950513566,1.6232703551897083,Cu,PRUNED
2394,-1.0,2026-04-07 11:32:32.170693,2026-04-07 11:32:32.738913,0 days 00:00:00.568220,23.313200041723768,17.14976637129618,1.9306772626902549,Cu,COMPLETE
2395,-1.0,2026-04-07 11:32:32.507227,2026-04-07 11:32:33.196340,0 days 00:00:00.689113,35.158560863799735,14.654307155585302,1.938585740714568,Cu,COMPLETE
2396,-1.0,2026-04-07 11:32:32.733400,2026-04-07 11:32:33.262212,0 days 00:00:00.528812,20.476912567449723,16.5785977490061,1.4565558560010745,Au,COMPLETE
2397,-1.0,2026-04-07 11:32:32.769146,2026-04-07 11:32:33.262212,0 days 00:00:00.493066,20.70409446930684,19.809667329894012,1.1592177291255368,Cu,COMPLETE
2398,-11.904761904760544,2026-04-07 11:32:32.798731,2026-04-07 11:32:33.364959,0 days 00:00:00.566228,21.55439454300631,19.301443577980198,1.7969670250024898,Cu,PRUNED
2399,-10.71428571428449,2026-04-07 11:32:32.878839,2026-04-07 11:32:33.657894,0 days 00:00:00.779055,23.216053389841882,18.666670193152754,1.7807364140885125,Cu,PRUNED
2400,-1.0,2026-04-07 11:32:32.919936,2026-04-07 11:32:33.260597,0 days 00:00:00.340661,23.3302863219245,19.88882371985067,1.3280199636827148,Au,COMPLETE
2401,-1.0,2026-04-07 11:32:32.933651,2026-04-07 11:32:33.397449,0 days 00:00:00.463798,21.789360019708873,19.108149052751823,1.6259070904093917,Cu,COMPLETE
2402,-13.15789473684072,2026-04-07 11:32:32.948804,2026-04-07 11:32:33.560652,0 days 00:00:00.611848,23.58734077148873,17.172857047350583,1.7392040379989289,Cu,PRUNED
2403,0.0,2026-04-07 11:32:33.282075,2026-04-07 11:32:34.040681,0 days 00:00:00.758606,36.71095416344074,19.82772283791583,1.8576686889287586,Cu,PRUNED
2404,0.0,2026-04-07 11:32:33.397960,2026-04-07 11:32:34.299843,0 days 00:00:00.901883,38.47044319133896,17.142301511497177,1.5022809269139958,Au,PRUNED
2405,-1.0,2026-04-07 11:32:33.477667,2026-04-07 11:32:33.960516,0 days 00:00:00.482849,20.42350481783346,19.286781863725377,1.8633042158194755,Cu,COMPLETE
2406,0.0,2026-04-07 11:32:33.521806,2026-04-07 11:32:34.055601,0 days 00:00:00.533795,20.78843916573927,17.215249469684917,1.0983989459767964,Au,PRUNED
2407,-1.0,2026-04-07 11:32:33.563659,2026-04-07 11:32:34.272734,0 days 00:00:00.709075,72.27676456885926,6.087890376258347,1.9736874965310598,Ag,COMPLETE
2408,-1.0,2026-04-07 11:32:33.660402,2026-04-07 11:32:34.349763,0 days 00:00:00.689361,20.544384657586885,16.540653583201454,1.6381477498979202,Au,COMPLETE
2409,-1.0,2026-04-07 11:32:33.718069,2026-04-07 11:32:34.269508,0 days 00:00:00.551439,32.20183227445818,19.92902602981823,1.7291999607517412,Cu,COMPLETE
2410,0.0,2026-04-07 11:32:33.729357,2026-04-07 11:32:34.303525,0 days 00:00:00.574168,40.213486242670186,19.941324084832004,1.4246278038059192,Cu,PRUNED
2411,0.0,2026-04-07 11:32:34.120439,2026-04-07 11:32:34.938510,0 days 00:00:00.818071,20.444772441023822,17.311651325206743,1.53327066653142,Cu,PRUNED
2412,0.0,2026-04-07 11:32:34.161777,2026-04-07 11:32:34.939509,0 days 00:00:00.777732,36.79527528898575,16.414778764563426,1.8062723716036828,Au,PRUNED
2413,-1.0,2026-04-07 11:32:34.220109,2026-04-07 11:32:34.768636,0 days 00:00:00.548527,25.91920834143535,16.399597504033146,1.7421924831702988,Ag,COMPLETE
2414,-9.50292397660752,2026-04-07 11:32:34.368773,2026-04-07 11:32:35.003308,0 days 00:00:00.634535,24.25194816014401,17.695740252235623,1.8520904082980612,Ag,PRUNED
2415,0.0,2026-04-07 11:32:34.406028,2026-04-07 11:32:35.110811,0 days 00:00:00.704783,20.352841529477736,15.720421459998548,1.4935121584115654,Cu,PRUNED
2416,-1.0,2026-04-07 11:32:34.435127,2026-04-07 11:32:34.875793,0 days 00:00:00.440666,38.95724350416407,16.56767887390613,1.7665241551570388,Au,COMPLETE
2417,-407.9736211030594,2026-04-07 11:32:34.491748,2026-04-07 11:32:35.269391,0 days 00:00:00.777643,20.306060802181012,19.433970822339276,1.5321207089675415,Au,COMPLETE
2418,-294.57885304656304,2026-04-07 11:32:34.534842,2026-04-07 11:32:35.303545,0 days 00:00:00.768703,20.286524063000744,19.495577800651628,1.4841220965175916,Cu,COMPLETE
2419,-12.731481481480067,2026-04-07 11:32:35.063121,2026-04-07 11:32:35.663882,0 days 00:00:00.600761,21.37880918739465,19.71637094583186,1.2697427866585471,Cu,PRUNED
2420,-1.0,2026-04-07 11:32:35.086208,2026-04-07 11:32:35.537103,0 days 00:00:00.450895,20.681619202478583,18.370702363454242,1.7476557727759117,Au,COMPLETE
2421,-1.0,2026-04-07 11:32:35.110811,2026-04-07 11:32:35.771545,0 days 00:00:00.660734,33.36402052968691,19.521573435305523,1.896324570290993,Au,COMPLETE
2422,-417.89215686268363,2026-04-07 11:32:35.149000,2026-04-07 11:32:35.726985,0 days 00:00:00.577985,20.52688115121184,19.484279924198773,1.4996110039096107,Au,COMPLETE
2423,-1.0,2026-04-07 11:32:35.163621,2026-04-07 11:32:35.634310,0 days 00:00:00.470689,117.7472140627697,17.32491948297283,1.3212216308898481,Au,COMPLETE
2424,-1.0,2026-04-07 11:32:35.186331,2026-04-07 11:32:35.697786,0 days 00:00:00.511455,28.552182870817873,18.894316011673418,1.3218761581260547,Au,COMPLETE
2425,-1.0,2026-04-07 11:32:35.434656,2026-04-07 11:32:35.849672,0 days 00:00:00.415016,31.605605373554987,18.539259288773355,1.5762180133930606,Au,COMPLETE
2426,-1.0,2026-04-07 11:32:35.467384,2026-04-07 11:32:35.962751,0 days 00:00:00.495367,22.219338652822163,19.03207359342339,1.4355869956366702,Au,COMPLETE
2427,0.0,2026-04-07 11:32:35.751250,2026-04-07 11:32:36.308255,0 days 00:00:00.557005,28.63880055656258,18.672541280911076,1.5177844277802484,Au,PRUNED
2428,-1.0,2026-04-07 11:32:35.811944,2026-04-07 11:32:36.182735,0 days 00:00:00.370791,23.391368117647804,19.642817335718878,1.7737200237183894,Au,COMPLETE
2429,0.0,2026-04-07 11:32:35.786531,2026-04-07 11:32:36.475795,0 days 00:00:00.689264,35.71543736017552,18.133507357344826,1.275845618946059,Au,PRUNED
2430,0.0,2026-04-07 11:32:35.740475,2026-04-07 11:32:36.445120,0 days 00:00:00.704645,29.576288102412015,19.743586218217413,1.467080224154758,Au,PRUNED
2431,0.0,2026-04-07 11:32:35.893378,2026-04-07 11:32:36.307214,0 days 00:00:00.413836,36.43151770180713,19.732280353790426,1.5625346717138178,Au,PRUNED
2432,-1.0,2026-04-07 11:32:35.965255,2026-04-07 11:32:36.524558,0 days 00:00:00.559303,24.98848871492077,18.747521083409495,1.5689596659641172,Au,COMPLETE
2433,0.0,2026-04-07 11:32:36.008623,2026-04-07 11:32:36.522552,0 days 00:00:00.513929,28.693467093398702,19.154982350471666,1.6652755444744574,Au,PRUNED
2434,-1.0,2026-04-07 11:32:36.120703,2026-04-07 11:32:36.603468,0 days 00:00:00.482765,36.230521624097165,18.21231209178011,1.3423405407892703,Au,COMPLETE
2435,0.0,2026-04-07 11:32:36.310214,2026-04-07 11:32:37.082112,0 days 00:00:00.771898,31.81600636302172,19.981405354438184,1.4239854716553677,Au,PRUNED
2436,-1.0,2026-04-07 11:32:36.401071,2026-04-07 11:32:36.928962,0 days 00:00:00.527891,25.135884584650576,19.01780114701377,1.3674918138130103,Au,COMPLETE
2437,0.0,2026-04-07 11:32:36.478297,2026-04-07 11:32:36.973587,0 days 00:00:00.495290,25.445952465055843,19.903739174001817,1.3979749104823473,Au,PRUNED
2438,0.0,2026-04-07 11:32:36.576464,2026-04-07 11:32:37.114483,0 days 00:00:00.538019,34.85257700969114,19.680574456564575,1.5818181944556096,Au,PRUNED
2439,-7.4404761904751275,2026-04-07 11:32:36.637700,2026-04-07 11:32:37.268116,0 days 00:00:00.630416,21.584298745198378,18.726533502611268,1.7451949071388135,Au,PRUNED
2440,0.0,2026-04-07 11:32:36.663570,2026-04-07 11:32:37.405708,0 days 00:00:00.742138,42.96068445813894,19.089016246570605,1.5230363488814713,Au,PRUNED
2441,0.0,2026-04-07 11:32:36.677909,2026-04-07 11:32:37.690636,0 days 00:00:01.012727,41.73087100733405,19.359771667094968,1.5828708152936883,Au,PRUNED
2442,0.0,2026-04-07 11:32:36.721526,2026-04-07 11:32:37.343428,0 days 00:00:00.621902,25.518279827780734,19.981190054478255,1.3563808787376148,Au,PRUNED
2443,-1.0,2026-04-07 11:32:37.028434,2026-04-07 11:32:37.675733,0 days 00:00:00.647299,33.969095342374814,17.446191861805787,1.7649879966193536,Au,COMPLETE
2444,0.0,2026-04-07 11:32:37.054677,2026-04-07 11:32:37.958722,0 days 00:00:00.904045,27.607087585512794,19.78212986605648,1.5999270660684919,Au,PRUNED
2445,-1.0,2026-04-07 11:32:37.141391,2026-04-07 11:32:37.911316,0 days 00:00:00.769925,20.74297800566627,16.792014853908245,1.4455580887360795,Au,COMPLETE
2446,-1.0,2026-04-07 11:32:37.239582,2026-04-07 11:32:37.678047,0 days 00:00:00.438465,20.89101328779587,19.87680610789399,1.600941333221063,Au,COMPLETE
2447,-1.0,2026-04-07 11:32:37.345917,2026-04-07 11:32:37.978436,0 days 00:00:00.632519,20.125399112592902,18.28652892436415,1.4205044374388274,Au,COMPLETE
2448,-1.0,2026-04-07 11:32:37.439676,2026-04-07 11:32:38.034715,0 days 00:00:00.595039,44.40827858325339,17.213748210486273,1.4734689456380041,Au,COMPLETE
2449,-353.2494758909407,2026-04-07 11:32:37.486360,2026-04-07 11:32:37.975385,0 days 00:00:00.489025,21.278941377727328,18.344296549615514,1.1270115674341064,Au,COMPLETE
2450,-289.90299823630096,2026-04-07 11:32:37.822684,2026-04-07 11:32:38.661719,0 days 00:00:00.839035,23.141725048210663,15.543191083915454,1.3359192709461238,Au,COMPLETE
2451,82.10784313725247,2026-04-07 11:32:37.863272,2026-04-07 11:32:38.568199,0 days 00:00:00.704927,27.74660921009385,17.887580635998575,0.6859296169788386,Au,PRUNED
2452,81.49509803921329,2026-04-07 11:32:37.979437,2026-04-07 11:32:38.904609,0 days 00:00:00.925172,29.327496496220547,15.836275284458562,1.4467253723952378,Au,PRUNED
2453,-1.0,2026-04-07 11:32:38.066223,2026-04-07 11:32:38.511799,0 days 00:00:00.445576,119.2240705278299,13.662409849086567,1.2973346347646069,Cu,COMPLETE
2454,-1.0,2026-04-07 11:32:38.088341,2026-04-07 11:32:38.498059,0 days 00:00:00.409718,22.258603022179578,15.231516310311639,1.1710194798839444,Au,COMPLETE
2455,-1.0,2026-04-07 11:32:38.146815,2026-04-07 11:32:38.772837,0 days 00:00:00.626022,30.58545116648576,17.202329808423638,0.9142674665783712,Au,COMPLETE
2456,-1.0,2026-04-07 11:32:38.202435,2026-04-07 11:32:38.662732,0 days 00:00:00.460297,20.43173475558957,17.414083949314307,0.9529581486185392,Au,COMPLETE
2457,-1.0,2026-04-07 11:32:38.253044,2026-04-07 11:32:38.586585,0 days 00:00:00.333541,20.74103159014598,15.938054940202443,0.9592794049416096,Au,COMPLETE
2458,-1.0,2026-04-07 11:32:38.569217,2026-04-07 11:32:39.107996,0 days 00:00:00.538779,22.680808619372385,18.65003019190886,0.9804199007353883,Au,COMPLETE
2459,-1.0,2026-04-07 11:32:38.786767,2026-04-07 11:32:39.299116,0 days 00:00:00.512349,51.24651630032862,19.5490799510266,1.328576384986917,Au,COMPLETE
2460,-1.0,2026-04-07 11:32:38.822393,2026-04-07 11:32:39.251261,0 days 00:00:00.428868,33.677588956559404,15.835856953100295,1.1879279195095904,Au,COMPLETE
2461,0.0,2026-04-07 11:32:38.876118,2026-04-07 11:32:39.535197,0 days 00:00:00.659079,37.40573896250392,16.300879144011688,0.9494698977729037,Au,PRUNED
2462,0.0,2026-04-07 11:32:38.914301,2026-04-07 11:32:39.501277,0 days 00:00:00.586976,44.60084494362548,18.03362459686109,0.9682195990261191,Au,PRUNED
2463,-1.0,2026-04-07 11:32:38.965335,2026-04-07 11:32:39.337984,0 days 00:00:00.372649,22.841972932860088,19.74402977556276,0.8098449844612761,Au,COMPLETE
2464,0.0,2026-04-07 11:32:38.976536,2026-04-07 11:32:39.454144,0 days 00:00:00.477608,35.96535258683059,16.1651370074637,1.2463021992086576,Au,PRUNED
2465,0.0,2026-04-07 11:32:39.019050,2026-04-07 11:32:39.697548,0 days 00:00:00.678498,38.51156317105427,16.92229586913295,0.9802070782535337,Au,PRUNED
2466,-0.8928571428571173,2026-04-07 11:32:39.243959,2026-04-07 11:32:39.849798,0 days 00:00:00.605839,20.954277652991617,14.642502491861471,1.1955693986430078,Ag,PRUNED
2467,0.0,2026-04-07 11:32:39.397735,2026-04-07 11:32:40.297016,0 days 00:00:00.899281,38.742792524856725,19.3125254787348,1.186463746905392,Au,PRUNED
2468,-1.0,2026-04-07 11:32:39.426023,2026-04-07 11:32:40.192538,0 days 00:00:00.766515,22.509406553002336,19.934802507017405,1.2598548204309594,Au,COMPLETE
2469,-1.0,2026-04-07 11:32:39.567127,2026-04-07 11:32:40.000599,0 days 00:00:00.433472,22.725523340110083,18.131153898347293,1.2876116190950615,Au,COMPLETE
2470,-1.0,2026-04-07 11:32:39.580307,2026-04-07 11:32:40.176109,0 days 00:00:00.595802,20.900219430311424,18.80236490214868,1.3615576557068931,Au,COMPLETE
2471,-351.30208333328943,2026-04-07 11:32:39.605576,2026-04-07 11:32:40.533966,0 days 00:00:00.928390,22.09445626681119,17.75237894900439,1.1428767876400734,Au,COMPLETE
2472,80.86419753086179,2026-04-07 11:32:39.597131,2026-04-07 11:32:40.330051,0 days 00:00:00.732920,29.56344205155486,17.093213346535453,1.2798013883573813,Au,PRUNED
2473,-1.0,2026-04-07 11:32:39.739640,2026-04-07 11:32:40.114077,0 days 00:00:00.374437,64.67598483493576,9.840827367174528,1.2225858890868226,Cu,COMPLETE
2474,79.32098765431864,2026-04-07 11:32:39.897072,2026-04-07 11:32:40.455712,0 days 00:00:00.558640,32.41047963373169,16.016216124254324,1.50583270778255,Au,PRUNED
2475,0.0,2026-04-07 11:32:40.091969,2026-04-07 11:32:40.825084,0 days 00:00:00.733115,20.229362212148004,17.453318258067483,1.29633644263648,Au,PRUNED
2476,-8.064516129031217,2026-04-07 11:32:40.358526,2026-04-07 11:32:41.206943,0 days 00:00:00.848417,25.135964223433874,16.6067666910252,1.1212188339446678,Au,PRUNED
2477,-1.0,2026-04-07 11:32:40.386661,2026-04-07 11:32:41.002170,0 days 00:00:00.615509,22.044574383811653,16.319284789479944,1.1185082056541327,Au,COMPLETE
2478,0.0,2026-04-07 11:32:40.411946,2026-04-07 11:32:41.115336,0 days 00:00:00.703390,20.760017230267362,17.809395170748957,1.222763542238825,Au,PRUNED
2479,-1.0,2026-04-07 11:32:40.426884,2026-04-07 11:32:40.940348,0 days 00:00:00.513464,38.998971171251014,17.541657423697018,1.2073861826198082,Au,COMPLETE
2480,-10.41666666666518,2026-04-07 11:32:40.459735,2026-04-07 11:32:41.331675,0 days 00:00:00.871940,22.395172826292995,18.57619072803716,1.076116712271406,Au,PRUNED
2481,79.0441176470565,2026-04-07 11:32:40.502657,2026-04-07 11:32:41.112499,0 days 00:00:00.609842,35.8858423717177,14.449179705516928,0.8886587527802666,Au,PRUNED
2482,-292.55793226378364,2026-04-07 11:32:40.689453,2026-04-07 11:32:41.345912,0 days 00:00:00.656459,22.19981041353344,16.47683551817019,1.035235665159233,Au,COMPLETE
2483,-1.0,2026-04-07 11:32:40.866530,2026-04-07 11:32:41.450894,0 days 00:00:00.584364,119.12883825541346,13.890848636150892,0.21261364086280587,Ag,COMPLETE
2484,0.0,2026-04-07 11:32:41.118673,2026-04-07 11:32:41.736533,0 days 00:00:00.617860,34.55749864249637,18.994708772819124,0.8335042260828575,Au,PRUNED
2485,-390.2298850574169,2026-04-07 11:32:41.203239,2026-04-07 11:32:41.704521,0 days 00:00:00.501282,20.855462373940238,18.99705832346128,1.3167709279428608,Au,COMPLETE
2486,0.0,2026-04-07 11:32:41.226686,2026-04-07 11:32:41.874856,0 days 00:00:00.648170,20.971266151111813,16.762718551197207,1.292135827955386,Au,PRUNED
2487,0.0,2026-04-07 11:32:41.303358,2026-04-07 11:32:41.848212,0 days 00:00:00.544854,37.10763291453135,18.816383867596723,1.0320732878985666,Au,PRUNED
2488,0.0,2026-04-07 11:32:41.332674,2026-04-07 11:32:41.849219,0 days 00:00:00.516545,22.689067476630143,19.774126559026328,0.8679901486891108,Au,PRUNED
2489,-325.77972709547885,2026-04-07 11:32:41.374779,2026-04-07 11:32:42.189823,0 days 00:00:00.815044,20.18508195869547,18.236211860466696,1.611756894852363,Au,COMPLETE
2490,2.6881720430104057,2026-04-07 11:32:41.569297,2026-04-07 11:32:42.131318,0 days 00:00:00.562021,21.813786299855852,19.945523444912226,1.736422628111555,Au,PRUNED
2491,0.0,2026-04-07 11:32:41.616406,2026-04-07 11:32:42.285516,0 days 00:00:00.669110,43.58116566103345,19.414963389082832,0.8117734509773766,Au,PRUNED
2492,49.76851851851713,2026-04-07 11:32:41.797343,2026-04-07 11:32:42.438544,0 days 00:00:00.641201,48.70466620533818,19.835310124750936,1.8158113762706285,Ag,PRUNED
2493,-12.499999999998334,2026-04-07 11:32:41.906276,2026-04-07 11:32:42.625762,0 days 00:00:00.719486,22.914168082009077,17.598564637084603,1.1523629215370226,Au,PRUNED
2494,0.0,2026-04-07 11:32:41.948183,2026-04-07 11:32:42.594021,0 days 00:00:00.645838,32.339338049428385,18.73795616411383,1.0707072633939119,Au,PRUNED
2495,-1.0,2026-04-07 11:32:42.009313,2026-04-07 11:32:42.510684,0 days 00:00:00.501371,20.33677693833559,18.90198664699019,1.2303422848511434,Au,COMPLETE
2496,0.0,2026-04-07 11:32:42.019266,2026-04-07 11:32:42.610138,0 days 00:00:00.590872,27.762380536566482,19.940338498106524,1.341840737649617,Au,PRUNED
2497,-1.0,2026-04-07 11:32:42.211228,2026-04-07 11:32:42.732325,0 days 00:00:00.521097,44.91087851131053,19.873656688265203,1.2003086954104027,Au,COMPLETE
2498,-1.0,2026-04-07 11:32:42.282906,2026-04-07 11:32:43.001635,0 days 00:00:00.718729,21.179258878743212,17.960114594805916,1.3476990712791586,Au,COMPLETE
2499,-1.0,2026-04-07 11:32:42.469736,2026-04-07 11:32:43.081050,0 days 00:00:00.611314,21.470149669201415,18.404735303279814,1.3851692993034717,Au,COMPLETE
2500,-336.34538152606416,2026-04-07 11:32:42.555296,2026-04-07 11:32:43.056588,0 days 00:00:00.501292,20.642121681188513,18.426934185792774,1.2154252157734065,Au,COMPLETE
2501,-8.01282051281928,2026-04-07 11:32:42.694431,2026-04-07 11:32:43.191669,0 days 00:00:00.497238,20.792735339205215,19.95912818268737,1.4261000025832846,Au,PRUNED
2502,-1.3888888888887037,2026-04-07 11:32:42.709283,2026-04-07 11:32:43.189765,0 days 00:00:00.480482,22.66306749831473,18.83298086138288,1.5383302156886773,Au,PRUNED
2503,-437.820512820445,2026-04-07 11:32:42.747090,2026-04-07 11:32:43.280949,0 days 00:00:00.533859,20.972859052248438,19.84132916815119,0.924513400585282,Au,COMPLETE
2504,-315.81439393935807,2026-04-07 11:32:42.724689,2026-04-07 11:32:43.495420,0 days 00:00:00.770731,21.88941176253097,16.863420819972674,1.532717933716778,Au,COMPLETE
2505,-348.3436853001639,2026-04-07 11:32:42.892149,2026-04-07 11:32:43.579784,0 days 00:00:00.687635,20.05781582302009,18.8537649790242,1.4863498778058741,Au,COMPLETE
2506,0.0,2026-04-07 11:32:43.155554,2026-04-07 11:32:43.848499,0 days 00:00:00.692945,38.480242424556124,19.477893443981458,0.7821047428282742,Au,PRUNED
2507,0.0,2026-04-07 11:32:43.232451,2026-04-07 11:32:43.998955,0 days 00:00:00.766504,31.621383719096002,19.961246324437735,0.6815464668754039,Au,PRUNED
2508,0.0,2026-04-07 11:32:43.270222,2026-04-07 11:32:44.091658,0 days 00:00:00.821436,22.387961499569972,19.86708824085071,0.9436367868010349,Au,PRUNED
2509,-1.0,2026-04-07 11:32:43.294634,2026-04-07 11:32:43.702399,0 days 00:00:00.407765,31.528928135037525,19.662378024404877,0.6764515854060176,Au,COMPLETE
2510,-1.0,2026-04-07 11:32:43.339912,2026-04-07 11:32:44.328204,0 days 00:00:00.988292,32.74816404407489,19.320063095022554,1.0435413820065453,Au,COMPLETE
2511,-1.0,2026-04-07 11:32:43.576198,2026-04-07 11:32:44.207865,0 days 00:00:00.631667,24.47129865392715,19.82305489949963,1.0537121303401806,Au,COMPLETE
2512,-1.0,2026-04-07 11:32:43.618644,2026-04-07 11:32:44.232831,0 days 00:00:00.614187,39.18474278325163,19.325099891073958,1.2412144480117577,Au,COMPLETE
2513,-365.53030303025525,2026-04-07 11:32:43.841743,2026-04-07 11:32:44.295047,0 days 00:00:00.453304,20.617852730052594,18.95119157543461,1.1833851804408604,Au,COMPLETE
2514,-1.0,2026-04-07 11:32:43.894254,2026-04-07 11:32:44.398801,0 days 00:00:00.504547,23.955684897696326,16.21147114198826,0.9733825268979011,Au,COMPLETE
2515,-1.0,2026-04-07 11:32:44.042815,2026-04-07 11:32:44.622581,0 days 00:00:00.579766,22.8110190761372,15.986997145210298,1.0265123866975518,Au,COMPLETE
2516,79.3504901960761,2026-04-07 11:32:44.087588,2026-04-07 11:32:44.555356,0 days 00:00:00.467768,33.58523487444794,15.918099397077535,0.710112563178614,Au,PRUNED
2517,-1.0,2026-04-07 11:32:44.300973,2026-04-07 11:32:44.790021,0 days 00:00:00.489048,25.106449159425797,16.946902364768125,0.7233133307747754,Au,COMPLETE
2518,-1.0,2026-04-07 11:32:44.152480,2026-04-07 11:32:45.062787,0 days 00:00:00.910307,20.23923992116557,19.6488419039002,1.014006480779257,Au,COMPLETE
2519,-1.0,2026-04-07 11:32:44.389061,2026-04-07 11:32:45.045728,0 days 00:00:00.656667,25.46211863331264,19.998783658778162,1.1627096460990969,Au,COMPLETE
2520,0.0,2026-04-07 11:32:44.477782,2026-04-07 11:32:45.200003,0 days 00:00:00.722221,29.55601967393686,19.64361736856281,1.1081331875887641,Au,PRUNED
2521,2.3809523809521087,2026-04-07 11:32:44.512029,2026-04-07 11:32:45.201009,0 days 00:00:00.688980,28.496200848280715,16.075291820319386,0.9217723352874372,Au,PRUNED
2522,0.0,2026-04-07 11:32:44.603735,2026-04-07 11:32:45.186488,0 days 00:00:00.582753,38.308743365608414,18.26694332195227,1.1715578717228414,Au,PRUNED
2523,-1.0,2026-04-07 11:32:44.706347,2026-04-07 11:32:45.341200,0 days 00:00:00.634853,38.696404754611024,19.564040820458942,1.34687191901892,Au,COMPLETE
2524,-1.0,2026-04-07 11:32:44.731323,2026-04-07 11:32:45.150878,0 days 00:00:00.419555,25.83462525253013,19.224883223807463,1.0811168726677685,Au,COMPLETE
2525,0.0,2026-04-07 11:32:44.919299,2026-04-07 11:32:45.546866,0 days 00:00:00.627567,34.46438759814813,17.353448783694496,1.2084353779537034,Au,PRUNED
2526,-1.0,2026-04-07 11:32:45.204039,2026-04-07 11:32:45.731931,0 days 00:00:00.527892,20.674312980748027,17.48436759271101,1.1922698393258633,Au,COMPLETE
2527,83.02696078431127,2026-04-07 11:32:45.266410,2026-04-07 11:32:45.860277,0 days 00:00:00.593867,24.079141543047683,19.85448837098244,0.8768672656611327,Au,PRUNED
2528,-1.0,2026-04-07 11:32:45.280700,2026-04-07 11:32:45.796728,0 days 00:00:00.516028,22.058881920064813,19.97478805067686,0.9933361585677213,Au,COMPLETE
2529,-1.0,2026-04-07 11:32:45.298568,2026-04-07 11:32:45.993138,0 days 00:00:00.694570,23.046444460013202,17.369780713247078,1.2349089161006375,Au,COMPLETE
