number,value,datetime_start,datetime_complete,duration,params_D2_nm,params_D3_nm,params_D4_nm,params_metal,state
5593,-1.0,2026-04-07 11:38:12.999844,2026-04-07 11:38:13.843225,0 days 00:00:00.843381,27.58917125090611,19.981542639869012,0.6340379135709612,Au,COMPLETE
5594,-1.0,2026-04-07 11:38:13.311384,2026-04-07 11:38:13.964848,0 days 00:00:00.653464,21.119702807727165,19.814542110253495,0.9875227170906313,Au,COMPLETE
5595,0.0,2026-04-07 11:38:13.485501,2026-04-07 11:38:14.188649,0 days 00:00:00.703148,31.777187066696385,19.996539017483183,0.5159437204251747,Au,PRUNED
5596,-1.0,2026-04-07 11:38:13.529002,2026-04-07 11:38:14.278520,0 days 00:00:00.749518,49.324433072608855,17.023810602720697,0.6824935524770943,Cu,COMPLETE
5597,0.0,2026-04-07 11:38:13.618131,2026-04-07 11:38:14.404527,0 days 00:00:00.786396,32.47698943966349,17.407560797937784,0.4967261862088572,Au,PRUNED
5598,-1.0,2026-04-07 11:38:13.732330,2026-04-07 11:38:14.387736,0 days 00:00:00.655406,36.61693961176235,18.168476806922317,0.7316448371057304,Au,COMPLETE
5599,-1.0,2026-04-07 11:38:13.752226,2026-04-07 11:38:14.387736,0 days 00:00:00.635510,21.139653258300317,17.042999498337384,0.48514822424201653,Au,COMPLETE
5600,-1.0,2026-04-07 11:38:13.711494,2026-04-07 11:38:14.277074,0 days 00:00:00.565580,33.00702404687869,19.91912270886873,0.6181002799354208,Au,COMPLETE
5601,0.0,2026-04-07 11:38:14.111606,2026-04-07 11:38:14.765621,0 days 00:00:00.654015,40.17488355426548,19.92522010603228,0.5600216119586324,Au,PRUNED
5602,0.0,2026-04-07 11:38:14.236997,2026-04-07 11:38:15.275061,0 days 00:00:01.038064,44.18851439555446,19.957440704096165,0.7878509403993768,Au,PRUNED
5603,-1.0,2026-04-07 11:38:14.252669,2026-04-07 11:38:15.000793,0 days 00:00:00.748124,31.847564028194803,17.7721999724472,1.1190379553620655,Au,COMPLETE
5604,-1.0,2026-04-07 11:38:14.379142,2026-04-07 11:38:15.276058,0 days 00:00:00.896916,45.39451833131688,17.579677136017544,0.6887123368482555,Au,COMPLETE
5605,0.0,2026-04-07 11:38:14.485985,2026-04-07 11:38:15.419049,0 days 00:00:00.933064,20.06033862895235,19.64233233659965,0.46871067080810946,Au,PRUNED
5606,-401.30023640656185,2026-04-07 11:38:14.596555,2026-04-07 11:38:15.834043,0 days 00:00:01.237488,20.395532516299202,19.89952444928625,0.8059471198200857,Au,COMPLETE
5607,-1.0,2026-04-07 11:38:14.673249,2026-04-07 11:38:15.622618,0 days 00:00:00.949369,36.127490674444964,19.95712769931978,0.9675872656006228,Au,COMPLETE
5608,-441.53746770019023,2026-04-07 11:38:14.740774,2026-04-07 11:38:15.923874,0 days 00:00:01.183100,21.118471947831868,19.85684064433763,0.9358745746874418,Au,COMPLETE
5609,0.0,2026-04-07 11:38:14.895662,2026-04-07 11:38:15.835051,0 days 00:00:00.939389,44.96730200895704,16.94069760814942,0.9561899850831975,Au,PRUNED
5610,-444.98697916659717,2026-04-07 11:38:15.352563,2026-04-07 11:38:16.016316,0 days 00:00:00.663753,20.843501633243527,19.981934296838755,1.022166168581824,Au,COMPLETE
5611,0.0,2026-04-07 11:38:15.416093,2026-04-07 11:38:16.485125,0 days 00:00:01.069032,44.932235211463265,16.664243476891063,1.1570572060271032,Au,PRUNED
5612,-448.49081364822314,2026-04-07 11:38:15.507002,2026-04-07 11:38:16.432632,0 days 00:00:00.925630,21.42309194208357,19.92232987248629,0.644142069712251,Au,COMPLETE
5613,0.0,2026-04-07 11:38:15.621606,2026-04-07 11:38:16.204039,0 days 00:00:00.582433,32.51103630112935,17.66202618927725,0.44386683255258846,Au,PRUNED
5614,-1.0,2026-04-07 11:38:15.908849,2026-04-07 11:38:16.442424,0 days 00:00:00.533575,21.060415366023488,19.66636736583108,0.3485429161594199,Cu,COMPLETE
5615,0.0,2026-04-07 11:38:15.952328,2026-04-07 11:38:16.714491,0 days 00:00:00.762163,39.73258185649147,19.98420247570565,0.7438477442259787,Au,PRUNED
5616,0.0,2026-04-07 11:38:16.019989,2026-04-07 11:38:16.758866,0 days 00:00:00.738877,48.23446530747182,19.99299309864625,0.3765197285657538,Au,PRUNED
5617,-1.0,2026-04-07 11:38:16.205168,2026-04-07 11:38:17.053632,0 days 00:00:00.848464,33.928730651375815,17.68126978128372,0.60027990514779,Au,COMPLETE
5618,0.0,2026-04-07 11:38:16.246881,2026-04-07 11:38:17.107711,0 days 00:00:00.860830,35.164489876450716,19.976644653240225,0.3463574106328516,Au,PRUNED
5619,0.0,2026-04-07 11:38:16.314512,2026-04-07 11:38:17.104638,0 days 00:00:00.790126,20.32919372155473,17.4382427355882,0.6927087950492452,Au,PRUNED
5620,-1.0,2026-04-07 11:38:16.592855,2026-04-07 11:38:17.239768,0 days 00:00:00.646913,28.35167163779539,15.157746229184038,0.6297156479759654,Au,COMPLETE
5621,-1.0,2026-04-07 11:38:16.676102,2026-04-07 11:38:17.381596,0 days 00:00:00.705494,20.64304311952979,18.22696840599571,0.4090551226320692,Au,COMPLETE
5622,-0.29342723004694005,2026-04-07 11:38:16.743158,2026-04-07 11:38:17.630911,0 days 00:00:00.887753,49.89879007579274,14.770686748359829,0.634498211947623,Au,PRUNED
5623,0.0,2026-04-07 11:38:16.853897,2026-04-07 11:38:17.574331,0 days 00:00:00.720434,20.196619980854496,14.818199219948305,0.6985707398276612,Au,PRUNED
5624,0.0,2026-04-07 11:38:16.897725,2026-04-07 11:38:17.572329,0 days 00:00:00.674604,22.26909220515037,14.505510851073664,0.41786774698295825,Au,PRUNED
5625,-4.761904761904217,2026-04-07 11:38:17.173351,2026-04-07 11:38:17.977145,0 days 00:00:00.803794,30.95360022527673,14.361966929879166,0.6155087190064905,Au,PRUNED
5626,0.0,2026-04-07 11:38:17.235650,2026-04-07 11:38:18.085585,0 days 00:00:00.849935,33.81057596047064,17.74716563287846,0.7108479115787654,Au,PRUNED
5627,-1.0,2026-04-07 11:38:17.198796,2026-04-07 11:38:17.910205,0 days 00:00:00.711409,30.005498014634647,15.329226161190684,0.34545107454618146,Au,COMPLETE
5628,0.0,2026-04-07 11:38:17.456709,2026-04-07 11:38:18.178496,0 days 00:00:00.721787,33.86695128965727,18.255954870943278,0.3390144101508944,Au,PRUNED
5629,-1.0,2026-04-07 11:38:17.667521,2026-04-07 11:38:18.524484,0 days 00:00:00.856963,32.623373194911636,17.782810661135954,0.555296351929409,Au,COMPLETE
5630,-11.79245283018779,2026-04-07 11:38:17.683693,2026-04-07 11:38:18.508261,0 days 00:00:00.824568,37.21337445293631,13.634353780524684,0.3587714446376725,Cu,PRUNED
5631,-1.0,2026-04-07 11:38:17.735909,2026-04-07 11:38:18.385108,0 days 00:00:00.649199,83.98247569210457,3.389245562911446,1.3555255320782005,Au,COMPLETE
5632,0.0,2026-04-07 11:38:17.754184,2026-04-07 11:38:18.665760,0 days 00:00:00.911576,35.054538528025525,19.892541718760903,0.3818748899960392,Au,PRUNED
5633,0.0,2026-04-07 11:38:18.081048,2026-04-07 11:38:18.874490,0 days 00:00:00.793442,36.08999111608043,19.95661276066231,0.3728199542937817,Au,PRUNED
5634,-9.9999999999984,2026-04-07 11:38:18.115925,2026-04-07 11:38:19.218705,0 days 00:00:01.102780,21.627011318786106,19.866210317507218,0.7044198386175959,Au,PRUNED
5635,0.0,2026-04-07 11:38:18.198123,2026-04-07 11:38:19.026275,0 days 00:00:00.828152,37.96181984845626,17.478577733066686,0.4811045130891114,Au,PRUNED
5636,-1.0,2026-04-07 11:38:18.296139,2026-04-07 11:38:18.773165,0 days 00:00:00.477026,33.7976587807075,19.919315853623583,0.6742997742095521,Au,COMPLETE
5637,0.0,2026-04-07 11:38:18.562149,2026-04-07 11:38:19.497574,0 days 00:00:00.935425,31.10784768429799,19.961186213138664,0.4126117990717167,Au,PRUNED
5638,-1.0,2026-04-07 11:38:18.612640,2026-04-07 11:38:19.363642,0 days 00:00:00.751002,33.07224790272291,17.029938359221795,0.45966675187375977,Au,COMPLETE
5639,-1.0,2026-04-07 11:38:18.712929,2026-04-07 11:38:19.549182,0 days 00:00:00.836253,31.433588912968982,17.481484588321575,0.5826974476134277,Au,COMPLETE
5640,-1.0,2026-04-07 11:38:18.777751,2026-04-07 11:38:19.395969,0 days 00:00:00.618218,44.21797521228783,17.884917583361,0.7165965584618929,Au,COMPLETE
5641,-1.0,2026-04-07 11:38:19.000212,2026-04-07 11:38:19.664263,0 days 00:00:00.664051,35.56368690258316,17.620454679122204,0.5857530581171413,Au,COMPLETE
5642,-452.0502645501923,2026-04-07 11:38:19.045850,2026-04-07 11:38:20.054014,0 days 00:00:01.008164,21.389451504171387,19.94961375833474,0.6770546412170065,Au,COMPLETE
5643,0.0,2026-04-07 11:38:19.124347,2026-04-07 11:38:19.695444,0 days 00:00:00.571097,36.38328277670527,19.89643305792417,0.10696315719813446,Au,PRUNED
5644,-1.0,2026-04-07 11:38:19.412030,2026-04-07 11:38:20.288055,0 days 00:00:00.876025,22.366990418070433,19.993754758992242,0.6742492111271492,Au,COMPLETE
5645,-1.0,2026-04-07 11:38:19.538590,2026-04-07 11:38:20.479682,0 days 00:00:00.941092,35.04586541468565,19.93239708475764,0.48704255821181264,Au,COMPLETE
5646,0.0,2026-04-07 11:38:19.622465,2026-04-07 11:38:20.375481,0 days 00:00:00.753016,33.774081014309154,18.06876272741419,0.6223424335758339,Au,PRUNED
5647,0.0,2026-04-07 11:38:19.750466,2026-04-07 11:38:20.826850,0 days 00:00:01.076384,20.148156996110274,18.46995345810155,0.33679909398303653,Au,PRUNED
5648,4.761904761904217,2026-04-07 11:38:19.931348,2026-04-07 11:38:20.826850,0 days 00:00:00.895502,31.877417195267682,15.053767027520315,0.5246070233335769,Au,PRUNED
5649,81.48148148147907,2026-04-07 11:38:19.977007,2026-04-07 11:38:20.630628,0 days 00:00:00.653621,29.549760403813984,17.66630270604077,0.5824578460226971,Au,PRUNED
5650,-1.0,2026-04-07 11:38:20.017119,2026-04-07 11:38:20.739058,0 days 00:00:00.721939,33.88303710769321,17.5418707483714,0.3127461997279113,Au,COMPLETE
5651,0.0,2026-04-07 11:38:20.380166,2026-04-07 11:38:21.338641,0 days 00:00:00.958475,20.731984330808167,19.618042635439174,0.16492912114890856,Au,PRUNED
5652,0.0,2026-04-07 11:38:20.451566,2026-04-07 11:38:21.205601,0 days 00:00:00.754035,20.192462288101865,17.863874269030802,0.33745857101607896,Au,PRUNED
5653,-1.0,2026-04-07 11:38:20.504615,2026-04-07 11:38:21.340645,0 days 00:00:00.836030,21.196952067188157,17.27650335395908,0.43940988240897055,Au,COMPLETE
5654,0.0,2026-04-07 11:38:20.716109,2026-04-07 11:38:21.442385,0 days 00:00:00.726276,20.123555424511455,19.348249372566364,0.38900702923492003,Au,PRUNED
5655,-1.0,2026-04-07 11:38:20.763738,2026-04-07 11:38:21.414642,0 days 00:00:00.650904,53.11685862823225,19.91758664166459,0.5342318923325837,Au,COMPLETE
5656,0.0,2026-04-07 11:38:20.930457,2026-04-07 11:38:21.665001,0 days 00:00:00.734544,20.41338882965992,18.277473665716094,0.5283340413724393,Au,PRUNED
5657,-367.10239651411337,2026-04-07 11:38:20.956339,2026-04-07 11:38:21.598339,0 days 00:00:00.642000,20.126548129021398,19.826827806145587,0.6635038522248423,Au,COMPLETE
5658,-1.0,2026-04-07 11:38:21.034028,2026-04-07 11:38:21.665001,0 days 00:00:00.630973,22.578141641129935,19.78633569144535,0.3444610828146388,Au,COMPLETE
5659,-1.0,2026-04-07 11:38:21.311697,2026-04-07 11:38:22.090483,0 days 00:00:00.778786,20.047640717281627,15.090485193664506,0.6339952859247525,Au,COMPLETE
5660,-1.0,2026-04-07 11:38:21.382024,2026-04-07 11:38:22.087183,0 days 00:00:00.705159,20.21787042009502,17.502458354200048,0.6726183907948529,Au,COMPLETE
5661,-1.0,2026-04-07 11:38:21.562810,2026-04-07 11:38:22.128455,0 days 00:00:00.565645,30.35302718422922,17.318046057103707,0.26265767054612743,Au,COMPLETE
5662,-1.0,2026-04-07 11:38:21.722085,2026-04-07 11:38:22.270805,0 days 00:00:00.548720,34.25533389156978,17.566484850619478,0.5236148603606663,Au,COMPLETE
5663,0.0,2026-04-07 11:38:21.741823,2026-04-07 11:38:22.419109,0 days 00:00:00.677286,22.461376233705103,16.89032167699309,0.4595794162189786,Au,PRUNED
5664,79.93827160493589,2026-04-07 11:38:21.797099,2026-04-07 11:38:22.474026,0 days 00:00:00.676927,32.6443255373821,17.27941414964915,0.2532167069372946,Au,PRUNED
5665,-1.0,2026-04-07 11:38:21.831722,2026-04-07 11:38:22.569647,0 days 00:00:00.737925,21.153527058168336,19.57763750766428,0.3467698854004826,Au,COMPLETE
5666,-1.0,2026-04-07 11:38:22.003314,2026-04-07 11:38:22.552959,0 days 00:00:00.549645,34.06910718459983,19.905227220331902,0.25687037617109526,Au,COMPLETE
5667,-1.0,2026-04-07 11:38:22.220809,2026-04-07 11:38:22.898862,0 days 00:00:00.678053,21.74346529843827,17.08710910833373,0.504620563435219,Au,COMPLETE
5668,-1.0,2026-04-07 11:38:22.317287,2026-04-07 11:38:22.899868,0 days 00:00:00.582581,26.541865957622086,19.940556467368538,0.5822944872328901,Au,COMPLETE
5669,-1.0,2026-04-07 11:38:22.456988,2026-04-07 11:38:23.254987,0 days 00:00:00.797999,20.812502823975787,17.86009879495735,0.6011722831763568,Au,COMPLETE
5670,-354.6940928269596,2026-04-07 11:38:22.478271,2026-04-07 11:38:23.337230,0 days 00:00:00.858959,20.52419324807221,19.449801105873192,0.5615831065260606,Au,COMPLETE
5671,-1.0,2026-04-07 11:38:22.609121,2026-04-07 11:38:23.201280,0 days 00:00:00.592159,39.04448516308511,19.896767756359303,0.4094092873298792,Au,COMPLETE
5672,-1.0,2026-04-07 11:38:22.554524,2026-04-07 11:38:23.241418,0 days 00:00:00.686894,36.0961176159426,19.986389557566355,0.6646366695585155,Au,COMPLETE
5673,0.0,2026-04-07 11:38:22.764965,2026-04-07 11:38:23.398303,0 days 00:00:00.633338,37.19276626645366,19.84954719024511,0.5906111483095271,Au,PRUNED
5674,0.0,2026-04-07 11:38:22.777181,2026-04-07 11:38:23.521638,0 days 00:00:00.744457,34.58899071462466,17.911787582840834,0.640112097345755,Au,PRUNED
5675,-1.0,2026-04-07 11:38:23.071798,2026-04-07 11:38:24.035856,0 days 00:00:00.964058,20.006241607724405,19.72050299726232,0.5214661334124842,Au,COMPLETE
5676,0.0,2026-04-07 11:38:23.117381,2026-04-07 11:38:24.081892,0 days 00:00:00.964511,20.122966715827207,19.44082400463454,0.3863008585722517,Au,PRUNED
5677,-372.7924944811867,2026-04-07 11:38:23.418001,2026-04-07 11:38:24.285952,0 days 00:00:00.867951,20.144017188816857,19.703880686065354,0.8674572402238802,Au,COMPLETE
5678,-7.44047619047566,2026-04-07 11:38:23.444096,2026-04-07 11:38:24.512394,0 days 00:00:01.068298,25.026607386933726,14.71124482031285,0.46299444707165577,Ag,PRUNED
5679,-1.0,2026-04-07 11:38:23.477780,2026-04-07 11:38:24.077538,0 days 00:00:00.599758,20.853604048308704,17.364876824514816,0.49741698946227997,Au,COMPLETE
5680,0.0,2026-04-07 11:38:23.556106,2026-04-07 11:38:24.251374,0 days 00:00:00.695268,34.909324295765835,19.748143616262013,0.59996306384777,Au,PRUNED
5681,-1.0,2026-04-07 11:38:23.574487,2026-04-07 11:38:24.312867,0 days 00:00:00.738380,20.306209710974386,17.30316652058061,0.5254981655745589,Au,COMPLETE
5682,-1.0,2026-04-07 11:38:23.631271,2026-04-07 11:38:24.172389,0 days 00:00:00.541118,20.213150909933127,19.84181901604185,0.6191652553995104,Au,COMPLETE
5683,-1.0,2026-04-07 11:38:24.145436,2026-04-07 11:38:25.012914,0 days 00:00:00.867478,20.37268163877829,19.8079446657545,0.5827471576364911,Au,COMPLETE
5684,-1.0,2026-04-07 11:38:24.283292,2026-04-07 11:38:24.967002,0 days 00:00:00.683710,20.33675403206785,17.247093199880794,0.5991874112102753,Au,COMPLETE
5685,0.0,2026-04-07 11:38:24.361214,2026-04-07 11:38:25.216127,0 days 00:00:00.854913,30.37211291060623,19.973855250922444,0.4000133577358177,Au,PRUNED
5686,0.0,2026-04-07 11:38:24.445624,2026-04-07 11:38:25.466218,0 days 00:00:01.020594,28.134387279626264,19.873011086975467,0.5864370171128126,Au,PRUNED
5687,0.0,2026-04-07 11:38:24.536292,2026-04-07 11:38:25.363300,0 days 00:00:00.827008,46.613915698368096,17.152062424493458,0.34769723161242294,Au,PRUNED
5688,-1.0,2026-04-07 11:38:24.556363,2026-04-07 11:38:25.325693,0 days 00:00:00.769330,29.737155774282275,19.967176015242213,0.5181066224221238,Au,COMPLETE
5689,0.0,2026-04-07 11:38:24.565364,2026-04-07 11:38:25.321618,0 days 00:00:00.756254,20.200422232626558,18.057292292364746,0.10744654752681981,Au,PRUNED
5690,-430.87121212114675,2026-04-07 11:38:24.638780,2026-04-07 11:38:25.335765,0 days 00:00:00.696985,20.565621671995775,19.93848855143253,1.0297167617543848,Au,COMPLETE
5691,-1.0,2026-04-07 11:38:25.235024,2026-04-07 11:38:25.969399,0 days 00:00:00.734375,30.753996925577045,19.92200236941458,0.21382223541672946,Au,COMPLETE
5692,0.0,2026-04-07 11:38:25.297020,2026-04-07 11:38:26.083898,0 days 00:00:00.786878,31.199567746911022,18.04290203650345,0.7606943230604366,Au,PRUNED
5693,-1.0,2026-04-07 11:38:25.339270,2026-04-07 11:38:26.110357,0 days 00:00:00.771087,20.075477228280285,15.678231364904008,0.8656727248593414,Au,COMPLETE
5694,-1.0,2026-04-07 11:38:25.403094,2026-04-07 11:38:26.142033,0 days 00:00:00.738939,100.07538661198774,14.187576541001546,0.8569947352280849,Cu,COMPLETE
5695,-407.6738609112121,2026-04-07 11:38:25.529477,2026-04-07 11:38:26.300078,0 days 00:00:00.770601,20.58682876843831,19.78979343347509,0.8527897606527325,Au,COMPLETE
5696,-1.0,2026-04-07 11:38:25.547452,2026-04-07 11:38:26.163489,0 days 00:00:00.616037,32.10951212061424,14.634105378395613,0.31051738335993473,Au,COMPLETE
5697,-1.0,2026-04-07 11:38:25.715966,2026-04-07 11:38:26.390053,0 days 00:00:00.674087,20.313057840672037,19.756001283521755,0.6006572026172036,Au,COMPLETE
5698,-1.0,2026-04-07 11:38:25.784910,2026-04-07 11:38:26.282836,0 days 00:00:00.497926,30.06819694396797,19.696463298901513,0.1082980652662292,Au,COMPLETE
5699,0.0,2026-04-07 11:38:26.082849,2026-04-07 11:38:26.906361,0 days 00:00:00.823512,20.387731683045097,17.798089154524376,0.5943633750435129,Au,PRUNED
5700,0.0,2026-04-07 11:38:26.169086,2026-04-07 11:38:27.117552,0 days 00:00:00.948466,33.69055258011081,19.935695312295714,0.7351575468974931,Au,PRUNED
5701,0.0,2026-04-07 11:38:26.301079,2026-04-07 11:38:26.946453,0 days 00:00:00.645374,30.929302046639627,17.76186330793349,0.7016013293975427,Au,PRUNED
5702,0.0,2026-04-07 11:38:26.331395,2026-04-07 11:38:27.088286,0 days 00:00:00.756891,20.09431695843257,19.470964344544136,0.4177541284266848,Au,PRUNED
5703,-1.0,2026-04-07 11:38:26.392563,2026-04-07 11:38:26.940938,0 days 00:00:00.548375,33.61142301703704,17.935188439599408,0.7127524489550126,Au,COMPLETE
5704,-1.0,2026-04-07 11:38:26.490021,2026-04-07 11:38:27.267525,0 days 00:00:00.777504,105.67594418997024,4.9953485914112745,0.8739848166976631,Au,COMPLETE
5705,-1.0,2026-04-07 11:38:26.517653,2026-04-07 11:38:27.118651,0 days 00:00:00.600998,28.290781755813413,19.791515746839185,0.41014199994182643,Ag,COMPLETE
5706,-13.888888888887731,2026-04-07 11:38:26.576540,2026-04-07 11:38:27.734613,0 days 00:00:01.158073,32.28908482337908,17.178914801728617,0.40938680237204556,Ag,PRUNED
5707,-32.05128205127712,2026-04-07 11:38:27.036066,2026-04-07 11:38:27.844576,0 days 00:00:00.808510,37.07244240194447,18.083671848439003,0.5389398695915464,Ag,PRUNED
5708,0.0,2026-04-07 11:38:26.980097,2026-04-07 11:38:27.957567,0 days 00:00:00.977470,32.71645059666586,18.08107815549929,0.3357771109692017,Au,PRUNED
5709,-1.0,2026-04-07 11:38:27.095709,2026-04-07 11:38:27.954670,0 days 00:00:00.858961,20.24289698448413,17.579339602268064,0.3029344832376617,Au,COMPLETE
5710,-1.0,2026-04-07 11:38:27.123068,2026-04-07 11:38:27.871581,0 days 00:00:00.748513,32.478954555733935,17.352158800630107,0.8369227184683431,Au,COMPLETE
5711,-1.0,2026-04-07 11:38:27.335820,2026-04-07 11:38:27.897471,0 days 00:00:00.561651,39.33616437107494,15.054507040832203,0.6322369098873262,Au,COMPLETE
5712,0.0,2026-04-07 11:38:27.485961,2026-04-07 11:38:28.419313,0 days 00:00:00.933352,20.1816228209984,17.818266907718264,0.3214774063088471,Au,PRUNED
5713,-1.0,2026-04-07 11:38:27.579308,2026-04-07 11:38:28.371866,0 days 00:00:00.792558,20.816980822053072,19.934634025442858,0.5763014000404634,Au,COMPLETE
5714,0.0,2026-04-07 11:38:27.859670,2026-04-07 11:38:28.671058,0 days 00:00:00.811388,34.33853334832737,19.978059850806115,1.0209389629253756,Au,PRUNED
5715,-1.0,2026-04-07 11:38:27.904756,2026-04-07 11:38:28.757574,0 days 00:00:00.852818,30.741347603651274,17.702827207472904,0.3366992014683914,Au,COMPLETE
5716,-1.0,2026-04-07 11:38:27.956062,2026-04-07 11:38:29.070701,0 days 00:00:01.114639,32.730104110707614,17.141173074873905,0.10623436088305507,Au,COMPLETE
5717,0.0,2026-04-07 11:38:28.052200,2026-04-07 11:38:28.978527,0 days 00:00:00.926327,20.01728314971293,19.15723232739854,0.4181705014284734,Au,PRUNED
5718,0.0,2026-04-07 11:38:28.076586,2026-04-07 11:38:29.054195,0 days 00:00:00.977609,33.80258219622087,17.53311183453793,0.7764578682309196,Au,PRUNED
5719,-404.16666666660814,2026-04-07 11:38:28.227127,2026-04-07 11:38:29.398007,0 days 00:00:01.170880,20.360072909883286,19.88961539100073,0.8596082297592555,Au,COMPLETE
5720,0.0,2026-04-07 11:38:28.615665,2026-04-07 11:38:29.484681,0 days 00:00:00.869016,33.978992882301334,17.52582785868425,0.7332931029863847,Au,PRUNED
5721,0.0,2026-04-07 11:38:28.669047,2026-04-07 11:38:29.338264,0 days 00:00:00.669217,30.97975762342334,19.947973299994867,0.716717181524009,Au,PRUNED
5722,-1.0,2026-04-07 11:38:28.722523,2026-04-07 11:38:29.601057,0 days 00:00:00.878534,48.69153127628954,8.7663844427287,1.9729822954910787,Cu,COMPLETE
5723,-1.0,2026-04-07 11:38:28.972150,2026-04-07 11:38:29.646956,0 days 00:00:00.674806,32.03694859062588,18.09141307242243,0.7128405549843766,Au,COMPLETE
5724,-1.0,2026-04-07 11:38:29.168648,2026-04-07 11:38:29.791808,0 days 00:00:00.623160,94.68514797962106,13.658368164462436,1.948373819277934,Au,COMPLETE
5725,-1.0,2026-04-07 11:38:29.220128,2026-04-07 11:38:29.981630,0 days 00:00:00.761502,30.28000456219757,17.116115193447577,0.3819642238244042,Cu,COMPLETE
5726,-1.0,2026-04-07 11:38:29.361463,2026-04-07 11:38:29.856133,0 days 00:00:00.494670,45.65297768556095,19.880173764359103,0.6730339160899875,Au,COMPLETE
5727,0.0,2026-04-07 11:38:29.417623,2026-04-07 11:38:30.303227,0 days 00:00:00.885604,46.52523667680255,19.53185957211143,0.6011941746413146,Au,PRUNED
5728,0.0,2026-04-07 11:38:29.580904,2026-04-07 11:38:30.428589,0 days 00:00:00.847685,31.86941746937763,17.735847536352075,0.6666199740940899,Au,PRUNED
5729,0.0,2026-04-07 11:38:29.646385,2026-04-07 11:38:30.397166,0 days 00:00:00.750781,50.554231432277746,18.153534144931374,0.526846131535424,Au,PRUNED
5730,-1.0,2026-04-07 11:38:29.778137,2026-04-07 11:38:30.429588,0 days 00:00:00.651451,20.341025024048037,19.638611998909084,0.4867145439688239,Au,COMPLETE
5731,0.0,2026-04-07 11:38:29.915170,2026-04-07 11:38:30.731008,0 days 00:00:00.815838,33.182277317578325,19.998000920469774,0.6620657795930418,Au,PRUNED
5732,-23.809523809519273,2026-04-07 11:38:29.987725,2026-04-07 11:38:30.893245,0 days 00:00:00.905520,63.97920128277742,8.627144928752271,1.7298465489488852,Ag,PRUNED
