number,value,datetime_start,datetime_complete,duration,params_D2_nm,params_D3_nm,params_D4_nm,params_metal,state
1034,-49.99999999997149,2025-11-13 12:27:51.129488,2025-11-13 12:27:51.778789,0 days 00:00:00.649301,73.2126315930016,0.8611523588024643,0.10115298809514042,Ag,COMPLETE
1035,-51.4705882352638,2025-11-13 12:27:51.221369,2025-11-13 12:27:52.122810,0 days 00:00:00.901441,73.15104196445184,0.8998031380805418,0.10091816248212565,Ag,COMPLETE
1036,-14.166666666664812,2025-11-13 12:27:51.295665,2025-11-13 12:27:52.677528,0 days 00:00:01.381863,70.53548665781027,0.8405000356135044,0.35451618136918295,Cu,COMPLETE
1037,-25.839793281649754,2025-11-13 12:27:51.355519,2025-11-13 12:27:52.153965,0 days 00:00:00.798446,60.23891814502191,13.516144581316922,0.3175322626074356,Ag,COMPLETE
1038,-12.651821862347175,2025-11-13 12:27:51.526231,2025-11-13 12:27:52.404954,0 days 00:00:00.878723,70.9417736297122,8.022585382139985,0.18428770068781875,Cu,COMPLETE
1039,-0.8802816901408202,2025-11-13 12:27:51.582032,2025-11-13 12:27:52.185297,0 days 00:00:00.603265,20.237520852465252,0.7678252063936523,0.297099149186853,Cu,COMPLETE
1040,-0.8802816901408202,2025-11-13 12:27:51.694612,2025-11-13 12:27:52.185297,0 days 00:00:00.490685,20.335082470098584,0.5048786437284523,0.34050001096419713,Cu,COMPLETE
1041,-48.42342342339707,2025-11-13 12:27:52.122810,2025-11-13 12:27:52.833789,0 days 00:00:00.710979,70.99605174935425,1.6823513909020757,0.17715990074727184,Ag,COMPLETE
1042,-12.457044673538256,2025-11-13 12:27:52.295554,2025-11-13 12:27:53.065484,0 days 00:00:00.769930,34.73252260094196,12.5989664601162,0.13278599239024955,Ag,COMPLETE
1043,-19.060283687939265,2025-11-13 12:27:52.358057,2025-11-13 12:27:53.261762,0 days 00:00:00.903705,87.66427351065877,0.5175016431875962,1.3166353670419764,Ag,COMPLETE
1044,-51.76767676764536,2025-11-13 12:27:52.448557,2025-11-13 12:27:53.066404,0 days 00:00:00.617847,69.43137051464899,0.5028409537365828,0.1343610446927634,Ag,COMPLETE
1045,-48.6111111110841,2025-11-13 12:27:52.513748,2025-11-13 12:27:53.067454,0 days 00:00:00.553706,66.14084680916721,1.4808029088570396,0.13450794259134302,Ag,COMPLETE
1046,-9.339080459769033,2025-11-13 12:27:52.566077,2025-11-13 12:27:53.339996,0 days 00:00:00.773919,27.0119769302416,0.5011692901186376,0.1368521023465994,Ag,COMPLETE
1047,-15.931372549016434,2025-11-13 12:27:52.645093,2025-11-13 12:27:53.261762,0 days 00:00:00.616669,34.029812147951546,0.5066918712833068,0.13617313069476142,Ag,COMPLETE
1048,-49.99999999997149,2025-11-13 12:27:53.143492,2025-11-13 12:27:53.827696,0 days 00:00:00.684204,63.707527306484224,1.1178083924305553,0.19012089089757714,Ag,COMPLETE
1049,-48.61111111108426,2025-11-13 12:27:53.181420,2025-11-13 12:27:53.874623,0 days 00:00:00.693203,63.44318759278127,1.139757407640642,0.18481072421257963,Ag,COMPLETE
1050,-48.61111111108426,2025-11-13 12:27:53.308726,2025-11-13 12:27:53.890248,0 days 00:00:00.581522,64.07359812043055,1.1454181716432537,0.1909534573684412,Ag,COMPLETE
1051,16.025641025640574,2025-11-13 12:27:53.355633,2025-11-13 12:27:53.890248,0 days 00:00:00.534615,23.965735180233185,1.164616447122041,0.1887187548255594,Ag,COMPLETE
1052,-48.42342342339707,2025-11-13 12:27:53.428901,2025-11-13 12:27:54.339731,0 days 00:00:00.910830,67.54077741993764,1.6120473336378174,0.2294382207319593,Ag,COMPLETE
1053,-48.61111111108426,2025-11-13 12:27:53.544223,2025-11-13 12:27:54.418487,0 days 00:00:00.874264,63.829597813393356,1.1388432176952792,0.18701320243004682,Ag,COMPLETE
1054,-31.517094017085764,2025-11-13 12:27:53.689452,2025-11-13 12:27:54.482996,0 days 00:00:00.793544,67.83088667254191,9.703051506063153,0.2347017701807841,Ag,COMPLETE
1055,-43.74999999997827,2025-11-13 12:27:53.778897,2025-11-13 12:27:54.230870,0 days 00:00:00.451973,56.37814239151859,1.194829740208465,0.18254960624012537,Ag,COMPLETE
1056,-32.77777777776917,2025-11-13 12:27:54.261604,2025-11-13 12:27:54.602837,0 days 00:00:00.341233,68.69277735011455,9.69799833126482,0.1008433955219134,Ag,COMPLETE
1057,-48.611111111084135,2025-11-13 12:27:54.355356,2025-11-13 12:27:54.820033,0 days 00:00:00.464677,73.84068435334177,0.8227352732607076,0.2843120119138832,Ag,COMPLETE
1058,-40.71969696967866,2025-11-13 12:27:54.453961,2025-11-13 12:27:54.943974,0 days 00:00:00.490013,74.26085288145751,0.870173662254417,1.0189719200859009,Ag,COMPLETE
1059,-53.03030303027095,2025-11-13 12:27:54.308488,2025-11-13 12:27:55.021068,0 days 00:00:00.712580,72.5525874753857,0.5060920839434117,0.10018203573725575,Ag,COMPLETE
1060,-42.658730158709915,2025-11-13 12:27:54.562761,2025-11-13 12:27:55.503289,0 days 00:00:00.940528,65.81772711779767,0.500839998287187,1.2735706283055825,Ag,COMPLETE
1061,-51.4705882352638,2025-11-13 12:27:54.726322,2025-11-13 12:27:55.514431,0 days 00:00:00.788109,65.45108282144201,0.8616501587127876,0.13623284318261794,Ag,COMPLETE
1062,-6.03254769921397,2025-11-13 12:27:54.912696,2025-11-13 12:27:55.828543,0 days 00:00:00.915847,93.82934690361412,1.5096966129643514,0.12814111689739854,Ag,COMPLETE
1063,-18.74999999999738,2025-11-13 12:27:55.360546,2025-11-13 12:27:56.069547,0 days 00:00:00.709001,72.31691165579271,1.709444170649395,0.1292331997799315,Au,COMPLETE
1064,-49.76851851849098,2025-11-13 12:27:55.363730,2025-11-13 12:27:56.032992,0 days 00:00:00.669262,72.27636375570691,1.7429681753960053,0.10154755134866444,Ag,COMPLETE
1065,-0.5319148936170122,2025-11-13 12:27:55.442579,2025-11-13 12:27:56.032992,0 days 00:00:00.590413,74.67663731075143,16.95320377009699,0.1022269686753545,Au,COMPLETE
1066,-18.912529550824747,2025-11-13 12:27:55.547496,2025-11-13 12:27:56.287931,0 days 00:00:00.740435,72.20763716512977,1.7963687995404012,0.10219934218364171,Au,COMPLETE
1067,24.576822916666284,2025-11-13 12:27:55.626179,2025-11-13 12:27:56.272306,0 days 00:00:00.646127,72.06862544132325,10.792706844050844,0.10003386427432207,Au,COMPLETE
1068,-49.99999999997149,2025-11-13 12:27:55.828543,2025-11-13 12:27:56.879621,0 days 00:00:01.051078,61.339881920375205,0.8830467294082864,0.10136303518963163,Ag,COMPLETE
1069,-47.45370370367742,2025-11-13 12:27:56.032992,2025-11-13 12:27:56.848351,0 days 00:00:00.815359,77.11508645361678,0.8528280624823779,0.10066422444430852,Ag,COMPLETE
1070,-26.67682926828941,2025-11-13 12:27:56.225438,2025-11-13 12:27:57.163220,0 days 00:00:00.937782,68.13440760308627,15.803189522895892,0.15472066484913527,Ag,COMPLETE
1071,-48.8095238094959,2025-11-13 12:27:56.350817,2025-11-13 12:27:57.128994,0 days 00:00:00.778177,62.002066748668895,0.8699070255241531,0.15195947979347335,Ag,COMPLETE
1072,-51.4705882352638,2025-11-13 12:27:56.413617,2025-11-13 12:27:57.423260,0 days 00:00:01.009643,69.26069548711155,0.8547540421329243,0.1588312940823371,Ag,COMPLETE
1073,-50.245098039186,2025-11-13 12:27:56.483703,2025-11-13 12:27:57.313275,0 days 00:00:00.829572,61.539827578881535,0.5071426144986513,0.150370489650632,Ag,COMPLETE
1074,-48.8095238094959,2025-11-13 12:27:56.530167,2025-11-13 12:27:57.163220,0 days 00:00:00.633053,61.26653660748471,0.8091932455849462,0.13826023956294875,Ag,COMPLETE
1075,-45.94017094014738,2025-11-13 12:27:56.675693,2025-11-13 12:27:57.927984,0 days 00:00:01.252291,68.58130842376184,0.5084216739768591,0.9200061275381433,Ag,COMPLETE
1076,-51.19047619044695,2025-11-13 12:27:57.210097,2025-11-13 12:27:57.742372,0 days 00:00:00.532275,66.22345354979426,1.3557319126703442,0.1382774008590851,Ag,COMPLETE
1077,-43.60465116277041,2025-11-13 12:27:57.360584,2025-11-13 12:27:58.420032,0 days 00:00:01.059448,65.36716511797843,3.667998745381378,0.1639331051649466,Ag,COMPLETE
1078,-49.99999999997149,2025-11-13 12:27:57.438920,2025-11-13 12:27:58.031197,0 days 00:00:00.592277,67.01969619101276,1.2404596725286647,0.13038956951316164,Ag,COMPLETE
1079,-25.219298245609554,2025-11-13 12:27:57.485863,2025-11-13 12:27:58.094078,0 days 00:00:00.608215,80.31245057429739,11.799421325363358,0.1376177686679375,Ag,COMPLETE
1080,20.1972010178114,2025-11-13 12:27:57.564482,2025-11-13 12:27:58.420032,0 days 00:00:00.855550,70.38072266672876,17.81291810894221,0.8885551382961039,Ag,COMPLETE
1081,-33.92857142856179,2025-11-13 12:27:57.630313,2025-11-13 12:27:58.420032,0 days 00:00:00.789719,70.35747253377819,8.961492792730699,0.13109540887913151,Ag,COMPLETE
1082,-9.818007662834113,2025-11-13 12:27:57.959305,2025-11-13 12:27:58.776243,0 days 00:00:00.816938,28.89829255878811,3.5436140058061083,0.1705791065374222,Ag,COMPLETE
1083,-51.19047619044695,2025-11-13 12:27:58.189770,2025-11-13 12:27:58.838741,0 days 00:00:00.648971,67.56010041743514,1.3150864120730796,0.172389047956604,Ag,COMPLETE
1084,-51.47058823526383,2025-11-13 12:27:58.305485,2025-11-13 12:27:59.080818,0 days 00:00:00.775333,74.37781646447931,0.504591485859587,0.18039026650435017,Ag,COMPLETE
1085,-49.76851851849095,2025-11-13 12:27:58.511819,2025-11-13 12:27:59.511163,0 days 00:00:00.999344,75.26187251074951,1.2986309185934766,0.10142967652359326,Ag,COMPLETE
1086,-47.297297297271975,2025-11-13 12:27:58.641563,2025-11-13 12:27:59.864872,0 days 00:00:01.223309,75.27122839329522,1.176445537759747,0.1753865668264461,Ag,COMPLETE
1087,-47.29729729727182,2025-11-13 12:27:58.744991,2025-11-13 12:27:59.769173,0 days 00:00:01.024182,76.06327442788768,0.8664509801345859,0.21802532792264218,Ag,COMPLETE
1088,-44.79166666664434,2025-11-13 12:27:58.807495,2025-11-13 12:27:59.583725,0 days 00:00:00.776230,73.1145545128517,0.8659192219861043,0.7723393002527024,Ag,COMPLETE
1089,-48.61111111108426,2025-11-13 12:27:59.011963,2025-11-13 12:28:00.040999,0 days 00:00:01.029036,65.11338709136692,1.1168570406618945,0.23378741179114615,Ag,COMPLETE
1090,-2.700617283950543,2025-11-13 12:27:59.080818,2025-11-13 12:28:00.009663,0 days 00:00:00.928845,96.96088346483594,0.8616103580202452,0.10121265936681258,Ag,COMPLETE
1091,-48.809523809495936,2025-11-13 12:27:59.181960,2025-11-13 12:28:00.025385,0 days 00:00:00.843425,65.2444221138033,0.8803951081852063,0.23326796821047663,Ag,COMPLETE
1092,-50.24509803918621,2025-11-13 12:27:59.722732,2025-11-13 12:28:00.391784,0 days 00:00:00.669052,64.61534848289702,0.840336581271339,0.10118190312245375,Ag,COMPLETE
1093,20.671834625322678,2025-11-13 12:27:59.831603,2025-11-13 12:28:00.316850,0 days 00:00:00.485247,70.04440288883735,19.252433837874595,0.10159769315700765,Ag,COMPLETE
1094,-51.76767676764536,2025-11-13 12:27:59.962785,2025-11-13 12:28:00.686968,0 days 00:00:00.724183,69.53106661685665,0.5146083698461713,0.13477272347294114,Ag,COMPLETE
1095,-53.03030303027095,2025-11-13 12:27:59.913756,2025-11-13 12:28:01.034369,0 days 00:00:01.120613,69.54520225160779,0.5070091905736583,0.10028501833594934,Ag,COMPLETE
1096,-38.82575757573999,2025-11-13 12:28:00.119624,2025-11-13 12:28:01.613791,0 days 00:00:01.494167,50.03449503458437,0.500222758494204,0.13910788238343383,Ag,COMPLETE
1097,-51.76767676764536,2025-11-13 12:28:00.281886,2025-11-13 12:28:01.860728,0 days 00:00:01.578842,69.20565547790981,0.5095997036303345,0.13861008741846498,Ag,COMPLETE
1098,-51.76767676764536,2025-11-13 12:28:00.376163,2025-11-13 12:28:01.179912,0 days 00:00:00.803749,69.40631519841132,0.5215769716819278,0.13451583118443056,Ag,COMPLETE
1099,-37.234042553175584,2025-11-13 12:28:00.391784,2025-11-13 12:28:01.242848,0 days 00:00:00.851064,50.944034150939586,1.4950550317730709,0.1407881443549557,Ag,COMPLETE
1100,-26.9274376417197,2025-11-13 12:28:00.577615,2025-11-13 12:28:01.564028,0 days 00:00:00.986413,66.5747796072034,14.892848865322105,0.13505778967513818,Ag,COMPLETE
1101,-48.6111111110841,2025-11-13 12:28:01.175240,2025-11-13 12:28:01.708206,0 days 00:00:00.532966,66.8784362306822,1.5149271485648819,0.10024411239706416,Ag,COMPLETE
1102,-48.42342342339707,2025-11-13 12:28:01.179912,2025-11-13 12:28:01.803280,0 days 00:00:00.623368,67.1445602536121,2.0944732887236275,0.10188791459038972,Ag,COMPLETE
1103,-48.42342342339707,2025-11-13 12:28:01.282097,2025-11-13 12:28:02.037266,0 days 00:00:00.755169,67.42654760841914,2.0768773915292185,0.13053881348532287,Ag,COMPLETE
1104,-31.609195402288027,2025-11-13 12:28:01.429905,2025-11-13 12:28:02.131101,0 days 00:00:00.701196,85.95452377249791,2.3599609679885747,0.1001755681152474,Ag,COMPLETE
1105,-8.037225042300365,2025-11-13 12:28:01.645741,2025-11-13 12:28:02.347587,0 days 00:00:00.701846,25.729207952748233,1.1817794990055404,0.15645129792755308,Ag,COMPLETE
1106,-50.24509803918621,2025-11-13 12:28:01.927466,2025-11-13 12:28:02.523574,0 days 00:00:00.596108,62.85027963775477,0.5003367202861643,0.1004112302001345,Ag,COMPLETE
1107,-38.19444444442853,2025-11-13 12:28:02.099830,2025-11-13 12:28:02.555773,0 days 00:00:00.455943,63.557964876599065,1.1799346679326557,1.571639727795782,Ag,COMPLETE
1108,-15.796703296701534,2025-11-13 12:28:02.215780,2025-11-13 12:28:02.919189,0 days 00:00:00.703409,71.28309913409403,0.9100941540773302,1.8348888415773656,Au,COMPLETE
1109,-49.99999999997173,2025-11-13 12:28:02.295975,2025-11-13 12:28:02.863370,0 days 00:00:00.567395,63.89976816652772,1.0848067828683343,0.1696392813602154,Ag,COMPLETE
1110,-37.41496598637935,2025-11-13 12:28:02.435081,2025-11-13 12:28:02.888668,0 days 00:00:00.453587,62.85738372974412,1.1366536969153909,1.7215257070830374,Ag,COMPLETE
1111,-49.99999999997149,2025-11-13 12:28:02.461053,2025-11-13 12:28:02.780726,0 days 00:00:00.319673,62.66975230753129,1.1394156220414378,0.17282216522717792,Ag,COMPLETE
1112,-13.666666666664465,2025-11-25 10:23:32.987702,2025-11-25 10:24:00.630867,0 days 00:00:27.643165,32.15004303915077,1.681344404492817,0.13076337415893907,Ag,COMPLETE
1113,-51.190476190446915,2025-11-25 10:23:33.013241,2025-11-25 10:24:00.630867,0 days 00:00:27.617626,68.04373497956169,1.574015109695163,0.10035986968949753,Ag,COMPLETE
1114,-47.29729729727182,2025-11-25 10:23:32.998217,2025-11-25 10:24:00.534925,0 days 00:00:27.536708,71.99273947548198,1.6758545177642006,0.1337116401356514,Ag,COMPLETE
1115,-42.57246376809763,2025-11-25 10:23:33.072989,2025-11-25 10:24:00.664274,0 days 00:00:27.591285,71.69173585601244,4.745611799736711,0.10099211474112486,Ag,COMPLETE
1116,-49.76851851849095,2025-11-25 10:23:33.104348,2025-11-25 10:24:00.534925,0 days 00:00:27.430577,71.42088375176183,1.6149666447476787,0.13590268415248957,Ag,COMPLETE
1117,-44.871794871771776,2025-11-25 10:23:33.143863,2025-11-25 10:24:00.599138,0 days 00:00:27.455275,59.07452110665773,1.6263257281822467,0.16751345593446126,Ag,COMPLETE
1118,-48.42342342339725,2025-11-25 10:23:33.168022,2025-11-25 10:24:00.731733,0 days 00:00:27.563711,71.7614807090739,1.7950280372730973,0.16029217190099918,Ag,COMPLETE
1119,-49.76851851849095,2025-11-25 10:23:33.182826,2025-11-25 10:24:00.588127,0 days 00:00:27.405301,71.6167339981413,1.5630032881349214,0.10013456559752186,Ag,COMPLETE
1120,-15.782828282825847,2025-11-25 10:24:00.656261,2025-11-25 10:24:01.233305,0 days 00:00:00.577044,65.8433066803154,0.5027894995727356,0.20167678670757946,Cu,COMPLETE
1121,-15.782828282825847,2025-11-25 10:24:00.588127,2025-11-25 10:24:01.967451,0 days 00:00:01.379324,65.92847076797791,0.5071990626616905,0.18765677591098115,Cu,COMPLETE
1122,-19.333333333330202,2025-11-25 10:24:00.809214,2025-11-25 10:24:02.061269,0 days 00:00:01.252055,68.34728459510778,0.5018433257208147,0.1992966974834883,Au,COMPLETE
1123,-15.54726368158969,2025-11-25 10:24:00.924195,2025-11-25 10:24:01.742435,0 days 00:00:00.818240,65.30349133543993,0.8338636890924352,0.19529074085664055,Cu,COMPLETE
1124,-15.624999999997724,2025-11-25 10:24:00.946988,2025-11-25 10:24:01.968705,0 days 00:00:01.021717,66.57588440218888,0.8357961721097558,0.1985101396452724,Cu,COMPLETE
1125,-16.985138004244096,2025-11-25 10:24:00.974076,2025-11-25 10:24:02.124885,0 days 00:00:01.150809,68.79949743616794,0.8631126085825718,1.1629670609475347,Au,COMPLETE
1126,-19.37984496123722,2025-11-25 10:24:01.073367,2025-11-25 10:24:01.905051,0 days 00:00:00.831684,68.40239835579924,0.8521159938813497,0.19549840547340247,Au,COMPLETE
1127,-51.4705882352638,2025-11-25 10:24:01.041502,2025-11-25 10:24:02.604374,0 days 00:00:01.562872,68.75822390263829,0.8666373225238693,0.14873012262934426,Ag,COMPLETE
1128,-0.8234519104084191,2025-11-25 10:24:01.805434,2025-11-25 10:24:02.725867,0 days 00:00:00.920433,73.64756527420589,19.995691564303804,0.15785316444551628,Ag,COMPLETE
1129,-1.1134552273792424,2025-11-25 10:24:01.968705,2025-11-25 10:24:02.568133,0 days 00:00:00.599428,22.622014645795193,1.208278917660571,0.15522632440411557,Ag,COMPLETE
1130,18.640350877192702,2025-11-25 10:24:02.192139,2025-11-25 10:24:02.982214,0 days 00:00:00.790075,73.76409257628018,16.382251435252254,1.4011621024485326,Ag,COMPLETE
1131,-25.167785234896,2025-11-25 10:24:02.342850,2025-11-25 10:24:03.056069,0 days 00:00:00.713219,74.41625803524559,14.275145409353458,0.2530514743449981,Ag,COMPLETE
1132,-49.76851851849059,2025-11-25 10:24:02.445567,2025-11-25 10:24:03.086986,0 days 00:00:00.641419,73.67205896800225,1.1980577356043944,0.26160997492775867,Ag,COMPLETE
1133,-51.76767676764536,2025-11-25 10:24:02.514061,2025-11-25 10:24:03.208726,0 days 00:00:00.694665,64.71426369789401,0.5072085079335557,0.13333543434804496,Ag,COMPLETE
1134,-48.61111111108426,2025-11-25 10:24:02.612683,2025-11-25 10:24:03.724406,0 days 00:00:01.111723,60.35470297125918,0.8466188552134619,0.1372611704271076,Ag,COMPLETE
1135,-51.76767676764536,2025-11-25 10:24:02.923678,2025-11-25 10:24:03.745361,0 days 00:00:00.821683,64.54991407593802,0.5029449893034401,0.13316824039560798,Ag,COMPLETE
1136,-34.39153439152359,2025-11-25 10:24:02.995269,2025-11-25 10:24:03.767758,0 days 00:00:00.772489,60.076439334028585,7.5822334101731865,0.16740893197555948,Ag,COMPLETE
1137,-51.4705882352638,2025-11-25 10:24:03.155662,2025-11-25 10:24:03.948399,0 days 00:00:00.792737,70.1247745414703,0.8813224569210651,0.1355584904007918,Ag,COMPLETE
1138,-51.4705882352638,2025-11-25 10:24:03.325087,2025-11-25 10:24:03.948399,0 days 00:00:00.623312,69.50059916870423,1.1764153969366495,0.16346231552307944,Ag,COMPLETE
1139,-36.05769230767859,2025-11-25 10:24:03.413751,2025-11-25 10:24:04.320576,0 days 00:00:00.906825,69.88725551108044,1.2350618002557918,1.9085492576476302,Ag,COMPLETE
1140,-49.76851851849059,2025-11-25 10:24:03.529895,2025-11-25 10:24:04.388154,0 days 00:00:00.858259,67.00103660804713,1.2473110961925902,0.23043347861455787,Ag,COMPLETE
1141,-49.99999999997116,2025-11-25 10:24:03.647966,2025-11-25 10:24:04.549045,0 days 00:00:00.901079,66.89869668782929,1.3262737044554114,0.21305126376559988,Ag,COMPLETE
1142,-49.99999999997132,2025-11-25 10:24:04.059313,2025-11-25 10:24:04.949682,0 days 00:00:00.890369,66.89358911571718,0.8465294826470942,0.20795613633601082,Ag,COMPLETE
1143,-50.24509803918621,2025-11-25 10:24:04.150496,2025-11-25 10:24:05.054919,0 days 00:00:00.904423,67.48509352839768,0.8547808344488976,0.10110226444795357,Ag,COMPLETE
1144,-1.4320785597381105,2025-11-25 10:24:04.237656,2025-11-25 10:24:05.385084,0 days 00:00:01.147428,113.55923705057539,0.5018292159683573,0.2843986564077279,Ag,COMPLETE
1145,-50.24509803918605,2025-11-25 10:24:04.345053,2025-11-25 10:24:05.297533,0 days 00:00:00.952480,66.73126017763343,0.5029190758856723,0.21946356852038026,Ag,COMPLETE
1146,-20.576131687237737,2025-11-25 10:24:04.406705,2025-11-25 10:24:05.989391,0 days 00:00:01.582686,37.347205638783684,0.5078148024291108,0.1007377218866729,Ag,COMPLETE
1147,-50.24509803918621,2025-11-25 10:24:04.670409,2025-11-25 10:24:05.722772,0 days 00:00:01.052363,62.57288237760156,0.8433148439498037,0.1003467280824408,Ag,COMPLETE
1148,-43.74999999997812,2025-11-25 10:24:04.873803,2025-11-25 10:24:05.986781,0 days 00:00:01.112978,76.75804791740781,0.8805510712940923,0.4943894123464073,Ag,COMPLETE
1149,-23.972602739719356,2025-11-25 10:24:04.993283,2025-11-25 10:24:06.292321,0 days 00:00:01.299038,41.09292646463912,1.9757946239204962,0.17464939781164573,Ag,COMPLETE
1150,-30.505952380941356,2025-11-25 10:24:05.533929,2025-11-25 10:24:06.418206,0 days 00:00:00.884277,44.98804437655721,0.8659262783196197,0.17107883800383306,Ag,COMPLETE
1151,-23.7268518518453,2025-11-25 10:24:05.666807,2025-11-25 10:24:06.476812,0 days 00:00:00.810005,40.70641446445853,1.3704637547547232,0.16775837088659912,Ag,COMPLETE
1152,-47.149122806992466,2025-11-25 10:24:05.796870,2025-11-25 10:24:06.296483,0 days 00:00:00.499613,64.47448658486839,1.997255871059987,0.1701495502880887,Ag,COMPLETE
1153,78.39506172839273,2026-04-07 11:30:05.086087,2026-04-07 11:30:09.215564,0 days 00:00:04.129477,36.88124406749993,14.315793608185585,1.4834869547050415,Au,PRUNED
1154,-1.0,2026-04-07 11:30:05.093680,2026-04-07 11:30:05.510783,0 days 00:00:00.417103,26.448802653683938,15.883532708411373,1.424234261399158,Au,COMPLETE
1155,-1.0,2026-04-07 11:30:05.089591,2026-04-07 11:30:05.521692,0 days 00:00:00.432101,35.44130600420503,8.616878889828655,1.534812268345209,Au,COMPLETE
1156,3.858024691357739,2026-04-07 11:30:05.143117,2026-04-07 11:30:08.819455,0 days 00:00:03.676338,38.229844981799125,12.888837712388629,1.2812091839070734,Au,COMPLETE
1157,-1.0,2026-04-07 11:30:05.160628,2026-04-07 11:30:05.505067,0 days 00:00:00.344439,31.17863522343757,9.871527253285645,1.7236652563862376,Au,COMPLETE
1158,-1.0,2026-04-07 11:30:05.176003,2026-04-07 11:30:05.517608,0 days 00:00:00.341605,27.396632332375873,8.429309637834066,1.3504778391372265,Au,COMPLETE
1159,-11.081560283687162,2026-04-07 11:30:05.211724,2026-04-07 11:30:09.076649,0 days 00:00:03.864925,35.429810034745955,12.156333534947288,0.1906551774148133,Cu,COMPLETE
1160,-31.249999999990234,2026-04-07 11:30:05.223266,2026-04-07 11:30:09.009215,0 days 00:00:03.785949,81.40285849124129,5.476187853890432,0.28243066131252936,Ag,COMPLETE
1161,0.0,2026-04-07 11:30:05.569976,2026-04-07 11:30:09.136826,0 days 00:00:03.566850,42.79099748716325,16.344241100538405,1.8327861909062229,Au,COMPLETE
1162,-2.385124610591841,2026-04-07 11:30:05.585687,2026-04-07 11:30:09.075144,0 days 00:00:03.489457,98.02075804045025,5.08711127345296,0.7623150624465812,Ag,COMPLETE
