number,value,datetime_start,datetime_complete,duration,params_D2_nm,params_D3_nm,params_D4_nm,params_metal,state
2118,-9.50292397660752,2026-04-07 11:32:06.232725,2026-04-07 11:32:06.751161,0 days 00:00:00.518436,24.842166292848916,15.735895300923506,1.629493741245143,Cu,PRUNED
2119,60.57919621749237,2026-04-07 11:32:06.102476,2026-04-07 11:32:07.001178,0 days 00:00:00.898702,43.03249452528824,15.512539549188828,1.5110316746543155,Cu,PRUNED
2120,-3.787878787878329,2026-04-07 11:32:06.490487,2026-04-07 11:32:07.070253,0 days 00:00:00.579766,24.92031531179513,19.506236107948876,1.0027185513482892,Cu,PRUNED
2121,-1.0,2026-04-07 11:32:06.558171,2026-04-07 11:32:07.002768,0 days 00:00:00.444597,22.104036126537256,18.15310658643167,1.0304105802824086,Au,COMPLETE
2122,0.0,2026-04-07 11:32:06.567821,2026-04-07 11:32:07.189675,0 days 00:00:00.621854,20.246903522336734,13.710012326435297,1.4662802721273855,Cu,PRUNED
2123,-0.5995203836930283,2026-04-07 11:32:06.591979,2026-04-07 11:32:07.288276,0 days 00:00:00.696297,21.9730928079837,13.372171773032704,0.9847798079648151,Cu,PRUNED
2124,-1.0,2026-04-07 11:32:06.630828,2026-04-07 11:32:07.387921,0 days 00:00:00.757093,22.05172183406473,12.720230164748141,1.382916729900888,Cu,COMPLETE
2125,-1.0,2026-04-07 11:32:06.815880,2026-04-07 11:32:07.402063,0 days 00:00:00.586183,26.62046455742484,14.083710321958346,1.1337894565265951,Cu,COMPLETE
2126,-1.0,2026-04-07 11:32:07.102170,2026-04-07 11:32:07.580573,0 days 00:00:00.478403,20.711266313775003,18.445885343784642,0.9940547266803985,Cu,COMPLETE
2127,-4.761904761904217,2026-04-07 11:32:07.096015,2026-04-07 11:32:07.699606,0 days 00:00:00.603591,27.11377882269754,17.890779536124747,1.1891849080292913,Cu,PRUNED
2128,-1.0,2026-04-07 11:32:07.161033,2026-04-07 11:32:07.817668,0 days 00:00:00.656635,28.999066619198892,16.22346951673325,1.4088731684674252,Cu,COMPLETE
2129,-1.0,2026-04-07 11:32:07.245849,2026-04-07 11:32:07.721476,0 days 00:00:00.475627,20.586172217421225,18.387273922945226,1.430444538491792,Cu,COMPLETE
2130,-1.0,2026-04-07 11:32:07.317098,2026-04-07 11:32:07.815065,0 days 00:00:00.497967,20.189281880863817,16.802337417138034,1.4608594385792724,Cu,COMPLETE
2131,78.4313725490173,2026-04-07 11:32:07.365790,2026-04-07 11:32:08.019919,0 days 00:00:00.654129,31.613289540867548,19.742039128372866,1.0485109100145789,Cu,PRUNED
2132,-1.0,2026-04-07 11:32:07.503524,2026-04-07 11:32:08.061944,0 days 00:00:00.558420,24.142748711868535,16.35974105186558,1.3491846747367982,Ag,COMPLETE
2133,-11.904761904760544,2026-04-07 11:32:07.573104,2026-04-07 11:32:08.157384,0 days 00:00:00.584280,22.53306054268865,19.082960033300665,1.3154293083000237,Cu,PRUNED
2134,-1.0,2026-04-07 11:32:07.717706,2026-04-07 11:32:08.375500,0 days 00:00:00.657794,22.61982334926342,19.074547090478397,0.9463926201087727,Cu,COMPLETE
2135,0.0,2026-04-07 11:32:07.819723,2026-04-07 11:32:08.388666,0 days 00:00:00.568943,20.315586914620614,15.91799263891174,0.7493022464851151,Cu,PRUNED
2136,-7.716049382714907,2026-04-07 11:32:07.916354,2026-04-07 11:32:08.668005,0 days 00:00:00.751651,22.06000151192975,19.314825173414047,1.0153931281558715,Au,PRUNED
2137,-1.0,2026-04-07 11:32:07.957913,2026-04-07 11:32:08.374501,0 days 00:00:00.416588,31.89931773932256,11.759709580528169,1.4059276137665386,Au,COMPLETE
2138,3.144654088050077,2026-04-07 11:32:08.010872,2026-04-07 11:32:08.685622,0 days 00:00:00.674750,37.269798271054086,17.082811532960992,0.7432179048014147,Cu,PRUNED
2139,-182.47126436780343,2026-04-07 11:32:08.108143,2026-04-07 11:32:08.638459,0 days 00:00:00.530316,21.735797555527306,17.681149561540128,0.9082176860814902,Cu,COMPLETE
2140,-339.6464646464236,2026-04-07 11:32:08.258179,2026-04-07 11:32:08.928680,0 days 00:00:00.670501,22.384698158237402,17.230599175187127,1.2749176706024858,Au,COMPLETE
2141,-8.474576271185866,2026-04-07 11:32:08.305645,2026-04-07 11:32:08.999863,0 days 00:00:00.694218,23.59847705756128,16.391182869452276,1.1063877178170591,Cu,PRUNED
2142,-11.695906432747716,2026-04-07 11:32:08.545746,2026-04-07 11:32:09.215598,0 days 00:00:00.669852,30.872362865327467,14.170721496488358,0.6956705623136907,Cu,PRUNED
2143,-0.8333333333332666,2026-04-07 11:32:08.618843,2026-04-07 11:32:09.464966,0 days 00:00:00.846123,32.59108742049495,16.97118169070983,0.5238382256936289,Cu,PRUNED
2144,-1.0,2026-04-07 11:32:08.711181,2026-04-07 11:32:09.372667,0 days 00:00:00.661486,36.23107014064433,17.373148025545383,1.3467440397029056,Au,COMPLETE
2145,0.0,2026-04-07 11:32:08.754773,2026-04-07 11:32:09.637661,0 days 00:00:00.882888,22.581380857324458,12.56502153979169,0.9924662641741262,Au,PRUNED
2146,-1.0,2026-04-07 11:32:08.834417,2026-04-07 11:32:09.291965,0 days 00:00:00.457548,40.50443828663175,15.46117517324951,0.8823854994749265,Cu,COMPLETE
2147,-4.901960784313341,2026-04-07 11:32:08.846549,2026-04-07 11:32:09.433723,0 days 00:00:00.587174,34.770004223201305,15.124798391380502,0.8475860387373508,Cu,PRUNED
2148,-1.0,2026-04-07 11:32:09.072382,2026-04-07 11:32:09.506931,0 days 00:00:00.434549,41.79265524986798,17.75238103384335,1.1914462571382862,Au,COMPLETE
2149,-15.765765765764062,2026-04-07 11:32:09.158089,2026-04-07 11:32:09.745772,0 days 00:00:00.587683,26.508455213180074,14.258475932410537,0.9672925015774909,Au,PRUNED
2150,-1.0,2026-04-07 11:32:09.340838,2026-04-07 11:32:10.154249,0 days 00:00:00.813411,22.364112557614693,19.026359087567265,1.3786018394812574,Au,COMPLETE
2151,-1.0,2026-04-07 11:32:09.482860,2026-04-07 11:32:10.075505,0 days 00:00:00.592645,30.258528246017676,16.447682575101442,1.0377883277383455,Au,COMPLETE
2152,0.0,2026-04-07 11:32:09.594905,2026-04-07 11:32:10.145139,0 days 00:00:00.550234,20.677299471208443,16.44954891957448,1.1172824784543114,Cu,PRUNED
2153,-1.0,2026-04-07 11:32:09.610390,2026-04-07 11:32:10.121729,0 days 00:00:00.511339,22.667801938344464,18.54857834235358,1.0615169499621642,Ag,COMPLETE
2154,-1.0,2026-04-07 11:32:09.668419,2026-04-07 11:32:10.293634,0 days 00:00:00.625215,34.85560856494761,19.701536644959518,0.9998774601687175,Cu,COMPLETE
2155,-4.0322580645156085,2026-04-07 11:32:09.714626,2026-04-07 11:32:10.535318,0 days 00:00:00.820692,24.599769122322968,17.30614194866058,1.2956465467716651,Au,PRUNED
2156,0.0,2026-04-07 11:32:09.824452,2026-04-07 11:32:10.434125,0 days 00:00:00.609673,20.0874858390757,19.529198050616724,0.812262368885884,Cu,PRUNED
2157,-1.0,2026-04-07 11:32:09.849236,2026-04-07 11:32:10.295144,0 days 00:00:00.445908,30.774633241771703,19.68414910167205,1.3390126811478469,Ag,COMPLETE
2158,-13.095238095236597,2026-04-07 11:32:10.179444,2026-04-07 11:32:10.686869,0 days 00:00:00.507425,22.74970914622447,19.622361259773168,0.7625690722102472,Cu,PRUNED
2159,-1.0,2026-04-07 11:32:10.195535,2026-04-07 11:32:10.512765,0 days 00:00:00.317230,22.782401816118142,19.346453853556838,1.203486503077335,Au,COMPLETE
2160,-0.8928571428571173,2026-04-07 11:32:10.184497,2026-04-07 11:32:10.846401,0 days 00:00:00.661904,20.246539125835795,16.913563930458476,0.8543713559816539,Ag,PRUNED
2161,-1.0,2026-04-07 11:32:10.325709,2026-04-07 11:32:10.937633,0 days 00:00:00.611924,29.76344253195122,18.64444489461133,1.26606711448283,Au,COMPLETE
2162,0.0,2026-04-07 11:32:10.442601,2026-04-07 11:32:11.344243,0 days 00:00:00.901642,21.18629140646065,17.318196743229286,0.769299243209628,Cu,PRUNED
2163,-212.2243839169742,2026-04-07 11:32:10.603950,2026-04-07 11:32:11.281441,0 days 00:00:00.677491,20.115124892760214,19.60670375258807,1.2975311166179315,Cu,COMPLETE
2164,-315.34090909087325,2026-04-07 11:32:10.649913,2026-04-07 11:32:11.282788,0 days 00:00:00.632875,21.792960426856794,17.107543370857012,1.3094032839842393,Au,COMPLETE
2165,76.33819951337976,2026-04-07 11:32:10.630469,2026-04-07 11:32:11.279823,0 days 00:00:00.649354,40.263475795358914,13.878918728939864,1.3130458968436334,Au,PRUNED
2166,-1.0,2026-04-07 11:32:10.725582,2026-04-07 11:32:11.377279,0 days 00:00:00.651697,31.04811227384654,4.484482312837135,1.757354271107883,Au,COMPLETE
2167,-1.4671361502347005,2026-04-07 11:32:10.757408,2026-04-07 11:32:11.579959,0 days 00:00:00.822551,40.628757542867106,19.158149740791448,0.6729631793387455,Cu,PRUNED
2168,-1.1111111111110814,2026-04-07 11:32:10.915519,2026-04-07 11:32:11.524249,0 days 00:00:00.608730,48.715497785017504,19.043452603416455,0.8584061757455902,Cu,PRUNED
2169,0.0,2026-04-07 11:32:11.049570,2026-04-07 11:32:11.468228,0 days 00:00:00.418658,20.36221603436224,18.24468171250072,1.1721499631572823,Cu,PRUNED
2170,-297.10144927533,2026-04-07 11:32:11.343624,2026-04-07 11:32:12.206900,0 days 00:00:00.863276,20.18359616984059,19.931877677542786,1.0879776908337235,Cu,COMPLETE
2171,-13.095238095236597,2026-04-07 11:32:11.497010,2026-04-07 11:32:12.125490,0 days 00:00:00.628480,22.074016657142398,19.559341816716056,1.2006939298616404,Cu,PRUNED
2172,-1.0,2026-04-07 11:32:11.527260,2026-04-07 11:32:12.030151,0 days 00:00:00.502891,35.45461940899984,19.604685230613903,1.5310833710567004,Au,COMPLETE
2173,-1.0,2026-04-07 11:32:11.635880,2026-04-07 11:32:12.003245,0 days 00:00:00.367365,21.253227638590754,18.99246647080626,1.4235055723283665,Cu,COMPLETE
2174,0.0,2026-04-07 11:32:11.660303,2026-04-07 11:32:12.318222,0 days 00:00:00.657919,20.178317443937306,17.4877281157325,0.9240049165864923,Au,PRUNED
2175,-1.0,2026-04-07 11:32:11.673959,2026-04-07 11:32:12.142428,0 days 00:00:00.468469,20.934448329938256,19.55355994711967,1.391182374987826,Au,COMPLETE
2176,-198.83578431371083,2026-04-07 11:32:11.691503,2026-04-07 11:32:12.248547,0 days 00:00:00.557044,23.308123386990303,14.942136085380753,1.3191628222272216,Au,COMPLETE
2177,0.0,2026-04-07 11:32:11.728593,2026-04-07 11:32:12.276360,0 days 00:00:00.547767,20.629650391861276,14.94729351507359,1.1356317557525768,Au,PRUNED
2178,79.62962962962726,2026-04-07 11:32:12.176328,2026-04-07 11:32:13.080150,0 days 00:00:00.903822,33.034773918018054,15.900872684407698,1.170570849033935,Au,PRUNED
2179,-2.3148148148145573,2026-04-07 11:32:12.207903,2026-04-07 11:32:12.815737,0 days 00:00:00.607834,31.034392924366557,13.807066099763498,1.1967160929633884,Au,PRUNED
2180,-1.0,2026-04-07 11:32:12.277868,2026-04-07 11:32:12.814740,0 days 00:00:00.536872,33.495743357501176,14.63716402706991,1.1414314198169744,Au,COMPLETE
2181,-14.639639639638055,2026-04-07 11:32:12.329404,2026-04-07 11:32:13.091757,0 days 00:00:00.762353,26.69054107955714,14.193483011347066,1.2281784771698572,Au,PRUNED
2182,0.0,2026-04-07 11:32:12.391115,2026-04-07 11:32:12.941679,0 days 00:00:00.550564,31.710121437944522,17.021508251750046,1.1829037698759663,Au,PRUNED
2183,-1.0,2026-04-07 11:32:12.422162,2026-04-07 11:32:12.813732,0 days 00:00:00.391570,106.48540473636663,12.995916541242007,0.20656033588929656,Au,COMPLETE
2184,0.0,2026-04-07 11:32:12.452652,2026-04-07 11:32:12.968848,0 days 00:00:00.516196,20.764800360192126,14.155657986724476,1.2954447797288868,Au,PRUNED
2185,-1.0,2026-04-07 11:32:12.484482,2026-04-07 11:32:12.904208,0 days 00:00:00.419726,40.58459622681217,15.640592632321992,1.2392117282750101,Au,COMPLETE
2186,0.0,2026-04-07 11:32:12.945196,2026-04-07 11:32:13.611244,0 days 00:00:00.666048,37.10939419468542,19.92262614376004,1.203773330041428,Cu,PRUNED
2187,-1.0,2026-04-07 11:32:13.018031,2026-04-07 11:32:13.612750,0 days 00:00:00.594719,20.698052509223388,16.4097775792999,1.26593641642853,Au,COMPLETE
2188,79.6568627450957,2026-04-07 11:32:13.051481,2026-04-07 11:32:13.681924,0 days 00:00:00.630443,29.18263170170284,19.791787332807253,1.497670477442395,Cu,PRUNED
2189,-1.0,2026-04-07 11:32:13.111195,2026-04-07 11:32:13.787565,0 days 00:00:00.676370,35.11913866137071,19.6510823537518,1.1855601613866829,Cu,COMPLETE
2190,-1.0,2026-04-07 11:32:13.142282,2026-04-07 11:32:13.793054,0 days 00:00:00.650772,25.301039127559527,15.60480619371577,0.7048460711598694,Au,COMPLETE
2191,-1.0,2026-04-07 11:32:13.264512,2026-04-07 11:32:13.717353,0 days 00:00:00.452841,23.39549473011391,16.64600195191853,1.2372757924475852,Au,COMPLETE
2192,-1.0,2026-04-07 11:32:13.297227,2026-04-07 11:32:13.671034,0 days 00:00:00.373807,34.44439127267874,14.54726711301473,1.48691335516467,Au,COMPLETE
2193,1.2626262626261096,2026-04-07 11:32:13.346752,2026-04-07 11:32:14.171632,0 days 00:00:00.824880,25.504592706374893,19.99329891386428,0.9923139176008802,Cu,PRUNED
2194,-12.254901960782872,2026-04-07 11:32:13.647561,2026-04-07 11:32:13.983341,0 days 00:00:00.335780,22.062103017049175,19.734137536296693,1.1617874713104432,Cu,PRUNED
2195,-1.0,2026-04-07 11:32:13.748290,2026-04-07 11:32:14.296415,0 days 00:00:00.548125,22.882386854566086,18.321123578555618,1.093430367952216,Au,COMPLETE
2196,-206.43219264890695,2026-04-07 11:32:13.785558,2026-04-07 11:32:14.547803,0 days 00:00:00.762245,21.107768715582008,18.890577371541447,1.141671418047439,Cu,COMPLETE
2197,79.62962962962726,2026-04-07 11:32:13.847840,2026-04-07 11:32:14.514395,0 days 00:00:00.666555,32.78435090150804,15.747761059345802,1.4655703724419866,Au,PRUNED
2198,-1.0,2026-04-07 11:32:13.865891,2026-04-07 11:32:14.417723,0 days 00:00:00.551832,20.951074968470188,15.991290035191692,1.5236106568764074,Au,COMPLETE
2199,-1.0,2026-04-07 11:32:13.920893,2026-04-07 11:32:14.386500,0 days 00:00:00.465607,24.163486170855553,19.95319951053212,1.510223667833503,Cu,COMPLETE
2200,0.0,2026-04-07 11:32:14.134561,2026-04-07 11:32:14.901688,0 days 00:00:00.767127,20.06384847733617,15.851359743522428,1.3197178728048147,Au,PRUNED
2201,0.0,2026-04-07 11:32:14.199927,2026-04-07 11:32:14.736503,0 days 00:00:00.536576,20.056147521340048,10.631632920221154,0.9947797375970119,Au,PRUNED
2202,-2.525252525252219,2026-04-07 11:32:14.272419,2026-04-07 11:32:14.837361,0 days 00:00:00.564942,24.659885804431827,19.855281420730876,1.121867263293288,Cu,PRUNED
2203,0.0,2026-04-07 11:32:14.501109,2026-04-07 11:32:15.305712,0 days 00:00:00.804603,23.028413047432718,13.540162970641116,1.3332933279084707,Au,PRUNED
2204,-1.0,2026-04-07 11:32:14.537361,2026-04-07 11:32:14.997325,0 days 00:00:00.459964,20.477019862989877,17.70251664085625,1.4793615018362507,Au,COMPLETE
2205,-1.0,2026-04-07 11:32:14.516917,2026-04-07 11:32:15.102587,0 days 00:00:00.585670,21.418172735628957,13.032863116964789,1.1712097128544046,Au,COMPLETE
2206,-1.446759259259219,2026-04-07 11:32:14.623470,2026-04-07 11:32:15.604836,0 days 00:00:00.981366,46.726080352666045,19.90068201616842,0.9648711416306628,Cu,PRUNED
2207,-1.0,2026-04-07 11:32:14.779225,2026-04-07 11:32:15.176739,0 days 00:00:00.397514,20.168270401158257,17.82816738384562,1.610193192826594,Au,COMPLETE
2208,-1.0,2026-04-07 11:32:14.793375,2026-04-07 11:32:15.230297,0 days 00:00:00.436922,20.163506479316204,18.779611143972357,1.5595695902926912,Au,COMPLETE
2209,-10.101010101008876,2026-04-07 11:32:14.905691,2026-04-07 11:32:15.471832,0 days 00:00:00.566141,23.147345554852592,19.693960935669196,1.22714503181735,Cu,PRUNED
2210,0.0,2026-04-07 11:32:14.963305,2026-04-07 11:32:15.551402,0 days 00:00:00.588097,32.28983148609005,18.061229065313825,1.4712364184998798,Au,PRUNED
2211,-1.0,2026-04-07 11:32:15.152978,2026-04-07 11:32:15.680344,0 days 00:00:00.527366,34.03818280129592,15.754442227344253,1.5731879848477504,Au,COMPLETE
2212,0.0,2026-04-07 11:32:15.230297,2026-04-07 11:32:16.123615,0 days 00:00:00.893318,20.015704534867346,19.060354469103192,1.1647744012092145,Cu,PRUNED
2213,79.9632352941153,2026-04-07 11:32:15.337878,2026-04-07 11:32:16.233054,0 days 00:00:00.895176,33.22894475672043,14.459490409906488,1.387744820921626,Au,PRUNED
2214,0.0,2026-04-07 11:32:15.411093,2026-04-07 11:32:16.187769,0 days 00:00:00.776676,36.41483228976409,15.627443305022998,1.4837010751779007,Au,PRUNED
2215,-1.0,2026-04-07 11:32:15.446683,2026-04-07 11:32:15.949172,0 days 00:00:00.502489,33.395801565445346,15.876198301806625,1.4412952897559066,Au,COMPLETE
2216,-1.0,2026-04-07 11:32:15.507986,2026-04-07 11:32:15.873570,0 days 00:00:00.365584,37.65481797718311,17.28456743226215,1.430751265029653,Au,COMPLETE
2217,-1.0,2026-04-07 11:32:15.607836,2026-04-07 11:32:16.081811,0 days 00:00:00.473975,20.34186171771182,19.598400911004084,1.1251128287350176,Cu,COMPLETE
2218,0.0,2026-04-07 11:32:15.725307,2026-04-07 11:32:16.545980,0 days 00:00:00.820673,20.618152231013443,18.139049489035333,1.2903193635002674,Cu,PRUNED
2219,-1.0,2026-04-07 11:32:15.809902,2026-04-07 11:32:16.548991,0 days 00:00:00.739089,23.03282480352621,13.471449606605345,1.5241474792809444,Au,COMPLETE
2220,-1.0,2026-04-07 11:32:15.996377,2026-04-07 11:32:16.763143,0 days 00:00:00.766766,20.464857900642222,15.37485996005533,1.4174136336359844,Au,COMPLETE
2221,0.0,2026-04-07 11:32:16.155543,2026-04-07 11:32:16.778208,0 days 00:00:00.622665,48.23985073871631,17.494620959960162,1.1100472296000388,Au,PRUNED
2222,-1.0,2026-04-07 11:32:16.189916,2026-04-07 11:32:16.634804,0 days 00:00:00.444888,24.41941174777581,19.819145335778707,1.2171568972017903,Au,COMPLETE
2223,-1.0,2026-04-07 11:32:16.250506,2026-04-07 11:32:16.700429,0 days 00:00:00.449923,31.92077302782087,19.802988215214647,1.160815463544592,Au,COMPLETE
2224,-1.0,2026-04-07 11:32:16.264609,2026-04-07 11:32:16.832069,0 days 00:00:00.567460,31.39022915061592,18.022100393139265,1.2119086146989502,Au,COMPLETE
2225,-1.0,2026-04-07 11:32:16.278127,2026-04-07 11:32:16.702492,0 days 00:00:00.424365,20.848838588826453,15.977314300063988,1.023787887445895,Au,COMPLETE
2226,-1.0,2026-04-07 11:32:16.670282,2026-04-07 11:32:17.104598,0 days 00:00:00.434316,35.28991676807867,19.53616214385623,1.038315599397951,Cu,COMPLETE
2227,-1.0,2026-04-07 11:32:16.795904,2026-04-07 11:32:17.217732,0 days 00:00:00.421828,20.373698266712594,18.611822543516492,1.3508772884658642,Ag,COMPLETE
2228,-1.0,2026-04-07 11:32:16.843936,2026-04-07 11:32:17.308747,0 days 00:00:00.464811,21.07856690159344,18.56838303025676,1.1104680641078706,Au,COMPLETE
2229,-1.0,2026-04-07 11:32:16.864660,2026-04-07 11:32:17.306646,0 days 00:00:00.441986,32.167262120519766,16.973257300142098,1.3685219348369526,Au,COMPLETE
2230,-303.80036630033266,2026-04-07 11:32:16.873262,2026-04-07 11:32:17.388406,0 days 00:00:00.515144,21.653729958963083,16.82869670353355,1.45851408630821,Au,COMPLETE
2231,0.0,2026-04-07 11:32:16.909735,2026-04-07 11:32:17.458676,0 days 00:00:00.548941,20.35834517045757,14.427592698811441,1.5703515508110213,Au,PRUNED
2232,-1.0,2026-04-07 11:32:16.925932,2026-04-07 11:32:17.535597,0 days 00:00:00.609665,20.484998747372718,19.340620158980233,1.0426305720063753,Cu,COMPLETE
2233,-1.0,2026-04-07 11:32:16.993074,2026-04-07 11:32:17.662077,0 days 00:00:00.669003,37.513001213243115,9.671583455802708,1.2540417047819608,Au,COMPLETE
2234,-1.2626262626261096,2026-04-07 11:32:17.265878,2026-04-07 11:32:17.973055,0 days 00:00:00.707177,25.232603415498204,16.98912568282539,1.3806136749238718,Au,PRUNED
2235,0.0,2026-04-07 11:32:17.424727,2026-04-07 11:32:18.151609,0 days 00:00:00.726882,20.466003556101633,18.876632971064623,0.9102621209424748,Cu,PRUNED
2236,-1.456876456876416,2026-04-07 11:32:17.461253,2026-04-07 11:32:17.975570,0 days 00:00:00.514317,43.844148763325634,19.638049710807742,1.3493465491448569,Cu,PRUNED
2237,-8.928571428570791,2026-04-07 11:32:17.507053,2026-04-07 11:32:18.056842,0 days 00:00:00.549789,26.116275976160967,16.01338938478521,1.5228237111580425,Ag,PRUNED
2238,-1.0,2026-04-07 11:32:17.531087,2026-04-07 11:32:18.026038,0 days 00:00:00.494951,22.314547211019836,17.039252775438424,1.382863982336627,Au,COMPLETE
2239,-1.0,2026-04-07 11:32:17.596499,2026-04-07 11:32:17.972056,0 days 00:00:00.375557,20.611803698455404,14.906471698274416,1.3875466218186492,Au,COMPLETE
2240,-0.9342301943198636,2026-04-07 11:32:17.752966,2026-04-07 11:32:18.523294,0 days 00:00:00.770328,50.705987887493635,19.9031134631431,1.4685758362600305,Cu,PRUNED
2241,-1.0,2026-04-07 11:32:17.762701,2026-04-07 11:32:18.461903,0 days 00:00:00.699202,20.788972653660082,19.994379458255505,1.491023481932211,Au,COMPLETE
2242,-206.59062103927445,2026-04-07 11:32:18.082697,2026-04-07 11:32:18.791947,0 days 00:00:00.709250,20.157744799578257,19.319440014321245,1.3653181279581301,Cu,COMPLETE
2243,-1.0,2026-04-07 11:32:18.142809,2026-04-07 11:32:18.759654,0 days 00:00:00.616845,22.398998630853168,19.969601443367193,1.6089791442473595,Cu,COMPLETE
2244,-1.0,2026-04-07 11:32:18.155090,2026-04-07 11:32:18.571154,0 days 00:00:00.416064,32.26583285755982,18.375989464370548,1.684374048434527,Au,COMPLETE
2245,-1.0,2026-04-07 11:32:18.190445,2026-04-07 11:32:18.668629,0 days 00:00:00.478184,38.29767522605803,19.53259654225374,1.7410476643354564,Au,COMPLETE
2246,-1.0,2026-04-07 11:32:18.204601,2026-04-07 11:32:18.571154,0 days 00:00:00.366553,35.5778700361986,18.301357447534752,1.5911287029223593,Au,COMPLETE
2247,-1.0,2026-04-07 11:32:18.219785,2026-04-07 11:32:18.759654,0 days 00:00:00.539869,21.6042430703856,19.057820306718337,1.4412636055544923,Cu,COMPLETE
2248,-1.0,2026-04-07 11:32:18.600884,2026-04-07 11:32:18.979194,0 days 00:00:00.378310,20.289270829404106,17.10747593556841,1.7203663735367734,Au,COMPLETE
2249,-302.4267399267069,2026-04-07 11:32:18.716643,2026-04-07 11:32:19.304001,0 days 00:00:00.587358,21.164548240024004,19.48192360979607,1.1579485535419591,Cu,COMPLETE
2250,-1.0,2026-04-07 11:32:18.729263,2026-04-07 11:32:19.207258,0 days 00:00:00.477995,21.15017901963094,19.450842897228032,1.568921672232618,Cu,COMPLETE
2251,-1.0,2026-04-07 11:32:18.793452,2026-04-07 11:32:19.321246,0 days 00:00:00.527794,33.377499122274244,19.818863994764463,0.8241993914803165,Cu,COMPLETE
2252,-1.0,2026-04-07 11:32:18.873169,2026-04-07 11:32:19.321246,0 days 00:00:00.448077,37.71139128036341,14.58518500949097,1.2859331164892498,Au,COMPLETE
2253,-1.0,2026-04-07 11:32:18.906667,2026-04-07 11:32:19.318193,0 days 00:00:00.411526,24.86631580343701,19.681363581933844,1.5750388433543847,Cu,COMPLETE
2254,-1.0,2026-04-07 11:32:18.936965,2026-04-07 11:32:19.349435,0 days 00:00:00.412470,23.2078584431307,17.504608651446738,1.3037481637561072,Au,COMPLETE
