number,value,datetime_start,datetime_complete,duration,params_D2_nm,params_D3_nm,params_D4_nm,params_metal,state
2255,-17.857142857140307,2026-04-07 11:32:18.981193,2026-04-07 11:32:19.551063,0 days 00:00:00.569870,83.70193430874554,8.796633940714395,1.2661439248366706,Ag,PRUNED
2256,-1.0,2026-04-07 11:32:19.121663,2026-04-07 11:32:19.313098,0 days 00:00:00.191435,22.523805319860575,17.149067500428647,1.1869224391759925,Au,COMPLETE
2257,77.25060827250383,2026-04-07 11:32:19.377187,2026-04-07 11:32:19.926555,0 days 00:00:00.549368,34.791383883660906,18.54173423482334,1.096650261730484,Cu,PRUNED
2258,-1.0,2026-04-07 11:32:19.401091,2026-04-07 11:32:19.981193,0 days 00:00:00.580102,24.703514783705085,19.81284268434787,1.2055842755714623,Cu,COMPLETE
2259,-1.456876456876416,2026-04-07 11:32:19.514989,2026-04-07 11:32:20.254731,0 days 00:00:00.739742,42.65310957662287,17.78924331780908,1.2384677671520405,Cu,PRUNED
2260,-1.0,2026-04-07 11:32:19.582850,2026-04-07 11:32:20.003704,0 days 00:00:00.420854,21.318113865999525,19.816313620680607,1.5284828796059198,Cu,COMPLETE
2261,-1.0,2026-04-07 11:32:19.632748,2026-04-07 11:32:20.129557,0 days 00:00:00.496809,21.986539792194364,19.65552949199706,1.2576062680661675,Cu,COMPLETE
2262,-1.0,2026-04-07 11:32:19.655102,2026-04-07 11:32:20.146892,0 days 00:00:00.491790,34.27329426954522,19.500213508277238,1.3287503561321976,Cu,COMPLETE
2263,-1.0,2026-04-07 11:32:19.616643,2026-04-07 11:32:20.011868,0 days 00:00:00.395225,36.174108342392806,19.192001123707445,1.1011634559709915,Cu,COMPLETE
2264,-1.0,2026-04-07 11:32:19.744082,2026-04-07 11:32:20.423768,0 days 00:00:00.679686,37.598530316004016,17.489413127731,1.275960138410683,Cu,COMPLETE
2265,-3.787878787878329,2026-04-07 11:32:20.005863,2026-04-07 11:32:20.942342,0 days 00:00:00.936479,24.257847210512633,19.782045133440672,1.1908445256318267,Cu,PRUNED
2266,-12.254901960782872,2026-04-07 11:32:20.187942,2026-04-07 11:32:20.746062,0 days 00:00:00.558120,22.26862851622832,19.757770511961922,1.004012739988194,Cu,PRUNED
2267,76.33819951337976,2026-04-07 11:32:20.195524,2026-04-07 11:32:20.925221,0 days 00:00:00.729697,35.488490765989326,17.406317568620384,1.4334610222144277,Cu,PRUNED
2268,-1.0,2026-04-07 11:32:20.273082,2026-04-07 11:32:20.627959,0 days 00:00:00.354877,36.09777723712355,16.331769209100777,1.1312187239104137,Cu,COMPLETE
2269,-13.095238095236597,2026-04-07 11:32:20.342549,2026-04-07 11:32:20.919680,0 days 00:00:00.577131,22.06529605595996,19.77560626565588,0.8317771209786211,Cu,PRUNED
2270,-295.94594594591405,2026-04-07 11:32:20.370599,2026-04-07 11:32:21.075547,0 days 00:00:00.704948,21.475225450267665,19.06418962735278,1.139605845512527,Cu,COMPLETE
2271,-10.101010101008876,2026-04-07 11:32:20.436527,2026-04-07 11:32:21.142262,0 days 00:00:00.705735,23.09879606675376,19.479582339469342,1.2344172764061705,Cu,PRUNED
2272,0.0,2026-04-07 11:32:20.628984,2026-04-07 11:32:21.400107,0 days 00:00:00.771123,20.255150717607613,16.11352688472516,1.0433084189260384,Cu,PRUNED
2273,-1.0,2026-04-07 11:32:20.836812,2026-04-07 11:32:21.425356,0 days 00:00:00.588544,20.57660413960865,19.091925624461304,1.3256791908880605,Au,COMPLETE
2274,-11.904761904760544,2026-04-07 11:32:20.921681,2026-04-07 11:32:21.756689,0 days 00:00:00.835008,21.913541144453635,19.69629577847192,1.0912583635607322,Cu,PRUNED
2275,0.0,2026-04-07 11:32:20.992560,2026-04-07 11:32:21.804101,0 days 00:00:00.811541,20.717530002703867,16.29909080144097,1.110989444475593,Cu,PRUNED
2276,-1.0,2026-04-07 11:32:21.040211,2026-04-07 11:32:21.707415,0 days 00:00:00.667204,23.958455016889253,16.21185969171341,1.0412405471860307,Cu,COMPLETE
2277,-184.46180555554275,2026-04-07 11:32:21.112004,2026-04-07 11:32:21.818130,0 days 00:00:00.706126,22.294019554168898,17.02914933611893,1.347119532752759,Cu,COMPLETE
2278,-10.101010101008876,2026-04-07 11:32:21.192362,2026-04-07 11:32:21.894082,0 days 00:00:00.701720,23.788050444310404,19.65380322172524,0.9175116704503178,Cu,PRUNED
2279,-176.4870931537478,2026-04-07 11:32:21.330492,2026-04-07 11:32:21.847959,0 days 00:00:00.517467,22.684388867394986,16.684817158695868,1.0121468289067728,Cu,COMPLETE
2280,72.68856447688353,2026-04-07 11:32:21.473903,2026-04-07 11:32:22.188921,0 days 00:00:00.715018,36.723093440423334,16.975027064834947,1.2664891116335686,Cu,PRUNED
2281,-1.0,2026-04-07 11:32:21.607495,2026-04-07 11:32:22.222926,0 days 00:00:00.615431,20.43979558131176,19.98348616412937,0.738717504913122,Cu,COMPLETE
2282,-1.0,2026-04-07 11:32:21.836385,2026-04-07 11:32:22.429577,0 days 00:00:00.593192,40.18394305460764,19.43941708016091,1.2993681469962306,Cu,COMPLETE
2283,-313.3239171374407,2026-04-07 11:32:21.806504,2026-04-07 11:32:22.490309,0 days 00:00:00.683805,20.14944571622931,19.890751711626862,1.7885973204243832,Cu,COMPLETE
2284,-1.0,2026-04-07 11:32:21.913063,2026-04-07 11:32:22.336492,0 days 00:00:00.423429,35.2469082943078,19.884998421189803,0.9557928671118872,Cu,COMPLETE
2285,-1.0,2026-04-07 11:32:21.938036,2026-04-07 11:32:22.336492,0 days 00:00:00.398456,37.34278138714765,19.685837503774156,1.2079783419361327,Cu,COMPLETE
2286,0.0,2026-04-07 11:32:22.024285,2026-04-07 11:32:22.653790,0 days 00:00:00.629505,38.056110836888784,19.389089864818086,1.0334155605772095,Cu,PRUNED
2287,-1.0,2026-04-07 11:32:22.089310,2026-04-07 11:32:22.554665,0 days 00:00:00.465355,20.72866912286676,19.34610565299243,1.023860369821485,Cu,COMPLETE
2288,-1.0,2026-04-07 11:32:22.295904,2026-04-07 11:32:22.741339,0 days 00:00:00.445435,20.125934036714295,19.571331925373592,1.3305854768690455,Cu,COMPLETE
2289,-1.0,2026-04-07 11:32:22.390905,2026-04-07 11:32:22.871392,0 days 00:00:00.480487,21.492759338323243,19.087755987176067,1.157750540636449,Cu,COMPLETE
2290,-12.820512820511505,2026-04-07 11:32:22.480085,2026-04-07 11:32:22.993804,0 days 00:00:00.513719,23.03471028363771,16.684804890437977,1.7520123397636436,Cu,PRUNED
2291,-1.4671361502347005,2026-04-07 11:32:22.573085,2026-04-07 11:32:23.224408,0 days 00:00:00.651323,40.435931414092465,17.973092016423283,1.9144881549772177,Cu,PRUNED
2292,-12.387387387386047,2026-04-07 11:32:22.590724,2026-04-07 11:32:22.992252,0 days 00:00:00.401528,22.012175228138116,18.745697562135174,1.3499234786381344,Cu,PRUNED
2293,76.08695652173692,2026-04-07 11:32:22.651786,2026-04-07 11:32:23.389959,0 days 00:00:00.738173,35.527354100699895,17.662402524983953,1.7646088776395503,Cu,PRUNED
2294,-1.1737089201877602,2026-04-07 11:32:22.757973,2026-04-07 11:32:23.684317,0 days 00:00:00.926344,42.30272799692696,17.35336025401215,1.9412728448238066,Cu,PRUNED
2295,-10.71428571428449,2026-04-07 11:32:22.798239,2026-04-07 11:32:23.521503,0 days 00:00:00.723264,24.244967139627704,17.96799761166246,1.8579415785606597,Cu,PRUNED
2296,0.0,2026-04-07 11:32:22.929685,2026-04-07 11:32:23.605713,0 days 00:00:00.676028,34.543608458526776,18.48869929052305,1.9503267394533303,Cu,PRUNED
2297,-1.0,2026-04-07 11:32:22.997580,2026-04-07 11:32:23.813209,0 days 00:00:00.815629,31.89936069428743,18.15283351315008,1.5133309065612424,Cu,COMPLETE
2298,-7.142857142856326,2026-04-07 11:32:23.120010,2026-04-07 11:32:23.774178,0 days 00:00:00.654168,25.145600645894277,18.229342195173025,1.637061956669889,Cu,PRUNED
2299,-1.0,2026-04-07 11:32:23.164083,2026-04-07 11:32:23.720637,0 days 00:00:00.556554,20.100144952533554,19.901583870574694,1.9208296031506114,Cu,COMPLETE
2300,0.0,2026-04-07 11:32:23.278529,2026-04-07 11:32:24.176173,0 days 00:00:00.897644,36.287892839557124,19.422059731894123,1.703047242698899,Cu,PRUNED
2301,78.7377450980369,2026-04-07 11:32:23.467187,2026-04-07 11:32:24.102261,0 days 00:00:00.635074,30.357677671537186,19.60735936855807,1.5932908628588587,Cu,PRUNED
2302,80.26960784313488,2026-04-07 11:32:23.557453,2026-04-07 11:32:24.177185,0 days 00:00:00.619732,27.868002521854645,19.998453250847703,1.719054888776835,Cu,PRUNED
2303,0.0,2026-04-07 11:32:23.708887,2026-04-07 11:32:24.519461,0 days 00:00:00.810574,45.530078240631426,19.770795057565394,1.0754608138466675,Au,PRUNED
2304,-1.0,2026-04-07 11:32:23.744832,2026-04-07 11:32:24.361151,0 days 00:00:00.616319,22.316477222481772,17.309073458856368,1.8163042089185244,Cu,COMPLETE
2305,0.0,2026-04-07 11:32:23.859768,2026-04-07 11:32:24.579642,0 days 00:00:00.719874,35.964121642498874,17.673022707727164,1.1474131435504273,Au,PRUNED
2306,-1.0,2026-04-07 11:32:23.889961,2026-04-07 11:32:24.361662,0 days 00:00:00.471701,39.74153371910954,19.960720701354106,1.772846424633889,Cu,COMPLETE
2307,-292.11229946520933,2026-04-07 11:32:24.166038,2026-04-07 11:32:24.848362,0 days 00:00:00.682324,20.645020441757737,19.135575768478276,1.454891606707592,Cu,COMPLETE
2308,-11.574074074072788,2026-04-07 11:32:24.143618,2026-04-07 11:32:24.923039,0 days 00:00:00.779421,22.14879518812985,18.91808666632294,1.5820158006613294,Cu,PRUNED
2309,-1.0,2026-04-07 11:32:24.241009,2026-04-07 11:32:24.699976,0 days 00:00:00.458967,25.14578449986606,19.69712552949718,1.6213980068540266,Ag,COMPLETE
2310,0.0,2026-04-07 11:32:24.275018,2026-04-07 11:32:25.005651,0 days 00:00:00.730633,38.27252325009243,19.23092125534063,1.3187930267995631,Au,PRUNED
2311,-1.0,2026-04-07 11:32:24.533975,2026-04-07 11:32:25.248308,0 days 00:00:00.714333,38.064328960454,17.344153327462408,1.4271281214897464,Au,COMPLETE
2312,0.0,2026-04-07 11:32:24.600238,2026-04-07 11:32:25.278758,0 days 00:00:00.678520,20.702906096696044,16.31281145095177,1.4963285304869829,Au,PRUNED
2313,-1.0,2026-04-07 11:32:24.615003,2026-04-07 11:32:25.078233,0 days 00:00:00.463230,34.776870657811926,17.846945922786105,1.385279818844579,Au,COMPLETE
2314,-1.0,2026-04-07 11:32:24.638657,2026-04-07 11:32:25.202307,0 days 00:00:00.563650,20.654463277082915,16.506023905692242,1.7918333160441042,Cu,COMPLETE
2315,-11.904761904760544,2026-04-07 11:32:24.862062,2026-04-07 11:32:25.383138,0 days 00:00:00.521076,21.22026896948691,19.65384813390672,1.375578918545951,Cu,PRUNED
2316,-1.0,2026-04-07 11:32:24.943604,2026-04-07 11:32:25.433943,0 days 00:00:00.490339,34.06698626907121,17.053552833108657,1.4898229707821582,Cu,COMPLETE
2317,-1.0,2026-04-07 11:32:25.078233,2026-04-07 11:32:25.678255,0 days 00:00:00.600022,26.05966154348473,18.101483725270054,1.844127587936045,Cu,COMPLETE
2318,79.0441176470565,2026-04-07 11:32:25.108675,2026-04-07 11:32:25.859170,0 days 00:00:00.750495,30.544796089200428,19.179855930492373,1.5422609445388038,Cu,PRUNED
2319,-1.0,2026-04-07 11:32:25.226804,2026-04-07 11:32:25.642452,0 days 00:00:00.415648,23.01377645889137,19.685450859988936,1.366306101025292,Cu,COMPLETE
2320,-3.787878787878329,2026-04-07 11:32:25.358458,2026-04-07 11:32:26.032108,0 days 00:00:00.673650,23.457976993066925,19.522112408879888,1.9142056250957817,Cu,PRUNED
2321,-1.0,2026-04-07 11:32:25.423687,2026-04-07 11:32:26.048804,0 days 00:00:00.625117,20.640797350142435,18.61661886314896,1.5873896294474235,Cu,COMPLETE
2322,-1.2626262626261096,2026-04-07 11:32:25.480449,2026-04-07 11:32:26.180259,0 days 00:00:00.699810,24.25406803650055,19.689257741255165,1.5307054503680189,Cu,PRUNED
2323,-10.41666666666551,2026-04-07 11:32:25.513638,2026-04-07 11:32:26.157569,0 days 00:00:00.643931,24.665914944475748,17.869586685141602,1.7318400594431882,Cu,PRUNED
2324,-1.0,2026-04-07 11:32:25.565907,2026-04-07 11:32:25.951578,0 days 00:00:00.385671,35.82591603721076,19.647327080889106,1.3587991771365364,Cu,COMPLETE
2325,-1.0,2026-04-07 11:32:25.820877,2026-04-07 11:32:26.450523,0 days 00:00:00.629646,20.993560598596904,19.484977000021516,1.7698231601455845,Cu,COMPLETE
2326,-1.0,2026-04-07 11:32:25.786002,2026-04-07 11:32:26.606574,0 days 00:00:00.820572,22.542809178248596,15.754891933747638,1.392834428204603,Cu,COMPLETE
2327,-165.6175059951918,2026-04-07 11:32:26.103346,2026-04-07 11:32:26.856793,0 days 00:00:00.753447,22.477273082270624,19.172337071292457,1.222754701014542,Ag,COMPLETE
2328,-1.0,2026-04-07 11:32:26.202483,2026-04-07 11:32:26.759614,0 days 00:00:00.557131,32.25460090706589,17.13441879905975,1.4034651742641824,Cu,COMPLETE
2329,-1.0,2026-04-07 11:32:26.144478,2026-04-07 11:32:26.700350,0 days 00:00:00.555872,23.910037610309946,17.179489545511995,1.4054989116034005,Cu,COMPLETE
2330,-8.771929824560788,2026-04-07 11:32:26.234472,2026-04-07 11:32:26.898883,0 days 00:00:00.664411,23.23454854066433,16.76263173622404,1.449306565268889,Cu,PRUNED
2331,-1.6869095816463964,2026-04-07 11:32:26.256226,2026-04-07 11:32:26.936216,0 days 00:00:00.679990,118.23449707203812,5.161147693276669,1.210179276059294,Ag,PRUNED
2332,76.94647201946246,2026-04-07 11:32:26.291738,2026-04-07 11:32:26.805631,0 days 00:00:00.513893,33.33083315875395,19.262019595880613,1.408225906066833,Cu,PRUNED
2333,0.0,2026-04-07 11:32:26.581815,2026-04-07 11:32:27.295149,0 days 00:00:00.713334,24.31969328201874,19.908989222361097,1.505385528072536,Cu,PRUNED
2334,-1.0,2026-04-07 11:32:26.807632,2026-04-07 11:32:27.439539,0 days 00:00:00.631907,20.888256513486887,19.880963715915556,1.374665189648321,Cu,COMPLETE
2335,-211.24031007750287,2026-04-07 11:32:26.913065,2026-04-07 11:32:27.533651,0 days 00:00:00.620586,20.203178803665484,19.766573498024282,1.0817236080177797,Cu,COMPLETE
2336,0.0,2026-04-07 11:32:26.950429,2026-04-07 11:32:27.745196,0 days 00:00:00.794767,20.649119560236407,16.947569375392526,1.2999850596416516,Au,PRUNED
2337,-1.0,2026-04-07 11:32:26.953455,2026-04-07 11:32:27.359462,0 days 00:00:00.406007,22.9981578796814,19.042236479883353,1.558375074977212,Au,COMPLETE
2338,0.0,2026-04-07 11:32:27.008415,2026-04-07 11:32:27.550879,0 days 00:00:00.542464,27.32392324642465,19.56987566591741,1.6822482712055788,Au,PRUNED
2339,0.0,2026-04-07 11:32:27.084795,2026-04-07 11:32:27.532650,0 days 00:00:00.447855,34.212695033031764,19.936243377994227,1.4435010887418889,Cu,PRUNED
2340,-173.58803986709816,2026-04-07 11:32:27.100068,2026-04-07 11:32:27.807088,0 days 00:00:00.707020,21.640249020611442,16.787744940502126,1.2771908552186086,Cu,COMPLETE
2341,-1.0,2026-04-07 11:32:27.395453,2026-04-07 11:32:27.811153,0 days 00:00:00.415700,39.51732163872836,15.62736968598959,1.5898857999345282,Cu,COMPLETE
2342,-1.0,2026-04-07 11:32:27.591945,2026-04-07 11:32:28.323545,0 days 00:00:00.731600,34.20076109015888,19.56819832332339,1.3627514374848326,Cu,COMPLETE
2343,-1.0,2026-04-07 11:32:27.629836,2026-04-07 11:32:28.162293,0 days 00:00:00.532457,20.727700130486134,19.899813250404037,1.1654987197314937,Cu,COMPLETE
2344,77.25060827250383,2026-04-07 11:32:27.640506,2026-04-07 11:32:28.246155,0 days 00:00:00.605649,32.78563552344922,19.776691336743365,1.1308625396063772,Cu,PRUNED
2345,0.0,2026-04-07 11:32:27.670757,2026-04-07 11:32:28.189937,0 days 00:00:00.519180,20.793486745353306,17.29142073689301,1.5619259667089673,Au,PRUNED
2346,-1.0,2026-04-07 11:32:27.874184,2026-04-07 11:32:28.208324,0 days 00:00:00.334140,20.09849149004831,17.406511030938187,1.4041754093685983,Cu,COMPLETE
2347,-1.0,2026-04-07 11:32:27.924231,2026-04-07 11:32:28.245583,0 days 00:00:00.321352,20.422917377341616,17.37338386917224,1.6380411437171387,Cu,COMPLETE
2348,-183.96770472893772,2026-04-07 11:32:28.030362,2026-04-07 11:32:28.796419,0 days 00:00:00.766057,21.242306240455676,17.378694434505658,1.5833658987654604,Cu,COMPLETE
2349,0.0,2026-04-07 11:32:28.091787,2026-04-07 11:32:28.635730,0 days 00:00:00.543943,21.28217608720913,16.887918600655556,1.460561332922853,Cu,PRUNED
2350,-1.0,2026-04-07 11:32:28.276273,2026-04-07 11:32:28.825601,0 days 00:00:00.549328,20.647706721271057,18.5795058276927,0.8326954326562954,Au,COMPLETE
2351,-1.0,2026-04-07 11:32:28.337826,2026-04-07 11:32:28.885157,0 days 00:00:00.547331,20.048571135533795,18.581423696124606,1.5266742234454465,Cu,COMPLETE
2352,80.59610705595871,2026-04-07 11:32:28.379437,2026-04-07 11:32:29.026166,0 days 00:00:00.646729,27.352520881397027,19.97787094035173,1.1691957572354106,Cu,PRUNED
2353,-1.0,2026-04-07 11:32:28.398596,2026-04-07 11:32:28.781606,0 days 00:00:00.383010,20.885896456014358,17.107476028955883,1.2729020952081778,Cu,COMPLETE
2354,-1.0,2026-04-07 11:32:28.452121,2026-04-07 11:32:28.823191,0 days 00:00:00.371070,32.63586740970491,19.52065836614428,0.8372508407371786,Ag,COMPLETE
2355,2.7777777777774073,2026-04-07 11:32:28.531473,2026-04-07 11:32:29.011203,0 days 00:00:00.479730,21.860505211639687,19.904796800622865,1.700745585603517,Au,PRUNED
2356,0.0,2026-04-07 11:32:28.738767,2026-04-07 11:32:29.331868,0 days 00:00:00.593101,20.19444108905251,17.395644799472276,1.9883265863571575,Au,PRUNED
2357,0.0,2026-04-07 11:32:28.975327,2026-04-07 11:32:29.666383,0 days 00:00:00.691056,20.80206870695879,17.027572564517094,1.0689853904378195,Cu,PRUNED
2358,59.73193473193305,2026-04-07 11:32:29.050444,2026-04-07 11:32:29.717682,0 days 00:00:00.667238,43.98437697222437,16.75057827395858,1.3671351702948016,Cu,PRUNED
2359,-9.615384615383135,2026-04-07 11:32:29.060698,2026-04-07 11:32:29.744241,0 days 00:00:00.683543,21.06857346698728,19.73445863804873,1.127672206528528,Au,PRUNED
2360,-1.0,2026-04-07 11:32:29.077042,2026-04-07 11:32:29.605605,0 days 00:00:00.528563,20.744952146632624,19.04322282496228,1.278993567123752,Cu,COMPLETE
2361,0.0,2026-04-07 11:32:29.091781,2026-04-07 11:32:29.700244,0 days 00:00:00.608463,40.62054518992321,17.86526407309189,1.6877356625503146,Au,PRUNED
2362,-1.0,2026-04-07 11:32:29.113018,2026-04-07 11:32:29.555987,0 days 00:00:00.442969,20.716627005529006,19.520950087301856,1.4718711755590195,Cu,COMPLETE
2363,-1.0,2026-04-07 11:32:29.186100,2026-04-07 11:32:29.730715,0 days 00:00:00.544615,21.99217117302163,19.950038369823414,1.1512130806613636,Cu,COMPLETE
2364,-1.0,2026-04-07 11:32:29.379311,2026-04-07 11:32:30.157132,0 days 00:00:00.777821,39.80334383655381,16.954564490638077,1.0522602500452582,Cu,COMPLETE
2365,-1.0,2026-04-07 11:32:29.713414,2026-04-07 11:32:30.255425,0 days 00:00:00.542011,41.065834546162286,16.967850563658146,1.3492979197278534,Ag,COMPLETE
2366,3.086419753086191,2026-04-07 11:32:29.779820,2026-04-07 11:32:30.532420,0 days 00:00:00.752600,35.33877135874302,17.187492877407106,1.1744599010837424,Cu,PRUNED
2367,0.0,2026-04-07 11:32:29.796888,2026-04-07 11:32:30.260625,0 days 00:00:00.463737,32.58159060984623,17.374018943602497,1.67077542341316,Au,PRUNED
2368,-1.0,2026-04-07 11:32:29.826267,2026-04-07 11:32:30.289890,0 days 00:00:00.463623,37.295742321472815,17.077813325427712,1.3148241533545435,Cu,COMPLETE
2369,-1.0,2026-04-07 11:32:29.859034,2026-04-07 11:32:30.257026,0 days 00:00:00.397992,35.16092483002004,18.573888490008137,1.8418166701538787,Au,COMPLETE
2370,-1.0,2026-04-07 11:32:29.914240,2026-04-07 11:32:30.418369,0 days 00:00:00.504129,20.605925563094825,15.890298249128666,1.503986711578399,Au,COMPLETE
2371,0.0,2026-04-07 11:32:29.946151,2026-04-07 11:32:30.663539,0 days 00:00:00.717388,37.448402215996595,19.834764683554337,1.602423529743132,Cu,PRUNED
2372,0.0,2026-04-07 11:32:30.314031,2026-04-07 11:32:30.845297,0 days 00:00:00.531266,33.821078447285515,17.32061218955105,1.554875275351457,Au,PRUNED
2373,-1.0,2026-04-07 11:32:30.289890,2026-04-07 11:32:31.085523,0 days 00:00:00.795633,48.749037614023734,19.617577873234143,1.1324583866485205,Cu,COMPLETE
2374,-1.0,2026-04-07 11:32:30.289890,2026-04-07 11:32:31.050169,0 days 00:00:00.760279,20.730386214256402,19.096464993157106,1.9886569367997098,Cu,COMPLETE
2375,-1.0,2026-04-07 11:32:30.463959,2026-04-07 11:32:31.133605,0 days 00:00:00.669646,39.40725567932805,19.86436916721077,1.3778599392500164,Cu,COMPLETE
2376,3.144654088050077,2026-04-07 11:32:30.534617,2026-04-07 11:32:31.196833,0 days 00:00:00.662216,33.695101327309914,17.292585701990856,1.1541539083293462,Cu,PRUNED
2377,-298.91304347822836,2026-04-07 11:32:30.623183,2026-04-07 11:32:31.199343,0 days 00:00:00.576160,20.64607314053269,19.17974180789275,1.7124991298249237,Cu,COMPLETE
2378,-1.0,2026-04-07 11:32:30.607713,2026-04-07 11:32:31.167520,0 days 00:00:00.559807,21.241405388426067,15.874560211830952,1.3647090011290206,Cu,COMPLETE
2379,-1.0,2026-04-07 11:32:30.750144,2026-04-07 11:32:31.165469,0 days 00:00:00.415325,22.66799529926392,19.857253415885502,1.9453487682289359,Cu,COMPLETE
2380,-1.0,2026-04-07 11:32:30.903864,2026-04-07 11:32:31.570045,0 days 00:00:00.666181,21.37099488764269,17.212122787829372,1.548755476957968,Au,COMPLETE
2381,-1.0,2026-04-07 11:32:31.225477,2026-04-07 11:32:31.783246,0 days 00:00:00.557769,42.70613653272818,17.92450625373099,1.7185832224184923,Cu,COMPLETE
2382,-1.0,2026-04-07 11:32:31.276434,2026-04-07 11:32:31.698347,0 days 00:00:00.421913,32.105220324129036,16.04664492305261,1.5995272140851862,Cu,COMPLETE
2383,79.62962962962726,2026-04-07 11:32:31.298062,2026-04-07 11:32:31.903397,0 days 00:00:00.605335,32.95819910853385,15.959675043189783,1.150279722399256,Au,PRUNED
2384,0.0,2026-04-07 11:32:31.322065,2026-04-07 11:32:31.897340,0 days 00:00:00.575275,20.092532285503214,16.809715378876508,1.560203353502326,Au,PRUNED
2385,-1.0,2026-04-07 11:32:31.371678,2026-04-07 11:32:31.789343,0 days 00:00:00.417665,38.20029111600926,19.17839688973194,1.9574459010135228,Cu,COMPLETE
2386,-1.0,2026-04-07 11:32:31.418923,2026-04-07 11:32:32.320917,0 days 00:00:00.901994,32.7684115306586,17.593229325998493,1.621241791228841,Au,COMPLETE
2387,-1.0,2026-04-07 11:32:31.529114,2026-04-07 11:32:32.018121,0 days 00:00:00.489007,29.235564745452958,18.36912145897359,1.7513513997765777,Cu,COMPLETE
2388,75.78502415458718,2026-04-07 11:32:31.843548,2026-04-07 11:32:32.584949,0 days 00:00:00.741401,36.08733644695833,17.655155091469187,1.7547456225469422,Cu,PRUNED
2389,-1.0,2026-04-07 11:32:31.790350,2026-04-07 11:32:32.538123,0 days 00:00:00.747773,22.832145587390517,19.879028302854266,1.5784909674877483,Cu,COMPLETE
2390,-9.33908045976947,2026-04-07 11:32:31.942717,2026-04-07 11:32:32.841165,0 days 00:00:00.898448,25.266730729627657,15.261480850964217,1.755664828642463,Cu,PRUNED
2391,-1.0,2026-04-07 11:32:32.021671,2026-04-07 11:32:32.506715,0 days 00:00:00.485044,26.66580981136452,15.557155210653242,1.820977548295146,Cu,COMPLETE
