number,value,datetime_start,datetime_complete,duration,params_D2_nm,params_D3_nm,params_D4_nm,params_metal,state
3085,-1.0,2026-04-07 11:33:39.809476,2026-04-07 11:33:40.268857,0 days 00:00:00.459381,20.74802180416055,16.84643527150789,0.865461636475202,Au,COMPLETE
3086,-1.0,2026-04-07 11:33:39.836252,2026-04-07 11:33:40.410694,0 days 00:00:00.574442,78.94661022297947,11.930782739510922,1.88617860262731,Au,COMPLETE
3087,-2.976190476190051,2026-04-07 11:33:39.983414,2026-04-07 11:33:40.552829,0 days 00:00:00.569415,22.245016096843038,19.805657709766052,0.9959064523896601,Au,PRUNED
3088,-1.0,2026-04-07 11:33:40.006001,2026-04-07 11:33:40.489043,0 days 00:00:00.483042,24.63679881780988,19.937701843999026,1.1217198980353975,Au,COMPLETE
3089,0.0,2026-04-07 11:33:40.231712,2026-04-07 11:33:40.981477,0 days 00:00:00.749765,33.67848362679203,19.82807457974161,0.8549823948130514,Au,PRUNED
3090,-386.7009132419558,2026-04-07 11:33:40.302900,2026-04-07 11:33:40.858383,0 days 00:00:00.555483,20.41605208055678,19.631892548543927,0.8945980586366545,Au,COMPLETE
3091,-1.0,2026-04-07 11:33:40.430896,2026-04-07 11:33:40.985024,0 days 00:00:00.554128,51.191162263141706,19.999399367081466,1.2675278009040756,Au,COMPLETE
3092,-386.41552511410265,2026-04-07 11:33:40.514024,2026-04-07 11:33:41.135401,0 days 00:00:00.621377,20.786223405760822,19.515017197702832,0.6890093111624955,Au,COMPLETE
3093,-1.0,2026-04-07 11:33:40.533391,2026-04-07 11:33:41.135401,0 days 00:00:00.602010,31.466595861258305,19.98105239984357,1.0656080712284728,Au,COMPLETE
3094,-1.0,2026-04-07 11:33:40.562979,2026-04-07 11:33:41.132508,0 days 00:00:00.569529,32.68595650903288,17.45799125696354,1.3050418780589488,Au,COMPLETE
3095,0.0,2026-04-07 11:33:40.651106,2026-04-07 11:33:41.316304,0 days 00:00:00.665198,35.597860944742926,18.30922546036134,1.207439460393278,Au,PRUNED
3096,-1.0,2026-04-07 11:33:40.675903,2026-04-07 11:33:41.179745,0 days 00:00:00.503842,20.77813299234051,16.786992073520537,1.223481331975039,Au,COMPLETE
3097,-1.0,2026-04-07 11:33:40.986033,2026-04-07 11:33:41.491124,0 days 00:00:00.505091,20.300505188413727,16.446918454950943,0.6734319091777241,Au,COMPLETE
3098,0.0,2026-04-07 11:33:41.057433,2026-04-07 11:33:41.648004,0 days 00:00:00.590571,20.59373187408326,17.571737438031107,0.9048042719656505,Au,PRUNED
3099,-413.9294403892341,2026-04-07 11:33:41.168881,2026-04-07 11:33:41.682483,0 days 00:00:00.513602,20.83161157457536,19.637037744207408,0.8833022466232859,Au,COMPLETE
3100,-1.0,2026-04-07 11:33:41.287699,2026-04-07 11:33:41.790899,0 days 00:00:00.503200,31.825295861362513,16.70479896019829,0.8486244993650331,Au,COMPLETE
3101,-1.0,2026-04-07 11:33:41.367028,2026-04-07 11:33:41.853067,0 days 00:00:00.486039,23.87645467426608,19.84603411331273,0.7287171424231755,Au,COMPLETE
3102,-1.0,2026-04-07 11:33:41.385556,2026-04-07 11:33:42.071472,0 days 00:00:00.685916,20.152853169803564,17.107045332470683,0.9474378996514126,Au,COMPLETE
3103,0.0,2026-04-07 11:33:41.407331,2026-04-07 11:33:42.240411,0 days 00:00:00.833080,37.48402666824513,19.819430471439823,0.7491522948274265,Au,PRUNED
3104,-1.0,2026-04-07 11:33:41.459286,2026-04-07 11:33:42.072467,0 days 00:00:00.613181,34.4041374327287,17.96255346772918,0.7778940263460978,Au,COMPLETE
3105,0.0,2026-04-07 11:33:41.650507,2026-04-07 11:33:42.160080,0 days 00:00:00.509573,50.85797003646804,17.572073753472253,0.9062602674188667,Au,PRUNED
3106,0.0,2026-04-07 11:33:41.723423,2026-04-07 11:33:42.450905,0 days 00:00:00.727482,36.08087483799526,19.8563433167694,0.755399727941023,Au,PRUNED
3107,0.0,2026-04-07 11:33:41.833339,2026-04-07 11:33:42.588680,0 days 00:00:00.755341,20.259148218613177,17.583843857934276,0.98829987338523,Au,PRUNED
3108,0.0,2026-04-07 11:33:41.916061,2026-04-07 11:33:42.573074,0 days 00:00:00.657013,30.609340239220824,19.93920530485538,0.9515658286435242,Au,PRUNED
3109,-6.410256410255424,2026-04-07 11:33:41.991231,2026-04-07 11:33:42.664195,0 days 00:00:00.672964,21.985434855854884,19.916501237243757,0.7312497361448339,Au,PRUNED
3110,-1.0,2026-04-07 11:33:42.172302,2026-04-07 11:33:42.629818,0 days 00:00:00.457516,22.409824294624677,16.631552336332867,0.7306981323967446,Au,COMPLETE
3111,0.0,2026-04-07 11:33:42.204009,2026-04-07 11:33:43.147907,0 days 00:00:00.943898,21.007446591705136,16.916475601000762,0.8934786772635246,Au,PRUNED
3112,-1.4880952380950254,2026-04-07 11:33:42.339011,2026-04-07 11:33:43.342586,0 days 00:00:01.003575,22.323116759444712,19.959212785962333,0.8905702574799275,Au,PRUNED
3113,-1.0,2026-04-07 11:33:42.500150,2026-04-07 11:33:43.219227,0 days 00:00:00.719077,23.52418457195913,19.877902395971624,1.087269408187663,Au,COMPLETE
3114,-1.0,2026-04-07 11:33:42.545840,2026-04-07 11:33:43.163872,0 days 00:00:00.618032,28.87445077871586,19.98346367503928,1.0240754528771723,Au,COMPLETE
3115,-1.0,2026-04-07 11:33:42.695776,2026-04-07 11:33:43.256583,0 days 00:00:00.560807,31.699472601189452,16.99870420787201,0.7259188067113015,Au,COMPLETE
3116,0.0,2026-04-07 11:33:42.727269,2026-04-07 11:33:43.343586,0 days 00:00:00.616317,33.791635521993655,19.98979602153923,1.2731172741648589,Au,PRUNED
3117,0.0,2026-04-07 11:33:42.781048,2026-04-07 11:33:43.344586,0 days 00:00:00.563538,20.418220223554794,18.09685264920111,0.84946078632791,Au,PRUNED
3118,82.41421568627209,2026-04-07 11:33:42.899919,2026-04-07 11:33:43.704259,0 days 00:00:00.804340,24.875331137603766,19.786372031495915,0.9281894756194458,Au,PRUNED
3119,-1.0,2026-04-07 11:33:43.291063,2026-04-07 11:33:43.847705,0 days 00:00:00.556642,20.032408071387216,19.4947262461808,0.9892395431120083,Au,COMPLETE
3120,0.0,2026-04-07 11:33:43.402134,2026-04-07 11:33:44.307318,0 days 00:00:00.905184,35.617595898513045,16.581354540106158,1.0819291679216374,Au,PRUNED
3121,-0.7002801120448061,2026-04-07 11:33:43.465038,2026-04-07 11:33:44.307318,0 days 00:00:00.842280,81.97683411696772,15.953445237626502,0.5545600114086537,Au,PRUNED
3122,-1.0,2026-04-07 11:33:43.493484,2026-04-07 11:33:44.224607,0 days 00:00:00.731123,46.4115968868786,19.84673091582445,0.9783549674834839,Au,COMPLETE
3123,-1.0,2026-04-07 11:33:43.525447,2026-04-07 11:33:43.991451,0 days 00:00:00.466004,27.746313323916564,19.964450344065764,1.0357521948941346,Au,COMPLETE
3124,-1.0,2026-04-07 11:33:43.555385,2026-04-07 11:33:44.162764,0 days 00:00:00.607379,34.315677104705216,17.780703868776786,1.0201830138308787,Au,COMPLETE
3125,-375.2777777777274,2026-04-07 11:33:43.586168,2026-04-07 11:33:44.350375,0 days 00:00:00.764207,20.134456439759102,19.899294101238244,0.6956854855091539,Au,COMPLETE
3126,-9.9999999999984,2026-04-07 11:33:43.807478,2026-04-07 11:33:44.425195,0 days 00:00:00.617717,21.31707825311184,19.884640485912826,0.862549298524122,Au,PRUNED
3127,-1.0,2026-04-07 11:33:44.040124,2026-04-07 11:33:44.702173,0 days 00:00:00.662049,20.477946200049136,19.74069991253409,0.914714544285856,Au,COMPLETE
3128,-9.615384615383135,2026-04-07 11:33:44.112040,2026-04-07 11:33:44.767237,0 days 00:00:00.655197,21.5571914565393,19.70254731135433,0.9577144202786129,Au,PRUNED
3129,-1.0,2026-04-07 11:33:44.374165,2026-04-07 11:33:44.893939,0 days 00:00:00.519774,20.721596644189518,17.665053539606106,0.9498580898802289,Au,COMPLETE
3130,0.0,2026-04-07 11:33:44.399769,2026-04-07 11:33:45.109583,0 days 00:00:00.709814,20.980869171229745,17.673964967872465,1.2289013681347654,Au,PRUNED
3131,4.6296296296292185,2026-04-07 11:33:44.451806,2026-04-07 11:33:45.032299,0 days 00:00:00.580493,37.656299862771306,19.972299820099085,1.0121093487249742,Ag,PRUNED
3132,-1.0,2026-04-07 11:33:44.463350,2026-04-07 11:33:45.110563,0 days 00:00:00.647213,31.786494414252275,19.948238870339605,0.858788020096292,Au,COMPLETE
3133,-1.0,2026-04-07 11:33:44.425195,2026-04-07 11:33:44.994997,0 days 00:00:00.569802,20.396142533553164,19.97074565691512,1.1983649178293039,Au,COMPLETE
3134,-1.0,2026-04-07 11:33:44.618745,2026-04-07 11:33:45.274024,0 days 00:00:00.655279,21.498443134249076,19.702491433825116,0.9566667457876239,Au,COMPLETE
3135,-1.0,2026-04-07 11:33:44.896952,2026-04-07 11:33:45.469368,0 days 00:00:00.572416,21.44219275841138,19.993305166210142,0.7917499330053694,Au,COMPLETE
3136,0.0,2026-04-07 11:33:45.024211,2026-04-07 11:33:45.426439,0 days 00:00:00.402228,35.309589317268916,17.242663026767588,1.0785506788630626,Au,PRUNED
3137,-1.0,2026-04-07 11:33:45.010062,2026-04-07 11:33:45.788563,0 days 00:00:00.778501,88.82852858694007,3.1643011221488244,1.9270330415473984,Cu,COMPLETE
3138,-1.0,2026-04-07 11:33:45.176478,2026-04-07 11:33:45.580488,0 days 00:00:00.404010,20.71807430543354,15.695033858194368,1.0355672667057152,Au,COMPLETE
3139,0.0,2026-04-07 11:33:45.225225,2026-04-07 11:33:45.798775,0 days 00:00:00.573550,33.368048438289804,17.711612347154595,0.7771231244198803,Au,PRUNED
3140,0.0,2026-04-07 11:33:45.288273,2026-04-07 11:33:45.919098,0 days 00:00:00.630825,32.632814865536204,19.96477884118939,1.1684623429056784,Au,PRUNED
3141,-411.23188405791177,2026-04-07 11:33:45.452730,2026-04-07 11:33:46.227057,0 days 00:00:00.774327,20.580673062735865,19.495250697002007,1.2846800757886545,Au,COMPLETE
3142,0.0,2026-04-07 11:33:45.504175,2026-04-07 11:33:46.223872,0 days 00:00:00.719697,20.73681260021266,15.380142584495516,1.1010181623484618,Au,PRUNED
3143,79.62962962962726,2026-04-07 11:33:45.518503,2026-04-07 11:33:46.279683,0 days 00:00:00.761180,32.13064203638823,16.991001463957193,0.9254863978510925,Au,PRUNED
3144,0.0,2026-04-07 11:33:45.699557,2026-04-07 11:33:46.403118,0 days 00:00:00.703561,34.980715049733476,16.88388800079406,1.0848751838506145,Au,PRUNED
3145,0.0,2026-04-07 11:33:45.856846,2026-04-07 11:33:46.546453,0 days 00:00:00.689607,34.526587107516896,19.928543215520374,0.7911514928476118,Au,PRUNED
3146,-1.0,2026-04-07 11:33:46.050639,2026-04-07 11:33:46.628368,0 days 00:00:00.577729,20.03923560941481,15.370072156569567,1.1326268952027523,Au,COMPLETE
3147,-1.0,2026-04-07 11:33:46.108399,2026-04-07 11:33:46.814393,0 days 00:00:00.705994,20.183937224777385,19.036121813450386,1.2956500546143037,Au,COMPLETE
3148,0.0,2026-04-07 11:33:46.111404,2026-04-07 11:33:46.814393,0 days 00:00:00.702989,39.966734397281755,19.959871028520553,1.4796059267970052,Au,PRUNED
3149,0.0,2026-04-07 11:33:46.333108,2026-04-07 11:33:47.158546,0 days 00:00:00.825438,30.267799213256495,19.69902098868029,1.7056637697029955,Au,PRUNED
3150,-1.0,2026-04-07 11:33:46.414482,2026-04-07 11:33:46.891304,0 days 00:00:00.476822,30.601562799797524,17.229763684350935,1.3211145287999297,Au,COMPLETE
3151,0.0,2026-04-07 11:33:46.495866,2026-04-07 11:33:47.124542,0 days 00:00:00.628676,32.952377397881804,17.97187825955077,1.315755139345903,Au,PRUNED
3152,-1.0,2026-04-07 11:33:46.541129,2026-04-07 11:33:46.986361,0 days 00:00:00.445232,20.57508578120954,19.962983131204613,1.4562200169268746,Au,COMPLETE
3153,0.0,2026-04-07 11:33:46.627357,2026-04-07 11:33:47.239761,0 days 00:00:00.612404,20.25739870993668,18.292113041545285,1.1281898004258237,Au,PRUNED
3154,-1.0,2026-04-07 11:33:46.759179,2026-04-07 11:33:47.520075,0 days 00:00:00.760896,37.6126845593073,19.98920744608543,1.3251489296955197,Au,COMPLETE
3155,0.0,2026-04-07 11:33:46.885197,2026-04-07 11:33:47.534877,0 days 00:00:00.649680,25.918758167389925,19.799835105474333,1.378741256957507,Au,PRUNED
3156,0.0,2026-04-07 11:33:47.086840,2026-04-07 11:33:47.649573,0 days 00:00:00.562733,28.254874292137686,19.87439825843572,1.4431279637534478,Au,PRUNED
3157,0.0,2026-04-07 11:33:47.194893,2026-04-07 11:33:48.046345,0 days 00:00:00.851452,30.05713366409057,19.458100698264463,1.3338189927532846,Au,PRUNED
3158,-1.0,2026-04-07 11:33:47.178289,2026-04-07 11:33:47.935734,0 days 00:00:00.757445,29.34115815979753,19.945710601133964,1.4039987453555236,Au,COMPLETE
3159,-1.0,2026-04-07 11:33:47.238759,2026-04-07 11:33:47.814472,0 days 00:00:00.575713,39.625280407371264,19.967165257195333,1.0996084002271762,Au,COMPLETE
3160,21.98162729658758,2026-04-07 11:33:47.308798,2026-04-07 11:33:47.922919,0 days 00:00:00.614121,78.59196139626243,9.327269870186393,1.0123343470932458,Au,PRUNED
3161,-1.0,2026-04-07 11:33:47.444311,2026-04-07 11:33:48.195867,0 days 00:00:00.751556,21.48250083369163,19.73433022153929,1.2828062677593859,Au,COMPLETE
3162,-1.0,2026-04-07 11:33:47.574955,2026-04-07 11:33:48.235411,0 days 00:00:00.660456,33.01554080283426,19.94907830211417,1.2557956940422177,Au,COMPLETE
3163,0.0,2026-04-07 11:33:47.654091,2026-04-07 11:33:48.289394,0 days 00:00:00.635303,37.85198509677138,17.711868028191414,1.215776004254737,Au,PRUNED
3164,0.0,2026-04-07 11:33:47.752579,2026-04-07 11:33:48.397628,0 days 00:00:00.645049,30.43111845629465,19.929185684348838,1.6288769503399712,Au,PRUNED
3165,-1.0,2026-04-07 11:33:47.997612,2026-04-07 11:33:48.628103,0 days 00:00:00.630491,35.162115829282,16.589441270473646,0.9318329825053666,Au,COMPLETE
3166,-1.0,2026-04-07 11:33:48.124487,2026-04-07 11:33:48.812861,0 days 00:00:00.688374,20.16823600454441,16.745213853474453,0.7479431536971506,Au,COMPLETE
3167,-1.0,2026-04-07 11:33:48.150387,2026-04-07 11:33:48.770012,0 days 00:00:00.619625,20.57592610241641,17.472130521189868,0.6982886126540558,Au,COMPLETE
3168,0.0,2026-04-07 11:33:48.129007,2026-04-07 11:33:48.858550,0 days 00:00:00.729543,35.419852981518474,17.443553154589353,0.9037304501674575,Au,PRUNED
3169,0.0,2026-04-07 11:33:48.360434,2026-04-07 11:33:48.874721,0 days 00:00:00.514287,20.81089772238316,16.964058841528736,0.9314826195705677,Au,PRUNED
3170,0.0,2026-04-07 11:33:48.470089,2026-04-07 11:33:49.050621,0 days 00:00:00.580532,48.88834520749785,19.702595449991676,0.8145027510175478,Au,PRUNED
3171,-1.0,2026-04-07 11:33:48.485197,2026-04-07 11:33:48.919002,0 days 00:00:00.433805,38.801502630081444,17.906344875483835,0.7723991808858006,Au,COMPLETE
3172,-1.0,2026-04-07 11:33:48.512437,2026-04-07 11:33:49.292106,0 days 00:00:00.779669,37.43545412190455,19.961304215064192,0.9162157457678829,Au,COMPLETE
3173,0.0,2026-04-07 11:33:48.917992,2026-04-07 11:33:49.822005,0 days 00:00:00.904013,36.92182754359902,16.69366957121033,1.2191813667231004,Au,PRUNED
3174,-1.0,2026-04-07 11:33:48.929382,2026-04-07 11:33:49.359207,0 days 00:00:00.429825,20.069839051626037,16.749697996909152,0.8957145961178117,Au,COMPLETE
3175,-1.0,2026-04-07 11:33:48.968702,2026-04-07 11:33:49.495649,0 days 00:00:00.526947,21.257203370387437,19.703926782920117,1.4604247462150113,Au,COMPLETE
3176,-1.0,2026-04-07 11:33:49.008490,2026-04-07 11:33:49.485311,0 days 00:00:00.476821,22.25616490535032,19.978989189530147,1.1941865772052178,Au,COMPLETE
3177,-1.0,2026-04-07 11:33:49.092421,2026-04-07 11:33:49.782553,0 days 00:00:00.690132,36.035118432869034,17.50303687221848,1.0203412572038817,Au,COMPLETE
3178,0.0,2026-04-07 11:33:49.107972,2026-04-07 11:33:49.782553,0 days 00:00:00.674581,37.0513262798012,19.92981203974147,0.7252639075641648,Au,PRUNED
3179,0.0,2026-04-07 11:33:49.209269,2026-04-07 11:33:49.779573,0 days 00:00:00.570304,20.56602310032464,17.075846234468735,1.152093972077697,Au,PRUNED
3180,-1.0,2026-04-07 11:33:49.458445,2026-04-07 11:33:49.933796,0 days 00:00:00.475351,20.363105629613703,17.58719618045428,1.1926697715556633,Au,COMPLETE
3181,0.0,2026-04-07 11:33:49.486311,2026-04-07 11:33:50.276866,0 days 00:00:00.790555,20.97966880830593,16.557629781807513,1.146251655660636,Au,PRUNED
3182,-1.0,2026-04-07 11:33:49.704901,2026-04-07 11:33:50.314334,0 days 00:00:00.609433,22.166010681002014,19.915490680806755,1.027847743607919,Au,COMPLETE
3183,0.0,2026-04-07 11:33:49.718093,2026-04-07 11:33:50.237390,0 days 00:00:00.519297,20.741078444298264,17.986987724248213,1.2209631430065957,Au,PRUNED
3184,82.41421568627209,2026-04-07 11:33:49.878368,2026-04-07 11:33:50.717453,0 days 00:00:00.839085,23.78072262060964,19.986969433669504,1.7011440126646238,Au,PRUNED
3185,-1.0,2026-04-07 11:33:49.916775,2026-04-07 11:33:50.430516,0 days 00:00:00.513741,114.66763277095525,18.732111305725063,1.953166431673556,Cu,COMPLETE
3186,0.0,2026-04-07 11:33:49.958179,2026-04-07 11:33:50.579682,0 days 00:00:00.621503,33.084126155173095,19.89542408204673,1.0458748936213607,Au,PRUNED
3187,0.0,2026-04-07 11:33:49.990494,2026-04-07 11:33:50.801830,0 days 00:00:00.811336,20.290430662556528,16.86064407074328,1.108226630337558,Au,PRUNED
3188,-341.2093495934543,2026-04-07 11:33:50.121262,2026-04-07 11:33:50.773930,0 days 00:00:00.652668,20.028089408268812,18.84638364968786,1.3910199989458598,Au,COMPLETE
3189,-1.0,2026-04-07 11:33:50.323170,2026-04-07 11:33:50.996849,0 days 00:00:00.673679,27.218881965554502,19.916589981858934,0.8545986181279271,Au,COMPLETE
3190,-8.333333333332,2026-04-07 11:33:50.340048,2026-04-07 11:33:50.997847,0 days 00:00:00.657799,20.984714648380262,19.97644473069901,1.1366501175679395,Au,PRUNED
3191,-1.0,2026-04-07 11:33:50.401867,2026-04-07 11:33:51.072552,0 days 00:00:00.670685,35.537673569733016,17.455197315647474,1.2629970367200842,Au,COMPLETE
3192,-1.0,2026-04-07 11:33:50.649036,2026-04-07 11:33:51.209992,0 days 00:00:00.560956,20.52735994693566,19.572896307685074,0.6510191218891548,Au,COMPLETE
3193,-1.0,2026-04-07 11:33:50.712101,2026-04-07 11:33:51.648511,0 days 00:00:00.936410,32.20069855442617,16.46112765768107,1.1915803400503113,Au,COMPLETE
3194,-1.0,2026-04-07 11:33:50.869545,2026-04-07 11:33:51.516262,0 days 00:00:00.646717,39.00335922376328,19.861472513081395,1.0652050719723272,Au,COMPLETE
3195,-1.0,2026-04-07 11:33:50.882460,2026-04-07 11:33:51.430682,0 days 00:00:00.548222,20.96526245888698,19.671811469305116,1.3091198063163634,Au,COMPLETE
3196,-420.98765432092506,2026-04-07 11:33:51.096244,2026-04-07 11:33:51.773603,0 days 00:00:00.677359,20.384899679054772,19.635367302167992,1.456145035188159,Au,COMPLETE
3197,-354.9578059071283,2026-04-07 11:33:51.126279,2026-04-07 11:33:51.651566,0 days 00:00:00.525287,20.094226250603803,19.481863076708812,0.8957811420879351,Au,COMPLETE
3198,-1.0,2026-04-07 11:33:51.164553,2026-04-07 11:33:51.649555,0 days 00:00:00.485002,22.991004041755378,19.758798391277928,1.3617069099211818,Au,COMPLETE
3199,-1.0,2026-04-07 11:33:51.267202,2026-04-07 11:33:51.760008,0 days 00:00:00.492806,35.66690043656342,17.58691483612904,0.7073109475430963,Au,COMPLETE
3200,-2.21088435374146,2026-04-07 11:33:51.380849,2026-04-07 11:33:51.963799,0 days 00:00:00.582950,112.8504028542022,1.754208855546553,1.1609962819943773,Au,PRUNED
3201,0.0,2026-04-07 11:33:51.646916,2026-04-07 11:33:52.297015,0 days 00:00:00.650099,30.78351200280907,19.878739280920694,0.6935269239812606,Au,PRUNED
3202,0.0,2026-04-07 11:33:51.719783,2026-04-07 11:33:52.341681,0 days 00:00:00.621898,38.60665364062476,19.90076419812048,1.7616446183653707,Au,PRUNED
3203,-1.0,2026-04-07 11:33:51.852199,2026-04-07 11:33:52.611308,0 days 00:00:00.759109,28.707283398777925,19.84544126753091,1.6434776692177504,Au,COMPLETE
3204,0.0,2026-04-07 11:33:51.807249,2026-04-07 11:33:52.513990,0 days 00:00:00.706741,38.97620401031834,19.976205269640953,1.5292688795973888,Au,PRUNED
3205,-1.0,2026-04-07 11:33:51.930694,2026-04-07 11:33:52.689236,0 days 00:00:00.758542,46.83626069252027,19.30305756029452,1.5706683851974685,Au,COMPLETE
3206,-1.0,2026-04-07 11:33:51.962799,2026-04-07 11:33:52.534569,0 days 00:00:00.571770,28.05867401976249,17.358795194343433,1.355049601842239,Au,COMPLETE
3207,0.0,2026-04-07 11:33:51.979596,2026-04-07 11:33:52.574619,0 days 00:00:00.595023,24.47629734629195,19.88634186359886,1.7977310060565468,Au,PRUNED
3208,-0.5144032921810615,2026-04-07 11:33:52.067074,2026-04-07 11:33:52.919818,0 days 00:00:00.852744,81.98461349917409,11.878049330331017,0.509572389401215,Au,PRUNED
3209,0.0,2026-04-07 11:33:52.342685,2026-04-07 11:33:53.035156,0 days 00:00:00.692471,34.91832383195359,19.962796881988513,1.1610408665119734,Au,PRUNED
3210,-414.537712895316,2026-04-07 11:33:52.392171,2026-04-07 11:33:53.160896,0 days 00:00:00.768725,20.601282347623922,19.247170465151843,1.6568884793231697,Au,COMPLETE
3211,-1.0,2026-04-07 11:33:52.579642,2026-04-07 11:33:53.176326,0 days 00:00:00.596684,21.805926415157174,16.654449987893955,0.8850346294060198,Au,COMPLETE
3212,0.0,2026-04-07 11:33:52.615102,2026-04-07 11:33:53.361298,0 days 00:00:00.746196,20.519901704534195,18.212661523218696,0.7309079087579977,Au,PRUNED
3213,-1.0,2026-04-07 11:33:52.772957,2026-04-07 11:33:53.392327,0 days 00:00:00.619370,34.80005977210628,19.869058261762458,1.4318201117715466,Ag,COMPLETE
3214,0.0,2026-04-07 11:33:52.841175,2026-04-07 11:33:53.474115,0 days 00:00:00.632940,32.88399206170811,19.58833300937137,1.4441391909357,Au,PRUNED
3215,0.0,2026-04-07 11:33:52.986774,2026-04-07 11:33:53.781188,0 days 00:00:00.794414,25.12624374014422,19.966942117359256,1.7161710445171803,Au,PRUNED
3216,-1.0,2026-04-07 11:33:53.042904,2026-04-07 11:33:53.796277,0 days 00:00:00.753373,31.482477728763207,19.55362252301951,1.5458665901147353,Au,COMPLETE
3217,-1.0,2026-04-07 11:33:53.120377,2026-04-07 11:33:53.828471,0 days 00:00:00.708094,54.21565203626885,14.919962547653768,1.1065796851175063,Ag,COMPLETE
3218,82.41421568627209,2026-04-07 11:33:53.324557,2026-04-07 11:33:54.049791,0 days 00:00:00.725234,24.5003023748918,19.27765433144231,1.6283917896564188,Au,PRUNED
3219,-1.0,2026-04-07 11:33:53.379408,2026-04-07 11:33:53.747787,0 days 00:00:00.368379,33.43537875799908,17.077083373234366,1.4499317927338835,Au,COMPLETE
3220,0.0,2026-04-07 11:33:53.418494,2026-04-07 11:33:54.049791,0 days 00:00:00.631297,20.050740210813217,18.268218295848342,1.4293639556096993,Au,PRUNED
3221,-1.0,2026-04-07 11:33:53.568863,2026-04-07 11:33:54.139586,0 days 00:00:00.570723,23.944992695439616,19.428195499666327,1.5934242878305378,Au,COMPLETE
3222,0.0,2026-04-07 11:33:53.629293,2026-04-07 11:33:54.579914,0 days 00:00:00.950621,35.759280400564975,19.433550317431326,1.6579002648147814,Au,PRUNED
3223,0.0,2026-04-07 11:33:53.924817,2026-04-07 11:33:54.578908,0 days 00:00:00.654091,38.61344828187035,18.061168917738776,1.495907964273321,Au,PRUNED
3224,0.0,2026-04-07 11:33:53.990078,2026-04-07 11:33:54.642531,0 days 00:00:00.652453,30.087590017122693,19.395543277511845,1.5287453988415112,Au,PRUNED
