number,value,datetime_start,datetime_complete,duration,params_D2_nm,params_D3_nm,params_D4_nm,params_metal,state
4756,-1.0,2026-04-07 11:36:37.360346,2026-04-07 11:36:38.230256,0 days 00:00:00.869910,41.465576658997335,16.16754712748769,0.718474380662252,Au,COMPLETE
4757,-1.0,2026-04-07 11:36:37.624774,2026-04-07 11:36:38.387219,0 days 00:00:00.762445,47.7106543324542,16.67902905159829,0.668214882953184,Au,COMPLETE
4758,-377.79642058160425,2026-04-07 11:36:37.725891,2026-04-07 11:36:38.420307,0 days 00:00:00.694416,20.864042752640742,19.57536625793672,0.45488257015844186,Au,COMPLETE
4759,-1.0,2026-04-07 11:36:37.766046,2026-04-07 11:36:38.293655,0 days 00:00:00.527609,29.815155453021468,17.77133111772592,0.797161013899099,Au,COMPLETE
4760,-1.0,2026-04-07 11:36:37.795667,2026-04-07 11:36:38.449284,0 days 00:00:00.653617,36.14660327545677,16.824195059142063,0.6082613172434643,Au,COMPLETE
4761,0.0,2026-04-07 11:36:37.817242,2026-04-07 11:36:38.416235,0 days 00:00:00.598993,31.496050354002826,14.356073072166598,0.8364107592122183,Au,PRUNED
4762,0.0,2026-04-07 11:36:38.012048,2026-04-07 11:36:38.886388,0 days 00:00:00.874340,20.538571196678024,17.22953030018745,0.8115982942719366,Au,PRUNED
4763,-1.0,2026-04-07 11:36:38.157029,2026-04-07 11:36:38.912363,0 days 00:00:00.755334,20.158714098023587,19.814820191113757,0.8318802358248785,Au,COMPLETE
4764,-1.0,2026-04-07 11:36:38.453321,2026-04-07 11:36:39.161855,0 days 00:00:00.708534,22.59823892001811,19.922665565144182,0.774875779989469,Au,COMPLETE
4765,-1.0,2026-04-07 11:36:38.508686,2026-04-07 11:36:39.267549,0 days 00:00:00.758863,41.221043131295886,17.477976409965965,0.5706417619349566,Au,COMPLETE
4766,-1.0,2026-04-07 11:36:38.567409,2026-04-07 11:36:39.199452,0 days 00:00:00.632043,32.39876588064636,17.13269304037098,0.6857113339149319,Au,COMPLETE
4767,-1.0,2026-04-07 11:36:38.647935,2026-04-07 11:36:39.336046,0 days 00:00:00.688111,40.23581378499485,17.41083257827754,0.5007115583367263,Au,COMPLETE
4768,-1.0,2026-04-07 11:36:38.741302,2026-04-07 11:36:39.320291,0 days 00:00:00.578989,20.566309371669963,19.916345849730842,0.613052758339585,Au,COMPLETE
4769,0.0,2026-04-07 11:36:38.851680,2026-04-07 11:36:39.477087,0 days 00:00:00.625407,35.445635493234505,16.843071130257798,0.6989853314557926,Au,PRUNED
4770,-1.0,2026-04-07 11:36:39.003234,2026-04-07 11:36:39.475284,0 days 00:00:00.472050,20.0438963792402,17.44431150385921,0.7185452513755132,Au,COMPLETE
4771,-19.60784313725029,2026-04-07 11:36:39.091251,2026-04-07 11:36:39.896131,0 days 00:00:00.804880,42.38395350762994,2.082379624450752,1.3032063206149234,Ag,PRUNED
4772,79.93827160493589,2026-04-07 11:36:39.298921,2026-04-07 11:36:39.989629,0 days 00:00:00.690708,30.761310894142575,17.589820243108054,0.8400851361080546,Au,PRUNED
4773,-1.0,2026-04-07 11:36:39.339059,2026-04-07 11:36:40.053327,0 days 00:00:00.714268,25.59507479697926,19.994970919506514,0.413879779636845,Au,COMPLETE
4774,-0.8928571428571173,2026-04-07 11:36:39.493654,2026-04-07 11:36:40.342344,0 days 00:00:00.848690,20.228218523434357,17.107300526249706,0.39663279922944916,Ag,PRUNED
4775,-1.0,2026-04-07 11:36:39.537900,2026-04-07 11:36:40.158707,0 days 00:00:00.620807,32.655607364141936,17.64525415496021,0.19099591785208825,Au,COMPLETE
4776,77.25060827250383,2026-04-07 11:36:39.606913,2026-04-07 11:36:40.230233,0 days 00:00:00.623320,33.23960819799037,19.903151570202045,0.7609346843569015,Cu,PRUNED
4777,0.0,2026-04-07 11:36:39.622441,2026-04-07 11:36:40.522556,0 days 00:00:00.900115,35.20490936835453,19.999647943800827,0.6932211676800181,Au,PRUNED
4778,-1.0,2026-04-07 11:36:39.839970,2026-04-07 11:36:40.518489,0 days 00:00:00.678519,33.947811139711476,19.96553630437487,0.6387027211471036,Ag,COMPLETE
4779,-21.551724137928062,2026-04-07 11:36:39.956605,2026-04-07 11:36:40.727999,0 days 00:00:00.771394,74.64250028328684,10.940732011391352,1.5769671804843615,Ag,PRUNED
4780,-1.0,2026-04-07 11:36:40.072128,2026-04-07 11:36:40.740206,0 days 00:00:00.668078,30.322574403389517,17.592897352983233,0.5077454757098236,Au,COMPLETE
4781,0.0,2026-04-07 11:36:40.322200,2026-04-07 11:36:41.087070,0 days 00:00:00.764870,20.86517348369984,17.89409177412931,0.6122103670992227,Au,PRUNED
4782,0.0,2026-04-07 11:36:40.351300,2026-04-07 11:36:41.243839,0 days 00:00:00.892539,20.80183067424973,16.074218210580263,0.868900264875845,Au,PRUNED
4783,0.0,2026-04-07 11:36:40.378245,2026-04-07 11:36:41.156325,0 days 00:00:00.778080,20.3260074286288,17.691470079650447,0.6105756005844705,Au,PRUNED
4784,0.0,2026-04-07 11:36:40.406214,2026-04-07 11:36:41.159395,0 days 00:00:00.753181,20.474863072647526,17.87001855344434,0.8089752127419572,Au,PRUNED
4785,-1.0,2026-04-07 11:36:40.662929,2026-04-07 11:36:41.246848,0 days 00:00:00.583919,20.235803736679593,16.678336428121632,0.31651595288945406,Au,COMPLETE
4786,-1.0,2026-04-07 11:36:40.691336,2026-04-07 11:36:41.492881,0 days 00:00:00.801545,31.70430194861759,19.983574922022438,0.48090363144815096,Au,COMPLETE
4787,0.0,2026-04-07 11:36:40.862736,2026-04-07 11:36:41.616676,0 days 00:00:00.753940,20.5370248848075,17.524359698048478,0.39986484656917254,Au,PRUNED
4788,-1.0,2026-04-07 11:36:40.993770,2026-04-07 11:36:41.769792,0 days 00:00:00.776022,30.636539129507714,13.00121628144389,0.4087302151348876,Au,COMPLETE
4789,-1.0,2026-04-07 11:36:41.179677,2026-04-07 11:36:42.114375,0 days 00:00:00.934698,20.37241486330847,13.431653087795405,0.13667796320520392,Au,COMPLETE
4790,0.0,2026-04-07 11:36:41.234450,2026-04-07 11:36:41.955347,0 days 00:00:00.720897,45.95635674656128,17.67474838884868,0.5782251011560323,Au,PRUNED
4791,-1.0,2026-04-07 11:36:41.248330,2026-04-07 11:36:41.819018,0 days 00:00:00.570688,78.31816082269984,19.9509386162395,0.9062846331465111,Au,COMPLETE
4792,0.0,2026-04-07 11:36:41.340281,2026-04-07 11:36:42.222871,0 days 00:00:00.882590,20.174058019637407,19.47701919335423,0.569418502707822,Au,PRUNED
4793,-1.0,2026-04-07 11:36:41.509726,2026-04-07 11:36:42.175380,0 days 00:00:00.665654,31.823728776327826,19.78696365354845,0.7534022949235804,Au,COMPLETE
4794,-375.5555555555051,2026-04-07 11:36:41.594876,2026-04-07 11:36:42.255568,0 days 00:00:00.660692,20.25264096024968,19.840491156942434,0.6869654088420548,Au,COMPLETE
4795,-1.0,2026-04-07 11:36:41.725213,2026-04-07 11:36:42.309897,0 days 00:00:00.584684,94.53928151765088,5.370738811653018,1.1605558911955636,Au,COMPLETE
4796,0.0,2026-04-07 11:36:41.983330,2026-04-07 11:36:42.893304,0 days 00:00:00.909974,32.44884935647297,17.62943270638929,0.8680171117925204,Au,PRUNED
4797,-9.374999999999062,2026-04-07 11:36:42.017680,2026-04-07 11:36:42.998062,0 days 00:00:00.980382,29.418315471123215,6.203611308864359,0.700460923054389,Ag,PRUNED
4798,0.0,2026-04-07 11:36:42.064591,2026-04-07 11:36:42.686812,0 days 00:00:00.622221,38.16229819889824,17.548975161898298,0.6641713920953196,Au,PRUNED
4799,0.0,2026-04-07 11:36:42.354039,2026-04-07 11:36:43.149465,0 days 00:00:00.795426,29.31361328237176,19.97212111159979,0.8868362904106678,Au,PRUNED
4800,-1.0,2026-04-07 11:36:42.388955,2026-04-07 11:36:42.840886,0 days 00:00:00.451931,27.48971389344768,19.973808708591857,0.794473439795953,Au,COMPLETE
4801,-18.678160919537653,2026-04-07 11:36:42.412570,2026-04-07 11:36:43.152975,0 days 00:00:00.740405,48.87732503356879,10.001207871894168,1.9388493079523221,Ag,PRUNED
4802,-11.06770833333165,2026-04-07 11:36:42.438837,2026-04-07 11:36:43.184248,0 days 00:00:00.745411,21.359301119598168,19.8566590759934,0.8108983654014609,Au,COMPLETE
4803,-1.0,2026-04-07 11:36:42.467233,2026-04-07 11:36:43.019511,0 days 00:00:00.552278,23.36752438795165,19.45139680495149,0.7236446439757638,Ag,COMPLETE
4804,-1.0,2026-04-07 11:36:42.764216,2026-04-07 11:36:43.585512,0 days 00:00:00.821296,20.093664848673672,15.746094122474751,0.8258998331217693,Au,COMPLETE
4805,-1.0,2026-04-07 11:36:43.053022,2026-04-07 11:36:43.721004,0 days 00:00:00.667982,23.193669757932337,19.91749859177505,0.6722169076721616,Au,COMPLETE
4806,0.0,2026-04-07 11:36:43.069402,2026-04-07 11:36:43.942770,0 days 00:00:00.873368,36.07251729183103,19.885025443258204,0.5467447765790424,Au,PRUNED
4807,0.0,2026-04-07 11:36:43.122559,2026-04-07 11:36:44.002617,0 days 00:00:00.880058,20.980111595490452,17.780055331188034,0.704359340681381,Au,PRUNED
4808,-1.0,2026-04-07 11:36:43.152975,2026-04-07 11:36:43.904290,0 days 00:00:00.751315,31.053523331352224,19.843198692553457,0.46142714336262164,Au,COMPLETE
4809,-1.0,2026-04-07 11:36:43.280587,2026-04-07 11:36:43.969610,0 days 00:00:00.689023,32.88812190796817,17.99646326600912,0.6433332188549749,Au,COMPLETE
4810,0.0,2026-04-07 11:36:43.301976,2026-04-07 11:36:44.003193,0 days 00:00:00.701217,20.397810647112827,17.31175845488868,0.9073417409541119,Au,PRUNED
4811,-1.0,2026-04-07 11:36:43.376025,2026-04-07 11:36:44.229058,0 days 00:00:00.853033,20.439382521836137,19.43191543138404,0.5576268542684216,Au,COMPLETE
4812,-401.59574468079353,2026-04-07 11:36:43.717411,2026-04-07 11:36:44.282215,0 days 00:00:00.564804,20.446458298094953,19.849845994587923,0.8436932573460889,Au,COMPLETE
4813,0.0,2026-04-07 11:36:44.054561,2026-04-07 11:36:44.771187,0 days 00:00:00.716626,36.495739654299406,17.826450461320253,0.940078348424516,Au,PRUNED
4814,5.787037037036394,2026-04-07 11:36:44.077125,2026-04-07 11:36:44.834007,0 days 00:00:00.756882,29.49356640627078,16.390960326486088,0.7102856113399236,Au,PRUNED
4815,0.0,2026-04-07 11:36:44.092572,2026-04-07 11:36:44.691730,0 days 00:00:00.599158,35.90842652180348,17.74855148592645,0.8236805531512924,Au,PRUNED
4816,0.0,2026-04-07 11:36:44.115702,2026-04-07 11:36:45.098923,0 days 00:00:00.983221,20.21834921719313,16.81955779960712,0.27850409558696243,Au,PRUNED
4817,-1.0,2026-04-07 11:36:44.143869,2026-04-07 11:36:44.889772,0 days 00:00:00.745903,31.235518713435432,18.564864394205042,0.8080766031208862,Au,COMPLETE
4818,-1.0,2026-04-07 11:36:44.180527,2026-04-07 11:36:44.690732,0 days 00:00:00.510205,43.41156594849964,18.000463670378245,0.8559839973828838,Au,COMPLETE
4819,0.0,2026-04-07 11:36:44.384804,2026-04-07 11:36:45.224284,0 days 00:00:00.839480,35.30141012534933,19.930562635933075,0.8239862761617051,Au,PRUNED
4820,-1.0,2026-04-07 11:36:44.551155,2026-04-07 11:36:45.192124,0 days 00:00:00.640969,20.961346770219368,17.575145838022024,0.36695505483183377,Au,COMPLETE
4821,0.0,2026-04-07 11:36:44.803604,2026-04-07 11:36:45.632558,0 days 00:00:00.828954,32.06179274947026,17.37418792380992,0.7002310206518118,Au,PRUNED
4822,-11.054421768706579,2026-04-07 11:36:44.858492,2026-04-07 11:36:45.563941,0 days 00:00:00.705449,87.9448579541773,8.917454732723929,1.8158557831215751,Ag,PRUNED
4823,-1.0,2026-04-07 11:36:44.914091,2026-04-07 11:36:45.783587,0 days 00:00:00.869496,35.74042935081336,19.964816170107362,0.9008350683603895,Au,COMPLETE
4824,-1.0,2026-04-07 11:36:44.984118,2026-04-07 11:36:45.487410,0 days 00:00:00.503292,34.03962813368969,15.224776690656363,0.7052505302732696,Au,COMPLETE
4825,-1.0,2026-04-07 11:36:45.160323,2026-04-07 11:36:45.723257,0 days 00:00:00.562934,31.06469936842316,17.150990443414127,0.1484163652293336,Au,COMPLETE
4826,-0.6265664160400909,2026-04-07 11:36:45.263443,2026-04-07 11:36:46.197046,0 days 00:00:00.933603,63.94764879911226,10.541421259674742,1.7318826706428785,Cu,PRUNED
4827,-1.0,2026-04-07 11:36:45.285354,2026-04-07 11:36:45.892537,0 days 00:00:00.607183,34.791387093041806,17.39886304183987,0.8406291944384057,Au,COMPLETE
4828,0.0,2026-04-07 11:36:45.387512,2026-04-07 11:36:46.139531,0 days 00:00:00.752019,21.641417405211268,17.093965901124882,0.7463811043808584,Au,PRUNED
4829,-1.0,2026-04-07 11:36:45.663291,2026-04-07 11:36:46.171019,0 days 00:00:00.507728,21.837630584897305,14.424871576137582,0.44719092148649653,Au,COMPLETE
4830,-1.0,2026-04-07 11:36:45.693809,2026-04-07 11:36:46.507975,0 days 00:00:00.814166,74.44301278304961,14.44131279951966,0.6571455114410891,Ag,COMPLETE
4831,0.0,2026-04-07 11:36:45.717900,2026-04-07 11:36:46.419380,0 days 00:00:00.701480,20.536125918599343,17.078695988225626,0.2667854507323913,Au,PRUNED
4832,-1.0,2026-04-07 11:36:45.886134,2026-04-07 11:36:46.719774,0 days 00:00:00.833640,36.325799973189895,10.805158539089623,1.443725107972014,Ag,COMPLETE
4833,-1.0,2026-04-07 11:36:46.039052,2026-04-07 11:36:46.618453,0 days 00:00:00.579401,20.197052639899,14.789670617561194,0.4435133435934145,Au,COMPLETE
4834,-1.0,2026-04-07 11:36:46.080383,2026-04-07 11:36:46.722253,0 days 00:00:00.641870,21.06169688173091,19.53084700551392,0.483063229477638,Au,COMPLETE
4835,-1.0,2026-04-07 11:36:46.318010,2026-04-07 11:36:46.800794,0 days 00:00:00.482784,20.84379219596616,16.758308339995523,0.8538626184620773,Au,COMPLETE
4836,0.0,2026-04-07 11:36:46.335467,2026-04-07 11:36:46.928342,0 days 00:00:00.592875,39.62262962011866,19.89869684453148,0.41628268157036086,Au,PRUNED
4837,-1.0,2026-04-07 11:36:46.441446,2026-04-07 11:36:46.927341,0 days 00:00:00.485895,30.61044001802629,19.75476975856,0.9305054831154242,Au,COMPLETE
4838,-1.0,2026-04-07 11:36:46.533857,2026-04-07 11:36:47.067896,0 days 00:00:00.534039,26.611358700774502,19.979713185407615,0.88981823931427,Au,COMPLETE
4839,-1.0,2026-04-07 11:36:46.696206,2026-04-07 11:36:47.462276,0 days 00:00:00.766070,20.324654951132384,17.84567917777668,0.6828242812711862,Au,COMPLETE
4840,-1.0,2026-04-07 11:36:46.750671,2026-04-07 11:36:47.315545,0 days 00:00:00.564874,30.96297345037933,19.92997069652324,0.866241168623308,Au,COMPLETE
4841,-444.66145833326385,2026-04-07 11:36:46.931527,2026-04-07 11:36:47.646130,0 days 00:00:00.714603,21.750471151675,19.779542538914043,0.4062628017898007,Au,COMPLETE
4842,-1.0,2026-04-07 11:36:46.978803,2026-04-07 11:36:47.503445,0 days 00:00:00.524642,35.59087644883338,17.432754548296277,0.8057707351210179,Ag,COMPLETE
4843,-1.0,2026-04-07 11:36:46.999804,2026-04-07 11:36:47.604333,0 days 00:00:00.604529,20.5993155485834,17.950428438657013,0.8490710703437181,Au,COMPLETE
4844,-9.9999999999984,2026-04-07 11:36:47.058103,2026-04-07 11:36:47.875755,0 days 00:00:00.817652,21.70815689345957,19.972864428486137,0.6153073902744621,Au,PRUNED
4845,0.0,2026-04-07 11:36:47.186875,2026-04-07 11:36:48.000272,0 days 00:00:00.813397,34.10198478707183,19.74785128570732,0.16171260941800242,Au,PRUNED
4846,-1.0,2026-04-07 11:36:47.249249,2026-04-07 11:36:48.346400,0 days 00:00:01.097151,20.33145224851734,19.639132822905307,0.5718386846360275,Au,COMPLETE
4847,-1.0,2026-04-07 11:36:47.544208,2026-04-07 11:36:48.170297,0 days 00:00:00.626089,21.013115627260323,19.89639459725374,0.5592596690615264,Au,COMPLETE
4848,-1.0,2026-04-07 11:36:47.605333,2026-04-07 11:36:48.278639,0 days 00:00:00.673306,37.49171774629205,18.367758880676497,0.2336352432138576,Au,COMPLETE
4849,-1.0,2026-04-07 11:36:47.673085,2026-04-07 11:36:48.316335,0 days 00:00:00.643250,20.096134747605262,19.216163999326366,0.2918728173009911,Au,COMPLETE
4850,0.0,2026-04-07 11:36:47.790642,2026-04-07 11:36:48.603051,0 days 00:00:00.812409,32.86528061494815,19.764669953528596,0.22926294097361521,Au,PRUNED
4851,-1.0,2026-04-07 11:36:47.949643,2026-04-07 11:36:48.522805,0 days 00:00:00.573162,32.65946492405665,19.511771508300093,0.26679037140457795,Au,COMPLETE
4852,-1.0,2026-04-07 11:36:47.992553,2026-04-07 11:36:48.502143,0 days 00:00:00.509590,102.51535873134509,16.59188376133517,1.5903023731811057,Cu,COMPLETE
4853,-1.0,2026-04-07 11:36:48.199892,2026-04-07 11:36:48.958398,0 days 00:00:00.758506,30.41182274434988,16.267591221143874,0.35031888916298143,Au,COMPLETE
4854,-1.0,2026-04-07 11:36:48.313779,2026-04-07 11:36:49.034326,0 days 00:00:00.720547,38.34058909321554,19.940138246054993,0.10865280222420576,Au,COMPLETE
4855,-12.820512820510848,2026-04-07 11:36:48.477360,2026-04-07 11:36:49.235357,0 days 00:00:00.757997,21.93778689507181,19.99121775346846,0.2960269525463911,Au,PRUNED
4856,5.050505050504438,2026-04-07 11:36:48.599984,2026-04-07 11:36:49.551306,0 days 00:00:00.951322,28.10335403139879,17.14320421758285,0.3013565288315847,Au,PRUNED
4857,-1.0,2026-04-07 11:36:48.631562,2026-04-07 11:36:49.103272,0 days 00:00:00.471710,92.97631208895703,13.676518624424135,0.5043869070152627,Cu,COMPLETE
4858,0.0,2026-04-07 11:36:48.652131,2026-04-07 11:36:49.267390,0 days 00:00:00.615259,37.687421537208195,15.972794242611448,0.4413579244676429,Au,PRUNED
4859,-1.4880952380950254,2026-04-07 11:36:48.667056,2026-04-07 11:36:49.444005,0 days 00:00:00.776949,22.23905623704783,19.991483373741747,0.8887081466795119,Au,PRUNED
4860,0.0,2026-04-07 11:36:48.677894,2026-04-07 11:36:49.378801,0 days 00:00:00.700907,20.221597068588515,19.725485433244774,0.5452348399608997,Au,PRUNED
4861,-2.2663877266387344,2026-04-07 11:36:49.077030,2026-04-07 11:36:50.029626,0 days 00:00:00.952596,107.2816147953264,1.191194033268454,0.836008295082343,Au,PRUNED
4862,-1.0,2026-04-07 11:36:49.302309,2026-04-07 11:36:49.957583,0 days 00:00:00.655274,56.98097320585396,7.21327080769381,0.5825619841440798,Au,COMPLETE
4863,0.0,2026-04-07 11:36:49.341552,2026-04-07 11:36:50.105941,0 days 00:00:00.764389,48.7041332164557,17.085736191615073,0.4913897652008896,Au,PRUNED
4864,-370.0657894736355,2026-04-07 11:36:49.363880,2026-04-07 11:36:50.125995,0 days 00:00:00.762115,20.20960384464597,19.56682719444781,0.9013741571262851,Au,COMPLETE
4865,-1.0,2026-04-07 11:36:49.408042,2026-04-07 11:36:50.159435,0 days 00:00:00.751393,45.71892030272169,19.857991841192767,0.592761569306171,Au,COMPLETE
4866,0.0,2026-04-07 11:36:49.446516,2026-04-07 11:36:50.293948,0 days 00:00:00.847432,27.77568627621038,19.991467072105177,0.6840280134304154,Au,PRUNED
4867,0.0,2026-04-07 11:36:49.578988,2026-04-07 11:36:50.555634,0 days 00:00:00.976646,108.52569774396055,14.805215878721718,1.2212070179369592,Ag,PRUNED
4868,-1.0,2026-04-07 11:36:49.674172,2026-04-07 11:36:50.277056,0 days 00:00:00.602884,20.54437556694729,17.67948050697639,0.8328291747377546,Au,COMPLETE
4869,-423.81840796013535,2026-04-07 11:36:50.159435,2026-04-07 11:36:50.849628,0 days 00:00:00.690193,20.989494418122575,19.790921713900484,0.73233757465016,Au,COMPLETE
4870,-389.3678160918998,2026-04-07 11:36:50.199337,2026-04-07 11:36:51.055576,0 days 00:00:00.856239,20.264066603947196,19.86447435709407,0.8080086109781115,Au,COMPLETE
4871,0.0,2026-04-07 11:36:50.188884,2026-04-07 11:36:50.971815,0 days 00:00:00.782931,22.328467916604193,16.83028103465698,0.12299739197226539,Au,PRUNED
4872,-1.0,2026-04-07 11:36:50.292943,2026-04-07 11:36:50.942899,0 days 00:00:00.649956,32.55823018511759,17.20981588244677,0.48647745325241415,Au,COMPLETE
4873,-372.5165562913412,2026-04-07 11:36:50.421027,2026-04-07 11:36:51.149120,0 days 00:00:00.728093,20.749475094547744,19.63920739304434,0.41987006289893203,Au,COMPLETE
4874,0.0,2026-04-07 11:36:50.580412,2026-04-07 11:36:51.442381,0 days 00:00:00.861969,21.91706120770332,17.60402633841325,0.23386389283276926,Au,PRUNED
4875,-1.0,2026-04-07 11:36:50.652949,2026-04-07 11:36:51.443385,0 days 00:00:00.790436,20.62542848753026,19.89591214818521,0.8599697098809754,Au,COMPLETE
4876,-1.0,2026-04-07 11:36:50.702098,2026-04-07 11:36:51.236590,0 days 00:00:00.534492,21.413389059173102,17.081958259191367,0.23033243289378774,Au,COMPLETE
4877,-1.0,2026-04-07 11:36:51.060289,2026-04-07 11:36:51.567657,0 days 00:00:00.507368,37.386192842339014,19.631844610720467,0.3222315323809675,Au,COMPLETE
4878,-1.0,2026-04-07 11:36:51.086489,2026-04-07 11:36:51.895353,0 days 00:00:00.808864,20.17988963515849,4.087426300320125,0.42110484614627464,Au,COMPLETE
4879,-407.6738609112121,2026-04-07 11:36:51.119025,2026-04-07 11:36:51.879567,0 days 00:00:00.760542,20.492436036023385,19.97808372402239,0.733237982699943,Au,COMPLETE
4880,-1.0,2026-04-07 11:36:51.214628,2026-04-07 11:36:51.774479,0 days 00:00:00.559851,46.79129677333643,17.967267116893606,0.8278092015465512,Au,COMPLETE
4881,-1.0,2026-04-07 11:36:51.402962,2026-04-07 11:36:52.020341,0 days 00:00:00.617379,21.124314993180967,19.892399817526922,0.7514478051231611,Au,COMPLETE
4882,-1.0,2026-04-07 11:36:51.470597,2026-04-07 11:36:51.975174,0 days 00:00:00.504577,22.0114514731157,18.98675884104859,0.12775330326301032,Au,COMPLETE
4883,-1.0,2026-04-07 11:36:51.517512,2026-04-07 11:36:52.016265,0 days 00:00:00.498753,36.59288380496845,19.986799684127504,0.3712809245805042,Au,COMPLETE
4884,-1.0,2026-04-07 11:36:51.724368,2026-04-07 11:36:52.167046,0 days 00:00:00.442678,33.60640777134827,19.971736187005988,0.8789398032051283,Au,COMPLETE
4885,-1.0,2026-04-07 11:36:51.740444,2026-04-07 11:36:52.370432,0 days 00:00:00.629988,21.598865629426474,19.582008192701455,0.1538351730714096,Au,COMPLETE
4886,-1.0,2026-04-07 11:36:51.990520,2026-04-07 11:36:52.859758,0 days 00:00:00.869238,30.191806871536894,19.8784474268881,0.4438125780510054,Au,COMPLETE
4887,-1.0,2026-04-07 11:36:52.021350,2026-04-07 11:36:52.858366,0 days 00:00:00.837016,20.110485324494785,19.73846602283682,0.29644028386230786,Au,COMPLETE
4888,-1.0,2026-04-07 11:36:52.092258,2026-04-07 11:36:52.774693,0 days 00:00:00.682435,31.105384868795735,14.794558621497696,0.7618373093716273,Au,COMPLETE
4889,-1.0,2026-04-07 11:36:52.166048,2026-04-07 11:36:52.711453,0 days 00:00:00.545405,20.16939119494666,15.783745345852436,0.5319171403850165,Au,COMPLETE
4890,-1.0,2026-04-07 11:36:52.179276,2026-04-07 11:36:52.801540,0 days 00:00:00.622264,32.40881399969018,17.97478475619832,1.0674695784702564,Au,COMPLETE
4891,0.0,2026-04-07 11:36:52.153463,2026-04-07 11:36:52.765144,0 days 00:00:00.611681,32.27104213664468,19.888458111650813,0.5994018545274109,Au,PRUNED
4892,0.0,2026-04-07 11:36:52.469933,2026-04-07 11:36:53.031997,0 days 00:00:00.562064,50.885319908088746,19.9997297184189,0.67126204798875,Au,PRUNED
4893,-1.0,2026-04-07 11:36:52.581575,2026-04-07 11:36:53.366193,0 days 00:00:00.784618,33.54739008189829,17.438242297608372,0.6180887716783066,Au,COMPLETE
4894,0.0,2026-04-07 11:36:52.778193,2026-04-07 11:36:53.574525,0 days 00:00:00.796332,20.581730670077192,19.465146351259413,0.45039885345841685,Au,PRUNED
