number,value,datetime_start,datetime_complete,duration,params_D2_nm,params_D3_nm,params_D4_nm,params_metal,state
1163,-9.803921568626775,2026-04-07 11:30:05.596363,2026-04-07 11:30:09.043869,0 days 00:00:03.447506,25.22008465813177,13.012310820361744,1.6057429376159893,Au,COMPLETE
1164,-1.0,2026-04-07 11:30:05.612376,2026-04-07 11:30:05.774281,0 days 00:00:00.161905,92.44779686748284,3.949084057981321,0.5670071926141348,Ag,COMPLETE
1165,-32.05128205127199,2026-04-07 11:30:05.785288,2026-04-07 11:30:09.075144,0 days 00:00:03.289856,53.74377638775988,5.894981425678637,0.5027335112556273,Ag,COMPLETE
1166,-6.696428571428093,2026-04-07 11:30:08.953131,2026-04-07 11:30:09.340411,0 days 00:00:00.387280,29.969988053905567,2.914491401884254,1.3511495969639786,Cu,PRUNED
1167,-2.0746887966804635,2026-04-07 11:30:09.135337,2026-04-07 11:30:09.708945,0 days 00:00:00.573608,85.84475200056428,5.11743181177273,0.674991865388933,Cu,PRUNED
1168,-29.166666666662483,2026-04-07 11:30:09.137827,2026-04-07 11:30:09.905966,0 days 00:00:00.768139,30.8125724518783,19.65057698146333,0.2925855829621875,Ag,COMPLETE
1169,-1.0,2026-04-07 11:30:09.290575,2026-04-07 11:30:09.744301,0 days 00:00:00.453726,51.51578838319509,10.254021382016669,1.92978170886777,Au,COMPLETE
1170,-1.0,2026-04-07 11:30:09.370668,2026-04-07 11:30:09.787727,0 days 00:00:00.417059,68.95812558138628,4.785737808044161,0.6223882811930823,Ag,COMPLETE
1171,-2.5510204081632235,2026-04-07 11:30:09.387397,2026-04-07 11:30:09.815197,0 days 00:00:00.427800,97.2885447471539,11.24168635348426,1.101702678191702,Ag,PRUNED
1172,-1.0,2026-04-07 11:30:09.404165,2026-04-07 11:30:09.812669,0 days 00:00:00.408504,89.0260523625462,5.946198820906612,0.37621984753652415,Ag,COMPLETE
1173,-1.0,2026-04-07 11:30:09.457900,2026-04-07 11:30:09.848302,0 days 00:00:00.390402,71.286339814348,6.160386804717466,0.53325799760777,Ag,COMPLETE
1174,-1.0,2026-04-07 11:30:09.500643,2026-04-07 11:30:10.089122,0 days 00:00:00.588479,25.313453094768068,19.56276222453768,0.20362858058946892,Cu,COMPLETE
1175,-1.0,2026-04-07 11:30:09.867735,2026-04-07 11:30:10.487630,0 days 00:00:00.619895,29.564766646174512,18.76073384387621,1.072264847186489,Au,COMPLETE
1176,0.0,2026-04-07 11:30:09.945116,2026-04-07 11:30:10.492267,0 days 00:00:00.547151,24.992223320593613,16.71799759664147,1.9413140548747232,Au,PRUNED
1177,-30.128205128195845,2026-04-07 11:30:09.908723,2026-04-07 11:30:10.445121,0 days 00:00:00.536398,50.08230046289405,4.896229751292567,0.4196966685217337,Ag,COMPLETE
1178,0.0,2026-04-07 11:30:09.982221,2026-04-07 11:30:11.019386,0 days 00:00:01.037165,119.56398681154442,17.780187901419914,1.167184755767692,Ag,PRUNED
1179,0.0,2026-04-07 11:30:10.026025,2026-04-07 11:30:10.559030,0 days 00:00:00.533005,21.754590591764135,15.184783710600843,1.5786438323953917,Au,PRUNED
1180,-0.5144032921810615,2026-04-07 11:30:10.036390,2026-04-07 11:30:10.784205,0 days 00:00:00.747815,97.17405672906408,9.181213770726231,1.8336197689578793,Au,PRUNED
1181,-0.5186721991701159,2026-04-07 11:30:10.131971,2026-04-07 11:30:10.831067,0 days 00:00:00.699096,108.82250416469398,16.92190458288944,0.32623125119282115,Au,PRUNED
1182,-16.29629629629485,2026-04-07 11:30:10.218882,2026-04-07 11:30:11.004332,0 days 00:00:00.785450,62.068493464742154,5.552825237878456,0.8777380449169562,Au,COMPLETE
1183,-6.2499999999995834,2026-04-07 11:30:10.605364,2026-04-07 11:30:11.264865,0 days 00:00:00.659501,28.70523994226044,2.0501181289452672,0.9854836475062053,Au,PRUNED
1184,-1.0,2026-04-07 11:30:10.593959,2026-04-07 11:30:11.204613,0 days 00:00:00.610654,37.39321380098176,12.197036601992217,1.9435825655996029,Au,COMPLETE
1185,-1.0,2026-04-07 11:30:10.653382,2026-04-07 11:30:11.123862,0 days 00:00:00.470480,23.071129976948903,11.203771908987084,1.2488272589438763,Au,COMPLETE
1186,-1.0,2026-04-07 11:30:10.868959,2026-04-07 11:30:11.342416,0 days 00:00:00.473457,25.392760848000734,15.946082897783478,0.5830783314190545,Ag,COMPLETE
1187,-1.0,2026-04-07 11:30:10.892122,2026-04-07 11:30:11.531126,0 days 00:00:00.639004,58.20092932403469,5.5570722491514495,0.3795101437567775,Ag,COMPLETE
1188,-37.808641975294485,2026-04-07 11:30:10.924312,2026-04-07 11:30:11.417382,0 days 00:00:00.493070,67.58818749680319,5.3765374729993365,0.526966733079144,Ag,COMPLETE
1189,-22.97008547007954,2026-04-07 11:30:11.079542,2026-04-07 11:30:11.739193,0 days 00:00:00.659651,88.5623674463851,1.0174038314531968,0.48472977395619055,Ag,COMPLETE
1190,-1.0,2026-04-07 11:30:11.139856,2026-04-07 11:30:11.516306,0 days 00:00:00.376450,51.171571414346715,5.922862833928546,1.3069564047827966,Cu,COMPLETE
1191,-7.911392405062891,2026-04-07 11:30:11.202606,2026-04-07 11:30:11.736215,0 days 00:00:00.533609,76.0614909927209,7.79482446060498,1.032188987975582,Cu,PRUNED
1192,-1.0,2026-04-07 11:30:11.344414,2026-04-07 11:30:11.844307,0 days 00:00:00.499893,21.83281828070345,7.472670240197873,0.9215734976793776,Ag,COMPLETE
1193,-20.03968253968066,2026-04-07 11:30:11.481305,2026-04-07 11:30:12.027504,0 days 00:00:00.546199,35.517228504934025,18.23608630408692,0.12543522246623615,Ag,COMPLETE
1194,-0.666666666666656,2026-04-07 11:30:11.517964,2026-04-07 11:30:12.023983,0 days 00:00:00.506019,84.11472300198135,12.536706243014242,1.2746642151557135,Cu,PRUNED
1195,2.5510204081632235,2026-04-07 11:30:11.580240,2026-04-07 11:30:12.076551,0 days 00:00:00.496311,96.45922796653136,18.701260907538586,1.1588283871120457,Cu,PRUNED
1196,-30.172413793093217,2026-04-07 11:30:11.661247,2026-04-07 11:30:12.192049,0 days 00:00:00.530802,46.78979146682718,1.2465981707589946,0.6774518347729295,Ag,COMPLETE
1197,-1.0,2026-04-07 11:30:11.686051,2026-04-07 11:30:12.240672,0 days 00:00:00.554621,27.91315870342747,16.42281648147641,0.3838324413279003,Ag,COMPLETE
1198,-1.0,2026-04-07 11:30:11.804157,2026-04-07 11:30:12.290231,0 days 00:00:00.486074,56.00767031108853,2.0136104909524075,0.6116181253972349,Ag,COMPLETE
1199,-14.9999999999976,2026-04-07 11:30:11.908691,2026-04-07 11:30:12.661485,0 days 00:00:00.752794,90.7641581179944,0.7469777699268221,0.5167661223786557,Ag,PRUNED
1200,-36.76470588233863,2026-04-07 11:30:12.104312,2026-04-07 11:30:12.877256,0 days 00:00:00.772944,55.77317219700828,3.6080342375904246,0.47606861935080524,Ag,COMPLETE
1201,-0.8680555555555314,2026-04-07 11:30:12.117997,2026-04-07 11:30:12.487648,0 days 00:00:00.369651,54.3125635053819,15.912585068834115,0.5450441476103196,Au,PRUNED
1202,-3.7878787878786353,2026-04-07 11:30:12.132782,2026-04-07 11:30:12.660428,0 days 00:00:00.527646,94.41778930549009,3.221557957808036,0.417668593592033,Ag,PRUNED
1203,-1.0,2026-04-07 11:30:12.169242,2026-04-07 11:30:12.691441,0 days 00:00:00.522199,26.777935113676975,11.754287617162932,1.6296907730003352,Cu,COMPLETE
1204,-36.45833333331814,2026-04-07 11:30:12.357915,2026-04-07 11:30:12.849937,0 days 00:00:00.492022,52.212484305210545,1.6270845007165977,0.5875260040621004,Ag,COMPLETE
1205,-1.0,2026-04-07 11:30:12.339055,2026-04-07 11:30:12.863722,0 days 00:00:00.524667,75.28588837820317,5.126715163274295,1.7542064376636963,Cu,COMPLETE
1206,-1.0,2026-04-07 11:30:12.417001,2026-04-07 11:30:12.831625,0 days 00:00:00.414624,40.18308381132891,18.261738644055804,1.2414616813057198,Cu,COMPLETE
1207,-1.0,2026-04-07 11:30:12.525680,2026-04-07 11:30:13.128058,0 days 00:00:00.602378,40.2312955184872,6.721787657480391,0.3312230685242694,Cu,COMPLETE
1208,-1.0,2026-04-07 11:30:12.779336,2026-04-07 11:30:13.181048,0 days 00:00:00.401712,47.693478714772496,0.7459284448117451,0.6510780785279909,Cu,COMPLETE
1209,-1.0,2026-04-07 11:30:12.808787,2026-04-07 11:30:13.204486,0 days 00:00:00.395699,49.775414457252445,1.1277451909025764,0.689527765176633,Au,COMPLETE
1210,-9.615384615383629,2026-04-07 11:30:12.894191,2026-04-07 11:30:13.299488,0 days 00:00:00.405297,92.35938405242426,6.004388827605563,0.16916757218399964,Ag,PRUNED
1211,-1.0,2026-04-07 11:30:12.969119,2026-04-07 11:30:13.354268,0 days 00:00:00.385149,51.70254516291153,5.0455830562133075,0.4239079858980055,Ag,COMPLETE
1212,-32.63888888887806,2026-04-07 11:30:12.989904,2026-04-07 11:30:13.590046,0 days 00:00:00.600142,80.38389795168335,4.650183670484178,0.44969332892647307,Ag,COMPLETE
1213,-1.0,2026-04-07 11:30:13.005820,2026-04-07 11:30:13.543293,0 days 00:00:00.537473,52.436610996447584,5.18208772986944,0.4424848501494456,Ag,COMPLETE
1214,-6.172839506171925,2026-04-07 11:30:13.027409,2026-04-07 11:30:13.565444,0 days 00:00:00.538035,22.950089923185356,19.71342003010811,0.32846278793724903,Au,PRUNED
1215,-18.74999999999625,2026-04-07 11:30:13.263693,2026-04-07 11:30:13.947858,0 days 00:00:00.684165,89.53710076732537,0.652627681039074,0.6192291130140938,Ag,PRUNED
1216,-9.027777777777175,2026-04-07 11:30:13.324882,2026-04-07 11:30:13.816709,0 days 00:00:00.491827,25.575152854301116,15.606351975269819,0.432604762062228,Cu,PRUNED
1217,-1.0,2026-04-07 11:30:13.355274,2026-04-07 11:30:13.853219,0 days 00:00:00.497945,98.33753513809935,1.30112667994105,0.12258251804015485,Cu,COMPLETE
1218,-36.94968553457724,2026-04-07 11:30:13.385005,2026-04-07 11:30:14.039136,0 days 00:00:00.654131,74.46910997921258,4.394996747019542,0.5702637722678725,Ag,COMPLETE
1219,-9.615384615383629,2026-04-07 11:30:13.592615,2026-04-07 11:30:14.178961,0 days 00:00:00.586346,92.61688056848814,0.9026391599123662,0.45997488619303645,Ag,PRUNED
1220,-31.073446327673043,2026-04-07 11:30:13.638795,2026-04-07 11:30:14.195442,0 days 00:00:00.556647,48.61745376495965,2.899664716251215,0.46402291259233147,Ag,COMPLETE
1221,-20.833333333328703,2026-04-07 11:30:13.684415,2026-04-07 11:30:14.364005,0 days 00:00:00.679590,42.76327601780355,4.843904524125601,0.11793403764198192,Ag,PRUNED
1222,-33.89830508473423,2026-04-07 11:30:13.703347,2026-04-07 11:30:14.481606,0 days 00:00:00.778259,80.25610970015242,4.412886408502489,0.5154260614098423,Ag,COMPLETE
1223,-1.0,2026-04-07 11:30:13.889061,2026-04-07 11:30:14.362503,0 days 00:00:00.473442,92.58914239265236,3.986105868154314,0.12446528820959751,Ag,COMPLETE
1224,-0.8992805755395424,2026-04-07 11:30:13.948856,2026-04-07 11:30:14.677861,0 days 00:00:00.729005,22.20738354831066,19.080290785971,0.44581603134925274,Ag,PRUNED
1225,-12.731481481480067,2026-04-07 11:30:14.056800,2026-04-07 11:30:14.693427,0 days 00:00:00.636627,29.47724327672929,12.841918728877163,1.644210137763588,Au,PRUNED
1226,-33.045977011482776,2026-04-07 11:30:14.144213,2026-04-07 11:30:14.848665,0 days 00:00:00.704452,51.56221963355901,4.582393679978425,0.17403569681255157,Ag,COMPLETE
1227,-43.69918699184875,2026-04-07 11:30:14.309874,2026-04-07 11:30:14.828233,0 days 00:00:00.518359,58.533658752533604,1.0871521788074738,0.5949316286261698,Ag,COMPLETE
1228,0.0,2026-04-07 11:30:14.442449,2026-04-07 11:30:15.040580,0 days 00:00:00.598131,21.207660054080144,13.302682008730745,1.6064753228755482,Au,PRUNED
1229,-13.071895424835576,2026-04-07 11:30:14.485081,2026-04-07 11:30:14.974808,0 days 00:00:00.489727,45.114266197080376,7.2701212918462215,0.3771070518363907,Au,PRUNED
1230,-1.0,2026-04-07 11:30:14.529980,2026-04-07 11:30:15.005859,0 days 00:00:00.475879,90.23474109051153,4.991477818935086,0.2185622994127234,Ag,COMPLETE
1231,-1.0,2026-04-07 11:30:14.608295,2026-04-07 11:30:15.006860,0 days 00:00:00.398565,78.63466435589065,2.524777369902691,0.5922327179012408,Ag,COMPLETE
1232,-1.0,2026-04-07 11:30:14.743035,2026-04-07 11:30:15.251075,0 days 00:00:00.508040,78.7846381216076,4.708957743145103,0.452747672789813,Ag,COMPLETE
1233,-0.504032258064508,2026-04-07 11:30:14.767456,2026-04-07 11:30:15.365784,0 days 00:00:00.598328,61.20366556442719,12.139644779464588,0.8135587537809896,Au,PRUNED
1234,-0.6915629322268211,2026-04-07 11:30:15.032467,2026-04-07 11:30:15.574652,0 days 00:00:00.542185,89.9982442202151,12.156907496708623,1.2940957254521468,Au,PRUNED
1235,-1.0,2026-04-07 11:30:15.100507,2026-04-07 11:30:15.412398,0 days 00:00:00.311891,33.858209787924146,16.552582803752465,0.1149267151785781,Ag,COMPLETE
1236,-1.9257703081232167,2026-04-07 11:30:15.118705,2026-04-07 11:30:15.804496,0 days 00:00:00.685791,96.57765281556152,1.7449531088569614,0.6200042235267601,Cu,PRUNED
1237,-1.0,2026-04-07 11:30:15.145735,2026-04-07 11:30:15.613184,0 days 00:00:00.467449,51.24749910171217,0.8535495018446734,0.6147327058072671,Ag,COMPLETE
1238,-37.03703703702322,2026-04-07 11:30:15.173978,2026-04-07 11:30:15.772413,0 days 00:00:00.598435,59.95776951705161,5.100907174870432,0.3785386654832253,Ag,COMPLETE
1239,-1.0,2026-04-07 11:30:15.201472,2026-04-07 11:30:15.770401,0 days 00:00:00.568929,50.577602865389224,4.16455611929578,0.22768921774510448,Ag,COMPLETE
1240,-1.0,2026-04-07 11:30:15.458165,2026-04-07 11:30:15.988600,0 days 00:00:00.530435,82.33332706193055,5.96855099258466,0.10696100568972496,Ag,COMPLETE
1241,-27.77777777777037,2026-04-07 11:30:15.504896,2026-04-07 11:30:16.027252,0 days 00:00:00.522356,84.21963011572205,5.170943991678466,0.265104572528757,Ag,PRUNED
1242,-1.0,2026-04-07 11:30:15.662601,2026-04-07 11:30:16.169643,0 days 00:00:00.507042,50.656758722964774,1.2803208207277432,0.5649562754507709,Ag,COMPLETE
1243,-35.13071895423448,2026-04-07 11:30:15.712773,2026-04-07 11:30:16.302573,0 days 00:00:00.589800,50.01239912894594,1.490780212594725,0.5737531608991077,Ag,COMPLETE
1244,-1.0,2026-04-07 11:30:15.852350,2026-04-07 11:30:16.303575,0 days 00:00:00.451225,48.37089736709824,0.9393944637578022,0.4502676748357616,Ag,COMPLETE
1245,0.7861635220125193,2026-04-07 11:30:15.870904,2026-04-07 11:30:16.461262,0 days 00:00:00.590358,34.89928567688234,14.86138818506081,1.9105240223240783,Cu,PRUNED
1246,-0.8865248226950103,2026-04-07 11:30:15.913571,2026-04-07 11:30:16.462258,0 days 00:00:00.548687,20.136641320147113,14.356102593128469,0.13477403890335513,Ag,PRUNED
1247,-18.74999999999625,2026-04-07 11:30:15.966786,2026-04-07 11:30:16.719716,0 days 00:00:00.752930,89.35851195949337,2.983491375137006,0.4031923006063305,Ag,PRUNED
1248,11.880856760374643,2026-04-07 11:30:16.098855,2026-04-07 11:30:16.589518,0 days 00:00:00.490663,110.6978652423744,3.6649234212067068,0.7792299915505946,Au,PRUNED
1249,-1.0,2026-04-07 11:30:16.114566,2026-04-07 11:30:16.761162,0 days 00:00:00.646596,63.323226147206135,2.7832778396463107,0.5682374803870133,Ag,COMPLETE
1250,-40.798611111094175,2026-04-07 11:30:16.364488,2026-04-07 11:30:17.186943,0 days 00:00:00.822455,71.40717516120135,3.589797670234081,0.5975516626978593,Ag,COMPLETE
1251,-1.0,2026-04-07 11:30:16.505024,2026-04-07 11:30:17.002235,0 days 00:00:00.497211,84.2274465143257,2.833529921500302,0.4563721920518529,Ag,COMPLETE
1252,-30.303030303021146,2026-04-07 11:30:16.524494,2026-04-07 11:30:17.203713,0 days 00:00:00.679219,83.72219508573117,5.1277689724976785,0.18047626297019054,Ag,COMPLETE
1253,-1.0,2026-04-07 11:30:16.560284,2026-04-07 11:30:17.000228,0 days 00:00:00.439944,84.8552997366732,4.887711116939274,0.1215695217095992,Ag,COMPLETE
1254,-1.0,2026-04-07 11:30:16.640289,2026-04-07 11:30:17.186386,0 days 00:00:00.546097,86.70597760150127,4.398492668300591,0.25805558922191646,Ag,COMPLETE
1255,-43.65079365077301,2026-04-07 11:30:16.682616,2026-04-07 11:30:17.203713,0 days 00:00:00.521097,77.25687230739419,1.3634156119323189,0.5908737666284807,Ag,COMPLETE
1256,-33.192090395469144,2026-04-07 11:30:16.763668,2026-04-07 11:30:17.373798,0 days 00:00:00.610130,52.39737548088907,4.498716393937852,0.3511857994469425,Ag,COMPLETE
1257,-28.84615384614497,2026-04-07 11:30:16.870935,2026-04-07 11:30:17.405535,0 days 00:00:00.534600,46.32169409755479,3.140867458245978,0.40517553828127484,Ag,PRUNED
1258,-34.35672514618687,2026-04-07 11:30:17.118656,2026-04-07 11:30:17.718608,0 days 00:00:00.599952,55.00480064087913,5.321513190599728,0.22560985568033848,Ag,COMPLETE
1259,-1.0,2026-04-07 11:30:17.155567,2026-04-07 11:30:17.942112,0 days 00:00:00.786545,113.40274871371011,19.67891660418627,1.5801521126609301,Cu,COMPLETE
1260,-1.0,2026-04-07 11:30:17.377093,2026-04-07 11:30:17.926865,0 days 00:00:00.549772,20.376975356512347,9.525927310934607,1.7902891543090604,Au,COMPLETE
1261,-1.0,2026-04-07 11:30:17.444718,2026-04-07 11:30:17.925745,0 days 00:00:00.481027,76.43422822704103,4.943302412466341,0.49951438716334884,Ag,COMPLETE
1262,-36.949685534577355,2026-04-07 11:30:17.454753,2026-04-07 11:30:18.080515,0 days 00:00:00.625762,56.98282916896544,4.129200025871766,0.5136472439648595,Ag,COMPLETE
1263,-1.0,2026-04-07 11:30:17.488254,2026-04-07 11:30:17.923854,0 days 00:00:00.435600,54.72209541184588,1.1628509214189484,0.6264441861563478,Ag,COMPLETE
1264,0.0,2026-04-07 11:30:17.583137,2026-04-07 11:30:18.110563,0 days 00:00:00.527426,113.42852476377999,14.83979550421507,1.702800222729393,Ag,PRUNED
1265,-36.54970760232651,2026-04-07 11:30:17.683154,2026-04-07 11:30:18.316792,0 days 00:00:00.633638,58.748744960739586,6.249953467816519,0.1409327706746506,Ag,COMPLETE
1266,-1.0,2026-04-07 11:30:17.887463,2026-04-07 11:30:18.371036,0 days 00:00:00.483573,66.58342517954212,0.6813043401879563,0.5762147659547469,Ag,COMPLETE
1267,-1.0,2026-04-07 11:30:18.045384,2026-04-07 11:30:18.447429,0 days 00:00:00.402045,54.00080475884444,0.5982906230920961,0.5319358873176698,Ag,COMPLETE
1268,-14.639639639638055,2026-04-07 11:30:18.110563,2026-04-07 11:30:18.566035,0 days 00:00:00.455472,24.397968840833535,15.05048348318156,1.150820874686807,Au,PRUNED
1269,0.0,2026-04-07 11:30:18.131745,2026-04-07 11:30:18.654178,0 days 00:00:00.522433,116.3829768928488,14.705886926035394,0.13606708140331936,Cu,PRUNED
1270,-39.96598639454163,2026-04-07 11:30:18.178677,2026-04-07 11:30:18.756275,0 days 00:00:00.577598,74.27724201794547,4.846679375652802,0.13303265198090158,Ag,COMPLETE
1271,-1.0,2026-04-07 11:30:18.198549,2026-04-07 11:30:18.596446,0 days 00:00:00.397897,92.99280766013402,2.60254768168884,0.3567003264604405,Ag,COMPLETE
1272,-1.0,2026-04-07 11:30:18.225630,2026-04-07 11:30:18.741606,0 days 00:00:00.515976,92.17080909608771,18.541346583742396,0.6491829159459961,Au,COMPLETE
1273,-35.087719298233345,2026-04-07 11:30:18.491617,2026-04-07 11:30:19.178218,0 days 00:00:00.686601,78.20619640137262,4.945630215810344,0.3840196386345488,Ag,COMPLETE
1274,-1.0,2026-04-07 11:30:18.629915,2026-04-07 11:30:19.147795,0 days 00:00:00.517880,85.54768252254394,12.415522607273823,0.24681746172629815,Cu,COMPLETE
1275,-1.0,2026-04-07 11:30:18.663204,2026-04-07 11:30:19.081382,0 days 00:00:00.418178,80.0939221200502,1.204028080406892,0.6125409790317231,Ag,COMPLETE
1276,-1.0,2026-04-07 11:30:18.687337,2026-04-07 11:30:19.133002,0 days 00:00:00.445665,82.33584882582133,3.02088113677563,0.4278070308069847,Ag,COMPLETE
1277,-30.448717948713263,2026-04-07 11:30:18.710203,2026-04-07 11:30:19.257787,0 days 00:00:00.547584,35.635339507202744,19.090745808058394,0.11324582579807876,Ag,PRUNED
1278,-1.0,2026-04-07 11:30:18.822989,2026-04-07 11:30:19.148805,0 days 00:00:00.325816,52.41518041428232,4.980280992855581,0.17351943228488786,Ag,COMPLETE
1279,-28.84615384614497,2026-04-07 11:30:18.858061,2026-04-07 11:30:19.421319,0 days 00:00:00.563258,83.47139187042313,3.2685996556813697,0.46292214519241986,Ag,PRUNED
1280,-34.97023809522566,2026-04-07 11:30:18.908841,2026-04-07 11:30:19.430259,0 days 00:00:00.521418,80.33006783890156,4.13926928269204,0.4055354475568358,Ag,COMPLETE
1281,-2.833333333333288,2026-04-07 11:30:19.173141,2026-04-07 11:30:19.760754,0 days 00:00:00.587613,91.53497597091331,4.562870407156214,0.4689550093727417,Au,PRUNED
1282,-1.0,2026-04-07 11:30:19.330606,2026-04-07 11:30:19.788762,0 days 00:00:00.458156,84.00983469888374,1.7261934957705931,0.6019954822172964,Ag,COMPLETE
1283,-1.0,2026-04-07 11:30:19.363126,2026-04-07 11:30:19.838566,0 days 00:00:00.475440,51.1462968372852,0.7084358301898099,0.45999415720478154,Ag,COMPLETE
1284,-37.735849056589586,2026-04-07 11:30:19.401712,2026-04-07 11:30:19.936335,0 days 00:00:00.534623,60.189437315758816,4.560925933996732,0.5302447594083113,Ag,COMPLETE
1285,-1.0,2026-04-07 11:30:19.424159,2026-04-07 11:30:19.842075,0 days 00:00:00.417916,81.66848390011981,1.1584130508839432,0.5997163841063109,Ag,COMPLETE
1286,-1.0,2026-04-07 11:30:19.462287,2026-04-07 11:30:19.849819,0 days 00:00:00.387532,27.769729904347297,14.307732791637346,1.8482585308429669,Au,COMPLETE
1287,-1.0,2026-04-07 11:30:19.484228,2026-04-07 11:30:19.754133,0 days 00:00:00.269905,25.429459909391873,4.441198836780155,1.9666766057564162,Ag,COMPLETE
1288,79.93827160493589,2026-04-07 11:30:19.670381,2026-04-07 11:30:20.208019,0 days 00:00:00.537638,33.131028887947636,14.529859238782892,1.8614385949753094,Au,PRUNED
1289,0.0,2026-04-07 11:30:19.884629,2026-04-07 11:30:20.475629,0 days 00:00:00.591000,110.57123860957648,8.630785950680274,1.3555985028238557,Cu,PRUNED
1290,-1.0,2026-04-07 11:30:19.939818,2026-04-07 11:30:20.363063,0 days 00:00:00.423245,52.021494358824285,0.8764769881039303,0.5467782040234739,Ag,COMPLETE
1291,-39.93055555553879,2026-04-07 11:30:19.985159,2026-04-07 11:30:20.625757,0 days 00:00:00.640598,68.25097653790111,3.994088320682761,0.5400323979661829,Ag,COMPLETE
1292,-1.0,2026-04-07 11:30:20.026832,2026-04-07 11:30:20.453033,0 days 00:00:00.426201,62.02451846626964,4.469857455760378,0.42474921445850766,Ag,COMPLETE
1293,-26.785714285706632,2026-04-07 11:30:19.913328,2026-04-07 11:30:20.504560,0 days 00:00:00.591232,49.88721855338046,4.840980519593777,0.3276854443991832,Ag,PRUNED
1294,-36.94968553457724,2026-04-07 11:30:20.104798,2026-04-07 11:30:20.580424,0 days 00:00:00.475626,58.07233569067919,4.239191456534187,0.49722839172920685,Ag,COMPLETE
1295,11.880856760374643,2026-04-07 11:30:20.190652,2026-04-07 11:30:20.914419,0 days 00:00:00.723767,114.82216090152826,3.1176151448270293,1.6248500888844188,Au,PRUNED
1296,-39.21568627449449,2026-04-07 11:30:20.303507,2026-04-07 11:30:21.092942,0 days 00:00:00.789435,66.83624576338282,4.9080798459621615,0.4051916534446642,Ag,COMPLETE
1297,-40.83333333331706,2026-04-07 11:30:20.522741,2026-04-07 11:30:21.113379,0 days 00:00:00.590638,64.26257573248061,5.692266638080784,0.10209042977842309,Ag,COMPLETE
