number,value,datetime_start,datetime_complete,duration,params_D2_nm,params_D3_nm,params_D4_nm,params_metal,state
5453,-1.0,2026-04-07 11:37:56.905165,2026-04-07 11:37:57.764306,0 days 00:00:00.859141,36.156194688547124,19.958625088387812,0.5279705601705923,Au,COMPLETE
5454,-0.6775067750677396,2026-04-07 11:37:57.000835,2026-04-07 11:37:57.540776,0 days 00:00:00.539941,84.6782758073619,16.34100742637339,1.8863457062559328,Cu,PRUNED
5455,0.0,2026-04-07 11:37:57.018523,2026-04-07 11:37:57.712340,0 days 00:00:00.693817,45.54200366901546,17.6119029578066,0.8382706028180142,Au,PRUNED
5456,0.0,2026-04-07 11:37:57.076260,2026-04-07 11:37:57.790714,0 days 00:00:00.714454,20.043603311137186,19.65233091015075,0.4151606989024397,Au,PRUNED
5457,0.0,2026-04-07 11:37:57.145657,2026-04-07 11:37:57.790714,0 days 00:00:00.645057,32.06848200183421,18.008103909913313,0.33901785717047267,Au,PRUNED
5458,-1.0,2026-04-07 11:37:57.458473,2026-04-07 11:37:58.378496,0 days 00:00:00.920023,20.938887505221786,17.793377916894922,0.37250239108221084,Au,COMPLETE
5459,0.0,2026-04-07 11:37:57.501476,2026-04-07 11:37:58.263140,0 days 00:00:00.761664,20.986696870062953,17.757930921840472,0.8193271674947811,Au,PRUNED
5460,0.0,2026-04-07 11:37:57.624853,2026-04-07 11:37:58.552716,0 days 00:00:00.927863,32.926410352911034,19.9924747809205,0.3418813476286866,Au,PRUNED
5461,-1.0,2026-04-07 11:37:57.780427,2026-04-07 11:37:58.254740,0 days 00:00:00.474313,20.47695138090075,18.02623537780132,0.7359477539828491,Au,COMPLETE
5462,-1.0,2026-04-07 11:37:57.754338,2026-04-07 11:37:58.347714,0 days 00:00:00.593376,47.83260382188911,19.94957617583537,1.1025304501119326,Au,COMPLETE
5463,0.0,2026-04-07 11:37:57.902931,2026-04-07 11:37:58.486103,0 days 00:00:00.583172,31.88021671966246,17.206285632296414,0.9142807051079298,Au,PRUNED
5464,-1.0,2026-04-07 11:37:57.919924,2026-04-07 11:37:58.446353,0 days 00:00:00.526429,21.052295115385473,19.910894440906237,1.0718421400978615,Au,COMPLETE
5465,-1.0,2026-04-07 11:37:57.977094,2026-04-07 11:37:58.858290,0 days 00:00:00.881196,29.861564993349106,17.653460898338334,0.9078720216561451,Au,COMPLETE
5466,79.93827160493589,2026-04-07 11:37:58.297387,2026-04-07 11:37:59.148402,0 days 00:00:00.851015,31.665549194795204,17.159945929647762,0.717438653517511,Au,PRUNED
5467,-3.205128205127712,2026-04-07 11:37:58.458925,2026-04-07 11:37:59.100461,0 days 00:00:00.641536,22.137952943837192,19.97003474983772,0.7888870736910145,Au,PRUNED
5468,0.0,2026-04-07 11:37:58.557888,2026-04-07 11:37:59.381435,0 days 00:00:00.823547,30.950993963520546,17.39913618053923,1.0848933819509357,Au,PRUNED
5469,-1.0,2026-04-07 11:37:58.603296,2026-04-07 11:37:59.366609,0 days 00:00:00.763313,20.964246380061645,17.284946290201766,1.006683807860074,Au,COMPLETE
5470,-0.5186721991701159,2026-04-07 11:37:58.656994,2026-04-07 11:37:59.617914,0 days 00:00:00.960920,99.94202556959509,19.65345311912793,1.970931852961645,Au,PRUNED
5471,0.0,2026-04-07 11:37:58.681036,2026-04-07 11:37:59.380425,0 days 00:00:00.699389,20.03518131552389,18.982292882073224,0.7750559282533194,Au,PRUNED
5472,-427.31829573928434,2026-04-07 11:37:58.695155,2026-04-07 11:37:59.411772,0 days 00:00:00.716617,20.51415295587348,19.88251422487972,1.0804628282066755,Au,COMPLETE
5473,0.0,2026-04-07 11:37:59.213126,2026-04-07 11:38:00.151496,0 days 00:00:00.938370,20.67524334890123,17.78240270175474,0.6192000572470945,Cu,PRUNED
5474,0.0,2026-04-07 11:37:59.274519,2026-04-07 11:38:00.214653,0 days 00:00:00.940134,20.00262111933176,15.781745815155652,0.5451680277095141,Au,PRUNED
5475,0.0,2026-04-07 11:37:59.334102,2026-04-07 11:38:00.151496,0 days 00:00:00.817394,20.52039372926748,17.012268667343317,0.6267044386502744,Au,PRUNED
5476,-1.0,2026-04-07 11:37:59.518323,2026-04-07 11:38:00.289243,0 days 00:00:00.770920,20.569755659544192,19.895530913692983,0.4216674256508723,Au,COMPLETE
5477,0.0,2026-04-07 11:37:59.555862,2026-04-07 11:38:00.214653,0 days 00:00:00.658791,40.82281526316737,17.879511158327432,0.7310611002963752,Au,PRUNED
5478,0.0,2026-04-07 11:37:59.648137,2026-04-07 11:38:00.713465,0 days 00:00:01.065328,21.119638994618008,17.112518294272586,1.0289170620982593,Au,PRUNED
5479,-1.1904761904760544,2026-04-07 11:37:59.729314,2026-04-07 11:38:00.534756,0 days 00:00:00.805442,29.508301870643216,14.970496442837366,0.9500739419686783,Au,PRUNED
5480,-1.0,2026-04-07 11:37:59.741499,2026-04-07 11:38:00.304423,0 days 00:00:00.562924,87.49662589541097,9.322858954027632,0.3282579094943042,Ag,COMPLETE
5481,-1.0,2026-04-07 11:38:00.233289,2026-04-07 11:38:01.092233,0 days 00:00:00.858944,20.27001698187653,19.73713590582048,0.8187137792999628,Au,COMPLETE
5482,2.3809523809521087,2026-04-07 11:38:00.253793,2026-04-07 11:38:00.967243,0 days 00:00:00.713450,30.172511086817323,15.073043152930229,1.014461212096009,Au,PRUNED
5483,-1.0,2026-04-07 11:38:00.338758,2026-04-07 11:38:01.061408,0 days 00:00:00.722650,20.782329414062215,16.383772481266067,0.9960253171133103,Au,COMPLETE
5484,8.074935400516672,2026-04-07 11:38:00.457300,2026-04-07 11:38:01.262002,0 days 00:00:00.804702,100.96897725670487,13.746306864410103,1.660458403756491,Ag,PRUNED
5485,-1.0,2026-04-07 11:38:00.606598,2026-04-07 11:38:01.131974,0 days 00:00:00.525376,30.60218445228313,17.366489956694046,0.9600533676323801,Au,COMPLETE
5486,0.0,2026-04-07 11:38:00.645409,2026-04-07 11:38:01.647947,0 days 00:00:01.002538,20.005332704917354,16.815269703162777,0.9114458717184182,Au,PRUNED
5487,4.901960784313341,2026-04-07 11:38:00.666106,2026-04-07 11:38:01.367784,0 days 00:00:00.701678,32.37725014361733,15.302421740385448,0.4249175751929336,Au,PRUNED
5488,0.0,2026-04-07 11:38:00.841487,2026-04-07 11:38:01.596824,0 days 00:00:00.755337,34.38357974893246,19.829313168260114,0.4507494212232004,Au,PRUNED
5489,0.0,2026-04-07 11:38:01.095742,2026-04-07 11:38:02.267573,0 days 00:00:01.171831,20.135035081342785,17.34584129945585,0.7175009025428112,Au,PRUNED
5490,-11.494252873561631,2026-04-07 11:38:01.246622,2026-04-07 11:38:02.323618,0 days 00:00:01.076996,31.0206882500963,19.852748759958928,1.193550660078115,Ag,PRUNED
5491,-1.0,2026-04-07 11:38:01.313790,2026-04-07 11:38:02.185428,0 days 00:00:00.871638,20.6841838059524,17.311763230652787,0.3908906750456452,Au,COMPLETE
5492,-394.81351981346444,2026-04-07 11:38:01.372441,2026-04-07 11:38:02.201107,0 days 00:00:00.828666,20.423801528130028,19.93811498627294,0.6304344705670735,Au,COMPLETE
5493,0.0,2026-04-07 11:38:01.503930,2026-04-07 11:38:02.265572,0 days 00:00:00.761642,32.06952847928874,17.241052372182182,0.7758819096842605,Au,PRUNED
5494,-1.0,2026-04-07 11:38:01.532251,2026-04-07 11:38:02.292294,0 days 00:00:00.760043,31.67106105702908,17.762698618462075,1.088862829660837,Au,COMPLETE
5495,-1.0,2026-04-07 11:38:01.904412,2026-04-07 11:38:02.387230,0 days 00:00:00.482818,32.28685606482219,18.104438643755227,0.4411112346895279,Au,COMPLETE
5496,0.0,2026-04-07 11:38:01.930495,2026-04-07 11:38:02.778962,0 days 00:00:00.848467,42.514223864567896,19.97751904535889,1.0750205219030156,Au,PRUNED
5497,-1.0,2026-04-07 11:38:02.271711,2026-04-07 11:38:03.141429,0 days 00:00:00.869718,46.580656764861956,17.762344827488405,0.618712422939385,Au,COMPLETE
5498,-1.0,2026-04-07 11:38:02.344072,2026-04-07 11:38:02.967243,0 days 00:00:00.623171,41.60222012830602,19.95985850480859,0.9641251618583866,Au,COMPLETE
5499,0.0,2026-04-07 11:38:02.376062,2026-04-07 11:38:03.073631,0 days 00:00:00.697569,34.07463452436298,19.947875407131832,0.3675513059917339,Au,PRUNED
5500,-380.63063063057916,2026-04-07 11:38:02.430929,2026-04-07 11:38:03.461606,0 days 00:00:01.030677,20.432164708788157,19.98673782118786,0.42391704781164685,Au,COMPLETE
5501,-1.0,2026-04-07 11:38:02.406470,2026-04-07 11:38:03.122896,0 days 00:00:00.716426,20.868241314644155,19.870337937375993,0.9121967939350317,Au,COMPLETE
5502,-1.0,2026-04-07 11:38:02.501290,2026-04-07 11:38:03.229533,0 days 00:00:00.728243,21.218569714281042,19.98628347812256,0.659416377476786,Au,COMPLETE
5503,76.94647201946246,2026-04-07 11:38:02.605511,2026-04-07 11:38:03.506440,0 days 00:00:00.900929,33.441912613237065,19.842374457199192,0.8150283923531315,Cu,PRUNED
5504,-1.0,2026-04-07 11:38:02.905504,2026-04-07 11:38:03.627822,0 days 00:00:00.722318,20.05766913933036,17.800258855654313,0.9650679284398147,Au,COMPLETE
5505,-1.1990407673860566,2026-04-07 11:38:03.119143,2026-04-07 11:38:03.723286,0 days 00:00:00.604143,20.081262213073977,19.108577389634462,0.762843720419533,Ag,PRUNED
5506,-1.0,2026-04-07 11:38:03.141429,2026-04-07 11:38:03.761729,0 days 00:00:00.620300,30.327088156369292,17.448627673675457,0.5647781883740117,Au,COMPLETE
5507,-1.0,2026-04-07 11:38:03.393518,2026-04-07 11:38:04.084621,0 days 00:00:00.691103,82.57342696469375,4.583435156878532,1.377621775114271,Cu,COMPLETE
5508,-1.0,2026-04-07 11:38:03.507626,2026-04-07 11:38:04.177578,0 days 00:00:00.669952,26.29956856613195,19.94358433271282,0.9848060507657017,Au,COMPLETE
5509,-1.0,2026-04-07 11:38:03.591884,2026-04-07 11:38:04.175578,0 days 00:00:00.583694,20.567998715662803,17.11927545990069,0.3059389839722684,Cu,COMPLETE
5510,-1.0,2026-04-07 11:38:03.604007,2026-04-07 11:38:04.175578,0 days 00:00:00.571571,116.28584210504923,9.30189530049735,1.4399464087189753,Au,COMPLETE
5511,0.0,2026-04-07 11:38:03.706136,2026-04-07 11:38:04.344145,0 days 00:00:00.638009,21.07224507846243,17.16179123603874,0.163037744706246,Au,PRUNED
5512,-1.0,2026-04-07 11:38:03.838865,2026-04-07 11:38:04.422978,0 days 00:00:00.584113,31.21851026043842,17.391707140073468,0.1480118451176525,Au,COMPLETE
5513,-1.0,2026-04-07 11:38:03.860638,2026-04-07 11:38:04.576739,0 days 00:00:00.716101,29.130679812293835,16.844090126552356,0.753178388545332,Au,COMPLETE
5514,80.57598039215449,2026-04-07 11:38:03.943586,2026-04-07 11:38:04.577243,0 days 00:00:00.633657,31.0105362209169,17.04898266432048,0.5116832826764571,Au,PRUNED
5515,-430.87121212114675,2026-04-07 11:38:04.171597,2026-04-07 11:38:05.046858,0 days 00:00:00.875261,21.19643170470796,19.536240231539235,1.0414136752546328,Au,COMPLETE
5516,0.0,2026-04-07 11:38:04.378050,2026-04-07 11:38:05.314749,0 days 00:00:00.936699,20.27930004780814,16.861734958599122,0.8252061522247583,Au,PRUNED
5517,80.55555555555317,2026-04-07 11:38:04.411368,2026-04-07 11:38:05.317263,0 days 00:00:00.905895,30.401165690899372,17.228995129749073,0.9622985310420283,Au,PRUNED
5518,-1.0,2026-04-07 11:38:04.426036,2026-04-07 11:38:05.007070,0 days 00:00:00.581034,29.576619316007168,19.819571390629033,1.0569728528240316,Au,COMPLETE
5519,-1.0,2026-04-07 11:38:04.487288,2026-04-07 11:38:05.192152,0 days 00:00:00.704864,20.23415783845195,19.798042510837373,0.7236441133279301,Cu,COMPLETE
5520,0.0,2026-04-07 11:38:04.702491,2026-04-07 11:38:05.557966,0 days 00:00:00.855475,20.204137474840266,18.87132514549784,1.0066474864750954,Au,PRUNED
5521,-427.31829573928434,2026-04-07 11:38:04.792116,2026-04-07 11:38:05.421647,0 days 00:00:00.629531,21.159061365042678,19.86836979827595,0.5580614575533352,Au,COMPLETE
5522,-1.0,2026-04-07 11:38:04.832529,2026-04-07 11:38:05.817391,0 days 00:00:00.984862,30.778868770503735,17.262002460781876,0.9014801389761616,Au,COMPLETE
5523,0.0,2026-04-07 11:38:05.216824,2026-04-07 11:38:05.901961,0 days 00:00:00.685137,32.23253937468434,17.624546471841846,0.5732017538872308,Au,PRUNED
5524,0.0,2026-04-07 11:38:05.365288,2026-04-07 11:38:06.083881,0 days 00:00:00.718593,20.762317005037456,18.191341457954742,0.966982549753221,Au,PRUNED
5525,0.0,2026-04-07 11:38:05.496869,2026-04-07 11:38:06.406280,0 days 00:00:00.909411,20.139271664987994,18.26269151756877,0.9337639004899347,Au,PRUNED
5526,-1.0,2026-04-07 11:38:05.527104,2026-04-07 11:38:06.083881,0 days 00:00:00.556777,32.14096554420153,18.15769489192576,0.7085982352046438,Au,COMPLETE
5527,-430.5555555554903,2026-04-07 11:38:05.630803,2026-04-07 11:38:06.277154,0 days 00:00:00.646351,20.758169109324527,19.946531293346666,0.8138643285889153,Au,COMPLETE
5528,-1.0,2026-04-07 11:38:05.646603,2026-04-07 11:38:06.325538,0 days 00:00:00.678935,117.98672101026803,6.624269259617881,1.7018496983051628,Ag,COMPLETE
5529,-1.0,2026-04-07 11:38:05.763463,2026-04-07 11:38:06.276153,0 days 00:00:00.512690,36.45961397075186,19.48568200334924,0.10940194599256775,Au,COMPLETE
5530,-1.0,2026-04-07 11:38:05.974720,2026-04-07 11:38:06.423287,0 days 00:00:00.448567,40.41105782411534,19.889068961765638,0.23434547775550116,Au,COMPLETE
5531,-1.0,2026-04-07 11:38:06.018685,2026-04-07 11:38:06.484143,0 days 00:00:00.465458,20.21087651279956,19.697347493107234,0.6591531321364731,Au,COMPLETE
5532,-1.0,2026-04-07 11:38:06.235895,2026-04-07 11:38:06.949610,0 days 00:00:00.713715,20.624642035312295,19.72410726487882,0.6834982345070224,Au,COMPLETE
5533,-1.0,2026-04-07 11:38:06.284962,2026-04-07 11:38:07.035439,0 days 00:00:00.750477,20.26205404229578,16.484656754213546,0.6929218295827302,Au,COMPLETE
5534,-1.0,2026-04-07 11:38:06.460058,2026-04-07 11:38:07.052287,0 days 00:00:00.592229,31.222801931252157,15.017734418407953,0.8050716326166762,Au,COMPLETE
5535,-1.0,2026-04-07 11:38:06.474428,2026-04-07 11:38:07.223511,0 days 00:00:00.749083,60.4054631564435,19.66432234372048,0.6954853625095111,Au,COMPLETE
5536,0.0,2026-04-07 11:38:06.486764,2026-04-07 11:38:07.157726,0 days 00:00:00.670962,33.44351797250128,19.85498281066227,0.5761736359053544,Au,PRUNED
5537,0.0,2026-04-07 11:38:06.439158,2026-04-07 11:38:07.297204,0 days 00:00:00.858046,20.213902717085166,19.931256794305508,0.2450933386915789,Au,PRUNED
5538,-1.0,2026-04-07 11:38:06.575567,2026-04-07 11:38:07.225507,0 days 00:00:00.649940,30.909997729102876,17.352906845401513,0.8754808086943163,Au,COMPLETE
5539,0.0,2026-04-07 11:38:06.841117,2026-04-07 11:38:07.474613,0 days 00:00:00.633496,32.74832896913369,19.88656122993579,0.9551852399720632,Au,PRUNED
5540,0.0,2026-04-07 11:38:07.093358,2026-04-07 11:38:07.956700,0 days 00:00:00.863342,20.379150260103316,17.193200338830806,0.8147822258163849,Au,PRUNED
5541,0.0,2026-04-07 11:38:07.197552,2026-04-07 11:38:08.063779,0 days 00:00:00.866227,20.579437332794246,17.33301858760506,1.0394399456217833,Au,PRUNED
5542,0.0,2026-04-07 11:38:07.300785,2026-04-07 11:38:08.255965,0 days 00:00:00.955180,32.73665373211068,19.867145856897178,0.8841991763498044,Au,PRUNED
5543,-1.0,2026-04-07 11:38:07.344295,2026-04-07 11:38:07.954577,0 days 00:00:00.610282,42.5665800874039,17.716535648557635,0.9496888296434857,Au,COMPLETE
5544,-1.0,2026-04-07 11:38:07.403013,2026-04-07 11:38:08.034045,0 days 00:00:00.631032,20.204117799184445,18.461740756023033,0.7327543280529312,Au,COMPLETE
5545,0.0,2026-04-07 11:38:07.428088,2026-04-07 11:38:08.331910,0 days 00:00:00.903822,39.47049225833382,17.454178161418646,0.39804065703769537,Au,PRUNED
5546,0.0,2026-04-07 11:38:07.609997,2026-04-07 11:38:08.639625,0 days 00:00:01.029628,20.0082079244762,18.228503670553053,0.9986406368875989,Au,PRUNED
5547,2.6881720430104057,2026-04-07 11:38:07.629989,2026-04-07 11:38:08.345698,0 days 00:00:00.715709,23.02663116062793,19.96342310128145,0.8278724966515493,Au,PRUNED
5548,0.0,2026-04-07 11:38:08.125199,2026-04-07 11:38:09.044320,0 days 00:00:00.919121,20.775255739399473,17.0012236993752,0.11017634172334145,Au,PRUNED
5549,-1.0,2026-04-07 11:38:08.193413,2026-04-07 11:38:08.864937,0 days 00:00:00.671524,20.039354646695095,17.237209781300102,0.6383136135582312,Au,COMPLETE
5550,-1.0,2026-04-07 11:38:08.163143,2026-04-07 11:38:08.940975,0 days 00:00:00.777832,32.866422896263444,17.74531030372928,0.6714930734823031,Au,COMPLETE
5551,0.0,2026-04-07 11:38:08.353646,2026-04-07 11:38:09.043272,0 days 00:00:00.689626,33.78835286703044,19.965164635899598,1.085366737857759,Au,PRUNED
5552,0.0,2026-04-07 11:38:08.365253,2026-04-07 11:38:09.204564,0 days 00:00:00.839311,27.37375727367396,19.993295155698277,0.45851289373822063,Au,PRUNED
5553,-1.0,2026-04-07 11:38:08.391080,2026-04-07 11:38:08.941978,0 days 00:00:00.550898,20.447818131062764,18.871490613912485,1.0462848068241104,Ag,COMPLETE
5554,0.0,2026-04-07 11:38:08.413918,2026-04-07 11:38:09.370827,0 days 00:00:00.956909,34.06085327745115,19.999883893687663,0.2694646015253732,Au,PRUNED
5555,-1.0,2026-04-07 11:38:08.742267,2026-04-07 11:38:09.331517,0 days 00:00:00.589250,20.858902205638273,19.942707306287215,0.2050267636760708,Ag,COMPLETE
5556,-1.0,2026-04-07 11:38:09.080431,2026-04-07 11:38:09.736397,0 days 00:00:00.655966,20.160831669346887,12.770548297640048,0.4203546376215468,Au,COMPLETE
5557,0.0,2026-04-07 11:38:09.132268,2026-04-07 11:38:09.994638,0 days 00:00:00.862370,32.14495672261648,19.697431959944733,0.9954483335709443,Au,PRUNED
5558,0.0,2026-04-07 11:38:09.169574,2026-04-07 11:38:09.880437,0 days 00:00:00.710863,20.040759780947337,16.10957795449246,0.667641775363235,Au,PRUNED
5559,0.0,2026-04-07 11:38:09.232654,2026-04-07 11:38:10.016785,0 days 00:00:00.784131,20.04762759364891,19.581276464013015,0.6229615186736692,Au,PRUNED
5560,0.0,2026-04-07 11:38:09.296189,2026-04-07 11:38:10.248169,0 days 00:00:00.951980,37.32586023463365,19.963579377560805,0.579900510995677,Au,PRUNED
5561,-1.0,2026-04-07 11:38:09.429544,2026-04-07 11:38:10.128988,0 days 00:00:00.699444,20.11462835844422,17.03668715349594,1.0639146221637956,Au,COMPLETE
5562,-1.0,2026-04-07 11:38:09.485504,2026-04-07 11:38:10.142734,0 days 00:00:00.657230,32.37004440444631,19.952983955935714,0.5793524769917139,Au,COMPLETE
5563,-367.64705882348085,2026-04-07 11:38:09.641904,2026-04-07 11:38:10.314509,0 days 00:00:00.672605,20.117038228651893,19.52732016164233,0.9965189136093245,Au,COMPLETE
5564,0.0,2026-04-07 11:38:09.935702,2026-04-07 11:38:10.579347,0 days 00:00:00.643645,20.05308889067017,17.63611279917514,0.34955577667442883,Au,PRUNED
5565,-1.0,2026-04-07 11:38:10.008165,2026-04-07 11:38:10.550119,0 days 00:00:00.541954,22.414086432876434,17.344336905304967,0.6989094716202383,Ag,COMPLETE
5566,0.0,2026-04-07 11:38:10.102874,2026-04-07 11:38:10.943769,0 days 00:00:00.840895,20.97478918243037,17.49248904226149,0.49097320929439503,Au,PRUNED
5567,-1.0,2026-04-07 11:38:10.153234,2026-04-07 11:38:10.859861,0 days 00:00:00.706627,22.848647457067052,19.974366089828575,1.0179672918746354,Au,COMPLETE
5568,-1.0,2026-04-07 11:38:10.315519,2026-04-07 11:38:11.202620,0 days 00:00:00.887101,41.50673598495148,19.7802841456409,0.9633538696583825,Ag,COMPLETE
5569,0.0,2026-04-07 11:38:10.429001,2026-04-07 11:38:11.188077,0 days 00:00:00.759076,44.8480931485401,17.803863622689367,0.3034236716168587,Au,PRUNED
5570,0.0,2026-04-07 11:38:10.564774,2026-04-07 11:38:11.388452,0 days 00:00:00.823678,20.604239021783766,17.666519007291548,0.6897609768275996,Au,PRUNED
5571,-1.0,2026-04-07 11:38:10.723598,2026-04-07 11:38:11.387452,0 days 00:00:00.663854,20.0361836407092,18.1937385443587,0.7157240533975304,Au,COMPLETE
5572,0.0,2026-04-07 11:38:10.761217,2026-04-07 11:38:11.474993,0 days 00:00:00.713776,47.19014746651433,19.842809809239302,0.8216820729020836,Au,PRUNED
5573,0.0,2026-04-07 11:38:10.824584,2026-04-07 11:38:11.625611,0 days 00:00:00.801027,20.343405010751436,17.53575398332198,0.35400814635795474,Au,PRUNED
5574,-0.5787037037036875,2026-04-07 11:38:11.070384,2026-04-07 11:38:11.954460,0 days 00:00:00.884076,53.60861982653272,14.06615945496199,0.4704331227705833,Au,PRUNED
5575,-9.9999999999984,2026-04-07 11:38:11.145769,2026-04-07 11:38:11.982835,0 days 00:00:00.837066,21.91025075546215,19.939126236867406,0.4637553683028342,Au,PRUNED
5576,-1.0,2026-04-07 11:38:11.358256,2026-04-07 11:38:12.154434,0 days 00:00:00.796178,33.41264594794367,17.851089436394442,0.9578936440123222,Au,COMPLETE
5577,-1.0,2026-04-07 11:38:11.440678,2026-04-07 11:38:12.047102,0 days 00:00:00.606424,20.978660835254168,19.904454648102405,1.062483912560203,Au,COMPLETE
5578,-1.0,2026-04-07 11:38:11.478502,2026-04-07 11:38:12.126445,0 days 00:00:00.647943,20.50297665927432,19.970858091315765,0.9847071293233349,Au,COMPLETE
5579,0.0,2026-04-07 11:38:11.583160,2026-04-07 11:38:12.249009,0 days 00:00:00.665849,28.165746613650647,19.99232331577534,0.7079646473265421,Au,PRUNED
5580,-1.0,2026-04-07 11:38:11.723468,2026-04-07 11:38:12.388640,0 days 00:00:00.665172,43.59598759275945,17.031208164251293,0.8157963387769072,Au,COMPLETE
5581,-1.0,2026-04-07 11:38:11.827162,2026-04-07 11:38:12.419554,0 days 00:00:00.592392,33.96837426542478,15.932505020493833,1.1202353389334165,Ag,COMPLETE
5582,-1.0,2026-04-07 11:38:12.066239,2026-04-07 11:38:12.732503,0 days 00:00:00.666264,21.64035732816648,19.989772826882454,0.3570697074444853,Au,COMPLETE
5583,5.608974358973928,2026-04-07 11:38:12.086464,2026-04-07 11:38:12.903374,0 days 00:00:00.816910,48.31634661874298,19.672950774134176,0.41232113019465944,Ag,PRUNED
5584,-1.0,2026-04-07 11:38:12.148206,2026-04-07 11:38:12.655732,0 days 00:00:00.507526,35.09868574458932,19.979835434900096,0.6234183143777193,Cu,COMPLETE
5585,0.0,2026-04-07 11:38:12.289895,2026-04-07 11:38:12.904374,0 days 00:00:00.614479,29.5789232520166,19.99815905212263,0.8738613583449302,Au,PRUNED
5586,-1.0,2026-04-07 11:38:12.339218,2026-04-07 11:38:13.180019,0 days 00:00:00.840801,20.14504215031916,17.215193431923034,0.9327473992449649,Au,COMPLETE
5587,-1.0,2026-04-07 11:38:12.404416,2026-04-07 11:38:13.342790,0 days 00:00:00.938374,21.24571020122849,19.79925855974795,0.6561936019869943,Au,COMPLETE
5588,-1.0,2026-04-07 11:38:12.580224,2026-04-07 11:38:13.312395,0 days 00:00:00.732171,35.82311661587191,15.097335572467596,0.4008269401459533,Au,COMPLETE
5589,-1.0,2026-04-07 11:38:12.596372,2026-04-07 11:38:13.343814,0 days 00:00:00.747442,48.87276578571306,19.96101683335371,0.8178568452375412,Au,COMPLETE
5590,-1.0,2026-04-07 11:38:12.922742,2026-04-07 11:38:13.445491,0 days 00:00:00.522749,20.54694425273549,17.743024931211856,0.6537661226236233,Au,COMPLETE
5591,-1.0,2026-04-07 11:38:13.029415,2026-04-07 11:38:13.559338,0 days 00:00:00.529923,42.93188988935983,17.624152559378935,0.3628583608598539,Au,COMPLETE
5592,-1.0,2026-04-07 11:38:12.956989,2026-04-07 11:38:13.450006,0 days 00:00:00.493017,32.93661915340411,17.98277850999547,0.5994842703835408,Au,COMPLETE
