number,value,datetime_start,datetime_complete,duration,params_D2_nm,params_D3_nm,params_D4_nm,params_metal,state
3920,-1.0,2026-04-07 11:35:05.248140,2026-04-07 11:35:05.755449,0 days 00:00:00.507309,20.324244219181775,19.788182798005437,0.9641606992641831,Au,COMPLETE
3921,0.0,2026-04-07 11:35:05.281437,2026-04-07 11:35:06.042105,0 days 00:00:00.760668,33.36933356984274,19.545505857267745,1.1570136735074843,Au,PRUNED
3922,9.403372243839025,2026-04-07 11:35:05.535349,2026-04-07 11:35:05.980112,0 days 00:00:00.444763,99.63286660855559,16.062369414383237,0.43668574596767795,Ag,PRUNED
3923,-444.98697916659717,2026-04-07 11:35:05.579413,2026-04-07 11:35:06.506514,0 days 00:00:00.927101,21.097350962281322,19.996381076448902,0.7608729483425221,Au,COMPLETE
3924,-1.0,2026-04-07 11:35:05.695227,2026-04-07 11:35:06.402834,0 days 00:00:00.707607,34.23581605636015,19.938751480811234,0.854821409830147,Au,COMPLETE
3925,0.0,2026-04-07 11:35:05.872051,2026-04-07 11:35:06.804428,0 days 00:00:00.932377,20.21904462265035,17.211314277517985,1.0402601678455057,Au,PRUNED
3926,-1.0,2026-04-07 11:35:05.999910,2026-04-07 11:35:06.789528,0 days 00:00:00.789618,50.18029397751202,4.626200491313933,0.9842718444251299,Au,COMPLETE
3927,0.0,2026-04-07 11:35:06.061369,2026-04-07 11:35:06.804428,0 days 00:00:00.743059,37.04501336369011,19.968943194385798,0.7489436684031576,Au,PRUNED
3928,-1.0,2026-04-07 11:35:06.073057,2026-04-07 11:35:06.757292,0 days 00:00:00.684235,30.746479431561596,19.993894426014382,0.8459291647074769,Au,COMPLETE
3929,-8.802816901407956,2026-04-07 11:35:06.146824,2026-04-07 11:35:06.802821,0 days 00:00:00.655997,73.56546980520704,7.107593272938576,1.9843157480727327,Cu,PRUNED
3930,-1.0,2026-04-07 11:35:06.184019,2026-04-07 11:35:06.721512,0 days 00:00:00.537493,52.63815408025415,19.96725302074289,0.9483721644260384,Au,COMPLETE
3931,-401.59574468079353,2026-04-07 11:35:06.841526,2026-04-07 11:35:07.429095,0 days 00:00:00.587569,20.522159236951442,19.840527349310886,0.7939987540221798,Au,COMPLETE
3932,-395.3962703962157,2026-04-07 11:35:06.870989,2026-04-07 11:35:07.584089,0 days 00:00:00.713100,20.205127472183342,19.93207980735303,0.8608436468562934,Au,COMPLETE
3933,0.0,2026-04-07 11:35:06.902085,2026-04-07 11:35:07.630671,0 days 00:00:00.728586,20.074063487892445,17.05135582717603,0.7356020938177884,Au,PRUNED
3934,-1.0,2026-04-07 11:35:06.915831,2026-04-07 11:35:07.676565,0 days 00:00:00.760734,35.581356361495935,17.716307061922066,0.6197580490563774,Au,COMPLETE
3935,-1.0,2026-04-07 11:35:06.931777,2026-04-07 11:35:07.544987,0 days 00:00:00.613210,45.2858107921573,13.931303725959184,0.6581179898157474,Au,COMPLETE
3936,-8.01282051281928,2026-04-07 11:35:06.946501,2026-04-07 11:35:07.727868,0 days 00:00:00.781367,21.492165255012097,19.845283704743146,0.919945432727819,Au,PRUNED
3937,-1.0,2026-04-07 11:35:06.991841,2026-04-07 11:35:07.678572,0 days 00:00:00.686731,33.16451393137341,19.93327930652995,0.6885791646050192,Au,COMPLETE
3938,-9.615384615383135,2026-04-07 11:35:07.009761,2026-04-07 11:35:07.605882,0 days 00:00:00.596121,21.83856891479191,19.618680326774065,0.856635582886042,Au,PRUNED
3939,-1.0,2026-04-07 11:35:07.605882,2026-04-07 11:35:08.106406,0 days 00:00:00.500524,32.05865760039883,19.9204121359716,0.6300205389927638,Au,COMPLETE
3940,0.0,2026-04-07 11:35:07.712930,2026-04-07 11:35:08.333252,0 days 00:00:00.620322,20.111856826690623,17.947558655923455,1.0976792502730455,Au,PRUNED
3941,-372.24061810149647,2026-04-07 11:35:07.728867,2026-04-07 11:35:08.310867,0 days 00:00:00.582000,20.199749784055864,19.830900153114424,0.6471894228060959,Au,COMPLETE
3942,-1.0,2026-04-07 11:35:07.808350,2026-04-07 11:35:08.308868,0 days 00:00:00.500518,34.002491993750496,17.057986028832815,0.7314696841562687,Au,COMPLETE
3943,-1.0,2026-04-07 11:35:07.820762,2026-04-07 11:35:08.267084,0 days 00:00:00.446322,32.19097954929886,14.134631447394444,0.9373816050785666,Ag,COMPLETE
3944,0.0,2026-04-07 11:35:07.835792,2026-04-07 11:35:08.758923,0 days 00:00:00.923131,37.41023043993418,16.65659193844665,0.6622090329017963,Au,PRUNED
3945,-1.0,2026-04-07 11:35:07.867037,2026-04-07 11:35:08.459322,0 days 00:00:00.592285,22.152264206065134,16.23561019813977,0.55722392250635,Au,COMPLETE
3946,0.0,2026-04-07 11:35:08.016748,2026-04-07 11:35:08.727263,0 days 00:00:00.710515,21.51015664256009,17.31868961329103,0.4823598974568952,Au,PRUNED
3947,-1.0,2026-04-07 11:35:08.367001,2026-04-07 11:35:08.998091,0 days 00:00:00.631090,21.95580731544005,19.887056489704847,0.9531502683172896,Au,COMPLETE
3948,0.0,2026-04-07 11:35:08.414598,2026-04-07 11:35:09.149502,0 days 00:00:00.734904,20.218554385795958,15.422870412808146,0.7463360656718441,Au,PRUNED
3949,0.0,2026-04-07 11:35:08.431367,2026-04-07 11:35:09.147269,0 days 00:00:00.715902,38.175125351627074,19.669487443514477,0.8187955504254698,Au,PRUNED
3950,-1.0,2026-04-07 11:35:08.499529,2026-04-07 11:35:09.144714,0 days 00:00:00.645185,20.304664993633555,19.777760130397926,0.7522715484123267,Au,COMPLETE
3951,-0.8928571428571173,2026-04-07 11:35:08.539038,2026-04-07 11:35:09.270643,0 days 00:00:00.731605,20.695390609980645,16.71966953510198,0.8491301444671157,Ag,PRUNED
3952,0.0,2026-04-07 11:35:08.682711,2026-04-07 11:35:09.449150,0 days 00:00:00.766439,20.265716152425952,19.173968475580086,0.6304487668854843,Au,PRUNED
3953,-22.91666666666208,2026-04-07 11:35:08.788214,2026-04-07 11:35:09.549310,0 days 00:00:00.761096,49.51144342562996,6.03789605013959,1.8845763546588983,Ag,PRUNED
3954,-1.0,2026-04-07 11:35:08.884052,2026-04-07 11:35:09.550313,0 days 00:00:00.666261,35.49033188314478,19.916941491524735,0.9151168948577043,Ag,COMPLETE
3955,-1.0,2026-04-07 11:35:09.205037,2026-04-07 11:35:09.959667,0 days 00:00:00.754630,29.25828824891618,19.798426384851357,0.794289935276955,Au,COMPLETE
3956,0.0,2026-04-07 11:35:09.245309,2026-04-07 11:35:09.864893,0 days 00:00:00.619584,20.01152236992677,16.824470941246123,0.5787080890891348,Au,PRUNED
3957,-392.3611111110566,2026-04-07 11:35:09.301907,2026-04-07 11:35:10.144226,0 days 00:00:00.842319,20.24417437595505,19.875247813200424,0.8563535752541219,Au,COMPLETE
3958,-1.0,2026-04-07 11:35:09.359759,2026-04-07 11:35:10.037845,0 days 00:00:00.678086,20.345909636691392,16.73896368971308,0.8555151296299761,Au,COMPLETE
3959,0.0,2026-04-07 11:35:09.452149,2026-04-07 11:35:10.191407,0 days 00:00:00.739258,31.98732591398355,19.859239221266517,1.0426218175323643,Au,PRUNED
3960,0.0,2026-04-07 11:35:09.520753,2026-04-07 11:35:10.207683,0 days 00:00:00.686930,30.570768752183035,19.919446648686325,1.0661519918952327,Au,PRUNED
3961,-1.0,2026-04-07 11:35:09.739941,2026-04-07 11:35:10.332304,0 days 00:00:00.592363,20.084791778084863,17.771929947342617,0.9966905979477685,Au,COMPLETE
3962,-1.0,2026-04-07 11:35:09.775772,2026-04-07 11:35:10.363422,0 days 00:00:00.587650,22.175083363381813,19.817262694972275,0.5975340726173646,Au,COMPLETE
3963,-8.333333333332,2026-04-07 11:35:10.055455,2026-04-07 11:35:10.955689,0 days 00:00:00.900234,21.25351554498615,19.93396078909904,1.0006507186499398,Au,PRUNED
3964,-1.0,2026-04-07 11:35:10.120302,2026-04-07 11:35:10.848740,0 days 00:00:00.728438,38.939793055067504,19.97970305303255,0.4066451767772551,Au,COMPLETE
3965,-1.0,2026-04-07 11:35:10.238613,2026-04-07 11:35:10.931090,0 days 00:00:00.692477,21.768675869852046,19.93257007467278,0.7391361040291256,Au,COMPLETE
3966,-1.0,2026-04-07 11:35:10.336826,2026-04-07 11:35:10.846219,0 days 00:00:00.509393,20.253252868535505,16.924877180126163,0.7380861586354501,Au,COMPLETE
3967,72.68856447688353,2026-04-07 11:35:10.405267,2026-04-07 11:35:11.361720,0 days 00:00:00.956453,36.82732400987345,18.13698971210404,0.3978047156063317,Cu,PRUNED
3968,-1.0,2026-04-07 11:35:10.426455,2026-04-07 11:35:10.847227,0 days 00:00:00.420772,20.970980961869547,16.849761500957115,0.638409643357494,Au,COMPLETE
3969,-1.0,2026-04-07 11:35:10.490542,2026-04-07 11:35:10.863110,0 days 00:00:00.372568,33.55782151462709,17.665684860404227,0.768713208495222,Au,COMPLETE
3970,-1.0,2026-04-07 11:35:10.566502,2026-04-07 11:35:11.125485,0 days 00:00:00.558983,48.05566101046418,19.937344899071753,0.9474930917843999,Au,COMPLETE
3971,0.0,2026-04-07 11:35:10.889845,2026-04-07 11:35:11.392703,0 days 00:00:00.502858,33.20150755037793,19.84073841717698,0.5842937371935948,Au,PRUNED
3972,-1.0,2026-04-07 11:35:10.999042,2026-04-07 11:35:11.553842,0 days 00:00:00.554800,32.24843929091263,17.53030674040056,0.96926546002809,Au,COMPLETE
3973,0.0,2026-04-07 11:35:10.928577,2026-04-07 11:35:11.911073,0 days 00:00:00.982496,46.570515477183,17.260276668308983,0.8090047686125491,Au,PRUNED
3974,-1.0,2026-04-07 11:35:11.042560,2026-04-07 11:35:11.526173,0 days 00:00:00.483613,45.96382649454314,19.84511695755591,0.8137132306443722,Au,COMPLETE
3975,-1.0,2026-04-07 11:35:11.209816,2026-04-07 11:35:11.661953,0 days 00:00:00.452137,35.93127641089969,19.90096889430086,0.46941422628171925,Au,COMPLETE
3976,-1.0,2026-04-07 11:35:11.392703,2026-04-07 11:35:11.913602,0 days 00:00:00.520899,23.12115143304201,19.887978110153547,0.7494064931853336,Au,COMPLETE
3977,-1.0,2026-04-07 11:35:11.453554,2026-04-07 11:35:12.157487,0 days 00:00:00.703933,61.950215462737724,6.168900649239709,0.9659743136320449,Cu,COMPLETE
3978,0.0,2026-04-07 11:35:11.471563,2026-04-07 11:35:12.285370,0 days 00:00:00.813807,41.36067399248261,14.731271990729756,0.8201848835974702,Au,PRUNED
3979,0.0,2026-04-07 11:35:11.486937,2026-04-07 11:35:12.330088,0 days 00:00:00.843151,34.73608921319485,17.757000807518857,0.7227398566703995,Au,PRUNED
3980,-1.0,2026-04-07 11:35:11.813034,2026-04-07 11:35:12.189571,0 days 00:00:00.376537,38.73306875293285,19.945786909821344,0.9113132376150348,Au,COMPLETE
3981,-1.0,2026-04-07 11:35:11.830240,2026-04-07 11:35:12.331643,0 days 00:00:00.501403,33.42077482277502,19.589453352836173,0.948111187535226,Au,COMPLETE
3982,-1.0,2026-04-07 11:35:11.846079,2026-04-07 11:35:12.535593,0 days 00:00:00.689514,31.132236210956307,14.550300533566734,0.6855128380792807,Au,COMPLETE
3983,-0.5364806866952697,2026-04-07 11:35:12.058472,2026-04-07 11:35:12.748285,0 days 00:00:00.689813,72.75535041596731,16.629929073490132,1.2267692128175622,Au,PRUNED
3984,-1.0,2026-04-07 11:35:12.049699,2026-04-07 11:35:12.623376,0 days 00:00:00.573677,30.325963909797725,17.617593048912216,1.108792345359338,Au,COMPLETE
3985,0.0,2026-04-07 11:35:12.300651,2026-04-07 11:35:12.961776,0 days 00:00:00.661125,20.080427446315586,16.237777147830144,0.7767493648439943,Au,PRUNED
3986,-1.0,2026-04-07 11:35:12.380769,2026-04-07 11:35:12.961776,0 days 00:00:00.581007,20.423418551357283,17.84614857656405,1.0876397957322317,Au,COMPLETE
3987,-1.0,2026-04-07 11:35:12.393689,2026-04-07 11:35:12.828176,0 days 00:00:00.434487,32.43833562661422,16.98112246636746,0.7414439631759709,Au,COMPLETE
3988,-1.0,2026-04-07 11:35:12.445184,2026-04-07 11:35:13.042673,0 days 00:00:00.597489,34.03667716405978,19.69752997587233,0.8087671572183444,Au,COMPLETE
3989,0.0,2026-04-07 11:35:12.415400,2026-04-07 11:35:13.269570,0 days 00:00:00.854170,32.93842324606486,17.074724305406175,0.8115363427482454,Au,PRUNED
3990,-1.0,2026-04-07 11:35:12.729939,2026-04-07 11:35:13.282039,0 days 00:00:00.552100,21.178585793319172,16.530607524235013,0.6912039606218063,Au,COMPLETE
3991,-1.0,2026-04-07 11:35:12.815942,2026-04-07 11:35:13.437618,0 days 00:00:00.621676,32.7227412315356,19.91299812871821,0.600658470791062,Au,COMPLETE
3992,0.0,2026-04-07 11:35:12.843272,2026-04-07 11:35:13.497987,0 days 00:00:00.654715,28.910558946245715,19.966045141287776,0.7653788708009646,Au,PRUNED
3993,-1.0,2026-04-07 11:35:12.972965,2026-04-07 11:35:13.783121,0 days 00:00:00.810156,20.370936802202056,17.293661152938384,0.5357940832585921,Au,COMPLETE
3994,0.0,2026-04-07 11:35:13.022937,2026-04-07 11:35:13.848605,0 days 00:00:00.825668,32.37943829155083,17.435142724022217,0.83787272833723,Au,PRUNED
3995,-1.0,2026-04-07 11:35:13.184211,2026-04-07 11:35:13.661886,0 days 00:00:00.477675,30.341195158332603,19.91013794669145,0.8026473771728928,Au,COMPLETE
3996,0.0,2026-04-07 11:35:13.198786,2026-04-07 11:35:13.988664,0 days 00:00:00.789878,22.695314520588536,19.90170028279693,0.7304055239971258,Au,PRUNED
3997,-1.0,2026-04-07 11:35:13.416085,2026-04-07 11:35:13.805698,0 days 00:00:00.389613,20.020184351506973,19.30783603494356,0.5058282061596663,Au,COMPLETE
3998,-1.0,2026-04-07 11:35:13.500595,2026-04-07 11:35:14.367424,0 days 00:00:00.866829,20.159453031695683,16.80374888190635,1.1346658965809107,Au,COMPLETE
3999,0.0,2026-04-07 11:35:13.585825,2026-04-07 11:35:14.463850,0 days 00:00:00.878025,30.552994829445097,19.792211214201927,1.0715495602564413,Au,PRUNED
4000,79.93827160493589,2026-04-07 11:35:13.601478,2026-04-07 11:35:14.461337,0 days 00:00:00.859859,31.58772136398975,17.169168158785475,0.8934468665046837,Au,PRUNED
4001,0.0,2026-04-07 11:35:13.767017,2026-04-07 11:35:14.462844,0 days 00:00:00.695827,33.59873066822951,19.93492701236447,1.0838609637618324,Au,PRUNED
4002,0.0,2026-04-07 11:35:13.945425,2026-04-07 11:35:14.736835,0 days 00:00:00.791410,34.515132603328965,18.099672099803055,1.120436777243871,Au,PRUNED
4003,0.0,2026-04-07 11:35:13.977592,2026-04-07 11:35:14.796797,0 days 00:00:00.819205,20.347147606887738,17.65416923076544,1.0220916259245751,Au,PRUNED
4004,0.0,2026-04-07 11:35:14.020207,2026-04-07 11:35:14.735824,0 days 00:00:00.715617,20.14784159213988,17.41251601820148,1.1275219931179576,Au,PRUNED
4005,-1.0,2026-04-07 11:35:14.038627,2026-04-07 11:35:14.615653,0 days 00:00:00.577026,38.535976755166494,14.753724165921016,1.083987758089591,Au,COMPLETE
4006,0.0,2026-04-07 11:35:14.484796,2026-04-07 11:35:15.272345,0 days 00:00:00.787549,20.916209661392678,16.879572143819882,0.9254285479325137,Au,PRUNED
4007,-1.0,2026-04-07 11:35:14.568319,2026-04-07 11:35:15.271082,0 days 00:00:00.702763,29.489900333628064,17.241373336831312,0.9440769035595201,Au,COMPLETE
4008,0.0,2026-04-07 11:35:14.642099,2026-04-07 11:35:15.241551,0 days 00:00:00.599452,20.362574063555048,18.56436905301471,0.8227237850045648,Au,PRUNED
4009,-1.0,2026-04-07 11:35:14.680781,2026-04-07 11:35:15.317362,0 days 00:00:00.636581,33.68931184543783,17.466425208701118,0.6754382093093865,Au,COMPLETE
4010,-1.0,2026-04-07 11:35:14.833484,2026-04-07 11:35:15.460502,0 days 00:00:00.627018,31.730577554957748,17.324386337024343,0.8408887473867812,Au,COMPLETE
4011,0.0,2026-04-07 11:35:14.880394,2026-04-07 11:35:15.789442,0 days 00:00:00.909048,37.210290230960524,19.940453084639998,0.8473176833558207,Au,PRUNED
4012,-378.07606263977044,2026-04-07 11:35:14.898227,2026-04-07 11:35:15.553099,0 days 00:00:00.654872,20.754011222635945,19.465524081873586,0.6791502619566088,Au,COMPLETE
4013,0.0,2026-04-07 11:35:14.950943,2026-04-07 11:35:15.461502,0 days 00:00:00.510559,35.98865076615169,19.982289185792673,0.9644643156379529,Au,PRUNED
4014,-1.0,2026-04-07 11:35:15.433795,2026-04-07 11:35:16.191926,0 days 00:00:00.758131,34.13493301914069,17.365973757507128,0.5006811497178703,Au,COMPLETE
4015,-1.0,2026-04-07 11:35:15.504311,2026-04-07 11:35:16.148811,0 days 00:00:00.644500,96.6050924374809,8.585101703608583,0.5273025882969204,Cu,COMPLETE
4016,-1.0,2026-04-07 11:35:15.524050,2026-04-07 11:35:16.190912,0 days 00:00:00.666862,92.41064339345917,1.4824193915030186,1.6475797603665285,Au,COMPLETE
4017,0.0,2026-04-07 11:35:15.571376,2026-04-07 11:35:16.507176,0 days 00:00:00.935800,30.595964744722217,19.741604678200943,1.0827655944366583,Au,PRUNED
4018,0.0,2026-04-07 11:35:15.603429,2026-04-07 11:35:16.398534,0 days 00:00:00.795105,20.24310524035705,19.455151116025228,0.7471868000132056,Au,PRUNED
4019,0.0,2026-04-07 11:35:15.725752,2026-04-07 11:35:16.403050,0 days 00:00:00.677298,20.81289672186775,17.722209573704244,0.8765828454830881,Au,PRUNED
4020,-386.7009132419558,2026-04-07 11:35:15.806352,2026-04-07 11:35:16.400659,0 days 00:00:00.594307,20.00464070845581,19.861732462575386,1.0011620029547745,Au,COMPLETE
4021,-1.0,2026-04-07 11:35:15.887158,2026-04-07 11:35:16.854809,0 days 00:00:00.967651,20.272477058184194,17.500135849828126,1.1349883829215746,Au,COMPLETE
4022,-1.0,2026-04-07 11:35:16.224124,2026-04-07 11:35:16.894549,0 days 00:00:00.670425,20.519663475406336,17.172298575997246,0.9909980214084789,Au,COMPLETE
4023,-370.6140350876705,2026-04-07 11:35:16.410085,2026-04-07 11:35:17.112564,0 days 00:00:00.702479,20.220921795971943,19.374578666359163,1.1354099139090197,Au,COMPLETE
4024,0.0,2026-04-07 11:35:16.504604,2026-04-07 11:35:17.035192,0 days 00:00:00.530588,37.03442745960884,19.90026753787428,1.123719822958623,Au,PRUNED
4025,-1.0,2026-04-07 11:35:16.527195,2026-04-07 11:35:17.018245,0 days 00:00:00.491050,49.42246042253762,14.932818497843018,1.2351517390947266,Au,COMPLETE
4026,0.0,2026-04-07 11:35:16.504604,2026-04-07 11:35:17.191100,0 days 00:00:00.686496,20.287506452174156,18.181001488137095,1.1612428828046792,Au,PRUNED
4027,-1.0,2026-04-07 11:35:16.583649,2026-04-07 11:35:17.286448,0 days 00:00:00.702799,31.84686858265647,17.893642844543034,0.8155962132520955,Au,COMPLETE
4028,0.0,2026-04-07 11:35:16.733322,2026-04-07 11:35:17.564091,0 days 00:00:00.830769,45.16127115864281,16.481910254317654,0.9811069375957684,Au,PRUNED
4029,0.0,2026-04-07 11:35:17.059821,2026-04-07 11:35:17.866403,0 days 00:00:00.806582,32.50497961469648,17.235024896003985,1.1720249108642065,Au,PRUNED
4030,0.0,2026-04-07 11:35:17.098961,2026-04-07 11:35:17.813088,0 days 00:00:00.714127,46.531985927674995,17.409650030701716,1.0101122597009158,Au,PRUNED
4031,-1.0,2026-04-07 11:35:17.115696,2026-04-07 11:35:17.750134,0 days 00:00:00.634438,45.71695943255578,2.4476367480736263,1.9014439021843104,Ag,COMPLETE
4032,-1.0,2026-04-07 11:35:17.206409,2026-04-07 11:35:17.699368,0 days 00:00:00.492959,26.763224954071138,19.939890840688562,1.0157896680526324,Au,COMPLETE
4033,-452.0502645501923,2026-04-07 11:35:17.380406,2026-04-07 11:35:18.127418,0 days 00:00:00.747012,21.544490894710318,19.96474164981077,0.4563092796536603,Au,COMPLETE
4034,-1.0,2026-04-07 11:35:17.395493,2026-04-07 11:35:17.977670,0 days 00:00:00.582177,33.11188039913487,18.00431615623011,1.1580422361457785,Au,COMPLETE
4035,-0.8680555555555314,2026-04-07 11:35:17.480137,2026-04-07 11:35:18.264064,0 days 00:00:00.783927,54.05587727985651,16.86392300158685,0.42622395867060303,Au,PRUNED
4036,-1.0,2026-04-07 11:35:17.662727,2026-04-07 11:35:18.402419,0 days 00:00:00.739692,20.819409248806554,19.936564022452487,1.1642357664387462,Au,COMPLETE
4037,-1.0,2026-04-07 11:35:17.912543,2026-04-07 11:35:18.440299,0 days 00:00:00.527756,35.16563156018019,19.795013846983124,0.7224824953083184,Au,COMPLETE
4038,0.0,2026-04-07 11:35:17.948367,2026-04-07 11:35:18.670746,0 days 00:00:00.722379,20.615197639048596,18.2828330411253,0.8987627433157886,Au,PRUNED
4039,-325.0487329434317,2026-04-07 11:35:17.982185,2026-04-07 11:35:18.606094,0 days 00:00:00.623909,22.855385941392058,17.470541430696734,0.3837961737869456,Au,COMPLETE
4040,-430.87121212114675,2026-04-07 11:35:18.106082,2026-04-07 11:35:18.914771,0 days 00:00:00.808689,21.21992697180204,19.696195636246102,0.7897419734001105,Au,COMPLETE
4041,-1.0,2026-04-07 11:35:18.201353,2026-04-07 11:35:18.789830,0 days 00:00:00.588477,39.28820093188322,19.703430707815944,0.4723396795034476,Au,COMPLETE
4042,82.71604938271359,2026-04-07 11:35:18.345443,2026-04-07 11:35:19.340526,0 days 00:00:00.995083,26.058398106640098,19.86537212292998,0.42815765485113866,Au,PRUNED
4043,81.17283950617043,2026-04-07 11:35:18.548938,2026-04-07 11:35:19.297094,0 days 00:00:00.748156,29.62323928218004,17.997628865265437,0.4751680002833972,Au,PRUNED
4044,-1.0,2026-04-07 11:35:18.651418,2026-04-07 11:35:19.177454,0 days 00:00:00.526036,36.41097889239515,19.94854444652455,0.5219595118331573,Au,COMPLETE
4045,-1.0,2026-04-07 11:35:18.607428,2026-04-07 11:35:19.324709,0 days 00:00:00.717281,30.182014801469798,19.477848773407988,0.488961804948688,Au,COMPLETE
4046,-1.0,2026-04-07 11:35:18.755186,2026-04-07 11:35:19.509902,0 days 00:00:00.754716,36.97657452531444,19.587725461170137,0.3798516223660299,Au,COMPLETE
4047,-1.0,2026-04-07 11:35:18.857117,2026-04-07 11:35:19.338953,0 days 00:00:00.481836,100.46659648459675,15.681641430148296,0.2224219842613323,Cu,COMPLETE
4048,82.72058823529169,2026-04-07 11:35:18.989077,2026-04-07 11:35:19.654314,0 days 00:00:00.665237,25.934387922910005,19.377161207871083,0.4287507101948058,Au,PRUNED
4049,-398.1807511736532,2026-04-07 11:35:19.073021,2026-04-07 11:35:19.767863,0 days 00:00:00.694842,20.666425635048554,19.89693730995246,0.5483729871044938,Au,COMPLETE
4050,0.0,2026-04-07 11:35:19.292477,2026-04-07 11:35:20.103926,0 days 00:00:00.811449,32.76840623105048,18.750146200826613,0.37437182980942274,Au,PRUNED
4051,-1.0,2026-04-07 11:35:19.343648,2026-04-07 11:35:20.184873,0 days 00:00:00.841225,35.62330759004266,19.918436390354607,0.6071747270259666,Au,COMPLETE
4052,-0.5827505827505663,2026-04-07 11:35:19.473691,2026-04-07 11:35:20.138756,0 days 00:00:00.665065,52.21815858278393,16.946283906437266,0.5595758405958957,Au,PRUNED
4053,-1.0,2026-04-07 11:35:19.553187,2026-04-07 11:35:20.305728,0 days 00:00:00.752541,21.621703211331752,17.679808753692676,0.47043477998549404,Au,COMPLETE
4054,0.0,2026-04-07 11:35:19.592559,2026-04-07 11:35:20.228848,0 days 00:00:00.636289,30.86623888026106,19.97228334404411,0.6388201257919572,Au,PRUNED
4055,-1.0,2026-04-07 11:35:19.796419,2026-04-07 11:35:20.365770,0 days 00:00:00.569351,20.697650771221678,19.764920779510998,0.44681867874876297,Au,COMPLETE
4056,-1.0,2026-04-07 11:35:19.770873,2026-04-07 11:35:20.264757,0 days 00:00:00.493884,31.868738859154348,16.366038486169977,0.3940849121108632,Au,COMPLETE
4057,-1.0,2026-04-07 11:35:19.920490,2026-04-07 11:35:20.635839,0 days 00:00:00.715349,25.52950917228288,16.27959758196432,0.45460063320934596,Au,COMPLETE
4058,-1.0,2026-04-07 11:35:20.167912,2026-04-07 11:35:20.727421,0 days 00:00:00.559509,22.51441805165296,17.53660682375428,0.5614514968645135,Au,COMPLETE
