number,value,datetime_start,datetime_complete,duration,params_D2_nm,params_D3_nm,params_D4_nm,params_metal,state
5733,-1.0,2026-04-07 11:38:30.162777,2026-04-07 11:38:30.894256,0 days 00:00:00.731479,35.8818168577016,16.86760324848259,0.7229202612652749,Cu,COMPLETE
5734,-1.0,2026-04-07 11:38:30.189618,2026-04-07 11:38:30.997447,0 days 00:00:00.807829,35.531165386022465,19.74658074063324,0.9098130102199792,Ag,COMPLETE
5735,-1.0,2026-04-07 11:38:30.389498,2026-04-07 11:38:31.065083,0 days 00:00:00.675585,20.30731024963835,19.535698200416533,0.8031648912771958,Ag,COMPLETE
5736,-1.0,2026-04-07 11:38:30.459158,2026-04-07 11:38:31.064075,0 days 00:00:00.604917,21.290106617875793,19.84337767285515,0.7210524390455512,Au,COMPLETE
5737,-1.0,2026-04-07 11:38:30.584228,2026-04-07 11:38:31.191209,0 days 00:00:00.606981,20.00714578049705,19.899722130288033,0.7066284707910871,Au,COMPLETE
5738,-9.9999999999984,2026-04-07 11:38:30.754700,2026-04-07 11:38:31.371814,0 days 00:00:00.617114,21.29781938108777,19.96764584152309,0.8080067071372706,Au,PRUNED
5739,-1.0,2026-04-07 11:38:30.802380,2026-04-07 11:38:31.361715,0 days 00:00:00.559335,29.608552773943373,17.817021874250006,0.8248786958040046,Au,COMPLETE
5740,0.0,2026-04-07 11:38:31.124342,2026-04-07 11:38:31.975235,0 days 00:00:00.850893,32.26032505070806,19.97588426060853,0.7066468621983439,Au,PRUNED
5741,-1.0,2026-04-07 11:38:31.094817,2026-04-07 11:38:31.710095,0 days 00:00:00.615278,33.69508648965966,17.497052465500847,0.4775628508061688,Au,COMPLETE
5742,-1.0,2026-04-07 11:38:31.270732,2026-04-07 11:38:31.929015,0 days 00:00:00.658283,54.476387755401745,18.652954939223825,0.10706931827362198,Au,COMPLETE
5743,-1.0,2026-04-07 11:38:31.407866,2026-04-07 11:38:32.064336,0 days 00:00:00.656470,29.731579011864504,17.881172642409886,0.6575532020969573,Au,COMPLETE
5744,0.0,2026-04-07 11:38:31.375360,2026-04-07 11:38:32.179112,0 days 00:00:00.803752,32.60531937698446,19.69975996424528,0.5918312743936212,Au,PRUNED
5745,0.0,2026-04-07 11:38:30.979092,2026-04-07 11:38:32.180112,0 days 00:00:01.201020,20.129961904752182,17.50081344823996,0.6697984193370017,Au,PRUNED
5746,-1.0,2026-04-07 11:38:31.471599,2026-04-07 11:38:32.255350,0 days 00:00:00.783751,31.376736431723995,19.80562532708044,0.4886821269061578,Au,COMPLETE
5747,3.571428571428163,2026-04-07 11:38:31.783380,2026-04-07 11:38:32.647959,0 days 00:00:00.864579,31.266042306984577,15.286383048701417,0.5332414519826618,Au,PRUNED
5748,-1.0,2026-04-07 11:38:31.902143,2026-04-07 11:38:32.684018,0 days 00:00:00.781875,34.45687705578278,1.9326873821983366,0.9438866787678262,Ag,COMPLETE
5749,-1.0,2026-04-07 11:38:32.155677,2026-04-07 11:38:32.900866,0 days 00:00:00.745189,44.203808573511445,19.874537439575292,0.3583757364180916,Au,COMPLETE
5750,-1.0,2026-04-07 11:38:32.205766,2026-04-07 11:38:32.795131,0 days 00:00:00.589365,21.24587477881787,19.790313759242007,0.6284268468881229,Au,COMPLETE
5751,-1.0,2026-04-07 11:38:32.227476,2026-04-07 11:38:32.803395,0 days 00:00:00.575919,32.90558419783823,14.666342201104833,0.7837936556346626,Au,COMPLETE
5752,-1.0,2026-04-07 11:38:32.130364,2026-04-07 11:38:32.901870,0 days 00:00:00.771506,33.65113358519157,17.583974413644352,0.9102298033391553,Au,COMPLETE
5753,0.0,2026-04-07 11:38:32.286927,2026-04-07 11:38:33.194071,0 days 00:00:00.907144,34.6728054503478,17.787776779137307,0.5300198212998163,Au,PRUNED
5754,-1.0,2026-04-07 11:38:32.478600,2026-04-07 11:38:32.972539,0 days 00:00:00.493939,33.262821788223405,15.396190897419405,0.5724695293155948,Au,COMPLETE
5755,-1.0,2026-04-07 11:38:32.732235,2026-04-07 11:38:33.194071,0 days 00:00:00.461836,46.3404045379654,19.986498752828783,0.6397880486952015,Au,COMPLETE
5756,0.0,2026-04-07 11:38:32.858019,2026-04-07 11:38:33.773153,0 days 00:00:00.915134,36.42962312588934,17.95056506886979,0.43511447043711515,Au,PRUNED
5757,-1.0,2026-04-07 11:38:32.962579,2026-04-07 11:38:33.831957,0 days 00:00:00.869378,20.172298380508835,19.715127736177166,0.7856548384019759,Au,COMPLETE
5758,0.0,2026-04-07 11:38:33.072867,2026-04-07 11:38:33.991367,0 days 00:00:00.918500,32.25639766949496,19.861819572320773,0.2978394247722409,Au,PRUNED
5759,-1.0,2026-04-07 11:38:33.094488,2026-04-07 11:38:33.880789,0 days 00:00:00.786301,20.167426928027623,16.883964026532475,0.8097140084416987,Au,COMPLETE
5760,-1.0,2026-04-07 11:38:33.154293,2026-04-07 11:38:33.762011,0 days 00:00:00.607718,20.111112851140994,19.9800925133958,1.052364079006461,Au,COMPLETE
5761,0.0,2026-04-07 11:38:33.180571,2026-04-07 11:38:33.955819,0 days 00:00:00.775248,20.6310653981174,14.344931756565783,0.3862026505004321,Au,PRUNED
5762,-398.1807511736532,2026-04-07 11:38:33.318323,2026-04-07 11:38:33.988823,0 days 00:00:00.670500,20.3227727445214,19.954535047007457,0.7600645914096082,Au,COMPLETE
5763,-1.0,2026-04-07 11:38:33.534586,2026-04-07 11:38:33.994365,0 days 00:00:00.459779,33.5099108034179,19.98097301432515,0.5516595663932025,Au,COMPLETE
5764,80.55555555555317,2026-04-07 11:38:33.895592,2026-04-07 11:38:34.778629,0 days 00:00:00.883037,30.20500305322222,18.100983304558284,0.5715694673371692,Au,PRUNED
5765,-10.057471264367123,2026-04-07 11:38:34.035357,2026-04-07 11:38:35.142233,0 days 00:00:01.106876,34.730981042157566,7.568366757618903,0.6182143433782334,Au,PRUNED
5766,0.0,2026-04-07 11:38:34.061458,2026-04-07 11:38:34.776251,0 days 00:00:00.714793,20.571959139062464,17.238431091461543,0.7913475313979559,Au,PRUNED
5767,-1.0,2026-04-07 11:38:34.127652,2026-04-07 11:38:34.943518,0 days 00:00:00.815866,32.26227571963242,17.752606943843507,0.8710746460991327,Au,COMPLETE
5768,-1.0,2026-04-07 11:38:34.166828,2026-04-07 11:38:34.777628,0 days 00:00:00.610800,20.221063135356424,17.649532945032497,0.7893214167523883,Au,COMPLETE
5769,-1.0,2026-04-07 11:38:34.180296,2026-04-07 11:38:34.774207,0 days 00:00:00.593911,33.15989436198433,17.567703978284896,0.5172888651373564,Au,COMPLETE
5770,0.0,2026-04-07 11:38:34.243392,2026-04-07 11:38:34.778629,0 days 00:00:00.535237,32.62957364603366,19.944743502229038,0.4210445938915776,Au,PRUNED
5771,-1.0,2026-04-07 11:38:34.496533,2026-04-07 11:38:34.832256,0 days 00:00:00.335723,31.339799641312236,17.328641926784783,0.3331524142996175,Au,COMPLETE
5772,0.0,2026-04-07 11:38:34.910350,2026-04-07 11:38:35.640781,0 days 00:00:00.730431,20.438728754795992,18.54727977790869,0.28470822469024787,Au,PRUNED
5773,0.0,2026-04-07 11:38:34.962352,2026-04-07 11:38:35.782555,0 days 00:00:00.820203,31.601102862714143,19.832635645565457,0.4919020428259122,Au,PRUNED
5774,-1.0,2026-04-07 11:38:34.981875,2026-04-07 11:38:35.705102,0 days 00:00:00.723227,36.47058483372684,19.860378844054527,1.0267184119509007,Au,COMPLETE
5775,-1.0,2026-04-07 11:38:35.024992,2026-04-07 11:38:35.698843,0 days 00:00:00.673851,20.867013970156425,17.732408547669806,0.3156990127214275,Au,COMPLETE
5776,-1.0,2026-04-07 11:38:35.174270,2026-04-07 11:38:35.782555,0 days 00:00:00.608285,34.65518600572743,19.888650637115028,1.1481668112409376,Au,COMPLETE
5777,0.0,2026-04-07 11:38:35.191231,2026-04-07 11:38:35.844611,0 days 00:00:00.653380,44.511996904455785,17.88032511233789,0.9864772827591204,Au,PRUNED
5778,3.4722222222218364,2026-04-07 11:38:35.253070,2026-04-07 11:38:36.026342,0 days 00:00:00.773272,31.376807249920784,14.775000951672766,0.8513277931629497,Au,PRUNED
5779,0.0,2026-04-07 11:38:35.429131,2026-04-07 11:38:36.338716,0 days 00:00:00.909585,20.09703980488123,14.373990185862631,0.5898010065614192,Au,PRUNED
5780,-1.0,2026-04-07 11:38:35.725843,2026-04-07 11:38:36.580773,0 days 00:00:00.854930,21.270792031155953,17.399729758987394,0.9376681250403824,Ag,COMPLETE
5781,0.0,2026-04-07 11:38:35.769352,2026-04-07 11:38:36.798732,0 days 00:00:01.029380,29.27702394512284,19.904502142092323,0.3251321748119108,Au,PRUNED
5782,-1.0,2026-04-07 11:38:35.813401,2026-04-07 11:38:36.567585,0 days 00:00:00.754184,49.19828300067053,18.112443157704742,0.7386086020729923,Au,COMPLETE
5783,0.0,2026-04-07 11:38:35.961048,2026-04-07 11:38:36.766997,0 days 00:00:00.805949,20.2462336590921,15.659047942712649,0.6626746286895095,Au,PRUNED
5784,-1.0,2026-04-07 11:38:35.987367,2026-04-07 11:38:36.679674,0 days 00:00:00.692307,32.711709807410124,19.936562799810247,0.7912443163883438,Au,COMPLETE
5785,0.0,2026-04-07 11:38:36.040257,2026-04-07 11:38:36.746458,0 days 00:00:00.706201,31.077593921759707,19.866856630643237,0.28149915678873594,Au,PRUNED
5786,0.0,2026-04-07 11:38:36.124038,2026-04-07 11:38:36.745451,0 days 00:00:00.621413,20.09661441664176,14.659088262920317,0.7295288052606212,Au,PRUNED
5787,-1.0,2026-04-07 11:38:36.404894,2026-04-07 11:38:36.959988,0 days 00:00:00.555094,45.71101179274388,19.99342949399206,0.9157025723821093,Au,COMPLETE
5788,4.9999999999996,2026-04-07 11:38:36.755733,2026-04-07 11:38:37.697410,0 days 00:00:00.941677,30.943670916814295,15.89019116263045,0.570587689920694,Au,PRUNED
5789,-1.0,2026-04-07 11:38:36.775965,2026-04-07 11:38:37.608735,0 days 00:00:00.832770,77.74245294240335,17.895924438575896,1.6740681343010784,Ag,COMPLETE
5790,-1.0,2026-04-07 11:38:36.844279,2026-04-07 11:38:37.538123,0 days 00:00:00.693844,33.74696668936282,19.99852875747881,0.6139027505488528,Au,COMPLETE
5791,0.0,2026-04-07 11:38:36.888389,2026-04-07 11:38:37.551400,0 days 00:00:00.663011,20.531004841785283,19.721518252264357,0.30684546718378525,Au,PRUNED
5792,-1.0,2026-04-07 11:38:36.909453,2026-04-07 11:38:37.551400,0 days 00:00:00.641947,30.155186221366463,19.968672762837002,1.0285052743754028,Au,COMPLETE
5793,0.0,2026-04-07 11:38:36.924087,2026-04-07 11:38:37.653827,0 days 00:00:00.729740,20.237900925311493,16.889437605387755,0.8059299641146432,Cu,PRUNED
5794,-375.5555555555051,2026-04-07 11:38:36.943222,2026-04-07 11:38:37.653827,0 days 00:00:00.710605,20.310137618226236,19.76006735404225,0.7199102752677071,Au,COMPLETE
5795,0.0,2026-04-07 11:38:37.230231,2026-04-07 11:38:37.902091,0 days 00:00:00.671860,31.5493233996574,17.629607001057686,0.7953880252009116,Au,PRUNED
5796,-407.6738609112121,2026-04-07 11:38:37.676297,2026-04-07 11:38:38.536148,0 days 00:00:00.859851,20.28853432459011,19.993106388197134,0.8984501826753305,Au,COMPLETE
5797,-1.0,2026-04-07 11:38:37.756484,2026-04-07 11:38:38.728831,0 days 00:00:00.972347,20.546687178492565,16.29534591037825,0.669272237523421,Au,COMPLETE
5798,0.0,2026-04-07 11:38:37.764521,2026-04-07 11:38:38.626757,0 days 00:00:00.862236,43.02941412340999,17.881111210126445,0.7337364139067497,Au,PRUNED
5799,-1.2254901960782871,2026-04-07 11:38:37.796106,2026-04-07 11:38:38.536148,0 days 00:00:00.740042,30.521594742990537,15.296797381025565,0.3294876070949055,Au,PRUNED
5800,-1.0,2026-04-07 11:38:37.833739,2026-04-07 11:38:38.410612,0 days 00:00:00.576873,31.352157379720605,17.590387444887952,0.8988803849184971,Au,COMPLETE
5801,0.0,2026-04-07 11:38:38.007450,2026-04-07 11:38:38.624190,0 days 00:00:00.616740,32.15449382931109,17.149956270511954,0.9298909670709008,Au,PRUNED
5802,-1.0,2026-04-07 11:38:38.016539,2026-04-07 11:38:38.807978,0 days 00:00:00.791439,32.97521537628629,19.911640270851688,0.8324569104178182,Au,COMPLETE
5803,0.0,2026-04-07 11:38:38.033527,2026-04-07 11:38:39.044250,0 days 00:00:01.010723,20.28156009601329,16.38077642565714,0.5439383373462614,Au,PRUNED
5804,-1.0,2026-04-07 11:38:38.557518,2026-04-07 11:38:38.971711,0 days 00:00:00.414193,32.30051933389638,19.782077565245018,0.6683329834524359,Au,COMPLETE
5805,0.0,2026-04-07 11:38:38.609801,2026-04-07 11:38:39.364511,0 days 00:00:00.754710,31.601467136273385,17.78916767509411,1.0700795367584655,Au,PRUNED
5806,81.48148148147907,2026-04-07 11:38:38.701319,2026-04-07 11:38:39.878609,0 days 00:00:01.177290,29.561562061448107,17.374934831524754,0.769679511192167,Au,PRUNED
5807,-1.0,2026-04-07 11:38:38.726778,2026-04-07 11:38:39.441315,0 days 00:00:00.714537,38.26001573212754,19.94914032742536,0.9545885962331843,Au,COMPLETE
5808,80.24691358024454,2026-04-07 11:38:38.879557,2026-04-07 11:38:39.603792,0 days 00:00:00.724235,31.02696068976951,17.699271647166515,0.5732654932572485,Au,PRUNED
5809,-1.0,2026-04-07 11:38:39.106679,2026-04-07 11:38:40.001789,0 days 00:00:00.895110,48.36313891026912,12.521636974905157,1.6899869641833032,Ag,COMPLETE
5810,-1.0,2026-04-07 11:38:39.121259,2026-04-07 11:38:39.722197,0 days 00:00:00.600938,45.842269736009555,17.78598634059563,0.6191648382642017,Au,COMPLETE
5811,-1.0,2026-04-07 11:38:39.175817,2026-04-07 11:38:39.908829,0 days 00:00:00.733012,20.151741082294283,16.956374006314906,0.33276181860352333,Au,COMPLETE
5812,-1.0,2026-04-07 11:38:39.193368,2026-04-07 11:38:39.801964,0 days 00:00:00.608596,44.60730037262483,17.461934500372397,0.36206227849613876,Au,COMPLETE
5813,-1.0,2026-04-07 11:38:39.475154,2026-04-07 11:38:40.060938,0 days 00:00:00.585784,24.13568645198272,19.912893288367425,0.6167790688352238,Cu,COMPLETE
5814,0.0,2026-04-07 11:38:39.543725,2026-04-07 11:38:40.159077,0 days 00:00:00.615352,46.75768232394966,16.249944987690323,0.12086663053874347,Au,PRUNED
5815,-8.333333333332,2026-04-07 11:38:39.767213,2026-04-07 11:38:40.639250,0 days 00:00:00.872037,21.960551395840778,19.89193869986005,0.565266554861682,Au,PRUNED
5816,0.0,2026-04-07 11:38:39.974735,2026-04-07 11:38:40.875693,0 days 00:00:00.900958,31.767287822675858,19.93677883352334,1.1465039825467194,Au,PRUNED
5817,-1.0,2026-04-07 11:38:39.990758,2026-04-07 11:38:40.584681,0 days 00:00:00.593923,45.32013437415165,19.89012636360261,0.4881940098773163,Au,COMPLETE
5818,81.49509803921329,2026-04-07 11:38:40.074417,2026-04-07 11:38:41.156019,0 days 00:00:01.081602,28.478349233219042,17.88156433718275,0.572893420877324,Au,PRUNED
5819,-1.0,2026-04-07 11:38:40.017931,2026-04-07 11:38:40.704077,0 days 00:00:00.686146,22.423394709357474,19.979260572990515,0.8761225906185143,Au,COMPLETE
5820,-1.0,2026-04-07 11:38:40.233944,2026-04-07 11:38:40.799110,0 days 00:00:00.565166,20.223579456673782,19.499506731274508,0.5235404120489493,Au,COMPLETE
5821,-380.9121621621107,2026-04-07 11:38:40.295753,2026-04-07 11:38:41.092059,0 days 00:00:00.796306,20.159724932707874,19.692844704090266,0.9633182665938759,Au,COMPLETE
5822,-1.0,2026-04-07 11:38:40.322000,2026-04-07 11:38:41.025393,0 days 00:00:00.703393,20.395078670478824,16.79663582635322,0.9514235365991421,Au,COMPLETE
5823,0.0,2026-04-07 11:38:40.745002,2026-04-07 11:38:41.600076,0 days 00:00:00.855074,35.822959674015806,19.990237191210188,0.8688988611710635,Au,PRUNED
5824,0.0,2026-04-07 11:38:40.791900,2026-04-07 11:38:41.731911,0 days 00:00:00.940011,20.688211404377192,16.887607756112576,1.1072493461494874,Au,PRUNED
5825,0.0,2026-04-07 11:38:40.947246,2026-04-07 11:38:41.729399,0 days 00:00:00.782153,36.697134407780695,19.89751417363085,0.8175353095976594,Au,PRUNED
5826,82.72058823529169,2026-04-07 11:38:40.973040,2026-04-07 11:38:41.925475,0 days 00:00:00.952435,25.265551388584655,19.94146998625527,0.3907234973449547,Au,PRUNED
5827,0.0,2026-04-07 11:38:41.102762,2026-04-07 11:38:41.966381,0 days 00:00:00.863619,21.253600669726023,17.444856345181556,0.10188061000813975,Au,PRUNED
5828,-1.0,2026-04-07 11:38:41.290418,2026-04-07 11:38:41.951676,0 days 00:00:00.661258,20.143659672958915,17.06974022157205,0.3795268061298384,Au,COMPLETE
5829,-1.0,2026-04-07 11:38:41.314066,2026-04-07 11:38:41.922965,0 days 00:00:00.608899,20.113467731447606,19.753795386859952,0.8854601440940034,Au,COMPLETE
5830,79.93827160493589,2026-04-07 11:38:41.440378,2026-04-07 11:38:42.155350,0 days 00:00:00.714972,31.927495260999848,17.452284889860334,0.41316158670091535,Au,PRUNED
5831,-410.92995169076204,2026-04-07 11:38:41.795386,2026-04-07 11:38:42.654655,0 days 00:00:00.859269,20.12766448795234,19.935482387261928,1.1385093908908832,Au,COMPLETE
5832,-1.0,2026-04-07 11:38:41.810477,2026-04-07 11:38:42.730150,0 days 00:00:00.919673,49.81706849356992,9.650481958518897,0.9128051880191214,Cu,COMPLETE
5833,0.0,2026-04-07 11:38:41.846823,2026-04-07 11:38:42.653419,0 days 00:00:00.806596,21.172569257226137,17.66448116921099,0.7948895502235258,Au,PRUNED
5834,-1.0,2026-04-07 11:38:42.078805,2026-04-07 11:38:42.689567,0 days 00:00:00.610762,20.92394433532458,16.53761681247239,0.48880150443771764,Au,COMPLETE
5835,0.0,2026-04-07 11:38:42.108882,2026-04-07 11:38:43.057010,0 days 00:00:00.948128,43.73382611079174,19.98036949431257,0.7452739717059343,Au,PRUNED
5836,0.0,2026-04-07 11:38:42.167317,2026-04-07 11:38:42.977091,0 days 00:00:00.809774,50.17951655271991,19.933338022529952,0.13306653300733884,Au,PRUNED
5837,0.0,2026-04-07 11:38:42.212574,2026-04-07 11:38:42.973082,0 days 00:00:00.760508,34.61180507614316,17.306256536762692,0.2902465575504418,Au,PRUNED
5838,-10.204081632652228,2026-04-07 11:38:42.241220,2026-04-07 11:38:42.975087,0 days 00:00:00.733867,42.95675714768254,7.298897787350969,0.6875005747532503,Cu,PRUNED
5839,-1.0,2026-04-07 11:38:42.887474,2026-04-07 11:38:43.737712,0 days 00:00:00.850238,20.40339203212209,17.457628818040945,0.7616616326057225,Au,COMPLETE
5840,0.0,2026-04-07 11:38:42.907002,2026-04-07 11:38:43.771222,0 days 00:00:00.864220,21.08787861648756,17.60100832746364,0.9194881430561014,Au,PRUNED
5841,0.0,2026-04-07 11:38:42.999232,2026-04-07 11:38:43.868582,0 days 00:00:00.869350,46.63705729284037,17.82181834569069,1.162397377363506,Au,PRUNED
5842,-1.0,2026-04-07 11:38:43.149703,2026-04-07 11:38:43.902662,0 days 00:00:00.752959,35.69211528543371,19.752574290562336,0.669661793874432,Au,COMPLETE
5843,0.0,2026-04-07 11:38:43.184527,2026-04-07 11:38:44.255967,0 days 00:00:01.071440,32.75788604553108,17.868365078448544,0.35868172994986774,Au,PRUNED
5844,-1.0,2026-04-07 11:38:43.199954,2026-04-07 11:38:43.850617,0 days 00:00:00.650663,20.834870696879708,17.538995631612604,0.545245843487334,Au,COMPLETE
5845,-8.333333333332,2026-04-07 11:38:43.215015,2026-04-07 11:38:44.020044,0 days 00:00:00.805029,21.539087229926466,19.924031205156727,0.8422606740494711,Au,PRUNED
5846,-8.01282051281928,2026-04-07 11:38:43.275561,2026-04-07 11:38:44.254463,0 days 00:00:00.978902,22.052615200645963,19.845261928613663,0.6062353573685445,Au,PRUNED
5847,0.0,2026-04-07 11:38:43.867581,2026-04-07 11:38:44.904632,0 days 00:00:01.037051,20.175717701440387,19.891881008989476,0.42000169230320983,Au,PRUNED
5848,0.0,2026-04-07 11:38:43.938849,2026-04-07 11:38:44.906140,0 days 00:00:00.967291,20.66411992388622,19.537973814981683,0.31827391823006357,Au,PRUNED
5849,-1.0,2026-04-07 11:38:44.050409,2026-04-07 11:38:44.837159,0 days 00:00:00.786750,39.89569601322279,15.243015782986825,0.7008869730834144,Au,COMPLETE
5850,-1.0,2026-04-07 11:38:44.112905,2026-04-07 11:38:44.813856,0 days 00:00:00.700951,38.05770269628936,19.977964253984332,0.6580939227177219,Au,COMPLETE
5851,-1.0,2026-04-07 11:38:44.215615,2026-04-07 11:38:44.847345,0 days 00:00:00.631730,29.89124600604388,17.3743749817341,0.8305439146925729,Au,COMPLETE
5852,-1.0,2026-04-07 11:38:44.290939,2026-04-07 11:38:45.004247,0 days 00:00:00.713308,33.05026095172901,17.9767936472078,0.9366819217373874,Au,COMPLETE
5853,-1.0,2026-04-07 11:38:44.309193,2026-04-07 11:38:44.905631,0 days 00:00:00.596438,26.548116108392986,19.778646127558567,0.12423622028234138,Au,COMPLETE
5854,-0.6802721088435263,2026-04-07 11:38:44.332780,2026-04-07 11:38:44.989046,0 days 00:00:00.656266,78.91775410733639,11.226508728507868,0.8170932645225619,Au,PRUNED
5855,0.0,2026-04-07 11:38:44.960457,2026-04-07 11:38:45.854927,0 days 00:00:00.894470,31.544724377077312,19.97498449512136,1.112340292577621,Au,PRUNED
5856,-1.0,2026-04-07 11:38:45.056449,2026-04-07 11:38:45.681808,0 days 00:00:00.625359,23.513195255119097,19.95237513899319,0.6118875630898385,Au,COMPLETE
5857,-1.0,2026-04-07 11:38:45.069765,2026-04-07 11:38:45.671055,0 days 00:00:00.601290,33.52628435977989,19.9865792316137,1.0591280053120422,Au,COMPLETE
5858,-1.0,2026-04-07 11:38:45.086391,2026-04-07 11:38:45.719174,0 days 00:00:00.632783,31.809925032487804,18.13618214978498,0.4540000949033032,Au,COMPLETE
5859,-24.6913580246877,2026-04-07 11:38:45.100667,2026-04-07 11:38:45.922748,0 days 00:00:00.822081,32.13352139896589,19.806785817929768,0.4664084858988221,Ag,PRUNED
5860,-1.0,2026-04-07 11:38:45.119636,2026-04-07 11:38:45.757111,0 days 00:00:00.637475,29.2433509226453,17.050468651336587,0.6473127960548894,Au,COMPLETE
5861,-1.0,2026-04-07 11:38:45.166930,2026-04-07 11:38:45.866822,0 days 00:00:00.699892,29.70830389650821,17.997266801239032,0.7333645060071036,Au,COMPLETE
5862,80.86419753086179,2026-04-07 11:38:45.348947,2026-04-07 11:38:45.935574,0 days 00:00:00.586627,30.645862188506097,17.799357897974097,0.3620785293399274,Au,PRUNED
5863,-1.0,2026-04-07 11:38:45.852920,2026-04-07 11:38:46.571614,0 days 00:00:00.718694,20.43175756423655,17.45810146448796,0.6039558657832174,Au,COMPLETE
5864,0.0,2026-04-07 11:38:45.933768,2026-04-07 11:38:46.797379,0 days 00:00:00.863611,20.07420494461762,17.374963805011483,0.4995212181075911,Au,PRUNED
5865,0.0,2026-04-07 11:38:46.023312,2026-04-07 11:38:46.678609,0 days 00:00:00.655297,20.056082431232376,18.1473088370724,1.058541660298336,Au,PRUNED
5866,-1.0,2026-04-07 11:38:46.041688,2026-04-07 11:38:46.879665,0 days 00:00:00.837977,57.50784854813081,17.2093294410067,1.4318862489661481,Ag,COMPLETE
5867,0.0,2026-04-07 11:38:46.057500,2026-04-07 11:38:46.945200,0 days 00:00:00.887700,20.389167336730395,15.602975599522667,0.2996300933180622,Au,PRUNED
5868,-1.0,2026-04-07 11:38:46.107281,2026-04-07 11:38:46.680446,0 days 00:00:00.573165,20.219630307135358,19.682215758342785,0.3246617558317455,Au,COMPLETE
5869,0.0,2026-04-07 11:38:46.126976,2026-04-07 11:38:46.978789,0 days 00:00:00.851813,30.567830044940557,17.952683031346698,1.1440417826307157,Au,PRUNED
5870,-1.0,2026-04-07 11:38:46.178546,2026-04-07 11:38:46.853467,0 days 00:00:00.674921,20.12274673554089,17.722576007262887,0.7659731027229775,Au,COMPLETE
5871,0.0,2026-04-07 11:38:46.766770,2026-04-07 11:38:47.597436,0 days 00:00:00.830666,20.29857331282862,19.823771299814386,0.11569490435340724,Au,PRUNED
5872,-1.0,2026-04-07 11:38:46.811147,2026-04-07 11:38:47.626014,0 days 00:00:00.814867,35.22570724902517,19.9307464020039,0.8494643260988733,Au,COMPLETE
