number,value,datetime_start,datetime_complete,duration,params_D2_nm,params_D3_nm,params_D4_nm,params_metal,state
5873,0.0,2026-04-07 11:38:46.949559,2026-04-07 11:38:47.674242,0 days 00:00:00.724683,33.77462414218218,19.756218875491374,0.5029763603210278,Au,PRUNED
5874,-1.0,2026-04-07 11:38:46.993523,2026-04-07 11:38:47.594665,0 days 00:00:00.601142,20.25903007356837,19.654277976327844,0.8406747141648244,Au,COMPLETE
5875,-1.0,2026-04-07 11:38:47.029024,2026-04-07 11:38:47.753493,0 days 00:00:00.724469,33.373668159711755,17.516569027251684,0.9026819761025098,Au,COMPLETE
5876,-1.0,2026-04-07 11:38:47.078644,2026-04-07 11:38:47.656545,0 days 00:00:00.577901,29.841734035860966,17.534868368534866,0.7926593970641116,Cu,COMPLETE
5877,0.0,2026-04-07 11:38:47.116649,2026-04-07 11:38:47.895394,0 days 00:00:00.778745,33.11761627718299,19.965937327150854,0.8574790769628092,Au,PRUNED
5878,0.0,2026-04-07 11:38:47.128897,2026-04-07 11:38:48.000413,0 days 00:00:00.871516,34.24855887647096,17.592028384024218,0.8306467006579324,Au,PRUNED
5879,-1.0,2026-04-07 11:38:47.696971,2026-04-07 11:38:48.612348,0 days 00:00:00.915377,34.29619025733893,19.92831368494312,0.5749778618822055,Au,COMPLETE
5880,0.0,2026-04-07 11:38:47.838657,2026-04-07 11:38:48.940845,0 days 00:00:01.102188,31.081164151480102,17.60088418150617,1.027939762260948,Au,PRUNED
5881,80.55555555555317,2026-04-07 11:38:47.891873,2026-04-07 11:38:48.944911,0 days 00:00:01.053038,30.545750608501706,17.67687776978443,0.6465889273816106,Au,PRUNED
5882,-1.0,2026-04-07 11:38:48.035070,2026-04-07 11:38:48.611190,0 days 00:00:00.576120,62.20364961225488,17.17218537559349,0.840672775319058,Au,COMPLETE
5883,-1.0,2026-04-07 11:38:48.048669,2026-04-07 11:38:48.716945,0 days 00:00:00.668276,31.398511608359456,17.820112420383133,0.7222862618548146,Au,COMPLETE
5884,-1.0,2026-04-07 11:38:48.070655,2026-04-07 11:38:48.643977,0 days 00:00:00.573322,20.424328780841428,17.952457174263508,1.0403592307186913,Au,COMPLETE
5885,0.0,2026-04-07 11:38:48.097097,2026-04-07 11:38:48.912328,0 days 00:00:00.815231,32.158161048729625,19.73736314190465,0.5898593520313176,Au,PRUNED
5886,-1.0,2026-04-07 11:38:48.197232,2026-04-07 11:38:48.830380,0 days 00:00:00.633148,29.61432960828589,17.45797968539336,0.7175899632368815,Au,COMPLETE
5887,0.0,2026-04-07 11:38:48.769151,2026-04-07 11:38:49.687610,0 days 00:00:00.918459,35.06179555668632,19.95455626435941,0.6823422589266318,Au,PRUNED
5888,-1.0,2026-04-07 11:38:48.928203,2026-04-07 11:38:49.657141,0 days 00:00:00.728938,40.369621510417716,15.11588370151982,0.6728770340698546,Au,COMPLETE
5889,-1.0,2026-04-07 11:38:48.969525,2026-04-07 11:38:49.550241,0 days 00:00:00.580716,33.87978471301596,17.879072946799177,0.3993226538246344,Au,COMPLETE
5890,-1.0,2026-04-07 11:38:49.009057,2026-04-07 11:38:49.634006,0 days 00:00:00.624949,29.518108008448635,16.066297275111047,0.6843479004107869,Au,COMPLETE
5891,0.0,2026-04-07 11:38:49.060268,2026-04-07 11:38:49.844095,0 days 00:00:00.783827,28.419986599137115,19.87786839609913,0.734262093268294,Au,PRUNED
5892,0.0,2026-04-07 11:38:49.049898,2026-04-07 11:38:49.910612,0 days 00:00:00.860714,45.45083226038879,17.388191342040926,0.414924257627475,Au,PRUNED
5893,-2.166666666666632,2026-04-07 11:38:49.137265,2026-04-07 11:38:49.823030,0 days 00:00:00.685765,94.79140239833687,7.619668131265087,0.11285398259209001,Cu,PRUNED
5894,-1.0,2026-04-07 11:38:49.200826,2026-04-07 11:38:49.802021,0 days 00:00:00.601195,20.05586344711439,19.906924210107594,0.6994415437067942,Au,COMPLETE
5895,0.0,2026-04-07 11:38:49.707357,2026-04-07 11:38:50.573925,0 days 00:00:00.866568,20.163262105031365,15.594470333605258,1.0423554111795075,Au,PRUNED
5896,-1.0,2026-04-07 11:38:49.862673,2026-04-07 11:38:50.672286,0 days 00:00:00.809613,36.549082762787364,18.548045306083665,0.4741792565795143,Cu,COMPLETE
5897,-1.0,2026-04-07 11:38:49.879033,2026-04-07 11:38:50.467683,0 days 00:00:00.588650,20.627147856892716,19.745196306090076,0.7390658935050173,Au,COMPLETE
5898,-1.0,2026-04-07 11:38:49.894138,2026-04-07 11:38:50.580032,0 days 00:00:00.685894,31.359941444197894,17.791188700042326,0.9528729146192438,Au,COMPLETE
5899,-1.0,2026-04-07 11:38:49.911611,2026-04-07 11:38:50.517985,0 days 00:00:00.606374,20.54259881128702,19.839064098978078,0.7409689464401179,Au,COMPLETE
5900,0.0,2026-04-07 11:38:49.988492,2026-04-07 11:38:50.735762,0 days 00:00:00.747270,21.05095672193209,17.48421316782096,0.6876229486938906,Au,PRUNED
5901,-1.0,2026-04-07 11:38:50.003215,2026-04-07 11:38:50.572927,0 days 00:00:00.569712,32.059340292432125,19.90153217797561,0.2981824184882142,Au,COMPLETE
5902,-1.0,2026-04-07 11:38:50.017550,2026-04-07 11:38:50.700652,0 days 00:00:00.683102,21.550456032551335,19.901310079157486,0.5557167239207977,Au,COMPLETE
5903,0.0,2026-04-07 11:38:50.611928,2026-04-07 11:38:51.664658,0 days 00:00:01.052730,36.58623530554144,19.996466449149697,0.47234338276935833,Au,PRUNED
5904,80.55555555555317,2026-04-07 11:38:50.644376,2026-04-07 11:38:51.512725,0 days 00:00:00.868349,30.99280675920047,17.506130780944517,0.4789712022722861,Au,PRUNED
5905,0.0,2026-04-07 11:38:50.770383,2026-04-07 11:38:51.782550,0 days 00:00:01.012167,20.905877599803688,17.13775337666931,0.41421268823017615,Au,PRUNED
5906,0.0,2026-04-07 11:38:50.827942,2026-04-07 11:38:51.843640,0 days 00:00:01.015698,30.569658901213437,19.858256903852507,0.6977765738168294,Au,PRUNED
5907,-1.0,2026-04-07 11:38:50.862818,2026-04-07 11:38:51.578434,0 days 00:00:00.715616,45.35955318200038,17.09427136157653,0.9342399908781871,Au,COMPLETE
5908,-1.0,2026-04-07 11:38:50.971184,2026-04-07 11:38:51.580950,0 days 00:00:00.609766,45.77206530560173,17.569102319787582,0.8147753470486657,Au,COMPLETE
5909,82.41421568627209,2026-04-07 11:38:50.986014,2026-04-07 11:38:51.731668,0 days 00:00:00.745654,25.391577241716647,19.959394645720533,0.5784008834367497,Au,PRUNED
5910,-14.756944444443215,2026-04-07 11:38:51.043697,2026-04-07 11:38:51.698006,0 days 00:00:00.654309,33.08056391355434,17.081634076639656,0.7764970223373632,Ag,PRUNED
5911,-401.004728132331,2026-04-07 11:38:51.606184,2026-04-07 11:38:52.562202,0 days 00:00:00.956018,20.932937016689902,19.7816666847293,0.47075485614547213,Au,COMPLETE
5912,-1.0,2026-04-07 11:38:51.750998,2026-04-07 11:38:52.531937,0 days 00:00:00.780939,21.444532954179127,19.984618526526695,0.1695511633157032,Au,COMPLETE
5913,-1.0,2026-04-07 11:38:51.874646,2026-04-07 11:38:52.499537,0 days 00:00:00.624891,20.81506912063611,19.800168782848594,0.41021499466726496,Au,COMPLETE
5914,-413.6253041361929,2026-04-07 11:38:51.892033,2026-04-07 11:38:52.918159,0 days 00:00:01.026126,20.900266149238625,19.89196907612942,0.540602056046815,Au,COMPLETE
5915,4.084967320261118,2026-04-07 11:38:51.905617,2026-04-07 11:38:52.895652,0 days 00:00:00.990035,31.59420087407127,14.923523992144425,1.0556108386626386,Au,PRUNED
5916,-1.0,2026-04-07 11:38:51.926613,2026-04-07 11:38:52.530856,0 days 00:00:00.604243,20.92014487478764,17.169767144223005,0.5805127855875205,Au,COMPLETE
5917,-9.9999999999984,2026-04-07 11:38:51.956961,2026-04-07 11:38:52.967559,0 days 00:00:01.010598,21.52013990993479,19.886239972288806,0.7242837696442254,Au,PRUNED
5918,0.0,2026-04-07 11:38:52.257163,2026-04-07 11:38:52.641184,0 days 00:00:00.384021,45.529383730065206,17.592304280208268,0.5130507981176423,Au,PRUNED
5919,-1.0,2026-04-07 11:38:52.559339,2026-04-07 11:38:53.008114,0 days 00:00:00.448775,31.03404997130447,17.649964439055502,0.414782483772948,Au,COMPLETE
5920,0.0,2026-04-07 11:38:52.536663,2026-04-07 11:38:53.282902,0 days 00:00:00.746239,30.729609990959382,19.9734692899468,0.4032548479089321,Au,PRUNED
5921,0.0,2026-04-07 11:38:52.638330,2026-04-07 11:38:53.472981,0 days 00:00:00.834651,31.983927062846295,19.919976901087722,0.47418243212907646,Au,PRUNED
5922,-5.952380952380102,2026-04-07 11:38:52.730012,2026-04-07 11:38:53.562224,0 days 00:00:00.832212,33.855531500697374,19.845593129480882,0.7819274464772944,Ag,PRUNED
5923,-1.0,2026-04-07 11:38:52.938969,2026-04-07 11:38:53.967415,0 days 00:00:01.028446,20.627734900903818,17.601139449040343,0.5848655712687989,Au,COMPLETE
5924,0.0,2026-04-07 11:38:52.988427,2026-04-07 11:38:53.899491,0 days 00:00:00.911064,21.745186017948804,17.24599557654159,0.7761322101065232,Au,PRUNED
5925,0.0,2026-04-07 11:38:53.054858,2026-04-07 11:38:53.799254,0 days 00:00:00.744396,49.30328823643295,19.96517612601074,0.7236883802683667,Au,PRUNED
5926,-448.49081364822314,2026-04-07 11:38:53.083014,2026-04-07 11:38:53.951401,0 days 00:00:00.868387,20.98042392018113,19.998990987533432,0.9570766605957556,Au,COMPLETE
5927,-1.0,2026-04-07 11:38:53.287943,2026-04-07 11:38:53.899491,0 days 00:00:00.611548,31.845588112902433,17.360695469629903,0.8424726939229117,Au,COMPLETE
5928,0.0,2026-04-07 11:38:53.410925,2026-04-07 11:38:54.142154,0 days 00:00:00.731229,32.46014496202845,19.83397660909838,0.5277910902344132,Au,PRUNED
5929,0.0,2026-04-07 11:38:53.557914,2026-04-07 11:38:54.142154,0 days 00:00:00.584240,20.339731731108873,19.83639993492917,0.184242069840039,Au,PRUNED
5930,-1.0,2026-04-07 11:38:53.620411,2026-04-07 11:38:54.141123,0 days 00:00:00.520712,20.12572659606547,16.832559115537265,0.851723140196248,Au,COMPLETE
5931,-1.0,2026-04-07 11:38:53.875262,2026-04-07 11:38:54.728187,0 days 00:00:00.852925,31.773709319891335,17.8513817750629,1.1806865705463907,Au,COMPLETE
5932,-1.0,2026-04-07 11:38:54.039696,2026-04-07 11:38:54.836568,0 days 00:00:00.796872,33.10810926335372,17.849389126028974,1.1158891665915223,Au,COMPLETE
5933,-1.0,2026-04-07 11:38:54.093664,2026-04-07 11:38:54.653046,0 days 00:00:00.559382,20.06482004624244,15.25340052808425,0.9012155378300086,Au,COMPLETE
5934,0.0,2026-04-07 11:38:54.236594,2026-04-07 11:38:54.903369,0 days 00:00:00.666775,41.312979913843016,15.316956077126841,1.1107406291340027,Au,PRUNED
5935,-398.47417840369934,2026-04-07 11:38:54.288612,2026-04-07 11:38:55.040566,0 days 00:00:00.751954,20.34127392016153,19.687164360729625,1.0617868592209945,Au,COMPLETE
5936,-1.0,2026-04-07 11:38:54.311907,2026-04-07 11:38:54.962901,0 days 00:00:00.650994,39.300908295669416,19.978605340714456,0.8780829681245222,Au,COMPLETE
5937,0.0,2026-04-07 11:38:54.379506,2026-04-07 11:38:55.246848,0 days 00:00:00.867342,20.436371590926377,18.510631506561037,0.7383111739525107,Cu,PRUNED
5938,0.0,2026-04-07 11:38:54.467567,2026-04-07 11:38:55.390730,0 days 00:00:00.923163,42.35865159723186,15.35720790485567,1.0251801827039866,Au,PRUNED
5939,5.9523809523808575,2026-04-07 11:38:54.813016,2026-04-07 11:38:55.739188,0 days 00:00:00.926172,114.97996239393628,12.350983414484508,1.393630917655376,Ag,PRUNED
5940,-1.0,2026-04-07 11:38:54.927350,2026-04-07 11:38:55.591647,0 days 00:00:00.664297,50.40670619256358,12.91715752340989,1.9868752185695402,Cu,COMPLETE
5941,0.0,2026-04-07 11:38:54.950317,2026-04-07 11:38:55.859131,0 days 00:00:00.908814,32.62915217459596,19.919773351521577,0.5972534611844075,Au,PRUNED
5942,-407.3741007193657,2026-04-07 11:38:55.078317,2026-04-07 11:38:56.188717,0 days 00:00:01.110400,20.63368507473034,19.889653834836047,0.6791977875895754,Au,COMPLETE
5943,-1.0,2026-04-07 11:38:55.201690,2026-04-07 11:38:56.059768,0 days 00:00:00.858078,32.05266704538035,17.876232708013845,0.9260622416853259,Au,COMPLETE
5944,-10.03086419753012,2026-04-07 11:38:55.336284,2026-04-07 11:38:56.499502,0 days 00:00:01.163218,23.667401094697272,19.73871839094418,0.5734298051282017,Ag,PRUNED
5945,-0.8928571428571173,2026-04-07 11:38:55.483281,2026-04-07 11:38:56.323577,0 days 00:00:00.840296,21.016545698837245,17.98607863679384,0.630240454386545,Ag,PRUNED
5946,0.0,2026-04-07 11:38:55.555729,2026-04-07 11:38:56.620659,0 days 00:00:01.064930,31.3945994683095,18.189890250050514,1.0626273035384115,Au,PRUNED
5947,-1.0,2026-04-07 11:38:55.862152,2026-04-07 11:38:56.575894,0 days 00:00:00.713742,52.94266852668713,10.293768327481914,0.7230179180414817,Ag,COMPLETE
5948,-1.0,2026-04-07 11:38:55.901339,2026-04-07 11:38:56.826428,0 days 00:00:00.925089,32.08255606615752,17.53140306592971,0.20134918137293403,Au,COMPLETE
5949,-10.964912280700984,2026-04-07 11:38:55.980005,2026-04-07 11:38:56.815371,0 days 00:00:00.835366,29.795526515926674,15.084494450098536,0.11673315361543896,Cu,PRUNED
5950,0.0,2026-04-07 11:38:56.291764,2026-04-07 11:38:57.177503,0 days 00:00:00.885739,20.334089931541087,17.896121444952744,0.7422889314826469,Au,PRUNED
5951,-1.0,2026-04-07 11:38:56.395427,2026-04-07 11:38:57.076587,0 days 00:00:00.681160,32.52605538618673,19.916865862232882,1.0658567393391472,Au,COMPLETE
5952,-1.0,2026-04-07 11:38:56.436856,2026-04-07 11:38:57.105852,0 days 00:00:00.668996,20.275908208045955,17.319143649231098,0.7274041413036099,Au,COMPLETE
5953,0.0,2026-04-07 11:38:56.751524,2026-04-07 11:38:57.387049,0 days 00:00:00.635525,20.342106356975904,14.089398141584722,0.3395741244141969,Au,PRUNED
5954,0.0,2026-04-07 11:38:56.776419,2026-04-07 11:38:57.418775,0 days 00:00:00.642356,46.56143634365462,19.899612489788275,0.3046807437303092,Au,PRUNED
5955,0.0,2026-04-07 11:38:56.814361,2026-04-07 11:38:57.973408,0 days 00:00:01.159047,20.826867652019295,18.0668002771345,0.4966044095968649,Au,PRUNED
5956,0.0,2026-04-07 11:38:56.912933,2026-04-07 11:38:57.739011,0 days 00:00:00.826078,20.48054401643326,18.309448391776986,0.7375456628272304,Au,PRUNED
5957,0.0,2026-04-07 11:38:57.049336,2026-04-07 11:38:58.017578,0 days 00:00:00.968242,20.678329961782097,15.995820509545137,1.1380838650752463,Au,PRUNED
5958,-1.0,2026-04-07 11:38:57.313230,2026-04-07 11:38:58.152273,0 days 00:00:00.839043,31.323831530244753,17.92065516330957,0.5913724515487606,Au,COMPLETE
5959,-1.0,2026-04-07 11:38:57.330162,2026-04-07 11:38:58.015065,0 days 00:00:00.684903,22.392324639696135,19.92506681414767,0.852661342932051,Au,COMPLETE
5960,0.0,2026-04-07 11:38:57.383489,2026-04-07 11:38:58.093268,0 days 00:00:00.709779,39.72147151216612,19.987241642051256,0.4896520200321416,Au,PRUNED
5961,-1.0,2026-04-07 11:38:57.515132,2026-04-07 11:38:58.019836,0 days 00:00:00.504704,33.51188615418133,18.036858454462358,0.47986481802764314,Au,COMPLETE
5962,-1.0,2026-04-07 11:38:57.531617,2026-04-07 11:38:58.089363,0 days 00:00:00.557746,20.070619599466177,17.37293535719891,0.34304653299807186,Au,COMPLETE
5963,0.0,2026-04-07 11:38:57.786740,2026-04-07 11:38:58.505481,0 days 00:00:00.718741,33.47942239207741,19.861368256055393,0.709130989862631,Au,PRUNED
5964,-440.89147286814887,2026-04-07 11:38:58.015065,2026-04-07 11:38:59.424858,0 days 00:00:01.409793,21.16158956229475,19.950666789302097,0.6040396026042237,Au,COMPLETE
5965,0.0,2026-04-07 11:38:58.138666,2026-04-07 11:38:59.009344,0 days 00:00:00.870678,29.2115817724224,19.802810770699775,1.0526437315083785,Au,PRUNED
5966,-1.0,2026-04-07 11:38:58.190561,2026-04-07 11:38:58.915098,0 days 00:00:00.724537,29.833696930245953,19.86595042213681,0.9542107635565424,Au,COMPLETE
5967,0.0,2026-04-07 11:38:58.226963,2026-04-07 11:38:58.994668,0 days 00:00:00.767705,32.59628498503101,19.920815042554345,0.5565969419526458,Au,PRUNED
5968,-1.0,2026-04-07 11:38:58.254976,2026-04-07 11:38:59.077447,0 days 00:00:00.822471,41.40906442798496,17.580932255566296,0.5992436124975524,Au,COMPLETE
5969,0.0,2026-04-07 11:38:58.295203,2026-04-07 11:38:59.077447,0 days 00:00:00.782244,20.13710746583011,17.60483978116985,0.765659990085676,Au,PRUNED
5970,-0.664010624169976,2026-04-07 11:38:58.608966,2026-04-07 11:38:59.099822,0 days 00:00:00.490856,99.1431449934621,7.945857253294188,0.56094155679419,Au,PRUNED
5971,0.0,2026-04-07 11:38:58.644311,2026-04-07 11:38:59.423859,0 days 00:00:00.779548,21.00850316657356,17.533858117539385,1.1300845564963424,Au,PRUNED
5972,0.0,2026-04-07 11:38:59.102840,2026-04-07 11:38:59.951882,0 days 00:00:00.849042,31.381300374877974,19.808016988775236,0.8873100827248768,Au,PRUNED
5973,0.0,2026-04-07 11:38:59.153724,2026-04-07 11:39:00.018156,0 days 00:00:00.864432,20.24891672199648,17.610276488726218,0.6910389044397911,Au,PRUNED
5974,0.0,2026-04-07 11:38:59.142893,2026-04-07 11:39:00.094132,0 days 00:00:00.951239,20.559926913269628,17.872229328740108,0.7300951362572894,Au,PRUNED
5975,-1.0,2026-04-07 11:38:59.242698,2026-04-07 11:39:00.002605,0 days 00:00:00.759907,20.33330601814369,19.938752411034358,0.47218664420321976,Au,COMPLETE
5976,81.48148148147907,2026-04-07 11:38:59.336315,2026-04-07 11:38:59.985898,0 days 00:00:00.649583,28.950441009309564,17.320371603464217,1.1121875106119141,Au,PRUNED
5977,-1.0,2026-04-07 11:38:59.503381,2026-04-07 11:39:00.155802,0 days 00:00:00.652421,34.537831790987454,17.99805571624151,0.9700526646993808,Au,COMPLETE
5978,-1.0,2026-04-07 11:38:59.556925,2026-04-07 11:39:00.123925,0 days 00:00:00.567000,39.867976254093804,19.9363929920926,0.7304012830088152,Au,COMPLETE
5979,-364.9891774891304,2026-04-07 11:38:59.674544,2026-04-07 11:39:00.598536,0 days 00:00:00.923992,20.07177433829919,19.710202097980677,0.824462616819275,Au,COMPLETE
5980,-1.0,2026-04-07 11:39:00.082572,2026-04-07 11:39:00.832621,0 days 00:00:00.750049,21.984913408473155,19.95530578300049,0.8293261128392827,Au,COMPLETE
5981,0.0,2026-04-07 11:39:00.158683,2026-04-07 11:39:01.073290,0 days 00:00:00.914607,30.373330954144365,18.004558162117394,0.8973316323637938,Au,PRUNED
5982,-430.87121212114675,2026-04-07 11:39:00.144349,2026-04-07 11:39:00.883921,0 days 00:00:00.739572,20.619553980082387,19.975942787593574,0.9444539723959745,Au,COMPLETE
5983,-1.0,2026-04-07 11:39:00.231141,2026-04-07 11:39:00.882916,0 days 00:00:00.651775,29.235982135257842,19.971860926892443,0.7409145889188239,Au,COMPLETE
5984,79.6568627450957,2026-04-07 11:39:00.270268,2026-04-07 11:39:01.082679,0 days 00:00:00.812411,34.05643540695273,15.09345025094466,0.8051660818083294,Au,PRUNED
5985,-1.0,2026-04-07 11:39:00.360435,2026-04-07 11:39:01.003014,0 days 00:00:00.642579,20.41253591863077,17.590779754426695,0.6142932250182221,Au,COMPLETE
5986,80.24691358024454,2026-04-07 11:39:00.727400,2026-04-07 11:39:01.620061,0 days 00:00:00.892661,32.83150855708413,16.28052638380653,0.7218867152770367,Au,PRUNED
5987,0.0,2026-04-07 11:39:00.746354,2026-04-07 11:39:01.402777,0 days 00:00:00.656423,34.83273899047762,17.44900163107719,0.8588495138746772,Au,PRUNED
5988,-413.9294403892341,2026-04-07 11:39:01.108959,2026-04-07 11:39:02.018414,0 days 00:00:00.909455,20.35102543692673,19.906515672416376,1.000100233171936,Au,COMPLETE
5989,-1.0,2026-04-07 11:39:01.083682,2026-04-07 11:39:01.963907,0 days 00:00:00.880225,69.38200737365561,12.204804323819841,1.1166848912367018,Cu,COMPLETE
5990,-1.0,2026-04-07 11:39:01.146850,2026-04-07 11:39:02.047521,0 days 00:00:00.900671,32.48350291239515,15.310875154269327,0.25676525667934497,Au,COMPLETE
5991,-29.76190476190051,2026-04-07 11:39:01.169068,2026-04-07 11:39:02.048533,0 days 00:00:00.879465,31.4402738686903,19.89437463642338,0.14887956448843265,Ag,PRUNED
5992,-8.333333333332,2026-04-07 11:39:01.208070,2026-04-07 11:39:02.047018,0 days 00:00:00.838948,21.66212486857991,19.95367637813265,0.7642762565086054,Au,PRUNED
5993,79.62962962962726,2026-04-07 11:39:01.232605,2026-04-07 11:39:02.018414,0 days 00:00:00.785809,32.00186616642405,17.266984645703566,0.6646951384621999,Au,PRUNED
5994,-1.0,2026-04-07 11:39:01.620061,2026-04-07 11:39:02.238524,0 days 00:00:00.618463,30.272369452640728,17.09161794161198,0.6276226277143795,Au,COMPLETE
5995,-3.0864197530859623,2026-04-07 11:39:01.673580,2026-04-07 11:39:02.488658,0 days 00:00:00.815078,22.207898588813332,19.980196950460567,0.8069949560837868,Au,PRUNED
5996,-5.952380952380574,2026-04-07 11:39:02.065408,2026-04-07 11:39:02.834360,0 days 00:00:00.768952,26.172075627631123,6.579056804740148,0.10313347501002246,Cu,PRUNED
5997,0.0,2026-04-07 11:39:02.068483,2026-04-07 11:39:02.828982,0 days 00:00:00.760499,20.31763988823079,16.063225723530124,0.3473416140587351,Au,PRUNED
5998,-1.0,2026-04-07 11:39:02.314750,2026-04-07 11:39:02.964776,0 days 00:00:00.650026,20.35954941316422,16.390789350848976,0.8254897336320249,Au,COMPLETE
5999,0.0,2026-04-07 11:39:02.352257,2026-04-07 11:39:03.194517,0 days 00:00:00.842260,50.667456956589206,19.978762212643048,1.1029427040854256,Au,PRUNED
6000,-1.0,2026-04-07 11:39:02.433655,2026-04-07 11:39:03.037971,0 days 00:00:00.604316,30.21477151585345,17.795818617279146,0.46873852450934317,Au,COMPLETE
6001,-1.0,2026-04-07 11:39:02.673656,2026-04-07 11:39:03.440397,0 days 00:00:00.766741,32.27333129220851,17.47021466380833,0.17484468819969806,Au,COMPLETE
6002,-6.3559322033894,2026-04-07 11:39:02.707545,2026-04-07 11:39:03.633252,0 days 00:00:00.925707,26.434390245353967,0.5944854706249458,1.2927808878287126,Cu,PRUNED
6003,-1.0,2026-04-07 11:39:02.743950,2026-04-07 11:39:03.439393,0 days 00:00:00.695443,20.79883917789344,17.26492248696272,1.1346958496154642,Au,COMPLETE
6004,-1.0,2026-04-07 11:39:02.962324,2026-04-07 11:39:03.693833,0 days 00:00:00.731509,35.09033684617178,19.891140340042472,1.050521699387327,Au,COMPLETE
6005,0.0,2026-04-07 11:39:02.998473,2026-04-07 11:39:03.787368,0 days 00:00:00.788895,32.3347970339744,17.88852791211168,0.13390886672996716,Au,PRUNED
6006,0.0,2026-04-07 11:39:03.160892,2026-04-07 11:39:04.177757,0 days 00:00:01.016865,20.466124437802062,16.210956081579564,0.5228706771413867,Au,PRUNED
6007,-11.904761904760544,2026-04-07 11:39:03.209250,2026-04-07 11:39:03.829523,0 days 00:00:00.620273,49.735275467222664,0.548082708641811,1.855927885570953,Cu,PRUNED
6008,0.0,2026-04-07 11:39:03.305536,2026-04-07 11:39:03.889084,0 days 00:00:00.583548,30.617564273318415,19.83838998580834,0.7850353789238538,Au,PRUNED
6009,-1.0,2026-04-07 11:39:03.579698,2026-04-07 11:39:04.339385,0 days 00:00:00.759687,48.25721528428619,17.576212721670487,1.1051331430929694,Au,COMPLETE
6010,-1.0,2026-04-07 11:39:03.668141,2026-04-07 11:39:04.551650,0 days 00:00:00.883509,20.678041907201415,15.171771167657912,0.47644515401835397,Au,COMPLETE
6011,0.0,2026-04-07 11:39:03.697345,2026-04-07 11:39:04.940952,0 days 00:00:01.243607,43.89598067075813,17.82760641027442,1.0678796187400892,Au,PRUNED
