number,value,datetime_start,datetime_complete,duration,params_D2_nm,params_D3_nm,params_D4_nm,params_metal,state
3781,0.0,2026-04-07 11:34:50.946427,2026-04-07 11:34:51.538022,0 days 00:00:00.591595,35.34436127248462,19.809298283541633,0.903565752556645,Au,PRUNED
3782,-1.0,2026-04-07 11:34:50.922848,2026-04-07 11:34:51.404581,0 days 00:00:00.481733,21.7671131336653,19.981070910374108,0.9736545966729758,Au,COMPLETE
3783,-1.0,2026-04-07 11:34:50.971189,2026-04-07 11:34:51.594674,0 days 00:00:00.623485,20.20386960151375,19.558430642637468,1.025441746526961,Au,COMPLETE
3784,0.0,2026-04-07 11:34:50.983772,2026-04-07 11:34:51.631388,0 days 00:00:00.647616,47.05227153618388,16.687366886325112,0.7968094771741564,Au,PRUNED
3785,-25.862068965513675,2026-04-07 11:34:51.230878,2026-04-07 11:34:51.897847,0 days 00:00:00.666969,28.39664674217906,19.889959487908698,0.9518027255347409,Ag,PRUNED
3786,81.80147058823289,2026-04-07 11:34:51.466528,2026-04-07 11:34:52.368364,0 days 00:00:00.901836,28.467457873562932,17.23379157322948,0.9016876231144589,Au,PRUNED
3787,-8.928571428570791,2026-04-07 11:34:51.567880,2026-04-07 11:34:52.387682,0 days 00:00:00.819802,35.5159489520677,7.45747331957044,1.4507702225682118,Cu,PRUNED
3788,-16.36904761904528,2026-04-07 11:34:51.591641,2026-04-07 11:34:52.292843,0 days 00:00:00.701202,34.12368584855304,18.98962679076258,1.001416969490837,Ag,PRUNED
3789,-1.0,2026-04-07 11:34:51.634454,2026-04-07 11:34:52.170751,0 days 00:00:00.536297,32.959538434134416,19.90698265647428,0.832559184040278,Au,COMPLETE
3790,-1.0,2026-04-07 11:34:51.692129,2026-04-07 11:34:52.171820,0 days 00:00:00.479691,20.021111906997152,17.450221915153694,0.745953455854587,Au,COMPLETE
3791,-1.0,2026-04-07 11:34:51.705022,2026-04-07 11:34:52.085232,0 days 00:00:00.380210,21.62368833398088,16.22070496748385,0.8827316322575867,Au,COMPLETE
3792,-1.0,2026-04-07 11:34:51.724149,2026-04-07 11:34:52.247334,0 days 00:00:00.523185,24.133682387508134,19.938768568631417,0.746100786330617,Au,COMPLETE
3793,0.0,2026-04-07 11:34:52.010016,2026-04-07 11:34:52.759675,0 days 00:00:00.749659,27.526849561336604,19.982033033155822,0.6762150257623674,Au,PRUNED
3794,-1.0,2026-04-07 11:34:52.328928,2026-04-07 11:34:52.962762,0 days 00:00:00.633834,117.288306354192,4.93684860969428,1.3438614096788302,Cu,COMPLETE
3795,-1.0,2026-04-07 11:34:52.389682,2026-04-07 11:34:52.953697,0 days 00:00:00.564015,32.36698406763624,17.2403321443416,0.941578524741671,Au,COMPLETE
3796,-1.0,2026-04-07 11:34:52.434687,2026-04-07 11:34:52.894891,0 days 00:00:00.460204,20.67611298052559,19.662480354004945,0.5015901700723809,Au,COMPLETE
3797,-1.0,2026-04-07 11:34:52.449539,2026-04-07 11:34:52.990477,0 days 00:00:00.540938,23.80417620637926,19.95223235978659,0.7487056211384522,Au,COMPLETE
3798,0.0,2026-04-07 11:34:52.466801,2026-04-07 11:34:53.132110,0 days 00:00:00.665309,29.44093900597362,19.949671662226837,1.0074234437325602,Au,PRUNED
3799,-1.0,2026-04-07 11:34:52.502180,2026-04-07 11:34:52.951695,0 days 00:00:00.449515,20.082784777297086,19.69800880144728,0.6285687010796553,Ag,COMPLETE
3800,82.72058823529169,2026-04-07 11:34:52.480542,2026-04-07 11:34:53.250440,0 days 00:00:00.769898,24.108047840182675,19.908239110112312,1.0619468918004482,Au,PRUNED
3801,-1.0,2026-04-07 11:34:52.815548,2026-04-07 11:34:53.594506,0 days 00:00:00.778958,22.53310750624747,19.62158719969298,0.6296486774591507,Ag,COMPLETE
3802,0.0,2026-04-07 11:34:53.012959,2026-04-07 11:34:53.615126,0 days 00:00:00.602167,20.332994907528843,19.195328681817394,0.6745158294402548,Au,PRUNED
3803,-1.0,2026-04-07 11:34:53.146676,2026-04-07 11:34:53.841025,0 days 00:00:00.694349,100.58939333682616,9.987673898439876,1.4800158061287234,Au,COMPLETE
3804,0.0,2026-04-07 11:34:53.197629,2026-04-07 11:34:53.910388,0 days 00:00:00.712759,20.615844075545134,16.963824647557548,0.8546032235032157,Au,PRUNED
3805,-1.0,2026-04-07 11:34:53.229282,2026-04-07 11:34:53.779949,0 days 00:00:00.550667,20.183386185594856,19.40297684897519,0.8031299787575811,Au,COMPLETE
3806,0.0,2026-04-07 11:34:53.271785,2026-04-07 11:34:53.939952,0 days 00:00:00.668167,37.363550043011955,17.829297603145722,0.8160618218926712,Au,PRUNED
3807,0.0,2026-04-07 11:34:53.305309,2026-04-07 11:34:53.910388,0 days 00:00:00.605079,37.53642433033056,17.349004987525525,0.8213495526297616,Au,PRUNED
3808,-1.0,2026-04-07 11:34:53.399982,2026-04-07 11:34:53.947611,0 days 00:00:00.547629,21.374189313758205,17.640986515616028,0.5971596758113203,Au,COMPLETE
3809,-308.4264432029449,2026-04-07 11:34:53.668091,2026-04-07 11:34:54.234135,0 days 00:00:00.566044,21.477420388810717,17.44226139467284,1.000116254247377,Au,COMPLETE
3810,-1.0,2026-04-07 11:34:53.727882,2026-04-07 11:34:54.534454,0 days 00:00:00.806572,20.7047693964642,19.93950416381999,1.0112530669545496,Au,COMPLETE
3811,0.0,2026-04-07 11:34:53.903075,2026-04-07 11:34:54.876759,0 days 00:00:00.973684,34.23976336940656,19.964133630412537,0.7283364932721885,Au,PRUNED
3812,-1.0,2026-04-07 11:34:53.991605,2026-04-07 11:34:54.603129,0 days 00:00:00.611524,47.47233682270241,19.865672010035325,0.6380644820740331,Au,COMPLETE
3813,-392.07175925920484,2026-04-07 11:34:54.011831,2026-04-07 11:34:54.735869,0 days 00:00:00.724038,20.38854813426033,19.81690225254529,0.7635051442239883,Au,COMPLETE
3814,-1.0,2026-04-07 11:34:54.052775,2026-04-07 11:34:54.608880,0 days 00:00:00.556105,45.52177340071876,19.99092531460275,0.6655430724082072,Au,COMPLETE
3815,83.33333333333088,2026-04-07 11:34:54.095522,2026-04-07 11:34:54.652597,0 days 00:00:00.557075,22.964724951870622,19.993598354205492,1.0174367508329334,Au,PRUNED
3816,0.0,2026-04-07 11:34:54.168397,2026-04-07 11:34:54.736878,0 days 00:00:00.568481,30.232116702729293,19.98760100086587,0.9472481493935214,Au,PRUNED
3817,0.0,2026-04-07 11:34:54.365320,2026-04-07 11:34:54.929007,0 days 00:00:00.563687,20.827882503226025,15.470339486133664,0.810730216435603,Au,PRUNED
3818,-1.0,2026-04-07 11:34:54.800913,2026-04-07 11:34:55.653979,0 days 00:00:00.853066,21.045665930736252,19.9983306618609,0.975622979521043,Au,COMPLETE
3819,0.0,2026-04-07 11:34:54.828608,2026-04-07 11:34:55.655094,0 days 00:00:00.826486,44.314032511495256,19.802192966059792,1.0190564224532919,Au,PRUNED
3820,-1.0,2026-04-07 11:34:54.898769,2026-04-07 11:34:55.498708,0 days 00:00:00.599939,29.092983043590337,17.560892293329534,0.9669729325026153,Au,COMPLETE
3821,0.0,2026-04-07 11:34:54.947503,2026-04-07 11:34:55.775666,0 days 00:00:00.828163,36.18667964590415,19.965389599837284,1.065246859716681,Au,PRUNED
3822,-1.0,2026-04-07 11:34:54.979979,2026-04-07 11:34:55.500182,0 days 00:00:00.520203,36.315684140214216,16.6423699606675,0.760548720635581,Au,COMPLETE
3823,-1.0,2026-04-07 11:34:55.042010,2026-04-07 11:34:55.657611,0 days 00:00:00.615601,22.20632188305232,19.992450519065624,0.6049387872819645,Au,COMPLETE
3824,0.0,2026-04-07 11:34:55.055160,2026-04-07 11:34:55.776665,0 days 00:00:00.721505,20.744739113853665,17.466904855669544,0.9899287896048512,Au,PRUNED
3825,4.084967320261118,2026-04-07 11:34:55.069438,2026-04-07 11:34:55.836442,0 days 00:00:00.767004,32.476429006836824,15.108347786929462,0.5301277253593307,Au,PRUNED
3826,-1.0,2026-04-07 11:34:55.570656,2026-04-07 11:34:56.243627,0 days 00:00:00.672971,36.77726039547945,19.91880445281416,1.1920155666829886,Au,COMPLETE
3827,-6.172839506171925,2026-04-07 11:34:55.743103,2026-04-07 11:34:56.455184,0 days 00:00:00.712081,21.72845277426753,19.807717438071673,1.0918747449834956,Au,PRUNED
3828,-434.47837150120574,2026-04-07 11:34:55.792555,2026-04-07 11:34:56.511885,0 days 00:00:00.719330,21.16302029394259,19.627836335579296,1.0734136228950004,Au,COMPLETE
3829,0.0,2026-04-07 11:34:55.845337,2026-04-07 11:34:56.510885,0 days 00:00:00.665548,20.391115942303525,17.224495074919606,0.8784695452447344,Au,PRUNED
3830,0.0,2026-04-07 11:34:55.867296,2026-04-07 11:34:56.677887,0 days 00:00:00.810591,39.674493032966154,19.945549844475885,1.077069858938801,Au,PRUNED
3831,0.0,2026-04-07 11:34:55.901839,2026-04-07 11:34:56.513888,0 days 00:00:00.612049,32.221119721833865,19.945913011652998,1.0543295551053664,Au,PRUNED
3832,79.32098765431864,2026-04-07 11:34:55.978647,2026-04-07 11:34:56.708434,0 days 00:00:00.729787,33.619990099947564,16.66243582833343,0.6513229475011828,Au,PRUNED
3833,-1.0,2026-04-07 11:34:55.996240,2026-04-07 11:34:56.414785,0 days 00:00:00.418545,30.66333965934738,17.635005943810828,0.8866337990883727,Au,COMPLETE
3834,-1.0,2026-04-07 11:34:56.556686,2026-04-07 11:34:57.334379,0 days 00:00:00.777693,41.061087407908516,17.37517584100594,0.5181653509553397,Au,COMPLETE
3835,-23.43749999999707,2026-04-07 11:34:56.589646,2026-04-07 11:34:57.492172,0 days 00:00:00.902526,53.71314277962356,14.395367863507065,0.656808554138842,Ag,PRUNED
3836,-1.0,2026-04-07 11:34:56.605261,2026-04-07 11:34:57.117902,0 days 00:00:00.512641,21.19095849513572,16.52613546513307,0.7595000735201763,Au,COMPLETE
3837,-1.0,2026-04-07 11:34:56.618842,2026-04-07 11:34:57.226516,0 days 00:00:00.607674,21.580584056861923,19.588694684778595,0.6693476953514291,Au,COMPLETE
3838,-1.0,2026-04-07 11:34:56.654942,2026-04-07 11:34:57.301782,0 days 00:00:00.646840,35.84531739499312,17.91914754185245,0.5857952914543819,Au,COMPLETE
3839,-1.0,2026-04-07 11:34:56.850307,2026-04-07 11:34:57.220911,0 days 00:00:00.370604,20.027017566979943,17.41081500034621,0.7219407303728932,Au,COMPLETE
3840,-1.0,2026-04-07 11:34:56.886444,2026-04-07 11:34:57.239058,0 days 00:00:00.352614,20.868872772812797,19.805860601978488,0.5871652664524782,Au,COMPLETE
3841,83.33333333333088,2026-04-07 11:34:56.901044,2026-04-07 11:34:57.494182,0 days 00:00:00.593138,23.648522021840748,19.95568445857666,0.6532177241691883,Au,PRUNED
3842,-1.0,2026-04-07 11:34:57.411967,2026-04-07 11:34:57.959081,0 days 00:00:00.547114,21.518392715896077,19.94310042031412,1.0480190074018063,Au,COMPLETE
3843,-1.0,2026-04-07 11:34:57.508595,2026-04-07 11:34:58.132346,0 days 00:00:00.623751,42.187901130125766,18.09028843024664,0.9044547091625985,Au,COMPLETE
3844,-1.0,2026-04-07 11:34:57.541384,2026-04-07 11:34:58.189518,0 days 00:00:00.648134,20.80864959174315,16.881514783231307,0.844118131401753,Au,COMPLETE
3845,-1.0,2026-04-07 11:34:57.603352,2026-04-07 11:34:58.080655,0 days 00:00:00.477303,33.98841308908382,16.402250110942177,0.9832166972626798,Au,COMPLETE
3846,0.0,2026-04-07 11:34:57.620144,2026-04-07 11:34:58.255396,0 days 00:00:00.635252,34.959015228712786,19.96573947167447,0.6216950342431287,Au,PRUNED
3847,0.0,2026-04-07 11:34:57.641513,2026-04-07 11:34:58.270296,0 days 00:00:00.628783,34.53389670714367,18.079279263003716,0.9073317182479914,Au,PRUNED
3848,-1.0,2026-04-07 11:34:57.666636,2026-04-07 11:34:58.081658,0 days 00:00:00.415022,115.5929877129602,18.331572075650513,1.2252934104091893,Cu,COMPLETE
3849,-1.0,2026-04-07 11:34:57.633387,2026-04-07 11:34:58.191519,0 days 00:00:00.558132,32.22231912288145,16.67388915452008,0.9647081649773454,Au,COMPLETE
3850,0.0,2026-04-07 11:34:58.288132,2026-04-07 11:34:58.927189,0 days 00:00:00.639057,36.27831797313069,19.789028852961273,0.8175457790974623,Au,PRUNED
3851,-1.5182186234817567,2026-04-07 11:34:58.305063,2026-04-07 11:34:58.926184,0 days 00:00:00.621121,117.99847931715534,2.1204215826502413,1.497864673056097,Ag,PRUNED
3852,-352.2012578615907,2026-04-07 11:34:58.318519,2026-04-07 11:34:59.307306,0 days 00:00:00.988787,20.25461465045928,19.271834812885835,0.9116361163683401,Au,COMPLETE
3853,0.0,2026-04-07 11:34:58.334691,2026-04-07 11:34:58.926184,0 days 00:00:00.591493,20.535586637221545,16.341656716989753,1.010290159797606,Au,PRUNED
3854,-1.1990407673860566,2026-04-07 11:34:58.351084,2026-04-07 11:34:59.108885,0 days 00:00:00.757801,20.654518778810427,19.85784870280861,1.094090582479696,Ag,PRUNED
3855,0.0,2026-04-07 11:34:58.364931,2026-04-07 11:34:59.010092,0 days 00:00:00.645161,20.173649714817632,19.627243782688474,0.7215475637657731,Au,PRUNED
3856,0.0,2026-04-07 11:34:58.382551,2026-04-07 11:34:59.385752,0 days 00:00:01.003201,32.462535982926894,17.41880407530836,1.1340147752000305,Au,PRUNED
3857,0.0,2026-04-07 11:34:58.433522,2026-04-07 11:34:59.066517,0 days 00:00:00.632995,30.579885890422798,19.96868210621423,1.142419946951366,Au,PRUNED
3858,-1.0,2026-04-07 11:34:59.024409,2026-04-07 11:34:59.750873,0 days 00:00:00.726464,21.022217485155085,16.839783594664134,1.1414220002004454,Au,COMPLETE
3859,79.0441176470565,2026-04-07 11:34:59.031653,2026-04-07 11:34:59.918584,0 days 00:00:00.886931,35.50076059089864,15.101080939701564,0.796242342198601,Au,PRUNED
3860,-1.0,2026-04-07 11:34:59.144142,2026-04-07 11:34:59.653176,0 days 00:00:00.509034,38.988821845568964,19.884584089997475,0.6420439896641142,Au,COMPLETE
3861,-1.0,2026-04-07 11:34:59.174351,2026-04-07 11:34:59.724403,0 days 00:00:00.550052,26.1311879718031,7.731365871990061,1.336739920496616,Ag,COMPLETE
3862,-1.0,2026-04-07 11:34:59.205056,2026-04-07 11:34:59.627199,0 days 00:00:00.422143,102.05004552321952,18.79481628004622,1.8315247827360905,Ag,COMPLETE
3863,0.0,2026-04-07 11:34:59.219062,2026-04-07 11:34:59.799765,0 days 00:00:00.580703,20.012455164384914,19.313071148880024,0.9272953451779244,Au,PRUNED
3864,0.0,2026-04-07 11:34:59.488420,2026-04-07 11:35:00.531593,0 days 00:00:01.043173,21.485173802108044,17.127471588643466,0.5646809857357988,Au,PRUNED
3865,0.0,2026-04-07 11:34:59.554013,2026-04-07 11:35:00.486249,0 days 00:00:00.932236,41.17110536274657,17.214309972649698,0.8041662846341262,Au,PRUNED
3866,-1.0,2026-04-07 11:34:59.798759,2026-04-07 11:35:00.424915,0 days 00:00:00.626156,20.958942284961637,17.414548312161674,0.902393583459298,Au,COMPLETE
3867,-383.5034013604926,2026-04-07 11:34:59.860045,2026-04-07 11:35:00.797115,0 days 00:00:00.937070,20.409959387426387,19.61617940968084,0.8475627849841315,Au,COMPLETE
3868,0.0,2026-04-07 11:34:59.876272,2026-04-07 11:35:00.817226,0 days 00:00:00.940954,34.794664545094676,17.965413329478,0.8546099398990886,Au,PRUNED
3869,0.0,2026-04-07 11:34:59.911500,2026-04-07 11:35:00.610760,0 days 00:00:00.699260,30.54297907569653,19.78644427064342,0.47732486669322377,Au,PRUNED
3870,0.0,2026-04-07 11:34:59.920633,2026-04-07 11:35:00.422728,0 days 00:00:00.502095,48.76429917341916,17.591430394043492,1.2413246947980354,Au,PRUNED
3871,-1.0,2026-04-07 11:35:00.025620,2026-04-07 11:35:00.563277,0 days 00:00:00.537657,20.25134161160542,17.81350747811486,0.9143388742016729,Au,COMPLETE
3872,0.0,2026-04-07 11:35:00.448404,2026-04-07 11:35:01.269888,0 days 00:00:00.821484,36.19558862017946,18.210354050964902,0.6810241575618694,Au,PRUNED
3873,-1.0,2026-04-07 11:35:00.643545,2026-04-07 11:35:01.378552,0 days 00:00:00.735007,34.266320427962896,14.394228154100276,1.0577425655170285,Au,COMPLETE
3874,0.0,2026-04-07 11:35:00.674238,2026-04-07 11:35:01.382337,0 days 00:00:00.708099,20.38045973151676,17.600439964800366,0.5697612823577879,Au,PRUNED
3875,80.24691358024454,2026-04-07 11:35:00.755151,2026-04-07 11:35:01.410743,0 days 00:00:00.655592,31.172073245819973,16.899186829417122,1.0193313820515872,Au,PRUNED
3876,-1.0,2026-04-07 11:35:00.815223,2026-04-07 11:35:01.409520,0 days 00:00:00.594297,20.086123274554552,18.204864132850076,1.005258280469031,Au,COMPLETE
3877,-1.0,2026-04-07 11:35:00.848035,2026-04-07 11:35:01.571654,0 days 00:00:00.723619,31.87728161558679,19.962758748581546,0.8879121179431274,Au,COMPLETE
3878,-1.0,2026-04-07 11:35:00.934932,2026-04-07 11:35:01.455054,0 days 00:00:00.520122,31.77822580514583,17.137514062102788,1.0548465361723665,Au,COMPLETE
3879,-1.0,2026-04-07 11:35:01.085004,2026-04-07 11:35:01.523998,0 days 00:00:00.438994,38.70531976243622,19.946118338879653,1.074867864496984,Au,COMPLETE
3880,0.0,2026-04-07 11:35:01.304600,2026-04-07 11:35:02.077236,0 days 00:00:00.772636,33.689339526446,17.499250744280758,0.9401642609192742,Au,PRUNED
3881,80.24691358024454,2026-04-07 11:35:01.556962,2026-04-07 11:35:02.157306,0 days 00:00:00.600344,30.440713729069437,17.525249015549136,1.0405132001511923,Au,PRUNED
3882,-1.0,2026-04-07 11:35:01.562967,2026-04-07 11:35:02.081300,0 days 00:00:00.518333,20.978225499392842,17.166252484933423,1.0992836979659133,Au,COMPLETE
3883,0.0,2026-04-07 11:35:01.574219,2026-04-07 11:35:02.238819,0 days 00:00:00.664600,21.310998939469656,13.26197938526461,0.9486685815156035,Au,PRUNED
3884,-1.0,2026-04-07 11:35:01.649120,2026-04-07 11:35:02.347299,0 days 00:00:00.698179,37.8564475411914,19.929684295370564,0.438737425919317,Au,COMPLETE
3885,-1.0,2026-04-07 11:35:01.689505,2026-04-07 11:35:02.209240,0 days 00:00:00.519735,21.730862296690947,19.952823893458003,0.5403632199075122,Au,COMPLETE
3886,0.0,2026-04-07 11:35:01.735151,2026-04-07 11:35:02.565114,0 days 00:00:00.829963,21.567499799220805,14.092833654581481,0.8261566424464627,Au,PRUNED
3887,-3.67647058823515,2026-04-07 11:35:01.753959,2026-04-07 11:35:02.516420,0 days 00:00:00.762461,92.42393445742337,1.9278287442600117,1.8549070519303488,Ag,PRUNED
3888,-1.0,2026-04-07 11:35:02.159320,2026-04-07 11:35:02.812236,0 days 00:00:00.652916,21.61682879045583,19.820651992879043,1.1734559864480754,Au,COMPLETE
3889,-1.0,2026-04-07 11:35:02.212242,2026-04-07 11:35:02.923470,0 days 00:00:00.711228,21.452556281342513,19.8271902872875,1.14884431562444,Au,COMPLETE
3890,-0.6775067750677396,2026-04-07 11:35:02.302658,2026-04-07 11:35:03.140752,0 days 00:00:00.838094,96.18673431019774,14.958235048061155,1.1888541586471255,Cu,PRUNED
3891,0.0,2026-04-07 11:35:02.398191,2026-04-07 11:35:03.020496,0 days 00:00:00.622305,33.494211113878436,19.900663975424543,0.8377436344596911,Au,PRUNED
3892,-423.81840796013535,2026-04-07 11:35:02.456782,2026-04-07 11:35:03.331058,0 days 00:00:00.874276,20.48068913589618,19.998114507572314,0.924435385175808,Au,COMPLETE
3893,-1.0,2026-04-07 11:35:02.635657,2026-04-07 11:35:03.177126,0 days 00:00:00.541469,21.288546860690186,17.657461046449818,1.1229637166426243,Au,COMPLETE
3894,-359.7756410255949,2026-04-07 11:35:02.643697,2026-04-07 11:35:03.300670,0 days 00:00:00.656973,20.116343035466794,19.36461221035852,1.0452745370257719,Au,COMPLETE
3895,0.0,2026-04-07 11:35:02.706179,2026-04-07 11:35:03.361918,0 days 00:00:00.655739,35.76176942331283,17.43941315769341,0.454856283182644,Au,PRUNED
3896,-1.0,2026-04-07 11:35:02.988553,2026-04-07 11:35:03.609570,0 days 00:00:00.621017,36.77396069388682,16.739565108765394,0.4451902585871721,Au,COMPLETE
3897,-1.0,2026-04-07 11:35:03.179546,2026-04-07 11:35:03.685040,0 days 00:00:00.505494,20.320608279812813,18.5084560255977,0.808982722795474,Au,COMPLETE
3898,-1.0,2026-04-07 11:35:03.237962,2026-04-07 11:35:03.846434,0 days 00:00:00.608472,20.274384215215026,19.920984329927897,0.546581340766139,Au,COMPLETE
3899,83.02696078431127,2026-04-07 11:35:03.254657,2026-04-07 11:35:04.075897,0 days 00:00:00.821240,24.112424577023997,19.922780737389797,0.8085709846648163,Au,PRUNED
3900,-1.0,2026-04-07 11:35:03.292342,2026-04-07 11:35:03.846434,0 days 00:00:00.554092,44.58583669259099,18.791078730799928,0.9505546473706515,Au,COMPLETE
3901,-1.0,2026-04-07 11:35:03.416029,2026-04-07 11:35:03.882570,0 days 00:00:00.466541,20.348872901225306,16.96231656558586,0.9709507827644522,Au,COMPLETE
3902,0.0,2026-04-07 11:35:03.506066,2026-04-07 11:35:04.393306,0 days 00:00:00.887240,46.326610769194986,17.234249302040524,1.1797562863093025,Au,PRUNED
3903,-1.0,2026-04-07 11:35:03.531733,2026-04-07 11:35:04.137675,0 days 00:00:00.605942,20.293477836065414,19.544489229009642,0.8142219356420729,Au,COMPLETE
3904,0.0,2026-04-07 11:35:03.916448,2026-04-07 11:35:04.322207,0 days 00:00:00.405759,34.252791917770395,17.832668209492226,0.9941137852914137,Au,PRUNED
3905,-1.0,2026-04-07 11:35:03.903766,2026-04-07 11:35:04.204524,0 days 00:00:00.300758,20.510236058088676,16.847919215967096,1.0931763207646026,Au,COMPLETE
3906,-1.0,2026-04-07 11:35:03.952730,2026-04-07 11:35:04.507749,0 days 00:00:00.555019,21.44534598335947,19.903764768200535,1.2719012542938049,Au,COMPLETE
3907,-0.8928571428571173,2026-04-07 11:35:03.950517,2026-04-07 11:35:04.859116,0 days 00:00:00.908599,21.029956690599917,16.94064043782029,1.138874416190416,Ag,PRUNED
3908,-16.30434782608554,2026-04-07 11:35:03.773922,2026-04-07 11:35:04.734322,0 days 00:00:00.960400,67.32275426780907,5.083668105789046,1.2186486554230131,Au,PRUNED
3909,-1.0,2026-04-07 11:35:04.289098,2026-04-07 11:35:04.937936,0 days 00:00:00.648838,28.70320696462744,19.95127166839507,0.9334298954061919,Au,COMPLETE
3910,0.0,2026-04-07 11:35:04.389285,2026-04-07 11:35:05.105916,0 days 00:00:00.716631,27.556051035510283,19.835687800112957,1.1006116953879104,Au,PRUNED
3911,0.0,2026-04-07 11:35:04.438235,2026-04-07 11:35:05.105916,0 days 00:00:00.667681,35.87582916264761,18.669681620066722,1.0964595051415984,Au,PRUNED
3912,0.0,2026-04-07 11:35:04.460098,2026-04-07 11:35:05.069282,0 days 00:00:00.609184,20.492727295871305,18.631545173259482,1.0120462146677565,Au,PRUNED
3913,-1.0,2026-04-07 11:35:04.484151,2026-04-07 11:35:04.912713,0 days 00:00:00.428562,33.479522535465776,19.858989501663654,0.9144458380824503,Au,COMPLETE
3914,0.0,2026-04-07 11:35:04.743310,2026-04-07 11:35:05.376334,0 days 00:00:00.633024,33.16856906478312,17.654044056388745,1.1024100876029517,Au,PRUNED
3915,0.0,2026-04-07 11:35:04.803631,2026-04-07 11:35:05.448333,0 days 00:00:00.644702,33.368856488797114,17.586860629505896,0.8891242220745799,Au,PRUNED
3916,-1.0,2026-04-07 11:35:05.002369,2026-04-07 11:35:05.532351,0 days 00:00:00.529982,20.456816102287785,19.680680227540805,0.7968520424903551,Au,COMPLETE
3917,-1.0,2026-04-07 11:35:05.079841,2026-04-07 11:35:05.755449,0 days 00:00:00.675608,38.01226068750632,19.672956183562217,0.9567412171397004,Au,COMPLETE
3918,-1.0,2026-04-07 11:35:05.154334,2026-04-07 11:35:05.823704,0 days 00:00:00.669370,20.01161184610027,13.183611095526672,1.0359561262467152,Au,COMPLETE
3919,-1.0,2026-04-07 11:35:05.233688,2026-04-07 11:35:05.766448,0 days 00:00:00.532760,34.80210641685437,17.98336027477348,0.9592825829692877,Au,COMPLETE
