number,value,datetime_start,datetime_complete,duration,params_D2_nm,params_D3_nm,params_D4_nm,params_metal,state
1704,-1.0,2026-04-07 11:31:21.389092,2026-04-07 11:31:22.178492,0 days 00:00:00.789400,38.162047808471414,4.167540341108017,1.0125119721027085,Ag,COMPLETE
1705,-1.0,2026-04-07 11:31:21.534349,2026-04-07 11:31:22.680799,0 days 00:00:01.146450,59.78799433004676,1.0726643788052261,0.46111547693891997,Ag,COMPLETE
1706,-14.25438596491078,2026-04-07 11:31:21.599067,2026-04-07 11:31:22.302241,0 days 00:00:00.703174,24.555110965156793,14.831161982354745,1.3762467702361145,Au,PRUNED
1707,79.62962962962726,2026-04-07 11:31:21.847607,2026-04-07 11:31:23.183196,0 days 00:00:01.335589,32.15058114605384,16.006364660720063,1.502680624591972,Au,PRUNED
1708,-190.07656065958605,2026-04-07 11:31:21.823261,2026-04-07 11:31:23.041017,0 days 00:00:01.217756,23.776991921051934,13.653678430406654,1.9898871350658554,Au,COMPLETE
1709,-9.615384615383876,2026-04-07 11:31:22.052338,2026-04-07 11:31:23.029599,0 days 00:00:00.977261,81.4321228005279,3.445003112508094,0.3293525501963349,Cu,PRUNED
1710,-43.60465116277056,2026-04-07 11:31:22.138369,2026-04-07 11:31:23.154022,0 days 00:00:01.015653,70.57045576371665,3.8162929556859857,0.11506103139321416,Ag,COMPLETE
1711,-1.0,2026-04-07 11:31:22.236856,2026-04-07 11:31:22.946747,0 days 00:00:00.709891,94.02817852805433,0.9907456707288027,1.334440259201914,Au,COMPLETE
1712,-1.0,2026-04-07 11:31:22.403985,2026-04-07 11:31:23.229886,0 days 00:00:00.825901,53.41540724469852,2.2912147732853714,0.14920203467322943,Ag,COMPLETE
1713,-1.0,2026-04-07 11:31:22.495746,2026-04-07 11:31:23.510105,0 days 00:00:01.014359,39.112769265449856,15.47157809339338,1.5305463838323126,Au,COMPLETE
1714,-1.0,2026-04-07 11:31:23.028599,2026-04-07 11:31:23.589122,0 days 00:00:00.560523,23.931989579913914,16.354044908007857,1.9034255047825852,Au,COMPLETE
1715,-1.0,2026-04-07 11:31:23.108851,2026-04-07 11:31:23.925353,0 days 00:00:00.816502,21.109256183597147,13.339098621181918,1.913381937748962,Au,COMPLETE
1716,-13.513513513512052,2026-04-07 11:31:23.220159,2026-04-07 11:31:23.949068,0 days 00:00:00.728909,25.790443716131968,14.146466772431182,1.8931236795323632,Au,PRUNED
1717,0.0,2026-04-07 11:31:23.248234,2026-04-07 11:31:24.148794,0 days 00:00:00.900560,45.30045178853037,14.957672977516856,1.9956766630783684,Au,PRUNED
1718,-1.0,2026-04-07 11:31:23.279663,2026-04-07 11:31:23.815953,0 days 00:00:00.536290,27.8342111738551,12.999972221063775,1.710321567442838,Au,COMPLETE
1719,-1.0,2026-04-07 11:31:23.365954,2026-04-07 11:31:24.118398,0 days 00:00:00.752444,82.40086408817682,1.032791081230118,0.1752394937857004,Ag,COMPLETE
1720,0.0,2026-04-07 11:31:23.550506,2026-04-07 11:31:24.305851,0 days 00:00:00.755345,20.00786357025493,14.658186650817376,1.8866945828823147,Au,PRUNED
1721,-1.0,2026-04-07 11:31:23.903102,2026-04-07 11:31:25.007246,0 days 00:00:01.104144,27.893355270318498,14.346405867596657,1.850733071835641,Au,COMPLETE
1722,-1.0,2026-04-07 11:31:24.030752,2026-04-07 11:31:24.767467,0 days 00:00:00.736715,29.458324213061587,9.72244427448718,1.8328354186003843,Au,COMPLETE
1723,-1.0,2026-04-07 11:31:24.056620,2026-04-07 11:31:24.850357,0 days 00:00:00.793737,21.058598351940013,12.054675898335192,1.932582829332117,Au,COMPLETE
1724,-1.0,2026-04-07 11:31:24.094668,2026-04-07 11:31:25.112786,0 days 00:00:01.018118,31.13902615013972,8.998605002450242,1.8853430798864341,Au,COMPLETE
1725,0.0,2026-04-07 11:31:24.173031,2026-04-07 11:31:25.276775,0 days 00:00:01.103744,24.719321380931778,8.687368503496938,1.867749987942105,Au,PRUNED
1726,0.0,2026-04-07 11:31:24.265595,2026-04-07 11:31:25.365274,0 days 00:00:01.099679,23.19168693511878,12.583787361977176,1.849280326598069,Au,PRUNED
1727,-1.0,2026-04-07 11:31:24.404158,2026-04-07 11:31:25.069976,0 days 00:00:00.665818,22.811353603219125,10.592080745044825,1.9928514633563275,Au,COMPLETE
1728,-1.0,2026-04-07 11:31:24.431222,2026-04-07 11:31:25.275439,0 days 00:00:00.844217,20.554141643333324,13.381932723038972,1.6647725775211857,Au,COMPLETE
1729,-1.0,2026-04-07 11:31:24.998844,2026-04-07 11:31:25.670219,0 days 00:00:00.671375,26.994108671371617,10.416583323200113,1.746810946483146,Au,COMPLETE
1730,75.18115942028767,2026-04-07 11:31:25.279029,2026-04-07 11:31:26.490552,0 days 00:00:01.211523,42.05053918151754,12.716981959912188,1.977874115114756,Au,PRUNED
1731,-1.0,2026-04-07 11:31:25.416110,2026-04-07 11:31:26.256450,0 days 00:00:00.840340,85.82508216053759,0.724422653584055,0.12874303460728345,Ag,COMPLETE
1732,-1.0,2026-04-07 11:31:25.365274,2026-04-07 11:31:26.121016,0 days 00:00:00.755742,36.57512203907602,16.047242869830022,1.7326126766967656,Au,COMPLETE
1733,-1.0,2026-04-07 11:31:25.523495,2026-04-07 11:31:26.303902,0 days 00:00:00.780407,30.0356084551503,16.732285369778307,1.7859623603460348,Au,COMPLETE
1734,-1.0,2026-04-07 11:31:25.568103,2026-04-07 11:31:26.368472,0 days 00:00:00.800369,39.43203970744432,10.56422976580592,1.6816669568644982,Au,COMPLETE
1735,-1.0,2026-04-07 11:31:25.614476,2026-04-07 11:31:26.241168,0 days 00:00:00.626692,22.48136441546317,2.489168394950976,1.488072804725354,Ag,COMPLETE
1736,-1.0,2026-04-07 11:31:25.805960,2026-04-07 11:31:26.432307,0 days 00:00:00.626347,63.73086717375273,3.7417540257222273,0.14501694067663962,Ag,COMPLETE
1737,-7.161458333332886,2026-04-07 11:31:25.937068,2026-04-07 11:31:26.604114,0 days 00:00:00.667046,23.096320534144194,14.434173313603623,1.8843764073596723,Cu,PRUNED
1738,-33.33333333332,2026-04-07 11:31:26.309008,2026-04-07 11:31:27.828622,0 days 00:00:01.519614,79.25133526590933,2.754985412223361,0.1148448289343321,Ag,PRUNED
1739,-1.0,2026-04-07 11:31:26.479449,2026-04-07 11:31:27.411404,0 days 00:00:00.931955,29.52104378587719,14.940937605886758,1.9537644623732242,Au,COMPLETE
1740,-1.0,2026-04-07 11:31:26.530166,2026-04-07 11:31:27.348479,0 days 00:00:00.818313,26.79623125863377,15.772908953801327,1.660314358320446,Au,COMPLETE
1741,-4.9019607843131485,2026-04-07 11:31:26.554432,2026-04-07 11:31:27.611607,0 days 00:00:01.057175,26.485107421684887,15.18937995413727,1.8700004889531137,Au,PRUNED
1742,-37.037037037020575,2026-04-07 11:31:26.634496,2026-04-07 11:31:27.658786,0 days 00:00:01.024290,51.62073264802311,0.5374930249102036,0.1235533859044036,Ag,PRUNED
1743,0.0,2026-04-07 11:31:26.606622,2026-04-07 11:31:27.536203,0 days 00:00:00.929581,35.51266147858,16.177832344770245,1.9139860136740685,Au,PRUNED
1744,-315.81439393935807,2026-04-07 11:31:26.724638,2026-04-07 11:31:27.688695,0 days 00:00:00.964057,21.329832827977093,17.06245139763542,1.72480354126079,Au,COMPLETE
1745,3.086419753086191,2026-04-07 11:31:26.775036,2026-04-07 11:31:27.613615,0 days 00:00:00.838579,35.14310906175451,12.983046003329598,1.5839828833666063,Au,PRUNED
1746,0.0,2026-04-07 11:31:27.586459,2026-04-07 11:31:28.532151,0 days 00:00:00.945692,35.656890250941636,19.04733325335235,1.6950855486429037,Au,PRUNED
1747,-8.928571428570153,2026-04-07 11:31:27.662297,2026-04-07 11:31:28.736274,0 days 00:00:01.073977,21.392870795827847,18.516936938327927,1.9036596208120902,Au,PRUNED
1748,-1.0,2026-04-07 11:31:27.753016,2026-04-07 11:31:28.392550,0 days 00:00:00.639534,39.2000262808513,12.38029490776715,1.9999448780796034,Au,COMPLETE
1749,-1.0,2026-04-07 11:31:27.766422,2026-04-07 11:31:28.563378,0 days 00:00:00.796956,34.66377871760504,16.68588401187405,1.698187675189871,Au,COMPLETE
1750,-1.0,2026-04-07 11:31:27.800283,2026-04-07 11:31:28.505132,0 days 00:00:00.704849,31.87443254759346,13.17654380174235,1.9351855883177969,Au,COMPLETE
1751,-11.904761904760544,2026-04-07 11:31:27.884714,2026-04-07 11:31:28.926062,0 days 00:00:01.041348,24.68138559456303,15.404390676556574,1.6966395871389761,Au,PRUNED
1752,-1.0,2026-04-07 11:31:27.922201,2026-04-07 11:31:28.546082,0 days 00:00:00.623881,29.90194671371233,19.68796270718002,1.4519375482172938,Au,COMPLETE
1753,0.0,2026-04-07 11:31:28.017969,2026-04-07 11:31:29.410074,0 days 00:00:01.392105,33.08356676483971,17.19822446421766,1.824282428501697,Au,PRUNED
1754,-300.0452898550398,2026-04-07 11:31:28.695134,2026-04-07 11:31:29.863471,0 days 00:00:01.168337,22.111731945313792,16.19852607190137,1.6808957209590667,Au,COMPLETE
1755,-1.0,2026-04-07 11:31:28.769925,2026-04-07 11:31:29.565325,0 days 00:00:00.795400,33.89631664971665,17.60313749771928,0.44348761596981956,Ag,COMPLETE
1756,-44.64285714283566,2026-04-07 11:31:28.799210,2026-04-07 11:31:29.786740,0 days 00:00:00.987530,66.65556975702489,3.6142071230883634,0.10037039583961911,Ag,COMPLETE
1757,-13.095238095236597,2026-04-07 11:31:28.827748,2026-04-07 11:31:29.770518,0 days 00:00:00.942770,26.635667825078748,14.469519817950292,1.5374419387990548,Au,PRUNED
1758,-1.0,2026-04-07 11:31:28.866494,2026-04-07 11:31:29.495345,0 days 00:00:00.628851,22.611337366595045,19.460419766935704,1.6438049166605164,Au,COMPLETE
1759,-1.0,2026-04-07 11:31:28.970395,2026-04-07 11:31:29.966268,0 days 00:00:00.995873,20.753498939830124,17.629872714889714,1.7283966168125215,Au,COMPLETE
1760,-1.0,2026-04-07 11:31:29.006288,2026-04-07 11:31:29.817243,0 days 00:00:00.810955,45.62013374557216,14.56903429660027,1.7240643674361642,Au,COMPLETE
1761,-1.0,2026-04-07 11:31:29.561307,2026-04-07 11:31:30.521537,0 days 00:00:00.960230,20.02818769129859,9.679694738455227,1.6275433022989487,Ag,COMPLETE
1762,-1.0,2026-04-07 11:31:29.716432,2026-04-07 11:31:30.395282,0 days 00:00:00.678850,21.916186035989835,19.199207371972804,1.5452275955053354,Au,COMPLETE
1763,-3.571428571428163,2026-04-07 11:31:29.790804,2026-04-07 11:31:30.907843,0 days 00:00:01.117039,27.170180987645264,14.735085493641623,1.9515856645507454,Au,PRUNED
1764,-1.0,2026-04-07 11:31:29.896665,2026-04-07 11:31:30.463814,0 days 00:00:00.567149,65.46880082672817,10.720774604489517,1.5832220490236617,Au,COMPLETE
1765,-1.0,2026-04-07 11:31:30.056808,2026-04-07 11:31:30.635517,0 days 00:00:00.578709,23.50897787354951,16.79314874490789,1.8664526207287226,Ag,COMPLETE
1766,-1.0,2026-04-07 11:31:30.183910,2026-04-07 11:31:30.832690,0 days 00:00:00.648780,41.24732420092073,18.506344973252748,1.4191963592255135,Au,COMPLETE
1767,-16.02564102563938,2026-04-07 11:31:30.193488,2026-04-07 11:31:31.051671,0 days 00:00:00.858183,27.292161137236867,12.424107115348356,1.607685071447202,Au,PRUNED
1768,0.0,2026-04-07 11:31:30.274535,2026-04-07 11:31:31.288224,0 days 00:00:01.013689,48.20579283521022,18.788216432559388,1.892344652655445,Au,PRUNED
1769,-9.433962264150232,2026-04-07 11:31:30.681128,2026-04-07 11:31:31.738167,0 days 00:00:01.057039,43.74222774659249,11.016569614674975,1.8236207367143265,Cu,PRUNED
1770,-1.0,2026-04-07 11:31:30.708560,2026-04-07 11:31:31.417354,0 days 00:00:00.708794,29.1755777463707,16.64735099644837,1.8129104648411583,Au,COMPLETE
1771,0.0,2026-04-07 11:31:30.804177,2026-04-07 11:31:31.556444,0 days 00:00:00.752267,36.15122581287468,18.192671104830808,1.551885863719709,Au,PRUNED
1772,0.0,2026-04-07 11:31:30.996866,2026-04-07 11:31:32.221951,0 days 00:00:01.225085,30.94049469008823,18.536495522866716,1.5536193301078336,Au,PRUNED
1773,0.0,2026-04-07 11:31:31.123803,2026-04-07 11:31:32.071793,0 days 00:00:00.947990,32.24985126531493,19.927575439353962,1.8266780238979314,Au,PRUNED
1774,-1.0,2026-04-07 11:31:31.170683,2026-04-07 11:31:31.959299,0 days 00:00:00.788616,26.212570622463716,15.10258207322113,1.8465557399262378,Au,COMPLETE
1775,0.0,2026-04-07 11:31:31.080401,2026-04-07 11:31:32.450499,0 days 00:00:01.370098,46.234245350391014,14.712978768136747,1.742938584404867,Au,PRUNED
1776,0.0,2026-04-07 11:31:31.558443,2026-04-07 11:31:32.730025,0 days 00:00:01.171582,22.557681464026825,11.518263003239735,1.4555817729082794,Au,PRUNED
1777,-1.0,2026-04-07 11:31:31.671929,2026-04-07 11:31:32.501388,0 days 00:00:00.829459,23.183035577885086,16.156843803528908,1.5480265799647106,Au,COMPLETE
1778,-1.0,2026-04-07 11:31:31.872140,2026-04-07 11:31:32.500810,0 days 00:00:00.628670,20.751840202523855,17.511042000797627,1.8318763158891693,Au,COMPLETE
1779,-1.0,2026-04-07 11:31:31.765830,2026-04-07 11:31:32.580066,0 days 00:00:00.814236,30.844721727972036,15.859270851579998,1.5809139549289914,Au,COMPLETE
1780,-1.0,2026-04-07 11:31:32.175344,2026-04-07 11:31:32.931892,0 days 00:00:00.756548,44.38000462595018,15.927414879633037,1.8190751741073945,Au,COMPLETE
1781,-1.0,2026-04-07 11:31:32.122040,2026-04-07 11:31:33.078336,0 days 00:00:00.956296,21.216373707953668,16.931422865524404,1.8400143026741573,Au,COMPLETE
1782,-1.0,2026-04-07 11:31:32.375810,2026-04-07 11:31:33.269276,0 days 00:00:00.893466,20.604531117502766,15.753097810170809,1.6463579444809695,Au,COMPLETE
1783,-1.0,2026-04-07 11:31:32.616168,2026-04-07 11:31:33.533792,0 days 00:00:00.917624,22.458456153130783,15.540328489581448,1.4244522069301964,Au,COMPLETE
1784,-1.0,2026-04-07 11:31:32.739922,2026-04-07 11:31:33.487707,0 days 00:00:00.747785,27.897716805690376,18.84970558818212,1.923089914897643,Au,COMPLETE
1785,-1.0,2026-04-07 11:31:32.770789,2026-04-07 11:31:33.565547,0 days 00:00:00.794758,35.32496418862156,17.549510751193036,1.6027614089848548,Au,COMPLETE
1786,-1.0,2026-04-07 11:31:32.801921,2026-04-07 11:31:33.516585,0 days 00:00:00.714664,28.563655494265767,13.574528461869035,1.4932457811921684,Au,COMPLETE
1787,-1.0,2026-04-07 11:31:32.829755,2026-04-07 11:31:33.627050,0 days 00:00:00.797295,22.017173162271913,16.83323869857575,1.5243648573054787,Au,COMPLETE
1788,0.0,2026-04-07 11:31:33.266157,2026-04-07 11:31:34.006303,0 days 00:00:00.740146,32.79357393412617,16.58455124343238,1.3293673110785789,Au,PRUNED
1789,-320.4022988505381,2026-04-07 11:31:33.377692,2026-04-07 11:31:34.337538,0 days 00:00:00.959846,22.865545855653945,16.423901905678996,1.4376215064649398,Au,COMPLETE
1790,-1.0,2026-04-07 11:31:33.584147,2026-04-07 11:31:34.335978,0 days 00:00:00.751831,78.47899277640583,1.0111267607307433,0.10515888968947827,Ag,COMPLETE
1791,-1.0,2026-04-07 11:31:33.683802,2026-04-07 11:31:34.402364,0 days 00:00:00.718562,21.2624513476288,14.38784779069775,1.9446586956017171,Au,COMPLETE
1792,-1.0,2026-04-07 11:31:33.743539,2026-04-07 11:31:34.577281,0 days 00:00:00.833742,39.76564789987595,14.064373826669266,1.8501543983526794,Au,COMPLETE
1793,-298.4234234233912,2026-04-07 11:31:33.754923,2026-04-07 11:31:34.679632,0 days 00:00:00.924709,22.969057569801482,15.6002892808253,1.6850476343144603,Au,COMPLETE
1794,2.525252525252219,2026-04-07 11:31:33.802890,2026-04-07 11:31:34.681186,0 days 00:00:00.878296,23.980578557294145,17.593092564887694,1.9928393439117862,Au,PRUNED
1795,-1.0,2026-04-07 11:31:33.901465,2026-04-07 11:31:34.498220,0 days 00:00:00.596755,34.540991221740015,15.477404633536235,1.5960477524238434,Au,COMPLETE
1796,-1.0,2026-04-07 11:31:34.132860,2026-04-07 11:31:34.857696,0 days 00:00:00.724836,26.868954122827397,15.361124932272059,1.7308300486060473,Au,COMPLETE
1797,0.0,2026-04-07 11:31:34.617777,2026-04-07 11:31:35.554359,0 days 00:00:00.936582,34.63624446963034,15.98900368687892,1.3142027629251676,Au,PRUNED
1798,0.0,2026-04-07 11:31:34.657906,2026-04-07 11:31:35.618281,0 days 00:00:00.960375,95.86324723005424,16.195072984952393,1.8882365727270147,Ag,PRUNED
1799,-1.0,2026-04-07 11:31:34.729454,2026-04-07 11:31:35.445203,0 days 00:00:00.715749,22.63608486080615,11.95389942231212,1.583502467958758,Au,COMPLETE
1800,-13.888888888887346,2026-04-07 11:31:34.760492,2026-04-07 11:31:35.632809,0 days 00:00:00.872317,24.648319408425117,15.35969137863548,1.1817626611168364,Au,PRUNED
1801,-1.0,2026-04-07 11:31:34.774410,2026-04-07 11:31:35.428206,0 days 00:00:00.653796,21.354504998249517,18.964504205721823,1.288324219593796,Au,COMPLETE
1802,0.0,2026-04-07 11:31:34.810464,2026-04-07 11:31:35.633816,0 days 00:00:00.823352,31.68523561388568,17.38270404183174,1.345348310646435,Au,PRUNED
1803,0.0,2026-04-07 11:31:34.856152,2026-04-07 11:31:36.023246,0 days 00:00:01.167094,118.04225834140011,15.397559115549337,0.8834076456204536,Cu,PRUNED
1804,-1.0,2026-04-07 11:31:35.104220,2026-04-07 11:31:35.939664,0 days 00:00:00.835444,34.63675618434992,14.274434981276569,1.6744470537718026,Au,COMPLETE
1805,-15.35087719298084,2026-04-07 11:31:35.636919,2026-04-07 11:31:36.431146,0 days 00:00:00.794227,25.981461185813444,13.711481095933543,1.2962585964244024,Au,PRUNED
1806,-1.0,2026-04-07 11:31:35.730056,2026-04-07 11:31:36.713416,0 days 00:00:00.983360,25.632421151722994,15.494106034899211,1.6905496774839985,Cu,COMPLETE
1807,-326.26705653017615,2026-04-07 11:31:35.745566,2026-04-07 11:31:36.429196,0 days 00:00:00.683630,21.044998560509562,17.661053786847614,1.5476415996415926,Au,COMPLETE
1808,-1.0,2026-04-07 11:31:35.761046,2026-04-07 11:31:36.414832,0 days 00:00:00.653786,20.487080275264855,13.749763330830072,1.678672550883079,Au,COMPLETE
1809,0.0,2026-04-07 11:31:35.799224,2026-04-07 11:31:36.758180,0 days 00:00:00.958956,36.37232272455211,17.10289970266354,1.4465652285788417,Au,PRUNED
1810,1.633986928104447,2026-04-07 11:31:35.825003,2026-04-07 11:31:36.789951,0 days 00:00:00.964948,33.03411411949985,13.599222097311536,1.15727543283817,Au,PRUNED
1811,-1.0,2026-04-07 11:31:36.137847,2026-04-07 11:31:37.016000,0 days 00:00:00.878153,24.042356109406988,18.805993297884783,1.7978809618853044,Au,COMPLETE
1812,-1.0,2026-04-07 11:31:36.220559,2026-04-07 11:31:36.913195,0 days 00:00:00.692636,20.70273031075198,19.175548289206265,1.3840444225993935,Au,COMPLETE
1813,-2.278645833333298,2026-04-07 11:31:36.611782,2026-04-07 11:31:38.145444,0 days 00:00:01.533662,95.99674335925503,3.655171537517237,1.9021230069916168,Au,PRUNED
1814,-301.6848816028817,2026-04-07 11:31:36.690301,2026-04-07 11:31:37.831714,0 days 00:00:01.141413,23.093144384663834,15.801733423621194,1.4377977792721823,Au,COMPLETE
1815,-1.0,2026-04-07 11:31:36.848889,2026-04-07 11:31:37.661633,0 days 00:00:00.812744,57.164858008722916,17.66386817786958,1.4833140592626646,Au,COMPLETE
1816,-1.0,2026-04-07 11:31:36.870096,2026-04-07 11:31:37.708981,0 days 00:00:00.838885,20.524581744478937,17.151089304353942,1.473713688213201,Au,COMPLETE
1817,-1.0,2026-04-07 11:31:36.883673,2026-04-07 11:31:37.577293,0 days 00:00:00.693620,36.663324524501995,15.580491492648363,1.6685367634857786,Au,COMPLETE
1818,-1.3440860215052028,2026-04-07 11:31:37.071190,2026-04-07 11:31:38.018872,0 days 00:00:00.947682,23.52171446211151,17.98992865888552,1.6563709022958522,Au,PRUNED
1819,-1.0,2026-04-07 11:31:37.100881,2026-04-07 11:31:37.975403,0 days 00:00:00.874522,24.561769461279546,16.57362674791178,1.3977656349549012,Au,COMPLETE
1820,-1.0,2026-04-07 11:31:37.280326,2026-04-07 11:31:38.008054,0 days 00:00:00.727728,26.423877500598145,17.235878085508805,1.3920971018191541,Au,COMPLETE
1821,-1.0,2026-04-07 11:31:37.791490,2026-04-07 11:31:38.604169,0 days 00:00:00.812679,20.818834358968928,17.570640519243003,1.4051631729073963,Au,COMPLETE
1822,-12.896825396824168,2026-04-07 11:31:37.893970,2026-04-07 11:31:39.177577,0 days 00:00:01.283607,46.570104452140875,15.863909936212377,1.8720020641316395,Ag,PRUNED
1823,-8.928571428570153,2026-04-07 11:31:37.928064,2026-04-07 11:31:38.860547,0 days 00:00:00.932483,21.541800911291787,19.141601190059227,1.373083255663746,Au,PRUNED
1824,-1.0,2026-04-07 11:31:38.037334,2026-04-07 11:31:38.859039,0 days 00:00:00.821705,34.35657786020684,19.756613074845024,1.1111890077439133,Au,COMPLETE
1825,-1.0,2026-04-07 11:31:38.195933,2026-04-07 11:31:38.940201,0 days 00:00:00.744268,22.831975647052165,18.409735826266633,1.309804322944757,Au,COMPLETE
1826,-1.0,2026-04-07 11:31:38.207790,2026-04-07 11:31:39.035097,0 days 00:00:00.827307,20.53472304863138,16.861016923139818,1.13572333228296,Au,COMPLETE
1827,-13.888888888887655,2026-04-07 11:31:38.277353,2026-04-07 11:31:39.485519,0 days 00:00:01.208166,38.13437793593764,13.88871836435771,1.6669270529525602,Ag,PRUNED
1828,-2.2357723577235333,2026-04-07 11:31:38.481966,2026-04-07 11:31:39.614946,0 days 00:00:01.132980,86.95686397588909,0.9674433793046191,1.373454693631641,Cu,PRUNED
1829,0.0,2026-04-07 11:31:38.935140,2026-04-07 11:31:39.544573,0 days 00:00:00.609433,22.174638973971508,15.716558792191142,1.3477171106144863,Au,PRUNED
1830,-1.0,2026-04-07 11:31:39.065026,2026-04-07 11:31:39.699820,0 days 00:00:00.634794,22.099821814783713,18.6015605128542,1.5684873167857212,Au,COMPLETE
1831,0.0,2026-04-07 11:31:39.217973,2026-04-07 11:31:39.797458,0 days 00:00:00.579485,23.203023802162498,13.242584095175086,1.2411763707535874,Au,PRUNED
1832,79.07542579075195,2026-04-07 11:31:39.222633,2026-04-07 11:31:39.896183,0 days 00:00:00.673550,31.387861446835792,18.806856913093252,0.8758164939048025,Cu,PRUNED
1833,-1.0,2026-04-07 11:31:39.301480,2026-04-07 11:31:39.851810,0 days 00:00:00.550330,20.0524222044242,14.178344197906302,1.4144077006041316,Au,COMPLETE
1834,-1.728907330567053,2026-04-07 11:31:39.376806,2026-04-07 11:31:40.019055,0 days 00:00:00.642249,104.48064215138885,4.944506305394535,1.6757176343446614,Ag,PRUNED
1835,-7.142857142856326,2026-04-07 11:31:39.544573,2026-04-07 11:31:40.304093,0 days 00:00:00.759520,25.94948964870186,17.757933401908094,1.603039576030178,Cu,PRUNED
1836,-1.0,2026-04-07 11:31:39.641281,2026-04-07 11:31:40.149918,0 days 00:00:00.508637,43.913678937002246,14.898422496758162,1.0586339411749988,Au,COMPLETE
1837,-2.4509803921565743,2026-04-07 11:31:39.722216,2026-04-07 11:31:40.394424,0 days 00:00:00.672208,25.540074454427533,16.340844677729432,1.6383734289360217,Au,PRUNED
1838,0.0,2026-04-07 11:31:39.893164,2026-04-07 11:31:40.646881,0 days 00:00:00.753717,20.461169421919344,14.65505242827371,1.515939054989698,Au,PRUNED
1839,-1.0,2026-04-07 11:31:39.943527,2026-04-07 11:31:40.378731,0 days 00:00:00.435204,23.7682818159062,18.068019312041844,1.6546356515689058,Ag,COMPLETE
1840,80.26960784313488,2026-04-07 11:31:39.981967,2026-04-07 11:31:40.629101,0 days 00:00:00.647134,32.25182210440298,14.922237508393197,1.4191112964059367,Au,PRUNED
1841,-1.0,2026-04-07 11:31:40.006110,2026-04-07 11:31:40.517631,0 days 00:00:00.511521,27.66732362734264,18.365044547718885,1.6817884900150244,Au,COMPLETE
