number,value,datetime_start,datetime_complete,duration,params_D2_nm,params_D3_nm,params_D4_nm,params_metal,state
3225,-1.0,2026-04-07 11:33:54.054309,2026-04-07 11:33:54.776157,0 days 00:00:00.721848,21.7721455021223,17.836263346979685,1.4635238410539544,Au,COMPLETE
3226,-396.27039627034065,2026-04-07 11:33:54.082037,2026-04-07 11:33:54.928048,0 days 00:00:00.846011,20.29229342643277,19.16410938516782,1.705191835008118,Au,COMPLETE
3227,0.0,2026-04-07 11:33:54.101693,2026-04-07 11:33:54.812318,0 days 00:00:00.710625,26.0862639266067,19.452452566496422,1.7286713872603987,Au,PRUNED
3228,0.0,2026-04-07 11:33:54.214566,2026-04-07 11:33:55.036412,0 days 00:00:00.821846,32.30349532517551,19.986228914471248,0.649456350631321,Au,PRUNED
3229,0.0,2026-04-07 11:33:54.255819,2026-04-07 11:33:55.107311,0 days 00:00:00.851492,32.063455911046546,19.77757296075285,1.7475874238054838,Au,PRUNED
3230,-6.410256410255424,2026-04-07 11:33:54.659032,2026-04-07 11:33:55.356761,0 days 00:00:00.697729,22.106448023911515,19.77950882037419,0.7228754738210308,Au,PRUNED
3231,-1.0,2026-04-07 11:33:54.746017,2026-04-07 11:33:55.298300,0 days 00:00:00.552283,20.160894744455966,17.084848607909912,0.7973538589762346,Au,COMPLETE
3232,-430.5555555554903,2026-04-07 11:33:54.813443,2026-04-07 11:33:55.489946,0 days 00:00:00.676503,20.577268491580977,19.98494185189993,0.9414517448693649,Au,COMPLETE
3233,0.0,2026-04-07 11:33:54.930050,2026-04-07 11:33:55.482427,0 days 00:00:00.552377,24.063646541267726,19.92386670627587,1.9952449385386521,Au,PRUNED
3234,-1.0,2026-04-07 11:33:54.995887,2026-04-07 11:33:55.841764,0 days 00:00:00.845877,20.996483903256035,19.785932223876355,1.8256405132739406,Au,COMPLETE
3235,-1.0,2026-04-07 11:33:55.095824,2026-04-07 11:33:55.754430,0 days 00:00:00.658606,32.83335206128399,19.618914895531304,1.5428045669659034,Au,COMPLETE
3236,80.26960784313488,2026-04-07 11:33:55.139095,2026-04-07 11:33:55.841207,0 days 00:00:00.702112,31.6171051085852,16.308610060510308,0.7307284372240306,Au,PRUNED
3237,2.6881720430104057,2026-04-07 11:33:55.217217,2026-04-07 11:33:55.816868,0 days 00:00:00.599651,22.645162722579748,18.984572738691394,1.8455694430648328,Au,PRUNED
3238,0.0,2026-04-07 11:33:55.443186,2026-04-07 11:33:55.999840,0 days 00:00:00.556654,36.05006332515724,19.930144014236053,0.9278721387129949,Au,PRUNED
3239,-1.0,2026-04-07 11:33:55.462809,2026-04-07 11:33:55.967823,0 days 00:00:00.505014,20.389619490164836,19.752870183159423,1.6245455759039822,Au,COMPLETE
3240,0.0,2026-04-07 11:33:55.554717,2026-04-07 11:33:56.420051,0 days 00:00:00.865334,26.700755384555496,19.933121284076115,1.859559662141751,Au,PRUNED
3241,-407.6738609112121,2026-04-07 11:33:55.680028,2026-04-07 11:33:56.479832,0 days 00:00:00.799804,20.049092595532283,19.905211295911712,1.1952357566034277,Au,COMPLETE
3242,0.0,2026-04-07 11:33:55.907031,2026-04-07 11:33:56.478551,0 days 00:00:00.571520,42.44234072077262,19.990369206937714,0.7120879879718027,Au,PRUNED
3243,-1.0,2026-04-07 11:33:55.915649,2026-04-07 11:33:56.355769,0 days 00:00:00.440120,20.146983733931965,19.627855729667946,0.7432935448208317,Au,COMPLETE
3244,-1.0,2026-04-07 11:33:56.010191,2026-04-07 11:33:56.422138,0 days 00:00:00.411947,33.430630283882465,19.986192368954896,0.7120046115504959,Au,COMPLETE
3245,0.0,2026-04-07 11:33:56.090535,2026-04-07 11:33:56.698295,0 days 00:00:00.607760,35.85138779017963,18.44346937126271,1.4869821206566287,Au,PRUNED
3246,-5.952380952380102,2026-04-07 11:33:56.105521,2026-04-07 11:33:56.660955,0 days 00:00:00.555434,33.80022970608769,19.81912905905259,0.8630880203651597,Ag,PRUNED
3247,-1.0,2026-04-07 11:33:56.143445,2026-04-07 11:33:56.561808,0 days 00:00:00.418363,35.87489159120322,17.58065483700794,1.455858355626146,Au,COMPLETE
3248,-1.0,2026-04-07 11:33:56.494499,2026-04-07 11:33:57.369869,0 days 00:00:00.875370,22.026006034018696,19.659309608641895,0.7507904776954939,Au,COMPLETE
3249,0.0,2026-04-07 11:33:56.587205,2026-04-07 11:33:57.633545,0 days 00:00:01.046340,37.07904588757707,19.958811766875446,1.1106235539329816,Au,PRUNED
3250,-386.7009132419558,2026-04-07 11:33:56.608050,2026-04-07 11:33:57.443355,0 days 00:00:00.835305,20.24972083726583,19.73336777612507,0.9401372800616409,Au,COMPLETE
3251,-1.0,2026-04-07 11:33:56.684457,2026-04-07 11:33:57.309843,0 days 00:00:00.625386,20.3158977289524,17.773811664582905,0.9299137689919614,Au,COMPLETE
3252,-1.0,2026-04-07 11:33:56.748075,2026-04-07 11:33:57.308483,0 days 00:00:00.560408,29.874682772811205,17.178342440816845,0.8015514865256881,Au,COMPLETE
3253,-1.0,2026-04-07 11:33:56.777602,2026-04-07 11:33:57.207535,0 days 00:00:00.429933,22.432200357969556,19.699742835834478,0.9755781426690492,Au,COMPLETE
3254,0.0,2026-04-07 11:33:56.793052,2026-04-07 11:33:57.489527,0 days 00:00:00.696475,20.015722273802012,16.353114553190718,1.2860655226693245,Au,PRUNED
3255,-1.0,2026-04-07 11:33:56.884088,2026-04-07 11:33:57.399873,0 days 00:00:00.515785,31.73012940729603,19.956575170890535,1.5040344513970414,Au,COMPLETE
3256,-1.0,2026-04-07 11:33:57.313039,2026-04-07 11:33:58.159373,0 days 00:00:00.846334,29.275222543161373,19.825620878524386,0.6893782044379775,Au,COMPLETE
3257,0.0,2026-04-07 11:33:57.513350,2026-04-07 11:33:58.100818,0 days 00:00:00.587468,20.12146314039076,18.462638813800666,1.4294537198770345,Au,PRUNED
3258,-2.976190476190051,2026-04-07 11:33:57.544795,2026-04-07 11:33:58.206466,0 days 00:00:00.661671,22.613252360363802,19.74294059241511,0.7288426734310216,Au,PRUNED
3259,0.0,2026-04-07 11:33:57.574928,2026-04-07 11:33:58.133223,0 days 00:00:00.558295,31.39848212471132,17.421121381888216,0.8988777888000576,Au,PRUNED
3260,-1.0,2026-04-07 11:33:57.611700,2026-04-07 11:33:58.342665,0 days 00:00:00.730965,20.74999875372348,19.437778945271912,0.9657403104910297,Au,COMPLETE
3261,17.415364583333062,2026-04-07 11:33:57.635958,2026-04-07 11:33:58.527853,0 days 00:00:00.891895,94.01998331055859,6.628854599054456,1.4259537669326614,Au,PRUNED
3262,0.0,2026-04-07 11:33:57.740340,2026-04-07 11:33:58.389251,0 days 00:00:00.648911,36.18104844831957,19.863273836555514,1.2554856166491883,Au,PRUNED
3263,0.0,2026-04-07 11:33:57.776964,2026-04-07 11:33:58.334285,0 days 00:00:00.557321,20.29857107560294,17.72654328922346,1.4070476489007853,Au,PRUNED
3264,0.0,2026-04-07 11:33:58.171582,2026-04-07 11:33:59.288430,0 days 00:00:01.116848,20.545261244496995,16.885355342578503,0.7838818963566478,Au,PRUNED
3265,-1.0,2026-04-07 11:33:58.303051,2026-04-07 11:33:59.068806,0 days 00:00:00.765755,28.577827430475217,19.94431575479354,1.049607292842125,Au,COMPLETE
3266,-417.58578431366413,2026-04-07 11:33:58.409794,2026-04-07 11:33:59.208622,0 days 00:00:00.798828,20.727510381874698,19.635722452177504,1.0783971219236665,Au,COMPLETE
3267,0.0,2026-04-07 11:33:58.427839,2026-04-07 11:33:59.335130,0 days 00:00:00.907291,21.63180281636829,16.105286058876526,0.6957421044112079,Au,PRUNED
3268,-1.0,2026-04-07 11:33:58.443074,2026-04-07 11:33:59.029843,0 days 00:00:00.586769,52.19327778677034,15.463666147332908,0.9414244489992122,Au,COMPLETE
3269,-1.0,2026-04-07 11:33:58.477345,2026-04-07 11:33:59.082719,0 days 00:00:00.605374,37.47833820473458,19.800735528345978,0.881970699459654,Au,COMPLETE
3270,-1.0,2026-04-07 11:33:58.769711,2026-04-07 11:33:59.196615,0 days 00:00:00.426904,27.136003674791045,19.986423766710406,0.8268907828276957,Au,COMPLETE
3271,-1.0,2026-04-07 11:33:58.805267,2026-04-07 11:33:59.255704,0 days 00:00:00.450437,36.49264865718958,19.95384901776407,1.352823553182368,Au,COMPLETE
3272,79.32098765431864,2026-04-07 11:33:59.121685,2026-04-07 11:33:59.847758,0 days 00:00:00.726073,32.97666076643658,16.72401766727883,0.8171603011245926,Au,PRUNED
3273,-1.0,2026-04-07 11:33:59.243391,2026-04-07 11:33:59.738014,0 days 00:00:00.494623,31.245515794749853,16.9477772688866,1.1291330735517597,Au,COMPLETE
3274,-23.809523809520407,2026-04-07 11:33:59.378354,2026-04-07 11:33:59.935672,0 days 00:00:00.557318,36.18806271212558,17.7632310497345,1.2893940375128947,Ag,PRUNED
3275,-1.5243902439024142,2026-04-07 11:33:59.397924,2026-04-07 11:33:59.906201,0 days 00:00:00.508277,113.84048499980616,1.7581919573746756,1.8803248481359272,Ag,PRUNED
3276,-1.0,2026-04-07 11:33:59.411795,2026-04-07 11:33:59.985087,0 days 00:00:00.573292,20.677384340831434,19.806249708482024,0.7171724090768149,Au,COMPLETE
3277,-1.0,2026-04-07 11:33:59.428610,2026-04-07 11:34:00.017476,0 days 00:00:00.588866,32.62735624348425,19.96006415871031,0.9754263933020018,Au,COMPLETE
3278,-14.880952380950255,2026-04-07 11:33:59.459076,2026-04-07 11:34:00.151616,0 days 00:00:00.692540,33.504862838236654,18.90504240689404,1.2191251154354437,Ag,PRUNED
3279,83.33333333333088,2026-04-07 11:33:59.440357,2026-04-07 11:34:00.150610,0 days 00:00:00.710253,22.482451920018736,19.88774286094701,1.5587922255026174,Au,PRUNED
3280,-1.0,2026-04-07 11:33:59.865085,2026-04-07 11:34:00.438350,0 days 00:00:00.573265,20.577896913083233,19.80660596093005,1.4719790030543842,Au,COMPLETE
3281,-1.0,2026-04-07 11:33:59.940961,2026-04-07 11:34:00.565980,0 days 00:00:00.625019,34.6400640760726,16.8187536071843,1.103067299563759,Au,COMPLETE
3282,-1.0,2026-04-07 11:34:00.061357,2026-04-07 11:34:00.490871,0 days 00:00:00.429514,22.509053389037504,2.1859211951082607,0.9414275616454231,Cu,COMPLETE
3283,-1.0,2026-04-07 11:34:00.117305,2026-04-07 11:34:00.592795,0 days 00:00:00.475490,81.49903339106133,17.098457712846113,1.1420432260054891,Cu,COMPLETE
3284,0.0,2026-04-07 11:34:00.212095,2026-04-07 11:34:00.664939,0 days 00:00:00.452844,20.07167933151368,18.616805986481573,0.7890576963626941,Au,PRUNED
3285,0.0,2026-04-07 11:34:00.226982,2026-04-07 11:34:01.002895,0 days 00:00:00.775913,51.97833465009755,17.33626802892333,1.285296013774191,Au,PRUNED
3286,-1.0,2026-04-07 11:34:00.282838,2026-04-07 11:34:00.794288,0 days 00:00:00.511450,21.8875454139361,19.939891122937627,1.2776351264907948,Au,COMPLETE
3287,-1.0,2026-04-07 11:34:00.297800,2026-04-07 11:34:01.023493,0 days 00:00:00.725693,32.0393982234165,17.282472987016888,1.0499910532302934,Au,COMPLETE
3288,-1.0,2026-04-07 11:34:00.554985,2026-04-07 11:34:01.074109,0 days 00:00:00.519124,33.88384208665636,17.158297153859305,0.7016899656057445,Au,COMPLETE
3289,-1.0,2026-04-07 11:34:00.617227,2026-04-07 11:34:01.341421,0 days 00:00:00.724194,114.18205804255892,8.544359066973076,1.2769949391322815,Ag,COMPLETE
3290,-380.9121621621107,2026-04-07 11:34:00.708182,2026-04-07 11:34:01.309019,0 days 00:00:00.600837,20.579443833940008,19.68539058798519,0.6365757099672591,Au,COMPLETE
3291,-1.0,2026-04-07 11:34:00.736588,2026-04-07 11:34:01.137909,0 days 00:00:00.401321,20.29715590629515,17.73767206228367,0.5955318223868405,Au,COMPLETE
3292,0.0,2026-04-07 11:34:00.754024,2026-04-07 11:34:01.190021,0 days 00:00:00.435997,34.68837484304956,17.10277328810144,0.70464378847313,Au,PRUNED
3293,-1.0,2026-04-07 11:34:00.931322,2026-04-07 11:34:01.472645,0 days 00:00:00.541323,20.14836453465796,19.9833305901389,1.2210289254292532,Au,COMPLETE
3294,0.0,2026-04-07 11:34:01.101483,2026-04-07 11:34:01.799412,0 days 00:00:00.697929,37.14938611176221,19.612265279912336,1.100389689939167,Au,PRUNED
3295,-1.0,2026-04-07 11:34:01.209368,2026-04-07 11:34:01.883860,0 days 00:00:00.674492,21.276478330862126,19.917524585641335,1.303233927975795,Au,COMPLETE
3296,-1.0,2026-04-07 11:34:01.239726,2026-04-07 11:34:01.636903,0 days 00:00:00.397177,33.77830199710943,19.806876070781236,1.1137869059505865,Au,COMPLETE
3297,-1.0,2026-04-07 11:34:01.255001,2026-04-07 11:34:02.010803,0 days 00:00:00.755802,32.860882052781236,19.786690119116173,0.937216046929384,Au,COMPLETE
3298,-1.0,2026-04-07 11:34:01.332723,2026-04-07 11:34:01.918223,0 days 00:00:00.585500,36.36736821324976,16.97402605508678,1.0247786851976468,Au,COMPLETE
3299,0.0,2026-04-07 11:34:01.416122,2026-04-07 11:34:02.137867,0 days 00:00:00.721745,33.02404387358746,19.628510483340115,0.8815663781596655,Au,PRUNED
3300,0.0,2026-04-07 11:34:01.532631,2026-04-07 11:34:02.163396,0 days 00:00:00.630765,35.86631284385385,19.985050568856742,0.8927126920293181,Au,PRUNED
3301,-414.23357664227547,2026-04-07 11:34:01.639256,2026-04-07 11:34:02.313491,0 days 00:00:00.674235,20.243989248553795,19.779798130148144,1.280295483019739,Au,COMPLETE
3302,0.0,2026-04-07 11:34:01.786714,2026-04-07 11:34:02.350662,0 days 00:00:00.563948,20.248570531570287,17.025343872748792,1.1984726560545216,Au,PRUNED
3303,-0.6265664160400909,2026-04-07 11:34:01.899121,2026-04-07 11:34:02.535543,0 days 00:00:00.636422,75.30404250696142,6.380436518892724,1.983111683046967,Au,PRUNED
3304,-1.0,2026-04-07 11:34:01.979452,2026-04-07 11:34:02.529178,0 days 00:00:00.549726,20.15462534577123,19.17696815234651,0.8322968552824803,Au,COMPLETE
3305,-1.0,2026-04-07 11:34:02.156423,2026-04-07 11:34:02.611368,0 days 00:00:00.454945,20.655336308686667,17.304030029156035,0.8033753407270144,Au,COMPLETE
3306,-1.0,2026-04-07 11:34:02.246420,2026-04-07 11:34:02.611368,0 days 00:00:00.364948,30.903386735535015,19.998966358846527,0.8361590993841339,Au,COMPLETE
3307,-1.0,2026-04-07 11:34:02.260885,2026-04-07 11:34:02.707885,0 days 00:00:00.447000,21.073306824280348,16.932328869906797,1.2718998235440777,Au,COMPLETE
3308,0.0,2026-04-07 11:34:02.377982,2026-04-07 11:34:03.107289,0 days 00:00:00.729307,38.06115408982122,19.660668419270653,1.3463386625861773,Au,PRUNED
3309,-1.0,2026-04-07 11:34:02.396123,2026-04-07 11:34:03.036766,0 days 00:00:00.640643,34.041606655205754,16.807410567004652,1.3535844211601893,Au,COMPLETE
3310,0.0,2026-04-07 11:34:02.518601,2026-04-07 11:34:03.105782,0 days 00:00:00.587181,34.568849253297856,17.019584931062628,1.2789193483165877,Au,PRUNED
3311,-1.0,2026-04-07 11:34:02.711057,2026-04-07 11:34:03.168898,0 days 00:00:00.457841,34.86614321993098,16.94538173905987,1.2563550846094398,Au,COMPLETE
3312,-8.01282051281928,2026-04-07 11:34:02.762743,2026-04-07 11:34:03.396353,0 days 00:00:00.633610,21.1057655195691,19.821032237841383,1.3565445059327714,Au,PRUNED
3313,0.0,2026-04-07 11:34:02.783335,2026-04-07 11:34:03.283116,0 days 00:00:00.499781,31.62838684978392,17.39401520528304,1.4540539558648953,Au,PRUNED
3314,-1.0,2026-04-07 11:34:02.887707,2026-04-07 11:34:03.443686,0 days 00:00:00.555979,20.08678441011057,13.925679130321306,0.918915138999858,Au,COMPLETE
3315,0.0,2026-04-07 11:34:02.974662,2026-04-07 11:34:03.860456,0 days 00:00:00.885794,36.94306489344311,17.66184124045933,1.1747192618190017,Au,PRUNED
3316,-1.0,2026-04-07 11:34:03.200314,2026-04-07 11:34:03.686496,0 days 00:00:00.486182,44.085984199419784,8.185830726012128,1.1064959695262062,Cu,COMPLETE
3317,-407.6738609112121,2026-04-07 11:34:03.172405,2026-04-07 11:34:03.814652,0 days 00:00:00.642247,20.165885023403487,19.983537212592957,0.9932855443601405,Au,COMPLETE
3318,-1.0,2026-04-07 11:34:03.240486,2026-04-07 11:34:03.987773,0 days 00:00:00.747287,20.290711244139377,18.516269984316487,0.9562449010426602,Au,COMPLETE
3319,-1.0,2026-04-07 11:34:03.356613,2026-04-07 11:34:03.892658,0 days 00:00:00.536045,20.29259341546898,19.05675425803873,1.0579112048982358,Au,COMPLETE
3320,-1.0,2026-04-07 11:34:03.398761,2026-04-07 11:34:04.026316,0 days 00:00:00.627555,90.9676872162108,14.817419474233468,1.345156654086197,Ag,COMPLETE
3321,0.0,2026-04-07 11:34:03.456309,2026-04-07 11:34:03.948204,0 days 00:00:00.491895,45.12713683917103,19.856325834013106,0.9764882338807372,Au,PRUNED
3322,-1.0,2026-04-07 11:34:03.637707,2026-04-07 11:34:04.191377,0 days 00:00:00.553670,102.49905009336692,11.828556400568887,1.9656311588890856,Ag,COMPLETE
3323,-1.0,2026-04-07 11:34:03.822715,2026-04-07 11:34:04.285527,0 days 00:00:00.462812,21.06497265872433,19.802427242485614,1.2900003370743356,Au,COMPLETE
3324,-1.0,2026-04-07 11:34:03.950789,2026-04-07 11:34:04.680871,0 days 00:00:00.730082,20.136177051003006,16.975834775221543,1.0431416219925471,Au,COMPLETE
3325,2.873563218390408,2026-04-07 11:34:04.029320,2026-04-07 11:34:04.677786,0 days 00:00:00.648466,22.508913406187975,19.931930595635123,1.0621087970950278,Au,PRUNED
3326,-1.0,2026-04-07 11:34:03.991794,2026-04-07 11:34:04.564568,0 days 00:00:00.572774,20.05011903079154,16.46700806484906,1.2568318619293521,Au,COMPLETE
3327,-1.0,2026-04-07 11:34:04.104612,2026-04-07 11:34:04.768376,0 days 00:00:00.663764,23.052955707708477,19.956236386713424,1.4120263928338743,Au,COMPLETE
3328,-1.0,2026-04-07 11:34:04.121964,2026-04-07 11:34:04.680871,0 days 00:00:00.558907,21.952571861876645,17.248145908167157,1.0436171739168663,Au,COMPLETE
3329,-1.0,2026-04-07 11:34:04.244149,2026-04-07 11:34:04.709363,0 days 00:00:00.465214,20.754805256471048,19.411651839032977,1.2023534865864531,Au,COMPLETE
3330,-1.0,2026-04-07 11:34:04.376789,2026-04-07 11:34:04.678851,0 days 00:00:00.302062,30.874283071979207,19.811992466623746,1.5451375296543544,Au,COMPLETE
3331,-404.7619047618469,2026-04-07 11:34:04.420080,2026-04-07 11:34:04.897520,0 days 00:00:00.477440,20.323990707021693,19.587637548309722,1.2766842365468967,Au,COMPLETE
3332,-1.0,2026-04-07 11:34:04.638687,2026-04-07 11:34:05.356333,0 days 00:00:00.717646,20.719274207018543,16.847141863482413,1.2482941799807987,Au,COMPLETE
3333,-351.56249999995606,2026-04-07 11:34:04.712362,2026-04-07 11:34:05.588802,0 days 00:00:00.876440,21.438303908636527,17.851972123614257,1.5450620878700685,Au,COMPLETE
3334,-9.615384615383135,2026-04-07 11:34:04.843277,2026-04-07 11:34:05.527359,0 days 00:00:00.684082,21.00617606907803,19.8302249302317,1.1676342695126012,Au,PRUNED
3335,4.166666666666111,2026-04-07 11:34:04.884385,2026-04-07 11:34:05.561347,0 days 00:00:00.676962,22.95253579591561,19.834377818731568,0.9993306086556117,Au,PRUNED
3336,-341.97154471540597,2026-04-07 11:34:04.900298,2026-04-07 11:34:05.586093,0 days 00:00:00.685795,20.836714046130645,18.023135556228542,1.6407012780693022,Au,COMPLETE
3337,-1.0,2026-04-07 11:34:04.944052,2026-04-07 11:34:05.487350,0 days 00:00:00.543298,35.74561344761985,17.612666672313654,1.3245226166598483,Au,COMPLETE
3338,-1.0,2026-04-07 11:34:04.957990,2026-04-07 11:34:05.485847,0 days 00:00:00.527857,20.102391309952278,17.88269364858798,1.0119387188987583,Au,COMPLETE
3339,-3.0864197530859623,2026-04-07 11:34:05.102825,2026-04-07 11:34:05.904330,0 days 00:00:00.801505,21.944672157320035,19.977192853360332,0.9555224488329573,Au,PRUNED
3340,-1.7076502732240157,2026-04-07 11:34:05.592507,2026-04-07 11:34:06.339676,0 days 00:00:00.747169,109.68726617776942,0.8064007604853973,1.0197884708779998,Cu,PRUNED
3341,-381.75675675670516,2026-04-07 11:34:05.660685,2026-04-07 11:34:06.286512,0 days 00:00:00.625827,20.139031341890238,19.20584655146757,1.5504595105881103,Au,COMPLETE
3342,-1.0,2026-04-07 11:34:05.670859,2026-04-07 11:34:06.121093,0 days 00:00:00.450234,38.529831506099356,19.81047033178642,1.294753580378718,Au,COMPLETE
3343,-1.0,2026-04-07 11:34:05.692588,2026-04-07 11:34:06.217879,0 days 00:00:00.525291,20.354604649412142,19.232314444607113,1.2968944621264666,Ag,COMPLETE
3344,-1.0,2026-04-07 11:34:05.732173,2026-04-07 11:34:06.222727,0 days 00:00:00.490554,23.09615293858339,19.969669070173694,1.1491151033044438,Ag,COMPLETE
3345,-11.752136752135547,2026-04-07 11:34:05.719915,2026-04-07 11:34:06.350073,0 days 00:00:00.630158,49.383437006716726,3.6845016036088687,0.8637051660391712,Cu,PRUNED
3346,-1.0,2026-04-07 11:34:05.790816,2026-04-07 11:34:06.285513,0 days 00:00:00.494697,49.04235984845248,16.227513534184453,0.8604369225279604,Au,COMPLETE
3347,0.0,2026-04-07 11:34:06.001678,2026-04-07 11:34:06.710611,0 days 00:00:00.708933,41.19717425909987,19.78224998127066,1.222191613532404,Au,PRUNED
3348,0.0,2026-04-07 11:34:06.311070,2026-04-07 11:34:06.901667,0 days 00:00:00.590597,35.85977886681967,17.905758558399096,1.0652723735417533,Au,PRUNED
3349,79.93827160493589,2026-04-07 11:34:06.405553,2026-04-07 11:34:07.085751,0 days 00:00:00.680198,31.519557209312296,16.523676736908953,1.2243311796892586,Au,PRUNED
3350,0.0,2026-04-07 11:34:06.462421,2026-04-07 11:34:07.145947,0 days 00:00:00.683526,20.039506488941782,17.109005286746733,1.1006195858394818,Au,PRUNED
3351,-7.716049382714907,2026-04-07 11:34:06.484120,2026-04-07 11:34:07.150900,0 days 00:00:00.666780,21.328327585661338,19.677770315333934,1.3108840084730504,Au,PRUNED
3352,-1.0,2026-04-07 11:34:06.506861,2026-04-07 11:34:07.091423,0 days 00:00:00.584562,20.16877229782958,16.55299414027982,1.4142435533740751,Au,COMPLETE
3353,0.0,2026-04-07 11:34:06.551607,2026-04-07 11:34:07.120459,0 days 00:00:00.568852,35.02737128262848,17.45357999935839,0.8291262483318497,Au,PRUNED
3354,-1.0,2026-04-07 11:34:06.497892,2026-04-07 11:34:07.084751,0 days 00:00:00.586859,34.63341644612271,17.506376275860838,1.4449952806052782,Au,COMPLETE
3355,-1.0,2026-04-07 11:34:06.782987,2026-04-07 11:34:07.263786,0 days 00:00:00.480799,34.84174419765788,17.52276173480674,1.2973294875434624,Au,COMPLETE
3356,0.0,2026-04-07 11:34:07.002389,2026-04-07 11:34:07.853426,0 days 00:00:00.851037,37.7240929882324,19.633417490101962,1.2467615466737718,Au,PRUNED
3357,-1.0,2026-04-07 11:34:07.120981,2026-04-07 11:34:07.884781,0 days 00:00:00.763800,20.43680449355334,19.069103913724526,1.5591390321196616,Au,COMPLETE
3358,-1.0,2026-04-07 11:34:07.259651,2026-04-07 11:34:07.780104,0 days 00:00:00.520453,33.50248847315742,19.751973391683258,1.079103073186637,Au,COMPLETE
3359,-1.0,2026-04-07 11:34:07.276664,2026-04-07 11:34:07.781363,0 days 00:00:00.504699,20.196965068674558,19.93385766784509,0.6924647282591101,Au,COMPLETE
3360,-1.0,2026-04-07 11:34:07.335133,2026-04-07 11:34:07.823244,0 days 00:00:00.488111,21.788415618899787,19.90949675673038,1.0909198212115623,Au,COMPLETE
3361,-1.0,2026-04-07 11:34:07.389298,2026-04-07 11:34:07.775841,0 days 00:00:00.386543,32.27074263442822,17.982901993008397,0.9683755757961272,Au,COMPLETE
3362,-1.0,2026-04-07 11:34:07.490473,2026-04-07 11:34:07.945740,0 days 00:00:00.455267,45.03810974266355,19.99388019477527,1.0256320207633318,Au,COMPLETE
3363,0.0,2026-04-07 11:34:07.574482,2026-04-07 11:34:08.104354,0 days 00:00:00.529872,35.76222380645743,17.663541213092543,0.8782082380549796,Au,PRUNED
