number,value,datetime_start,datetime_complete,duration,params_D2_nm,params_D3_nm,params_D4_nm,params_metal,state
4477,0.0,2026-04-07 11:36:06.278207,2026-04-07 11:36:07.124752,0 days 00:00:00.846545,32.060701898533395,17.70862130834302,0.7017675247564132,Au,PRUNED
4478,0.0,2026-04-07 11:36:06.468539,2026-04-07 11:36:07.170281,0 days 00:00:00.701742,20.411909004823706,14.267930337132498,0.840709940010195,Au,PRUNED
4479,-1.0,2026-04-07 11:36:06.490609,2026-04-07 11:36:07.158458,0 days 00:00:00.667849,32.37600269226287,17.24923695200598,0.8367768421335163,Au,COMPLETE
4480,-1.0,2026-04-07 11:36:06.556953,2026-04-07 11:36:07.298414,0 days 00:00:00.741461,20.36724976003415,15.554127058120143,0.7519903217479036,Au,COMPLETE
4481,-1.0,2026-04-07 11:36:06.722343,2026-04-07 11:36:07.197695,0 days 00:00:00.475352,91.4036409791494,10.794869989605608,0.17229494300995551,Au,COMPLETE
4482,-1.0,2026-04-07 11:36:06.747589,2026-04-07 11:36:07.354931,0 days 00:00:00.607342,20.857708906568003,17.375973869683488,0.5811413263568334,Au,COMPLETE
4483,0.0,2026-04-07 11:36:07.052676,2026-04-07 11:36:07.816859,0 days 00:00:00.764183,35.44472508937088,17.391327216803717,0.926557196750347,Au,PRUNED
4484,-1.0,2026-04-07 11:36:07.202046,2026-04-07 11:36:07.922971,0 days 00:00:00.720925,31.096795150577467,17.517300694048828,0.5388392404291767,Au,COMPLETE
4485,-1.0,2026-04-07 11:36:07.270289,2026-04-07 11:36:07.862215,0 days 00:00:00.591926,31.650985388886177,19.962300129568895,0.9041972860604721,Au,COMPLETE
4486,0.0,2026-04-07 11:36:07.349764,2026-04-07 11:36:08.016651,0 days 00:00:00.666887,44.81375615770794,17.255001313391926,0.5230149829792439,Au,PRUNED
4487,-1.0,2026-04-07 11:36:07.378815,2026-04-07 11:36:07.875526,0 days 00:00:00.496711,56.510930347512215,6.9125328221022,1.8462944528587262,Au,COMPLETE
4488,-8.012820512819896,2026-04-07 11:36:07.455116,2026-04-07 11:36:08.274218,0 days 00:00:00.819102,31.682858875254155,0.7240637178380744,0.6673778389760407,Au,PRUNED
4489,0.0,2026-04-07 11:36:07.576166,2026-04-07 11:36:08.275221,0 days 00:00:00.699055,31.31973180074248,17.828505027104683,0.49820863318091,Au,PRUNED
4490,-1.0,2026-04-07 11:36:07.595232,2026-04-07 11:36:08.178529,0 days 00:00:00.583297,21.19103932714965,19.92330570499219,0.9675860448538367,Au,COMPLETE
4491,-1.0,2026-04-07 11:36:07.928017,2026-04-07 11:36:08.574723,0 days 00:00:00.646706,20.08230500901425,17.044629433504998,0.8307947357221124,Au,COMPLETE
4492,-1.0,2026-04-07 11:36:08.019463,2026-04-07 11:36:08.796852,0 days 00:00:00.777389,33.86846151171297,17.71680767024936,0.6389316422141914,Au,COMPLETE
4493,-1.0,2026-04-07 11:36:08.131440,2026-04-07 11:36:08.695536,0 days 00:00:00.564096,30.98010617290128,19.784699485232345,0.3322806649490848,Au,COMPLETE
4494,0.0,2026-04-07 11:36:08.175507,2026-04-07 11:36:09.051419,0 days 00:00:00.875912,30.677167617142366,19.823151637225706,0.7519212973967293,Au,PRUNED
4495,0.0,2026-04-07 11:36:08.227860,2026-04-07 11:36:08.796852,0 days 00:00:00.568992,34.304820827929824,19.891002401441416,0.7638436077648363,Au,PRUNED
4496,-1.0,2026-04-07 11:36:08.339718,2026-04-07 11:36:08.883371,0 days 00:00:00.543653,26.07212271837483,19.87393314274987,0.4084126725264613,Au,COMPLETE
4497,-1.0,2026-04-07 11:36:08.398768,2026-04-07 11:36:08.933850,0 days 00:00:00.535082,21.910591717031007,19.421505010370154,0.47650682577725834,Au,COMPLETE
4498,-1.0,2026-04-07 11:36:08.411406,2026-04-07 11:36:09.007693,0 days 00:00:00.596287,30.46784871994321,19.919410124175762,0.6075823780363582,Au,COMPLETE
4499,-372.7924944811867,2026-04-07 11:36:08.724477,2026-04-07 11:36:09.366507,0 days 00:00:00.642030,20.025773419605272,19.863727357456412,0.8122599349765034,Au,COMPLETE
4500,0.0,2026-04-07 11:36:08.902915,2026-04-07 11:36:09.496246,0 days 00:00:00.593331,31.276384830405306,19.960260662412736,0.4996293264572885,Au,PRUNED
4501,-1.0,2026-04-07 11:36:08.988095,2026-04-07 11:36:09.651762,0 days 00:00:00.663667,30.19858395730361,19.734452411388443,0.9522364006563421,Au,COMPLETE
4502,-359.7756410255949,2026-04-07 11:36:09.079883,2026-04-07 11:36:09.602829,0 days 00:00:00.522946,20.577155258380223,19.23765935089971,0.8083653604433351,Au,COMPLETE
4503,-1.0,2026-04-07 11:36:09.118118,2026-04-07 11:36:09.649732,0 days 00:00:00.531614,39.915753846973516,19.79711118334063,0.42533667718940493,Cu,COMPLETE
4504,-8.333333333332,2026-04-07 11:36:09.156842,2026-04-07 11:36:09.808425,0 days 00:00:00.651583,22.07831356089217,19.991339725244448,0.4128496385773309,Au,PRUNED
4505,0.6830601092895726,2026-04-07 11:36:09.168263,2026-04-07 11:36:09.764848,0 days 00:00:00.596585,52.355429148054434,13.646181745380765,0.6876134598347203,Cu,PRUNED
4506,-1.0,2026-04-07 11:36:09.213846,2026-04-07 11:36:10.031256,0 days 00:00:00.817410,80.48653746263875,12.794144163400851,0.8844331226954083,Cu,COMPLETE
4507,0.0,2026-04-07 11:36:09.512133,2026-04-07 11:36:10.288558,0 days 00:00:00.776425,20.34668697855475,17.539540747188774,0.34172386027759993,Au,PRUNED
4508,-1.0,2026-04-07 11:36:09.679590,2026-04-07 11:36:10.166504,0 days 00:00:00.486914,50.173654513227,19.892868182482783,0.463573475644637,Au,COMPLETE
4509,-404.7619047618469,2026-04-07 11:36:09.870175,2026-04-07 11:36:10.868251,0 days 00:00:00.998076,20.56368928638581,19.7012433684325,0.9461074521315913,Au,COMPLETE
4510,83.02696078431127,2026-04-07 11:36:09.890184,2026-04-07 11:36:10.789056,0 days 00:00:00.898872,23.920381660337778,19.90861439791414,0.8994738664951647,Au,PRUNED
4511,-1.0,2026-04-07 11:36:09.910537,2026-04-07 11:36:10.554635,0 days 00:00:00.644098,32.167166423396885,19.860249334893876,1.1347816496643774,Au,COMPLETE
4512,-378.35570469793595,2026-04-07 11:36:09.930906,2026-04-07 11:36:10.749119,0 days 00:00:00.818213,20.822035241994293,19.48808419836186,0.6162039077282468,Au,COMPLETE
4513,0.0,2026-04-07 11:36:09.955665,2026-04-07 11:36:10.841677,0 days 00:00:00.886012,45.405117821501705,16.817778688560466,0.9494966922991877,Au,PRUNED
4514,0.0,2026-04-07 11:36:10.286533,2026-04-07 11:36:10.866720,0 days 00:00:00.580187,20.77003247026563,16.717194264080984,0.41165843078773473,Au,PRUNED
4515,0.0,2026-04-07 11:36:10.346208,2026-04-07 11:36:11.010668,0 days 00:00:00.664460,47.08253672306105,19.9578479017954,0.6771648080781224,Au,PRUNED
4516,-1.0,2026-04-07 11:36:10.596092,2026-04-07 11:36:11.193677,0 days 00:00:00.597585,27.47981916825873,17.075261094833476,0.8210351256969987,Au,COMPLETE
4517,0.0,2026-04-07 11:36:10.703014,2026-04-07 11:36:11.398378,0 days 00:00:00.695364,20.610724808128438,17.84740605870805,0.9359391148574202,Au,PRUNED
4518,-11.217948717946992,2026-04-07 11:36:10.919727,2026-04-07 11:36:11.750912,0 days 00:00:00.831185,21.808614596074072,19.75513532425714,0.5934547317848052,Au,PRUNED
4519,-1.0,2026-04-07 11:36:10.905266,2026-04-07 11:36:11.603987,0 days 00:00:00.698721,20.1081138343985,16.937253583749182,0.6069699028228243,Au,COMPLETE
4520,0.0,2026-04-07 11:36:11.010668,2026-04-07 11:36:11.775711,0 days 00:00:00.765043,20.170647491829182,19.208866831647768,0.41838519773780114,Au,PRUNED
4521,-1.0,2026-04-07 11:36:11.058425,2026-04-07 11:36:11.682104,0 days 00:00:00.623679,20.66535179627591,16.17191457858066,0.8150701017884349,Ag,COMPLETE
4522,-1.0,2026-04-07 11:36:11.230174,2026-04-07 11:36:11.816418,0 days 00:00:00.586244,20.069547678417894,19.829242295544947,0.8789673382010468,Au,COMPLETE
4523,-1.0,2026-04-07 11:36:11.240359,2026-04-07 11:36:11.851087,0 days 00:00:00.610728,29.555934518928375,17.871271812981927,0.8182529755982064,Au,COMPLETE
4524,0.0,2026-04-07 11:36:11.346663,2026-04-07 11:36:12.265293,0 days 00:00:00.918630,34.88224128673883,17.256475291673976,0.9783827868563646,Au,PRUNED
4525,-1.0,2026-04-07 11:36:11.462559,2026-04-07 11:36:12.188052,0 days 00:00:00.725493,22.358819111523356,17.051872815733304,0.8846467568055338,Au,COMPLETE
4526,0.0,2026-04-07 11:36:11.870098,2026-04-07 11:36:12.648011,0 days 00:00:00.777913,119.80250149654054,17.882398396445673,0.5550170428554062,Ag,PRUNED
4527,-1.0,2026-04-07 11:36:11.822062,2026-04-07 11:36:12.537474,0 days 00:00:00.715412,30.985466495643344,16.96349328115721,0.9128608206457931,Au,COMPLETE
4528,4.084967320261118,2026-04-07 11:36:11.805324,2026-04-07 11:36:12.739123,0 days 00:00:00.933799,32.83479161100754,14.799173294824648,0.5982253939806614,Au,PRUNED
4529,0.0,2026-04-07 11:36:11.914054,2026-04-07 11:36:12.710068,0 days 00:00:00.796014,30.886535981938433,17.896306145993485,0.8818267696334117,Au,PRUNED
4530,-1.0,2026-04-07 11:36:12.000472,2026-04-07 11:36:12.649329,0 days 00:00:00.648857,20.633218855383987,17.759768942117198,0.8687649036081224,Au,COMPLETE
4531,0.0,2026-04-07 11:36:12.080806,2026-04-07 11:36:13.051931,0 days 00:00:00.971125,20.154341380358836,17.08743526442835,0.13005970064634675,Au,PRUNED
4532,-14.756944444443215,2026-04-07 11:36:12.362731,2026-04-07 11:36:13.331217,0 days 00:00:00.968486,31.28841987584733,17.901793084110043,0.5850952924230493,Ag,PRUNED
4533,-448.49081364822314,2026-04-07 11:36:12.395591,2026-04-07 11:36:13.022211,0 days 00:00:00.626620,21.202427483249494,19.957775116879326,0.7990868926399279,Au,COMPLETE
4534,-11.43790849673113,2026-04-07 11:36:12.685772,2026-04-07 11:36:13.331217,0 days 00:00:00.645445,24.124345603524954,19.91422230427832,0.9767004735160029,Ag,PRUNED
4535,0.0,2026-04-07 11:36:12.772260,2026-04-07 11:36:13.822863,0 days 00:00:01.050603,20.309596528999865,17.68025309901382,0.690215505316509,Au,PRUNED
4536,-8.928571428570791,2026-04-07 11:36:12.804692,2026-04-07 11:36:13.822863,0 days 00:00:01.018171,25.561468498503967,16.917885753766637,0.5941789257371537,Ag,PRUNED
4537,-1.0,2026-04-07 11:36:12.954362,2026-04-07 11:36:13.678626,0 days 00:00:00.724264,37.27479098539382,19.92654972707507,0.9177791046219992,Au,COMPLETE
4538,79.9632352941153,2026-04-07 11:36:12.910410,2026-04-07 11:36:13.686682,0 days 00:00:00.776272,34.28246794212991,15.075130538383771,0.5084740027064658,Au,PRUNED
4539,0.0,2026-04-07 11:36:13.266170,2026-04-07 11:36:13.830328,0 days 00:00:00.564158,44.68395894330294,17.916680080721534,0.636234908789528,Au,PRUNED
4540,0.0,2026-04-07 11:36:13.294152,2026-04-07 11:36:13.834554,0 days 00:00:00.540402,20.296755285881012,18.586145951487612,0.7587987929401859,Au,PRUNED
4541,-1.0,2026-04-07 11:36:13.401599,2026-04-07 11:36:13.771519,0 days 00:00:00.369920,20.478556616896938,19.700028031633703,0.6535254760428649,Au,COMPLETE
4542,0.0,2026-04-07 11:36:13.502599,2026-04-07 11:36:14.184010,0 days 00:00:00.681411,47.10968827283463,17.483312401277157,0.8622165243246301,Au,PRUNED
4543,-1.0,2026-04-07 11:36:13.725539,2026-04-07 11:36:14.539037,0 days 00:00:00.813498,32.6358827656303,17.676133696356324,0.6425381656945894,Au,COMPLETE
4544,-1.0,2026-04-07 11:36:13.900077,2026-04-07 11:36:14.599726,0 days 00:00:00.699649,20.113432473809365,19.46143565585696,0.5674766290866053,Au,COMPLETE
4545,0.0,2026-04-07 11:36:13.945846,2026-04-07 11:36:14.674359,0 days 00:00:00.728513,104.14483178952511,19.363188348197788,0.7831471059142789,Cu,PRUNED
4546,0.0,2026-04-07 11:36:13.977253,2026-04-07 11:36:14.671842,0 days 00:00:00.694589,20.18971114254377,17.31626217452307,0.5794775038913798,Au,PRUNED
4547,-1.0,2026-04-07 11:36:14.002946,2026-04-07 11:36:14.539037,0 days 00:00:00.536091,105.36405205217156,8.440593946599629,1.599086643818562,Ag,COMPLETE
4548,-1.0,2026-04-07 11:36:14.087588,2026-04-07 11:36:14.612257,0 days 00:00:00.524669,20.67536343751298,19.96438488309823,0.685577886071017,Au,COMPLETE
4549,-1.0,2026-04-07 11:36:14.101365,2026-04-07 11:36:14.645656,0 days 00:00:00.544291,38.266559757736545,19.942373400918232,0.5202123906718416,Au,COMPLETE
4550,-1.0,2026-04-07 11:36:14.286016,2026-04-07 11:36:14.830640,0 days 00:00:00.544624,20.26931163625114,19.874031282007028,0.3777395563165439,Au,COMPLETE
4551,0.0,2026-04-07 11:36:14.707491,2026-04-07 11:36:15.465967,0 days 00:00:00.758476,32.514964434325584,19.894528939532822,0.2416754968763694,Au,PRUNED
4552,-1.0,2026-04-07 11:36:14.773341,2026-04-07 11:36:15.512423,0 days 00:00:00.739082,35.37700654485065,19.879902391660746,0.4213741252878253,Au,COMPLETE
4553,0.0,2026-04-07 11:36:14.788126,2026-04-07 11:36:15.387334,0 days 00:00:00.599208,20.046628871952702,17.9178398639497,0.8093335261003111,Au,PRUNED
4554,0.0,2026-04-07 11:36:14.804512,2026-04-07 11:36:15.609774,0 days 00:00:00.805262,34.58755679298957,17.8508845511751,0.7601336733528339,Au,PRUNED
4555,0.0,2026-04-07 11:36:14.817538,2026-04-07 11:36:15.636121,0 days 00:00:00.818583,49.73974063983786,18.04272713294534,0.7535286545032674,Au,PRUNED
4556,-1.0,2026-04-07 11:36:14.848896,2026-04-07 11:36:15.439004,0 days 00:00:00.590108,38.12260197658185,17.23093114652856,0.37761345607164815,Au,COMPLETE
4557,0.0,2026-04-07 11:36:15.044990,2026-04-07 11:36:15.954256,0 days 00:00:00.909266,35.27854950174886,17.046029762025615,0.5298850323478761,Au,PRUNED
4558,0.0,2026-04-07 11:36:15.083056,2026-04-07 11:36:15.781414,0 days 00:00:00.698358,37.59773288111782,19.820022196580627,0.5079310961505378,Au,PRUNED
4559,-420.6790123456165,2026-04-07 11:36:15.474671,2026-04-07 11:36:16.139750,0 days 00:00:00.665079,20.53803089152388,19.91744996643705,0.9375222534953971,Au,COMPLETE
4560,-1.0,2026-04-07 11:36:15.722712,2026-04-07 11:36:16.401927,0 days 00:00:00.679215,33.189364499869576,19.69141747929583,0.48482167617714633,Au,COMPLETE
4561,0.0,2026-04-07 11:36:15.759983,2026-04-07 11:36:16.404574,0 days 00:00:00.644591,34.50595855706558,17.016152399325737,0.34171112346922927,Au,PRUNED
4562,0.0,2026-04-07 11:36:15.671675,2026-04-07 11:36:16.499413,0 days 00:00:00.827738,34.967566184729925,19.897583980033087,0.7626322620460586,Au,PRUNED
4563,-1.0,2026-04-07 11:36:15.815097,2026-04-07 11:36:16.362603,0 days 00:00:00.547506,28.491018726659764,19.94366589718384,0.5302835653112308,Au,COMPLETE
4564,0.0,2026-04-07 11:36:15.838077,2026-04-07 11:36:16.687133,0 days 00:00:00.849056,36.673814116395285,19.831307073572045,0.32788965574094814,Au,PRUNED
4565,-1.0,2026-04-07 11:36:16.040657,2026-04-07 11:36:16.700843,0 days 00:00:00.660186,22.56541754426679,19.96182018819519,0.4705821082242625,Au,COMPLETE
4566,-441.2144702841686,2026-04-07 11:36:16.110453,2026-04-07 11:36:17.249390,0 days 00:00:01.138937,21.207149491132064,19.929768680441953,0.6521924295766024,Au,COMPLETE
4567,0.0,2026-04-07 11:36:16.329135,2026-04-07 11:36:17.157952,0 days 00:00:00.828817,20.376313893913302,19.891575851320308,0.281945638333958,Au,PRUNED
4568,0.0,2026-04-07 11:36:16.561237,2026-04-07 11:36:17.263160,0 days 00:00:00.701923,33.697736368150956,18.08250966159663,0.6145721938244317,Au,PRUNED
4569,-1.0,2026-04-07 11:36:16.597477,2026-04-07 11:36:17.205645,0 days 00:00:00.608168,20.12084627694433,19.785455784561552,0.5810951335125318,Au,COMPLETE
4570,-1.0,2026-04-07 11:36:16.618416,2026-04-07 11:36:17.204141,0 days 00:00:00.585725,22.425196170973205,19.896415894310643,0.6327511493457587,Au,COMPLETE
4571,-1.0,2026-04-07 11:36:16.806799,2026-04-07 11:36:17.406078,0 days 00:00:00.599279,31.003647862980664,17.02297420737645,0.5385392129805238,Au,COMPLETE
4572,-1.0,2026-04-07 11:36:16.867386,2026-04-07 11:36:17.478827,0 days 00:00:00.611441,42.036971182232,19.90997616696681,0.8155547583274672,Au,COMPLETE
4573,-1.0,2026-04-07 11:36:16.896144,2026-04-07 11:36:17.479826,0 days 00:00:00.583682,21.156532125796424,19.92825126616791,0.289716968903469,Au,COMPLETE
4574,-1.0,2026-04-07 11:36:17.232266,2026-04-07 11:36:17.849532,0 days 00:00:00.617266,43.04128978190627,17.64412079670666,0.4408304237649381,Au,COMPLETE
4575,0.0,2026-04-07 11:36:17.320739,2026-04-07 11:36:18.063134,0 days 00:00:00.742395,35.094749063494035,19.841066601236268,0.6862978445145314,Au,PRUNED
4576,-1.0,2026-04-07 11:36:17.350689,2026-04-07 11:36:17.923571,0 days 00:00:00.572882,56.44942547030581,17.139480655512525,0.10339693392118854,Au,COMPLETE
4577,-1.0,2026-04-07 11:36:17.422329,2026-04-07 11:36:17.924569,0 days 00:00:00.502240,20.66118511018995,17.415568398022014,0.4547816118803366,Au,COMPLETE
4578,-1.0,2026-04-07 11:36:17.439325,2026-04-07 11:36:18.107277,0 days 00:00:00.667952,21.08630520288524,18.042368925249146,0.7015014535113412,Au,COMPLETE
4579,-1.0,2026-04-07 11:36:17.601675,2026-04-07 11:36:18.063134,0 days 00:00:00.461459,20.878876170290187,16.44744456105799,0.3656807428103588,Au,COMPLETE
4580,-1.0,2026-04-07 11:36:17.723674,2026-04-07 11:36:18.465709,0 days 00:00:00.742035,28.180709166254086,19.985217375297296,0.5019971138431193,Au,COMPLETE
4581,-1.0,2026-04-07 11:36:17.767522,2026-04-07 11:36:18.265502,0 days 00:00:00.497980,21.677696757868834,19.99308585485424,0.5362493764040132,Au,COMPLETE
4582,-1.0,2026-04-07 11:36:18.067208,2026-04-07 11:36:18.846118,0 days 00:00:00.778910,37.463599929355354,17.13868045496278,0.5611938427435985,Au,COMPLETE
4583,0.0,2026-04-07 11:36:18.144480,2026-04-07 11:36:18.794308,0 days 00:00:00.649828,37.2595107530082,19.959625695978335,0.6085612170230017,Au,PRUNED
4584,-1.0,2026-04-07 11:36:18.163330,2026-04-07 11:36:18.656635,0 days 00:00:00.493305,31.109227125965155,19.647093567791796,0.668034440307147,Au,COMPLETE
4585,-1.0,2026-04-07 11:36:18.189980,2026-04-07 11:36:18.794308,0 days 00:00:00.604328,28.088546133324037,19.913834600420802,0.3827683627132556,Cu,COMPLETE
4586,-1.0,2026-04-07 11:36:18.283490,2026-04-07 11:36:18.875029,0 days 00:00:00.591539,20.52080617215576,19.859807043661267,0.44825587855975557,Au,COMPLETE
4587,0.0,2026-04-07 11:36:18.414689,2026-04-07 11:36:19.274139,0 days 00:00:00.859450,50.41597669751961,19.84323798364442,0.5008882023207725,Au,PRUNED
4588,-1.0,2026-04-07 11:36:18.537374,2026-04-07 11:36:19.130241,0 days 00:00:00.592867,22.37284076176339,17.21958861460545,0.6167637249656241,Au,COMPLETE
4589,-1.0,2026-04-07 11:36:18.616074,2026-04-07 11:36:19.273134,0 days 00:00:00.657060,22.312909998755533,17.253754571521107,0.6029241348212686,Au,COMPLETE
4590,-1.0,2026-04-07 11:36:18.962594,2026-04-07 11:36:19.511189,0 days 00:00:00.548595,32.01851810253049,17.947922476426196,0.7048739679701316,Au,COMPLETE
4591,0.0,2026-04-07 11:36:19.005357,2026-04-07 11:36:19.863433,0 days 00:00:00.858076,20.064054969180393,19.457297565439905,0.6280641913407379,Au,PRUNED
4592,-1.0,2026-04-07 11:36:19.054676,2026-04-07 11:36:19.828344,0 days 00:00:00.773668,20.235601484940204,19.762677777919006,0.5836112710388596,Cu,COMPLETE
4593,-1.0,2026-04-07 11:36:19.123514,2026-04-07 11:36:19.891568,0 days 00:00:00.768054,27.32922938334863,17.38622372985281,0.6135456100876602,Au,COMPLETE
4594,80.57598039215449,2026-04-07 11:36:19.169224,2026-04-07 11:36:19.750150,0 days 00:00:00.580926,30.977536032010235,17.131781374800127,0.4803041246120672,Au,PRUNED
4595,-1.0,2026-04-07 11:36:19.401926,2026-04-07 11:36:19.797594,0 days 00:00:00.395668,83.76681151739533,4.4113398191444615,1.2282349702052286,Ag,COMPLETE
4596,-1.0,2026-04-07 11:36:19.419096,2026-04-07 11:36:19.778077,0 days 00:00:00.358981,40.340285811513,18.036280355314435,0.1620753444212702,Cu,COMPLETE
4597,0.0,2026-04-07 11:36:19.443376,2026-04-07 11:36:20.024844,0 days 00:00:00.581468,30.198752983623173,19.70463014238576,0.6160239111210142,Au,PRUNED
4598,0.0,2026-04-07 11:36:19.672336,2026-04-07 11:36:20.518172,0 days 00:00:00.845836,33.018279000713136,17.784570673426888,0.554882050142548,Au,PRUNED
4599,-1.0,2026-04-07 11:36:19.790431,2026-04-07 11:36:20.552864,0 days 00:00:00.762433,20.092378863594558,19.014953304499535,0.5396771852071383,Au,COMPLETE
4600,-1.0,2026-04-07 11:36:19.985032,2026-04-07 11:36:20.436402,0 days 00:00:00.451370,44.18217928409261,19.788481921050085,0.17066925306552144,Au,COMPLETE
4601,0.0,2026-04-07 11:36:20.046401,2026-04-07 11:36:20.920981,0 days 00:00:00.874580,47.921742694595366,19.995239833642305,0.6271435830365379,Au,PRUNED
4602,-427.00501253126436,2026-04-07 11:36:20.014014,2026-04-07 11:36:20.950202,0 days 00:00:00.936188,20.958699116972177,19.78850431207417,0.7699793357436904,Au,COMPLETE
4603,4.761904761904217,2026-04-07 11:36:20.122295,2026-04-07 11:36:20.686253,0 days 00:00:00.563958,29.122262768566472,16.641122271791367,0.3699443196900004,Au,PRUNED
4604,79.62962962962726,2026-04-07 11:36:20.147792,2026-04-07 11:36:20.919966,0 days 00:00:00.772174,32.78841360406447,17.13015168206739,0.49369187693525574,Au,PRUNED
4605,-1.0,2026-04-07 11:36:20.158599,2026-04-07 11:36:20.718281,0 days 00:00:00.559682,20.936920386187126,17.928542708995124,0.8153905387101836,Au,COMPLETE
4606,-1.0,2026-04-07 11:36:20.541024,2026-04-07 11:36:21.218491,0 days 00:00:00.677467,47.52094136312257,19.890988185402513,0.5229901738235371,Au,COMPLETE
4607,0.0,2026-04-07 11:36:20.637459,2026-04-07 11:36:21.426862,0 days 00:00:00.789403,27.218275218664665,19.87428658730669,0.5980463806581979,Au,PRUNED
4608,-1.0,2026-04-07 11:36:20.677496,2026-04-07 11:36:21.445345,0 days 00:00:00.767849,21.000720770024504,17.832203752650752,0.7021208399061909,Ag,COMPLETE
4609,-1.0,2026-04-07 11:36:20.812178,2026-04-07 11:36:21.539068,0 days 00:00:00.726890,32.28429817185052,17.626021147491883,0.5595787363961273,Au,COMPLETE
4610,-1.0,2026-04-07 11:36:20.896003,2026-04-07 11:36:21.515397,0 days 00:00:00.619394,20.378166244912013,19.990121957480003,0.21417363802101083,Au,COMPLETE
4611,-1.0,2026-04-07 11:36:21.060779,2026-04-07 11:36:21.893287,0 days 00:00:00.832508,33.80848412629771,17.950493574492477,0.3090521834297201,Au,COMPLETE
4612,-1.0,2026-04-07 11:36:21.119966,2026-04-07 11:36:21.825049,0 days 00:00:00.705083,32.078107582907904,16.680223052289563,0.32584487737147616,Au,COMPLETE
4613,0.0,2026-04-07 11:36:21.184417,2026-04-07 11:36:21.969199,0 days 00:00:00.784782,20.505377905440433,18.340612628517395,0.45443839993192925,Au,PRUNED
4614,-0.6802721088435263,2026-04-07 11:36:21.421239,2026-04-07 11:36:21.982315,0 days 00:00:00.561076,105.07576112348828,7.3814118977924394,1.8372673238659516,Au,PRUNED
4615,0.0,2026-04-07 11:36:21.542511,2026-04-07 11:36:22.465300,0 days 00:00:00.922789,42.31742012119241,15.792279587879978,0.7813637373517999,Au,PRUNED
4616,-1.0,2026-04-07 11:36:21.609692,2026-04-07 11:36:22.120383,0 days 00:00:00.510691,32.92654821157741,16.925323109276377,0.7321839243320929,Au,COMPLETE
