number,value,datetime_start,datetime_complete,duration,params_D2_nm,params_D3_nm,params_D4_nm,params_metal,state
3503,-1.0,2026-04-07 11:34:21.928595,2026-04-07 11:34:22.482906,0 days 00:00:00.554311,21.694583033924143,19.89674096262891,0.8888593552038568,Au,COMPLETE
3504,-1.0,2026-04-07 11:34:21.954736,2026-04-07 11:34:22.609441,0 days 00:00:00.654705,21.629871130878907,16.661785515691747,0.663487231602707,Au,COMPLETE
3505,0.0,2026-04-07 11:34:22.122663,2026-04-07 11:34:22.949908,0 days 00:00:00.827245,36.344858562194986,17.742438253418555,0.9504895444726208,Au,PRUNED
3506,-1.0,2026-04-07 11:34:22.236318,2026-04-07 11:34:22.918847,0 days 00:00:00.682529,30.810885145095895,19.98751107280541,0.9401221187153442,Au,COMPLETE
3507,0.0,2026-04-07 11:34:22.351008,2026-04-07 11:34:23.038939,0 days 00:00:00.687931,35.46329093618777,19.419930727871247,0.7606520087151506,Au,PRUNED
3508,0.0,2026-04-07 11:34:22.392174,2026-04-07 11:34:22.919872,0 days 00:00:00.527698,20.69624191151219,18.376667261194097,0.7874759028836745,Au,PRUNED
3509,-1.0,2026-04-07 11:34:22.615917,2026-04-07 11:34:23.151182,0 days 00:00:00.535265,42.136967034125234,13.670284090902594,0.8406196274529323,Au,COMPLETE
3510,-1.0,2026-04-07 11:34:22.608441,2026-04-07 11:34:23.373229,0 days 00:00:00.764788,20.9269713834588,19.929090950299003,0.8231590125378757,Au,COMPLETE
3511,-1.0,2026-04-07 11:34:22.718685,2026-04-07 11:34:23.343050,0 days 00:00:00.624365,29.9620515254679,19.83216047562919,0.6957057850011246,Au,COMPLETE
3512,-1.0,2026-04-07 11:34:22.794660,2026-04-07 11:34:23.248581,0 days 00:00:00.453921,35.51718367306544,19.791829487225037,0.7545928094059258,Au,COMPLETE
3513,0.0,2026-04-07 11:34:23.041947,2026-04-07 11:34:23.773184,0 days 00:00:00.731237,33.19841551812412,17.454101350467635,0.8501797191353573,Au,PRUNED
3514,-1.0,2026-04-07 11:34:23.101976,2026-04-07 11:34:23.485375,0 days 00:00:00.383399,22.259940870075855,19.823807820558255,0.5315953701372529,Au,COMPLETE
3515,-1.0,2026-04-07 11:34:23.117384,2026-04-07 11:34:23.651390,0 days 00:00:00.534006,33.99519656399034,17.316704010543997,0.8570811835714984,Au,COMPLETE
3516,-1.0,2026-04-07 11:34:23.126925,2026-04-07 11:34:23.729315,0 days 00:00:00.602390,20.617596505095225,17.89146788845576,0.625829561925007,Au,COMPLETE
3517,0.0,2026-04-07 11:34:23.307615,2026-04-07 11:34:23.980610,0 days 00:00:00.672995,30.70552905607246,18.077755627164283,0.917446421150755,Au,PRUNED
3518,-1.0,2026-04-07 11:34:23.378344,2026-04-07 11:34:24.089793,0 days 00:00:00.711449,31.16629396638129,19.883213112231196,0.9252126680727217,Au,COMPLETE
3519,-1.0,2026-04-07 11:34:23.482266,2026-04-07 11:34:23.952812,0 days 00:00:00.470546,33.828249163755814,19.974260438257147,1.056619238437493,Au,COMPLETE
3520,0.0,2026-04-07 11:34:23.519370,2026-04-07 11:34:24.166653,0 days 00:00:00.647283,20.57734966523083,17.232661489371207,0.8283171259525949,Au,PRUNED
3521,-1.0,2026-04-07 11:34:23.590591,2026-04-07 11:34:24.376302,0 days 00:00:00.785711,26.756445950844864,19.98421332328592,0.9993423896756779,Au,COMPLETE
3522,0.0,2026-04-07 11:34:23.824555,2026-04-07 11:34:24.486774,0 days 00:00:00.662219,32.69969916914465,17.670420643575284,0.9024849769158422,Au,PRUNED
3523,0.0,2026-04-07 11:34:23.878636,2026-04-07 11:34:24.545142,0 days 00:00:00.666506,20.157995815758774,19.30484340331034,0.6971885951678664,Au,PRUNED
3524,-9.9999999999984,2026-04-07 11:34:23.907065,2026-04-07 11:34:24.749401,0 days 00:00:00.842336,21.665840778246256,19.935267203237686,0.6681796518970456,Au,PRUNED
3525,-434.16030534344486,2026-04-07 11:34:24.050902,2026-04-07 11:34:24.834019,0 days 00:00:00.783117,20.589594034403305,19.953995047808295,1.03351592992964,Au,COMPLETE
3526,-1.0,2026-04-07 11:34:24.170006,2026-04-07 11:34:24.678600,0 days 00:00:00.508594,22.709461575973346,19.912681349806842,0.6819486388320924,Au,COMPLETE
3527,83.02696078431127,2026-04-07 11:34:24.250260,2026-04-07 11:34:24.857877,0 days 00:00:00.607617,24.63106438203026,19.993751541785503,0.5397771451428852,Au,PRUNED
3528,-8.01282051281928,2026-04-07 11:34:24.264949,2026-04-07 11:34:25.261165,0 days 00:00:00.996216,20.652720737345213,19.869120118446343,1.6393997806343323,Au,PRUNED
3529,-3.0864197530859623,2026-04-07 11:34:24.531201,2026-04-07 11:34:25.538595,0 days 00:00:01.007394,21.40343349132149,19.691935537312432,1.5493320892726106,Au,PRUNED
3530,-1.0,2026-04-07 11:34:24.543034,2026-04-07 11:34:25.308743,0 days 00:00:00.765709,20.649284154811074,17.08119746681322,1.3750101448823477,Au,COMPLETE
3531,-1.0,2026-04-07 11:34:24.682537,2026-04-07 11:34:25.349875,0 days 00:00:00.667338,34.339470530879886,19.917352306404425,1.3193499196246194,Au,COMPLETE
3532,-401.59574468079353,2026-04-07 11:34:24.876111,2026-04-07 11:34:25.446574,0 days 00:00:00.570463,20.028905529598372,19.900840528317904,1.1321945698281328,Au,COMPLETE
3533,0.0,2026-04-07 11:34:24.891093,2026-04-07 11:34:25.537594,0 days 00:00:00.646501,33.02169867026195,19.975667761935675,1.0726513771101096,Au,PRUNED
3534,-327.94117647054986,2026-04-07 11:34:24.925998,2026-04-07 11:34:25.655147,0 days 00:00:00.729149,20.209174185113675,18.296471795980107,1.5712217745050838,Au,COMPLETE
3535,-1.0,2026-04-07 11:34:24.996051,2026-04-07 11:34:25.420162,0 days 00:00:00.424111,20.50364667556385,19.485446913549133,1.5977606837378775,Au,COMPLETE
3536,0.0,2026-04-07 11:34:25.371622,2026-04-07 11:34:26.062213,0 days 00:00:00.690591,27.26210876216174,19.952927151185186,1.2078539968172703,Au,PRUNED
3537,-401.59574468079353,2026-04-07 11:34:25.504038,2026-04-07 11:34:26.418712,0 days 00:00:00.914674,20.21043706851266,19.820189878047668,1.078858192030555,Au,COMPLETE
3538,-1.0,2026-04-07 11:34:25.586272,2026-04-07 11:34:26.073610,0 days 00:00:00.487338,48.00771798219384,17.741183115572166,1.0662553051599106,Au,COMPLETE
3539,-1.0,2026-04-07 11:34:25.625111,2026-04-07 11:34:26.128061,0 days 00:00:00.502950,37.02467587306103,17.75752823927587,1.0722715553112048,Au,COMPLETE
3540,-1.0,2026-04-07 11:34:25.652455,2026-04-07 11:34:26.216750,0 days 00:00:00.564295,34.38695269354921,17.320766977947592,1.0133243418035913,Au,COMPLETE
3541,-1.0,2026-04-07 11:34:25.696954,2026-04-07 11:34:26.203693,0 days 00:00:00.506739,32.24052290091191,17.327329825252203,1.3812330518644438,Au,COMPLETE
3542,0.0,2026-04-07 11:34:25.760267,2026-04-07 11:34:26.710691,0 days 00:00:00.950424,50.04794138128193,19.803102013190554,1.2902314900397132,Au,PRUNED
3543,-1.0,2026-04-07 11:34:25.955776,2026-04-07 11:34:26.496385,0 days 00:00:00.540609,20.15745238492391,17.768901198343247,0.6575911296378915,Au,COMPLETE
3544,-1.0,2026-04-07 11:34:26.198846,2026-04-07 11:34:26.710186,0 days 00:00:00.511340,20.164096541990798,19.73631159560443,0.9467543660158345,Au,COMPLETE
3545,0.0,2026-04-07 11:34:26.258640,2026-04-07 11:34:27.010328,0 days 00:00:00.751688,35.31151363085182,19.86547891953222,1.275917195642652,Au,PRUNED
3546,0.0,2026-04-07 11:34:26.330011,2026-04-07 11:34:26.925702,0 days 00:00:00.595691,33.08593251362498,18.235290560636454,1.5128153394261643,Au,PRUNED
3547,-1.0,2026-04-07 11:34:26.418712,2026-04-07 11:34:27.054738,0 days 00:00:00.636026,20.664325977788227,19.806361856410184,1.2082654519375309,Au,COMPLETE
3548,-1.0,2026-04-07 11:34:26.597768,2026-04-07 11:34:27.185252,0 days 00:00:00.587484,31.40551178738989,17.039723402866816,1.0956117400756582,Au,COMPLETE
3549,-1.0,2026-04-07 11:34:26.618457,2026-04-07 11:34:27.139898,0 days 00:00:00.521441,33.93279312936465,18.09905476131395,1.0569238762011515,Au,COMPLETE
3550,-1.0,2026-04-07 11:34:26.703785,2026-04-07 11:34:27.248987,0 days 00:00:00.545202,33.63180456923355,19.82642889085524,1.33236261945564,Au,COMPLETE
3551,80.24691358024454,2026-04-07 11:34:26.844870,2026-04-07 11:34:27.569758,0 days 00:00:00.724888,31.599241967761447,16.312751499758907,1.1214702808619035,Au,PRUNED
3552,-8.333333333332,2026-04-07 11:34:26.965230,2026-04-07 11:34:27.772449,0 days 00:00:00.807219,21.762992746025372,19.954469136446644,0.6305523327424534,Au,PRUNED
3553,-3.0864197530859623,2026-04-07 11:34:27.126633,2026-04-07 11:34:28.023695,0 days 00:00:00.897062,21.961264726931454,19.945163647089323,0.9582280215471125,Au,PRUNED
3554,-1.0,2026-04-07 11:34:27.183749,2026-04-07 11:34:27.865465,0 days 00:00:00.681716,20.129002961659808,18.94996216361665,0.9546920570058075,Au,COMPLETE
3555,-3.0864197530859623,2026-04-07 11:34:27.244937,2026-04-07 11:34:28.054867,0 days 00:00:00.809930,21.657464987319926,19.91396624410247,1.2568434378379347,Au,PRUNED
3556,0.0,2026-04-07 11:34:27.260949,2026-04-07 11:34:27.945901,0 days 00:00:00.684952,20.87499599248409,17.16459809236498,0.9821848958341319,Au,PRUNED
3557,-1.0,2026-04-07 11:34:27.298725,2026-04-07 11:34:27.834019,0 days 00:00:00.535294,33.2336522255369,17.029553881782178,1.090672774829702,Au,COMPLETE
3558,-1.0,2026-04-07 11:34:27.587137,2026-04-07 11:34:28.086298,0 days 00:00:00.499161,27.817262389963794,17.897590843661433,0.9473953168891447,Ag,COMPLETE
3559,-1.0,2026-04-07 11:34:27.635169,2026-04-07 11:34:28.148147,0 days 00:00:00.512978,85.92323421727531,1.8218212335412876,0.9348252480831679,Cu,COMPLETE
3560,-140.3508771929726,2026-04-07 11:34:27.874047,2026-04-07 11:34:28.653616,0 days 00:00:00.779569,23.457563910854983,17.909280494413096,0.7601729526992734,Ag,PRUNED
3561,-1.0,2026-04-07 11:34:27.941765,2026-04-07 11:34:28.552146,0 days 00:00:00.610381,64.35612251143978,12.60335171134793,0.225975078278143,Cu,COMPLETE
3562,-1.0,2026-04-07 11:34:28.125799,2026-04-07 11:34:28.604314,0 days 00:00:00.478515,21.06734874662032,19.941440403159717,0.954409489891799,Au,COMPLETE
3563,80.86419753086179,2026-04-07 11:34:28.168453,2026-04-07 11:34:28.937060,0 days 00:00:00.768607,28.916414378582417,17.2597543432099,1.5240279233821012,Au,PRUNED
3564,-0.83668005354751,2026-04-07 11:34:28.212069,2026-04-07 11:34:29.003458,0 days 00:00:00.791389,69.17459424015081,15.703832551715179,0.6729908798668718,Cu,PRUNED
3565,-1.0,2026-04-07 11:34:28.266918,2026-04-07 11:34:28.801899,0 days 00:00:00.534981,21.101629898013847,9.522828297418403,0.4338855692910496,Cu,COMPLETE
3566,0.0,2026-04-07 11:34:28.291173,2026-04-07 11:34:28.972569,0 days 00:00:00.681396,35.11007241399735,16.940436477638947,1.5624020891761363,Au,PRUNED
3567,-1.0,2026-04-07 11:34:28.368196,2026-04-07 11:34:28.788211,0 days 00:00:00.420015,83.14107544274584,7.205210334134004,0.9847932821123213,Ag,COMPLETE
3568,-1.0,2026-04-07 11:34:28.726563,2026-04-07 11:34:29.228796,0 days 00:00:00.502233,36.35955307525406,19.992357192440213,1.1647362914101205,Au,COMPLETE
3569,-1.0,2026-04-07 11:34:28.757240,2026-04-07 11:34:29.288870,0 days 00:00:00.531630,22.948717049754684,19.786957537130508,1.5563341825220685,Au,COMPLETE
3570,-1.0,2026-04-07 11:34:28.857924,2026-04-07 11:34:29.475255,0 days 00:00:00.617331,33.249035176379905,14.333491063978684,0.7973954720158507,Au,COMPLETE
3571,-1.0,2026-04-07 11:34:29.026651,2026-04-07 11:34:29.446021,0 days 00:00:00.419370,20.040236493705496,16.900484722415513,1.4101432477326712,Au,COMPLETE
3572,-318.09523809520164,2026-04-07 11:34:29.042696,2026-04-07 11:34:29.604670,0 days 00:00:00.561974,20.6667578690302,17.590273951070454,1.7628461307182608,Au,COMPLETE
3573,0.0,2026-04-07 11:34:29.053787,2026-04-07 11:34:29.628221,0 days 00:00:00.574434,33.63441445270225,19.803542123332683,1.6963277880650207,Au,PRUNED
3574,-1.0,2026-04-07 11:34:29.106164,2026-04-07 11:34:29.606732,0 days 00:00:00.500568,20.093522330637136,18.708962148667336,1.8850278327873524,Au,COMPLETE
3575,0.0,2026-04-07 11:34:29.117861,2026-04-07 11:34:29.854906,0 days 00:00:00.737045,20.494061989363022,16.407960118370877,0.8759200537313057,Au,PRUNED
3576,-1.0,2026-04-07 11:34:29.415122,2026-04-07 11:34:29.956004,0 days 00:00:00.540882,53.900514888201045,10.17425600194383,1.417199317522641,Ag,COMPLETE
3577,-1.0,2026-04-07 11:34:29.551215,2026-04-07 11:34:30.094719,0 days 00:00:00.543504,22.05607807508759,19.78272811635735,1.4381948490612804,Au,COMPLETE
3578,-1.0,2026-04-07 11:34:29.620081,2026-04-07 11:34:30.390673,0 days 00:00:00.770592,20.01670743049323,17.788031290605208,0.8478383781802634,Au,COMPLETE
3579,82.10784313725247,2026-04-07 11:34:29.726196,2026-04-07 11:34:30.372148,0 days 00:00:00.645952,27.731113248334243,17.175400736243983,1.0453008321151,Au,PRUNED
3580,0.0,2026-04-07 11:34:29.756033,2026-04-07 11:34:30.348464,0 days 00:00:00.592431,33.18959172108039,19.955721223378333,0.7264812671091596,Au,PRUNED
3581,0.0,2026-04-07 11:34:29.858256,2026-04-07 11:34:30.530019,0 days 00:00:00.671763,34.14416526253498,19.808863746791978,1.290222746914559,Au,PRUNED
3582,-1.0,2026-04-07 11:34:29.902815,2026-04-07 11:34:30.423994,0 days 00:00:00.521179,34.03464505024587,19.74815577900917,1.1043096211339314,Au,COMPLETE
3583,-1.0,2026-04-07 11:34:29.926107,2026-04-07 11:34:30.580542,0 days 00:00:00.654435,34.66240326221951,14.434703380635128,1.0339288534215436,Au,COMPLETE
3584,-6.410256410255424,2026-04-07 11:34:30.126914,2026-04-07 11:34:30.808809,0 days 00:00:00.681895,20.87976095783574,19.984460153885895,1.5214005264224273,Au,PRUNED
3585,-1.0,2026-04-07 11:34:30.199291,2026-04-07 11:34:30.780700,0 days 00:00:00.581409,29.083368546843726,14.161703996104109,1.0552739375303473,Au,COMPLETE
3586,-1.0,2026-04-07 11:34:30.477634,2026-04-07 11:34:30.888057,0 days 00:00:00.410423,35.32388945327206,17.44452998257338,1.0005479411994485,Au,COMPLETE
3587,0.0,2026-04-07 11:34:30.489152,2026-04-07 11:34:31.127971,0 days 00:00:00.638819,34.81620261387154,19.820733284186527,0.8791740141704573,Au,PRUNED
3588,-386.7009132419558,2026-04-07 11:34:30.619285,2026-04-07 11:34:31.548440,0 days 00:00:00.929155,20.539603762300185,19.510984155697052,0.9244306731724288,Au,COMPLETE
3589,0.0,2026-04-07 11:34:30.560047,2026-04-07 11:34:31.287034,0 days 00:00:00.726987,20.013854805008652,14.972961903469713,0.8349068875752685,Au,PRUNED
3590,0.0,2026-04-07 11:34:30.677551,2026-04-07 11:34:31.441387,0 days 00:00:00.763836,33.87455822883368,19.742186468962867,0.8666823499771026,Au,PRUNED
3591,0.0,2026-04-07 11:34:30.731208,2026-04-07 11:34:31.486169,0 days 00:00:00.754961,20.018502408550823,17.121680234201268,1.0861442619110333,Au,PRUNED
3592,0.0,2026-04-07 11:34:30.891279,2026-04-07 11:34:31.688124,0 days 00:00:00.796845,20.3843695333311,17.770711705488345,1.1558520918982664,Au,PRUNED
3593,-1.0,2026-04-07 11:34:31.011509,2026-04-07 11:34:31.592163,0 days 00:00:00.580654,31.884554285308177,17.32237452140018,1.543023532204261,Au,COMPLETE
3594,0.0,2026-04-07 11:34:31.031242,2026-04-07 11:34:31.927799,0 days 00:00:00.896557,21.217259042372394,16.526513696774284,1.3078006772244848,Au,PRUNED
3595,-1.0,2026-04-07 11:34:31.211619,2026-04-07 11:34:31.757049,0 days 00:00:00.545430,22.061806375373646,19.93013930822204,1.1597853859526,Au,COMPLETE
3596,-2.614379084967279,2026-04-07 11:34:31.389472,2026-04-07 11:34:32.002112,0 days 00:00:00.612640,98.91079795228049,13.511596905542223,0.8512121427569599,Ag,PRUNED
3597,0.0,2026-04-07 11:34:31.641677,2026-04-07 11:34:32.469175,0 days 00:00:00.827498,32.61183686606774,19.995887205394062,1.000066590934691,Au,PRUNED
3598,-1.0,2026-04-07 11:34:31.672464,2026-04-07 11:34:32.433711,0 days 00:00:00.761247,20.042818709672794,19.82826021498777,1.4158222340364544,Au,COMPLETE
3599,-1.0,2026-04-07 11:34:31.792211,2026-04-07 11:34:32.345728,0 days 00:00:00.553517,21.299746784276902,19.94941696477292,0.8177756503585164,Au,COMPLETE
3600,0.0,2026-04-07 11:34:31.759567,2026-04-07 11:34:32.470328,0 days 00:00:00.710761,34.02277932460042,19.92242858222762,0.9118156056770969,Au,PRUNED
3601,0.0,2026-04-07 11:34:31.904396,2026-04-07 11:34:32.719171,0 days 00:00:00.814775,20.404693687714865,17.341899730735975,0.8405478926129694,Au,PRUNED
3602,83.33333333333088,2026-04-07 11:34:31.980092,2026-04-07 11:34:32.715916,0 days 00:00:00.735824,23.32689788657844,19.95332351017397,0.8096925762970956,Au,PRUNED
3603,-1.9011406844106176,2026-04-07 11:34:32.069341,2026-04-07 11:34:32.780901,0 days 00:00:00.711560,73.37991692419577,9.892065107466026,0.8032450535860137,Cu,PRUNED
3604,80.24691358024454,2026-04-07 11:34:32.117871,2026-04-07 11:34:32.822999,0 days 00:00:00.705128,29.92219517229634,17.57308091403128,1.187271271260275,Au,PRUNED
3605,0.0,2026-04-07 11:34:32.550387,2026-04-07 11:34:33.334537,0 days 00:00:00.784150,33.360158041933424,19.982257331439058,1.4533474731616063,Au,PRUNED
3606,-1.0,2026-04-07 11:34:32.605037,2026-04-07 11:34:33.284758,0 days 00:00:00.679721,35.80224841453338,17.288365645041463,0.5547419282003473,Au,COMPLETE
3607,0.0,2026-04-07 11:34:32.641687,2026-04-07 11:34:33.569739,0 days 00:00:00.928052,20.184634563254605,16.81506371614035,0.9900090674019865,Au,PRUNED
3608,-1.0,2026-04-07 11:34:32.740853,2026-04-07 11:34:33.361128,0 days 00:00:00.620275,20.132201634379005,18.675243300465592,0.969746364479656,Au,COMPLETE
3609,-1.0,2026-04-07 11:34:32.879907,2026-04-07 11:34:33.333033,0 days 00:00:00.453126,34.447983663704306,17.046570628071212,1.3564691308157741,Au,COMPLETE
3610,80.86419753086179,2026-04-07 11:34:32.893033,2026-04-07 11:34:33.496620,0 days 00:00:00.603587,29.90525573576579,17.054386226318183,1.1037730708078972,Au,PRUNED
3611,-1.0,2026-04-07 11:34:32.929238,2026-04-07 11:34:33.362134,0 days 00:00:00.432896,20.460806746087762,19.962673697854967,1.209068952805057,Au,COMPLETE
3612,-1.0,2026-04-07 11:34:32.974005,2026-04-07 11:34:33.363692,0 days 00:00:00.389687,37.74301440763819,19.95732879669188,0.718733114241765,Au,COMPLETE
3613,0.0,2026-04-07 11:34:33.494998,2026-04-07 11:34:34.356266,0 days 00:00:00.861268,47.28407580708212,17.36416136022607,1.5241877383916882,Au,PRUNED
3614,-1.0,2026-04-07 11:34:33.554202,2026-04-07 11:34:34.038435,0 days 00:00:00.484233,52.8841083214366,19.915850973299186,0.987072794542838,Au,COMPLETE
3615,-1.0,2026-04-07 11:34:33.571739,2026-04-07 11:34:34.147370,0 days 00:00:00.575631,30.497804354254484,16.974570999185698,1.0963122605528233,Au,COMPLETE
3616,0.0,2026-04-07 11:34:33.602681,2026-04-07 11:34:34.258011,0 days 00:00:00.655330,31.923918772751595,16.912799702164286,1.3928215207651125,Au,PRUNED
3617,0.0,2026-04-07 11:34:33.648421,2026-04-07 11:34:34.259007,0 days 00:00:00.610586,44.49890225100752,19.720620010442364,1.6720180634847945,Au,PRUNED
3618,-1.0,2026-04-07 11:34:33.662424,2026-04-07 11:34:34.124381,0 days 00:00:00.461957,52.335155731855274,19.792416139485773,1.0267440062049509,Au,COMPLETE
3619,-0.8928571428571173,2026-04-07 11:34:33.733547,2026-04-07 11:34:34.302969,0 days 00:00:00.569422,22.40981632362403,16.881872361433402,1.0564092886290493,Ag,PRUNED
3620,79.62962962962726,2026-04-07 11:34:33.773219,2026-04-07 11:34:34.517436,0 days 00:00:00.744217,31.903584587642726,16.964785223540456,1.0395596787135122,Au,PRUNED
3621,-1.0,2026-04-07 11:34:34.215451,2026-04-07 11:34:34.824581,0 days 00:00:00.609130,31.3351856253214,19.966878579883222,0.8806662756184693,Au,COMPLETE
3622,-1.0,2026-04-07 11:34:34.324606,2026-04-07 11:34:34.991522,0 days 00:00:00.666916,45.85893214792872,17.721234269030948,0.6679041132797321,Au,COMPLETE
3623,-1.0,2026-04-07 11:34:34.356266,2026-04-07 11:34:34.975631,0 days 00:00:00.619365,20.607794482443076,17.730913823551678,1.2234971474655145,Au,COMPLETE
3624,-1.0,2026-04-07 11:34:34.415098,2026-04-07 11:34:34.990846,0 days 00:00:00.575748,21.111329526255904,17.21853069380944,1.302056197699973,Au,COMPLETE
3625,-9.615384615383135,2026-04-07 11:34:34.432519,2026-04-07 11:34:35.114870,0 days 00:00:00.682351,21.253321688434784,19.786599792149474,0.9860774626383438,Au,PRUNED
3626,-1.0,2026-04-07 11:34:34.452131,2026-04-07 11:34:34.992543,0 days 00:00:00.540412,20.481193390271464,19.47520357116705,1.017405118421638,Au,COMPLETE
3627,-1.0,2026-04-07 11:34:34.527245,2026-04-07 11:34:34.995131,0 days 00:00:00.467886,20.006604323672914,19.799905455036487,1.5067916930628351,Au,COMPLETE
3628,-323.40116279066007,2026-04-07 11:34:34.681668,2026-04-07 11:34:35.208128,0 days 00:00:00.526460,21.188153486041898,17.85125543162692,1.159404515552536,Au,COMPLETE
3629,-430.87121212114675,2026-04-07 11:34:34.925477,2026-04-07 11:34:35.757665,0 days 00:00:00.832188,20.635467904499276,19.852498834187795,1.0799244986499068,Au,COMPLETE
3630,-441.2144702841686,2026-04-07 11:34:34.992543,2026-04-07 11:34:35.880722,0 days 00:00:00.888179,21.4426969570626,19.845037417326836,0.540999951493541,Au,COMPLETE
3631,-1.0,2026-04-07 11:34:35.154244,2026-04-07 11:34:35.724736,0 days 00:00:00.570492,47.85734417665887,17.62014825266324,0.932922939896344,Au,COMPLETE
3632,-1.0,2026-04-07 11:34:35.244748,2026-04-07 11:34:35.695331,0 days 00:00:00.450583,46.24500586919574,8.732221418029498,0.14797987318529415,Cu,COMPLETE
3633,0.0,2026-04-07 11:34:35.280021,2026-04-07 11:34:35.990232,0 days 00:00:00.710211,31.90115131325352,17.11843356590603,1.1517157050927875,Au,PRUNED
3634,0.0,2026-04-07 11:34:35.289635,2026-04-07 11:34:35.953071,0 days 00:00:00.663436,38.969805295614975,19.965645686002954,0.9590922310753192,Au,PRUNED
3635,-1.0,2026-04-07 11:34:35.343100,2026-04-07 11:34:35.722638,0 days 00:00:00.379538,36.357816743467424,17.91545170488866,0.7056379714101214,Au,COMPLETE
3636,0.0,2026-04-07 11:34:35.468550,2026-04-07 11:34:36.442813,0 days 00:00:00.974263,35.53697941205904,18.027614916352462,1.6812662946947126,Au,PRUNED
3637,-1.0,2026-04-07 11:34:35.721134,2026-04-07 11:34:36.240970,0 days 00:00:00.519836,20.090902817984944,16.208660843370602,0.6479899222712705,Au,COMPLETE
3638,0.0,2026-04-07 11:34:35.997885,2026-04-07 11:34:36.772662,0 days 00:00:00.774777,38.308832469424374,16.861607585033934,0.5149847895716432,Au,PRUNED
3639,-1.0,2026-04-07 11:34:35.988198,2026-04-07 11:34:36.820605,0 days 00:00:00.832407,40.074290069525745,19.94372172291975,0.7327927234746713,Au,COMPLETE
3640,-1.0,2026-04-07 11:34:35.956066,2026-04-07 11:34:36.544786,0 days 00:00:00.588720,31.5727166967481,19.99989675700121,0.4882754813836995,Cu,COMPLETE
3641,-13.44086021505203,2026-04-07 11:34:36.037436,2026-04-07 11:34:36.721074,0 days 00:00:00.683638,23.516796186193904,17.496260571629918,0.6151639510865455,Au,PRUNED
