number,value,datetime_start,datetime_complete,duration,params_D2_nm,params_D3_nm,params_D4_nm,params_metal,state
5314,-19.791666666664685,2026-04-07 11:37:40.872824,2026-04-07 11:37:41.822309,0 days 00:00:00.949485,41.27395448572538,17.393040897029433,0.6916496489768771,Ag,PRUNED
5315,0.0,2026-04-07 11:37:40.993337,2026-04-07 11:37:42.246139,0 days 00:00:01.252802,43.37759957237492,15.482949006142016,0.8706703514071534,Au,PRUNED
5316,-1.0,2026-04-07 11:37:41.100360,2026-04-07 11:37:41.886387,0 days 00:00:00.786027,42.46197497580344,15.181630953318857,0.8329314089452062,Au,COMPLETE
5317,-1.0,2026-04-07 11:37:41.322471,2026-04-07 11:37:41.978376,0 days 00:00:00.655905,20.141164140769632,19.55718917498639,0.8790911044977014,Au,COMPLETE
5318,0.0,2026-04-07 11:37:41.357762,2026-04-07 11:37:42.133754,0 days 00:00:00.775992,34.264721734955586,19.98029580527739,0.360392731209192,Au,PRUNED
5319,0.0,2026-04-07 11:37:41.528697,2026-04-07 11:37:42.214839,0 days 00:00:00.686142,32.36241313571426,17.11493300439389,1.0013873068657035,Au,PRUNED
5320,-1.0,2026-04-07 11:37:41.705228,2026-04-07 11:37:42.545190,0 days 00:00:00.839962,31.972231906514814,17.990951191736475,1.0227227707578217,Au,COMPLETE
5321,-0.5827505827505663,2026-04-07 11:37:41.770077,2026-04-07 11:37:42.500035,0 days 00:00:00.729958,50.085716450113196,14.637952196431389,0.9633362871999784,Au,PRUNED
5322,-404.46428571422797,2026-04-07 11:37:41.951941,2026-04-07 11:37:43.012631,0 days 00:00:01.060690,20.418150569406414,19.741458940472835,1.0113014067466195,Au,COMPLETE
5323,-1.0,2026-04-07 11:37:42.101763,2026-04-07 11:37:42.979849,0 days 00:00:00.878086,20.81472440426078,19.720551100054955,0.8993440252362217,Au,COMPLETE
5324,-1.0,2026-04-07 11:37:42.224630,2026-04-07 11:37:42.921937,0 days 00:00:00.697307,46.849321970700345,19.99198451723678,1.0864563403393683,Au,COMPLETE
5325,-1.0,2026-04-07 11:37:42.308317,2026-04-07 11:37:42.950075,0 days 00:00:00.641758,20.330110070963705,14.575378126907822,0.14456813541775776,Au,COMPLETE
5326,0.0,2026-04-07 11:37:42.315962,2026-04-07 11:37:43.056686,0 days 00:00:00.740724,34.09021381326247,17.04369502862751,0.4871685666497185,Au,PRUNED
5327,-1.0,2026-04-07 11:37:42.406163,2026-04-07 11:37:43.045129,0 days 00:00:00.638966,20.933948637381974,19.744450876359483,0.8026314210810885,Au,COMPLETE
5328,-1.0,2026-04-07 11:37:42.604273,2026-04-07 11:37:42.989714,0 days 00:00:00.385441,21.205244260744806,17.758921013978288,0.8146816595904334,Au,COMPLETE
5329,0.0,2026-04-07 11:37:42.714558,2026-04-07 11:37:43.235040,0 days 00:00:00.520482,33.87202520194349,19.84825704363697,1.1098368277517765,Au,PRUNED
5330,-1.0,2026-04-07 11:37:43.010043,2026-04-07 11:37:43.618873,0 days 00:00:00.608830,36.78569572147402,17.80599634790553,0.7915845653603064,Cu,COMPLETE
5331,0.0,2026-04-07 11:37:43.156067,2026-04-07 11:37:43.842589,0 days 00:00:00.686522,29.639667014338105,19.992067185169503,0.2612488652469459,Au,PRUNED
5332,80.24691358024454,2026-04-07 11:37:43.169679,2026-04-07 11:37:43.845058,0 days 00:00:00.675379,30.63862477025785,17.426201831065324,0.9055564023764289,Au,PRUNED
5333,0.0,2026-04-07 11:37:43.247319,2026-04-07 11:37:44.201295,0 days 00:00:00.953976,20.564511918762484,17.664304444856757,0.6983452578787246,Au,PRUNED
5334,-6.172839506171925,2026-04-07 11:37:43.317946,2026-04-07 11:37:43.888610,0 days 00:00:00.570664,22.16079022010045,19.88759355281907,0.7307928412013813,Au,PRUNED
5335,0.0,2026-04-07 11:37:43.342143,2026-04-07 11:37:43.937552,0 days 00:00:00.595409,34.96665062359027,19.88428166766586,0.37424063870705027,Au,PRUNED
5336,-1.0,2026-04-07 11:37:43.442704,2026-04-07 11:37:44.108390,0 days 00:00:00.665686,20.394356439442745,18.054531507766615,0.5745300660757154,Au,COMPLETE
5337,-401.30023640656185,2026-04-07 11:37:43.556706,2026-04-07 11:37:44.387227,0 days 00:00:00.830521,20.83849038491869,19.775405601959978,0.5610299009884406,Au,COMPLETE
5338,-427.00501253126436,2026-04-07 11:37:43.791578,2026-04-07 11:37:44.385631,0 days 00:00:00.594053,20.79194315625402,19.9330793576876,0.7526779349284283,Au,COMPLETE
5339,0.0,2026-04-07 11:37:43.937552,2026-04-07 11:37:44.755538,0 days 00:00:00.817986,20.813015714681423,17.640385421339072,0.8107153282194015,Au,PRUNED
5340,0.0,2026-04-07 11:37:43.999744,2026-04-07 11:37:44.811772,0 days 00:00:00.812028,20.265686537594945,17.833345565675337,0.46875140744606,Au,PRUNED
5341,-1.0,2026-04-07 11:37:44.020357,2026-04-07 11:37:44.873928,0 days 00:00:00.853571,33.42082850243513,17.37744144770603,0.15825285805718836,Au,COMPLETE
5342,-1.0,2026-04-07 11:37:44.036643,2026-04-07 11:37:44.622626,0 days 00:00:00.585983,32.47574102080226,17.77777604261553,0.6934510871153713,Au,COMPLETE
5343,0.0,2026-04-07 11:37:44.290336,2026-04-07 11:37:45.282878,0 days 00:00:00.992542,20.11853291704215,16.225406169755537,0.7474864162769241,Cu,PRUNED
5344,0.0,2026-04-07 11:37:44.363993,2026-04-07 11:37:45.010568,0 days 00:00:00.646575,105.9761675590864,9.356861145884007,1.1823675667491238,Cu,PRUNED
5345,80.26960784313488,2026-04-07 11:37:44.485305,2026-04-07 11:37:45.342847,0 days 00:00:00.857542,32.987111770956325,15.611947054202151,0.6221173948182525,Au,PRUNED
5346,-1.0,2026-04-07 11:37:44.705973,2026-04-07 11:37:45.529419,0 days 00:00:00.823446,35.37061704767148,17.314846931460657,0.48046982300411856,Au,COMPLETE
5347,-1.0,2026-04-07 11:37:44.778322,2026-04-07 11:37:45.604828,0 days 00:00:00.826506,32.82411256505661,17.759774493047768,0.5493197558262447,Au,COMPLETE
5348,-1.0,2026-04-07 11:37:44.852064,2026-04-07 11:37:45.577128,0 days 00:00:00.725064,20.640558871005275,19.85736559168788,0.5341884592124314,Au,COMPLETE
5349,-1.0,2026-04-07 11:37:44.957528,2026-04-07 11:37:45.576130,0 days 00:00:00.618602,34.91571441747712,2.1832868373976364,0.5232810536173005,Cu,COMPLETE
5350,-1.0,2026-04-07 11:37:45.014079,2026-04-07 11:37:45.731685,0 days 00:00:00.717606,30.11646706137431,17.335842661651398,1.0146266545315152,Au,COMPLETE
5351,0.0,2026-04-07 11:37:45.169363,2026-04-07 11:37:45.732697,0 days 00:00:00.563334,34.2663896520638,17.71221590303252,0.8254404989093616,Au,PRUNED
5352,-1.0,2026-04-07 11:37:45.407558,2026-04-07 11:37:45.867357,0 days 00:00:00.459799,33.72793927220922,19.888385967666277,0.3752913709138835,Au,COMPLETE
5353,-1.0,2026-04-07 11:37:45.441241,2026-04-07 11:37:46.204019,0 days 00:00:00.762778,31.230922755632868,17.664163478143692,1.0577775952701438,Au,COMPLETE
5354,-1.0,2026-04-07 11:37:45.582706,2026-04-07 11:37:46.230394,0 days 00:00:00.647688,20.268916442332014,19.626564998457763,0.5906271743631519,Ag,COMPLETE
5355,0.0,2026-04-07 11:37:45.758252,2026-04-07 11:37:46.559197,0 days 00:00:00.800945,29.56187895018659,19.981828466476426,0.6954403988864892,Au,PRUNED
5356,-1.0,2026-04-07 11:37:45.808975,2026-04-07 11:37:46.339100,0 days 00:00:00.530125,21.480323331810638,6.206084856643257,1.9351809822838502,Cu,COMPLETE
5357,0.0,2026-04-07 11:37:45.830395,2026-04-07 11:37:46.561382,0 days 00:00:00.730987,20.222312315553808,17.13580789615436,0.9505074307012343,Au,PRUNED
5358,0.0,2026-04-07 11:37:45.781532,2026-04-07 11:37:46.558198,0 days 00:00:00.776666,32.72407450192945,17.901940106823563,0.9868603772750657,Au,PRUNED
5359,-1.0,2026-04-07 11:37:45.911013,2026-04-07 11:37:46.472309,0 days 00:00:00.561296,30.4757352140521,17.0814950700383,0.6241913311775011,Au,COMPLETE
5360,-1.0,2026-04-07 11:37:46.090230,2026-04-07 11:37:46.713161,0 days 00:00:00.622931,114.50332489603389,14.116271465106465,1.1188116805632944,Au,COMPLETE
5361,-1.0,2026-04-07 11:37:46.335860,2026-04-07 11:37:47.091854,0 days 00:00:00.755994,33.75035847723045,17.827797761596077,0.1536749697828225,Au,COMPLETE
5362,79.93827160493589,2026-04-07 11:37:46.365211,2026-04-07 11:37:47.169958,0 days 00:00:00.804747,32.291603093582104,17.31081356916776,0.38733131445976654,Au,PRUNED
5363,0.0,2026-04-07 11:37:46.653569,2026-04-07 11:37:47.458129,0 days 00:00:00.804560,44.88566211556194,17.396828561864563,0.5647487610272652,Au,PRUNED
5364,0.0,2026-04-07 11:37:46.669053,2026-04-07 11:37:47.222611,0 days 00:00:00.553558,27.63658580241343,19.915489434704384,0.9288310860823484,Au,PRUNED
5365,-1.0,2026-04-07 11:37:46.689787,2026-04-07 11:37:47.357994,0 days 00:00:00.668207,32.82675745929201,17.247825341696956,0.43500719006891453,Au,COMPLETE
5366,0.0,2026-04-07 11:37:46.699701,2026-04-07 11:37:47.368763,0 days 00:00:00.669062,36.08960081722981,17.683131964338532,0.7923598521034569,Au,PRUNED
5367,-9.615384615383135,2026-04-07 11:37:46.742990,2026-04-07 11:37:47.664754,0 days 00:00:00.921764,21.410272265274987,19.803055478762875,0.9605075119862381,Au,PRUNED
5368,-1.0,2026-04-07 11:37:46.950246,2026-04-07 11:37:47.771220,0 days 00:00:00.820974,20.746086942733328,19.71687913321524,0.4536523331920089,Au,COMPLETE
5369,-1.0,2026-04-07 11:37:47.258627,2026-04-07 11:37:47.862064,0 days 00:00:00.603437,42.92024829915,19.903201498780355,0.8364988014954836,Cu,COMPLETE
5370,0.0,2026-04-07 11:37:47.309273,2026-04-07 11:37:48.074702,0 days 00:00:00.765429,30.858866239314153,19.991820418384197,1.0170025484143066,Au,PRUNED
5371,0.0,2026-04-07 11:37:47.277132,2026-04-07 11:37:48.152834,0 days 00:00:00.875702,35.925854568704736,19.94826457707286,0.864604888539495,Au,PRUNED
5372,0.0,2026-04-07 11:37:47.482685,2026-04-07 11:37:48.125817,0 days 00:00:00.643132,20.155554786257408,16.85388767830628,0.26617700975544195,Au,PRUNED
5373,-0.5952380952380781,2026-04-07 11:37:47.587988,2026-04-07 11:37:48.429667,0 days 00:00:00.841679,20.431564399619834,11.568781944805687,0.7136361241470779,Cu,PRUNED
5374,-1.0,2026-04-07 11:37:47.660600,2026-04-07 11:37:48.384956,0 days 00:00:00.724356,20.0216044042526,17.553194477106757,0.3433829898283386,Au,COMPLETE
5375,-1.0,2026-04-07 11:37:47.775105,2026-04-07 11:37:48.384956,0 days 00:00:00.609851,20.152497977184364,17.46647236407112,0.6607832474748665,Au,COMPLETE
5376,-1.0,2026-04-07 11:37:48.016837,2026-04-07 11:37:48.524629,0 days 00:00:00.507792,30.541369955913318,17.85285899275544,0.66203947807986,Au,COMPLETE
5377,-1.0,2026-04-07 11:37:48.100855,2026-04-07 11:37:48.758509,0 days 00:00:00.657654,29.223127490590883,17.642379017491564,0.6945792943099222,Au,COMPLETE
5378,-1.0,2026-04-07 11:37:48.127816,2026-04-07 11:37:48.838902,0 days 00:00:00.711086,81.22265396807758,1.9401485530018316,1.6390572981587495,Cu,COMPLETE
5379,-1.0,2026-04-07 11:37:48.234191,2026-04-07 11:37:48.890268,0 days 00:00:00.656077,37.53350993183693,19.724432950659136,0.6523989075410035,Au,COMPLETE
5380,0.0,2026-04-07 11:37:48.249666,2026-04-07 11:37:49.146677,0 days 00:00:00.897011,32.63444544849132,18.067083632405613,0.5653880191409385,Au,PRUNED
5381,0.0,2026-04-07 11:37:48.559357,2026-04-07 11:37:49.260203,0 days 00:00:00.700846,48.725571212703244,19.94679923941469,0.3171356060447981,Au,PRUNED
5382,0.0,2026-04-07 11:37:48.598648,2026-04-07 11:37:49.240900,0 days 00:00:00.642252,30.76891102774949,19.998907421494646,0.3782376968569194,Au,PRUNED
5383,-1.0,2026-04-07 11:37:48.642027,2026-04-07 11:37:49.289037,0 days 00:00:00.647010,21.778344867321202,19.986086526251317,0.2545526561989322,Au,COMPLETE
5384,-12.019230769229845,2026-04-07 11:37:48.663891,2026-04-07 11:37:49.446911,0 days 00:00:00.783020,64.11234375929169,7.4048692142049894,1.5200246921651928,Cu,PRUNED
5385,-1.0,2026-04-07 11:37:48.887020,2026-04-07 11:37:49.593795,0 days 00:00:00.706775,20.10551346935981,19.7846337852764,0.6382858044513914,Au,COMPLETE
5386,0.0,2026-04-07 11:37:49.171725,2026-04-07 11:37:50.145897,0 days 00:00:00.974172,20.705240933115142,14.509920552928232,0.9643216972983092,Au,PRUNED
5387,0.0,2026-04-07 11:37:49.209584,2026-04-07 11:37:50.148147,0 days 00:00:00.938563,32.418336503699365,19.825149963687608,0.7771734798491089,Au,PRUNED
5388,0.0,2026-04-07 11:37:49.318129,2026-04-07 11:37:50.070447,0 days 00:00:00.752318,39.82987722288286,17.71085171407506,0.5799738125050659,Au,PRUNED
5389,-1.0,2026-04-07 11:37:49.428601,2026-04-07 11:37:50.069437,0 days 00:00:00.640836,42.45149605705381,19.867553100817165,0.7842298857701868,Au,COMPLETE
5390,-1.0,2026-04-07 11:37:49.450813,2026-04-07 11:37:50.148147,0 days 00:00:00.697334,30.750464366215503,17.646865444516564,0.5442984412702134,Au,COMPLETE
5391,0.0,2026-04-07 11:37:49.575400,2026-04-07 11:37:50.147146,0 days 00:00:00.571746,20.044613132051175,15.027797796812516,0.7098480937448226,Au,PRUNED
5392,-1.0,2026-04-07 11:37:49.603307,2026-04-07 11:37:50.071951,0 days 00:00:00.468644,20.460368305473796,16.219437786027363,0.5250856290540823,Au,COMPLETE
5393,-1.0,2026-04-07 11:37:49.753004,2026-04-07 11:37:50.306632,0 days 00:00:00.553628,31.192866357169926,17.78924025030717,1.1104827686849958,Au,COMPLETE
5394,-1.0,2026-04-07 11:37:50.182091,2026-04-07 11:37:50.779006,0 days 00:00:00.596915,44.60952017969299,19.934857806441464,0.5489172724776454,Au,COMPLETE
5395,-1.0,2026-04-07 11:37:50.204065,2026-04-07 11:37:50.931342,0 days 00:00:00.727277,20.18767696408421,18.382284736969197,0.7255172199692994,Au,COMPLETE
5396,-1.0,2026-04-07 11:37:50.226995,2026-04-07 11:37:51.008382,0 days 00:00:00.781387,20.401799927086145,19.817635236420664,0.720537210338602,Au,COMPLETE
5397,80.86419753086179,2026-04-07 11:37:50.326349,2026-04-07 11:37:51.050661,0 days 00:00:00.724312,30.404092852422174,17.18052503562069,0.8904466914674022,Au,PRUNED
5398,-28.64583333332617,2026-04-07 11:37:50.335409,2026-04-07 11:37:50.897059,0 days 00:00:00.561650,75.9384220833099,5.0992338785922575,1.6145897920232744,Ag,PRUNED
5399,0.0,2026-04-07 11:37:50.353401,2026-04-07 11:37:51.134892,0 days 00:00:00.781491,36.03753055106039,19.960311483795632,0.6519767935284587,Au,PRUNED
5400,0.0,2026-04-07 11:37:50.556593,2026-04-07 11:37:51.093758,0 days 00:00:00.537165,20.562205082993472,19.693740042021705,0.1161544279090504,Au,PRUNED
5401,-1.0,2026-04-07 11:37:50.576488,2026-04-07 11:37:51.304994,0 days 00:00:00.728506,20.633440998606506,19.81417954507478,0.29341983221354717,Au,COMPLETE
5402,2.7777777777775925,2026-04-07 11:37:51.031439,2026-04-07 11:37:51.917659,0 days 00:00:00.886220,53.73274387244538,10.506426319325932,0.8241359425340411,Au,PRUNED
5403,0.0,2026-04-07 11:37:51.093758,2026-04-07 11:37:51.946726,0 days 00:00:00.852968,34.82507603101345,19.971207336726845,0.8755114401992173,Au,PRUNED
5404,-1.0,2026-04-07 11:37:51.079113,2026-04-07 11:37:51.795071,0 days 00:00:00.715958,35.12783303128412,19.94548329072231,0.8178092482881849,Au,COMPLETE
5405,-380.9121621621107,2026-04-07 11:37:51.216515,2026-04-07 11:37:52.087515,0 days 00:00:00.871000,20.291963244463883,19.72177523779013,0.8288170045667117,Au,COMPLETE
5406,-1.0,2026-04-07 11:37:51.229994,2026-04-07 11:37:51.993697,0 days 00:00:00.763703,20.16761975673518,19.728774872720425,0.5157730616915587,Au,COMPLETE
5407,0.0,2026-04-07 11:37:51.337468,2026-04-07 11:37:52.182245,0 days 00:00:00.844777,32.20157439202423,19.87160370482456,1.0456200408296183,Au,PRUNED
5408,-1.0,2026-04-07 11:37:51.403110,2026-04-07 11:37:52.031603,0 days 00:00:00.628493,20.50183893151679,19.365749127230607,0.8696184658615145,Au,COMPLETE
5409,-1.0,2026-04-07 11:37:51.585653,2026-04-07 11:37:52.071510,0 days 00:00:00.485857,32.314928510784334,16.342842680450005,0.4402901361776312,Ag,COMPLETE
5410,76.64233576642111,2026-04-07 11:37:51.920695,2026-04-07 11:37:52.809153,0 days 00:00:00.888458,38.88132778466375,15.088049980615285,0.7823170427994366,Au,PRUNED
5411,-1.0,2026-04-07 11:37:52.122775,2026-04-07 11:37:52.703909,0 days 00:00:00.581134,36.62330171595211,19.913958367120795,0.5999296964654638,Au,COMPLETE
5412,0.0,2026-04-07 11:37:52.137865,2026-04-07 11:37:52.810165,0 days 00:00:00.672300,20.301086597943783,17.91337221795027,0.4298493956376756,Au,PRUNED
5413,-1.0,2026-04-07 11:37:52.243831,2026-04-07 11:37:52.919786,0 days 00:00:00.675955,20.24473806834786,17.42310150838845,0.4353511291907609,Au,COMPLETE
5414,-1.0,2026-04-07 11:37:52.264450,2026-04-07 11:37:52.966101,0 days 00:00:00.701651,20.331480974798136,19.861488945922268,0.6726718060501709,Au,COMPLETE
5415,-1.0,2026-04-07 11:37:52.360416,2026-04-07 11:37:52.963537,0 days 00:00:00.603121,20.418082930598416,19.637468036789667,0.7339001371417154,Au,COMPLETE
5416,-1.0,2026-04-07 11:37:52.370075,2026-04-07 11:37:53.025872,0 days 00:00:00.655797,74.72554097968894,19.632446381985424,1.8686059059277644,Au,COMPLETE
5417,-1.0,2026-04-07 11:37:52.392619,2026-04-07 11:37:53.168867,0 days 00:00:00.776248,34.39458078322107,19.84330750123059,0.8511756880527467,Au,COMPLETE
5418,76.08695652173692,2026-04-07 11:37:52.812627,2026-04-07 11:37:53.621763,0 days 00:00:00.809136,35.8254961510369,19.66870370550163,0.20721246212845532,Cu,PRUNED
5419,0.0,2026-04-07 11:37:52.925139,2026-04-07 11:37:53.670936,0 days 00:00:00.745797,33.66664158965538,17.325259676555717,0.8195833097878636,Au,PRUNED
5420,-1.0,2026-04-07 11:37:53.006444,2026-04-07 11:37:53.672488,0 days 00:00:00.666044,29.25087239725004,19.90940876876431,0.5568925369056918,Au,COMPLETE
5421,-1.0,2026-04-07 11:37:53.206449,2026-04-07 11:37:53.769155,0 days 00:00:00.562706,29.778907329680422,14.742757292626578,1.0519065047329395,Au,COMPLETE
5422,3.571428571428163,2026-04-07 11:37:53.239021,2026-04-07 11:37:54.048050,0 days 00:00:00.809029,32.4710841644389,14.567778483785457,0.5511590902856597,Au,PRUNED
5423,-1.0,2026-04-07 11:37:53.218397,2026-04-07 11:37:53.842253,0 days 00:00:00.623856,31.765544440773233,19.905968964357108,0.9341496645862495,Au,COMPLETE
5424,0.0,2026-04-07 11:37:53.284209,2026-04-07 11:37:54.141483,0 days 00:00:00.857274,20.170827320657967,17.64097024877109,1.1007454700257517,Au,PRUNED
5425,-1.0,2026-04-07 11:37:53.408127,2026-04-07 11:37:54.179583,0 days 00:00:00.771456,32.11916646807177,19.98699717618825,0.7864046594870447,Au,COMPLETE
5426,4.084967320261118,2026-04-07 11:37:53.772667,2026-04-07 11:37:54.743796,0 days 00:00:00.971129,31.838050879700624,15.342058767578841,0.8113815811363824,Au,PRUNED
5427,-9.615384615383135,2026-04-07 11:37:53.872894,2026-04-07 11:37:54.787623,0 days 00:00:00.914729,21.54432133677637,19.848862861042527,0.8327429661431298,Au,PRUNED
5428,-401.30023640656185,2026-04-07 11:37:54.065608,2026-04-07 11:37:54.932019,0 days 00:00:00.866411,20.648564358570994,19.823355260728153,0.6776355198355302,Au,COMPLETE
5429,0.0,2026-04-07 11:37:54.087166,2026-04-07 11:37:55.033027,0 days 00:00:00.945861,35.730511506884774,19.955767239726384,0.9837880654708611,Au,PRUNED
5430,-1.0,2026-04-07 11:37:54.125081,2026-04-07 11:37:54.859058,0 days 00:00:00.733977,45.3720172005348,0.9605411827502071,1.1493876259025602,Au,COMPLETE
5431,-1.0,2026-04-07 11:37:54.142484,2026-04-07 11:37:54.932019,0 days 00:00:00.789535,38.08447746638892,19.928816058025266,0.632149260953916,Au,COMPLETE
5432,3.3333333333330666,2026-04-07 11:37:54.188513,2026-04-07 11:37:55.109626,0 days 00:00:00.921113,34.055710338467016,14.621039094868113,0.33975159620468565,Au,PRUNED
5433,-1.0,2026-04-07 11:37:54.430925,2026-04-07 11:37:55.279009,0 days 00:00:00.848084,21.230341446329238,19.917692291588295,0.2715639384925639,Au,COMPLETE
5434,-1.0,2026-04-07 11:37:54.791676,2026-04-07 11:37:55.639204,0 days 00:00:00.847528,21.0573317242634,17.414378762757913,0.42981009197444553,Au,COMPLETE
5435,-1.0,2026-04-07 11:37:54.888900,2026-04-07 11:37:55.636684,0 days 00:00:00.747784,32.95480478266462,17.687939637727432,0.9099908699231716,Au,COMPLETE
5436,-1.0,2026-04-07 11:37:55.098905,2026-04-07 11:37:55.839088,0 days 00:00:00.740183,36.89819805432759,17.179593572975524,0.11907817857987246,Au,COMPLETE
5437,-1.0,2026-04-07 11:37:55.196513,2026-04-07 11:37:55.811258,0 days 00:00:00.614745,31.154254776937496,17.31545380735554,0.5605428064240718,Au,COMPLETE
5438,-1.0,2026-04-07 11:37:55.219331,2026-04-07 11:37:55.812264,0 days 00:00:00.592933,36.261122485508615,17.164719091743898,0.25306887695724156,Au,COMPLETE
5439,0.0,2026-04-07 11:37:55.245905,2026-04-07 11:37:55.924048,0 days 00:00:00.678143,30.707983425038016,19.997857589280915,0.770092579058152,Au,PRUNED
5440,0.0,2026-04-07 11:37:55.421185,2026-04-07 11:37:55.922541,0 days 00:00:00.501356,34.608179237317714,19.865988091539734,1.1100326168243544,Au,PRUNED
5441,-1.0,2026-04-07 11:37:55.527612,2026-04-07 11:37:56.154387,0 days 00:00:00.626775,31.297856714304096,19.943600440310206,0.4198881191396497,Au,COMPLETE
5442,78.7377450980369,2026-04-07 11:37:55.773636,2026-04-07 11:37:56.761172,0 days 00:00:00.987536,35.51266292601417,15.149126773053943,0.8977397213224623,Au,PRUNED
5443,-1.0,2026-04-07 11:37:55.948648,2026-04-07 11:37:56.667404,0 days 00:00:00.718756,29.940167978545006,17.337317473941994,0.7573372349323813,Au,COMPLETE
5444,-1.0,2026-04-07 11:37:55.982250,2026-04-07 11:37:56.574365,0 days 00:00:00.592115,99.95372321700833,15.96385768550804,0.5682887097514401,Au,COMPLETE
5445,3.571428571428163,2026-04-07 11:37:56.016776,2026-04-07 11:37:56.747880,0 days 00:00:00.731104,30.26560039952563,15.512195987661562,0.6064606436503941,Au,PRUNED
5446,0.0,2026-04-07 11:37:56.029511,2026-04-07 11:37:56.748878,0 days 00:00:00.719367,32.33524275156887,19.868133236686965,0.9353363815995801,Au,PRUNED
5447,-1.0,2026-04-07 11:37:56.045701,2026-04-07 11:37:56.697888,0 days 00:00:00.652187,20.41204630307244,19.955885570208427,0.22775740276234835,Au,COMPLETE
5448,-1.0,2026-04-07 11:37:56.098155,2026-04-07 11:37:56.500995,0 days 00:00:00.402840,34.38213556193395,17.833574531038714,0.640746339358968,Au,COMPLETE
5449,0.0,2026-04-07 11:37:56.417787,2026-04-07 11:37:56.934052,0 days 00:00:00.516265,33.573109376206226,19.971830831673564,0.7389840752008245,Au,PRUNED
5450,-1.0,2026-04-07 11:37:56.698463,2026-04-07 11:37:57.332586,0 days 00:00:00.634123,35.69044567565631,19.817966437485623,0.700769262610655,Ag,COMPLETE
5451,-1.0,2026-04-07 11:37:56.725679,2026-04-07 11:37:57.351850,0 days 00:00:00.626171,33.79128464024278,19.818119655841066,0.699753743618997,Au,COMPLETE
5452,-1.0,2026-04-07 11:37:56.886276,2026-04-07 11:37:57.461562,0 days 00:00:00.575286,20.36945167164306,19.63764177303412,0.6066741099342929,Au,COMPLETE
