number,value,datetime_start,datetime_complete,duration,params_D2_nm,params_D3_nm,params_D4_nm,params_metal,state
1433,-43.51851851849918,2026-04-07 11:30:33.609952,2026-04-07 11:30:34.352499,0 days 00:00:00.742547,67.6111981180224,4.418660596577449,0.10162508453641904,Ag,COMPLETE
1434,-1.0,2026-04-07 11:30:33.716783,2026-04-07 11:30:34.349916,0 days 00:00:00.633133,85.64660595200189,0.6258478889788113,0.3762331285010265,Ag,COMPLETE
1435,-42.5724637680975,2026-04-07 11:30:33.765806,2026-04-07 11:30:34.418236,0 days 00:00:00.652430,74.58504281794899,4.399584482297835,0.10300415243957804,Ag,COMPLETE
1436,-1.0,2026-04-07 11:30:33.871215,2026-04-07 11:30:34.622494,0 days 00:00:00.751279,51.42736500724321,2.8422473460456272,0.11348511247444573,Ag,COMPLETE
1437,-31.249999999989583,2026-04-07 11:30:34.308854,2026-04-07 11:30:35.289311,0 days 00:00:00.980457,48.6127883567562,3.0236087087998547,0.15367692507276182,Ag,PRUNED
1438,-27.777777777768517,2026-04-07 11:30:34.432532,2026-04-07 11:30:35.335090,0 days 00:00:00.902558,86.93722162267639,0.510229677385718,0.17444605517288822,Ag,PRUNED
1439,-18.74999999999625,2026-04-07 11:30:34.494154,2026-04-07 11:30:35.215069,0 days 00:00:00.720915,89.95156626016325,2.673209561565626,0.12973530830987245,Ag,PRUNED
1440,-28.84615384614497,2026-04-07 11:30:34.512552,2026-04-07 11:30:35.336090,0 days 00:00:00.823538,86.09104465389228,2.5172044015220476,0.34579642487439743,Ag,PRUNED
1441,-8.54700854700767,2026-04-07 11:30:34.562466,2026-04-07 11:30:35.245377,0 days 00:00:00.682911,93.15339542535,0.8620624443897493,0.13437663135823696,Ag,PRUNED
1442,-1.0,2026-04-07 11:30:34.626008,2026-04-07 11:30:35.244369,0 days 00:00:00.618361,44.588078945256406,0.720191158587973,0.20708488220655133,Ag,COMPLETE
1443,-26.785714285706632,2026-04-07 11:30:34.680562,2026-04-07 11:30:35.678358,0 days 00:00:00.997796,84.880890003321,3.5519788315075154,0.29973118708041147,Ag,PRUNED
1444,-1.0,2026-04-07 11:30:34.932961,2026-04-07 11:30:35.768309,0 days 00:00:00.835348,81.02935046031072,0.7220791630706413,0.5110463218281217,Ag,COMPLETE
1445,-1.0,2026-04-07 11:30:35.338104,2026-04-07 11:30:36.130816,0 days 00:00:00.792712,46.22791169539213,0.9327771869407644,0.10815859256790611,Ag,COMPLETE
1446,-1.0,2026-04-07 11:30:35.450160,2026-04-07 11:30:36.038551,0 days 00:00:00.588391,87.02100861225254,0.7325399309904264,0.10322143489693789,Ag,COMPLETE
1447,-1.0,2026-04-07 11:30:35.429845,2026-04-07 11:30:36.210352,0 days 00:00:00.780507,49.79803625041531,2.5661987244038884,0.35148717476648994,Ag,COMPLETE
1448,25.160256410256025,2026-04-07 11:30:35.489238,2026-04-07 11:30:36.210352,0 days 00:00:00.721114,54.32806881147934,19.522700520061584,1.3675294436327463,Ag,PRUNED
1449,-47.29729729727182,2026-04-07 11:30:35.528523,2026-04-07 11:30:36.236987,0 days 00:00:00.708464,69.01051951091812,0.6168216458004797,0.5621500074879993,Ag,COMPLETE
1450,-19.791666666664685,2026-04-07 11:30:35.572235,2026-04-07 11:30:36.238074,0 days 00:00:00.665839,43.58522791114906,17.421303081416784,0.49638298582178686,Ag,PRUNED
1451,-1.0,2026-04-07 11:30:35.725375,2026-04-07 11:30:36.348017,0 days 00:00:00.622642,61.96354131064651,4.401142134765825,0.3380342214155125,Ag,COMPLETE
1452,-1.0,2026-04-07 11:30:35.950111,2026-04-07 11:30:36.783198,0 days 00:00:00.833087,38.590588627687936,16.549943290217787,0.3269360455022049,Ag,COMPLETE
1453,-1.0,2026-04-07 11:30:36.268358,2026-04-07 11:30:36.954881,0 days 00:00:00.686523,44.94309755737545,0.6552948394132798,1.8744530142542346,Au,COMPLETE
1454,-1.0,2026-04-07 11:30:36.334137,2026-04-07 11:30:36.986107,0 days 00:00:00.651970,50.251374289438814,0.7998846267531229,0.4506088964293871,Ag,COMPLETE
1455,-33.33333333332,2026-04-07 11:30:36.351410,2026-04-07 11:30:37.343094,0 days 00:00:00.991684,50.2018449765138,0.7044512535842761,0.3958221403411397,Ag,PRUNED
1456,-38.39869281044246,2026-04-07 11:30:36.430711,2026-04-07 11:30:37.120935,0 days 00:00:00.690224,78.55154746467949,4.606976331329323,0.10341662078110926,Ag,COMPLETE
1457,-39.999999999983764,2026-04-07 11:30:36.443694,2026-04-07 11:30:37.126759,0 days 00:00:00.683065,60.59376661670284,5.010570438593438,0.11524197708732117,Ag,COMPLETE
1458,-1.0,2026-04-07 11:30:36.491102,2026-04-07 11:30:37.139415,0 days 00:00:00.648313,72.39583074730065,5.289170645296869,0.12576144023995753,Ag,COMPLETE
1459,-1.0,2026-04-07 11:30:36.618632,2026-04-07 11:30:37.359501,0 days 00:00:00.740869,49.94224579443137,3.928260043176343,0.10542234951737786,Ag,COMPLETE
1460,-1.0,2026-04-07 11:30:36.914536,2026-04-07 11:30:37.400813,0 days 00:00:00.486277,83.21909992932916,3.2749794575165705,0.10192425200811538,Ag,COMPLETE
1461,-12.195121951218322,2026-04-07 11:30:37.163545,2026-04-07 11:30:37.918018,0 days 00:00:00.754473,75.18870380571295,4.317490926446249,0.12021089955247481,Cu,PRUNED
1462,-23.809523809517003,2026-04-07 11:30:37.234982,2026-04-07 11:30:38.230994,0 days 00:00:00.996012,89.08247515215928,0.5212306745795698,0.210099967786102,Ag,PRUNED
1463,-1.0,2026-04-07 11:30:37.259996,2026-04-07 11:30:37.930008,0 days 00:00:00.670012,27.27484631034881,16.042964957649954,0.12804691745530064,Ag,COMPLETE
1464,-16.4473684210509,2026-04-07 11:30:37.378606,2026-04-07 11:30:38.298755,0 days 00:00:00.920149,56.446362206585555,4.584260588959675,0.11730727408931407,Au,PRUNED
1465,0.0,2026-04-07 11:30:37.406305,2026-04-07 11:30:38.232170,0 days 00:00:00.825865,118.20726944407345,9.776099800095686,1.7559820122327572,Cu,PRUNED
1466,-1.0,2026-04-07 11:30:37.489515,2026-04-07 11:30:38.111832,0 days 00:00:00.622317,70.48977815215999,3.39976755013634,0.410976932606674,Ag,COMPLETE
1467,-46.05263157892311,2026-04-07 11:30:37.614485,2026-04-07 11:30:38.491100,0 days 00:00:00.876615,75.05350394362638,0.8062025743334327,0.49236615359034763,Ag,COMPLETE
1468,-1.0,2026-04-07 11:30:37.751748,2026-04-07 11:30:38.377843,0 days 00:00:00.626095,59.348392421654864,3.8295459236720464,0.42409792114804845,Ag,COMPLETE
1469,-41.666666666648545,2026-04-07 11:30:38.009709,2026-04-07 11:30:39.028559,0 days 00:00:01.018850,72.22042312987067,4.417992955890212,0.12241108140416465,Ag,COMPLETE
1470,-1.0,2026-04-07 11:30:38.149487,2026-04-07 11:30:38.826880,0 days 00:00:00.677393,43.59503309079919,8.024791297922064,1.5544078708339044,Ag,COMPLETE
1471,-1.0,2026-04-07 11:30:38.345407,2026-04-07 11:30:38.874532,0 days 00:00:00.529125,20.57159507952022,19.47347076880427,0.2328944460234019,Ag,COMPLETE
1472,77.2058823529389,2026-04-07 11:30:38.381435,2026-04-07 11:30:39.060971,0 days 00:00:00.679536,39.47249982310707,13.38217509964598,1.6203034095167026,Au,PRUNED
1473,-1.0,2026-04-07 11:30:38.434475,2026-04-07 11:30:39.117776,0 days 00:00:00.683301,25.088583350881045,11.525066688408092,1.1404665704527654,Ag,COMPLETE
1474,-39.16666666665095,2026-04-07 11:30:38.471033,2026-04-07 11:30:39.293298,0 days 00:00:00.822265,73.75331841969334,4.321662897597369,0.45052478630881043,Ag,COMPLETE
1475,-34.090909090896695,2026-04-07 11:30:38.584102,2026-04-07 11:30:39.188015,0 days 00:00:00.603913,54.10266597629179,3.787099432032563,0.3380712586320077,Ag,PRUNED
1476,-34.090909090896695,2026-04-07 11:30:38.642456,2026-04-07 11:30:39.444696,0 days 00:00:00.802240,63.96821475385109,3.9568541701159976,0.43862953336458643,Ag,PRUNED
1477,-40.7608695651996,2026-04-07 11:30:38.990520,2026-04-07 11:30:39.784967,0 days 00:00:00.794447,60.31963347274584,3.2354813744634043,0.44231775026617104,Ag,COMPLETE
1478,-46.05263157892345,2026-04-07 11:30:39.064596,2026-04-07 11:30:40.043176,0 days 00:00:00.978580,60.78763852581234,0.7684225419178625,0.47833983096794386,Ag,COMPLETE
1479,-1.0,2026-04-07 11:30:39.120773,2026-04-07 11:30:39.781968,0 days 00:00:00.661195,89.63226796642539,19.13151562224217,1.4540489540685808,Ag,COMPLETE
1480,-1.0,2026-04-07 11:30:39.218569,2026-04-07 11:30:39.883301,0 days 00:00:00.664732,63.4038177614767,3.7872189275260366,0.3990349094677001,Ag,COMPLETE
1481,0.0,2026-04-07 11:30:39.321981,2026-04-07 11:30:40.044177,0 days 00:00:00.722196,20.8247198143871,14.153310461519064,1.495761534578805,Au,PRUNED
1482,-1.0,2026-04-07 11:30:39.410843,2026-04-07 11:30:39.935910,0 days 00:00:00.525067,72.1769711010439,3.950804522500225,0.3619699482955523,Ag,COMPLETE
1483,-1.0,2026-04-07 11:30:39.561053,2026-04-07 11:30:40.231038,0 days 00:00:00.669985,47.83296548337761,0.6192392311058738,0.37197528366600874,Ag,COMPLETE
1484,-1.0,2026-04-07 11:30:39.570655,2026-04-07 11:30:40.145722,0 days 00:00:00.575067,115.38458839629737,14.802936248518938,1.941320577346627,Au,COMPLETE
1485,-1.0,2026-04-07 11:30:39.999497,2026-04-07 11:30:40.779522,0 days 00:00:00.780025,71.96415223358815,3.1192592261313083,0.526024269644844,Ag,COMPLETE
1486,-1.0,2026-04-07 11:30:40.090166,2026-04-07 11:30:40.624423,0 days 00:00:00.534257,80.72240066287534,2.1884303278633763,0.4309592222296198,Ag,COMPLETE
1487,-1.0,2026-04-07 11:30:40.121585,2026-04-07 11:30:40.777010,0 days 00:00:00.655425,69.25208495830393,6.118914462761857,0.3713612128185556,Au,COMPLETE
1488,-31.249999999989583,2026-04-07 11:30:40.147964,2026-04-07 11:30:40.885549,0 days 00:00:00.737585,50.29067378501702,3.672665002189606,0.10555167592120618,Ag,PRUNED
1489,-1.0,2026-04-07 11:30:40.200387,2026-04-07 11:30:40.884031,0 days 00:00:00.683644,65.7997783722265,3.7428619081241474,0.42735030885288006,Ag,COMPLETE
1490,-27.777777777768517,2026-04-07 11:30:40.279068,2026-04-07 11:30:40.963427,0 days 00:00:00.684359,86.26650577931116,0.6576996200457199,0.42876861518587217,Ag,PRUNED
1491,-1.0,2026-04-07 11:30:40.422477,2026-04-07 11:30:40.979225,0 days 00:00:00.556748,88.11223613465867,2.3239965220050736,0.6645630261992536,Au,COMPLETE
1492,-1.0,2026-04-07 11:30:40.484915,2026-04-07 11:30:41.190383,0 days 00:00:00.705468,53.07219491924546,0.5955947723800009,0.3450935086644045,Ag,COMPLETE
1493,-1.0,2026-04-07 11:30:40.818882,2026-04-07 11:30:41.582613,0 days 00:00:00.763731,54.70442995668571,2.9332995611079054,0.3573815150288565,Ag,COMPLETE
1494,-1.0,2026-04-07 11:30:41.002568,2026-04-07 11:30:41.678861,0 days 00:00:00.676293,86.18732408587866,2.843116047496095,0.11184074073744323,Ag,COMPLETE
1495,-9.180790960451354,2026-04-07 11:30:41.030757,2026-04-07 11:30:41.837402,0 days 00:00:00.806645,33.88609219266658,9.781658421301989,0.6801159182528095,Cu,PRUNED
1496,-1.0,2026-04-07 11:30:41.060178,2026-04-07 11:30:41.648370,0 days 00:00:00.588192,78.31685484582597,3.5966083440094416,0.48043451265564363,Ag,COMPLETE
1497,0.0,2026-04-07 11:30:41.108403,2026-04-07 11:30:41.985521,0 days 00:00:00.877118,22.337612051552913,12.526348367437356,0.5171010791770843,Au,PRUNED
1498,-33.33333333332,2026-04-07 11:30:41.153937,2026-04-07 11:30:41.775910,0 days 00:00:00.621973,82.84990538433267,0.6388037511011817,0.4302340249269318,Ag,PRUNED
1499,-1.0,2026-04-07 11:30:41.240535,2026-04-07 11:30:41.775910,0 days 00:00:00.535375,55.73357690713105,4.309989532179117,0.2170936107947069,Ag,COMPLETE
1500,-31.249999999989583,2026-04-07 11:30:41.442416,2026-04-07 11:30:49.361748,0 days 00:00:07.919332,81.19293425748823,3.506811970875285,0.24885502944859722,Ag,PRUNED
1501,-1.0,2026-04-07 11:30:41.750375,2026-04-07 11:30:46.277549,0 days 00:00:04.527174,63.06270135708348,0.6351229035937999,0.4978890104393423,Ag,COMPLETE
1502,-1.0,2026-04-07 11:30:41.839766,2026-04-07 11:30:46.278561,0 days 00:00:04.438795,46.57430100606828,0.7394055308036318,0.19017695148977268,Ag,COMPLETE
1503,-28.84615384614497,2026-04-07 11:30:41.902550,2026-04-07 11:30:49.844356,0 days 00:00:07.941806,83.49317704822303,3.502664088320717,0.32638492173100386,Ag,PRUNED
1504,-1.0,2026-04-07 11:30:41.923130,2026-04-07 11:30:49.608721,0 days 00:00:07.685591,61.53751497614345,1.1714237074161251,0.509477990399288,Ag,COMPLETE
1505,-1.0,2026-04-07 11:30:41.983095,2026-04-07 11:30:49.272153,0 days 00:00:07.289058,51.834965207948215,2.9935473140384,0.14688694327282328,Ag,COMPLETE
1506,-1.0,2026-04-07 11:30:42.025932,2026-04-07 11:30:49.271149,0 days 00:00:07.245217,84.59560447191183,3.0065558699051937,0.19511023201244385,Ag,COMPLETE
1507,-1.0,2026-04-07 11:30:42.077529,2026-04-07 11:30:49.403516,0 days 00:00:07.325987,51.64561234109597,0.8737193512876745,0.3860285668361756,Ag,COMPLETE
1508,-8.20707070707021,2026-04-07 11:30:49.358386,2026-04-07 11:30:50.394856,0 days 00:00:01.036470,26.296508172483502,10.335646831023173,1.5055935340663016,Au,PRUNED
1509,-1.0,2026-04-07 11:30:49.397549,2026-04-07 11:30:50.442264,0 days 00:00:01.044715,68.03302857510744,4.801580638001578,0.12287639809204585,Ag,COMPLETE
1510,-15.151515151513774,2026-04-07 11:30:49.474398,2026-04-07 11:30:50.248055,0 days 00:00:00.773657,38.27073684380588,14.668262272802936,1.2452068204079065,Ag,PRUNED
1511,-34.090909090896695,2026-04-07 11:30:49.406524,2026-04-07 11:30:52.432157,0 days 00:00:03.025633,59.349577347871985,4.578982795741882,0.1352065991830933,Ag,PRUNED
1512,6.241565452091667,2026-04-07 11:30:49.577568,2026-04-07 11:30:52.475480,0 days 00:00:02.897912,112.16545832403096,4.152967845668151,0.9297006508141016,Cu,PRUNED
1513,-0.8928571428571173,2026-04-07 11:30:49.696650,2026-04-07 11:30:53.054967,0 days 00:00:03.358317,20.359964935176464,18.273444236310194,0.12551528565817416,Ag,PRUNED
1514,-1.0,2026-04-07 11:30:49.807601,2026-04-07 11:30:50.394295,0 days 00:00:00.586694,72.76820739173303,0.633533168172666,0.6073984224233419,Ag,COMPLETE
1515,-1.0,2026-04-07 11:30:49.911807,2026-04-07 11:30:50.581286,0 days 00:00:00.669479,57.87351619462082,0.9510919863339322,0.46339756011846034,Ag,COMPLETE
1516,-31.249999999989583,2026-04-07 11:30:50.601503,2026-04-07 11:30:56.339700,0 days 00:00:05.738197,81.70803644048881,3.3879554764567152,0.38163861580551117,Ag,PRUNED
1517,-34.090909090896695,2026-04-07 11:30:51.051705,2026-04-07 11:30:56.322601,0 days 00:00:05.270896,79.30096687243235,3.8400285071666302,0.252054051090321,Ag,PRUNED
1518,-12.626262626261097,2026-04-07 11:30:51.721474,2026-04-07 11:30:56.292874,0 days 00:00:04.571400,51.57847306378578,2.58362605471243,0.5167850664293304,Cu,PRUNED
1519,-13.480392156861159,2026-04-07 11:30:55.461772,2026-04-07 11:30:56.619749,0 days 00:00:01.157977,54.02605011681002,3.3566743898605207,0.4482525048698297,Cu,PRUNED
1520,-1.0,2026-04-07 11:30:55.937565,2026-04-07 11:30:56.533670,0 days 00:00:00.596105,64.03716655243427,0.5861698770926183,0.5703960393348827,Ag,COMPLETE
1521,-1.0,2026-04-07 11:30:55.892357,2026-04-07 11:30:56.912998,0 days 00:00:01.020641,78.10317670609129,3.772142530620089,0.35692511405614696,Ag,COMPLETE
1522,-15.624999999997396,2026-04-07 11:30:53.139989,2026-04-07 11:30:57.083636,0 days 00:00:03.943647,91.34397674963846,0.7374815516574804,0.14230403171611306,Ag,PRUNED
1523,-0.8644536652835265,2026-04-07 11:30:53.147980,2026-04-07 11:30:57.120504,0 days 00:00:03.972524,65.29306430720393,19.69732763842177,1.241876435759637,Cu,PRUNED
1524,-1.0,2026-04-07 11:30:56.400118,2026-04-07 11:30:56.849464,0 days 00:00:00.449346,82.54465194721043,0.6552630468473406,0.39413374050478206,Ag,COMPLETE
1525,-1.0,2026-04-07 11:30:56.416953,2026-04-07 11:30:56.834081,0 days 00:00:00.417128,50.92068768678585,0.8162948488866781,0.36104533478192735,Ag,COMPLETE
1526,-1.0,2026-04-07 11:30:56.468731,2026-04-07 11:30:56.990767,0 days 00:00:00.522036,59.88104234097055,14.96276417559106,1.8044827253811875,Au,COMPLETE
1527,5.810092961487291,2026-04-07 11:30:56.797453,2026-04-07 11:30:57.713178,0 days 00:00:00.915725,117.23770263146335,12.819640343345602,0.8943877805679135,Ag,PRUNED
1528,-0.7002801120448061,2026-04-07 11:30:56.740016,2026-04-07 11:30:57.714179,0 days 00:00:00.974163,82.69462403040376,16.36337426432861,1.9993095231031464,Au,PRUNED
1529,-1.0,2026-04-07 11:30:57.022576,2026-04-07 11:30:57.744620,0 days 00:00:00.722044,77.0266074434838,3.6400763377704033,0.41319233331112054,Ag,COMPLETE
1530,-1.0,2026-04-07 11:30:57.138042,2026-04-07 11:30:57.728262,0 days 00:00:00.590220,60.15903502592657,3.517344305115913,0.3623296279974013,Ag,COMPLETE
1531,-1.0,2026-04-07 11:30:57.152166,2026-04-07 11:30:57.964464,0 days 00:00:00.812298,62.92204538882554,4.749631175821179,0.34134270181612425,Ag,COMPLETE
1532,-1.0,2026-04-07 11:30:57.195478,2026-04-07 11:30:57.745619,0 days 00:00:00.550141,75.76870289625755,3.3739738839115807,0.368845535444406,Ag,COMPLETE
1533,-34.090909090896695,2026-04-07 11:30:57.214205,2026-04-07 11:30:57.950140,0 days 00:00:00.735935,55.163935194130346,3.840589108683565,0.14350157338013872,Ag,PRUNED
1534,-1.0,2026-04-07 11:30:57.282309,2026-04-07 11:30:57.782373,0 days 00:00:00.500064,60.29783080596086,0.9563721363422183,0.6102694559848874,Au,COMPLETE
1535,-1.0,2026-04-07 11:30:57.809665,2026-04-07 11:30:58.684759,0 days 00:00:00.875094,86.31267671891322,0.8381023703605026,0.2045407258462451,Ag,COMPLETE
1536,-43.560606060586124,2026-04-07 11:30:57.920170,2026-04-07 11:30:58.760902,0 days 00:00:00.840732,71.07985175084514,4.139894520429243,0.11076752401415318,Ag,COMPLETE
1537,-43.560606060586395,2026-04-07 11:30:57.983731,2026-04-07 11:30:58.916233,0 days 00:00:00.932502,69.27496430094227,4.032494998451412,0.10042329798996244,Ag,COMPLETE
1538,-0.9018759018758863,2026-04-07 11:30:58.011610,2026-04-07 11:30:58.828651,0 days 00:00:00.817041,71.52960699760364,19.27661240254698,1.5275476235083103,Au,PRUNED
1539,-1.0,2026-04-07 11:30:58.044205,2026-04-07 11:30:58.824136,0 days 00:00:00.779931,83.4563431139115,1.0090836013684865,0.4111682903203524,Ag,COMPLETE
1540,-34.090909090896695,2026-04-07 11:30:58.057819,2026-04-07 11:30:58.828651,0 days 00:00:00.770832,54.211688129865095,3.595999668044172,0.1831869336667438,Ag,PRUNED
1541,-1.0,2026-04-07 11:30:58.072564,2026-04-07 11:30:58.757725,0 days 00:00:00.685161,57.77708774102408,3.6210583513269405,0.32782838412156,Ag,COMPLETE
1542,-42.613636363616784,2026-04-07 11:30:58.339687,2026-04-07 11:30:59.323936,0 days 00:00:00.984249,71.79014668919456,3.034263394341889,0.4963539420883233,Ag,COMPLETE
1543,0.0,2026-04-07 11:30:58.903536,2026-04-07 11:30:59.846919,0 days 00:00:00.943383,21.694075943852546,13.959405748693328,0.7944978431522467,Cu,PRUNED
1544,-0.8169934640522748,2026-04-07 11:30:59.004776,2026-04-07 11:30:59.962881,0 days 00:00:00.958105,68.8659451829685,18.564637997055442,1.9142684212407943,Ag,PRUNED
1545,-1.0,2026-04-07 11:30:59.007166,2026-04-07 11:30:59.731335,0 days 00:00:00.724169,49.94318350813817,0.5052606352434494,0.10279056667273437,Ag,COMPLETE
1546,-1.0,2026-04-07 11:30:59.048772,2026-04-07 11:30:59.665043,0 days 00:00:00.616271,50.532979477707,1.562125969558127,0.10666371255525553,Ag,COMPLETE
1547,-40.78014184395421,2026-04-07 11:30:59.102518,2026-04-07 11:30:59.842924,0 days 00:00:00.740406,62.31632024586669,3.5390661946567996,0.43463413257031974,Ag,COMPLETE
1548,-1.0,2026-04-07 11:30:59.127701,2026-04-07 11:30:59.772851,0 days 00:00:00.645150,88.02870182349434,0.5679383001605433,0.25601995726855253,Ag,COMPLETE
1549,-1.0,2026-04-07 11:30:59.116959,2026-04-07 11:30:59.729335,0 days 00:00:00.612376,55.77964910948356,0.6155383750986734,0.4589739863099478,Ag,COMPLETE
1550,-39.11564625848725,2026-04-07 11:30:59.698984,2026-04-07 11:31:00.983215,0 days 00:00:01.284231,78.73310791898213,3.864306485915772,0.14556632034920852,Ag,COMPLETE
1551,-1.0,2026-04-07 11:30:59.845919,2026-04-07 11:31:01.101906,0 days 00:00:01.255987,43.82257373326171,10.413600847531029,1.6276246617097954,Au,COMPLETE
1552,0.0,2026-04-07 11:30:59.960016,2026-04-07 11:31:01.023783,0 days 00:00:01.063767,44.386622728857546,14.816184137225417,1.2028460796035185,Au,PRUNED
1553,-1.0,2026-04-07 11:30:59.981816,2026-04-07 11:31:01.132588,0 days 00:00:01.150772,48.816254495015,1.026494383915685,0.10411308840556702,Ag,COMPLETE
1554,-0.83668005354751,2026-04-07 11:31:00.040897,2026-04-07 11:31:01.303290,0 days 00:00:01.262393,93.67990550950427,12.176945407275678,0.78691137730262,Cu,PRUNED
1555,-1.0,2026-04-07 11:31:00.086106,2026-04-07 11:31:00.912938,0 days 00:00:00.826832,68.20951446724067,2.8836098421574574,1.1357742955133348,Cu,COMPLETE
1556,-0.8928571428571173,2026-04-07 11:31:00.128665,2026-04-07 11:31:01.283634,0 days 00:00:01.154969,22.19045016323528,15.704093260371726,0.4827440689360537,Ag,PRUNED
1557,-33.33333333332,2026-04-07 11:31:00.169416,2026-04-07 11:31:01.378977,0 days 00:00:01.209561,48.15085652370944,0.5759368076514515,0.12156348536460578,Ag,PRUNED
1558,-1.0,2026-04-07 11:31:00.954931,2026-04-07 11:31:01.779396,0 days 00:00:00.824465,43.70966246938805,19.81657974443581,0.43892604307306515,Ag,COMPLETE
1559,-1.0,2026-04-07 11:31:01.076395,2026-04-07 11:31:02.098509,0 days 00:00:01.022114,71.55864805671132,4.108244165576509,0.39302290317167,Ag,COMPLETE
1560,-41.66666666664842,2026-04-07 11:31:01.243078,2026-04-07 11:31:02.272358,0 days 00:00:01.029280,59.256754133243,3.8612877850532543,0.12408225847703194,Ag,COMPLETE
1561,-1.0,2026-04-07 11:31:01.329319,2026-04-07 11:31:02.241591,0 days 00:00:00.912272,76.19810515476077,2.584144736412993,0.5802611943005318,Cu,COMPLETE
1562,-41.66666666664841,2026-04-07 11:31:01.304297,2026-04-07 11:31:02.337671,0 days 00:00:01.033374,59.530999922270745,3.722346205261394,0.10881756231287629,Ag,COMPLETE
1563,-31.249999999989583,2026-04-07 11:31:01.429320,2026-04-07 11:31:02.194425,0 days 00:00:00.765105,79.61689455859519,5.05176382623238,0.11838202963498508,Ag,PRUNED
1564,-1.0,2026-04-07 11:31:01.512857,2026-04-07 11:31:02.099516,0 days 00:00:00.586659,58.97172247406507,3.940828794176224,0.15560736538988196,Ag,COMPLETE
1565,-41.66666666664801,2026-04-07 11:31:01.541618,2026-04-07 11:31:02.378056,0 days 00:00:00.836438,78.13003095505178,3.185436711170457,0.11303951304601369,Ag,COMPLETE
1566,-1.0,2026-04-07 11:31:02.180418,2026-04-07 11:31:02.973209,0 days 00:00:00.792791,82.97480309166943,3.239142827709457,0.1025018347305574,Ag,COMPLETE
1567,-44.715447154449805,2026-04-07 11:31:02.292266,2026-04-07 11:31:03.363895,0 days 00:00:01.071629,74.31725931413871,1.7532664080804343,0.5376921406218264,Ag,COMPLETE
1568,-34.090909090896695,2026-04-07 11:31:02.378056,2026-04-07 11:31:03.236683,0 days 00:00:00.858627,80.47393039737247,3.159850203447709,0.3333620095163897,Ag,PRUNED
