number,value,datetime_start,datetime_complete,duration,params_D2_nm,params_D3_nm,params_D4_nm,params_metal,state
4198,-1.0,2026-04-07 11:35:35.162806,2026-04-07 11:35:35.680571,0 days 00:00:00.517765,20.802851271796563,18.088744693643847,0.6420152886169666,Au,COMPLETE
4199,-1.0,2026-04-07 11:35:35.176450,2026-04-07 11:35:35.614363,0 days 00:00:00.437913,29.2155287607957,19.542278174812672,0.6110055143566575,Au,COMPLETE
4200,-1.0,2026-04-07 11:35:35.322294,2026-04-07 11:35:35.752096,0 days 00:00:00.429802,22.15694320628547,19.9636126924421,0.5996004561368689,Au,COMPLETE
4201,-1.0,2026-04-07 11:35:35.378859,2026-04-07 11:35:35.802974,0 days 00:00:00.424115,32.74786004863066,17.59012865130515,0.5841969500899444,Au,COMPLETE
4202,-0.7440476190476057,2026-04-07 11:35:35.400850,2026-04-07 11:35:36.027470,0 days 00:00:00.626620,66.18822212627366,18.108407100186795,0.6926508330357123,Au,PRUNED
4203,-1.0,2026-04-07 11:35:35.679101,2026-04-07 11:35:36.486966,0 days 00:00:00.807865,39.238215544868396,19.723970192899664,0.7205249978830243,Au,COMPLETE
4204,-1.0,2026-04-07 11:35:35.785619,2026-04-07 11:35:36.411647,0 days 00:00:00.626028,36.61671664725814,19.701803712901274,0.6340847552037231,Au,COMPLETE
4205,-1.0,2026-04-07 11:35:35.906260,2026-04-07 11:35:36.557050,0 days 00:00:00.650790,24.399224941119446,19.985705119248568,0.7243732898293399,Au,COMPLETE
4206,3.2051282051279584,2026-04-07 11:35:35.976102,2026-04-07 11:35:36.644710,0 days 00:00:00.668608,38.220142887078346,17.07462074384924,0.5786524812205478,Cu,PRUNED
4207,-1.0,2026-04-07 11:35:36.005309,2026-04-07 11:35:36.474900,0 days 00:00:00.469591,20.94292539713297,19.72323947099241,0.8167521495268895,Au,COMPLETE
4208,-1.0,2026-04-07 11:35:36.030482,2026-04-07 11:35:36.500722,0 days 00:00:00.470240,25.044508192134792,19.976949933078462,0.46718497863389996,Au,COMPLETE
4209,0.0,2026-04-07 11:35:36.090568,2026-04-07 11:35:36.798532,0 days 00:00:00.707964,45.35191094485839,17.362055325881638,0.7593945650374287,Au,PRUNED
4210,0.0,2026-04-07 11:35:36.186133,2026-04-07 11:35:36.779754,0 days 00:00:00.593621,35.453274834046496,19.804161319522912,0.5731909858810178,Au,PRUNED
4211,-1.0,2026-04-07 11:35:36.646801,2026-04-07 11:35:37.424689,0 days 00:00:00.777888,22.869192218630285,19.061909469378485,0.7830512511302701,Ag,COMPLETE
4212,0.0,2026-04-07 11:35:36.704170,2026-04-07 11:35:37.475775,0 days 00:00:00.771605,21.10854307112801,17.221548522920713,0.5490736619829051,Au,PRUNED
4213,-1.0,2026-04-07 11:35:36.742704,2026-04-07 11:35:37.408860,0 days 00:00:00.666156,21.071727471231874,17.216253002356048,0.35372345070794076,Au,COMPLETE
4214,0.0,2026-04-07 11:35:36.750507,2026-04-07 11:35:37.506176,0 days 00:00:00.755669,33.295964683610805,19.909517479253847,0.6581733147827853,Au,PRUNED
4215,-1.0,2026-04-07 11:35:36.825934,2026-04-07 11:35:37.453835,0 days 00:00:00.627901,21.680037207650166,19.979673683403615,0.7423186325701845,Au,COMPLETE
4216,0.0,2026-04-07 11:35:36.845925,2026-04-07 11:35:37.471754,0 days 00:00:00.625829,48.85091954099401,19.954485406414697,0.6339131899878112,Au,PRUNED
4217,4.9019607843131485,2026-04-07 11:35:36.858789,2026-04-07 11:35:37.509099,0 days 00:00:00.650310,27.67053921116613,16.999937894820903,0.6961897024425805,Au,PRUNED
4218,-1.0,2026-04-07 11:35:36.875411,2026-04-07 11:35:37.410371,0 days 00:00:00.534960,20.749675321277575,19.24179569646033,0.5644290701430953,Au,COMPLETE
4219,0.0,2026-04-07 11:35:37.601935,2026-04-07 11:35:38.437893,0 days 00:00:00.835958,20.93971699712172,17.23386193826101,0.7104604233306429,Au,PRUNED
4220,-1.0,2026-04-07 11:35:37.613394,2026-04-07 11:35:38.437893,0 days 00:00:00.824499,28.497598676355622,17.52968815857508,0.7741179149028629,Au,COMPLETE
4221,0.0,2026-04-07 11:35:37.629125,2026-04-07 11:35:38.287149,0 days 00:00:00.658024,32.749269804127266,19.96824266786803,0.7920794355444646,Au,PRUNED
4222,0.0,2026-04-07 11:35:37.642318,2026-04-07 11:35:38.434059,0 days 00:00:00.791741,31.678692382041504,19.998446687848798,0.5306104119475393,Au,PRUNED
4223,-1.0,2026-04-07 11:35:37.660365,2026-04-07 11:35:38.284125,0 days 00:00:00.623760,22.613023842762285,17.526716242495535,0.7087445696677449,Au,COMPLETE
4224,-1.7605633802816405,2026-04-07 11:35:37.725839,2026-04-07 11:35:38.394046,0 days 00:00:00.668207,40.358760757562564,19.934937447578218,0.6501979746463984,Cu,PRUNED
4225,0.0,2026-04-07 11:35:37.736927,2026-04-07 11:35:38.392529,0 days 00:00:00.655602,40.962567089042366,19.804075242455347,0.6964609709762186,Au,PRUNED
4226,-1.0,2026-04-07 11:35:37.782076,2026-04-07 11:35:38.346356,0 days 00:00:00.564280,33.52828585037828,17.789465163612434,0.7812636900253214,Au,COMPLETE
4227,-1.0,2026-04-07 11:35:38.370892,2026-04-07 11:35:39.031480,0 days 00:00:00.660588,22.183524218088493,19.838457445800355,0.7348144812810172,Au,COMPLETE
4228,0.0,2026-04-07 11:35:38.471935,2026-04-07 11:35:39.203906,0 days 00:00:00.731971,32.00147331412163,19.94170724388153,0.8483822940673886,Au,PRUNED
4229,-1.0,2026-04-07 11:35:38.485711,2026-04-07 11:35:39.063037,0 days 00:00:00.577326,20.22502922413817,19.780692024994508,0.5668196239480675,Au,COMPLETE
4230,-1.0,2026-04-07 11:35:38.515691,2026-04-07 11:35:39.094716,0 days 00:00:00.579025,20.09587288117262,17.67224157065659,0.2716710407739878,Au,COMPLETE
4231,-359.7756410255949,2026-04-07 11:35:38.550725,2026-04-07 11:35:39.203906,0 days 00:00:00.653181,20.254786107560296,19.42506709768833,0.870195425873661,Au,COMPLETE
4232,-1.0,2026-04-07 11:35:38.713592,2026-04-07 11:35:39.390590,0 days 00:00:00.676998,35.89629811568918,19.938709378282002,0.2897320456365742,Au,COMPLETE
4233,-1.0,2026-04-07 11:35:38.757958,2026-04-07 11:35:39.203906,0 days 00:00:00.445948,33.166449986207695,17.24087399783018,0.6292171696201173,Au,COMPLETE
4234,-1.0,2026-04-07 11:35:38.785264,2026-04-07 11:35:39.205118,0 days 00:00:00.419854,20.4812830044124,19.768711324162396,0.7652474301042125,Au,COMPLETE
4235,-1.0,2026-04-07 11:35:39.195219,2026-04-07 11:35:39.933719,0 days 00:00:00.738500,112.17811749996034,10.783650358688503,0.3909733034362344,Au,COMPLETE
4236,-1.0,2026-04-07 11:35:39.245846,2026-04-07 11:35:39.838723,0 days 00:00:00.592877,20.089390849885167,17.866233275724245,0.6471853431151626,Au,COMPLETE
4237,-372.7924944811867,2026-04-07 11:35:39.298969,2026-04-07 11:35:39.935837,0 days 00:00:00.636868,20.838139893692603,19.512805174827893,0.4953522560670446,Au,COMPLETE
4238,-1.0,2026-04-07 11:35:39.345711,2026-04-07 11:35:40.058338,0 days 00:00:00.712627,20.10133716246122,19.74867293362087,0.4738863353596034,Au,COMPLETE
4239,0.0,2026-04-07 11:35:39.407861,2026-04-07 11:35:40.094780,0 days 00:00:00.686919,20.28898561630157,16.783838529058407,0.4464811457419683,Au,PRUNED
4240,-1.0,2026-04-07 11:35:39.516553,2026-04-07 11:35:40.274538,0 days 00:00:00.757985,20.17916993276024,19.65712095683348,0.8822046300582385,Au,COMPLETE
4241,0.0,2026-04-07 11:35:39.546831,2026-04-07 11:35:40.184752,0 days 00:00:00.637921,20.20573973205422,17.846944488495495,0.11271005343162066,Cu,PRUNED
4242,-1.0,2026-04-07 11:35:39.574785,2026-04-07 11:35:40.118694,0 days 00:00:00.543909,31.060404118509314,13.990745645164129,0.7430210881001484,Au,COMPLETE
4243,-1.0,2026-04-07 11:35:40.013831,2026-04-07 11:35:41.296735,0 days 00:00:01.282904,21.288303543842428,19.861320048074816,0.6108860949357716,Au,COMPLETE
4244,0.0,2026-04-07 11:35:40.139248,2026-04-07 11:35:41.510214,0 days 00:00:01.370966,48.23525936895294,19.834269063102433,0.48343929966887267,Au,PRUNED
4245,0.0,2026-04-07 11:35:40.219631,2026-04-07 11:35:41.569686,0 days 00:00:01.350055,99.34636899361509,19.275044649713834,0.11607521453168268,Ag,PRUNED
4246,0.0,2026-04-07 11:35:40.228786,2026-04-07 11:35:41.600827,0 days 00:00:01.372041,36.9603472434468,17.537211747334027,0.8176496819093952,Au,PRUNED
4247,-371.9646799116503,2026-04-07 11:35:40.266686,2026-04-07 11:35:41.572410,0 days 00:00:01.305724,20.674363067876147,19.880202191905294,0.19661186201436998,Au,COMPLETE
4248,-1.0,2026-04-07 11:35:40.310785,2026-04-07 11:35:41.403936,0 days 00:00:01.093151,21.322962227984743,19.841984078375276,0.8000715006423039,Au,COMPLETE
4249,-3.0864197530859623,2026-04-07 11:35:40.996700,2026-04-07 11:35:41.829054,0 days 00:00:00.832354,22.373033066690436,19.993491901999615,0.7103189412669852,Au,PRUNED
4250,0.0,2026-04-07 11:35:41.126746,2026-04-07 11:35:41.906360,0 days 00:00:00.779614,20.223668768117633,15.511519292486657,0.7228556105648543,Au,PRUNED
4251,79.6568627450957,2026-04-07 11:35:41.473006,2026-04-07 11:35:42.355718,0 days 00:00:00.882712,34.84083264797923,14.646202931526716,0.9266158489605929,Au,PRUNED
4252,0.0,2026-04-07 11:35:41.540292,2026-04-07 11:35:42.324680,0 days 00:00:00.784388,29.58930900691167,19.943117169104674,0.6294976269809271,Au,PRUNED
4253,-1.0,2026-04-07 11:35:41.690543,2026-04-07 11:35:42.247013,0 days 00:00:00.556470,38.617565234894286,19.9241313585646,0.7083039510837553,Au,COMPLETE
4254,-1.0,2026-04-07 11:35:41.724530,2026-04-07 11:35:42.296229,0 days 00:00:00.571699,33.09562915651692,15.291026953852962,0.8253079234839061,Au,COMPLETE
4255,79.62962962962726,2026-04-07 11:35:41.765930,2026-04-07 11:35:42.495855,0 days 00:00:00.729925,32.703446280593894,16.983030179017284,0.6669907779634054,Au,PRUNED
4256,-370.0657894736355,2026-04-07 11:35:41.746030,2026-04-07 11:35:42.453388,0 days 00:00:00.707358,20.373132780284372,19.774960640870255,0.5723548999405117,Au,COMPLETE
4257,-1.0,2026-04-07 11:35:41.930045,2026-04-07 11:35:42.404686,0 days 00:00:00.474641,35.89209638960364,17.423079860518435,0.6653575103281106,Au,COMPLETE
4258,-1.0,2026-04-07 11:35:42.017036,2026-04-07 11:35:42.708786,0 days 00:00:00.691750,21.094272688804164,19.779642190716125,0.2803376384106394,Au,COMPLETE
4259,-1.0,2026-04-07 11:35:42.430601,2026-04-07 11:35:42.993844,0 days 00:00:00.563243,20.261094108215232,17.931492090759324,0.8708361117263559,Au,COMPLETE
4260,0.0,2026-04-07 11:35:42.451381,2026-04-07 11:35:43.105925,0 days 00:00:00.654544,34.20959419493769,18.226616694179285,0.8478045386287246,Au,PRUNED
4261,-1.0,2026-04-07 11:35:42.526782,2026-04-07 11:35:43.106923,0 days 00:00:00.580141,43.61051276934432,19.816978668700962,0.8346700338074518,Au,COMPLETE
4262,-1.0,2026-04-07 11:35:42.543623,2026-04-07 11:35:42.998070,0 days 00:00:00.454447,35.67853969472053,19.91471081466332,0.8138316627714834,Au,COMPLETE
4263,0.0,2026-04-07 11:35:42.595640,2026-04-07 11:35:43.062952,0 days 00:00:00.467312,35.53800264932417,19.93829972053046,0.2790797079407065,Au,PRUNED
4264,-1.0,2026-04-07 11:35:42.623339,2026-04-07 11:35:43.118969,0 days 00:00:00.495630,31.306456527689242,19.81266058487689,0.3792214357031287,Au,COMPLETE
4265,0.0,2026-04-07 11:35:42.750382,2026-04-07 11:35:43.325257,0 days 00:00:00.574875,38.45378542419694,19.92242271334475,0.8369826448763701,Au,PRUNED
4266,-1.0,2026-04-07 11:35:42.874111,2026-04-07 11:35:43.854999,0 days 00:00:00.980888,30.564170667865866,17.001614603970207,0.7869266682398807,Au,COMPLETE
4267,0.0,2026-04-07 11:35:43.118360,2026-04-07 11:35:44.028906,0 days 00:00:00.910546,37.11694298170675,19.9200082635152,0.7789574453938295,Au,PRUNED
4268,-1.0,2026-04-07 11:35:43.191972,2026-04-07 11:35:43.794564,0 days 00:00:00.602592,20.524137714655883,17.27785349748561,0.8849326611954933,Au,COMPLETE
4269,-1.0,2026-04-07 11:35:43.237762,2026-04-07 11:35:43.947434,0 days 00:00:00.709672,42.62395606869313,14.914874337623747,0.4576194107271169,Au,COMPLETE
4270,-1.0,2026-04-07 11:35:43.292720,2026-04-07 11:35:43.888583,0 days 00:00:00.595863,37.943339845128776,19.929663778711422,0.7490001592283219,Au,COMPLETE
4271,-392.3611111110566,2026-04-07 11:35:43.329105,2026-04-07 11:35:44.027904,0 days 00:00:00.698799,20.553013831190988,19.855655752721333,0.612302631855824,Au,COMPLETE
4272,-395.1048951048396,2026-04-07 11:35:43.387367,2026-04-07 11:35:44.077143,0 days 00:00:00.689776,20.290546230362526,19.99871708506858,0.7018210228729133,Au,COMPLETE
4273,79.01234567901,2026-04-07 11:35:43.530346,2026-04-07 11:35:44.153510,0 days 00:00:00.623164,35.709311849561274,16.139988230812165,0.25454595020271253,Au,PRUNED
4274,0.0,2026-04-07 11:35:44.119547,2026-04-07 11:35:44.885085,0 days 00:00:00.765538,30.170930755064454,19.972608539206693,0.5541149221220714,Au,PRUNED
4275,-1.0,2026-04-07 11:35:44.171044,2026-04-07 11:35:44.886082,0 days 00:00:00.715038,35.20735591389469,19.970233983738378,0.48363092018400594,Au,COMPLETE
4276,0.0,2026-04-07 11:35:44.185298,2026-04-07 11:35:44.962154,0 days 00:00:00.776856,21.262429614837398,17.03599540912081,0.8476881264290372,Au,PRUNED
4277,0.0,2026-04-07 11:35:44.217968,2026-04-07 11:35:44.837706,0 days 00:00:00.619738,20.47353277909171,14.181033981621574,0.5866800606979836,Au,PRUNED
4278,-1.0,2026-04-07 11:35:44.247800,2026-04-07 11:35:44.836097,0 days 00:00:00.588297,20.06012785961236,16.264701534413632,0.8137367209751641,Au,COMPLETE
4279,-1.0,2026-04-07 11:35:44.265485,2026-04-07 11:35:45.030073,0 days 00:00:00.764588,20.64933847508319,17.695791348697192,0.4950928133867716,Au,COMPLETE
4280,-1.0,2026-04-07 11:35:44.389752,2026-04-07 11:35:44.887296,0 days 00:00:00.497544,34.64850851478607,18.085667161657042,0.7479300836682473,Au,COMPLETE
4281,0.0,2026-04-07 11:35:44.547464,2026-04-07 11:35:45.283002,0 days 00:00:00.735538,20.826497684085314,16.67984764771277,0.7170770284700382,Au,PRUNED
4282,-413.6253041361929,2026-04-07 11:35:44.901330,2026-04-07 11:35:45.693979,0 days 00:00:00.792649,20.675860954133164,19.805329452973957,0.799960048871961,Au,COMPLETE
4283,-1.0,2026-04-07 11:35:44.987105,2026-04-07 11:35:45.402096,0 days 00:00:00.414991,34.07476180179177,19.76413313621635,0.8652009824459119,Au,COMPLETE
4284,-1.0,2026-04-07 11:35:44.964665,2026-04-07 11:35:45.784580,0 days 00:00:00.819915,29.414565837796985,19.833681419956886,0.8400242520492134,Au,COMPLETE
4285,79.01234567901,2026-04-07 11:35:45.135883,2026-04-07 11:35:45.890897,0 days 00:00:00.755014,34.40854858068143,16.44308639926627,0.6626811219923092,Au,PRUNED
4286,0.0,2026-04-07 11:35:45.210671,2026-04-07 11:35:46.021518,0 days 00:00:00.810847,33.193492982515934,19.944430536233455,0.48309845995779355,Au,PRUNED
4287,-1.0,2026-04-07 11:35:45.236434,2026-04-07 11:35:45.938400,0 days 00:00:00.701966,20.75986576752943,19.651872259617708,0.4855341521369218,Cu,COMPLETE
4288,-11.904761904760544,2026-04-07 11:35:45.310981,2026-04-07 11:35:45.940408,0 days 00:00:00.629427,32.41555489655078,16.002029294002675,0.271484691449897,Cu,PRUNED
4289,-1.0,2026-04-07 11:35:45.396618,2026-04-07 11:35:46.163752,0 days 00:00:00.767134,30.545153395848242,19.903851374238524,0.9307217311647156,Au,COMPLETE
4290,-1.0,2026-04-07 11:35:45.565671,2026-04-07 11:35:46.263942,0 days 00:00:00.698271,20.000355063846598,18.089336639816498,0.8168534960906142,Au,COMPLETE
4291,-1.0,2026-04-07 11:35:45.975292,2026-04-07 11:35:46.675145,0 days 00:00:00.699853,31.54321894557902,17.77875778570715,0.8118385962715112,Au,COMPLETE
4292,0.166666666666664,2026-04-07 11:35:46.041667,2026-04-07 11:35:46.833456,0 days 00:00:00.791789,94.60047721630761,19.555358148730996,1.1342602829472213,Ag,PRUNED
4293,0.0,2026-04-07 11:35:46.065047,2026-04-07 11:35:46.737749,0 days 00:00:00.672702,21.171709661924133,17.105275594089782,0.34269073254391486,Au,PRUNED
4294,0.0,2026-04-07 11:35:46.091676,2026-04-07 11:35:46.892222,0 days 00:00:00.800546,20.122393455336887,18.088252043402,0.8363842461053226,Au,PRUNED
4295,-1.0,2026-04-07 11:35:46.103934,2026-04-07 11:35:46.736279,0 days 00:00:00.632345,40.06780882414345,16.40581497926612,0.40765986136918364,Au,COMPLETE
4296,-1.0,2026-04-07 11:35:46.127401,2026-04-07 11:35:46.738761,0 days 00:00:00.611360,30.3577969335971,18.202472170062784,0.7195118686582135,Au,COMPLETE
4297,0.0,2026-04-07 11:35:46.314704,2026-04-07 11:35:46.939922,0 days 00:00:00.625218,20.509476573824166,17.49424245057945,0.19701731657213026,Au,PRUNED
4298,-1.0,2026-04-07 11:35:46.382918,2026-04-07 11:35:46.832374,0 days 00:00:00.449456,20.52515081513076,16.49040638312537,0.12888717601290178,Au,COMPLETE
4299,0.0,2026-04-07 11:35:46.863616,2026-04-07 11:35:47.575714,0 days 00:00:00.712098,35.43863055613801,19.927071326771763,0.8287639992646982,Au,PRUNED
4300,-1.0,2026-04-07 11:35:46.946584,2026-04-07 11:35:47.673687,0 days 00:00:00.727103,31.37077260042543,17.29609219940413,0.7204177035912762,Au,COMPLETE
4301,0.0,2026-04-07 11:35:46.991275,2026-04-07 11:35:47.722806,0 days 00:00:00.731531,35.359046946521254,17.143629626606128,0.6223593505755333,Au,PRUNED
4302,-1.0,2026-04-07 11:35:47.002915,2026-04-07 11:35:47.610518,0 days 00:00:00.607603,20.232710138140824,18.332634180779078,0.8606852057531444,Ag,COMPLETE
4303,79.93827160493589,2026-04-07 11:35:47.019172,2026-04-07 11:35:47.835698,0 days 00:00:00.816526,32.23793942995975,17.28990938130285,0.42307232352439395,Au,PRUNED
4304,0.0,2026-04-07 11:35:47.051906,2026-04-07 11:35:47.892898,0 days 00:00:00.840992,35.57629036950585,17.723596677703284,0.40034506211690996,Au,PRUNED
4305,-1.0,2026-04-07 11:35:47.149172,2026-04-07 11:35:47.736968,0 days 00:00:00.587796,20.766763779392733,17.397263599180086,0.5426795957366355,Au,COMPLETE
4306,0.0,2026-04-07 11:35:47.273964,2026-04-07 11:35:48.016612,0 days 00:00:00.742648,31.90707657603223,17.43581869010679,0.9695773505401502,Au,PRUNED
4307,-1.0,2026-04-07 11:35:47.672673,2026-04-07 11:35:48.376637,0 days 00:00:00.703964,33.197193166218526,19.91385741331817,0.503288906401161,Au,COMPLETE
4308,-389.0804597700614,2026-04-07 11:35:47.813699,2026-04-07 11:35:48.609013,0 days 00:00:00.795314,20.311739791085333,19.859583826517632,0.7448893526868564,Au,COMPLETE
4309,-1.0,2026-04-07 11:35:47.926381,2026-04-07 11:35:48.492784,0 days 00:00:00.566403,35.57858841593329,19.967160568093405,0.7735776415957282,Au,COMPLETE
4310,-392.07175925920484,2026-04-07 11:35:47.939730,2026-04-07 11:35:48.513605,0 days 00:00:00.573875,20.4260001771729,19.89331983704134,0.6576723645697469,Au,COMPLETE
4311,-1.0,2026-04-07 11:35:47.954864,2026-04-07 11:35:48.702919,0 days 00:00:00.748055,42.348737875256546,19.99428060513748,0.9111509728955587,Au,COMPLETE
4312,-1.0,2026-04-07 11:35:47.978496,2026-04-07 11:35:48.636671,0 days 00:00:00.658175,113.91136920143282,7.816430219353894,0.11051115106609866,Au,COMPLETE
4313,-1.0,2026-04-07 11:35:48.034900,2026-04-07 11:35:48.715400,0 days 00:00:00.680500,30.269003358902243,17.23413363614876,0.9231597153497375,Au,COMPLETE
4314,25.062656641603635,2026-04-07 11:35:48.087142,2026-04-07 11:35:48.788920,0 days 00:00:00.701778,67.34094091944606,9.51242123352654,0.5084258911935937,Au,PRUNED
4315,0.0,2026-04-07 11:35:48.569730,2026-04-07 11:35:49.306821,0 days 00:00:00.737091,51.255047505704844,17.94156522229999,0.6609383509976419,Au,PRUNED
4316,-1.0,2026-04-07 11:35:48.637377,2026-04-07 11:35:49.235313,0 days 00:00:00.597936,45.16007826612689,17.256841965089144,1.0607036887221841,Au,COMPLETE
4317,0.0,2026-04-07 11:35:48.734735,2026-04-07 11:35:49.565246,0 days 00:00:00.830511,28.57284574375985,19.86169077117614,0.371440570204562,Au,PRUNED
4318,-1.0,2026-04-07 11:35:48.881750,2026-04-07 11:35:49.494363,0 days 00:00:00.612613,24.124287548064935,19.972413892405584,0.38587374923531875,Au,COMPLETE
4319,-1.0,2026-04-07 11:35:48.904258,2026-04-07 11:35:49.444645,0 days 00:00:00.540387,20.131801695019618,16.17968294700282,0.8277936344668848,Au,COMPLETE
4320,0.0,2026-04-07 11:35:48.916071,2026-04-07 11:35:49.539360,0 days 00:00:00.623289,20.641538508350063,16.934204740699585,0.6250753103837658,Au,PRUNED
4321,-448.16272965872184,2026-04-07 11:35:48.986529,2026-04-07 11:35:49.765242,0 days 00:00:00.778713,21.769361964736873,19.908188433143554,0.23692480228096252,Au,COMPLETE
4322,-1.0,2026-04-07 11:35:48.974422,2026-04-07 11:35:49.841653,0 days 00:00:00.867231,20.245060364937782,19.733834796586788,0.7819624485246905,Au,COMPLETE
4323,0.0,2026-04-07 11:35:49.402921,2026-04-07 11:35:50.153583,0 days 00:00:00.750662,20.183952505450176,18.738363824140485,0.8470276966470508,Au,PRUNED
4324,-1.0,2026-04-07 11:35:49.490484,2026-04-07 11:35:49.964532,0 days 00:00:00.474048,20.919806933004153,18.094388261600102,0.8643544824647688,Au,COMPLETE
4325,-1.0,2026-04-07 11:35:49.607233,2026-04-07 11:35:50.091132,0 days 00:00:00.483899,20.143090688372276,13.472561906680536,1.000380072306491,Au,COMPLETE
4326,-1.0,2026-04-07 11:35:49.628810,2026-04-07 11:35:50.165088,0 days 00:00:00.536278,36.645202105171286,15.280518271053445,0.872964923346143,Au,COMPLETE
4327,0.0,2026-04-07 11:35:49.703273,2026-04-07 11:35:50.403419,0 days 00:00:00.700146,35.98837928623239,19.97136188553346,1.0056536030287797,Au,PRUNED
4328,-1.6937669376693492,2026-04-07 11:35:49.876776,2026-04-07 11:35:50.460770,0 days 00:00:00.583994,117.494494637143,5.549802623833953,0.46289501038249226,Ag,PRUNED
4329,-1.0,2026-04-07 11:35:49.962650,2026-04-07 11:35:50.650605,0 days 00:00:00.687955,20.27648958321467,18.354201710650102,0.10349226525569671,Au,COMPLETE
4330,-1.5432098765429811,2026-04-07 11:35:50.007989,2026-04-07 11:35:50.651610,0 days 00:00:00.643621,23.435895581877688,19.844351787624827,0.19297077383876154,Au,PRUNED
4331,-1.0,2026-04-07 11:35:50.102570,2026-04-07 11:35:50.818697,0 days 00:00:00.716127,20.48491537747002,19.769036576550967,0.3070186212896127,Au,COMPLETE
4332,-1.0,2026-04-07 11:35:50.275533,2026-04-07 11:35:50.838744,0 days 00:00:00.563211,23.03166804685357,19.934837943604656,0.32538437084331945,Au,COMPLETE
4333,-1.0,2026-04-07 11:35:50.341072,2026-04-07 11:35:51.054670,0 days 00:00:00.713598,24.99560797539839,19.77506882552955,0.2810313783027288,Au,COMPLETE
4334,-1.0,2026-04-07 11:35:50.451529,2026-04-07 11:35:51.072498,0 days 00:00:00.620969,32.34243300876879,17.587847426715708,0.933928570975095,Au,COMPLETE
4335,0.0,2026-04-07 11:35:50.487973,2026-04-07 11:35:51.156012,0 days 00:00:00.668039,20.248665692717456,17.500140539605333,0.8352618091299644,Au,PRUNED
4336,-17.992424242422604,2026-04-07 11:35:50.578850,2026-04-07 11:35:51.228143,0 days 00:00:00.649293,36.5318265896191,17.102111442169132,0.824790927073014,Ag,PRUNED
