number,value,datetime_start,datetime_complete,duration,params_D2_nm,params_D3_nm,params_D4_nm,params_metal,state
1842,-1.0,2026-04-07 11:31:40.111218,2026-04-07 11:31:40.785072,0 days 00:00:00.673854,30.081661290733255,16.00172628731267,1.6400882715013776,Au,COMPLETE
1843,-1.0,2026-04-07 11:31:40.305638,2026-04-07 11:31:40.819920,0 days 00:00:00.514282,22.917863004092936,17.253093069176717,0.9795525485765669,Au,COMPLETE
1844,76.0340632603384,2026-04-07 11:31:40.415076,2026-04-07 11:31:40.859814,0 days 00:00:00.444738,39.80032416221934,13.9769773290683,1.484771010700007,Au,PRUNED
1845,0.0,2026-04-07 11:31:40.450588,2026-04-07 11:31:41.127497,0 days 00:00:00.676909,20.272562455151252,17.165350551083804,1.5282991384354672,Au,PRUNED
1846,0.0,2026-04-07 11:31:40.558047,2026-04-07 11:31:41.162652,0 days 00:00:00.604605,45.70535576313377,16.770801709266323,1.3325383530831965,Au,PRUNED
1847,-10.41666666666551,2026-04-07 11:31:40.687704,2026-04-07 11:31:41.299544,0 days 00:00:00.611840,30.107180485198754,13.057605439352951,1.491078935028913,Au,PRUNED
1848,-1.0,2026-04-07 11:31:40.704004,2026-04-07 11:31:41.195231,0 days 00:00:00.491227,21.769811706323726,19.574808081700823,1.7171888834028286,Au,COMPLETE
1849,0.0,2026-04-07 11:31:40.727804,2026-04-07 11:31:41.125467,0 days 00:00:00.397663,45.75187598025786,18.11506554942923,1.3108712611049562,Au,PRUNED
1850,-1.0,2026-04-07 11:31:40.937817,2026-04-07 11:31:41.631055,0 days 00:00:00.693238,37.99172169028033,16.371423013227407,1.3252897681142362,Au,COMPLETE
1851,0.0,2026-04-07 11:31:40.964975,2026-04-07 11:31:41.688228,0 days 00:00:00.723253,41.63305698844245,17.03742625112556,1.219970597367563,Au,PRUNED
1852,0.0,2026-04-07 11:31:41.024006,2026-04-07 11:31:41.934394,0 days 00:00:00.910388,21.15556365324179,15.549212856425626,1.6165549517803803,Au,PRUNED
1853,0.0,2026-04-07 11:31:41.249736,2026-04-07 11:31:41.973466,0 days 00:00:00.723730,39.11990366099211,18.5778714320344,1.585271927919536,Au,PRUNED
1854,-300.72463768112675,2026-04-07 11:31:41.279009,2026-04-07 11:31:41.756628,0 days 00:00:00.477619,22.800402548671812,15.556047840260964,1.9152909466979604,Au,COMPLETE
1855,0.0,2026-04-07 11:31:41.343403,2026-04-07 11:31:41.787587,0 days 00:00:00.444184,38.027645826990664,15.90709109081239,1.3659829979184441,Au,PRUNED
1856,81.49509803921329,2026-04-07 11:31:41.407335,2026-04-07 11:31:42.283383,0 days 00:00:00.876048,28.21908382183717,16.608544529199065,1.5855790294586567,Au,PRUNED
1857,-1.0,2026-04-07 11:31:41.446170,2026-04-07 11:31:41.689228,0 days 00:00:00.243058,38.81830083180088,17.154425159408397,1.6790889750102487,Au,COMPLETE
1858,0.0,2026-04-07 11:31:41.756628,2026-04-07 11:31:42.346510,0 days 00:00:00.589882,21.474445281889697,15.853503602303924,1.6613286446848825,Au,PRUNED
1859,0.0,2026-04-07 11:31:41.864103,2026-04-07 11:31:42.721755,0 days 00:00:00.857652,20.440451704554604,14.722747488248581,1.8916076520995686,Au,PRUNED
1860,82.10784313725247,2026-04-07 11:31:41.884893,2026-04-07 11:31:42.501540,0 days 00:00:00.616647,26.794479579078555,16.662370210219784,1.8269132723671637,Au,PRUNED
1861,79.93827160493589,2026-04-07 11:31:41.915507,2026-04-07 11:31:42.587757,0 days 00:00:00.672250,30.5912191154879,16.144092460457216,1.9810190911917331,Au,PRUNED
1862,0.0,2026-04-07 11:31:41.944543,2026-04-07 11:31:42.639963,0 days 00:00:00.695420,32.592899676584395,19.82271003032789,1.6634302120887898,Au,PRUNED
1863,-1.0,2026-04-07 11:31:42.001317,2026-04-07 11:31:42.469474,0 days 00:00:00.468157,21.722040509474013,14.740502834358281,1.9098580423533609,Au,COMPLETE
1864,0.0,2026-04-07 11:31:42.059902,2026-04-07 11:31:42.802407,0 days 00:00:00.742505,40.54499887111753,16.96881083526743,1.8656741250655124,Au,PRUNED
1865,-1.0,2026-04-07 11:31:42.393710,2026-04-07 11:31:43.163519,0 days 00:00:00.769809,25.33276743008434,16.055167447167985,1.9398985563257964,Au,COMPLETE
1866,-1.0,2026-04-07 11:31:42.383521,2026-04-07 11:31:43.064251,0 days 00:00:00.680730,22.96344348160772,13.864592779405665,0.8343600624383529,Au,COMPLETE
1867,80.57598039215449,2026-04-07 11:31:42.554404,2026-04-07 11:31:43.334063,0 days 00:00:00.779659,30.135789616836863,16.194494479401587,1.3456405103733453,Au,PRUNED
1868,-1.0,2026-04-07 11:31:42.642465,2026-04-07 11:31:43.193114,0 days 00:00:00.550649,35.22268687966791,16.50462265213556,1.6114579540662197,Au,COMPLETE
1869,-1.0,2026-04-07 11:31:42.662194,2026-04-07 11:31:43.227582,0 days 00:00:00.565388,20.99240220631451,17.353766263961553,1.6541067583346962,Au,COMPLETE
1870,-1.0,2026-04-07 11:31:42.725092,2026-04-07 11:31:43.228584,0 days 00:00:00.503492,26.5907983451931,15.70237857622497,1.9912965012307007,Au,COMPLETE
1871,-1.0,2026-04-07 11:31:42.801407,2026-04-07 11:31:43.148286,0 days 00:00:00.346879,37.47465735430961,14.09596751171846,1.5935096576092014,Au,COMPLETE
1872,-1.0,2026-04-07 11:31:42.879735,2026-04-07 11:31:43.259755,0 days 00:00:00.380020,27.893081705372534,14.696394345934488,1.6505947087265025,Au,COMPLETE
1873,-1.0,2026-04-07 11:31:43.187378,2026-04-07 11:31:43.666169,0 days 00:00:00.478791,41.48702303874329,16.011214299303045,1.725523476975077,Cu,COMPLETE
1874,-1.0,2026-04-07 11:31:43.389921,2026-04-07 11:31:43.856236,0 days 00:00:00.466315,21.007946247328416,13.225182597297053,1.5672255881760038,Au,COMPLETE
1875,-1.0,2026-04-07 11:31:43.400197,2026-04-07 11:31:43.809564,0 days 00:00:00.409367,39.795908285545224,8.629632153530382,0.91183433516436,Au,COMPLETE
1876,-188.8204225351978,2026-04-07 11:31:43.421874,2026-04-07 11:31:44.233801,0 days 00:00:00.811927,24.34488243075374,13.633195882943912,1.6522825518174376,Au,COMPLETE
1877,0.0,2026-04-07 11:31:43.439667,2026-04-07 11:31:43.919170,0 days 00:00:00.479503,20.12902052922419,17.151632507305465,1.6106442343462868,Au,PRUNED
1878,-1.0,2026-04-07 11:31:43.471915,2026-04-07 11:31:43.965822,0 days 00:00:00.493907,25.0651114577729,9.616690360788406,1.9741669748164021,Ag,COMPLETE
1879,-1.0,2026-04-07 11:31:43.463590,2026-04-07 11:31:43.882502,0 days 00:00:00.418912,20.83588298418205,13.847887797207674,1.6377777639113038,Au,COMPLETE
1880,-1.0,2026-04-07 11:31:43.583427,2026-04-07 11:31:44.117920,0 days 00:00:00.534493,20.079261468772373,12.39970721124973,1.8858850408396342,Au,COMPLETE
1881,1.2254901960782871,2026-04-07 11:31:43.784728,2026-04-07 11:31:44.604657,0 days 00:00:00.819929,26.009158318356864,16.517251496950394,1.6566764689746138,Au,PRUNED
1882,-1.0,2026-04-07 11:31:43.964820,2026-04-07 11:31:44.606657,0 days 00:00:00.641837,20.86678819528976,13.623649737168313,1.3583262703123336,Au,COMPLETE
1883,0.0,2026-04-07 11:31:44.085479,2026-04-07 11:31:44.666721,0 days 00:00:00.581242,42.84170475995985,18.380775894494672,1.9929148199776268,Au,PRUNED
1884,-1.0,2026-04-07 11:31:44.156684,2026-04-07 11:31:44.705406,0 days 00:00:00.548722,20.63141706247705,14.154279682861711,1.3339780342358407,Au,COMPLETE
1885,3.858024691357739,2026-04-07 11:31:44.174978,2026-04-07 11:31:44.896982,0 days 00:00:00.722004,32.90398982651867,13.298400132647075,1.9796887369852267,Au,PRUNED
1886,-1.0,2026-04-07 11:31:44.244477,2026-04-07 11:31:44.775332,0 days 00:00:00.530855,34.83074351808917,13.766656817834113,1.7018003821741856,Au,COMPLETE
1887,-1.0,2026-04-07 11:31:44.280467,2026-04-07 11:31:44.801026,0 days 00:00:00.520559,21.86655622652849,18.720314456215686,1.7966028779306107,Au,COMPLETE
1888,-1.0,2026-04-07 11:31:44.432631,2026-04-07 11:31:45.026821,0 days 00:00:00.594190,21.045455822428316,11.246907493957416,1.4744367204836033,Au,COMPLETE
1889,3.858024691357739,2026-04-07 11:31:44.725749,2026-04-07 11:31:45.395029,0 days 00:00:00.669280,37.15393030885537,12.779004705438222,1.4424493958813944,Au,PRUNED
1890,-0.6858710562414153,2026-04-07 11:31:44.820564,2026-04-07 11:31:45.745466,0 days 00:00:00.924902,117.85240522612821,7.678348845222743,1.1347297325427763,Au,PRUNED
1891,78.4313725490173,2026-04-07 11:31:44.873604,2026-04-07 11:31:45.465104,0 days 00:00:00.591500,36.4757775528516,14.11805994327267,1.4677935802069313,Au,PRUNED
1892,0.0,2026-04-07 11:31:44.922556,2026-04-07 11:31:45.554193,0 days 00:00:00.631637,39.58437993255433,14.280598085562232,1.692466421337987,Au,PRUNED
1893,-1.0,2026-04-07 11:31:44.945108,2026-04-07 11:31:45.441212,0 days 00:00:00.496104,33.87555359316181,11.828120359529334,1.6760951292915305,Au,COMPLETE
1894,0.0,2026-04-07 11:31:44.976523,2026-04-07 11:31:45.504785,0 days 00:00:00.528262,20.487375840180576,15.659197578332376,1.586917138022531,Au,PRUNED
1895,-1.0,2026-04-07 11:31:45.080380,2026-04-07 11:31:45.611779,0 days 00:00:00.531399,37.630963494532494,11.891002049213615,1.6281557783470195,Au,COMPLETE
1896,-4.084967320261118,2026-04-07 11:31:45.261874,2026-04-07 11:31:45.988908,0 days 00:00:00.727034,36.34083303974236,11.63717532635206,1.165682986637488,Au,PRUNED
1897,0.0,2026-04-07 11:31:45.474935,2026-04-07 11:31:46.175646,0 days 00:00:00.700711,20.778303374744173,15.41610689007868,1.742135464660804,Au,PRUNED
1898,0.0,2026-04-07 11:31:45.528725,2026-04-07 11:31:46.207682,0 days 00:00:00.678957,20.00449059201021,16.96323199837363,1.4779737537941717,Au,PRUNED
1899,-1.0,2026-04-07 11:31:45.557196,2026-04-07 11:31:46.111806,0 days 00:00:00.554610,21.032400397981988,12.321868914799607,1.6069529596371188,Au,COMPLETE
1900,-1.0,2026-04-07 11:31:45.635604,2026-04-07 11:31:46.206299,0 days 00:00:00.570695,21.247131327574454,16.74018052402633,1.9487721182658828,Au,COMPLETE
1901,-1.0,2026-04-07 11:31:45.646879,2026-04-07 11:31:46.309786,0 days 00:00:00.662907,20.507062206602143,16.95948376488406,1.4272664031069289,Au,COMPLETE
1902,78.7377450980369,2026-04-07 11:31:45.750393,2026-04-07 11:31:46.380049,0 days 00:00:00.629656,35.816056099460255,13.379362123156092,1.8604095680448942,Au,PRUNED
1903,-1.0,2026-04-07 11:31:45.849638,2026-04-07 11:31:46.626767,0 days 00:00:00.777129,27.490485262857778,15.514931888221588,1.5760548866470394,Au,COMPLETE
1904,-1.0,2026-04-07 11:31:46.023203,2026-04-07 11:31:46.704642,0 days 00:00:00.681439,23.68936603145957,5.8899296466294295,1.6786175918781356,Cu,COMPLETE
1905,0.0,2026-04-07 11:31:46.253291,2026-04-07 11:31:46.830411,0 days 00:00:00.577120,20.868764469295854,13.817321579216236,1.3385650716531654,Au,PRUNED
1906,0.0,2026-04-07 11:31:46.313746,2026-04-07 11:31:47.040160,0 days 00:00:00.726414,21.230748864651105,15.121156176590434,1.3798934815651362,Au,PRUNED
1907,-1.0,2026-04-07 11:31:46.382546,2026-04-07 11:31:47.130003,0 days 00:00:00.747457,36.31864618453852,15.557846790999767,1.9148196199288252,Au,COMPLETE
1908,0.0,2026-04-07 11:31:46.457696,2026-04-07 11:31:47.160426,0 days 00:00:00.702730,21.241125204424083,14.723037532519777,1.3308276755987363,Au,PRUNED
1909,-310.05586592175297,2026-04-07 11:31:46.480077,2026-04-07 11:31:47.041664,0 days 00:00:00.561587,22.140979321333617,16.527338702192054,1.587862567132916,Au,COMPLETE
1910,-13.513513513512052,2026-04-07 11:31:46.530405,2026-04-07 11:31:47.222072,0 days 00:00:00.691667,23.35888110056503,15.565689895933,1.7797101890447529,Au,PRUNED
1911,-291.00529100526035,2026-04-07 11:31:46.847844,2026-04-07 11:31:47.552093,0 days 00:00:00.704249,22.124547579164844,15.690795582581611,1.9342833343930865,Au,COMPLETE
1912,-1.0,2026-04-07 11:31:46.916881,2026-04-07 11:31:47.610483,0 days 00:00:00.693602,21.47409949170198,15.05919785933318,1.9059600874679323,Au,COMPLETE
1913,-1.0,2026-04-07 11:31:46.957060,2026-04-07 11:31:47.563645,0 days 00:00:00.606585,21.615001557991242,14.803707459035714,1.7499830578105906,Au,COMPLETE
1914,4.6296296296292185,2026-04-07 11:31:47.211280,2026-04-07 11:31:47.802588,0 days 00:00:00.591308,34.757267183840945,19.749872779276025,1.4819983866159412,Ag,PRUNED
1915,-8.064516129031738,2026-04-07 11:31:47.223071,2026-04-07 11:31:47.715434,0 days 00:00:00.492363,24.9536209479122,14.77006723090139,1.2312290631568348,Cu,PRUNED
1916,-1.0,2026-04-07 11:31:47.250062,2026-04-07 11:31:47.689161,0 days 00:00:00.439099,26.88518323923389,14.600562361023787,1.503746229113429,Cu,COMPLETE
1917,0.0,2026-04-07 11:31:47.283473,2026-04-07 11:31:47.766441,0 days 00:00:00.482968,35.170691959441534,18.795206977474187,1.4123728327455731,Au,PRUNED
1918,0.0,2026-04-07 11:31:47.393417,2026-04-07 11:31:48.089827,0 days 00:00:00.696410,53.61498419167632,17.126635189478982,1.6442914282340622,Au,PRUNED
1919,0.0,2026-04-07 11:31:47.769522,2026-04-07 11:31:48.472545,0 days 00:00:00.703023,34.91879836570647,16.946897411263596,1.7955963235280366,Au,PRUNED
1920,-1.0,2026-04-07 11:31:47.825507,2026-04-07 11:31:48.359692,0 days 00:00:00.534185,55.28795021703834,11.546946173538112,1.2792002338968558,Au,COMPLETE
1921,-11.363636363634987,2026-04-07 11:31:47.863594,2026-04-07 11:31:48.473544,0 days 00:00:00.609950,23.020936037831266,16.551096484399825,1.8294709303587182,Au,PRUNED
1922,-1.0,2026-04-07 11:31:47.881250,2026-04-07 11:31:48.286347,0 days 00:00:00.405097,20.516274504707884,14.943004236138528,1.8946751404260107,Au,COMPLETE
1923,-1.0,2026-04-07 11:31:47.904386,2026-04-07 11:31:48.406477,0 days 00:00:00.502091,20.01806138315292,17.952002117854477,1.7059217824426145,Au,COMPLETE
1924,-1.0,2026-04-07 11:31:47.973557,2026-04-07 11:31:48.406477,0 days 00:00:00.432920,23.753277675238255,13.662991826765055,1.7869300503835657,Ag,COMPLETE
1925,-1.0,2026-04-07 11:31:48.057047,2026-04-07 11:31:48.405903,0 days 00:00:00.348856,34.79424804841807,15.814835661880284,1.8683554009754049,Au,COMPLETE
1926,0.0,2026-04-07 11:31:48.138679,2026-04-07 11:31:48.818511,0 days 00:00:00.679832,20.067362637791433,15.553051782103497,1.7804953782696136,Au,PRUNED
1927,-1.0,2026-04-07 11:31:48.492983,2026-04-07 11:31:49.111682,0 days 00:00:00.618699,24.782642564858406,12.87860008261567,1.882813071714394,Au,COMPLETE
1928,-1.0,2026-04-07 11:31:48.476974,2026-04-07 11:31:49.080008,0 days 00:00:00.603034,20.384055795288813,14.519211552488299,1.6800489396871752,Au,COMPLETE
1929,0.0,2026-04-07 11:31:48.518718,2026-04-07 11:31:49.119908,0 days 00:00:00.601190,20.052946508885384,10.83612155764497,1.762135261029802,Au,PRUNED
1930,-1.0,2026-04-07 11:31:48.567981,2026-04-07 11:31:49.038288,0 days 00:00:00.470307,35.46362108020284,12.099681080407613,1.9995594358149487,Au,COMPLETE
1931,-1.0,2026-04-07 11:31:48.580855,2026-04-07 11:31:49.229352,0 days 00:00:00.648497,20.702914684317832,19.71694264953951,1.864126095385316,Au,COMPLETE
1932,79.6568627450957,2026-04-07 11:31:48.596064,2026-04-07 11:31:49.363797,0 days 00:00:00.767733,33.72845387534994,13.955351772792792,1.7506677950206049,Au,PRUNED
1933,0.0,2026-04-07 11:31:48.636734,2026-04-07 11:31:49.307875,0 days 00:00:00.671141,46.8186683486865,15.817021759094137,1.563555145788016,Au,PRUNED
1934,-1.0,2026-04-07 11:31:48.932803,2026-04-07 11:31:49.832558,0 days 00:00:00.899755,26.245936606008602,13.519711775609267,1.9705193600244975,Au,COMPLETE
1935,-1.0,2026-04-07 11:31:49.225514,2026-04-07 11:31:49.740706,0 days 00:00:00.515192,29.248145450156198,14.091920523249273,1.9975947461691048,Au,COMPLETE
1936,0.0,2026-04-07 11:31:49.264107,2026-04-07 11:31:49.795793,0 days 00:00:00.531686,38.35780720958023,16.425917061343604,1.8890934141500912,Au,PRUNED
1937,-12.096774193546826,2026-04-07 11:31:49.320135,2026-04-07 11:31:50.050057,0 days 00:00:00.729922,23.11336730477025,17.27318376226932,1.35278227343701,Au,PRUNED
1938,-1.0,2026-04-07 11:31:49.405165,2026-04-07 11:31:49.925554,0 days 00:00:00.520389,20.80673220663829,17.095232429215386,1.6571576347806316,Au,COMPLETE
1939,0.0,2026-04-07 11:31:49.366581,2026-04-07 11:31:49.924551,0 days 00:00:00.557970,37.36795923565367,15.675804632049802,1.9909949267684055,Au,PRUNED
1940,-1.0,2026-04-07 11:31:49.448798,2026-04-07 11:31:49.891632,0 days 00:00:00.442834,33.328578317229386,17.517713909454496,1.4414415901454953,Au,COMPLETE
1941,-1.0,2026-04-07 11:31:49.475324,2026-04-07 11:31:49.969103,0 days 00:00:00.493779,30.065747101770288,10.204034323170651,1.1244070408659794,Cu,COMPLETE
1942,82.41421568627209,2026-04-07 11:31:49.987361,2026-04-07 11:31:51.027659,0 days 00:00:01.040298,24.690235537552258,18.29738925524044,1.983378195271195,Au,PRUNED
1943,0.0,2026-04-07 11:31:50.022465,2026-04-07 11:31:50.659439,0 days 00:00:00.636974,41.14360392039143,15.956538447794086,1.4767920028870125,Au,PRUNED
1944,-1.0,2026-04-07 11:31:50.064721,2026-04-07 11:31:50.659439,0 days 00:00:00.594718,28.218940612635063,13.911839018688035,1.3542644704353266,Ag,COMPLETE
1945,-1.0,2026-04-07 11:31:50.083091,2026-04-07 11:31:50.590815,0 days 00:00:00.507724,37.135902008006894,16.69821817228193,1.693482917396656,Au,COMPLETE
1946,-1.0,2026-04-07 11:31:50.128088,2026-04-07 11:31:50.549062,0 days 00:00:00.420974,21.33430698056842,15.163812947984923,1.4588243100829414,Au,COMPLETE
1947,-12.626262626261097,2026-04-07 11:31:50.142836,2026-04-07 11:31:50.736175,0 days 00:00:00.593339,24.173998474627243,15.902315804649364,1.619245075826093,Au,PRUNED
1948,0.0,2026-04-07 11:31:50.158045,2026-04-07 11:31:50.687873,0 days 00:00:00.529828,36.70805949831816,15.54569564348378,1.5595194517614626,Au,PRUNED
1949,0.0,2026-04-07 11:31:50.207514,2026-04-07 11:31:50.775646,0 days 00:00:00.568132,20.36763923404702,17.24543780996391,1.8930776664744176,Au,PRUNED
1950,-1.0,2026-04-07 11:31:50.754988,2026-04-07 11:31:51.344497,0 days 00:00:00.589509,21.090331155688016,15.92473170916564,1.0626921979772996,Au,COMPLETE
1951,-1.0,2026-04-07 11:31:50.832920,2026-04-07 11:31:51.344497,0 days 00:00:00.511577,20.517487074170802,16.562251437378425,1.660439046351645,Au,COMPLETE
1952,-1.0,2026-04-07 11:31:50.797894,2026-04-07 11:31:51.322726,0 days 00:00:00.524832,32.73417318806965,19.753661965536555,1.7361476419850763,Cu,COMPLETE
1953,-1.0,2026-04-07 11:31:50.881593,2026-04-07 11:31:51.339865,0 days 00:00:00.458272,39.12568225974938,13.300214854575188,1.7631362893523719,Au,COMPLETE
1954,-1.0,2026-04-07 11:31:50.891648,2026-04-07 11:31:51.337865,0 days 00:00:00.446217,22.168339917285667,14.243318448915561,1.745522850260126,Au,COMPLETE
1955,-1.0,2026-04-07 11:31:50.895727,2026-04-07 11:31:51.468098,0 days 00:00:00.572371,21.45153323610622,15.853529164014553,1.702035700380297,Au,COMPLETE
1956,-2.2522522522520085,2026-04-07 11:31:50.942312,2026-04-07 11:31:51.764225,0 days 00:00:00.821913,33.35815041708029,12.232294379907792,1.7459682784899655,Au,PRUNED
1957,-1.0,2026-04-07 11:31:51.090068,2026-04-07 11:31:51.566295,0 days 00:00:00.476227,21.8623388695072,15.105694980849702,1.7272497893383436,Au,COMPLETE
1958,-0.5827505827505663,2026-04-07 11:31:51.433428,2026-04-07 11:31:52.173231,0 days 00:00:00.739803,51.90317478064817,13.647729544245063,1.4990473224386407,Au,PRUNED
1959,-12.06140350877066,2026-04-07 11:31:51.502925,2026-04-07 11:31:52.205469,0 days 00:00:00.702544,53.137362287826605,2.4020717769700983,1.58292384251475,Cu,PRUNED
1960,-301.22950819668824,2026-04-07 11:31:51.534443,2026-04-07 11:31:52.286704,0 days 00:00:00.752261,21.80927431316495,16.805607689797473,1.2607834811301615,Au,COMPLETE
1961,-1.0,2026-04-07 11:31:51.568634,2026-04-07 11:31:52.155814,0 days 00:00:00.587180,39.80509388494589,16.588417784774553,0.8878549570522117,Au,COMPLETE
1962,-17.992424242422604,2026-04-07 11:31:51.581062,2026-04-07 11:31:52.258931,0 days 00:00:00.677869,39.832214375774,16.179348330402558,1.5820248734834692,Ag,PRUNED
1963,-1.0,2026-04-07 11:31:51.652617,2026-04-07 11:31:52.088460,0 days 00:00:00.435843,41.004232750372296,18.345197550221496,1.7672759253025505,Au,COMPLETE
1964,-1.0,2026-04-07 11:31:51.730197,2026-04-07 11:31:52.235900,0 days 00:00:00.505703,21.318075741758594,14.893256513238898,1.9614534894755384,Au,COMPLETE
1965,77.5122549019585,2026-04-07 11:31:51.829442,2026-04-07 11:31:52.491032,0 days 00:00:00.661590,38.57550376170481,13.897853998112227,1.4869145065803797,Au,PRUNED
1966,-1.0,2026-04-07 11:31:52.289706,2026-04-07 11:31:52.808607,0 days 00:00:00.518901,25.56783623898174,7.651051041192494,0.432496338093889,Ag,COMPLETE
1967,-13.888888888887346,2026-04-07 11:31:52.311253,2026-04-07 11:31:52.872238,0 days 00:00:00.560985,23.928585789419085,16.021305788417923,1.1786341610754814,Au,PRUNED
1968,79.0441176470565,2026-04-07 11:31:52.379317,2026-04-07 11:31:52.904196,0 days 00:00:00.524879,37.190493966903546,13.510996072534349,1.093082544801047,Au,PRUNED
1969,-187.13450292396354,2026-04-07 11:31:52.417933,2026-04-07 11:31:53.124481,0 days 00:00:00.706548,21.16481426940283,17.930547303279205,1.2581715241373237,Cu,COMPLETE
1970,-1.0,2026-04-07 11:31:52.437816,2026-04-07 11:31:52.887485,0 days 00:00:00.449669,22.4835358802943,15.995970042266627,1.255139786030096,Au,COMPLETE
1971,1.3020833333331705,2026-04-07 11:31:52.453614,2026-04-07 11:31:52.901771,0 days 00:00:00.448157,25.153213767226188,17.25109812536346,1.3765930315599584,Au,PRUNED
1972,-1.0,2026-04-07 11:31:52.568068,2026-04-07 11:31:53.121398,0 days 00:00:00.553330,29.443956972902985,15.845942984402502,1.0365803227870685,Au,COMPLETE
1973,0.0,2026-04-07 11:31:52.582208,2026-04-07 11:31:53.243952,0 days 00:00:00.661744,33.4439165205673,19.337337458308454,1.2818980787707581,Au,PRUNED
1974,-1.0,2026-04-07 11:31:52.932456,2026-04-07 11:31:53.765909,0 days 00:00:00.833453,21.394435232892583,12.456712496183284,1.6333231399810704,Cu,COMPLETE
1975,-1.0,2026-04-07 11:31:52.984067,2026-04-07 11:31:53.507318,0 days 00:00:00.523251,32.59269749129494,19.837617014930952,1.4195672519803981,Au,COMPLETE
1976,-1.0,2026-04-07 11:31:53.054043,2026-04-07 11:31:53.569342,0 days 00:00:00.515299,33.47638911552309,17.80313606030851,0.9272702804533254,Au,COMPLETE
1977,0.8012820512819896,2026-04-07 11:31:53.169435,2026-04-07 11:31:53.831549,0 days 00:00:00.662114,36.896665485686526,15.351407203448991,1.1491426825110564,Cu,PRUNED
1978,-1.0,2026-04-07 11:31:53.187943,2026-04-07 11:31:53.751587,0 days 00:00:00.563644,26.71065149042529,14.636198927282852,1.563832363509285,Cu,COMPLETE
1979,-1.0,2026-04-07 11:31:53.281743,2026-04-07 11:31:53.860602,0 days 00:00:00.578859,20.071924599301113,19.13697009358305,1.372104851243418,Cu,COMPLETE
1980,-9.027777777777175,2026-04-07 11:31:53.330340,2026-04-07 11:31:53.859021,0 days 00:00:00.528681,23.52429142788266,15.98251509066369,1.236311664840419,Cu,PRUNED
