number,value,datetime_start,datetime_complete,duration,params_D2_nm,params_D3_nm,params_D4_nm,params_metal,state
0,0.0,2025-11-13 12:25:34.241048,2025-11-13 12:25:38.718323,0 days 00:00:04.477275,119.99018837026208,18.259653268002275,1.0870691912346175,Cu,COMPLETE
1,-20.461309523805895,2025-11-13 12:25:34.269357,2025-11-13 12:25:38.849221,0 days 00:00:04.579864,85.1646542081692,6.914827566304099,0.9742322707163492,Ag,COMPLETE
2,-25.84388185653363,2025-11-13 12:25:34.241048,2025-11-13 12:25:38.718323,0 days 00:00:04.477275,79.8547655036709,3.7238117783040066,1.7479800605051563,Ag,COMPLETE
3,54.39814814814663,2025-11-13 12:25:34.297416,2025-11-13 12:25:38.765291,0 days 00:00:04.467875,47.63551681487391,16.46262252763266,0.35966859172988297,Cu,COMPLETE
4,1.0883084577114266,2025-11-13 12:25:34.331260,2025-11-13 12:25:38.858184,0 days 00:00:04.526924,64.8258087977377,17.721264611593803,0.7163389133597076,Ag,COMPLETE
5,18.61001317523027,2025-11-13 12:25:34.358153,2025-11-13 12:25:38.772663,0 days 00:00:04.414510,92.77954329484734,8.447670544598248,0.43720824574552475,Au,COMPLETE
6,-13.005780346819277,2025-11-13 12:25:34.367714,2025-11-13 12:25:38.805869,0 days 00:00:04.438155,26.904220662719386,18.069674180826816,0.3140397309162333,Cu,COMPLETE
7,26.399491094147184,2025-11-13 12:25:34.395459,2025-11-13 12:25:38.948271,0 days 00:00:04.552812,65.40326670646525,10.37711331176005,0.4874367834960027,Au,COMPLETE
8,-17.105263157892892,2025-11-13 12:25:38.789048,2025-11-13 12:25:39.124969,0 days 00:00:00.335921,85.16631339248843,12.207221607496626,0.8901417263299986,Ag,COMPLETE
9,-2.0693041526374434,2025-11-13 12:25:38.772341,2025-11-13 12:25:39.136993,0 days 00:00:00.364652,90.42788360499075,3.538429992651332,0.6681311772867293,Cu,COMPLETE
10,-1.4844804318488287,2025-11-13 12:25:39.096474,2025-11-13 12:25:39.431010,0 days 00:00:00.334536,118.20027027562281,0.6382684628369262,1.8826011059664056,Ag,COMPLETE
11,-1.5206812652067905,2025-11-13 12:25:39.180698,2025-11-13 12:25:39.631958,0 days 00:00:00.451260,116.42042183037555,1.3594507267334883,1.7769611647113388,Ag,COMPLETE
12,-1.5169902912621185,2025-11-13 12:25:39.203415,2025-11-13 12:25:39.649252,0 days 00:00:00.445837,118.65125757717982,1.4170426069964037,1.8772738932064925,Ag,COMPLETE
13,-26.74897119340891,2025-11-13 12:25:39.227577,2025-11-13 12:25:39.696924,0 days 00:00:00.469347,78.021089892032,5.725055388162296,1.3760089386703607,Ag,COMPLETE
14,-26.289682539676246,2025-11-13 12:25:39.248760,2025-11-13 12:25:39.702557,0 days 00:00:00.453797,78.98097055305482,5.855211368986092,1.332128816432587,Ag,COMPLETE
15,-26.66666666665953,2025-11-13 12:25:39.397773,2025-11-13 12:25:39.883469,0 days 00:00:00.485696,49.950046626594606,4.399378164435335,1.4237851456014943,Ag,COMPLETE
16,-25.49019607842531,2025-11-13 12:25:39.448207,2025-11-13 12:25:40.182687,0 days 00:00:00.734480,50.243919311218875,5.955659651498192,1.364200389331444,Ag,COMPLETE
17,-26.422764227635877,2025-11-13 12:25:39.486059,2025-11-13 12:25:40.062735,0 days 00:00:00.576676,51.97226710645124,5.829382650950035,1.4704984570652033,Ag,COMPLETE
18,0.0,2025-11-13 12:25:39.668171,2025-11-13 12:25:40.449449,0 days 00:00:00.781278,44.77438386499288,13.8971611529764,1.4589851662871371,Au,COMPLETE
19,-5.383895131085549,2025-11-13 12:25:39.916130,2025-11-13 12:25:40.434478,0 days 00:00:00.518348,30.02798226953483,13.442660687794977,1.62994449414952,Au,COMPLETE
20,-17.379679144383193,2025-11-13 12:25:39.966247,2025-11-13 12:25:40.497063,0 days 00:00:00.530816,30.060669935374246,11.915733273890254,1.3510461281936659,Au,COMPLETE
21,-7.022471910111609,2025-11-13 12:25:39.966247,2025-11-13 12:25:40.462604,0 days 00:00:00.496357,31.279888379384296,12.950977159778981,1.443413516504532,Au,COMPLETE
22,-187.06293706292405,2025-11-13 12:25:40.031398,2025-11-13 12:25:40.453605,0 days 00:00:00.422207,24.43283124108465,13.543175931956924,1.6151183753813054,Au,COMPLETE
23,2.4509803921566706,2025-11-13 12:25:40.078277,2025-11-13 12:25:40.559683,0 days 00:00:00.481406,32.00244868212165,13.73205095054689,1.5789367915165804,Au,COMPLETE
24,-15.773809523807282,2025-11-13 12:25:40.559683,2025-11-13 12:25:41.042773,0 days 00:00:00.483090,40.0809254547943,8.317448959963851,1.192515685346985,Ag,COMPLETE
25,-0.8865248226950103,2025-11-13 12:25:40.528436,2025-11-13 12:25:41.135843,0 days 00:00:00.607407,20.389044587646712,8.896840898535089,1.1687543175507051,Ag,COMPLETE
26,-25.67340067339563,2025-11-13 12:25:40.666110,2025-11-13 12:25:41.182884,0 days 00:00:00.516774,55.75066497197122,9.117953206069867,1.184604756635008,Ag,COMPLETE
27,-26.881720430101765,2025-11-13 12:25:40.697391,2025-11-13 12:25:41.135843,0 days 00:00:00.438452,57.75284279568161,8.871885846693438,1.1108167868751921,Ag,COMPLETE
28,-0.7122507122507,2025-11-13 12:25:40.728382,2025-11-13 12:25:41.514928,0 days 00:00:00.786546,71.94479457216019,16.02636286405382,0.8564037082700229,Au,COMPLETE
29,-2.098816405174759,2025-11-13 12:25:40.733442,2025-11-13 12:25:41.088593,0 days 00:00:00.355151,102.29307715957233,8.94578495411798,1.157986030423819,Ag,COMPLETE
30,-1.6401451702958991,2025-11-13 12:25:40.803163,2025-11-13 12:25:41.230407,0 days 00:00:00.427244,103.66846749087219,3.525363802623294,1.170235336112835,Ag,COMPLETE
31,-0.8300132802124702,2025-11-13 12:25:41.057287,2025-11-13 12:25:41.530575,0 days 00:00:00.473288,70.6884712345185,15.420999069201105,0.15650415482378066,Cu,COMPLETE
32,-28.846153846146578,2025-11-13 12:25:41.365978,2025-11-13 12:25:41.904034,0 days 00:00:00.538056,57.40783439182732,7.229625543205202,1.0155142485610407,Ag,COMPLETE
33,24.088541666666295,2025-11-13 12:25:41.432669,2025-11-13 12:25:41.997322,0 days 00:00:00.564653,56.58238648085221,19.63932572416798,1.6481877684974564,Ag,COMPLETE
34,-30.251141552503118,2025-11-13 12:25:41.470463,2025-11-13 12:25:41.793925,0 days 00:00:00.323462,60.70508597647013,6.986057494168386,1.018510207423254,Ag,COMPLETE
35,-26.09034267912293,2025-11-13 12:25:41.482698,2025-11-13 12:25:42.248964,0 days 00:00:00.766266,63.524755210253886,10.496978301446823,1.0474873332622021,Ag,COMPLETE
36,-25.81521739129862,2025-11-13 12:25:41.547723,2025-11-13 12:25:42.248964,0 days 00:00:00.701241,58.281764403182855,6.81813309179894,1.997129180945695,Ag,COMPLETE
37,-26.515151515145487,2025-11-13 12:25:41.563445,2025-11-13 12:25:42.169288,0 days 00:00:00.605843,59.26202106996297,7.236592760913195,1.5974968416147677,Ag,COMPLETE
38,-8.917589175891129,2025-11-13 12:25:41.778215,2025-11-13 12:25:42.446242,0 days 00:00:00.668027,60.21420359848342,10.56398602156951,1.0145599953580575,Cu,COMPLETE
39,-12.51584283903581,2025-11-13 12:25:42.329023,2025-11-13 12:25:42.767667,0 days 00:00:00.438644,42.89301306403337,11.302459444328932,0.7360138340169469,Cu,COMPLETE
40,-3.984063745019602,2025-11-13 12:25:42.344638,2025-11-13 12:25:42.952285,0 days 00:00:00.607647,38.46957281054105,11.608790296244756,0.7429692728247451,Au,COMPLETE
41,2.358490566037558,2025-11-13 12:25:42.344638,2025-11-13 12:25:42.952285,0 days 00:00:00.607647,42.306967000158785,11.65357041062293,0.9369613959959786,Au,COMPLETE
42,-12.254901960783414,2025-11-13 12:25:42.415424,2025-11-13 12:25:42.858613,0 days 00:00:00.443189,40.04844843022342,7.41479730468242,0.7856318605355657,Au,COMPLETE
43,-35.81871345027982,2025-11-13 12:25:42.532034,2025-11-13 12:25:43.303449,0 days 00:00:00.771415,75.60230077132316,4.851276267185592,0.6109781800869742,Ag,COMPLETE
44,-32.051282051272224,2025-11-13 12:25:42.565053,2025-11-13 12:25:43.196306,0 days 00:00:00.631253,77.48766514756952,4.777617739027296,0.9576302776888345,Ag,COMPLETE
45,-7.864792503346103,2025-11-13 12:25:42.597696,2025-11-13 12:25:43.132519,0 days 00:00:00.534823,37.00661919989837,11.551890712305896,0.7263664257398248,Au,COMPLETE
46,-33.46994535518047,2025-11-13 12:25:42.767667,2025-11-13 12:25:43.285352,0 days 00:00:00.517685,77.72222736788942,5.113676444548252,0.6001122206594177,Ag,COMPLETE
47,-14.388489208631016,2025-11-13 12:25:43.166956,2025-11-13 12:25:43.531995,0 days 00:00:00.365039,90.12436227271435,4.687886942555261,0.594041580745136,Ag,COMPLETE
48,-22.940074906361872,2025-11-13 12:25:43.198474,2025-11-13 12:25:43.864311,0 days 00:00:00.665837,86.35965794526466,4.860522409418823,0.5971341454970329,Ag,COMPLETE
49,-28.40909090908219,2025-11-13 12:25:43.245355,2025-11-13 12:25:43.732209,0 days 00:00:00.486854,85.47560990327904,2.3873526128486784,0.5722507645918967,Ag,COMPLETE
50,-27.777777777770062,2025-11-13 12:25:43.303449,2025-11-13 12:25:43.879916,0 days 00:00:00.576467,83.94356132521717,4.496271895353421,0.5649046156824075,Ag,COMPLETE
51,-40.76086956519973,2025-11-13 12:25:43.401514,2025-11-13 12:25:43.995355,0 days 00:00:00.593841,74.62928218429319,2.789557206880767,0.5762239917907681,Ag,COMPLETE
52,-39.85507246375091,2025-11-13 12:25:43.430271,2025-11-13 12:25:43.813762,0 days 00:00:00.383491,75.95554567695609,2.416813258733296,0.5981293069625908,Ag,COMPLETE
53,-11.84433164128474,2025-11-13 12:25:43.570719,2025-11-13 12:25:44.138939,0 days 00:00:00.568220,75.54571570771702,2.8361199224575047,0.41282181600342427,Cu,COMPLETE
54,-41.66666666664841,2025-11-13 12:25:43.631471,2025-11-13 12:25:44.182718,0 days 00:00:00.551247,75.95870427662842,2.7364143665953593,0.3878791499897264,Ag,COMPLETE
55,-42.635658914708635,2025-11-13 12:25:43.780366,2025-11-13 12:25:44.164819,0 days 00:00:00.384453,74.87136181280563,2.5139508686093297,0.34406729286316146,Ag,COMPLETE
56,-44.71544715444965,2025-11-13 12:25:44.113684,2025-11-13 12:25:44.782067,0 days 00:00:00.668383,73.8568083863593,2.672732036788695,0.2445798521544452,Ag,COMPLETE
57,-49.99999999997152,2025-11-13 12:25:44.134724,2025-11-13 12:25:44.526864,0 days 00:00:00.392140,66.83361832802885,0.5214937463025124,0.3176207036294908,Ag,COMPLETE
58,-48.42342342339707,2025-11-13 12:25:44.247631,2025-11-13 12:25:44.511320,0 days 00:00:00.263689,72.38936015598301,1.7787091615987265,0.12572597592899437,Ag,COMPLETE
59,-50.24509803918625,2025-11-13 12:25:44.263175,2025-11-13 12:25:44.748613,0 days 00:00:00.485438,66.92813763641847,0.5491193096542517,0.2622199413362546,Ag,COMPLETE
60,-49.999999999971564,2025-11-13 12:25:44.315926,2025-11-13 12:25:44.894111,0 days 00:00:00.578185,67.56907663034877,0.9358155933597792,0.2459198846872715,Ag,COMPLETE
61,-50.24509803918625,2025-11-13 12:25:44.315926,2025-11-13 12:25:44.798045,0 days 00:00:00.482119,68.25654625462703,0.5819313730950508,0.25509596188725536,Ag,COMPLETE
62,-50.24509803918625,2025-11-13 12:25:44.526864,2025-11-13 12:25:45.143334,0 days 00:00:00.616470,66.64357666267813,0.5767477134228169,0.2458742304574124,Ag,COMPLETE
63,-51.47058823526383,2025-11-13 12:25:44.633849,2025-11-13 12:25:45.152551,0 days 00:00:00.518702,66.47725613733888,0.6672962286695624,0.22948918927379003,Ag,COMPLETE
64,-51.47058823526383,2025-11-13 12:25:44.816068,2025-11-13 12:25:45.121123,0 days 00:00:00.305055,68.43830667621671,0.6150330312700818,0.24055662523725296,Ag,COMPLETE
65,-51.47058823526388,2025-11-13 12:25:44.862879,2025-11-13 12:25:45.449928,0 days 00:00:00.587049,64.85136670103391,0.5646712849553035,0.23842083475822123,Ag,COMPLETE
66,-18.82716049382434,2025-11-13 12:25:45.050229,2025-11-13 12:25:45.449928,0 days 00:00:00.399699,66.17438788872349,1.2154625836382793,0.2279845674539864,Au,COMPLETE
67,-18.82716049382434,2025-11-13 12:25:45.090543,2025-11-13 12:25:45.481982,0 days 00:00:00.391439,67.52558242044,1.2300065974197256,0.23870839774984062,Au,COMPLETE
68,-38.94927536230185,2025-11-13 12:25:45.198513,2025-11-13 12:25:45.632995,0 days 00:00:00.434482,54.135606913684605,1.8168717205096279,0.46634651511254777,Ag,COMPLETE
69,-18.967661691539455,2025-11-13 12:25:45.154612,2025-11-13 12:25:45.824990,0 days 00:00:00.670378,67.68250170773301,1.1600908305937256,0.2026287642249142,Au,COMPLETE
70,-39.81481481479711,2025-11-13 12:25:45.316956,2025-11-13 12:25:45.778200,0 days 00:00:00.461244,52.348613629600386,1.7108125561133638,0.18823216230280104,Ag,COMPLETE
71,-15.25821596243915,2025-11-13 12:25:45.425471,2025-11-13 12:25:45.900343,0 days 00:00:00.474872,63.49928680132776,1.8482725201500387,0.15813645160359457,Cu,COMPLETE
72,-49.99999999997149,2025-11-13 12:25:45.610311,2025-11-13 12:25:46.047900,0 days 00:00:00.437589,63.64867176058097,0.6585487195331166,0.27515259959916166,Ag,COMPLETE
73,-51.47058823526383,2025-11-13 12:25:45.746943,2025-11-13 12:25:46.198007,0 days 00:00:00.451064,70.17585350130858,0.5829714723066178,0.29206223540231563,Ag,COMPLETE
74,-34.72222222220921,2025-11-13 12:25:45.824990,2025-11-13 12:25:46.314407,0 days 00:00:00.489417,81.30863423148892,3.656942204148538,0.2892852957889251,Ag,COMPLETE
75,-50.24509803918625,2025-11-13 12:25:45.947790,2025-11-13 12:25:46.314407,0 days 00:00:00.366617,69.25767135043588,0.5139077550122613,0.28377171067434515,Ag,COMPLETE
76,-30.36723163840784,2025-11-13 12:25:46.165216,2025-11-13 12:25:46.748944,0 days 00:00:00.583728,46.928621777831374,2.0289703927299994,0.5103458532848572,Ag,COMPLETE
77,-26.701877934268587,2025-11-13 12:25:46.237470,2025-11-13 12:25:47.020472,0 days 00:00:00.783002,61.73241763947076,14.741180445049633,0.11953147231799505,Ag,COMPLETE
78,-44.715447154449805,2025-11-13 12:25:46.198007,2025-11-13 12:25:46.799009,0 days 00:00:00.601002,70.48371244530287,3.2619117379169453,0.10042287513997983,Ag,COMPLETE
79,-130.35714285713357,2025-11-13 12:25:46.262737,2025-11-13 12:25:46.782825,0 days 00:00:00.520088,24.13247536137964,17.435903833132212,0.10150819602867242,Ag,COMPLETE
80,-1.1150234741783764,2025-11-13 12:25:46.331155,2025-11-13 12:25:47.312193,0 days 00:00:00.981038,22.17879231218746,3.273920359378985,0.1251919904026903,Ag,COMPLETE
81,-0.8992805755395424,2025-11-13 12:25:46.589176,2025-11-13 12:25:47.633414,0 days 00:00:01.044238,21.867402389795423,18.738441665647947,0.3426739108716452,Ag,COMPLETE
82,-14.79076479076353,2025-11-13 12:25:46.743879,2025-11-13 12:25:47.422325,0 days 00:00:00.678446,33.8524845312881,16.845317724963476,0.43790704972469385,Ag,COMPLETE
83,-0.8928571428571173,2025-11-13 12:25:47.036240,2025-11-13 12:25:47.437801,0 days 00:00:00.401561,20.260152641467826,16.689428918795866,0.36732022377287266,Ag,COMPLETE
84,-1.0806916426512656,2025-11-13 12:25:47.114646,2025-11-13 12:25:47.758273,0 days 00:00:00.643627,22.44756752234036,19.00543151766244,0.3906095097790666,Ag,COMPLETE
85,-9.293680297397081,2025-11-13 12:25:47.151334,2025-11-13 12:25:47.633414,0 days 00:00:00.482080,26.166054820053674,17.398192285405152,0.34026740044999965,Ag,COMPLETE
86,-8.454106280192624,2025-11-13 12:25:47.180075,2025-11-13 12:25:47.813730,0 days 00:00:00.633655,25.273940902608835,16.993980116867192,0.3603830654203416,Ag,COMPLETE
87,-8.290816326529752,2025-11-13 12:25:47.296286,2025-11-13 12:25:48.071678,0 days 00:00:00.775392,25.948355306633946,1.4185946859898628,0.1857007989376595,Ag,COMPLETE
88,-48.611111111084135,2025-11-13 12:25:47.534711,2025-11-13 12:25:48.063664,0 days 00:00:00.528953,61.99238053879692,0.9861486454118003,0.1985707396023487,Ag,COMPLETE
89,-8.01787592008361,2025-11-13 12:25:47.543632,2025-11-13 12:25:48.248363,0 days 00:00:00.704731,26.839565585091364,12.567789107906018,1.2505642829002468,Cu,COMPLETE
90,-13.976793248943373,2025-11-13 12:25:47.711417,2025-11-13 12:25:48.247871,0 days 00:00:00.536454,62.20765949989525,0.9805572006520233,1.246543648615391,Cu,COMPLETE
91,-48.809523809495936,2025-11-13 12:25:47.962378,2025-11-13 12:25:48.828501,0 days 00:00:00.866123,69.13284169225923,0.5192811100892284,0.30506181594515813,Ag,COMPLETE
92,-51.47058823526383,2025-11-13 12:25:48.153273,2025-11-13 12:25:48.686482,0 days 00:00:00.533209,70.34307639725382,0.6027190601071939,0.2904293414667155,Ag,COMPLETE
93,-49.99999999997152,2025-11-13 12:25:48.196415,2025-11-13 12:25:48.686482,0 days 00:00:00.490067,70.38849776288366,0.5564401392894064,0.2921387913928414,Ag,COMPLETE
94,-49.99999999997152,2025-11-13 12:25:48.269320,2025-11-13 12:25:48.781283,0 days 00:00:00.511963,69.62274291231058,0.5520127295262861,0.29353457195700433,Ag,COMPLETE
95,-49.99999999997132,2025-11-13 12:25:48.286286,2025-11-13 12:25:48.781283,0 days 00:00:00.494997,69.77682475067928,0.7465867089498668,0.27978326876088033,Ag,COMPLETE
96,-51.47058823526383,2025-11-13 12:25:48.443595,2025-11-13 12:25:49.003673,0 days 00:00:00.560078,68.80284256922688,0.5665142246254257,0.3116275121758755,Ag,COMPLETE
97,-37.581699346390316,2025-11-13 12:25:48.663342,2025-11-13 12:25:49.167465,0 days 00:00:00.504123,79.98701954636336,4.068736186274227,0.15651485121214131,Ag,COMPLETE
98,-13.40996168582273,2025-11-13 12:25:48.768193,2025-11-13 12:25:49.263860,0 days 00:00:00.495667,80.41066497981609,4.032943667741458,1.5170420671500442,Au,COMPLETE
99,-2.2897585345545046,2025-11-13 12:25:48.932308,2025-11-13 12:25:49.649076,0 days 00:00:00.716768,106.95231245692537,2.1112322995855,0.5097039481049253,Au,COMPLETE
100,-17.668776371305817,2025-11-13 12:25:48.968628,2025-11-13 12:25:49.436491,0 days 00:00:00.467863,72.59870423736575,2.119095563530757,0.5107189486626142,Au,COMPLETE
101,-16.025641025639217,2025-11-13 12:25:49.003673,2025-11-13 12:25:49.503078,0 days 00:00:00.499405,72.95026168373491,1.4649828584065454,1.508811143241515,Au,COMPLETE
102,-17.73648648648411,2025-11-13 12:25:49.097756,2025-11-13 12:25:49.500078,0 days 00:00:00.402322,64.97493852053385,1.5539027684122284,0.5241940657139283,Au,COMPLETE
103,7.026143790849563,2025-11-13 12:25:49.194716,2025-11-13 12:25:49.816816,0 days 00:00:00.622100,107.7809908150134,14.420876641565629,0.43337448476861584,Ag,COMPLETE
104,-1.6304347826086645,2025-11-13 12:25:49.376700,2025-11-13 12:25:49.932661,0 days 00:00:00.555961,101.9210326076822,1.1408247097928896,1.7588603289624978,Ag,COMPLETE
105,-31.249999999992188,2025-11-13 12:25:49.546686,2025-11-13 12:25:50.153776,0 days 00:00:00.607090,65.37687721033488,9.994567474684878,0.2312354159126729,Ag,COMPLETE
106,-26.930894308939838,2025-11-13 12:25:49.750004,2025-11-13 12:25:50.202341,0 days 00:00:00.452337,65.685665221016,16.036577488263553,0.2259103117587088,Ag,COMPLETE
107,-47.29729729727182,2025-11-13 12:25:49.850100,2025-11-13 12:25:50.405461,0 days 00:00:00.555361,65.76352099545876,1.5648728313420897,0.22089257165138082,Ag,COMPLETE
108,-47.29729729727182,2025-11-13 12:25:49.883784,2025-11-13 12:25:50.386733,0 days 00:00:00.502949,60.18992279305409,1.4557232403581852,0.1697494617268639,Ag,COMPLETE
109,-49.76851851849095,2025-11-13 12:25:49.966919,2025-11-13 12:25:50.254243,0 days 00:00:00.287324,65.03593359956409,1.4424493616235172,0.21607341897826066,Ag,COMPLETE
110,-47.29729729727148,2025-11-13 12:25:50.028615,2025-11-13 12:25:50.562250,0 days 00:00:00.533635,59.679790771176094,1.3698956504299904,0.17557001933148741,Ag,COMPLETE
111,-44.871794871771776,2025-11-13 12:25:50.254243,2025-11-13 12:25:50.700858,0 days 00:00:00.446615,55.415454378670965,0.9536548940269076,0.13949683512201527,Ag,COMPLETE
112,-23.373983739831736,2025-11-13 12:25:50.363266,2025-11-13 12:25:50.735881,0 days 00:00:00.372615,82.66252957808283,2.204662393985854,1.8518588689682083,Ag,COMPLETE
113,-49.99999999997132,2025-11-13 12:25:50.515246,2025-11-13 12:25:51.299060,0 days 00:00:00.783814,68.91307570118542,1.0089594387314322,0.26454056406195164,Ag,COMPLETE
114,-34.97023809522566,2025-11-13 12:25:50.515246,2025-11-13 12:25:50.909902,0 days 00:00:00.394656,68.71787715129447,2.183482955164582,1.8225532339814408,Ag,COMPLETE
115,-45.94017094014722,2025-11-13 12:25:50.402390,2025-11-13 12:25:51.113094,0 days 00:00:00.710704,68.4474640451659,2.222255827712134,0.2738320018450682,Ag,COMPLETE
116,-45.94017094014738,2025-11-13 12:25:50.717935,2025-11-13 12:25:51.025526,0 days 00:00:00.307591,78.19955769858504,0.9215301318417211,0.26157701398772915,Ag,COMPLETE
117,-16.025641025637924,2025-11-13 12:25:50.821912,2025-11-13 12:25:51.331506,0 days 00:00:00.509594,34.45090020696795,0.9329085869111375,0.32280652675774557,Ag,COMPLETE
118,-48.61111111108394,2025-11-13 12:25:50.848519,2025-11-13 12:25:51.464508,0 days 00:00:00.615989,72.17874167052585,0.8453920837505888,0.32835469322527,Ag,COMPLETE
119,-43.560606060586124,2025-11-13 12:25:51.018478,2025-11-13 12:25:51.594989,0 days 00:00:00.576511,71.63698408399713,3.209688923430767,0.40204636822545714,Ag,COMPLETE
120,-42.61363636361706,2025-11-13 12:25:51.196826,2025-11-13 12:25:51.804050,0 days 00:00:00.607224,63.20926789922493,3.141976665492085,0.3837176000464402,Ag,COMPLETE
121,-46.171171171146376,2025-11-13 12:25:51.333541,2025-11-13 12:25:51.806150,0 days 00:00:00.472609,58.24074273806273,0.5291529042561949,0.36596727954945063,Ag,COMPLETE
122,-48.8095238094959,2025-11-13 12:25:51.513796,2025-11-13 12:25:52.241502,0 days 00:00:00.727706,63.41872097062078,0.5295857327635576,0.37193623585023633,Ag,COMPLETE
123,-22.206959706957267,2025-11-13 12:25:51.548254,2025-11-13 12:25:52.129953,0 days 00:00:00.581699,62.59331076903963,13.379126813027465,1.9425296754736092,Ag,COMPLETE
124,-45.833333333310414,2025-11-13 12:25:51.730010,2025-11-13 12:25:52.152326,0 days 00:00:00.422316,67.19741426070041,1.8842557514856086,0.4560814541860557,Ag,COMPLETE
125,-10.28806584362012,2025-11-13 12:25:51.850154,2025-11-13 12:25:52.786880,0 days 00:00:00.936726,28.688161114856918,1.6702395220700148,0.2503541578419565,Ag,COMPLETE
126,-10.822510822509418,2025-11-13 12:25:51.978245,2025-11-13 12:25:52.278932,0 days 00:00:00.300687,29.500024342119243,1.8513797488466603,0.1995832376918653,Ag,COMPLETE
127,-48.42342342339707,2025-11-13 12:25:52.081390,2025-11-13 12:25:52.755709,0 days 00:00:00.674319,74.26746198607468,1.1989484506838337,0.255790748101831,Ag,COMPLETE
128,-48.6111111110841,2025-11-13 12:25:52.129953,2025-11-13 12:25:52.818138,0 days 00:00:00.688185,73.68400336376429,1.1519444573445778,0.10330859883751226,Ag,COMPLETE
129,-15.318627450978095,2025-11-13 12:25:52.310143,2025-11-13 12:25:53.179074,0 days 00:00:00.868931,67.00051978783912,0.8497812062804773,0.14473941966475812,Cu,COMPLETE
