number,value,datetime_start,datetime_complete,duration,params_D2_nm,params_D3_nm,params_D4_nm,params_metal,state
3642,0.0,2026-04-07 11:34:36.103504,2026-04-07 11:34:36.974837,0 days 00:00:00.871333,35.72608791249645,19.427505876422494,0.6043608495723617,Au,PRUNED
3643,0.0,2026-04-07 11:34:36.153767,2026-04-07 11:34:36.803672,0 days 00:00:00.649905,31.40211253764741,18.315300776260937,0.5240903849221292,Au,PRUNED
3644,-1.0,2026-04-07 11:34:36.423675,2026-04-07 11:34:37.066515,0 days 00:00:00.642840,32.34378037123757,16.707142162912156,0.6846307041972706,Au,COMPLETE
3645,-1.0,2026-04-07 11:34:36.497283,2026-04-07 11:34:37.185534,0 days 00:00:00.688251,32.71820946798716,19.1811814648743,0.6437115595048832,Au,COMPLETE
3646,-1.0,2026-04-07 11:34:36.839213,2026-04-07 11:34:37.292754,0 days 00:00:00.453541,20.76453957292129,17.163973362527532,0.5938062748420017,Au,COMPLETE
3647,-1.0,2026-04-07 11:34:36.859352,2026-04-07 11:34:37.404286,0 days 00:00:00.544934,33.35627475810847,18.944742212251985,0.5034265756171412,Au,COMPLETE
3648,-1.0,2026-04-07 11:34:36.908936,2026-04-07 11:34:37.602770,0 days 00:00:00.693834,20.828862848981608,18.376788216764847,0.5513957418414839,Au,COMPLETE
3649,-1.0,2026-04-07 11:34:36.933189,2026-04-07 11:34:37.436486,0 days 00:00:00.503297,27.191066909823654,19.808429913388444,0.622813092339417,Ag,COMPLETE
3650,0.0,2026-04-07 11:34:36.978489,2026-04-07 11:34:37.577086,0 days 00:00:00.598597,34.36485241728139,19.816262222048117,0.5720872026690049,Au,PRUNED
3651,-1.0,2026-04-07 11:34:37.077526,2026-04-07 11:34:37.688328,0 days 00:00:00.610802,20.001939467549107,16.819753129935837,0.5380847555606477,Au,COMPLETE
3652,-1.0,2026-04-07 11:34:37.257955,2026-04-07 11:34:37.804968,0 days 00:00:00.547013,36.62979543250021,19.403519487632497,0.5494412839538343,Au,COMPLETE
3653,-1.0,2026-04-07 11:34:37.404286,2026-04-07 11:34:38.196476,0 days 00:00:00.792190,35.6174141169149,16.855521777799773,0.5909343673241455,Au,COMPLETE
3654,-1.0,2026-04-07 11:34:37.497548,2026-04-07 11:34:38.195467,0 days 00:00:00.697919,101.38303977506143,16.675484691500486,1.1514374795181772,Au,COMPLETE
3655,-444.66145833326385,2026-04-07 11:34:37.631327,2026-04-07 11:34:38.305873,0 days 00:00:00.674546,21.699935123500595,19.69439615221138,0.6253983872672744,Au,COMPLETE
3656,-1.0,2026-04-07 11:34:37.694838,2026-04-07 11:34:38.308833,0 days 00:00:00.613995,20.182264256573102,18.56303322364267,0.8291888818223567,Au,COMPLETE
3657,-1.0,2026-04-07 11:34:37.744599,2026-04-07 11:34:38.242808,0 days 00:00:00.498209,33.871706120036166,19.773730514805838,0.6270076714397756,Au,COMPLETE
3658,-1.0,2026-04-07 11:34:37.820517,2026-04-07 11:34:38.416135,0 days 00:00:00.595618,21.761301776483524,19.557310918119917,0.7493664956308059,Au,COMPLETE
3659,-1.0,2026-04-07 11:34:37.874473,2026-04-07 11:34:38.384822,0 days 00:00:00.510349,34.626832703357124,19.912279437205317,0.4770370002879729,Au,COMPLETE
3660,-1.0,2026-04-07 11:34:37.996238,2026-04-07 11:34:38.611448,0 days 00:00:00.615210,44.27991856422629,19.68128291008049,0.45253617029283627,Au,COMPLETE
3661,-1.0,2026-04-07 11:34:38.336777,2026-04-07 11:34:38.915845,0 days 00:00:00.579068,29.499792483043358,16.8020255572957,0.49694864439939257,Au,COMPLETE
3662,-1.0,2026-04-07 11:34:38.404853,2026-04-07 11:34:38.930891,0 days 00:00:00.526038,23.594071232313684,19.923297989329086,0.5697636514481924,Au,COMPLETE
3663,-1.0,2026-04-07 11:34:38.441873,2026-04-07 11:34:38.963010,0 days 00:00:00.521137,38.21494326293845,18.515570662051385,0.6556869698763486,Au,COMPLETE
3664,-1.0,2026-04-07 11:34:38.532471,2026-04-07 11:34:39.141868,0 days 00:00:00.609397,38.881544367865175,17.447028169884575,0.7756349782557311,Au,COMPLETE
3665,-1.0,2026-04-07 11:34:38.558998,2026-04-07 11:34:39.055928,0 days 00:00:00.496930,20.337418860001076,18.194168570750996,0.46280435727205504,Au,COMPLETE
3666,-373.06843267103204,2026-04-07 11:34:38.632980,2026-04-07 11:34:39.251898,0 days 00:00:00.618918,21.30186280147202,19.16771285180482,0.5111975809120264,Au,COMPLETE
3667,0.0,2026-04-07 11:34:38.660834,2026-04-07 11:34:39.253028,0 days 00:00:00.592194,20.243062144626464,18.979670657081513,0.6454704485458442,Au,PRUNED
3668,-1.0,2026-04-07 11:34:38.801916,2026-04-07 11:34:39.335629,0 days 00:00:00.533713,43.77857925041728,17.219649222788064,0.5617813024963975,Au,COMPLETE
3669,0.0,2026-04-07 11:34:39.089075,2026-04-07 11:34:39.944395,0 days 00:00:00.855320,34.49412532620223,17.230084198353264,0.680315214736668,Au,PRUNED
3670,-1.0,2026-04-07 11:34:39.164050,2026-04-07 11:34:39.742165,0 days 00:00:00.578115,35.47785635933559,15.532084731676123,0.7693973625622983,Au,COMPLETE
3671,-1.0,2026-04-07 11:34:39.212966,2026-04-07 11:34:39.756701,0 days 00:00:00.543735,21.110275441066516,17.180493757796857,0.5864689427911245,Ag,COMPLETE
3672,0.0,2026-04-07 11:34:39.291183,2026-04-07 11:34:39.897680,0 days 00:00:00.606497,30.022143763244934,19.742239804338215,0.49567825390612186,Au,PRUNED
3673,-1.0,2026-04-07 11:34:39.387904,2026-04-07 11:34:39.896672,0 days 00:00:00.508768,21.017598256102325,17.868830584447334,0.4687463684533839,Au,COMPLETE
3674,-322.9166666666291,2026-04-07 11:34:39.408837,2026-04-07 11:34:40.135352,0 days 00:00:00.726515,22.17409339676981,17.679377197650556,0.582930332772966,Au,COMPLETE
3675,0.0,2026-04-07 11:34:39.493656,2026-04-07 11:34:40.048301,0 days 00:00:00.554645,33.02769155142913,17.835395808393635,0.6010046895964878,Au,PRUNED
3676,80.24691358024454,2026-04-07 11:34:39.515578,2026-04-07 11:34:40.288940,0 days 00:00:00.773362,32.224925293150676,16.69018209619342,0.6059152114330699,Au,PRUNED
3677,80.86419753086179,2026-04-07 11:34:39.856493,2026-04-07 11:34:40.622170,0 days 00:00:00.765677,30.634810899575008,17.251861171129864,0.6906086980118995,Au,PRUNED
3678,-1.0,2026-04-07 11:34:40.052372,2026-04-07 11:34:40.648082,0 days 00:00:00.595710,21.14278054888932,19.574126677923804,0.557490270903446,Au,COMPLETE
3679,-1.0,2026-04-07 11:34:40.138351,2026-04-07 11:34:40.623425,0 days 00:00:00.485074,28.306413027889448,17.512175826435907,0.7519494253853767,Au,COMPLETE
3680,-1.0,2026-04-07 11:34:40.171350,2026-04-07 11:34:40.743413,0 days 00:00:00.572063,20.21450831089072,18.394201573940986,0.5709994226056443,Au,COMPLETE
3681,-349.7395833332896,2026-04-07 11:34:40.192039,2026-04-07 11:34:40.884906,0 days 00:00:00.692867,20.957785228967875,19.122463749987094,0.46249950118947636,Au,COMPLETE
3682,0.0,2026-04-07 11:34:40.216614,2026-04-07 11:34:40.903296,0 days 00:00:00.686682,36.73488594516193,19.665283206566816,0.49386478477089013,Au,PRUNED
3683,-1.0,2026-04-07 11:34:40.293396,2026-04-07 11:34:40.840710,0 days 00:00:00.547314,37.02011787293132,19.64309889440871,0.563468293719265,Au,COMPLETE
3684,-1.0,2026-04-07 11:34:40.485786,2026-04-07 11:34:41.036598,0 days 00:00:00.550812,33.077307258171416,17.129632415293035,0.779742718906284,Au,COMPLETE
3685,-1.0,2026-04-07 11:34:40.778446,2026-04-07 11:34:41.462471,0 days 00:00:00.684025,46.36441313718427,19.935420423282427,0.6419390262445803,Au,COMPLETE
3686,-1.0,2026-04-07 11:34:40.815748,2026-04-07 11:34:41.434263,0 days 00:00:00.618515,21.576655161277618,19.882446613375073,0.9038738547446598,Au,COMPLETE
3687,-1.0,2026-04-07 11:34:40.830038,2026-04-07 11:34:41.380702,0 days 00:00:00.550664,30.025507344425748,19.965996538368312,0.8573957268686804,Au,COMPLETE
3688,-0.5165289256198261,2026-04-07 11:34:40.840710,2026-04-07 11:34:41.493731,0 days 00:00:00.653021,113.80386943858989,13.120514651688726,0.7043446156105848,Au,PRUNED
3689,-1.0,2026-04-07 11:34:40.935957,2026-04-07 11:34:41.432741,0 days 00:00:00.496784,23.81006763592366,19.94509257891986,0.4560669064362117,Au,COMPLETE
3690,0.0,2026-04-07 11:34:41.076755,2026-04-07 11:34:41.801438,0 days 00:00:00.724683,35.61985029423234,19.864838932832146,0.5499537020053662,Au,PRUNED
3691,-1.0,2026-04-07 11:34:41.146484,2026-04-07 11:34:41.616756,0 days 00:00:00.470272,20.879762903300414,14.903201061071133,0.5253367325335772,Au,COMPLETE
3692,-1.0,2026-04-07 11:34:41.206398,2026-04-07 11:34:41.584640,0 days 00:00:00.378242,29.73393283070661,17.03746359882434,0.8090666229367842,Au,COMPLETE
3693,0.0,2026-04-07 11:34:41.493731,2026-04-07 11:34:42.444990,0 days 00:00:00.951259,20.195608323363988,17.106386847240646,0.7727454088792384,Au,PRUNED
3694,-1.0,2026-04-07 11:34:41.651718,2026-04-07 11:34:42.274655,0 days 00:00:00.622937,29.5285750805853,17.799706213289504,0.5945260918046645,Au,COMPLETE
3695,-213.7254901960616,2026-04-07 11:34:41.668672,2026-04-07 11:34:42.429802,0 days 00:00:00.761130,21.528365530245036,19.518757419400647,0.52062577692173,Cu,COMPLETE
3696,-1.0,2026-04-07 11:34:41.702965,2026-04-07 11:34:42.325009,0 days 00:00:00.622044,24.44736152318743,19.94361976002989,0.5261616736056782,Au,COMPLETE
3697,81.48148148147907,2026-04-07 11:34:41.732952,2026-04-07 11:34:42.414027,0 days 00:00:00.681075,29.942946067984515,17.14921268324661,0.7880178440337693,Au,PRUNED
3698,0.0,2026-04-07 11:34:41.763642,2026-04-07 11:34:42.381513,0 days 00:00:00.617871,20.668239469156063,17.595824189676787,0.5907457008537162,Au,PRUNED
3699,-1.0,2026-04-07 11:34:41.980883,2026-04-07 11:34:42.524727,0 days 00:00:00.543844,31.17728510035841,17.285270661627766,0.9115538021260897,Au,COMPLETE
3700,-1.0,2026-04-07 11:34:41.994180,2026-04-07 11:34:42.908289,0 days 00:00:00.914109,28.47862127176905,19.802423953840023,0.7020165581662172,Au,COMPLETE
3701,-1.0,2026-04-07 11:34:42.463321,2026-04-07 11:34:43.197497,0 days 00:00:00.734176,27.717753156149158,19.486854050673703,0.6264026827594213,Au,COMPLETE
3702,80.55555555555317,2026-04-07 11:34:42.540313,2026-04-07 11:34:43.211966,0 days 00:00:00.671653,29.755863746835477,17.983123840205945,0.8547003319053391,Au,PRUNED
3703,-1.0,2026-04-07 11:34:42.556842,2026-04-07 11:34:43.025991,0 days 00:00:00.469149,20.18935656793919,18.644054273213147,0.7300656496601999,Au,COMPLETE
3704,0.0,2026-04-07 11:34:42.613319,2026-04-07 11:34:43.432546,0 days 00:00:00.819227,20.034399779024607,18.06155780811712,0.7917287661854867,Au,PRUNED
3705,-1.0,2026-04-07 11:34:42.740618,2026-04-07 11:34:43.228156,0 days 00:00:00.487538,20.651298476101136,18.382996039321036,0.7825986452150434,Au,COMPLETE
3706,-1.0,2026-04-07 11:34:42.728315,2026-04-07 11:34:43.226090,0 days 00:00:00.497775,21.603660723776375,19.580612888155,0.5607044539166411,Au,COMPLETE
3707,0.0,2026-04-07 11:34:42.777165,2026-04-07 11:34:43.480746,0 days 00:00:00.703581,31.267530937829832,19.810679062263315,0.6989574350618927,Au,PRUNED
3708,0.0,2026-04-07 11:34:43.053416,2026-04-07 11:34:43.826450,0 days 00:00:00.773034,41.522579146469994,19.99343754829723,0.6872313893847999,Au,PRUNED
3709,79.93827160493589,2026-04-07 11:34:43.180605,2026-04-07 11:34:43.879816,0 days 00:00:00.699211,31.168537711387074,17.338391577996777,0.9181787129306864,Au,PRUNED
3710,0.0,2026-04-07 11:34:43.340704,2026-04-07 11:34:44.160532,0 days 00:00:00.819828,20.54017291817982,16.903000604654892,1.047487590722598,Au,PRUNED
3711,82.72058823529169,2026-04-07 11:34:43.399410,2026-04-07 11:34:44.136381,0 days 00:00:00.736971,24.646640227795405,19.96803147891065,0.8689800354995189,Au,PRUNED
3712,0.0,2026-04-07 11:34:43.542542,2026-04-07 11:34:44.216192,0 days 00:00:00.673650,44.275797684669186,19.848806362984597,0.9535048013021843,Au,PRUNED
3713,0.0,2026-04-07 11:34:43.559181,2026-04-07 11:34:44.321815,0 days 00:00:00.762634,29.412465132306476,19.883935540152024,0.6017456171104395,Au,PRUNED
3714,-1.0,2026-04-07 11:34:43.578044,2026-04-07 11:34:44.106139,0 days 00:00:00.528095,21.253526972282497,15.451853810959305,0.48817212024695555,Au,COMPLETE
3715,83.33333333333088,2026-04-07 11:34:43.720250,2026-04-07 11:34:44.788729,0 days 00:00:01.068479,23.919221749803132,19.946622997148086,0.5195065777279548,Au,PRUNED
3716,-1.0,2026-04-07 11:34:43.961049,2026-04-07 11:34:44.652142,0 days 00:00:00.691093,30.93530545046813,19.880122462780736,0.6277437440846071,Au,COMPLETE
3717,-0.83333333333332,2026-04-07 11:34:44.064394,2026-04-07 11:34:44.758812,0 days 00:00:00.694418,97.83436880904449,10.398311343563915,1.5747147043937462,Cu,PRUNED
3718,-1.0,2026-04-07 11:34:44.281777,2026-04-07 11:34:44.835774,0 days 00:00:00.553997,35.53806388097747,15.178644341568356,0.5630841641549663,Au,COMPLETE
3719,-1.0,2026-04-07 11:34:44.313218,2026-04-07 11:34:44.777274,0 days 00:00:00.464056,30.53076685514374,19.895146005471567,1.0215509966186773,Au,COMPLETE
3720,0.0,2026-04-07 11:34:44.346184,2026-04-07 11:34:45.132868,0 days 00:00:00.786684,33.15902784218683,17.815669558121066,1.0708768497396488,Au,PRUNED
3721,-1.0,2026-04-07 11:34:44.376461,2026-04-07 11:34:44.850553,0 days 00:00:00.474092,34.10176363868783,19.79389425503565,0.8591525385307336,Au,COMPLETE
3722,-1.0,2026-04-07 11:34:44.418311,2026-04-07 11:34:44.992872,0 days 00:00:00.574561,23.33216785587194,19.699242506286154,0.7471259583906977,Au,COMPLETE
3723,-1.0,2026-04-07 11:34:44.881107,2026-04-07 11:34:45.556146,0 days 00:00:00.675039,38.14306212716755,17.843414559114564,0.7946455038580548,Au,COMPLETE
3724,-434.16030534344486,2026-04-07 11:34:44.974600,2026-04-07 11:34:45.587912,0 days 00:00:00.613312,20.736927252484424,19.726697523596865,1.2132402040218242,Au,COMPLETE
3725,-1.0,2026-04-07 11:34:45.017318,2026-04-07 11:34:45.526303,0 days 00:00:00.508985,20.54278555819501,19.970264345476107,0.9314231219065358,Au,COMPLETE
3726,-416.9730392156249,2026-04-07 11:34:45.070372,2026-04-07 11:34:45.784390,0 days 00:00:00.714018,20.599983837767073,19.825945894580773,0.8994436212147717,Au,COMPLETE
3727,-1.0,2026-04-07 11:34:45.105861,2026-04-07 11:34:45.522187,0 days 00:00:00.416326,20.503436214560427,18.16579419315276,0.787090819425484,Au,COMPLETE
3728,0.0,2026-04-07 11:34:45.150030,2026-04-07 11:34:45.894646,0 days 00:00:00.744616,30.10966660664848,19.935828125228007,0.6935483695414986,Au,PRUNED
3729,-5.952380952380102,2026-04-07 11:34:45.199992,2026-04-07 11:34:45.779769,0 days 00:00:00.579777,36.023141976298554,19.77990171691346,0.46325827341035963,Ag,PRUNED
3730,-1.0,2026-04-07 11:34:45.383082,2026-04-07 11:34:45.777763,0 days 00:00:00.394681,25.250306504698752,19.937303426251063,0.6624070357726386,Au,COMPLETE
3731,-441.2144702841686,2026-04-07 11:34:45.725865,2026-04-07 11:34:46.412221,0 days 00:00:00.686356,20.62001511079757,19.975458647994067,1.1534149454925005,Au,COMPLETE
3732,-1.0,2026-04-07 11:34:45.859806,2026-04-07 11:34:46.355392,0 days 00:00:00.495586,35.120078162435085,17.0839327005321,1.2517713032221303,Au,COMPLETE
3733,0.0,2026-04-07 11:34:45.912250,2026-04-07 11:34:46.629495,0 days 00:00:00.717245,29.505688184056808,19.944573480413712,1.2868909223100229,Au,PRUNED
3734,-407.3741007193657,2026-04-07 11:34:45.944609,2026-04-07 11:34:46.632047,0 days 00:00:00.687438,20.328514593498774,19.834327032532368,0.995102143679746,Au,COMPLETE
3735,-1.0,2026-04-07 11:34:45.958926,2026-04-07 11:34:46.507696,0 days 00:00:00.548770,20.285236160606186,15.776339110299583,1.1205305165376316,Au,COMPLETE
3736,-1.0,2026-04-07 11:34:46.007891,2026-04-07 11:34:46.434098,0 days 00:00:00.426207,20.23275241988192,17.099198551580294,0.7244273891034854,Au,COMPLETE
3737,0.0,2026-04-07 11:34:46.021574,2026-04-07 11:34:46.868917,0 days 00:00:00.847343,50.0702478329835,16.15801728805854,1.0308408914223481,Au,PRUNED
3738,0.0,2026-04-07 11:34:46.042713,2026-04-07 11:34:46.674131,0 days 00:00:00.631418,49.44542656915207,19.936446460637846,1.3819302242377525,Au,PRUNED
3739,0.0,2026-04-07 11:34:46.539233,2026-04-07 11:34:47.485012,0 days 00:00:00.945779,49.112436494500194,19.88086529422437,1.1634346669651974,Au,PRUNED
3740,-1.0,2026-04-07 11:34:46.693773,2026-04-07 11:34:47.413279,0 days 00:00:00.719506,110.64481739812607,12.093425772454573,0.6097640941483976,Cu,COMPLETE
3741,-1.0,2026-04-07 11:34:46.713044,2026-04-07 11:34:47.258847,0 days 00:00:00.545803,21.887323472838595,19.902761578425576,1.1424692717707723,Au,COMPLETE
3742,79.62962962962726,2026-04-07 11:34:46.780521,2026-04-07 11:34:47.336096,0 days 00:00:00.555575,31.533240853567502,17.135215166462718,0.9931212128185534,Au,PRUNED
3743,-1.0,2026-04-07 11:34:46.807856,2026-04-07 11:34:47.398929,0 days 00:00:00.591073,34.318395348085936,19.53546294936772,1.1559049212777222,Au,COMPLETE
3744,0.0,2026-04-07 11:34:46.821504,2026-04-07 11:34:47.605660,0 days 00:00:00.784156,36.62903859392303,19.61505697920526,1.142052028993046,Au,PRUNED
3745,0.0,2026-04-07 11:34:46.946814,2026-04-07 11:34:47.577589,0 days 00:00:00.630775,34.86889354426448,17.633621652930255,0.9670060225417503,Au,PRUNED
3746,-8.01282051281928,2026-04-07 11:34:46.970090,2026-04-07 11:34:47.617708,0 days 00:00:00.647618,21.904079554855564,19.731980755689637,0.8127495490131268,Au,PRUNED
3747,-1.0,2026-04-07 11:34:47.360670,2026-04-07 11:34:48.104135,0 days 00:00:00.743465,31.73029192541636,16.814747325471505,1.089890151950215,Au,COMPLETE
3748,-1.0,2026-04-07 11:34:47.397313,2026-04-07 11:34:48.074233,0 days 00:00:00.676920,36.914414262844645,19.96646847747467,0.7970492640552059,Au,COMPLETE
3749,-1.0,2026-04-07 11:34:47.636558,2026-04-07 11:34:48.236436,0 days 00:00:00.599878,21.448089119243075,19.961815388906704,0.7297377993554003,Au,COMPLETE
3750,-1.0,2026-04-07 11:34:47.698121,2026-04-07 11:34:48.354963,0 days 00:00:00.656842,20.00872538972672,17.798746090298714,1.008011050408101,Au,COMPLETE
3751,-1.0,2026-04-07 11:34:47.714493,2026-04-07 11:34:48.117277,0 days 00:00:00.402784,22.476967331458972,19.969191807844766,0.9956551879726758,Au,COMPLETE
3752,-1.0,2026-04-07 11:34:47.730934,2026-04-07 11:34:48.353552,0 days 00:00:00.622618,20.70301113415881,16.88508503019089,0.981992913028682,Au,COMPLETE
3753,-1.0,2026-04-07 11:34:47.758324,2026-04-07 11:34:48.165743,0 days 00:00:00.407419,28.17246422434881,14.216041604245834,0.9931043538686113,Au,COMPLETE
3754,-1.0,2026-04-07 11:34:47.784895,2026-04-07 11:34:48.306533,0 days 00:00:00.521638,33.35553492561859,19.763184392599534,1.0101505577963765,Au,COMPLETE
3755,-1.0,2026-04-07 11:34:48.195604,2026-04-07 11:34:48.769286,0 days 00:00:00.573682,21.13196209523214,16.594464900628786,0.9843947937151181,Au,COMPLETE
3756,-1.0,2026-04-07 11:34:48.244518,2026-04-07 11:34:48.833659,0 days 00:00:00.589141,21.240726646931112,17.54757042419048,1.2146675118430723,Au,COMPLETE
3757,0.0,2026-04-07 11:34:48.275706,2026-04-07 11:34:48.957951,0 days 00:00:00.682245,30.43672577753042,17.663474476246005,1.2351418849497873,Au,PRUNED
3758,0.0,2026-04-07 11:34:48.381943,2026-04-07 11:34:48.957423,0 days 00:00:00.575480,32.85805806842875,19.787365853273577,0.9111756749418232,Au,PRUNED
3759,-1.0,2026-04-07 11:34:48.406042,2026-04-07 11:34:48.956714,0 days 00:00:00.550672,21.470738528675742,19.892892921151965,0.4978042391908237,Au,COMPLETE
3760,-332.0932539682144,2026-04-07 11:34:48.544297,2026-04-07 11:34:49.197165,0 days 00:00:00.652868,21.156623030447072,18.166216370606133,1.0248078573014767,Au,COMPLETE
3761,0.0,2026-04-07 11:34:48.563943,2026-04-07 11:34:49.198131,0 days 00:00:00.634188,37.1554697619156,19.710043186034362,1.1859841943874263,Au,PRUNED
3762,-20.83333333333125,2026-04-07 11:34:48.586461,2026-04-07 11:34:49.286544,0 days 00:00:00.700083,45.21514821310481,16.23166761878214,0.9644974585374692,Ag,PRUNED
3763,0.0,2026-04-07 11:34:48.931247,2026-04-07 11:34:49.850472,0 days 00:00:00.919225,34.022058563731115,17.37941517243481,1.08420878983517,Au,PRUNED
3764,-1.0,2026-04-07 11:34:49.017806,2026-04-07 11:34:49.678497,0 days 00:00:00.660691,57.472125332339466,19.57288142048006,0.4889947163470567,Au,COMPLETE
3765,-28.508771929818558,2026-04-07 11:34:49.063893,2026-04-07 11:34:49.660563,0 days 00:00:00.596670,68.5147432453522,9.297539415103598,0.9816311002280755,Ag,PRUNED
3766,82.72058823529169,2026-04-07 11:34:49.083561,2026-04-07 11:34:49.778311,0 days 00:00:00.694750,24.830453151450016,19.93574342718499,0.5806757945995872,Au,PRUNED
3767,-1.0,2026-04-07 11:34:49.317617,2026-04-07 11:34:49.977328,0 days 00:00:00.659711,20.544938780173634,16.633325190112284,0.49166254303694656,Au,COMPLETE
3768,-8.333333333332382,2026-04-07 11:34:49.340872,2026-04-07 11:34:50.188513,0 days 00:00:00.847641,29.777321388789883,14.371773921358901,0.8115154437324961,Au,PRUNED
3769,-420.6790123456165,2026-04-07 11:34:49.348718,2026-04-07 11:34:50.162903,0 days 00:00:00.814185,20.345076706767383,19.853572382317015,1.1670228590766112,Au,COMPLETE
3770,0.0,2026-04-07 11:34:49.381809,2026-04-07 11:34:50.035851,0 days 00:00:00.654042,32.63861653023427,19.787134727403593,1.1959547865172988,Au,PRUNED
3771,0.0,2026-04-07 11:34:49.714344,2026-04-07 11:34:50.324470,0 days 00:00:00.610126,31.804022277327512,19.692796193796923,1.201035950455081,Au,PRUNED
3772,0.0,2026-04-07 11:34:49.878659,2026-04-07 11:34:50.819541,0 days 00:00:00.940882,20.019789262427352,17.63152586340616,1.0114586526315228,Au,PRUNED
3773,4.166666666666111,2026-04-07 11:34:49.915749,2026-04-07 11:34:50.818541,0 days 00:00:00.902792,22.851312062914563,19.910067461006168,1.0241397267355887,Au,PRUNED
3774,-1.0,2026-04-07 11:34:49.940061,2026-04-07 11:34:50.583845,0 days 00:00:00.643784,20.054178787011466,16.357859284737437,0.7287867361257876,Au,COMPLETE
3775,0.0,2026-04-07 11:34:50.109128,2026-04-07 11:34:50.789933,0 days 00:00:00.680805,34.63812883723542,19.997710058574803,1.2413573603981505,Au,PRUNED
3776,-320.8092485548764,2026-04-07 11:34:50.154681,2026-04-07 11:34:50.902315,0 days 00:00:00.747634,20.941795191941512,18.002863475428352,1.1020580124669612,Au,COMPLETE
3777,0.0,2026-04-07 11:34:50.255144,2026-04-07 11:34:50.821047,0 days 00:00:00.565903,20.56353644331856,16.76896352639918,0.610026119320216,Au,PRUNED
3778,0.0,2026-04-07 11:34:50.362484,2026-04-07 11:34:51.247782,0 days 00:00:00.885298,20.53366630030632,16.173505560857993,0.9912393558628727,Au,PRUNED
3779,-427.31829573928434,2026-04-07 11:34:50.449200,2026-04-07 11:34:51.234992,0 days 00:00:00.785792,20.66820202082476,19.971525413596602,0.8482606417049732,Au,COMPLETE
3780,-1.0,2026-04-07 11:34:50.922848,2026-04-07 11:34:51.394552,0 days 00:00:00.471704,44.17776154509694,16.84249321808681,1.0200911736855158,Au,COMPLETE
