number,value,datetime_start,datetime_complete,duration,params_D2_nm,params_D3_nm,params_D4_nm,params_metal,state
4059,83.02696078431127,2026-04-07 11:35:20.188874,2026-04-07 11:35:20.846058,0 days 00:00:00.657184,24.74652306114715,19.908201138305824,0.4385065702423119,Au,PRUNED
4060,0.0,2026-04-07 11:35:20.340092,2026-04-07 11:35:20.883384,0 days 00:00:00.543292,32.918669936192906,18.168837099755574,0.47073889456128115,Au,PRUNED
4061,-1.0,2026-04-07 11:35:20.383748,2026-04-07 11:35:20.883384,0 days 00:00:00.499636,29.553740611203295,17.04720180370908,0.45058930466446284,Au,COMPLETE
4062,-1.0,2026-04-07 11:35:20.465291,2026-04-07 11:35:21.085925,0 days 00:00:00.620634,73.54280281367974,19.858920116661267,1.7387811381665648,Cu,COMPLETE
4063,-1.0,2026-04-07 11:35:20.531076,2026-04-07 11:35:21.154587,0 days 00:00:00.623511,32.80599817637857,17.094656753421365,0.6384888203673293,Au,COMPLETE
4064,-1.0,2026-04-07 11:35:20.575955,2026-04-07 11:35:21.014285,0 days 00:00:00.438330,27.466965689785464,16.74044748094263,0.46369763166206096,Au,COMPLETE
4065,2.873563218390408,2026-04-07 11:35:20.827774,2026-04-07 11:35:21.619670,0 days 00:00:00.791896,23.079680384199296,19.972015777976992,0.6764381450304117,Au,PRUNED
4066,0.0,2026-04-07 11:35:20.945152,2026-04-07 11:35:21.665653,0 days 00:00:00.720501,22.438092225904985,19.93225973645055,0.8428473285795306,Au,PRUNED
4067,0.0,2026-04-07 11:35:20.961916,2026-04-07 11:35:21.679337,0 days 00:00:00.717421,21.054513281015925,17.991394220455952,0.5264029123921947,Au,PRUNED
4068,-1.0,2026-04-07 11:35:21.020377,2026-04-07 11:35:21.678799,0 days 00:00:00.658422,20.024300180944962,19.68833399146125,0.5933835118460092,Au,COMPLETE
4069,80.26960784313488,2026-04-07 11:35:21.088927,2026-04-07 11:35:21.971996,0 days 00:00:00.883069,31.945675426018404,16.363297495054436,0.6640900339854298,Au,PRUNED
4070,79.32098765431864,2026-04-07 11:35:21.156596,2026-04-07 11:35:22.022092,0 days 00:00:00.865496,32.9684336775969,17.133669594492126,0.47065733464447335,Au,PRUNED
4071,-444.66145833326385,2026-04-07 11:35:21.271874,2026-04-07 11:35:21.904099,0 days 00:00:00.632225,21.521694215516202,19.931229077040374,0.3771368046618445,Au,COMPLETE
4072,0.0,2026-04-07 11:35:21.379477,2026-04-07 11:35:22.037200,0 days 00:00:00.657723,38.19052463445688,19.576513534523258,0.37881155821822093,Au,PRUNED
4073,-15.765765765764062,2026-04-07 11:35:21.751484,2026-04-07 11:35:22.522703,0 days 00:00:00.771219,27.040943021970403,16.548915365869135,0.5042391604380613,Cu,PRUNED
4074,-1.0,2026-04-07 11:35:21.798449,2026-04-07 11:35:22.524219,0 days 00:00:00.725770,21.550115908542427,19.69612064451249,0.34359361731875004,Au,COMPLETE
4075,-427.00501253126436,2026-04-07 11:35:21.840066,2026-04-07 11:35:22.755301,0 days 00:00:00.915235,21.47473350125341,19.8366530829007,0.28649286647465905,Au,COMPLETE
4076,-1.0,2026-04-07 11:35:22.046725,2026-04-07 11:35:22.727070,0 days 00:00:00.680345,20.01360360943115,19.20026397618574,0.360605518742638,Au,COMPLETE
4077,-1.0,2026-04-07 11:35:22.098070,2026-04-07 11:35:22.731642,0 days 00:00:00.633572,24.037738883828723,19.989027206329126,0.3259840582675205,Au,COMPLETE
4078,-1.0,2026-04-07 11:35:22.120311,2026-04-07 11:35:22.769861,0 days 00:00:00.649550,21.001821771375308,18.36246365757924,0.35014583425805557,Au,COMPLETE
4079,-1.0,2026-04-07 11:35:22.086539,2026-04-07 11:35:22.611897,0 days 00:00:00.525358,118.79079171101228,13.335087307968706,1.5189583743905475,Au,COMPLETE
4080,0.0,2026-04-07 11:35:22.157638,2026-04-07 11:35:22.904169,0 days 00:00:00.746531,20.670253145458524,17.891050814960202,0.5158036678237208,Au,PRUNED
4081,0.0,2026-04-07 11:35:22.643470,2026-04-07 11:35:23.197851,0 days 00:00:00.554381,20.017346267576453,12.301827969574134,0.7207402975816873,Au,PRUNED
4082,-1.0,2026-04-07 11:35:22.614404,2026-04-07 11:35:23.384395,0 days 00:00:00.769991,38.39070353805724,17.15461349840561,0.24187711427620395,Au,COMPLETE
4083,-1.0,2026-04-07 11:35:22.821752,2026-04-07 11:35:23.425925,0 days 00:00:00.604173,40.686343730663275,18.73230667065208,0.26365772414999433,Au,COMPLETE
4084,-1.0,2026-04-07 11:35:22.900770,2026-04-07 11:35:23.412036,0 days 00:00:00.511266,53.24586279151433,19.39293982226181,0.3777881349165835,Au,COMPLETE
4085,0.0,2026-04-07 11:35:22.950184,2026-04-07 11:35:23.638260,0 days 00:00:00.688076,32.387862303107056,18.440372620688446,0.329220380511893,Au,PRUNED
4086,0.0,2026-04-07 11:35:22.915861,2026-04-07 11:35:23.903788,0 days 00:00:00.987927,48.403205896514066,16.875250557585808,0.24486050114377378,Au,PRUNED
4087,-1.0,2026-04-07 11:35:22.985439,2026-04-07 11:35:23.499036,0 days 00:00:00.513597,25.137349443271816,18.809769700742212,0.2886883566263041,Au,COMPLETE
4088,-361.8279569892011,2026-04-07 11:35:23.007646,2026-04-07 11:35:23.681605,0 days 00:00:00.673959,20.75943363753088,19.558776911411186,0.33885397160994574,Au,COMPLETE
4089,-1.0,2026-04-07 11:35:23.287722,2026-04-07 11:35:23.837142,0 days 00:00:00.549420,23.822445160171217,18.764033707031597,0.433687371018566,Au,COMPLETE
4090,0.0,2026-04-07 11:35:23.464207,2026-04-07 11:35:24.258275,0 days 00:00:00.794068,39.38117852081102,18.75407393587044,0.343464908654151,Au,PRUNED
4091,-1.0,2026-04-07 11:35:23.564369,2026-04-07 11:35:24.005798,0 days 00:00:00.441429,42.36939198725109,19.93066966887688,0.11977100038309613,Au,COMPLETE
4092,-1.0,2026-04-07 11:35:23.759142,2026-04-07 11:35:24.335861,0 days 00:00:00.576719,35.3229133020496,19.43107941436514,0.2890821308624344,Au,COMPLETE
4093,79.93827160493589,2026-04-07 11:35:23.853793,2026-04-07 11:35:24.785203,0 days 00:00:00.931410,32.125777668294575,17.745730229564263,0.2342976700832671,Au,PRUNED
4094,-1.0,2026-04-07 11:35:23.949832,2026-04-07 11:35:24.536435,0 days 00:00:00.586603,22.68284990233718,17.92921052508558,0.4608278495236315,Au,COMPLETE
4095,-12.626262626261097,2026-04-07 11:35:23.978425,2026-04-07 11:35:24.964635,0 days 00:00:00.986210,24.27485269900203,19.551970422649696,0.23939447543219608,Cu,PRUNED
4096,0.0,2026-04-07 11:35:23.992597,2026-04-07 11:35:24.605305,0 days 00:00:00.612708,23.472753754925417,15.685034598824402,0.4085302812386572,Au,PRUNED
4097,-1.0,2026-04-07 11:35:24.039298,2026-04-07 11:35:24.847462,0 days 00:00:00.808164,30.695202793800213,15.429157069648081,0.42042054636903015,Au,COMPLETE
4098,81.17283950617043,2026-04-07 11:35:24.203489,2026-04-07 11:35:24.716976,0 days 00:00:00.513487,29.723632482267384,18.083062725236896,0.36012790478844203,Au,PRUNED
4099,79.93827160493589,2026-04-07 11:35:24.363362,2026-04-07 11:35:25.107682,0 days 00:00:00.744320,31.9425745790824,17.32706916118526,0.5054100791834089,Au,PRUNED
4100,-1.0,2026-04-07 11:35:24.525452,2026-04-07 11:35:25.238162,0 days 00:00:00.712710,21.20115615150142,17.139455649570166,0.31414486616141735,Au,COMPLETE
4101,-1.0,2026-04-07 11:35:24.640839,2026-04-07 11:35:25.391700,0 days 00:00:00.750861,35.336774886954665,18.91756696672299,0.3399848908693455,Au,COMPLETE
4102,-1.0,2026-04-07 11:35:24.628550,2026-04-07 11:35:25.424721,0 days 00:00:00.796171,20.189562490662677,15.416003651573458,0.3301504094460051,Au,COMPLETE
4103,-2.0833333333332984,2026-04-07 11:35:24.906940,2026-04-07 11:35:25.539091,0 days 00:00:00.632151,115.9546725372566,1.0001822395800168,0.34757624610216953,Au,PRUNED
4104,-1.0,2026-04-07 11:35:24.864758,2026-04-07 11:35:25.486375,0 days 00:00:00.621617,20.256772993228772,17.493555655283004,0.3696990447631895,Au,COMPLETE
4105,-1.0,2026-04-07 11:35:25.028978,2026-04-07 11:35:25.576042,0 days 00:00:00.547064,31.09091807508338,18.683234529405464,0.3041583810922476,Au,COMPLETE
4106,81.49509803921329,2026-04-07 11:35:25.052097,2026-04-07 11:35:25.618353,0 days 00:00:00.566256,30.544725241685835,16.624514773626526,0.39800129559662256,Au,PRUNED
4107,-1.0,2026-04-07 11:35:25.200559,2026-04-07 11:35:25.751081,0 days 00:00:00.550522,24.72368465353154,19.97361633669075,0.14821406671288834,Au,COMPLETE
4108,-1.0,2026-04-07 11:35:25.454435,2026-04-07 11:35:25.931628,0 days 00:00:00.477193,33.488123262442656,17.748401909699833,0.38283610876592333,Au,COMPLETE
4109,-1.0,2026-04-07 11:35:25.565418,2026-04-07 11:35:26.154370,0 days 00:00:00.588952,44.13490623853349,19.088001614997182,0.3886853982810649,Au,COMPLETE
4110,-1.0,2026-04-07 11:35:25.665520,2026-04-07 11:35:26.173658,0 days 00:00:00.508138,39.618003034452485,19.685781968222376,0.4128246891754227,Au,COMPLETE
4111,5.208333333332682,2026-04-07 11:35:25.678595,2026-04-07 11:35:26.163295,0 days 00:00:00.484700,25.599387523274626,18.800268928067318,0.28818833933234933,Au,PRUNED
4112,0.0,2026-04-07 11:35:25.699664,2026-04-07 11:35:26.295396,0 days 00:00:00.595732,20.33960137544365,19.3323956355883,0.49478781362466095,Au,PRUNED
4113,0.0,2026-04-07 11:35:25.714873,2026-04-07 11:35:26.468872,0 days 00:00:00.753999,20.014336523260322,19.9790025958545,0.5363357226178795,Au,PRUNED
4114,-1.0,2026-04-07 11:35:25.690740,2026-04-07 11:35:26.179565,0 days 00:00:00.488825,24.11533902144813,19.963006747065123,0.3053786500835045,Au,COMPLETE
4115,0.0,2026-04-07 11:35:25.985405,2026-04-07 11:35:26.569400,0 days 00:00:00.583995,30.338032370947918,19.53346368293316,0.41320982373805154,Au,PRUNED
4116,83.33333333333088,2026-04-07 11:35:26.143497,2026-04-07 11:35:26.898106,0 days 00:00:00.754609,24.630141978728417,19.563790951705613,0.38136269593003547,Au,PRUNED
4117,0.0,2026-04-07 11:35:26.353207,2026-04-07 11:35:26.962667,0 days 00:00:00.609460,20.437537775398663,19.08923801118644,0.3512528846238914,Au,PRUNED
4118,83.33333333333088,2026-04-07 11:35:26.380920,2026-04-07 11:35:27.302116,0 days 00:00:00.921196,24.08307565007719,19.877187385778825,0.35965330696708725,Au,PRUNED
4119,0.0,2026-04-07 11:35:26.414882,2026-04-07 11:35:27.242329,0 days 00:00:00.827447,38.36526966959663,19.62165677366007,0.2401994358263155,Au,PRUNED
4120,-1.0,2026-04-07 11:35:26.526090,2026-04-07 11:35:27.018677,0 days 00:00:00.492587,20.963034753722557,19.780922057512335,0.44231071895998514,Au,COMPLETE
4121,0.0,2026-04-07 11:35:26.546302,2026-04-07 11:35:27.303620,0 days 00:00:00.757318,31.8855312869209,19.976918085273997,0.4012667064535905,Au,PRUNED
4122,-1.2254901960782871,2026-04-07 11:35:26.595200,2026-04-07 11:35:27.179043,0 days 00:00:00.583843,28.046247932814815,18.913327560624275,0.4539821768740233,Cu,PRUNED
4123,-1.0,2026-04-07 11:35:26.648507,2026-04-07 11:35:27.129375,0 days 00:00:00.480868,35.59353354014144,19.854088858899384,0.46308779868637234,Au,COMPLETE
4124,-1.0,2026-04-07 11:35:26.939635,2026-04-07 11:35:27.485838,0 days 00:00:00.546203,38.26996854077254,19.98105978254786,0.24546730843458733,Au,COMPLETE
4125,-1.0,2026-04-07 11:35:27.183065,2026-04-07 11:35:27.977132,0 days 00:00:00.794067,33.71849489727523,15.836809928988258,0.38511293653729056,Au,COMPLETE
4126,-1.0,2026-04-07 11:35:27.260006,2026-04-07 11:35:27.929983,0 days 00:00:00.669977,20.131395668648672,17.799111558161798,0.5586094163114004,Cu,COMPLETE
4127,5.681818181817666,2026-04-07 11:35:27.292023,2026-04-07 11:35:28.125913,0 days 00:00:00.833890,43.38274205627098,19.88627019807909,0.6499548132338678,Ag,PRUNED
4128,0.0,2026-04-07 11:35:27.334712,2026-04-07 11:35:28.148680,0 days 00:00:00.813968,20.91828792670917,15.148111154523232,0.4947276107262708,Au,PRUNED
4129,-1.0,2026-04-07 11:35:27.378319,2026-04-07 11:35:27.962069,0 days 00:00:00.583750,21.88636769392017,17.61046818679945,0.4841345993943914,Ag,COMPLETE
4130,-1.0,2026-04-07 11:35:27.481342,2026-04-07 11:35:28.025509,0 days 00:00:00.544167,34.69140134324377,19.713260711154202,0.21659531440173896,Au,COMPLETE
4131,-1.0,2026-04-07 11:35:27.557391,2026-04-07 11:35:27.924126,0 days 00:00:00.366735,23.579309743756824,19.99464803783337,0.4849153371464235,Au,COMPLETE
4132,-1.0,2026-04-07 11:35:27.686571,2026-04-07 11:35:28.126914,0 days 00:00:00.440343,39.25813335641893,19.961609535288897,0.5601271986007271,Au,COMPLETE
4133,-286.18421052628565,2026-04-07 11:35:28.040726,2026-04-07 11:35:28.857900,0 days 00:00:00.817174,23.571175099628068,16.07030488493309,0.3976716801360237,Au,PRUNED
4134,17.20328282828257,2026-04-07 11:35:28.151362,2026-04-07 11:35:29.116727,0 days 00:00:00.965365,79.61507510807506,15.409989107871176,1.8914708488266605,Ag,PRUNED
4135,-1.0,2026-04-07 11:35:28.259205,2026-04-07 11:35:28.901344,0 days 00:00:00.642139,27.523256637668425,19.8672669031975,0.13425745235050998,Au,COMPLETE
4136,-1.0,2026-04-07 11:35:28.272868,2026-04-07 11:35:28.770097,0 days 00:00:00.497229,20.485781743405433,19.047928515147042,0.3910656972771734,Ag,COMPLETE
4137,0.0,2026-04-07 11:35:28.289570,2026-04-07 11:35:29.006882,0 days 00:00:00.717312,20.2767758319865,18.65595360674106,0.2552768050085451,Au,PRUNED
4138,0.0,2026-04-07 11:35:28.324031,2026-04-07 11:35:28.903188,0 days 00:00:00.579157,36.723370460962485,19.89639545668574,0.48276184159004265,Au,PRUNED
4139,-320.56840077067596,2026-04-07 11:35:28.369136,2026-04-07 11:35:28.956758,0 days 00:00:00.587622,23.032370246414335,17.180229560676676,0.4410148383287536,Au,COMPLETE
4140,-1.0,2026-04-07 11:35:28.379295,2026-04-07 11:35:28.817340,0 days 00:00:00.438045,20.46117585761256,15.151767057096889,0.27078116038573313,Au,COMPLETE
4141,0.0,2026-04-07 11:35:28.929856,2026-04-07 11:35:29.743746,0 days 00:00:00.813890,39.93684362368661,17.113860943299578,0.5452853426647062,Au,PRUNED
4142,0.0,2026-04-07 11:35:28.976452,2026-04-07 11:35:29.871327,0 days 00:00:00.894875,32.055080572530116,17.637817651961385,0.5696882212661976,Au,PRUNED
4143,0.0,2026-04-07 11:35:29.022715,2026-04-07 11:35:29.927951,0 days 00:00:00.905236,46.06541786020266,17.094688700338395,0.5745481787048345,Au,PRUNED
4144,-1.0,2026-04-07 11:35:29.056518,2026-04-07 11:35:29.565327,0 days 00:00:00.508809,36.75247255975914,19.862772965729583,0.4190246367693094,Au,COMPLETE
4145,0.0,2026-04-07 11:35:29.087441,2026-04-07 11:35:29.872834,0 days 00:00:00.785393,47.74791641047496,16.606297460000498,0.4529403439729844,Au,PRUNED
4146,0.0,2026-04-07 11:35:29.181237,2026-04-07 11:35:30.107789,0 days 00:00:00.926552,21.921147363681104,16.861747399393277,0.2373168761340046,Au,PRUNED
4147,-1.0,2026-04-07 11:35:29.225421,2026-04-07 11:35:30.108796,0 days 00:00:00.883375,31.302807714998636,19.96914597267193,0.5948111096375034,Au,COMPLETE
4148,-1.0,2026-04-07 11:35:29.271144,2026-04-07 11:35:29.927951,0 days 00:00:00.656807,35.54705237634708,18.71313544837749,0.39768437258492184,Au,COMPLETE
4149,-1.0,2026-04-07 11:35:29.826715,2026-04-07 11:35:30.551095,0 days 00:00:00.724380,22.715118336980968,19.879044189783922,0.11708111092399137,Au,COMPLETE
4150,-1.0,2026-04-07 11:35:29.893835,2026-04-07 11:35:30.497947,0 days 00:00:00.604112,30.13534933205427,19.575988169149625,0.3891367581115697,Au,COMPLETE
4151,-1.0,2026-04-07 11:35:30.003880,2026-04-07 11:35:30.552598,0 days 00:00:00.548718,21.156169871562735,19.702630412742863,0.5277403575031341,Au,COMPLETE
4152,-1.0,2026-04-07 11:35:30.077400,2026-04-07 11:35:30.577654,0 days 00:00:00.500254,33.026213462559355,19.725463307191205,0.31187607585014304,Au,COMPLETE
4153,-1.0,2026-04-07 11:35:30.175315,2026-04-07 11:35:30.672638,0 days 00:00:00.497323,21.899432548951822,16.836342534709722,0.3025910549099988,Au,COMPLETE
4154,-1.0,2026-04-07 11:35:30.189936,2026-04-07 11:35:30.734709,0 days 00:00:00.544773,35.463940405474816,19.767682661980043,0.45943987686773674,Au,COMPLETE
4155,0.0,2026-04-07 11:35:30.280869,2026-04-07 11:35:30.763001,0 days 00:00:00.482132,20.10249770267297,18.902877327416242,0.6384381574572885,Au,PRUNED
4156,-1.0,2026-04-07 11:35:30.397225,2026-04-07 11:35:31.174530,0 days 00:00:00.777305,23.298900551477615,19.830715456201855,0.6209717853615535,Au,COMPLETE
4157,-1.0,2026-04-07 11:35:30.644848,2026-04-07 11:35:31.246365,0 days 00:00:00.601517,20.762270778481398,16.622539490366954,0.6877500862660807,Au,COMPLETE
4158,-1.0,2026-04-07 11:35:30.733707,2026-04-07 11:35:31.324943,0 days 00:00:00.591236,100.01540573148245,2.585791909926143,1.2426682418149682,Ag,COMPLETE
4159,-1.0,2026-04-07 11:35:30.846501,2026-04-07 11:35:31.413946,0 days 00:00:00.567445,20.952322072610936,19.26866747653708,0.621571721952342,Au,COMPLETE
4160,-1.0,2026-04-07 11:35:30.859162,2026-04-07 11:35:31.367668,0 days 00:00:00.508506,31.657471042053903,16.911597060034993,0.43015267617607417,Au,COMPLETE
4161,0.0,2026-04-07 11:35:30.876546,2026-04-07 11:35:31.656761,0 days 00:00:00.780215,20.120150130533897,18.66868878245419,0.6793624782785114,Au,PRUNED
4162,0.0,2026-04-07 11:35:30.912512,2026-04-07 11:35:31.657811,0 days 00:00:00.745299,21.896673966478637,15.219165029987956,0.6009553204033684,Au,PRUNED
4163,79.32098765431864,2026-04-07 11:35:30.937984,2026-04-07 11:35:31.730483,0 days 00:00:00.792499,34.006254081848915,16.974841464571174,0.31133149492454204,Au,PRUNED
4164,-1.0,2026-04-07 11:35:31.433926,2026-04-07 11:35:32.292621,0 days 00:00:00.858695,32.07521933669664,17.298644693380798,0.6027561284409629,Au,COMPLETE
4165,80.24691358024454,2026-04-07 11:35:31.500975,2026-04-07 11:35:32.294206,0 days 00:00:00.793231,32.00881828785756,17.227783436963012,0.4313416156357685,Au,PRUNED
4166,-1.0,2026-04-07 11:35:31.541101,2026-04-07 11:35:32.225405,0 days 00:00:00.684304,37.49427878378103,17.849582271086618,0.5787923100784147,Au,COMPLETE
4167,79.6568627450957,2026-04-07 11:35:31.661656,2026-04-07 11:35:32.590050,0 days 00:00:00.928394,32.62837617573749,16.316519668538877,0.6459474035377606,Au,PRUNED
4168,0.0,2026-04-07 11:35:31.765121,2026-04-07 11:35:32.761021,0 days 00:00:00.995900,34.92322876493604,17.671935308519757,0.5638609525060924,Au,PRUNED
4169,-2.976190476190051,2026-04-07 11:35:31.733483,2026-04-07 11:35:32.525872,0 days 00:00:00.792389,23.076295255633504,19.73045087872525,0.4426548073084021,Au,PRUNED
4170,-1.0,2026-04-07 11:35:31.830249,2026-04-07 11:35:32.527460,0 days 00:00:00.697211,40.26810581331179,10.812192486302797,0.8665156766969244,Ag,COMPLETE
4171,-1.0,2026-04-07 11:35:31.793850,2026-04-07 11:35:32.259430,0 days 00:00:00.465580,20.184035563017012,19.74449077442341,0.39759933373331796,Au,COMPLETE
4172,-1.0,2026-04-07 11:35:32.291556,2026-04-07 11:35:33.029029,0 days 00:00:00.737473,20.704456047323255,15.914004211721073,0.5116366715921704,Au,COMPLETE
4173,0.0,2026-04-07 11:35:32.443760,2026-04-07 11:35:33.204592,0 days 00:00:00.760832,20.725850071293344,19.040437388434217,0.4494609288843946,Au,PRUNED
4174,-1.0,2026-04-07 11:35:32.565246,2026-04-07 11:35:33.112282,0 days 00:00:00.547036,30.702226334308506,19.87342113383276,0.4543114197030011,Ag,COMPLETE
4175,-1.0,2026-04-07 11:35:32.608964,2026-04-07 11:35:33.063610,0 days 00:00:00.454646,105.41957334092567,13.419303397035312,1.9652021410285259,Cu,COMPLETE
4176,-1.4880952380950254,2026-04-07 11:35:32.646690,2026-04-07 11:35:33.140928,0 days 00:00:00.494238,23.442634906906946,19.628396784265963,0.3854009311178671,Au,PRUNED
4177,-1.0,2026-04-07 11:35:32.671449,2026-04-07 11:35:33.297038,0 days 00:00:00.625589,21.49826953234265,19.564055480778556,0.27055748367587085,Au,COMPLETE
4178,-1.0,2026-04-07 11:35:32.799492,2026-04-07 11:35:33.378655,0 days 00:00:00.579163,20.537037328530204,19.822139889985174,0.49878589967644804,Au,COMPLETE
4179,-17.992424242422604,2026-04-07 11:35:32.841557,2026-04-07 11:35:33.527340,0 days 00:00:00.685783,36.03781422379495,17.340971491400865,0.5994380651968508,Ag,PRUNED
4180,-389.3678160918998,2026-04-07 11:35:33.170559,2026-04-07 11:35:33.888900,0 days 00:00:00.718341,21.14695413252462,19.412491626305485,0.5547178886284118,Au,COMPLETE
4181,0.0,2026-04-07 11:35:33.230172,2026-04-07 11:35:34.158104,0 days 00:00:00.927932,20.06153587740823,18.743841742172044,0.24577222798883047,Au,PRUNED
4182,-1.0,2026-04-07 11:35:33.296016,2026-04-07 11:35:33.992384,0 days 00:00:00.696368,30.811831185098185,19.964182457064194,0.7337005051194488,Au,COMPLETE
4183,0.0,2026-04-07 11:35:33.333315,2026-04-07 11:35:34.093518,0 days 00:00:00.760203,20.060471664477745,16.652163134297602,0.7116633270011944,Au,PRUNED
4184,-1.0,2026-04-07 11:35:33.345754,2026-04-07 11:35:33.874921,0 days 00:00:00.529167,21.04792484141416,19.823006960243205,0.5940321543553049,Au,COMPLETE
4185,0.0,2026-04-07 11:35:33.443044,2026-04-07 11:35:34.056694,0 days 00:00:00.613650,21.166994406826472,16.83092308888673,0.6048096331900327,Au,PRUNED
4186,0.0,2026-04-07 11:35:33.592403,2026-04-07 11:35:34.158104,0 days 00:00:00.565701,46.35190484230594,19.549593529518933,0.6276956977771398,Au,PRUNED
4187,-6.372549019607543,2026-04-07 11:35:33.648533,2026-04-07 11:35:34.706315,0 days 00:00:01.057782,90.07777778072509,10.312477802700178,0.8180894002059944,Ag,PRUNED
4188,0.0,2026-04-07 11:35:34.059022,2026-04-07 11:35:35.062700,0 days 00:00:01.003678,28.362760221633938,19.802151793342816,0.4673331135046448,Au,PRUNED
4189,0.0,2026-04-07 11:35:34.200553,2026-04-07 11:35:34.992357,0 days 00:00:00.791804,20.45899785149869,18.79301826724301,0.4302631108029025,Au,PRUNED
4190,0.0,2026-04-07 11:35:34.220512,2026-04-07 11:35:35.080675,0 days 00:00:00.860163,20.048374454731054,19.349074330746713,0.293843879645323,Au,PRUNED
4191,0.0,2026-04-07 11:35:34.243162,2026-04-07 11:35:35.245144,0 days 00:00:01.001982,20.61659003543532,16.9960368298228,0.5675641563562064,Au,PRUNED
4192,-1.0,2026-04-07 11:35:34.270472,2026-04-07 11:35:34.924290,0 days 00:00:00.653818,20.33962278923278,17.8929258891477,0.503821067122333,Au,COMPLETE
4193,-1.0,2026-04-07 11:35:34.284997,2026-04-07 11:35:34.807845,0 days 00:00:00.522848,33.2067201774085,17.45198951006273,0.49744622745900113,Au,COMPLETE
4194,-1.0,2026-04-07 11:35:34.299695,2026-04-07 11:35:34.956960,0 days 00:00:00.657265,31.676395799984583,19.83142712942839,0.17645395493021088,Au,COMPLETE
4195,-1.0,2026-04-07 11:35:34.846125,2026-04-07 11:35:35.563440,0 days 00:00:00.717315,33.92608784471414,13.08360503030135,0.46629846982039524,Au,COMPLETE
4196,-1.0,2026-04-07 11:35:35.116458,2026-04-07 11:35:35.680571,0 days 00:00:00.564113,35.63560296391984,19.966077434434713,0.5603671238903084,Au,COMPLETE
4197,81.17283950617043,2026-04-07 11:35:35.131819,2026-04-07 11:35:35.960252,0 days 00:00:00.828433,30.197488282724954,17.29444718292928,0.6418268224105965,Au,PRUNED
